tags,sub_header,text_body,quote_href
"['History', 'PunditFact', 'George Will']","
George Will describes Bernie Sanders' Soviet Union honeymoon
","For most couples, the ideal honeymoon getaway might entail a week of unwinding at a beach resort or a stay in a secluded mountainside cabin. Not Bernie Sanders. He chose a colder route. Sanders and his wife, Jane Sanders, spent their first days as newlyweds in the Soviet Union, claims George Will in a recent Washington Post column. Will’s Aug. 7 column focused mostly on the legacy of Robert Conquest, who died Aug. 3 at age 98, and whose writings on Soviet prisons documented the atrocities of the Stalin regime. A reader asked us to look into the accuracy of the final paragraph of Will’s column, which invoked Sanders’ ""honeymoon."" It reads: ""Conquest lived to see a current U.S. presidential candidate, a senator, who had chosen, surely as an ideological gesture, to spend his honeymoon in the Soviet Union in 1988. Gulags still functioned, probably including some of the ‘cold Auschwitzes’ in Siberia, described in Conquest’s ‘Kolyma.’ The honeymooner did not mind that in 1988 political prisoners were — as may still be the case — being tortured in psychiatric ‘hospitals.’ Thanks to the unblinking honesty of people like Conquest, the Soviet Union now is such a receding memory that Bernie Sanders’s moral obtuseness — the obverse of Conquest’s character — is considered an amusing eccentricity."" We wanted to see if Sanders actually honeymooned on the turf of the United States’ former adversary during the final years of the Cold War. Sister cities The trip took place while Sanders was mayor of Burlington, Vt., from 1981 to 1989. Toward the end of his mayoral tenure, the small city on Lake Champlain launched a sister-city program with Yaroslavl, located 160 miles northeast of Moscow. The program, which is still operating today, has facilitated exchanges between the two cities involving ""mayors, business people, firefighters, jazz musicians, youth orchestras, mural painters, high school students, medical students, nurses, librarians and the (Yaroslavl) ice-hockey team,"" according to its website. Along with sister-city relationships with Bethlehem in the West Bank and Puerto Cabezas, Nicaragua, the Yaroslavl program was part of Sanders’ unorthodox attempt to take on international issues from a small city in New England. Sanders also actively pursued his agenda outside of the country, writing letters to world leaders and even traveling to Cuba to meet with the mayor of Havana. ""Burlington had a foreign policy,"" he wrote in his 1997 book Outsider in the House, ""because, as progressives, we understood that we all live in one world."" The bond between Burlington and Yaroslavl solidified when Sanders and his wife, as members of a 12-person delegation from Burlington, paid their Soviet counterparts a visit in 1988. The timing of the trip was unusual. Bernie and Jane were married May 28, 1988. The delegation left Burlington the next day. ""Trust me,"" Sanders writes in the book. ""It was a very strange honeymoon."" When reached for comment, Sanders’ campaign said that the dates for the trip had already been set, and the couple ""set their wedding date to coincide with that trip because they didn't want to take more time off."" In a 2007 interview, Jane Sanders also recalled the peculiar timing: ""The day after we got married, we marched in a Memorial Day parade, and then we took off in a plane to start the sister city project with Yaroslavl with 10 other people on my honeymoon."" Bernie Sanders also refers to the trip sarcastically as ""quiet and romantic"" in his book. The ""honeymoon"" was dotted with meetings, interviews and diplomatic functions. A June 2015 profile in The Guardian described the former mayor’s meeting with Yaroslavl city officials: ""After receiving a rundown of central planning, Soviet-style, from Yaroslavl’s mayor, Alexander Riabkov, Sanders notes how the quality of both housing and health care in America appeared to be ‘significantly better’ than in the communist state. ‘However,’ he added, ‘the cost of both services is much, much, higher in the United States.’ "" An education in central planning probably wasn’t the only item on Sanders’ itinerary. Yaroslavl is home to historic churches and buildings, and the Sanderses would have been in for some good sightseeing, said Ariel Cohen, a senior fellow at the Atlantic Council. Will made it sound as if Sanders was visiting to condone Soviet torture practices, but the Burlington trip was more of a dialogue-building exchange program. The Vermont weekly newspaper Seven Days reported in 2009 that the sister-city relationship ""helped local residents who sought to ease tensions between the United States and Soviet Union by initiating citizen-to-citizen exchanges with a Russian city.""  Also, the Soviet Union was barely intact at the time of the trip.  Negotiations had opened up between President Ronald Reagan and Soviet leader Mikhail Gorbachev a few years earlier. ""It was at the beginning of perestroika,"" said Michael Briggs, a spokesman for the Sanders campaign, referring to the restructuring policy Gorbachev instituted in the mid 1980s. Gulags still existed and political prisoners were still held in 1988, said Ariel Cohen, a senior fellow at the Atlantic Council. But a watershed moment came when Gorbachev allowed physicist Andrei Sakharov to return from internal exile two years earlier. ""The power of the Communist Party was being questioned and the confrontation with the West was winding down through negotiations,"" Cohen said. In 1987, Reagan and Gorbachev signed the Intermediate-Range Nuclear Forces Treaty, and in 1988, Reagan himself spoke in Moscow’s Red Square. One year later brought the fall of the Berlin Wall. Three years later, the Soviet Union collapsed. Participation in the Burlington-Yaroslavl program has waned over the years, though it was viewed as a ""glamorous endeavor"" by many in Burlington at the time, program leader Howard Seaver said in 2009. Will could not be reached for comment through his researcher. Our ruling Will wrote that Sanders chose ""to spend his honeymoon in the Soviet Union in 1988."" Sanders and his wife did travel to Yaroslavl, a city in the Soviet Union, after their wedding in 1988. In the sense that the trip came after the couple were married, the trip was a honeymoon. The two have also referred to the trip that way, albeit sarcastically at times. But it was an unusual honeymoon, to say the least. The trip’s primary purpose was diplomacy, not leisure, and included about 10 extra guests. Will’s claim is accurate but is missing context about the trip’s underlying purpose. We rate his claim Mostly True.",/factchecks/2015/aug/12/george-will/george-will-reminds-readers-about-bernie-sanders-u/
"['Georgia', 'Legal Issues', 'LGBTQ', 'Marriage', 'Religion', 'Supreme Court', 'David Ralston']","
Ralston misfires with comment about debate over faith leaders, ruling
","Georgia House Speaker David Ralston, R-Blue Ridge, says June’s 5-4 Supreme Court ruling legalizing same-sex marriages is motivating him to pursue passage next year of a ""pastor protection"" bill. A working version of the bill reads: ""No minister of the gospel or cleric or religious practitioner ordained or authorized to solemnize marriages according to the usages of the denomination, when acting in his or her official religious capacity, shall be required to solemnize any marriage in violation of his or her right to free exercise of religion."" It was drawn up shortly after the U.S. Supreme Court ruled June 26 in Obergefell v. Hodges that the U.S. Constitution guarantees a right to same-sex marriage. The decision has been met with resistance in some states. ""In Georgia, we're going to come down clearly on the side of the separation of church and state, and as long as you have constitutional scholars debating among themselves whether this is covered, then I think we need to remove all uncertainty and all doubt."" Ralston said in an interview with The Atlanta Journal-Constitution on July 13, two days after he announced plans for his ""pastor protection"" bill. Ralston said his efforts are not connected to the ""religious liberty"" bills that have been at the center of some of the fiercest debates at the Capitol since 2014. Supporters see the ""religious liberty"" legislation as an extra layer of protection against government intrusion on religious beliefs, while critics say it would enable businesses to discriminate against gay customers. But what of the speaker’s claim of a debate among constitutional scholars? PolitiFact decided to dig deeper. First, a little background. Ralston was meeting with House Republicans on Jekyll Island in July when he first disclosed his plans to introduce a ""pastor protection"" bill in the 2016 General Assembly session. Several states have passed or are considering nearly identical bills, and two of these bills just became law in Texas and Oklahoma . Ralston says that in his House district in North Georgia, ""there’s a lot of unease in the faith community over the reach and ramifications"" of the Supreme Court’s decision. ""What we are trying to do is dispel the unease, dispel the uncertainty and replace it with clarity,"" he told a radio reporter last month. What do scholars say? As soon as Ralston announced plans for the bill, some began to question: Was it necessary? Anthony Michael Kreis, a constitutional scholar at the University of Georgia, said nothing in the gay marriage ruling affects the religious freedom protections provided faith leaders under the First Amendment to the U.S. Constitution. They still have the right to refuse to perform any marriage ceremony, Kreis said. Based on Ralston’s statement, suggesting a debate among constitutional scholars, we went in search of other opinions. We contacted constitutional law scholars in Georgia and across the country, including George Washington University law professor Ira C. Lupu and Georgia State University constitutional law professor Eric J. Segall. All said the Free Exercise Clause of the First Amendment prevents any minister, priest, rabbi or any other cleric from having to perform any religious ceremony - wedding or otherwise - against his or her faith. ""Many, for example, will not perform interfaith weddings,"" said Erwin Chemerinsky, a constitutional law expert and founding dean and distinguished professor of law at the University of California. The U.S. Supreme Court ""has never said otherwise,"" Segall said. ""And nothing in the same-sex marriage decision is to the contrary,"" he said. PolitiFact talked by telephone with Ralston, a lawyer by profession, and asked, ""Do you believe they (faith  leaders) are protected under the First Amendment?"" ""Arguably they are,"" the speaker said. He voiced concern that, with a U.S. Supreme Court that evolves, this could one day be an issue litigated in federal court. He also repeated his stance that, within the faith community, ""there’s certainly uncertainty and unease."" But, he acknowledged, ""I don’t think it is the reality."" He went to say: ""We also have to deal with the perception."" In a recent op-ed piece, Ralston wrote that ""the Pastor's Protection Act will make absolutely clear our state government does not view clergy as state actors."" Lupu, a nationally recognized scholar in constitutional law, said a civil marriage, based on its definition, ""is not a matter that has historically been the domain of religious leaders -- certainly not the exclusive domain."" ""Think about divorce laws and how far they depart from Catholic or Orthodox Jewish teaching,"" he said. Lauren Sudeall Lucas, a constitutional law expert and Georgia State University law professor, said the high court in Obergefell v. Hodges was careful to emphasize that it is ""the state"" that cannot refuse to recognize same-sex marriages. Lupu said he knows of no constitutional scholar who believes that the state can dictate to a pastor regarding who qualifies for religious marriage. ""So if Ralston says the Pastor Protection Act is legally necessary and adds something to the substance of the law, then he is speaking falsely,"" Lupu said. ""If he says ‘I know it's not necessary, but it will provide reassurance to some,‘ that cannot be a falsehood, because it will indeed do that."" Our ruling Georgia House Speaker David Ralston has announced he will propose a pastor protection bill, spelling out that faith leaders in the state have the right to refuse to perform any marriage ceremony that goes against their religious convictions. ""In Georgia, we're going to come down clearly on the side of the separation of church and state, and as long as you have constitutional scholars debating among themselves whether this is covered, then I think we need to remove all uncertainty and all doubt,"" Ralston said in an interview two days after announcing plans for the bill. We don’t claim to have reached every constitutional scholar. But we could find no evidence that there are any constitutional scholars who believe the ruling diminishes the First Amendment protections of religious freedom or forces religious leaders to marry people against their personal religious beliefs. Ralston, himself, acknowledges that. But he says there’s unease in the community and a ""perception"" to contend with. That’s a different argument for the bill. We rate his statement Mostly False.",/factchecks/2015/aug/12/david-ralston/ralston-misfires-comment-about-debate-over-faith-l/
"['Candidate Biography', 'Terrorism', 'PunditFact', 'Andrew Napolitano']","
Did Hillary Clinton emails reveal location of ambassador killed in Benghazi attack?
","Of course Hillary Clinton’s emails contained classified information, says Fox News legal analyst Andrew Napolitano. That’s obvious, in his view, from the sensitive content of the emails that have been released. The FBI is now investigating the security of the private email system Clinton used while secretary of state, which was not designed to handle classified information. Clinton has said she never dealt with classified information on her private server, though two government watchdog groups have said she did. Even the emails that have now been made public contain sensitive information -— including information about Benghazi, said Napolitano, a former judge, in an Aug. 5 conversation with Fox News host Sean Hannity. ""I saw emails that have been revealed under the Freedom of Information Act,"" Napolitano said. ""And in them, she is discussing the location of French fighter jets during the NATO bombardment of Libya, how big the no-fly zone is, where the no-fly zones are, and are you ready for this? — the location of Ambassador Stevens, who of course was murdered, in Libya. If that is not classified — if she didn’t know that was classified, she has no business being in public office."" Former U.S. Ambassador to Libya Christopher Stevens was killed in the 2012 attack on a diplomatic compound in Benghazi. Do emails contained on Clinton’s private server really discuss information about his location in Libya? As we'll see, Clinton's emails discuss Stevens' location in general terms — similar to information shared in the media at the time. Key emails We found six possibly relevant emails in the cache of Clinton emails that the State Department has released to the public so far. These emails all take place in a one-month period in 2011 during the Libyan Civil War, about a year and a half before the September 2012 Benghazi attack. At the time, Stevens was not yet the ambassador — he was the special envoy to the Transitional National Council (called the TNC), then the de facto government of Libya — and he was embarking on his first trip to Libya in this role. He became ambassador in May 2012, about four months before his death. We’ll lay out the key points in each email that speak to Stevens’ whereabouts, and then get into the analysis. March 23, 2011: In this email, which Napolitano pointed out to us, Clinton’s then-chief of staff Jacob Sullivan wrote to Clinton about the NATO mission in Libya. Sullivan also wrote that someone named Bill was ""trying to make sure Chris Stevens gets into E. Libya."" March 27, 2011: This is an email between two State Department officials that was then forwarded to Clinton. The subject line is: ""Chris Stevens mission."" Regarding his location and travel plans, the email said, ""The current game plan is for Mr. Stevens to move no later than Wednesday from Malta to Benghazi. He will stage off shore initially for a one day visit during which he will have meetings with TNC interlocutors and get a sense of the situation on the ground. The goal of this one day trip is for him to lay the groundwork for a stay of up to 30 days."" April 8, 2011: An email among State Department employees (marked ""sensitive but unclassified"") that was later forwarded to Clinton said, ""Security situation in Benghazi remains quiet. Chris Stevens & team are in the hotel, moving only for meetings as required."" April 10, 2011: Another email among State Department employees later forwarded to Clinton marked ""sensitive but unclassified"" said, ""The situation in Ajdabiyah has worsened to the point where Stevens is considering departure from Benghazi. The envoy's delegation is currently doing a phased checkout (paying the hotel bills, moving some comms to the boat, etc)."" April 22, 2011: Yet another email among State Department employees, this one marked ""unclassified,"" that was later forwarded to Clinton, ""I want to let you know about a temporary rotation in Benghazi. TNC Envoy Chris Stevens has been on the road since March 13, when he began his outreach mission, and has been in Benghazi since April 5."" April 24, 2011: A final email among State Department employees later forwarded to Clinton: ""Stevens will be meeting with MFA in one hour and will make a written request for better security at the hotel and for better security-related coordination. He still feels comfortable in the hotel. They are looking into the idea of moving into a villa, but that is some way off."" After this email, few of the emails released so far discuss Stevens in any capacity until after the 2012 attacks. Clinton only participated in the March 23 email conversation, and she did not say anything about Stevens’ location; in the other emails, she only received the messages. In any case, the information ended up on her private email server. What do the emails tell us? These emails do discuss Stevens’ location, though the terms are vague. We learn from the emails that Stevens was in Malta then Benghazi, where he met with local leaders at unspecified locations, and he stayed at an unnamed hotel. That’s about it. Napolitano’s statement suggests that if a bad guy had gotten his hands on these emails, Stevens could have been in danger because the bad guys would know exactly where to find him. In reality, these emails don’t reveal much more than what was publicly known at the time. On March 25, 2011, Stevens’ predecessor, Ambassador Gene Cretz, said in a press conference that Stevens would soon be traveling to Benghazi. We found at least four State Department daily press briefings between March and April 2011, where a press secretary discussed Stevens’ Benghazi plans with journalists. Quite a few newspaper and television reports at the time said Stevens was in Benghazi meeting with local leaders, such as the New York Times and Fox News. The media reports did not mention that Stevens went into Libya by way of Malta, and that he had set up shop at a hotel. There is, however, an April 11, 2011, Associated Press photo of Stevens meeting with local journalists at the Tibesty hotel in Benghazi, where we now know (as a result of State Department and congressional Benghazi investigations) Stevens had lived and worked in 2011. Now to address the broader point of Napolitano’s statement: that Clinton sent and received classified information. Three of the six emails detailed above were marked ""unclassified."" Regarding the other three, Clinton received information from other State Department employees, and — as we found in a prior story — as head of the agency, she had the authority to say whether information from her department was classified or not. Of course, there’s always the possibility of Clinton emails clearly containing classified or sensitive information about Stevens that have yet to be or never will be released. But Napolitano specified that he was talking about emails already available to the public. Our ruling Napolitano said emails released to the public show Clinton discussed ""the location of Ambassador Stevens, who of course was murdered, in Libya."" To clarify, Stevens was not the ambassador to Libya at the time, and the emails occurred about 18 months before the Benghazi attacks that killed him. Clinton received at least six emails that discussed Stevens’ location in Libya, though the terms are vague -- for example, saying he was in Benghazi at an unidentified hotel. The context of Napolitano’s statement gives the impression that the emails contain information that would have been damaging if released, but it was widely noted in the media at the time that Stevens was in Benghazi, and on at least one occasion, reporters encountered him at the hotel where he was living and working. The statement is partially accurate but leaves out important details and context, so we rate it Half True.",/factchecks/2015/aug/11/andrew-napolitano/did-hillary-clinton-emails-reveal-location-ambassa/
