tags,sub_header,text_body,quote_href
"['National', 'Legal Issues', 'Planned Parenthood']","
Ad distorts McCain's record on Violence Against Women Act
","
A new ad from Planned Parenthood makes two charges against Sarah Palin and John McCain. It says Wasilla, Alaska, charged rape victims for forensic exams when Palin was mayor and that, as a senator, McCain ""voted to let governments charge rape victims"" for forensic exam kits.
 
We've examined the controversy over the Wasilla rape kit policy

in this previous article,

so here we'll examine the charge that McCain voted to let governments charge the victims.
 
The ad begins with a rape victim named Gretchen who says, ""I just didn’t think it would happen to me. I was drugged and raped.""
 
The announcer says, ""Under Mayor Sarah Palin, women like Gretchen were forced to pay up to $1,200 for the emergency exams used to prosecute their attackers."" The screen says ""Charged rape victims for exams - Source: CNN, September 22, 2008.""  (We reported earlier that

Gretchen is from Illinois, not Alaska

, and was not subject to the Wasilla policy.)
 
The announcer continues: ""In the Senate, John McCain voted against legislation to protect women from these same heartless policies"" while the screen says, ""Voted to let governments charge rape victims.""
 
Gretchen then says, ""That is something to me that’s unthinkable. It scares me to death.""
 
The screen attributes the McCain allegation to a vote on Aug. 25, 1994, on a crime bill that included the Violence Against Women Act, which itself included a provision that required states to provide free forensic exams for rape victims.
 
Planned Parenthood's logic: Because McCain opposed that bill, he voted to let governments charge victims for their rape kits.
 
That's quite a stretch.
 
Indeed, McCain voted that day against a conference report on the crime bill, but he opposed it not because of the Violence Against Women provisions, but because it included extra spending that McCain considered unrelated to crime and it had a provision that would have banned so-called assault weapons.
 
Nine months earlier, McCain had supported the original bill, which included the Violence Against Women Act, when it passed the Senate 95-4. So that alone is a significant contradiction of Planned Parenthood's claim.
 
Also, McCain has supported the Violence Against Women Act when it has come up for reauthorization.
 
In 2000, McCain joined a unanimous vote on a crime bill that included the Violence Against Women Act.
 
In 2005, he praised the law when he introduced a companion bill to provide protections for Indian women. ""The 1994 Violence Against Women Act has had a tremendous impact on raising the national awareness of domestic violence and providing communities, including Indian tribes, the resources to respond to the devastating impact of domestic violence,"" he said.
 
When we asked Planned Parenthood if it had any other evidence to bolster its claim, spokesman Tait Sye scrounged up a few more: a vote against a 2008 justice spending bill that included all justice programs (McCain opposed it because it had too many earmarks), and a couple of other votes that are not directly related to the rape provision of the Violence Against Women Act.
 
That's the best they got?
 
That's the classic kind of cherry-picking we've seen in campaign ads and it is flimsy evidence for the serious charge that McCain opposed the program, especially in light of his clear support at other times.
 
Planned Parenthood has virtually nothing to back up its charge that McCain voted to let states charge for rape exams. Sure, McCain voted against a larger crime bill in 1994, but that vote was about assault weapons and spending, not the Violence Against Women Act. And McCain has supported the law before then — and twice since.
 
Planned Parenthood's claim isn't just False, it's ridiculously so, which merits a Pants on Fire.
",/factchecks/2008/oct/01/planned-parenthood/ad-distorts-mccains-record-on-violence-against-wom/
"['Health Care', 'Florida', 'Marco Rubio']","
Marco Rubio says $800 billion in taxes in health care law do not ""discriminate between rich and poor""
","
It’s not news that Republicans predict the health care overhaul will spell devastation for business. But Sen. Marco Rubio, R-Fla., is taking it further. He warns the law will ""hurt everyone.""

""Obamacare is bad policy that adds around $800 billion of taxes on the American people,"" he wrote in a July 8 opinion-editorial in the Orlando Sentinel. ""It does not discriminate between rich and poor. It hurts everyone.""

We wondered where he got his $800 billion tax total, as well as the validity of the idea that the law does not ""discriminate between rich and poor."" So we decided to check it out.

$800 billion in new taxes?

Rubio pulled the figure from a 2011 report by the nonpartisan Congressional Research Office and Joint Committee on Taxation. It was commissioned by Republican House Speaker John Boehner to estimate the cost of repealing the health care law.

Repealing the law would result in $813 billion in lost revenues for the government between 2012 and 2021, the report found.

Where do those come from? To pay for the overhaul, the federal government created a series of  new revenue sources -- some are clearly taxes, some are changes to tax rules -- that include the controversial tax penalty for people who do not have their own health insurance and a tax on indoor tanning. (We looked at more than a dozen revenue sources and whether they were actually taxes in a January PolitiFact report.)

Whether each revenue source is technically a tax does not matter to Rubio. Here, he equates all money raised from Americans as a tax.

Also, Rubio’s number doesn’t account for the tax breaks that are in the law, especially the tax credits that some people of modest means will receive to help them buy insurance.

We consulted several experts, who disagreed on the best way to account for the law’s tax increases.

A couple experts said Rubio’s $800 billion figure is valid, even if it is out of date and does not account for billions in tax credits.

""It's just stating what the tax bill is,"" said Joseph Henchman, of the business-backed Tax Policy Foundation. ""Most people don't expect you to net out benefits.""

Not so fast, said Chapin White, a former CBO staffer who is now a senior health researcher at the Center for Studying Health System Change, a health research group founded by the Robert Wood Johnson Foundation. White said it’s important to subtract the law’s $519 billion in refundable tax credits and subsidies for health insurance, among other things.

All told, the more appropriate net ""tax increase"" over 10 years is about $20 billion, he said.

No difference between rich and poor?

Rubio spokesman Alex Conant declined to elaborate on what Rubio meant when he said the law does not ""discriminate between rich and poor,"" saying he did not want to parse his words.

The best we can infer from Rubio’s claim and the context around it is the health care law affects the rich and the poor the same, tax-wise.

And that’s off base.

The point of the law was to expand health coverage to those who don’t have it -- including people who don't have jobs or have low income. To make that happen, the law provides tax credits to low- and moderate-income families, and it includes more taxes on the wealthy and an individual mandate requiring most Americans to obtain health insurance.

Two of the biggest taxes in the law are geared toward taxpayers with higher incomes. People whose incomes exceed $200,000 ($250,000 for couples filing jointly) will pay 0.9 percentage point more on Medicare payroll taxes in 2013. These people would also pay a new 3.8 percent tax on investment income.  

Plus, the law includes a 40 percent excise tax on people who have high-premium health insurance plans starting in 2018. Also known as ""Cadillac plans,"" these premiums are usually obtained by people in the middle- to upper- class, and are expected to bring in $111 billion through 2021.

Democrats, of course, take a different view than the Republicans. The Democrat-controlled U.S. Senate Finance Committee released a compilation of tax breaks available to individuals, middle-class families, and small businesses, thanks to the law. The total? $828 billion in ""tax cuts"" over 10 years.

Most of that comes from tax credits and subsidies for families with low- to moderate-level incomes. The law creates exchanges through which consumers can shop for the best plans. People who qualify can supplement the cost of an insurance plan with a government subsidy, which will be based on income.

A break is also extended to certain small businesses with low-income workers who employ fewer than 50 people and offer health insurance to them.

Now for the individual mandate, which requires most everyone to have health insurance in 2014 or pay a penalty to the Internal Revenue Service.

You could argue it doesn’t discriminate between rich and poor because it applies to most everyone. But the penalty is linked to income.

Individuals who go uninsured and who aren't exempt from the mandate will have to pay an annual penalty of at least $95 per adult in 2014, rising to $325 in 2015 and $695 in 2016. After 2016, the amount would be indexed to inflation and could be higher -- 2.5 percent of household income, if that’s greater than the amount written into the law.

The nonpartisan federal researchers at CBO and JCT have estimated that about 4 million uninsured Americans, including dependents, will have to pay up in 2016, amounting to $4 billion in revenue per year from 2017 to 2019.

Probably most relevant to our fact-check is the fact that the mandate includes a hardship exemption for people who cannot afford to buy health insurance.

Our ruling

Rubio cherry-picks the highest number he can find -- $800 billion in new taxes -- to garner opposition to the recently upheld health care law. He doesn’t tell readers anything more about the figure, including the fact that these ""taxes"" would be garnered over 10 years.

His statement also indicates that rich and poor people will feel the effects of the law’s various revenue-raising provisions with the same degree of pain. But that’s not true. The law taxes wealthier Americans to a greater degree to provide more services for the poor.

We rate this False.",/factchecks/2012/jul/16/marco-rubio/rubio-says-taxes-health-care-law-do-not-discrimina/
"['Abortion', 'New Hampshire', 'Education', 'Health Care', 'New Hampshire Democratic Party']","
NH Democrats heap blame on Speaker Bill O'Brien and his Tea Party followers
","Apparently, Siri may not have all the answers.

In a Web advertisement mimicking ads for Apple’s new Siri digital assistant, the New Hampshire Democratic Party takes aim at House Speaker William O’Brien and his ""Tea Party legislature.""

""Bill O'Brien's Tea Party legislature tried to repeal kindergarten and compulsory education,"" the assistant tells the unnamed voter in the ad, ""College vs. Smokes.""

They tried to ""defund Planned Parenthood and eliminate insurance coverage for birth control. …  On November 6, we must vote this radical Tea Party majority out of office.""

Siri may know a lot of things, but does it know the ins and outs of the New Hampshire legislature? We decided to check the tape.

To get to the answer, we broke the claim down to four parts: the kindergarten charge, compulsory education, Planned Parenthood and insurance coverage for birth control. In its ad, the Democratic party points to specific pieces of legislation for each claim, so it wasn’t hard to connect the dots.

1)  Repeal kindergarten

To support its kindergarten claim, the Democrats point to H.B. 631, considered during the 2011 legislative session. As the ad claims, the bill, sponsored by state Rep. Jonathan Maltz, R-Hudson, did in fact propose to repeal the state mandate requiring school districts to provide kindergarten programs. It reads, ""This bill repeals the requirement that all school districts offer public kindergarten, and exempts those school districts that implemented a public kindergarten program … from the kindergarten construction grant repayment penalty.""

But, what the ad fails to mention is the bill failed to gain much traction in the House, either among Democrats or from O’Brien’s Republican majority.

Members of the House Education committee, made up of 13 Republicans and four Democrats, recommended killing the bill with a 12-3 vote, and once it reached the House floor Feb. 23, 2011, representatives voted 213-134 to shoot it down, including 126 of 260 Republicans who voted against the bill.

""This bill was introduced because of the questionable constitutional mandate of a couple of years ago. However, since every school district now has kindergarten, this bill would be superfluous,"" state Rep. Ralph Boehm, vice-chairman of the education committee, wrote in the committee’s recommendation.

We rate this part of the claim Mostly False.


2)  Repeal compulsory education

By the time it reached the House floor, the compulsory education bill didn’t do much to address compulsory education.

In its original form, H.B. 542 included provisions proposing to repeal attendance requirements in public schools. But, that proposal drew heavy criticism and the House Education committee amended the bill to focus on objectionable material in the classroom.

The amended bill, which allows parents to object to any course material and request alternative curriculum, passed the committee by a 12-6 vote and was eventually approved by the full House 197-148.

Gov. John Lynch vetoed the amended bill, but both the House and the Senate voted to override the Governor’s veto, and it became law Jan. 4, 2012.

As it stands now, the law makes no mention of compulsory education or attendance requirements. Legislators have promised to pursue the compulsory education matter in a separate, free standing bill.

So at this point, there is little evidence to back up the Democrats' claim. We rate this portion False.

3)  Defund Planned Parenthood

The Planned Parenthood part of the claim may be closer to the truth.

With H.B. 228, House Republicans voted in January to ban the use of taxpayer dollars to fund Planned Parenthood or other abortion providers.

The bill, sponsored by Robert Willette, R-Milford, initially earned a tough reception from the Health, Human Services and Elderly Affairs committee, which recommended killing the bill in a 12-5 vote. But, after then-Majority Leader D.J. Bettencourt asked his colleagues to delay a vote, O’Brien, the House Speaker, worked to shape an amendment that made the bill more palatable to House lawmakers.

On Jan. 18, 2012, the House approved the amendment, which proposed to allow hospitals to use public dollars to fund emergency abortions, and the full House reversed the committee’s recommendation and passed the bill by a 207-147 vote.

Two months later, the state Senate voted to lay the matter on the table, letting it die a polite death.

Still, the House Republicans voted in favor of de-funding Planned Parenthood, so this portion earns a True.


4)  Eliminate insurance coverage for birth control

Lastly, we get to the issue of insurance coverage for birth control.

H.B. 1546, the bill referenced in the ad, didn’t start as a birth control proposal. Initially, it intended to re-codify laws relating to religious groups, including membership, donation and corporate powers. But, after O’Brien and several other House Republicans reworked it, the bill provided an exemption for groups with religious objections from providing insurance coverage for birth control and contraception.

The amendment, which passed the House Constitutional Review and Statutory Recodification committee by a 10-6 vote, added language to the bill saying ""No employer shall be required to include in its coverage for its employees the provisions of this section if the employer has a religious objection.""

The amended bill then passed the full House in a 196-150 vote, led by the Republican leadership team.

""No religious intuition or employer should be forced to pay for services they find morally objectionable, and with this bill we will have paved the way on the state level,"" Bettencourt, the House Majority Leader, said at the time in a written statement.

The following month, the state Senate referred the bill to interim study, leading to its eventual death.

But, even if it had passed into law, the bill would not, as the Democratic Party suggests, eliminated insurance coverage for birth control. Instead, it would have allowed employers with religious objections to decline to include birth control under its health insurance plans.

That's a big difference from eliminating coverage for birth control, as the ad claimed. This portion gets a Mostly False.

Our ruling:

The state Democratic Party included many claims in this 110-second ad, and one of them is on track. Of the four included in this statement, the ad is spot on about O’Brien and the Republican Majority’s push to defund Planned Parenthood. But, the ad is off the mark in other areas. The proposal to repeal the kindergarten mandate got little support from either party and was ushered to a quick death; the push to do away with compulsory education was removed from the associated bill before it reached the House floor; and, finally, with the birth control bill, House Republicans sought to allow some employers to decline to include birth control in their insurance coverage, not to eliminate coverage entirely.

Of these charges, the Democratic Party is shooting 1-4. We rate the claim Mostly False.",/factchecks/2012/jul/16/new-hampshire-democratic-party/nh-democrats-heap-blame-speaker-bill-obrien-and-hi/
"['Campaign Finance', 'Wisconsin', 'Democratic Congressional Campaign Committee']","
Democratic Congressional Campaign Committee says prostitution money is helping fund groups backing Rep. Sean Duffy’s campaign
","
Democrats have freshman Republican Congressman Sean Duffy, R-Wisconsin, a former Ashland County district attorney, on their 2012 targets list.

That was especially evident when the Democratic Congressional Campaign Committee unleashed a July 2, 2012 news release taking aim at Duffy’s campaign contributors.

The release begins: ""Foreign Chinese prostitution money is allegedly behind the groups funding Congressman Sean Duffy’s (WI-07) Republican Majority.""

Quite a claim. But hardly an original one.

The DCCC made an identical Chinese prostitution attack against Jim Renacci, a  Republican House member in Ohio. They also used it against Republican congressmen Scott DesJarlais in Tennessee and Jim Gerlach in Pennsylvania.

What’s behind this lurid campaign finance claim?

Our colleagues in PolitiFact Ohio dug into the issue after Renacci was targeted. Here’s what they found:

The charge is tied to billionaire casino owner Sheldon Adelson, who has donated millions to Republicans. A fired former employee of Adelson’s filed a lawsuit which alleges that Adelson personally approved of prostitution at properties his company owns in Macau, a former Portuguese colony near Hong Kong that now is part of China.

PolitiFact Ohio continued:

The DCCC release noted that Adelson and his wife gave $5 million to the Congressional Leadership Fund Super PAC, which is backed by House Speaker John Boehner and other GOP leaders. FEC records indicate that Super PAC hasn’t spent anything so far.

Adelson and his wife, Miriam, also gave more than $60,000 to the Republican counterpart of the DCCC, the National Republican Congressional Committee, during the past election cycle.

A spokesman for the Adelson’s company, Las Vegas Sands, issued a statement that said Adelson has always ""maintained a strong policy against prostitution on our properties and any accusation to the contrary represents a blatant and reprehensible personal attack on Mr. Adelson’s character.""

In a July 9 interview with Forbes magazine,  Adelson said there’s not a ""shred of evidence"" to back his former employee’s charges, and ""says the fact that he and his wife (a physician who specializes in treating addiction) have given millions of dollars to set up clinics around the world to treat people with drug addictions (many of them prostitutes) makes the … claims even more preposterous.""  Adelson also told the publication that promoting prostitution could cost him his gaming licenses in Las Vegas, Singapore and Macau.

The DCCC says  ""Adelson has given $5 million to Speaker (John) Boehner’s Congressional Leadership Fund Super PAC, pledged $5 million to Leader (Eric) Cantor’s Young Guns Network Super PAC, given $70,800 to the National Republican Congressional Committee (NRCC), and has committed at least $20 million into Karl Rove’s American Crossroads.""

So Adelson has contributed or pledged plenty of money to Republican candidates or committees. That’s clear. But the Chinese prostitution link is another matter.

Here’s how PolitiFact Ohio put it in their review of the claim against Renacci:

Do unproven charges by a disgruntled former Adelson employee coupled with Adelson’s generosity to GOP groups that are likely to back Renacci justify the DCCC’s claim that ""foreign Chinese prostitution money is allegedly behind the groups funding Congressman Jim Renacci’s Republican majority?""

We don’t think so.

Neither do we.

As our Ohio colleagues point out, the allegation that Adelson allowed prostitution at the Macau comes from a fired employee. The DCCC takes that claim and says money from prostitution was included in Adelson’s campaign contributions to GOP congressional incumbents -- including Duffy.

There’s no evidence that Duffy received contributions from Adelson, and he has no control over contributions to groups that support him.

""The claim that Adelson’s donations to these other groups amount to ‘Chinese prostitution money’  is dubious enough that inserting the word ‘allegedly’ can’t save it,"" PolitiFact Ohio wrote in its assessment.

That holds no matter what name is inserted into the cut-and-paste news release.

You can repeat a claim, but the smell of smoke remains the same. Pants on Fire.",/factchecks/2012/jul/16/democratic-congressional-campaign-committee/democratic-congressional-campaign-committee-says-p/
