tags,sub_header,text_body,sources,quote_href
"['National', 'Economy', 'Jobs', 'Workers', 'Bernie Sanders']","
Fact-checking Bernie Sanders on a $15 minimum wage
","Supporting a $15 minimum wage has become something of a litmus test for Democratic candidates these days -- strikingly so, since as recently as his 2013 State of the Union address, President Barack Obama supported a far more modest increase, a raise from $7.25 to $9. Later that year, he increased his proposal to $10.10. In a Feb. 26 tweet, Sen. Bernie Sanders, I-Vt. -- who had recently announced his second presidential bid -- touted the benefits of raising the minimum wage to $15. ""We must follow cities and states across the country and raise the federal minimum wage to $15 an hour and index it to median wage growth thereafter,"" he wrote. ""Doing so would give more than 40 million low-wage workers a raise, more than 25 percent of the U.S. workforce."" We must follow cities and states across the country and raise the federal minimum wage to $15 an hour and index it to median wage growth thereafter. Doing so would give more than 40 million low-wage workers a raise, more than 25 percent of the U.S. workforce. We found that Sanders was close on describing a study released Feb. 5 by the Economic Policy Institute, a left-of-center think tank. But it’s important to note that this study assumes that no net jobs will be lost as a result of a minimum wage -- an assumption that is speculative and, in some corners, controversial. The report looks at the potential impact of the Raise the Wage Act of 2019, which was sponsored by Sanders and other Democrats. The bill would phase in increases to the minimum wage so that it reaches $15 by 2024. It would also index future minimum wage increases to median wage growth. The study took into account the projected natural growth of wages between now and 2024 and only counted as gains the amount above that baseline wage growth. It also excluded workers who would not be affected by a minimum wage hike, such as self-employed workers. We should note that Sanders said ""more than 40 million low-wage workers"" would benefit, but the study itself said 39.7 million, which is slightly less than 40 million. In addition, the tweet glosses over the fact that the study looked at the bill’s full phase-in period, from 2019 to 2024. The study does say that 39.7 million Americans will benefit once the $15 level is reached by 2024, but prior to that, the numbers are smaller.     As the chart above shows, the study referred to workers who are ""directly"" impacted by the minimum wage hike as well as workers who are ""indirectly"" affected by it. Indirectly affected workers were defined as having a wage rate just above the new minimum wage. The study assumes that these workers will receive a raise as employers adjust their pay scales upward to reflect the new minimum wage. The biggest concern with the Economic Policy Institute study, though, is that it assumes no net change in employment status as a result of the minimum wage increase. For years, some economists have expressed caution about raising the minimum wage to $15, saying it could raise employers’ costs so much that it leads to higher unemployment. Supporters of a higher minimum wage point to a recent study that indicated that minimum wages between $10 and $13 did not generally lead to negative labor-force impacts. The study didn’t test a $15 minimum wage, however, since that level hasn’t been enacted anywhere yet. We reached out to several economists who had told us in 2016 that they were at least somewhat wary of increasing the wage that high. Timothy Smeeding, a professor of public affairs and economics at the University of Wisconsin, said the study is incomplete because it only counts the benefits and not the drawbacks. While conservatives ""look only at job losses,"" liberals ""look only at higher pay. The truth is that both will happen."" A particular problem is that a national minimum wage will pack a bigger wallop -- and potentially harm employment levels more -- in states with lower wage scales. In 2016, three states had median wages below $15, another 11 had median wages between $15 and $16, and another nine had median wages between $16 and $17. In these states, mandating a $15 minimum wage could immediately raise wages for close to half of workers, with some seeing their pay roughly double overnight. This could have untold impacts on employment, consumer prices and other aspects of the economy. ""I can’t see how a rapid increase of the minimum to $15 would be in the best interest of such areas, since I’m afraid employment opportunities for the low-skilled might suffer real harm,"" said Gary Burtless, a senior fellow at the Brookings Institution. One of the economists we checked back with, Henry Aaron of the Brookings Institution, said he finally ended his opposition to a $15 minimum wage this week, because Sanders’ bill phases in the increase over several years and because it indexes future increases, removing it from the realm of politics. ""In the past, we have had a minimum wage, adjusted for inflation, as high as the one that is proposed at a period when real labor productivity was lower, on average, than it is today or will be five years hence,"" Aaron said. ""Will there be some employment effects in some places from establishing a $15 minimum wage in 2024? Probably. But the effects will be small and the boost in earnings for relatively low-wage workers will be high."" Ultimately, it’s impossible to know how many jobs will be lost due to a minimum wage hike to $15. What we do know is that Sanders’ tweet focuses on the benefits but not the potential downside, expressing certainty where uncertainty prevails. Sanders said that raising the federal minimum wage to $15 ""would give more than 40 million low-wage workers a raise, more than 25 percent of the U.S. workforce."" That sticks closely to the top-line findings of a study by the Economic Policy Institute, a liberal group. Still, it’s important to note that the study assumed no change in unemployment. That’s a big assumption, and one that is not certain to pan out. We rate the statement Half True.",[<zip object at 0x000001B4EBDDA0C0>],/factchecks/2019/mar/01/bernie-sanders/fact-checking-bernie-sanders-15-minimum-wage/
"['Fake news', 'Facebook Fact-checks', 'Facebook posts']","
Facebook post shares photo of actor and claims he is Chelsea Clinton's 'dead bodyguard'
","Conspiracy theories that claim the Clintons kill off former employees or friends who reveal their family secrets are nothing new. They have been going around since President Bill Clinton was in office. Now, a new rumor on Facebook says Chelsea Clinton’s former bodyguard ""Jack Gordon"" was found dead in the Ohio River in early 2019 after he started telling prosecutors damaging information he had obtained on the job. The post features a photo of a man has text overlaid that says: ""This is Jack Gordon. He was Chelsea Clinton’s bodyguard until August 2018. Soon after his termination he started talking to federal prosecutors about damaging information he had obtained. In January of 2019 his body was found floating in the Ohio river near WV. His phone and computer had been smashed."" The post was published on Feb. 24 and has been shared close to 400 times. It was flagged as part of Facebook’s efforts to combat false news and misinformation on its News Feed. (Read more about our partnership with Facebook.) The photo is actually of actor Ted Levine, who has appeared in dozens of films since the 1980s and starred in the ""Monk"" TV series as Captain Leland Stottlemeyer and played Buffalo Bill in the 1991 movie ""The Silence of the Lambs."" There are no credible news reports of any former or current bodyguards of Chelsea Clinton being found dead. The only Jack Gordon we could find with any connection (albeit a small one) to the Clintons is the late entertainment manager and former husband of LaToya Jackson who died of cancer in 2005. In the late 1990s, Gordon apparently briefly represented Paula Jones, a pivotal figure in the impeachment trial of Bill Clinton, who said Clinton harassed her. A version of the dead body guard rumor appears to have started with a blog post published Feb. 10 on America’s Last Line of Defense, a website known for publishing misleading content, defining itself as ""satirical."" Still, some users share the blog’s stories as if they are true. The junk website said the body belonged to a Hillary Clinton aide named ""Jaeger Holpern,"" which is an anagram for the blog’s author, ""Jolee Garphren."" The story also claimed Holpern worked as Chelsea Clinton’s bodyguard until November 2018. The site lists this disclaimer: ""Everything on this website is fiction. It is not a lie and it is not fake news because it is not real. If you believe that it is real, you should have your head examined. Any similarities between this site’s pure fantasy and actual people, places, and events are purely coincidental and all images should be considered altered and satirical."" As rumors often do, this one appears to have morphed. It started as a satire blog post and eventually became  a meme that featured a known actor’s photograph and used the name ""Jack Gordon"" as Chelsea Clinton’s former bodyguard.   We rate this Pants on Fire!",[<zip object at 0x000001B4EBECAC00>],/factchecks/2019/mar/01/facebook-posts/facebook-post-shares-photo-actor-and-claims-its-ch/
"['National', 'Legal Issues', 'Foreign Policy', 'Ilhan Omar']","
Cohen and Abrams: A double standard on lying to Congress?
","When Michael Cohen, President Donald Trump’s former personal lawyer and convicted felon testified before a House committee, his Republican questioners had one main line of attack: He was a confessed liar who could never be believed. Near the end of Cohen’s testimony, Rep. Ilhan Omar, D-Minn., compared him to another confessed liar who later appeared before Congress — Special Representative to Venezuela Elliott Abrams. Omar tweeted this: ""#MichaelCohen: -Convicted of lying to Congress re: Russia investigation -Going to jail -'Don't believe a word he says!' #ElliottAbrams: -Convicted of lying to Congress re: arming Contra death squads -Pardoned, then appointed Envoy to Venezuela -'Don't dare question his past!' "" #MichaelCohen:-Convicted of lying to Congress re: Russia investigation-Going to jail-""Don't believe a word he says!""#ElliottAbrams:-Convicted of lying to Congress re: arming Contra death squads-Pardoned, then appointed Envoy to Venezuela-""Don't dare question his past!""🤔 To be sure, the two men’s resumés are strikingly different. Cohen has been a New York lawyer, a self-described fixer, and investor in a fleet of taxi medallions. Abrams has been a fixture in Republican foreign policy circles for decades. He was assistant Secretary of State during the Reagan administration in the 1980s, and served as a special assistant to President George. W. Bush. He is a senior fellow at the Council on Foreign Relations, a prominent policy think tank based in New York City. Both men pleaded guilty to making false statements to Congress, but Cohen also pleaded guilty to tax evasion, filing false statements on a loan application and hiding an illegal campaign contribution. That last one involved payments to porn star Stephanie Clifford (also known as Stormy Daniels) to buy her silence in the closing weeks of Trump’s presidential campaign. As for lying to Congress as the tweet claims, Cohen told Senate and House committees in August and October 2017 that discussions over a Trump Moscow development project ended in January 2016, before the Iowa caucuses and the New Hampshire primary. In his pleading, Cohen said that talks continued for months beyond that. ""The defendant’s false statements obscured the fact that the Moscow Project was a lucrative business opportunity that sought, and likely required, the assistance of the Russian government,"" government prosecutors wrote in their sentencing memo. ""If the project was completed, the Company (the Trump organization) could have received hundreds of millions of dollars from Russian sources in licensing fees and other revenues."" On the stump, Trump repeatedly insisted that he had no business ties inside Russia, though he did say he had sold plenty of high-end properties to Russians in America. Abrams’ offense dates to the mid-1980s. The Reagan administration was keen to stifle the leftist government that held power in the Central American nation of Nicaragua. To that end, the United States funded the Contras, an armed insurgency that battled for control of Nicaraguan territory. Congress objected, and in 1982, it banned support for the Contras. The Reagan administration carried on through a covert operation that sold arms to Iran, itself subject to an embargo, and used the proceeds to buy weapons the Contras needed. Abrams supplemented that cash with a $10 million contribution from the sultan of Brunei. Abrams gave the sultan’s representative a Swiss bank account number to complete the transaction. The crash of a small plane helping supply the Contras exposed the operation. Congress investigated. When asked by the House Permanent Select Committee on Intelligence if any foreign government had helped supply the Contras, Abrams said, ""No."" Abrams pleaded guilty to two misdemeanor counts of lying to Congress on the matter. He was later pardoned by President George H.W. Bush. In comparing the two, John Q. Barrett, a law professor at St. John’s University who helped prosecute the Iran-Contra investigation, said, ""Both Abrams and Cohen pleaded guilty and cooperated with law enforcement."" He added, ""Convicted criminals provide truthful and valuable information to government, both law enforcement and legislative oversight, all the time."" The turmoil in Venezuela, with two men claiming to be the country’s rightful leader, widespread protests and economic collapse, brought Abrams back before a congressional committee recently in his role as the administration's Special Representative, a diplomatic post. Omar attacked him (her own word), saying, ""I fail to understand why members of this committee or the American people should find any testimony that you give today to be truthful."" Right now, the main difference vis-à-vis false congressional testimony, is that Abrams has been pardoned and Cohen has not. That gives more support for challenging Cohen’s testimony, said Harvard law professor Alex Whiting. But Whiting cautioned that such distinctions are subjective. ""When it comes to convictions for perjury, it is often the case that how one feels about the seriousness of the crime and conviction depends on what one thinks of the person,"" Whiting said. Barrett did object to one part of Omar’s tweet. The Contras, he said, weren’t death squads. They were insurgents. Labels aside, there is credible and corroborated reporting that the Contras killed unarmed men, women and children, committed rape and torture, attacked civilian facilities, such as hospitals and food warehouses, and conducted mass kidnappings. While not all Contra groups were human rights violators, some acted with extreme brutality. Omar tweeted, ""Michael Cohen: Convicted of lying to Congress re: Russia investigation … Elliott Abrams: Convicted of lying to Congress re: arming Contra death squads.""  She was correct that both Cohen and Abrams were guilty of lying to Congress, although her comparison overlooks that Cohen admitted to other violations, including tax and loan fraud. Abrams received a pardon, and whether the Contras are accurately described as ""death squads"" is a complex issue. We rate this statement Mostly True.",[<zip object at 0x000001B4EAA9DC80>],/factchecks/2019/mar/01/ilhan-omar/cohen-and-abrams-double-standard-lying-congress/
"['Immigration', 'National', 'Homeland Security', 'Henry Cuellar']","
Fact-checking Texas congressman on Border Patrol hiring under Trump administration contract
","The Trump administration paid a company millions of dollars to help the government hire Border Patrol agents, but only two agents were employed, claimed U.S. Rep. Henry Cuellar, D-Texas. ""(President Donald Trump) put out a $297 million contract to a vendor to show him how to hire Border Patrol. So, the first payment they made was $14.8 million. You know how many Border Patrol they hired with $14.8 million? Two, "" Cuellar said during a Feb. 22 press conference in Laredo, Texas. Were only two Border Patrol agents hired under a $14.8 million initial payment of a $297 million contract? Cuellar’s broad claim of a troubled hiring process is accurate. But his statement overlooks some details, and the dollar figure he cited is slightly higher than the initial payment. The federal government has had problems finding and keeping people to work as Border Patrol agents, so it decided to turn to the private sector for help. U.S. Customs and Border Protection in November 2017 awarded a $297 million contract to Accenture Federal Services, so it could help the government recruit and hire 7,500 qualified candidates over five years. The jobs to fill are for Border Patrol agents, Customs and Border Protection officers, and Air and Marine Interdiction agents. The Office of Inspector General within the Department of Homeland Security audited the contract in response to hotline complaints about the contract. The inspector general’s office in a December 2018 report said that Accenture had not delivered the promised hiring process or results and relied on government resources to fulfill its obligations. It detailed several other concerns. ""CBP risks wasting millions of taxpayer dollars on a hastily approved contract that is not meeting its proposed performance expectations,"" the report said. ""CBP must hold the contractor accountable, mitigate risk, and devise a strategy to ensure results without additional costs to the government."" As of Oct. 1, 2018 — 10 months into the contract — Customs and Border Protection had paid Accenture about $13.6 million for startup costs, security requirements, recruiting, and applicant support. ""In return, Accenture has processed two accepted job offers,"" the report said. Cuellar’s office said his claim was based on this finding. The inspector general’s office told PolitiFact that those two accepted job offers processed by Accenture were for a Border Patrol agent and for a Customs and Border Protection officer. (CBP officers work at ports of entry and don’t necessarily go out on patrol duties.) Customs and Border Protection referred PolitiFact to a statement it issued after the report’s publication. ""While we take some exception to the OIG’s characterization of the contract, we do agree the contract has been a challenge, primarily due to the innovative efforts by both parties, and we are reviewing how best to use it moving forward,"" said part of the statement. The inspector general’s report also included Customs and Border Protection’s response to the audit. The agency said it was inaccurate to say that the $13.6 million only yielded two accepted job offers, because Accenture also ""created a hiring structure, tailored technology solutions to support and manage the hiring process, stood up an applicant care center, marketed and recruited thousands of new applicants, and conducted many of the hiring steps for several thousand applicants."" The inspector general’s officer countered that response, saying, ""While we recognize that CBP has worked with Accenture to establish hiring activities, we stand by our statement that such activities have resulted in only two accepted job offers as of Oct. 1, 2018."" One of the issues flagged by the report was a period when neither Accenture nor Customs and Border Protection could determine which applicants were recruited by Accenture, due to Office of Management and Budget restrictions and privacy concerns. Accenture also did not always provide human resource personnel and the people needed to conduct background investigations. And even though Accenture said it could provide an innovative applicant tracking system, it used the government’s hiring system instead, the inspector general report said. Due to those shortcomings, the government modified the contract and gave the company a three-month interim period (March through June 2018) to fix those issues. During this period, Customs and Border Protection did a lot of the work Accenture was supposed to be doing. And because Accenture couldn’t determine which applicants it recruited, the government agreed to give them credit and ""temporarily pay Accenture for a percentage of all applicants regardless of whether CBP or Accenture processed the applicants."" ""As of Oct. 1, 2018, CBP had processed 14 applicants on behalf of Accenture. All 14 applicants accepted job offers, and seven of the 14 entered on duty, which translated to payment of approximately $500,000 to Accenture for work CBP had completed,"" the report said. So, even though there were these additional hires, it’s unclear if they were employed due to Accenture’s recruitment efforts. The inspector general’s report said Accenture was ""nowhere near satisfying its 7,500-person hiring goal over the next 5 years."" Customs and Border Protection told PolitiFact there were ""new hires from Accenture"" brought onboard and others who had accepted job offers since the Oct. 1, 2018 date referenced in the report. It’s unclear how many were Border Patrol agents, how many were exclusively recruited and processed by Accenture, and whether they were covered in the initial payment to Accenture. Cuellar said, Trump ""put out a $297 million contract to a vendor to show him how to hire Border Patrol. So, the first payment they made was $14.8 million. You know how many Border Patrol they hired with $14.8 million? Two."" The Trump administration awarded a $297 million contract to Accenture to help Customs and Border Protection hire 7,500 new employees over five years. That includes Border Patrol agents. An inspector general report said that as of Oct. 1, 2018, Customs and Border Protection paid Accenture about $13.6 million for startup costs, security requirements, recruiting, and applicant support. The company to that date had processed two accepted job offers, the report said. One of them was a Border Patrol agent, the other a Customs and Border Protection officer. The report mentioned 14 other accepted job offers processed by Customs and Border Protection on behalf of Accenture. But due to deficiencies in the contract, it’s unclear if those 14 were hired because of Accenture’s recruitment. Cuellar’s statement is accurate but needs clarification. We rate it Mostly True.",[<zip object at 0x000001B4EBBB4040>],/factchecks/2019/mar/01/henry-cuellar/fact-checking-texas-congressman-border-patrol-hiri/
