tags,sub_header,text_body,quote_href
"['Arizona', 'Elections', 'Facebook Fact-checks', 'Facebook posts']","
No, Arizona troopers didn’t discover 50K ballots for Trump in a dumpster
","On Friday morning, Democratic presidential nominee Joe Biden was leading in Arizona, where some news outlets had already declared the former vice president the winner.  There were still 300,000 ballots remaining to be counted as an unnerving announcement started to spread on social media.  ""Arizona trooper found 50,000 ballots in dumpster all for President Trump!!"" one Facebook post said.  It was flagged as part of Facebook’s efforts to combat false news and misinformation on its News Feed. (Read more about our partnership with Facebook.)  But we checked with the Arizona Department of Public Safety. and a spokesperson and sergeant there told us that, actually, troopers have not found 50,000 ballots for President Donald Trump.  ""It is not true,"" a sergeant said.  We rate this Facebook post False. This fact check is available at IFCN’s 2020 US Elections #Chatbot on WhatsApp. Click here, for more.",/factchecks/2020/nov/06/facebook-posts/no-arizona-troopers-didnt-discover-50k-ballots-tru/
"['Elections', 'Facebook Fact-checks', 'California', 'TikTok posts']","
It wasn’t 'cheating' that Calif. collected ballots after state called for Biden
","A TikTok account suggested there was ""cheating"" for Joe Biden in California because some ballots weren’t collected until he had already been declared the winner in that state over President Donald Trump. The post relied on a widely circulated video filmed Nov. 4 — the day after the election and the day after Biden had been declared the winner in California.  The post was headlined: ""This video was just taken (11/04) by a friend in California. The cheating is unreal!!!"" A slightly shorter version of the video was also shared in a Facebook post on Nov. 4. That poster wrote: ""This is today"" in Reseda, which is a neighborhood in Los Angeles. The post was flagged as part of Facebook’s efforts to combat false news and misinformation on its News Feed. (Read more about our partnership with Facebook.) California did collect ballots on Nov. 4.  It was standard procedure, not any sign of cheating, to collect and then count ballots from drop boxes on Nov. 4. As shared on TikTok, the minute-long video shows two men loading hundreds of paper items from a box into satchels. The box is on a sidewalk on what appears to be a residential street. It’s not apparent where or when the video was recorded.  #votes2020 #california #trump2020 Here’s the exchange between the woman and one of the men. Woman: ""Are you guys collecting ballots?"" Man: ""Yeah."" Woman: ""I thought they collected them all. I just want to document."" Man: ""No, we’re still collecting."" Woman: ""Wait, how come they already called the state?"" Man: ""Because these are mail-in ballots."" (The box does appear to be a drop box for ballots, not a mailbox.) Woman: ""Are there a ton in there?"" Man: ""Yeah."" The woman then asks the men if they are ""official election guys,"" and one of them shows her a badge clipped to his shirt. What’s on the badge is not visible. There’s a sign on the box they’re collecting from, but what it says is not visible, either. Woman: ""Where do you guys take them?"" Man: ""Election Center."" Woman: ""Is that in the government building?"" Man: ""LA County."" The day after the posting, the office of the Los Angeles County Registrar-Recorder/County Clerk responded to a posting of the video on Twitter, saying: ""All Drop Boxes were closed and locked at 8 p.m. on Election Night and ballots were collected the following day. These are valid ballots that will be processed and counted during the post-election canvass — like all outstanding vote-by-mail ballots."" All Drop Boxes were closed and locked at 8PM on Election Night and ballots were collected the following day. These are valid ballots that will be processed and counted during the post-election canvass -- like all outstanding vote by mail ballots. A spokeswoman for the California Secretary of State told PolitiFact the video showed ballot collection in Reseda. The Associated Press and other media called California for Biden just after California polls closed Nov. 3. The AP said it declared Biden the winner of California as soon as polls closed in the state, ""even though election officials there had yet to release any results from Tuesday’s presidential contest. The news agency did so after results from AP VoteCast and an analysis of early voting statistics confirmed expectations that the state’s longstanding political trend in favor of Democratic presidential candidates will hold."" As of the morning of Nov. 6, Biden had more than 8.24 million votes in California — 65.1% of the vote — to Trump’s 4.17 million, according to the Secretary of State. A poster on TikTok claiming, ""The cheating is unreal,"" shared a video widely circulated on social media that appeared to show California ballots being collected the day after the election, after the state was called for Biden. In fact, it’s standard procedure in California to collect and process ballots from drop boxes after Election Day. A county official said the boxes were locked at 8 p.m. on election night. The video did not depict any cheating. We rate the claim False. 
This fact check is available at IFCN’s 2020 US Elections #Chatbot on WhatsApp. Click here, for more.  ",/factchecks/2020/nov/06/tiktok-posts/it-wasnt-cheating-calif-collected-ballots-after-st/
"['Jobs', 'Pennsylvania', 'Tom Marino']","
PA Congressman Marino and the math for 20M ‘out of work’ Americans
","U.S. Rep. Tom Marino took to MSNBC to defend presumptive GOP Presidential nominee Donald Trump, and cited an eye-opening number of unemployed Americans in the process. Marino, a Republican who represents Pennsylvania’s 10th district, endorsed Trump in February, saying the decision was ""one of my life-changing moments,"" according to Politico. He appeared Thursday on MSNBC to defend the real estate mogul’s record and assert Trump, who’s never held elected office before, is the best person for the job. ""To those that are saying that this just isn’t going to work, let me ask you this question: How’s it been working the last 30 years with governors and senators and career politicians being president?"" he asked. ""We’re 20 trillion dollars in debt, 20 million people out of work, businesses leaving the country, people are afraid that they can’t even send their kids to college."" The idea that 20 million people are out of work in America sounded high, especially because the official number of unemployed Americans was 8 million as of April 1, according to the Bureau of Labor Statistics. So we decided to check the fact. Marino’s office didn’t respond to a request for comment from PolitiFact, but we’ve looked into this claim before. Former presidential candidate John Kasich actually cited the 20 million figure in a campaign ad in February, and when PolitiFact asked the Kasich campaign for evidence, they proceeded to cite a source that caught us off-guard: Us. Specifically, they pointed to an even earlier fact check from August in which we analyzed a statement by Republican presidential candidate Donald Trump. Trump said that ""we have 93 million people out of work. They look for jobs, they give up, and all of a sudden, statistically, they're considered employed."" We rated this claim False, largely because the 93 million number included lots of people who would not be expected to want or be able to work, including full-time students, senior citizens, the disabled, and those who have chosen to take care of their children full-time. However, in the process, we conducted a mathematical experiment in which we played with possible numbers of Americans who are ""out of work"" that fit somewhere between the official unemployment rate (on the low end) and Trump’s number (on the high end). Here’s what we wrote, using the statistics that were current at the time: The official number of unemployed Americans is 8.3 million -- less than one-tenth of what Trump says. But to give Trump the benefit of the doubt, it’s possible to expand this number using more credible economic thinking. Gary Burtless, an economist at the Brookings Institution, says it’s not unreasonable to include: This would mean that upwards of 21 million Americans could be described with some justification as ""out of work"" involuntarily, either fully or partially. But that’s not even one-quarter of the number that Trump offered. Rob Nichols, a spokesman for Kasich, said the campaign simply updated our math with more recent data in preparing the television ad. The numbers for January 2016, Nichols said, were: That works out to 20 million on the nose. We salute the Kasich campaign’s efforts to fact-check-proof their assertion. Still, we should note that we didn’t intend our calculation to be the final word on how to determine the number of ""out of work"" Americans. Rather, we were trying to provide a benchmark for showing just how wrong Trump’s number was. We’ll note that our wording was that the 21 million figure had ""some justification"" — not exactly a clarion call for the Bureau of Labor Statistics to change its longstanding protocol. In subsequent fact-checks, though not the one the Kasich campaign referred to, we have added language that is clearer about our intentions. We did that, for instance, in our Feb. 11, 2016, fact-check of a different statement by Trump: ""Don't believe those phony numbers when you hear 4.9 and 5 percent unemployment. The number's probably 28, 29, as high as 35 (percent). In fact, I even heard recently 42 percent."" In that fact-check, which produced a rating of Pants on Fire, we prefaced a similar alternative calculation this way: ""We are deliberately stretching the numbers here as an intellectual exercise; we are not saying that 15.6 percent is a more accurate unemployment rate than the official one of 4.9 percent."" But enough from us. What do the two economists we checked with for the original fact-check think about the use of the 20 million figure? ""Given that the image looks like a guy in an unemployment line, I'd say it's a misleading figure,"" said Tara Sinclair, an economist with George Washington University and the jobs website Indeed.com. Many people have good reasons for not wanting to work now, she said, and that is something distinct from actually being ""out of work."" Burtless agreed, saying, ""The 5.988 million people working part-time who would prefer to have a full-time job are not ‘out of work.’ They are employed, but on a work schedule that does not provide them with the weekly hours they desire."" At the same time, Burtless said there is still some value in the number cited in Kasich’s advertisement. He called a the 20 million figure ""an upper-bound estimate of the total number of Americans who are unemployed or underemployed.""  It’s just not the only estimate. Our ruling Marino said on MSNBC that 20 million Americans are out of work. While the statement can be interpreted as accurate depending on the definition of ""out of work,"" it lacks context. We rate the claim Half True.",/factchecks/2016/may/09/tom-marino/pa-congressman-tom-marino-says-20-million-american/
"['History', 'Crime', 'Virginia', 'Terry McAuliffe']","
McAuliffe held Va. record for restoring felon voting rights before his blanket action
","The shock waves still are being felt from Gov. Terry McAuliffe’s blanket restoration of voting rights on April 22 to an estimated 206,000 Virginia felons who had served their prison sentences and completed their probationary periods. Republicans say the action is a ruse to help Hillary Clinton - McAuliffe’s close friend and fellow Democrat - carry Virginia in November’s presidential election. GOP legislative leaders have hired a lawyer to guide an expected lawsuit challenging the governor’s authority to order the sweeping restoration. McAuliffe says it’s only right to forgive people after they’ve served their punishments and that Virginia’s traditionally steep path toward restoration of rights can be traced to Jim Crow-era efforts to exclude black voters. The governor says that before his blanket action, he already had shattered the restoration-of-rights records by previous governors. Here’s what he said during an April 22 speech on the Capitol steps, moments before announcing his blanket policy. He also republished it on Medium.com. ""Today, I am proud to tell you that in a little more than two years that we have restored the rights of more than 18,000 individuals, which is more than the past seven governors combined in their four-year terms."" We wondered whether the McAuliffe’s figures were correct. The governor’s office sent us a data sheet with McAuliffe’s restoration numbers just before his announcement and those of every governor dating to 1938. We were able to confirm the figures of past administrations through old newspaper stories and with the help of Roger Christman, senior state governors’ archivist at the Library of Virginia. McAuliffe reports restoring the rights of 18,009 felons at the time of his announcement. Here’s how that compares with the previous seven governors, listed in descending order by their terms: •Republican Bob McDonnell, 8,111; •Democrat Tim Kaine, 4,402; •Democrat Mark Warner, 3,486; •Republican Jim Gilmore, 238; •Republican George Allen, 460; •Democrat Doug Wilder, 427; and •Democrat Jerry Baliles, 853. The seven governors restored rights to 17,977 felons - 32 fewer than McAuliffe’s total before his April 22 announcement. The seven governors, all serving four years, go back to 1986. Let’s keep going back, in descending order, to 1938: •Democrat Chuck Robb, 1,180; •Republican John Dalton, 939; •Republican Mills Godwin, 515; •Republican Linwood Holton, 303; •Democrat Mills Godwin, 260; •Democrat Albertis Harrison, 158; •Democrat Lindsay Almond, 136; •Democrat Tom Stanley, 163; •Democrat John Battle, 139; •Democrat William Tuck, 167; •Democrat Colgate Darden, 157; and •Democrat James Price, 273. If you’re wondering, the 19 governors before McAuliffe restored the rights of 22,367 felons. If McAuliffe’s action withstands legal challenge, he’ll have restored voting rights to about 224,000 felons in less than 2 1/2 years - 10 times more than the last 19 governors combined during their entire terms. McAuliffe says he’s empowered to issue a blanket restoration of rights and points to language in the Virginia Constitution that grants governors the authority to ""remove political disabilities"" for felons. Republicans say the governor must follow a more individualized process for restoring rights. The Richmond Times-Dispatch, in a May 3 article, said the GOP challenge could center on other language in the constitution that says no ""person"" convicted of a felony can vote unless ""his"" civil rights have been restored. Our ruling McAuliffe said that before issuing a blanket restoration of rights on April 22 to felons who had served their time, he already had ""restored the rights of more than 18,000 individuals, which is more than the past seven governors combined in their four-year terms."" Records prove his point.   We rate his statement True.",/factchecks/2016/may/09/terry-mcauliffe/mcauliffe-held-va-record-retoring-felon-voting-rig/
"['Immigration', 'National', 'Elections', 'Donald Trump']","
Donald Trump wrongly says noncitizens can vote when there is same-day voter registration
","Donald Trump said he does not support same-day voter registration because he says it makes it easier for noncitizens to vote. Because Trump complained repeatedly that the primary process was fixed, Meet the Press host Chuck Todd asked Trump if he supports policies that make it easier for people to vote. Same-day voter registration, for example, allows voters to register or update their information at the polls on Election Day. ""No, no,"" Trump said to the suggestion. ""I don't think people should sneak in through the cracks. And whether that's an ID or any way you want to do it. But you have to be a citizen to vote."" ""Well, of course,"" Todd replied. ""That is the law as it stands already."" Trump disagreed: ""No, it's not. I mean, you have places where people just walk in and vote."" In most states, people have to register to vote at least a few days prior to voting. But 15 states and the District of Columbia have or are in the process of implementing same-day voter registration. Is it really the case that noncitizens can just ""walk in and vote"" in these states? Election experts told us there’s no increased risk of noncitizens voting in states with same-day registration, as opposed to states that require voters to register in advance, because of the safeguards the states put in place. ""It’s not that you can just show up and vote — you have to register and provide necessary ID,"" said Michael McDonald, a political science professor at the University of Florida. To register someone to vote, states have to establish the voter’s identity and residency. To meet equivalent standards when registering people on Election Day, same-day registration states require the voter to bring proper identification and proof of residency, such as a utility bill, with them to the polls. The specifics, though, vary by state because each state makes its own election laws. So if there are problems with ineligible voters using same-day registration, it likely has more to do with how the state implements the program, rather than a problem inherent to the general concept of same-day registration, said Barry Burden, a political science professor at the University of Wisconsin. For example, some, but not all, states have an electronic database that they can use to check a same-day registrant’s eligibility on the spot. Others, like Iowa and New Hampshire, send a mailer to all same-day registrants, and if the card is returned as undeliverable, the state will investigate the case as potential election fraud. But the bottom line is that states strive to hold everyone to the same level of scrutiny in terms of identity verification. ""For presidential elections, all states require voters to be U.S. citizens, and there is nothing inherent about same-day registration that would make it easier for noncitizens to vote,"" said Joshua Douglas, an election law professor at the University of Kentucky College of Law. Douglas noted that some local jurisdictions do allow noncitizens to vote in certain elections, but it’s still illegal for them to vote in federal elections. Every expert we asked told us that there are anecdotal examples of noncitizens voting in federal elections, but it’s rare. And there isn’t any evidence that it’s more prevalent in the states with Election Day registration. For someone to vote fraudulently using same-day registration, they would have to lie about their eligibility in the presence of poll workers and others, and they would create a paper trail by filling out the paperwork. These factors serve as deterrents, in addition to the potentially severe penalties a fraudulent voter could face, like deportation if the person was in the country illegally.    Burden pointed to a recent case in Wisconsin of a man who has been charged with election fraud for voting in the state’s April 5 presidential primary. The man, who is not a citizen but is in the United States on a green card, registered and voted at the polls on Election Day. But the state government caught the man, and a spokesman for the Wisconsin Government Accountability Board told the local news that the agency had never encountered a similar case before, in 40 years of Election Day voter registration. ""For someone who’s not eligible to vote, to walk into a polling place and use same-day registration is risky,"" Burden said, noting that there’s a higher risk of election fraud in activities that occur outside the polling location, such as mail-in ballots. Our ruling ""You have to be a citizen to vote,"" but with same-day voter registration, ""you have places where people just walk in and vote."" In states with same-day voter registration, people don’t just walk in and vote. They have to provide the same level of identification as when registering in advance. Experts told us there is no additional risk of noncitizens casting ballots in states with same-day voter registration, nor is there any evidence that this occurs. We rate Trump’s statement False.",/factchecks/2016/may/08/donald-trump/donald-trump-wrongly-says-noncitizens-can-vote-whe/
"['National', 'Taxes', 'Donald Trump']","
For the third time, Donald Trump, U.S. is not 'highest taxed nation in the world'
","Donald Trump released a tax plan in September that would give huge tax cuts to the top 0.1 percent and bloat the deficit by at least $10 trillion over the next decade. But after he became the GOP’s last man standing and presumptive nominee, Trump said this week he’s considering raising taxes on the rich. ""Should we assume that most of your plans, then, we shouldn’t take you at your words, as sort of that they’re floors?"" Meet the Press host Chuck Todd asked Trump. ""It is called life, Chuck. It’s not my word, of course. I put in a proposal. You know what they are? They're really proposals. People can say it’s a tax plan. It’s really a tax proposal. Because after I put it in, and I think you know the Senate and Congress, you know as much as anybody, they start working with you and they start fighting,""  Trump responded. ""But I’m not under the illusion that that it’s going to pass. They’re going to come to me. They’re going to want to raise it for the rich more than anybody else."" He then explained why, despite that, he’s still sticking to his guns and giving ""a massive"" tax cut to businesses: ""We’re the highest taxed nation in the world. Our businesses pay more taxes than any businesses in the world. That’s why companies are leaving."" This is a version of one of Trump’s oft-repeated talking points, and it’s inaccurate. When we looked at this claim in the past, we compared the United States to the 33 other industrialized nations in Organization for Economic Cooperation and Development. Data from 2014, the most recent year available, shows that the United States wasn’t the most highly taxed by the typical metrics and actually places near the bottom or around the middle of the pack. Trump specified this time that he was talking about business taxes, but the essential data doesn’t back him there, either. Trump would have been more accurate if he had been more specific. The United States does have one of the highest top marginal corporate tax rates in the world. However, companies pay less in practice because they can take deductions and exclusions. When we look at the actual tax burden on U.S. companies, it’s far from highest in the world. Here’s a chart breaking it down: Tax revenue as percentage of GDP Corporate tax revenue as percentage of GDP Tax revenue per capita 1. Denmark: 50.9% 2. France: 45.2% 3. Belgium: 44.7% 1. Norway: 7.1% 2. New Zealand: 4.4% 3. Luxembourg: 4.3% 1. Luxembourg: $49,911 2. Norway: $38,016 3. Denmark: $31,054 31. United States: 26.0% 17. United States: 2.6% 19. United States: $14,204 32. Korea: 24.6% 33. Chile: 19.8% 34. Mexico: 19.7% 30. Hungary: 1.5% 31. Slovenia: 1.4% 32. Greece: 1.3% 32. Turkey: $2,985 33. Chile: $2,886 34. Mexico: $2,094 OECD average: 34.2% OECD average: 2.9% OECD average: $14,923 The World Bank’s data for 2012 — the last year for which it has complete figures — also placed the United States near the bottom in tax revenue as a percentage of GDP. Nations with lower percentages were two OECD members (Japan and Spain), a couple of oil-rich countries (Oman and Kuwait) and few impoverished states (like Afghanistan and the Central African Republic). We also looked at a 2016 report by the World Bank and PricewaterhouseCoopers that assessed the total tax burden for a case study company in different places around the world. The total tax rate — which includes not only income taxes but also labor taxes, property taxes, profit taxes, etc. — is expressed as a percentage over the total profit. By this metric, the company would have a total tax rate of 43.9 percent in the United States, placing it at No. 64 out of 189 countries. That’s lower than the rates the company would have paid in the two countries Trump says the United States loses to, China (67.8 percent) and Mexico (51.7 percent). Moreover, it’s nowhere near the top. Our ruling Trump said, ""We're the highest taxed nation in the world."" By all metrics we looked at, the United States is far from the most taxed nation overall and for businesses. We rate Trump’s claim False.",/factchecks/2016/may/08/donald-trump/donald-trump-us-not-highest-taxed-nation-in-world/
