tags,sub_header,text_body,quote_href
"['Elections', 'Facebook Fact-checks', 'Facebook posts']","
Fact-checking claim on Electoral College, Los Angeles County and 43 states
","A Facebook post claims that getting rid of the Electoral College would give a single county in California more say in the election of the president than 43 states. ""Abolishing the Electoral College would make Los Angeles County stronger than 43 states,"" said the Nov. 11 Facebook post that’s been shared more than 18,000 times. The post was flagged as part of Facebook’s efforts to combat false news and misinformation on its News Feed. (Read more about our partnership with Facebook.)  The post, taken literally, makes no sense, said James A. Gardner, an election law expert at the University at Buffalo School of Law. ""If the Electoral College were abolished, presumably the president would be elected by nationwide majority vote,"" Gardner said. In such a system, all groups of people ""would have precisely identical influence on the outcome of the election since every vote would count equally in the final tally,"" he said. A voter in Los Angeles County would have exactly the same input into the presidential election as would a voter in rural Wyoming if a national popular vote were used to elect the president, said Robert Speel, a political science associate professor at Penn State Erie, The Behrend College. Voters on Election Day choose who they want as president, yet the final vote comes later through the Electoral College, which consists of 538 electors. (The candidate who reaches 270 Electoral College votes wins.) The number of electors a state gets equals the combined number of members a state has in the U.S. House of Representatives and the U.S. Senate. Each state has two senators, and the number of representatives for each state varies depending on the state’s population. States with more people have more representatives. (Though not a state, the District of Columbia is allocated three electors due to a constitutional amendment. U.S. territories, like Puerto Rico, do not get electors and cannot vote in the general election.) Eliminating the Electoral College (and not creating a new system in its place) would mean that the president is elected based on the popular vote -- that is, who gets the most votes on Election Day.  Supporters of the Electoral College argue that keeping it requires candidates to get votes from all parts of the country, including less populated areas. Opponents say that it actually makes candidates focus only on swing states -- states where the margin is close enough that either party has a chance of winning. The Facebook post appears to suggest that since Los Angeles County has a lot of people — an estimated 10.1 million as of July 2019 — it will outweigh the voice of 43 other states. The post doesn’t specify which states, nor does it make clear if it means the county will be stronger than the 43 states combined or compared to each. U.S. Census Bureau population estimates show that 41 states, the District of Columbia, and Puerto Rico each had fewer people than did Los Angeles County. (Perhaps whoever created the Facebook post added the District of Columbia and Puerto Rico to arrive at ""43 states."")  One way to read the post is to say that Los Angeles County’s influence under a direct popular vote would outweigh the combination of all 43 states. But that’s wrong. The 43 states’ collective population — about 163.7 million — is about 16 times that of Los Angeles County. In a direct popular vote system, candidates might adjust their campaign strategy to appear in major media markets like Los Angeles, because that would be the most efficient use of campaign resources.  ""So maybe the author is trying inartfully to say this,"" Gardner said of the Facebook post.  But it’s uncertain whether candidates would even make that change. It could also be that candidates avoid places like Los Angeles because they are reliably Democratic and focus instead on winning swing regions, Gardner said. Under the Electoral College system, candidates spend almost all of their general election campaign time in urban and suburban areas in 10 to 12 battleground states, Speel said. In a popular vote system, they would likely stick to those regions but in a greater variety of states, he said. ""Presidential candidates are not going to campaign for the general election in rural areas no matter what system is used, simply because there aren't enough votes there,"" Speel said. A Facebook post said, ""Abolishing the Electoral College would make Los Angeles County stronger than 43 states."" With a popular vote system in place of the Electoral College, experts said every individual voter will have the same power. A change from one system to another could alter campaigning practices, but that doesn’t necessarily mean one vote in an urban area counts more than one vote in a rural area. We rate this post False.",/factchecks/2020/jan/08/facebook-posts/fact-checking-claim-electoral-college-los-angeles-/
"['Animals', 'Fake news', 'Fires', 'Facebook Fact-checks', 'Viral image']","
Image of burned sheep is from 2013 Australia fires
","A harrowing image of a group of burned sheep lying dead in a field is making the rounds on Facebook. While the image alone is uncaptioned, it was shared as part of a gallery post on Jan. 4. The collection’s caption claims that the photos in the gallery are examples of the devastation that the current Australia fires has had on the country’s animals. We found that many of the 29 photos included in that post were incorrectly labeled. In this case, the photo is real and was taken in Australia, but it is not from the current bushfires. The photo was flagged as part of Facebook’s efforts to combat false news and misinformation on its News Feed. (Read more about our partnership with Facebook.) The photo was taken in Australia –– but in January 2013. The image, which we found included in a Jan. 11, 2013, CNN article, shows a group of sheep lying in a New South Wales field after devastating bushfires swept through the area. The caption below the image reads: ""Burned sheep lie in a paddock near Bookham in New South Wales on Wednesday. An estimated 10,000 sheep have died in the New South Wales bushfires."" The photo was not manipulated and does show animals killed from bushfires in Australia, but it was taken several years ago. We rate this Mostly False.",/factchecks/2020/jan/07/viral-image/image-burned-sheep-australia-fires-2013/
"['Animals', 'Fake news', 'Fires', 'Facebook Fact-checks', 'Viral image']","
Photo of horse being led through smoky, burned field taken in US
","A heartbreaking image of a horse being led through a smoky, burned field is being shared on Facebook as the destructive wildfires in Australia continue to rage. The photo on its own is uncaptioned, but it’s included in a viral collection of images that the poster says all depict recent scenes from Australia. But we found that the photo and many other images in the post were not actually taken in Australia. The photo was flagged as part of Facebook’s efforts to combat false news and misinformation on its News Feed. (Read more about our partnership with Facebook.) We tracked down the image through a reverse-image search and found that it is a real photograph, but it shows a scene from California in late 2019.  The picture was taken by photographer Étienne Laurent on Oct. 30, 2019, in Simi Valley, Calif. In the photo’s original caption, Laurent says that horses were being evacuated from a burning ranch as the Easy Fire spread near Simi Valley, which sits north of Los Angeles. The image does not have a caption that says its from Australia, but it’s included in a gallery post that does. For that reason, we rate it Mostly False.",/factchecks/2020/jan/07/viral-image/photo-horse-being-led-through-smoky-burned-field-t/
"['Animals', 'Fake news', 'Fires', 'Facebook Fact-checks', 'Viral image']","
Photo of deer in burned rubble is from California, not Australia
","Devastating photos of wildlife caught in Australia’s unrelenting wildfires are circulating all over social media. And while some reports have estimated that nearly half a billion animals have died from the fires, we found that many included in one viral multi-photo post were not taken this fire season. Some of the photos were taken during previous fires in different countries, too, like this photo of a deer standing amid burned rubble in California. On its own, the viral deer image is uncaptioned. But it was posted as part of a photo gallery that included a post that reads in part, ""Huge wildfire in Australia has resulted in deaths of more than 480 milion animals.""Australia’s bushfires. We rated that post Mostly False after finding that many of the images are several years old and weren’t taken in Australia to begin with.  The image was flagged as part of Facebook’s efforts to combat false news and misinformation on its News Feed. (Read more about our partnership with Facebook.) After conducting a reverse-image search, we found that the deer image was taken by photographer Josh Edelson on Nov. 10, 2018, in Paradise, Calif. This photo shows the aftermath of the deadly Camp Fire that killed over 85 people and burned hundreds of thousands of acres in Northern California in 2018. This image is authentic, but it does not show destruction from Australia’s wildfires. Given the context in which it has been presented, we rate this viral image Mostly False.",/factchecks/2020/jan/07/viral-image/photo-deer-burned-rubble-california-not-australia/
"['Animals', 'Fake news', 'Fires', 'Facebook Fact-checks', 'Viral image']","
Image of burned cat isn’t from Australia wildfires
","As fires continue to blaze in Australia, images of animals caught in the devastation are being shared on Facebook. But many of these photos, like this one of a badly-burned house cat that was shared on Jan. 4, are not from this season’s fires in Australia at all.  On its own, the cat image is uncaptioned. But it was included in a viral post that displayed a collection of photographs supposedly from Australia’s bushfires. We rated that post Mostly False after finding that many of the images are several years old and weren’t even taken in Australia.  The image was flagged as part of Facebook’s efforts to combat false news and misinformation on its News Feed. (Read more about our partnership with Facebook.) A reverse-image search reveals the photo isn’t from Australia, nor was it taken during the most recent fire season. The photo was taken by photojournalist Jane Tyska on Nov. 11, 2018, in Paradise, Calif., following destruction from the Camp Fire. The Camp Fire started in Northern California in early November 2018, and burned over 150,000 acres, destroyed thousands of residences and killed more than 85 people.  Tyska’s caption on the burned cat image reads, ""A burned cat waits for animal control to arrive after they were called by responders who discovered it near Bille Road in Paradise, Calif., on Sunday, Nov. 11, 2018."" This is a real image, but it was taken in 2018 and is not from Australia. For that reason, we rate it Mostly False.",/factchecks/2020/jan/07/viral-image/image-burned-cat-isnt-australia-wildfires/
"['Animals', 'Fake news', 'Fires', 'Facebook Fact-checks', 'Facebook posts']","
Several photos of animals in viral post not from Australia fires, or this year
","Destructive bushfires in Australia have torched millions of acres across the region and have killed over 20 people and an estimated 480 million animals. We recently came across a Facebook page that posted a collection of heartbreaking images that purports to show scenes of different animals caught in the fires.  There’s just one problem: Many of the images are not from the wildfires in Australia. Some are not even from a fire event. We fact-checked several of the photos in the post, including this viral photo of a tiger on fire that was taken in 2012 in Jakarta, Indonesia. It depicted a bonfire of taxidermy animals. The multi-photo post that included that image has been shared over 84,000 times since Jan. 4 and displays 29 photos showing animals surrounded by smoke or fire, with the caption, ""Huge wildfire in Australia has resulted in deaths of more than 480 milion animals. Hundred of rare koalas are also reported dead among them. Lets pray for Australia Source: University of sydney report #wildfire.""  The University of Sydney estimated on Jan. 3 that 480 million animals have been killed in the New South Wales bushfires since September 2019. The post containing this photo gallery was flagged as part of Facebook’s efforts to combat false news and misinformation on its News Feed. (Read more about our partnership with Facebook.) We were able to track down several of the photos using the reverse-image search tool, Tin Eye.  Here are some that are included in the post with their original locations and dates. (Note to readers that many of these images are disturbing.) An image of a horse being pulled through a smoky field was taken by photographer Étienne Laurent on Oct. 30, 2019, in Simi Valley, California. Horses were being pulled by ranchers to evacuate a burning ranch as the Easy Fire spread.  A photo of a deer standing near a burned residence shows the aftermath of the Camp Fire that tore through Paradise, California. The photo was taken on Nov. 10, 2018, by photographer Josh Edelson. (Another image of a deer in the post wasn’t taken during a fire event and was found on Adobe Stock Images, titled ""Red Deer in morning Sun."") An image of a burned cat was also taken in Paradise, California, showing destruction from the Camp Fire. Photojournalist Jane Tyska took the photograph on Nov. 11, 2018.  A photo of a group of burned sheep lying dead in a field was taken in Australia, but it was taken in January 2013 in a New South Wales field after bushfires swept through the area. We found that a few of the other photos were taken in Australia more recently, in September 2019, but several more date back multiple years.  Though this viral post contains a smattering of images that are legitimately connected to the current wildfires devastating Australia, it appears an overwhelming number of those depicted here are not. We rate this post Mostly False.",/factchecks/2020/jan/07/facebook-posts/several-photos-animals-viral-post-not-australia-fi/
"['Iran', 'Facebook Fact-checks', 'Paul Gosar']","
This photo of Barack Obama shaking hands with Hassan Rouhani is doctored
","It wasn’t so long ago that a super PAC supporting U.S. Sen. Ron Johnson, R-Wis., aired an ad that used a doctored photo that appeared to show then-President Barack Obama and Iranian President Hassan Rouhani smiling and shaking hands.  But it’s perhaps been long enough, because on Jan. 6, U.S. Rep. Paul Gosar, R-Ariz., tweeted the image.  ""The world is a better place without these guys in power,"" he wrote. This post was flagged as part of Facebook’s efforts to combat false news and misinformation on its News Feed. (Read more about our partnership with Facebook.)  As the New York Times reported, Obama and Rouhani have never met in person. Rouhani is still in power. The original image, taken by Reuters photographer Jason Reed in 2011, shows Obama smiling and shaking hands with then-Indian Prime Minister Manmohan Singh.  As people responded to Gosar’s tweet to point out that the image of Obama and Rouhani was manipulated, he responded that ""no one said this wasn’t photoshopped."" ""No one said Obama met with Rouhani in person,"" he added on Twitter.  But the image, which has been reshared on social media since Gasar’s tweet, suggests that they did. When we fact-checked the Ron Johnson-supporting Restoration PAC for using it in 2015, we rated it Pants on Fire.  More than four years later, the image is still smoking. Pants on Fire!",/factchecks/2020/jan/07/paul-gosar/photo-barack-obama-shaking-hands-hassan-rouhani-do/
"['Candidate Biography', 'Facebook Fact-checks', 'Viral image']","
A doctored photo appears to show Obama using binoculars wrong
","A recent Facebook post appears to show former President Barack Obama peering through the wrong end of a pair of binoculars while a general watches. ""The look on the 4 stars face as obama looks through the wrong end of the upside down binoculars…"" the Dec. 2 post says. ""People actually voted for this clown… No face ever screamed ""You gotta be sh tting me louder than this… #obama.""  But the image has been manipulated, and this post was flagged as part of Facebook’s efforts to combat false news and misinformation on its News Feed. (Read more about our partnership with Facebook.)  You can see the original here. Associated Press photographer Pablo Martinez Monsivais took it on March 25, 2012, as Obama looked through the correct end of the binoculars to see North Korea from the Demilitarized Zone between North and South Korea.  Getty Images has other photos from that day from other angles. Obama isn’t holding his binoculars incorrectly in any of them.  We rate this Facebook post Pants on Fire!",/factchecks/2020/jan/07/viral-image/doctored-photo-appears-show-obama-using-binoculars/
"['Fake news', 'History', 'Military', 'Facebook Fact-checks', 'Facebook posts']","
No, Trump didn’t donate his airline to bring troops home in the 1990s
","A viral Facebook post depicts President Donald Trump as a generous airline owner who donated his planes to transport American soldiers home from Saudi Arabia in 1991. But the details don’t square with what happened. The post features a letter purportedly written by a man named Ron Knouse. He describes how he and other soldiers had to wait four days for buses to the airport because there was a shortage of planes at the end of Operation Desert Storm.   ""Finally, the buses came and took the young man to the airport. The planes waiting were from Tower Air. The owner of Tower Air had volunteered his planes and staff to bring soldiers home for the cost of fuel only. Happily, the young veteran got home just in time for Easter weekend in 1991 and spent that time emotionally healing with friends and family surrounding him… ""The Airline owner – Donald J Trump. ""This needs to go viral. He’s done so many good things you never hear about."" The post was flagged as part of Facebook’s efforts to combat false news and misinformation on its News Feed. (Read more about our partnership with Facebook.) Donald Trump did operate an airline at one time. But the details of the letter are inaccurate. Trump did not own Tower Air, and we found no evidence he assisted in the transport of military personnel from Saudi Arabia. Beyond that, Trump’s airline — Trump Shuttle — was being controlled by a consortium of banks, not Trump, when the United States military chartered flights from the airline for personnel transport. That was for flights within the United States, not from Saudi Arabia. A different story about a Trump plane transporting 200 marines from North Carolina to Florida after Operation Desert Storm in 1991 emerged when conservative talk radio host Sean Hannity aired a now-deleted segment about it in May 2016, during Trump’s presidential campaign. In that version, about 200 Marines took two trips on a Trump-owned plane from North Carolina to Florida after a logistics error left them stranded.  While Trump’s 2016 presidential campaign allegedly confirmed the story, details show that he was not personally involved in transporting any American troops. Trump ran the airline for a short time. In May 1989, he purchased Eastern Airlines for $365 million, renaming it Trump Shuttle. The airline operated short flights in the northeastern United States using a fleet of Boeing 727 airliners. A 2016 fact-check by the Washington Post reported that while some Trump Shuttle planes did transport military personnel around the country in the early 1990s, it was the U.S. military that chartered those flights, not Trump personally. Retired Lt. Gen. Vernon Kondra, who was in charge of all military airlift operations at the time, told the newspaper his notes indicated several references to a 1990-91 contract for Trump Shuttle to carry personnel across the country. He said it would have made little sense if Trump personally arranged the flights and said he was ""certainly not aware"" of him being involved. Trump wasn’t in a position to donate plane rides, anyway. NYC Aviation reported that he had defaulted on his loan in September 1990, and control of the airline went back to the banks until it was sold to US Air. US Air agreed in late 1991 to operate the airline with an option to buy it outright after five years. By April 1992, Trump Shuttle had ceased to exist when it was merged into a new corporation, Shuttle, Inc., which began operating as the USAir Shuttle. Trump’s name does not appear anywhere in the nearly 20-year history of Tower Air, which is mentioned as being owned by Trump in the Facebook post. The airline contracted with the Department of Defense to transport soldiers on charter flights in the early 1990s and was founded by Zev Melamid, Mordechi Gill, Morris Nachtomi and Sam Fondlier in 1982, according to Airline History records.  When Tower Air filed for bankruptcy in May 2000, Nachtomi was listed as its CEO.  To summarize our findings, Trump Shuttle planes were contracted by the U.S. military to transport personnel around the country while the airline was in the process of being sold; it was not under Trump’s control at the time. Trump was not affiliated with Tower Air, which contracted with the Department of Defense in the 1990s to transport soldiers stationed overseas. We rate this Facebook story False.",/factchecks/2020/jan/07/facebook-posts/no-trump-didnt-donate-his-airline-bring-troops-hom/
"['Abortion', 'Immigration', 'Debt', 'Religion', 'Facebook Fact-checks', 'Facebook posts']","
No evidence Jeff Foxworthy is behind this viral Facebook post
","""If you can get arrested for hunting or fishing without a license, but not for entering and remaining in the country illegally — you might live in a country that was founded by geniuses but is run by idiots."" That’s one of many examples in a list posted to Facebook on Nov. 19 and falsely attributed to comedian Jeff Foxworthy. The post was flagged as part of Facebook’s efforts to combat false news and misinformation on its News Feed. (Read more about our partnership with Facebook.)  Foxworthy is famous for his ""You might be a redneck if…"" jokes, but searching online we couldn’t find any credible evidence that he penned this list that touches on abortion, Muslims and federal debt.   Rather, we found users on web forums crediting someone named Fritz Edmunds with the list.  Snopes, which fact-checked this claim back in 2013, also noted that ""the original compiler of this appears to be Fritz Edmunds, who posted it to his ‘Politically True’ blog back in Feb. 3, 2013 (albeit with a disclaimer noting that ‘some of the ideas were from an email that did not contain a copyright’)."" The link to that post is now dead but the url includes the words ""channeling Jeff Foxworthy."" We rate it False.",/factchecks/2020/jan/07/facebook-posts/no-evidence-jeff-foxworthy-behind-viral-facebook-p/
