tags,sub_header,text_body,sources,quote_href
"['National', 'Bipartisanship', 'Congressional Leadership Fund']","
New Jersey's Leonard Lance is bipartisan, at least from this perspective
","Labels like ""conservative"" and ""liberal"" provide a shorthand for understanding political positions. So does ""bipartisan,"" conferring an air of grownup responsibility -- someone who won’t throw flames. A new TV ad from the Congressional Leadership Fund, a super PAC working to elect Republicans, says that GOP Rep. Leonard Lance of New Jersey was ""rated among the most bipartisan in Congress."" The ad seeks to draw a contrast with Lance’s Democratic challenger, Tom Malinowski, a former State Department official for human rights in President Barack Obama’s administration. Although there’s certainly some flame-throwing in this very ad, casting Malinowski as fiercely liberal and Lance as the adult in the room, it raised a good question: Is Lance really that bipartisan? To understand the answer, understand first that labels comes with certain conditions. Here’s how Lance got that label. The Congressional Leadership Fund, which has no formal ties with Lance but wants to keep him in Congress, based its claim on rankings from the Lugar Center and Georgetown University’s McCourt School of Public Policy. They produce rankings of bipartisanship that are not based on single bills or issues -- say, the Affordable Care Act, the Tax Cuts and Jobs Act or gun rights. Instead, they assess the frequency with which a lawmaker sponsors bills that draw support from the opposite political party, and how often a member joins as a co-sponsor of a bill introduced on the other side of the partisan aisle. For all of 2017, Lance ranked 13th most bipartisan in the House of Representatives. When looking at the entirety of the previous Congress, factoring in 2015 and 2016, Lance ranked 75th. While not in the very top tier, it was high, considering the House of Representatives has 435 members (although only 427 were counted because some members served too short a time for the rankings). These ranking do not count ceremonial bills or legislation to name a post office. They also are statistically weighted and standardized for such things political party, so as not to unfairly disadvantage scores of the current party in power. That’s because minority party members generally can’t move legislation without getting a sponsor from the party in power -- and therefore, they could appear to be more bipartisan. But this is just one set of ratings. So we checked others. Interest groups pushing specific agendas show different results, which is natural. For example, the League of Conservation Voters, which supports environmental legislation, says Lance voted for its positions 34 percent of the time in 2017, but he has only a 23 percent lifetime score. The U.S. Chamber of Commerce, promoting a pro-business agenda, gave Lance an 86 percent score in 2017 but a 90 percent cumulative score. FreedomWorks, allied with the tea party movement, gives Lance a score of 44 so far this year, and 47 for 2017. That meant Lance had the highest tea party-related score in 2017 of anyone in the New Jersey delegation. For the sake of perspective, New Jersey isn’t a hotbed of tea party activism, and Lance has at times voted against its positions on taxes and health care. Yet the Tea Party Express recently announced it would endorse him anyway, saying Lance ""has a stellar record of advocating policies that encourage economic growth, job creation, fiscal responsibility and a less intrusive federal government."" Want a different viewpoint? The Planned Parenthood Action Fund, vowing to maintain reproductive and women’s health rights,  gives Lance a rating of only 3 percent this year. The Human Rights Campaign, supporting legislation for LGBT rights, gave Lance a score of 48 for the combined two sessions of the 114th Congress in 2015 and 2016. That was a big leap from his score of 30 in the previous two-year session -- and only 15 in the two years before that. How does Lance stack up in New Jersey itself? GovTrack, a project that gathers data from across the partisan divide, ranked Lance second, not first, for bipartisan leadership in 2017, with Chris Smith, a Republican from New Jersey’s 4th Congressional District, ranked first. Yet the Lugar Center ranked Smith 24th nationally, which is not chopped liver, but it is below Lance’s rank of 13. The explanation: Different groups use different methodologies. We wondered how Congressional Quarterly, which closely follows the votes and actions of every member of Congress, summed up Lance. In a summary last updated in July 2017, Congressional Quarterly said Lance ""is one of about two dozen moderate-to-mildly conservative Republicans, many of them from New Jersey, New York, and Pennsylvania, who wield outsized influence since they can make the difference between victory and defeat for GOP leaders on high-profile legislation."" He doesn't consistently vote with the party. For example, Lance was one of a handful of Republicans who voted against the repeal-and-replace health care bill in 2017 -- and thus, against his party’s position -- saying he worried it wouldn’t fully protect people with pre-existing medical conditions. Lance is also a member of the House Problem Solvers Caucus, a group equally divided between Republicans and Democrats who say they want to find bipartisan solutions to the nation's problems. Yet the website FiveThirtyEight said Lance votes in line with President Donald Trump’s positions 87.1 percent of the time.  How one views Lance can depend on ideology and agendas. There are plenty of partisan votes when he sides with his party, as the interest-group ratings show. Yet he crosses the aisle at times, especially on sponsorships and co-sponsorship, and sometimes on important messaging or substantive bills.  How do we put all this together? The Congressional Leadership Fund did not say Lance was the most bipartisan member but, rather, that he was rated among the most bipartisan. Based on one standard -- sponsorships and co-sponsorships -- he was. Yet it helps to have this additional information, including the views of other rating systems and groups. We rate the claim Mostly True.",[<zip object at 0x0000028097ACDE40>],/factchecks/2018/oct/02/congressional-leadership-fund/new-jerseys-leonard-lance-bipartisan-least-perspec/
"['Congress', 'Florida', 'Rick Scott']","
Fact-checking Gov. Rick Scott's attack on Sen. Bill Nelson for skipping security hearings
","Gov. Rick Scott portrays U.S. Sen. Bill Nelson as an ""empty chair"" who often skips meetings on the important topic of security. ""Nelson skipped 45 percent of the hearings on national security,"" said a TV ad from Scott’s campaign. ""National security! Bill Nelson doesn’t write laws — he doesn’t even show up."" The ad refers to Nelson’s tenure on the Senate Armed Services Committee. Nelson is defending his seat in a close battle with Scott. Attacks for missed hearings are common. But these attacks omit several caveats about committee attendance. ""I have never been one that put much stock in the ‘attendance’ statistics to measure a senator's work"" on the Senate Armed Services Committee, said Arnold Punaro, who served as the committee's Democratic staff director from 1983 to 1997. Scott’s campaign published a spreadsheet showing that between 2001 and 2018, Nelson missed 45 percent (or 284 out of 636) of Senate Armed Service Committee hearings. (He wasn’t on the committee in 2011-12.) The campaign said it counted full committee hearings and subcommittees on which Nelson served and was expected to attend. Nelson’s attendance varied with each two-year congressional session, ranging from 44 percent in 2005-06 to 76 percent for the current 2017-18 session. Scott’s campaign pulled attendance records from the Senate Armed Services Committee website and the Government Printing Office. However, attendance isn’t published for closed or classified hearings. Since there aren’t public attendance records for all types of hearings, that means we don’t get the full picture of Nelson’s service on the committee. Dan McLaughlin, Nelson’s spokesman, said by his count Nelson attended 104 of 126 Armed Services hearings, informal meetings, sessions and briefings — including more than two dozen that were closed or classified — in 2017-18. PolitiFact can’t verify the Nelson campaign’s figures since that includes meetings that lack a public attendance record. Experts on Congress agreed that a straight-up attendance record doesn’t tell us much. ""A hearing about a national security threat, for example, is much more significant than routine budget hearings the (committee) holds every fiscal year,"" said Georgetown University professor Joshua Huder, who studies Congress. It is common for senators, who serve on multiple committees and subcommittees, to miss hearings. Sometimes, multiple committees will hold hearings at the same time, forcing the senator to split their time or prioritize one hearing over another. Roll Call, a Washington publication that regularly covers Congress, wrote in 2014 that unless the senator wields the gavel, he or she may only show up for five minutes, or when it is their turn to ask questions ""The results include guffaw-inducing scenes where even senior lawmakers enter the wrong hearing room, misidentify a witness and question the wrong person on the other side of the dais,"" Roll Call wrote. Scott said Nelson ""skipped 45 percent of the hearings on national security."" The Scott campaign’s data for Nelson’s 16 years on the Senate Armed Services Committee shows he missed 284 hearings out of 636. However, this omits that for some types of hearings there is no publicly available attendance record. This count is not perfect. We rate this statement Mostly True.",[<zip object at 0x0000028097ACAAC0>],/factchecks/2018/oct/01/rick-scott/fact-checking-gov-rick-scotts-attack-sen-bill-nels/
"['National', 'Foreign Policy', 'Trade', 'Donald Trump']","
Has US racked up $2 trillion in trade deficits since NAFTA began?
","During a press event to announce a successor trade pact to the North American Free Trade Agreement, President Donald Trump sought to portray NATFA as a disaster for American trade. ""Since NAFTA’s adoption, the United States racked up trade deficits totaling more than $2 trillion,"" Trump said at the Oct. 1, 2018, event at the White House. (Watch it at about the 20:00 mark.) Is that true? We turned to data for trade in goods with Canada and Mexico published by the U.S. Census Bureau. We totaled up the trade surpluses or deficits with each country between 1994 — the year the agreement was signed — and 2017, the last full year for which data is available. (Reminder: A trade surplus means that exports exceed imports; a trade deficit means that imports exceed exports. It doesn’t literally mean the United States lost $2 trillion.) Here’s the year-by-year summary of the balance of trade of goods with both countries. With one exception, they were all annual deficits. (Mexico is marked in red, while Canada is marked in blue.) If you add it all up, the accumulated U.S. trade deficit with both countries in goods between 1994 and 2017 was $1.97 trillion. Rounded up, that’s $2 trillion. But it’s not a fully comprehensive description. These figures are for goods only — not for goods and services. When Trump has talked as president about trade statistics, he has often referred to the deficit for goods only. That paints the United States’ trade position in a worse light than If the calculation had included services (such as legal or accounting services). We couldn’t find data on services all the way back to 1994, but we’ll use data for 2015, 2016 and 2017 for a sense of how the numbers differ. In each of those years, the United States erased its modest trade deficit in goods with Canada by running a trade surplus in services. The impact of services on the trade balance with Mexico was smaller, but the trade deficit with Mexico typically shrank when services were included. Second, Trump uses this statistic to emphasize the negative impact of NAFTA while minimizing the positive impact. NAFTA certainly had negative aspects for the United States. We recently rated a Trump statement that ""we lost thousands of plants"" due to NAFTA Mostly True. Still, the agreement has had positive impacts as well. For instance, NAFTA increased the amount of U.S. exports to both countries, which in turn produced jobs that didn’t exist before. Here’s a chart showing the level of U.S. exports to Canada and Mexico in 1994 and 2017. ""There are volume benefits to trade under NAFTA,"" said Ross Burkhart, a political scientist specializing in U.S.-Canada relations at Boise State University. ""Exports across NAFTA are one of them. Across the vast majority of U.S. states, Canada remains the No. 1 trading partner both in exports and imports."" It’s also worth noting that the concept of ""exports"" and ""imports"" between NAFTA-member countries has blurred, since partially assembled goods often cross the Canada-U.S. border several times before the final product is assembled, especially in the automobile sector. ""If Ford used to ship engines from a parts plant in Dearborn, Mich., to one in Ypsilanti, Mich., but it now ships those parts to Monterey, Mexico, for assembly into a car or truck that is shipped back to the United States (and if the Ypsilanti assembly plant has closed), then the increase in exports to Mexico has not supported any new jobs,"" said Robert E. Scott, senior economist and director of trade and manufacturing policy research at the Economic Policy Institute, which is skeptical of trade agreements. Various independent estimates have found that the net job losses from NAFTA were modest, with the gains roughly offsetting losses. In general, experts who are favorable to free trade say that arguing over deficits and surpluses misses the point. Specifically, trade deficits stem from demand among U.S. consumers for products that U.S. producers cannot meet, whether that’s because no American company makes the product in question, because American companies aren’t making the product cheaply enough, or because U.S.-produced wares simply aren’t appealing enough to consumers. ""We should be running deficits with some countries and surpluses with others, since comparative advantage will vary, country by country,"" I.M. (Mac) Destler, who teaches at the University of Maryland School of Public Policy, has told us previously. Trump said, ""Since NAFTA’s adoption, the United States racked up trade deficits totaling more than $2 trillion."" The trade deficit is different from the national debt in that it is not money owed to another country in the future. But if you compile the trade deficit for goods alone, Trump is on target. The amount might be smaller once services are factored in. It’s worth noting that this statistic emphasizes the negative impacts of the trade deal but ignores positive impacts, such as significant increases in U.S. exports to both countries. We rate the statement Mostly True.",[<zip object at 0x0000028097A7C4C0>],/factchecks/2018/oct/01/donald-trump/has-us-racked-2-trillion-trade-deficits-nafta-bega/
"['National', 'Elections', 'Congressional Leadership Fund']","
Did Paul Davis vote to allow strip clubs to open nears homes and schools?
","A new ad from the Congressional Leadership Fund, a super PAC working to protect the GOP Majority in the U.S. House, attacks a Kansas congressional hopeful for an incident at a strip club 20 years ago. You bet we wanted to see if the facts here stood up to scrutiny. Democrat Paul Davis is locked in a competitive race with Republican Steve Watkins in Kansas’ 2nd Congressional District, a seat that includes Topeka, Lawrence and the communities west of Kansas City. The ad targets Davis for his alleged involvement in a 1998 strip club drug raid, where he was found in a dark room with a nearly naked woman. ""What’s worse than getting caught at a strip club during a drug bust? Ask Paul Davis."" The ad then claims Davis was found in a VIP room with a woman wearing only a G-string. Then it says, ""Even worse, after Davis was caught with a stripper, he voted to allow strip clubs to open near our homes, churches, schools and even daycare facilities. Shady Paul Davis can’t be trusted."" Here, we are checking the details surrounding the strip club incident, along with the claim that Davis voted to allow strip clubs to operate near places like schools, homes, churches and daycares. The situation involving Davis and a strip club came to light in September 2014 during his bid for governor, which he lost. According to reports, Davis was getting a lap dance in a back room in the late 1990s when cops raided the club in search of drugs. He was not charged with a crime, but police involved in the raid reported he was found in a ""compromising position."" Davis said he ""was at the wrong place at the wrong time."" Independence Police Chief Harry Smith later corroborated Davis’ account that the candidate was not involved in any wrongdoing, or, to his knowledge, the focus of an investigation. He said Davis was questioned briefly before being released. Kelsi Browning, a spokeswoman for Davis’ campaign, told PolitiFact that the ad is based on something that happened 20 years ago when Davis was 26. As a new lawyer, she said, Davis went with his boss to meet an ""unsavory client"" of the law firm. The ad refers to HB 2107, or the Community Defense Act, which was a 2011 state bill that would have prohibited strip clubs and other sexually oriented businesses from being established within 1,000 feet of the property line of an existing one as well as any schools, churches, public parks, residences, libraries or daycare centers. The bill would have also required semi-nude dancers to remain at least 6 feet away from their customers and for sexually oriented businesses to remain closed from midnight to 6 a.m. Davis was one of 28 Kansas House members who voted against the bill, which ultimately failed in the Senate. The Davis campaign says that the legislation was a perennial bill that rarely made it out of committee. When it first came up in 2010, Davis actually voted for the bill before it was struck down in the Senate. It came up again in the 2011 session, but this time, he voted against it. Critics of the legislation, which included Davis, argued at the time that regulating these businesses was best left to cities and counties. Some also questioned taking the time to focus on the issue when the state was facing a massive budget deficit. In a Lawrence Journal-World story around the time of the vote, Davis, who was the House minority leader, was quoted saying that the Legislature was ""probably intruding in areas where we don’t need to be. We’ve got a lot more important things that we need to be dealing with here."" The Congressional Leadership Fund ad says that Kansas U.S. House candidate Paul Davis was caught with a stripper during a drug raid and later voted to allow strip clubs to open near homes, churches, schools and daycares. The ad is piecing together two unrelated issues to draw an unsavory conclusion, while embellishing parts of the story. Davis did not vote to allow strip clubs to open near schools, churches, daycares and the like. He once voted against a measure that would have banned them from opening near these places. He also once voted for the same proposal. The ad’s claim that he was found in a strip club during a drug raid is accurate, but any suggestion he was connected to the drug raid is misplaced. Overall, this claim is partially accurate but takes things out of context. We rate it Half True.",[<zip object at 0x0000028097D7CF80>],/factchecks/2018/oct/01/congressional-leadership-fund/did-paul-davis-vote-allow-strip-clubs-open-nears-h/
"['Elections', 'Texas', 'Karl Rove']","
Karl Rove writes that Democrats abolished state treasurer's office after she won it and she later became senator
","Karl Rove, the Texas-steeped consultant who guided George W. Bush through nearly two terms as governor and two more as president, recently issued a barbed claim about Democrats paying back Kay Bailey Hutchison. Rove, whose clients before Bush bid for governor included Hutchison, writes in his autobiography, “Courage and Consequence, My Life as a Conservative in The Fight”: “Kay Bailey Hutchison was elected state treasurer, succeeding Ann Richards. Democrats then abolished the position, which made me wonder if political payback is about the only grounds on which Democrats abolish government posts. Hutchison later became a U.S. senator.” The book was released March 9. Rove correctly reflects on Hutchison winning election as state treasurer in 1990, succeeding Richards, who won election as governor. However, we're intrigued by Rove’s statements about what happened next: According to him, Democrats then abolished the treasurer’s position. Later, Hutchison was elected to the U.S. Senate. Rove told us he stands by his account. Chronologically speaking, for starters, it's not so: Hutchison won her Senate seat in June 1993 while still serving as state treasurer, and the treasury remained a stand-alone agency after Hutchison left for Washington. Richards appointed an East Texas Democrat, Martha Whitehead, to serve out Hutchison’s term. Whitehead won election in her own right in 1994. So when -- and how -- was the treasurer's job abolished? According to legislative records, the Democratic-majority 1995 Legislature proposed a constitutional amendment abolishing the agency and shifting its operations elsewhere. Contrary to Rove's take, it wasn’t a move backed solely by Democrats. Senate Joint Resolution 1 was authored by Sen. Rodney Ellis, D-Houston, and sponsored in the House by Reps. Mark Stiles, D-Beaumont, and Bill Siebert, R-San Antonio. The proposed amendment cleared the Senate by 23-7 with five Republicans and two Democrats voting ""no"" and the House by 107-18 with several Republicans who voted “no” saying afterward they’d intended to vote “yes,” according to Senate and House journals. Texas voters approved the change by 69 percent to 31 percent in November 1995. And Whitehead--who’d campaigned for election vowing to eliminate the agency—marked her last day in office Aug. 31, 1996 by scraping her name and title off the glass front of the agency’s Austin headquarters. “I am the last treasurer of the State of Texas,” she said. Another Democrat, State Comptroller John Sharp, had proposed the agency’s abolition in a report issued in 1994, after Hutchison was already in the Senate. His report called the treasury a “bureaucracy with an annual operating budget of more than $11 million whose most important tasks are duplicated elsewhere across state government… Consolidating the bulk of the State Treasury's responsibilities with those of the Comptroller's office would cut costs, improve services and maintain accountability. It would also offer Texans the chance to prove that they're serious about reducing the size of their state government.” How does Rove’s statement shape up? As noted, he's correct that Hutchison succeeded Richards as treasurer. But he's wrong about the order of subsequent events, and assigns an unsupported motive—that Democrats abolished the agency because a Republican had its top spot. Some Republicans backed the abolition, too, and it was Hutchison’s Democratic successor whose stint in the office came to a sign-scraping close. We rate Rove’s poor job of retelling history as False.",[<zip object at 0x000002809C3CDCC0>],/factchecks/2010/mar/19/karl-rove/karl-rove-writes-democrats-abolished-state-treasur/
