tags,sub_header,text_body,sources,quote_href
"['Immigration', 'Virginia', 'Donald Trump']","
Donald Trump wrong that Virginia saw 'huge increase' in illegal immigration under Tim Kaine
","Donald Trump depicted Tim Kaine’s 2006-10 tenure as governor of Virginia as a painful time of tax hike proposals and rising unemployment. ""He also oversaw a huge increase in illegal immigration, a tremendous increase,"" Trump told supporters at an Aug. 20 rally in Fredericksburg. We wondered whether Trump was correct that, under Kaine’s governorship, illegal immigration spiked. We emailed the Trump campaign twice to ask about the basis of his statement, but we did not hear back. The GOP presidential nominee’s campaign posted a version of his speech online that includes a footnote to support his claim. It’s a 2007 editorial in The Washington Times that accused Kaine of failing to crack down on unauthorized immigrants who commit crimes. But the editorial provides no insight into whether the number of illegal immigrants in the state rose during Kaine’s tenure. For additional insight, we reached out to the nonpartisan Pew Hispanic Center, which estimates the size of the illegal immigration population in each state. Here are Pew’s figures on the size of Virginia’s illegal immigrant population by year: •2005 - 250,000 •2006 - 250,000 •2007 - 250,000 •2008 - 275,000 •2009 - 250,000 •2010 - 275,000 For 2011 and 2012, the latest years for which figures are available, the size of the illegal immigrant population also was 275,000, Pew found. So when Kaine entered office in 2006, the size of the illegal immigrant population was 250,000, it rose to 275,000 in 2008 and then went back down to its original level during 2009, his last full year in office, according to the Pew figures. If you go to 2010, during which Kaine served only the first two weeks, the illegal immigrant population was 275,000 - or 25,000 higher than when he entered the governor’s mansion. While a 10 percent increase in the illegal immigrant population between 2006 and 2010 might seem significant, it’s actually not much of a change at all from a statistical perspective, said Jeffrey Passel, a senior demographer at Pew. Passel explained that the research group’s illegal immigration figures are not meant to be exact figures on the size of the state’s illegal immigrant population. Rather, they are estimates culled from a sample of data collected by the Census Bureau and are subject to rounding. Just like a public polls drawn from a sample, there’s a margin of error involved in the estimates. During Kaine’s time in office, the annual size of the illegal immigrant population could be 15,000 to 20,000 higher or lower than the mid-range estimate Pew reported each year, according to its report. So it’s possible that a 25,000 increase from year-to-year might not outpace the Pew study’s margin of error. The bottom line, during Kaine’s tenure the size of the illegal immigrant population remained flat, Passel said. Nationally, the illegal immigrant population peaked in 2007 at 12.2 million and fell to 11.3 million in 2013, Pew’s figures show. A major reason for that drop was the impact of the Great Recession, Passel told us. The Trump campaign didn’t respond to a question we posed about how Kaine’s policies as governor would have led to an increase in illegal immigration. Analysts told us that beyond state laws, many other factors contribute to where illegal immigrants choose to reside. Michelle Mittelstadt, a spokeswoman for the Migration Policy Institute, told us illegal immigrants often settle in a state based on how its economy is doing, and whether they already have family living there. Our ruling Trump said that while Kaine was governor, he ""oversaw a huge increase in illegal immigration, a tremendous increase."" But figures from the Pew Hispanic Center show that the size of the illegal immigrant population essentially was flat during Kaine’s term as governor. It’s certainly not the ""huge"" and ""tremendous"" increase that Trump makes it out to be. We rate his claim False. https://www.sharethefacts.co/share/10bcb296-66a2-4ad7-a60d-b53e86eecc3c",[<zip object at 0x000002809C2D2B40>],/factchecks/2016/aug/29/donald-trump/donald-trump-wrong-virginia-say-huge-increase-ille/
"['National', 'Crime', 'Reince Priebus']","
Did Hillary Clinton call African-American youth 'superpredators?'
","In response to Donald Trump calling Hillary Clinton a ""bigot"" this week, GOP chairman Reince Priebus reminded people that Hillary Clinton once referred to African-American youth as ""superpredators.""   Priebus took a swing at Hillary Clinton’s past, telling NBC’s Meet the Press host Chuck Todd that her actions say a lot about her, adding ""she’s the one that labeled African-American youth as ‘superpredators’."" Trump, who is looking to increase his appeal among African-American voters, made the same ""superpredator"" claim days earlier on Twitter.  It didn’t take long to find what Trump and Priebus were referencing, but for this fact-check, we wanted to take a close look at the full context of Clinton’s remark. ‘Superpredators’ in context The ""superpredators"" line comes from a 1996 speech in New Hampshire, where Clinton spoke in support of the 1994 Violent Crime Control and Law Enforcement Act, which her husband, Bill Clinton, had signed in to law. ""We’re making some progress,"" Clinton said. ""Much of it is related to the initiative called ‘community policing.’ Because we have finally gotten more police officers on the street. That was one of the goals that the president had when he pushed the crime bill that was passed in 1994."" Provisions of the act included a ban on some assault weapons, more funding for community policing and an expansion of the death penalty. The legislation, which was championed by Bill Clinton as a way to reduce the number of African-Americans being killed in drug-related incidents, has drawn criticism in recent years for sending disproportionate numbers of African-Americans to prison. The ""superpredator"" remark, which Priebus and Trump referenced, was in the same speech a few lines later. ""But we also have to have an organized effort against gangs,"" Hillary Clinton  said in a C-SPAN video clip. ""Just as in a previous generation we had an organized effort against the mob. We need to take these people on. They are often connected to big drug cartels, they are not just gangs of kids anymore. They are often the kinds of kids that are called superpredators — no conscience, no empathy. We can talk about why they ended up that way, but first, we have to bring them to heel."" The full context of this incident does link children and superpredators, but nowhere in the speech does she directly label African-American youth this way. However, backlash from this speech has followed Clinton into this year’s election. Two Black Lives Matter activists confronted Clinton at a private fundraiser in February, telling the candidate she owes black people an apology. One day after this confrontation, Clinton released a statement to the Washington Post’s Jonathan Capehart, expressing regret for her word choice. ""Looking back, I shouldn't have used those words, and I wouldn't use them today,"" she said. Later in the election cycle, former Democratic opponent, Bernie Sanders, also criticized her language at a debate in Brooklyn. When Sanders was asked by debate moderator why he called out Bill Clinton out for his defense of Clinton’s use of the term ""superpredator,"" Sanders responded, ""Because it was a racist term, and everyone knew it was a racist term."" Our ruling Priebus said Hillary Clinton is ""the the one that labeled African-American youth as superpredators."" Clinton — in the midst of championing her husband’s 1994 crime legislation — did use the term ""superpredator"" when referring to ""gangs of kids."" She did not specifically label superpredators as African-American, but the context of her speech and her subsequent apology decades later suggests it was a reasonable inference. Priebus’ claim is accurate, but needs some clarification, so for that reason we rate his statement Mostly True.",[<zip object at 0x0000028096B15680>],/factchecks/2016/aug/28/reince-priebus/did-hillary-clinton-call-african-american-youth-su/
"['Candidate Biography', 'PunditFact', 'David Plouffe']","
Yes, Donald Trump donated $100,000 to the Clinton Foundation
","As Donald Trump amps up attacks on the Clinton Foundation, Democrats are pointing out that Trump himself has given to the nonprofit he now calls a pay-to-play operation. Recently released emails between Hillary Clinton’s aides when she was secretary of state and officials at the Clinton Foundation have demonstrated that some foundation donors did get access to Clinton, though there’s no evidence of direct favors. Addressing the topic on NBC’s Meet the Press, Barack Obama’s former campaign manager David Plouffe noted the Clinton Foundation’s work on HIV/AIDS and malaria and Trump’s own ties to the charity. ""The Clinton Foundation, I think it’s a universal agreement, has done remarkable work around the world. I think Donald Trump himself contributed $100,000 to the foundation,"" he said. Plouffe is right that Trump gave at least $100,000 to the foundation, a fact that Trump and his campaign readily admit. One caveat: It appears that the money came through Trump’s own foundation, not directly from Trump. The Clinton Foundation lists Donald J. Trump as a contributor with a cumulative lifetime donation amount between $100,001 to $250,000. It’s not clear if Trump himself made a personal contribution, but tax forms show that the Donald J. Trump Foundation (which Trump controls) donated $100,000 to the foundation in 2009 and reserved a table at the Clinton Foundation gala for $10,000 in 2010.   Trump’s daughter Ivanka is also listed as a donor who gave between $5,001 and $10,000 and her father-in-law, Charles Kushner, gave between $250,001 and $500,000. Trump’s gift amount places him in the top 0.2 percent of the foundation’s donors. Most of its 300,000 donors (85.5 percent) gave less than $250. Breaking it down by dollar amount, however, Trump’s total contribution isn’t that big. We estimated that the foundation has received at least $800 million in donations, over 70 percent of which came from gifts of $1 million or more. In 2009, the Trump Foundation gave $926,750 to some 40 organizations (page 18). The Clinton Foundation received one of the largest gifts that year, matched or surpassed only by the Arnold Palmer Medical Center Foundation ($100,000), the New York Presbyterian Hospital ($125,000) and the Police Athletic League ($156,000). Altogether, the Trump Foundation has donated $5.5 million to 298 charities between 2009 and 2013 according to the nonprofit’s tax forms, Forbes found. Trump did not make any personal contributions to his foundations during this time. (Money for the Trump Foundation in these years came from others and from investment income.) Trump doesn’t deny that he donated to the Clinton Foundation that he now calls a criminal enterprise. During the first GOP primary debate in August 2015, Trump voluntarily brought up his giving to the Clinton Foundation when asked about his previous donations to Hillary Clinton. ""When they call, I give. And you know what? When I need something from them two years later, three years later, I call them, they are there for me,"" Trump said. ""With Hillary Clinton, I said be at my wedding, and she came to my wedding. You know why? She didn’t have a choice, because I gave. I gave to a foundation that, frankly, that foundation is supposed to do good. I didn’t know her money would be used on private jets going all over the world."" For the record, the Clintons did attend Trump’s third wedding to Melania Knauss, but that occurred in 2005, four years before the $100,000 donation. A few months later, Trump gave pretty similar answers when he was asked to explain the Forbes article on his charitable giving record in late January. ""I did give to the Clinton Foundation. What I didn't know is they'd be using it for private aircraft and things like that. The Clinton Foundation was helping with Haiti and with lots of other things and I thought it was going to do some good work. So, it didn't make any difference to me,"" he said on Jan. 31’s Fox News Sunday. ""Again, I was a businessman and it was my obligation to get along with everybody, including the Clintons, including Democrats and liberals and Republicans and conservatives."" Our ruling Plouffe said, ""Donald Trump himself gave $100,000 to the Clinton Foundation."" Tax records show the Donald J. Trump Foundation gave $100,000 to the Clinton Foundation in 2009, and spent an additional $10,000 for a table at a Clinton Foundation gala the following year. The Clinton Foundation also lists Donald J. Trump (as well his daughter Ivanka and Ivanka’s father-in-law) as a contributor. It’s important to note that Trump made the donation through his foundation, not out of his personal income. But Trump himself acknowledges the donation. We rate Plouffe’s statement Mostly True. https://www.sharethefacts.co/share/552526f7-e5b8-4ccb-9206-517f0a5819f7",[<zip object at 0x000002809BFFD740>],/factchecks/2016/aug/28/david-plouffe/yes-donald-trump-donated-100000-clinton-foundation/
"['Polls and Public Opinion', 'States', 'Texas', 'Sean Hannity']","
Sean Hannity incorrect that 'all of Texas' conservative save a bit of Austin
","Sean Hannity, the Fox News host, took note of a brief protest during the Austin taping of his Aug. 23, 2016, interview of Donald Trump by characterizing the state’s politics. ""All right,"" Hannity said amid shouts, ""all of Texas is conservative, except a little bit of Austin."" Without question, Austin largely tilts left. At the time Hannity spoke, Travis County had no countywide elected Republicans while its Texas House delegation consisted of five Democrats and one Republican. In 2012, President Barack Obama carried 60 percent of the county’s vote to Republican Mitt Romney’s 36 percent. We focused on Hannity’s larger point — that the rest of Texas is conservative. In Hannity’s favor: No Democrat has won statewide since 1994 (when Democrats won five of 10 statewide non-judicial races). Also, no Democratic presidential nominee has captured the state since Jimmy Carter edged Gerald Ford by 129,019 votes in 1976 (a November so long ago that Donald Trump was only 30 and and Hillary Clinton had just turned 29). Statewide in 2012, Romney beat Obama by more than 1 million votes, carrying 57 percent to Obama’s 41 percent, leaving Texas pretty darned red, per this Politico map:    SOURCE: ""Election Special, 2012 Texas Presidential Results,"" Politico, last updated Nov. 19, 2012 But contrary to Hannity’s statement, Austin wasn’t the only blue dot on the 2012 map. Obama won much of the traditionally stalwart-Democratic border region including El Paso County plus the urban counties of Bexar (home to San Antonio); Dallas; Harris (home to Democrat-dominant Houston); and Jefferson (home to union-strong Beaumont). Two years later, Republican Greg Abbott trounced Democrat Wendy Davis for governor, doing well nearly everywhere outside the Mexico border region. Politico’s map (below) shows that beyond border counties, Davis outpolled Abbott only in Travis and Dallas counties.  SOURCE: ""2014 Texas Governor Election Results,"" Politico, update Dec. 17, 2014 (accessed Aug. 25, 2016) Otherwise, meantime, Democrats show some local strengths--and not only in Austin or near Mexico. As of August 2016, when Hannity spoke, Dallas County’s judge (the county’s top executive position) was Democrat Clay Jenkins while five other countywide officeholders, including Sheriff Lupe Valdez, were Democrats, per the county’s Democratic Party. District Attorney Susan Hawk was the sole Republican in a countywide elected post. In contrast, neighboring Tarrant County, home to Fort Worth, remained a Republican stronghold; by our count, per a county Republican Party list, Republicans held all six countywide elected posts. Also, the state’s most-populous county, Harris, had just one Democrat in a major countywide post--Vince Ryan, the county attorney. Ryan won re-election in 2012 along with another Democrat, Sheriff Adrian Garcia. Garcia resigned in 2015 to bid for mayor and he was replaced with a Republican, Ron Hickman, who seeks re-election in November 2016. Bexar County, meantime, had a longtime Democratic leader as county judge, Nelson Wolff, as well as Democrats Albert Uresti, the tax assessor-collector, and Nicholas ""Nico"" LaHood, the county’s criminal district attorney. Then again, voters also had in place a Republican sheriff, Susan Pamerleau, seeking a second term in 2016; a Republican county clerk, Gerard ""Gerry"" Rickhoff, who’d held the office for more than two decades; and a Republican district clerk, Donna Kay McKinney. We also asked the state parties to assess Hannity’s claim, which by email Mike Joyce of the Republican Party of Texas called ""fair."" Manny Garcia of the Texas Democratic Party noted Democratic gains in some parts of the state and pointed out that when Texas voters participating in a June 2016 University of Texas poll were asked to place themselves on a seven-point scale running from extremely liberal to extremely conservative, 39 percent chose ""in the middle."" Otherwise, 18 percent self-identified as liberal, 44 percent as conservative. Our ruling Hannity said: ""All of Texas is conservative except a little bit of Austin."" If Hannity had solely singled out the state's many rural and suburban counties, he'd have a point. However, the state’s border counties and biggest cities (not just Austin) lean Democratic while the UT poll showed the majority of all voters self-identify as something other than conservative. We find this ""all"" claim False. FALSE – The statement is not accurate. Click here for more on the six PolitiFact ratings and how we select facts to check. https://www.sharethefacts.co/share/302cffe5-cc74-4ce3-a60d-3f143864676d",[<zip object at 0x000002809754BC40>],/factchecks/2016/aug/26/sean-hannity/sean-hannity-incorrect-all-texas-conservative-save/
