tags,sub_header,text_body,quote_href
"['City Government', 'Ethics', 'Texas', 'Dave Claunch']","
Mayor Dave Claunch says Austin has more Capitol lobbyists than any other Texas city
","Texas cities naturally gear up to fight state encroachment by enlisting lobbyists, an Austin-area leader said. At a January West Lake Hills City Council meeting, where the council voted to hire a lobbying firm for $40,500 over nine months, Mayor Dave Claunch said employing lobbyists is a way for cities to preserve local control. Claunch went on to say: ""Austin has more lobbyists working for it than any other municipality in Texas, mostly because they are frequently a target of the Legislature."" Is Austin No. 1 among Texas cities in its load of lobbyists patrolling the Capitol? Claunch, asked how he reached his conclusion, said by phone that's just ""common general knowledge."" Checking lobbyist registrations For our own look, we turned to state filings by lobbyists. The Texas Ethics Commission has the responsibility of maintaining records including lobbying activity reports. Under state law, lobbyists are required to register with the commission and list their clients annually; the filings are available online. By phone, Natalia Ashley of the Texas Ethics Commission staff said whenever a lobbyist gets a client, he or she must amend their registration. When this happens, the agency’s public lobbyist-client lists are updated, she said. And when there is an update, she said, the new breakdown replaces the previous version posted online, ""so we don’t keep a printed document for each update."" Still with us? This was significant for our purposes, we realized, because a lobbyist-client list for 2015 about the moment Claunch spoke wasn’t readily available to us a few days later. By the time we inquired, that particular list had been overtaken online by updated versions possibly presenting information that would not have existed when Claunch spoke. To fairly check his claim, then, we considered a next-best thing, the agency’s lobbyist-client list for cities covering 2014. And according to that 2014 Lobby List, updated by the state Jan. 9, 2015, the City of Austin had 22 state-registered lobbyists in 2014, a total greater than the count shown for any of 89 other municipalities. The City of Irving, between Dallas and Fort Worth, came in second with 13. West Lake Hills had four people registered. Top 5 Texas Cities Based on Number of Registered Outside Lobbyists (2014) CITY STATE-REGISTERED LOBBYISTS Austin 22 Irving 13 Fort Worth 10 Houston 9 San Antonio 9 Source: Texas Ethics Commission, 2014 Lobby List with Concerns (Employers and Clients), Jan. 9, 2015 (downloaded Feb. 4, 2015) A complication? We wondered if those reported counts made this a slam-dunk claim. Possibly not, a City of Austin official suggested. John Hrncir, a city governmental relations officer, told us that even though 22 people were listed as lobbying for the city in 2014, he directly consulted with less than half that many. Similarly, a City of San Antonio official said by phone the number of lobbyists shown in state filings as representing that city do not reflect the lobbyists he regularly consults. Jeff Coyle, San Antonio’s director of intergovernmental relations, said he communicates actively with about four or five of San Antonio’s nine contracted lobbyists. Brie Franco, legislative attorney for the City of El Paso, said by phone that she talks directly to three of the four lobbyists listed as representing the city in state records. El Paso hired the firm Focused Advocacy to represent its interests in the legislative session, the same firm enlisted by West Lake Hills. Hrncir said that when a lobbying firm tells the ethics commission its clients and expected payments, the firm may specify all employees with any possibility of doing work on behalf of the city. We ran Hrncir’s analysis by Jack Gullahorn, president of the Professional Advocacy Association of Texas, which says it’s the only recognized statewide association for the lobby and government affairs community. By phone, Gullahorn said Hrncir was correct and added that the entirety of lobbyists in a firm routinely register for all of the clients listed underneath the firm even though someone at the practice may be the primary contact. Lobbyists do this ""to be conservative in following the law,"" Gullahorn said, by ensuring they don’t get in trouble with the state if someone is found lobbying for the city without reporting that in advance. According to an ethics commission report on laws affecting lobbyists, each lobbyist must provide information about each client  that employs, retains or reimburses them to lobby. Spending on lobbyists It’s one thing for Austin to have the most lobbyists indicating they’re out there walking the pink building on its behalf. We also looked into how the city stacks up in spending on contract lobbyists at the Capitol. According to a resolution approved without debate at the Austin City Council’s Nov. 20, 2014, meeting, council members agreed to contract with 10 lobbying firms for the 2015 legislative session for an amount not to exceed $805,000 all together. But there were a couple changes after that, Hrncir said, because lobbyists Randy Erben and Luis Saenz joined the administration of Gov. Greg Abbott. Hrncir said the city made an individual contract with Brian Yarbrough, Erben’s previous partner. Jennifer Rodriguez from McGuireWoods Consulting was to assume Saenz’s role on the city’s part, Hrncir said. Lobby Firms Hired by City of Austin Before 2015 Legislative Session FIRM MAXIMUM AMOUNT THE FIRM OR LOBBYIST EXPECTS FROM THE CITY FOR LOBBYING Nora Del Bosque $65,000 Randall Erben*/Erben & Yarbrough $90,000 Marta Greytok Consulting $90,000 Cliff Johnson $90,000 Demetrius McDaniel/GreenbergTaurig $90,000 Clayton Pope $90,000 Luis Saenz*/McGuireWoods Consulting $70,000 Trent Townsend/Imperium Public Affairs $65,000 Joe D. Valenzuela $65,000 Angelo Zottarelli/Adams & Zottarelli, LLC $90,000 TOTAL $805,000 *Erben and Saenz were appointed in December 2014 to be legislative director and appointments director, respectively, for Gov. Greg Abbott, with their duties hence shifted by the city to others, according to John Hrncir, a city governmental relations officer.  Source: City of Austin web page, ""Resolution No. 20141120-036,"" adopted by Austin City Council, Nov. 20, 2014 (accessed Feb. 4, 2015)  According to lobbyist filings with the commission covering 2014, Austin also was No. 1 in expected spending on lobbyists at the Texas Capitol. To approximate the amount city-hired lobbyists expected to be paid during 2014, we noted the minimum values and maximum values of prospective compensation reported by all the lobbyists listed for each of the five cities already having the most outside lobbyists for the year. In this subset, Austin was No. 1 again (as noted) but Irving, which had more lobbyists than Houston and Fort Worth, was evidently outspent by bigger cities. Projected Ranges of Compensation for City Lobbyists in Texas (Sampling)* 2014 City Projected Range of Compensation of Lobbyists Registered to Represent City Austin Up to $575,000 - $1,050,000 Fort Worth Up to $225,000 - $445,000 Houston Up to $345,000 - $420,000 Irving Up to $215,000 - $340,000 San Antonio Up to $145,000 - $280,000 *This chart reflects projected compensation amounts to lobbyists hired by only the five cities with the most outside lobbyists per commission filings in 2014. Source: Texas Ethics Commission, 2014 Lobby List with Concerns (Employers and Clients), Jan. 9, 2015 (Feb. 6, 2015) Our ruling Claunch said: ""Austin has more lobbyists working for it than any other municipality in Texas."" In 2014, indeed, Austin had more lobbyists (22) representing its interests before state government than any other Texas city and also was expected to spend more on such lobbyists than a few other cities identified as clients by multiple lobbyists. But lobbyist filings with the state don’t reveal how much time any lobbyist puts in for a particular client. It's possible, for instance, that some lobbyists who registered for Austin worked for firms hired by the city but didn’t personally put in time on its behalf. We rate this statement, which has a tinge of uncertainty, Mostly True. MOSTLY TRUE – The statement is accurate but needs clarification or additional information. Click here for more on the six PolitiFact ratings and how we select facts to check.",/factchecks/2015/feb/16/dave-claunch/mayor-dave-claunch-says-austin-has-more-capitol-lo/
"['Environment', 'Energy', 'PunditFact', 'Center for Western Priorities']","
Conservation group: Oil firms can lease federal land for less than the price of a Big Mac
","Doubts that Washington is getting as much money as it should when it leases land to oil and gas companies go back 40 years. The decades have done little to ease those concerns. In 2013, the Government Accountability Office reported that in the year before, oil and gas companies took in revenues of $66 billion and paid $10 billion to the government. Onshore leases in particular have not kept pace with the times, according to the GAO. The conservation group Center for Western Priorities took up this banner with an intriguing comparison on its website. ""Oil companies can obtain an acre of public land for less than the price of a Big Mac,"" the center wrote. The going price for a Big Mac, without the fries and the drink, is $3.99. We decided to check whether you can lease an acre of federal land for less than that. Greg Zimmerman, the policy director at the Center for Western Priorities, sent us a link to a September 2014 sales report from the Nevada office of the Bureau of Land Management. The numbers back up Zimmerman’s claim. Texas-based Appaloosa Energy paid $6,426 for the rights to drill on 3,212 acres. Buena Vista Holdings out of Colorado paid $11,392 for the rights to 5,693 acres. That comes out to $2 per acre, and even the mathematically challenged can see that is about half the price of a Big Mac. Under BLM regulations, $2 per acre is the minimum possible bid. Just to be clear, the company pays this money each year for the right to pump oil or gas from the land over a 10-year period. It doesn’t actually own the land, but it has locked down the oil and gas rights. Zimmerman acknowledges that there is another wrinkle here. There’s an additional $1.50 per acre fee for the first five years. Zimmerman described it as the cost to hold the land while the company assesses what to do with it. A BLM spokesman told PunditFact that the bidder would pay $1.50 per year for the first five years and then $2.00 a year for the next five. ""Nevertheless, even if you add the $1.50 per acre rent to the $2.00 per acre bid, it would still be less than a Big Mac,"" Zimmerman said. If the land ever starts producing oil or gas, the company starts paying royalties to the government on top of the $2 per acre leasing fee. It’s important to note that the statement simply said oil companies can obtain an acre for very little money. It doesn’t say this happens a lot. When we ran the numbers for all of 2014, we found that the average price per acre nationwide was $220. That was for parcels leased through a competitive auction. If a parcel finds no takers through competitive bidding, the government can offer it non-competitively. One time, that led to a winning bid of about $1.50 per acre. From what we could find, the lowest lease prices were all in Nevada. Brad Posey is a managing director for Appaloosa Energy, a company that successfully secured the right to a few thousand acres at a cost of $2 each. Posey said the property comes with many hurdles before any wells can be drilled. ""That land has so many restrictions on it,"" Posey said. ""There are the prairie chickens, and habitat. A very limited portion can be explored on."" Posey is correct about the land. A proposed resource management plan for the entire area puts a number of conditions on development. It protects municipal water supplies, grazing areas and trails for off-road trail riding. And animals. ""These areas contain some of the most important habitat remaining for sage-grouse and other at-risk wildlife,"" the plan said. Posey called the venture ""pure wildcat speculation."" This raises the question, if it’s such a long shot, why is the land worth even $2 an acre? Because, as another Appaloosa managing director Martin Shields explained, sometimes an unpromising bit of land surprises you. ""Many years ago, I was with a company that paid the $2 minimum and it paid off,"" Shields said. We asked Zimmerman if he knew of any land that went for $2 an acre that ever produced oil or gas. Zimmerman said he did not know of any case when it did. Our ruling The Center for Western Priorities said that oil companies can obtain an acre of public land for less than the price of a Big Mac. A Big Mac goes for $3.99. Thousands of acres of land in Nevada were leased for $2 per acre in 2014. We found one case where federal land went for about $1.50 an acre. The track record on land leased at those low rates ever producing oil or gas is quite poor and the average leasing price nationwide is $220 per acre. The claim is accurate but it downplays that companies pay a hundred times as much for land that is more likely to be productive. We rate the claim Mostly True.",/factchecks/2015/feb/16/center-western-priorities/conservation-group-oil-firms-can-lease-federal-lan/
"['Crime', 'States', 'Women', 'Guns', 'Virginia', 'Lori Haas']","
Haas says fewer women killed by guns in states with expanded background checks
","Closing a loophole in state law that allows some Virginians to buy firearms without going through a background check is a matter of life and death to women, according to Lori Haas, state director of the Coalition to Stop Gun Violence. Haas was among a number of gun control advocates who spoke at a news conference last month in favor of a series of bills aimed at tightening state firearm laws. Haas has compelling experience with gun violence: Her daughter, Emily, was grazed twice in the head during the 2007 shootings at Virginia Tech that left 32 dead and 17 wounded. Her brief remarks touched on background check laws. All states require licensed gun dealers to conduct a background check before selling a firearm to make sure the prospective buyer does not have a criminal record or disqualifying mental condition. But Virginia and 32 other states don’t require background checks for firearms bought through an unlicensed seller -- someone who isn’t in the routine business of selling guns. Haas backed a bill that would have  narrowed that exception. In states that run background checks for privately-sold handguns, ""49 percent fewer women are shot and killed,"" she said. Since Haas spoke, the General Assembly has scuttled major gun control bills, including the loophole closer. But background checks for all gun buyers is a perennial issue before the legislature and we wondered whether Haas’ statement was correct in terms of the number she used and the cause and effect of background check laws on women’s lives. She told us the figure came from Everytown for Gun Safety, an advocacy group founded by former New York City Mayor Michael Bloomberg. The numbers The group issued a report last September examining firearm homicides of women by intimate partners -- current and former husbands, as well as boyfriends. It found that from 2008-2012, the rate of such murders was 46 percent lower in 14 states that had background checks for some or all private handgun sales when compared with the rest of the nation. Stacey Radnor, a spokeswoman with Everytown, said the group also found that the level of non-gun intimate partner homicides of women was much less stark -- only 4.3 percent lower in the states with private-sale background checks for handguns. We should note, however, that Haas’ statement focused on a broader definition of victims.  She cited ""women"" without any reference to whether they were domestic violence victims. So to examine her exact statement, we needed to find figures on gun murders deaths of all women, which are not in Everytown’s report. The Centers for Disease Control and Prevention compiles fatality data based on information from death certificates filed in each state. We looked at the 14 states that had background checks on private handgun sales during the 5-year period Everytown references. Those states are California, Connecticut, Hawaii, Illinois, Iowa, Maryland, Massachusetts, Michigan, Nebraska, New Jersey, New York, North Carolina, Rhode Island and Pennsylvania. Three other states have in recent years added private-sale background checks: Colorado, Delaware and Washington. We found those firearms homicide figures of women for all but three states with small populations -- Rhode Island (which requires a background check for private handgun sales) as well as Vermont and Wyoming (which do not). The CDC withholds the number of firearms homicides of women in those states because they are so few in number. But given the small size of each state’s population, it wouldn’t affect the overall trend line for the 47 other states where the information was available. We found that in states with private-sale background checks, the rate of firearm homicides of females age 18 and over was 1.0 per 100,000 women. In the states that didn’t extend background checks to private handgun sales, the homicide rate was 1.6 per 100,000 women in that age group. That means there were 38 percent fewer firearms homicides of women in the states with private-sale background checks for handguns than the rest of the nation, lower than Haas’ statistic but still a significant figure. In Virginia, the rate was 1.4 per 100,000 women. We should note some states without background checks on all handgun sales bucked the trend of lower firearms violence against females. Minnesota, which has no requirement for background checks on private handgun sales, had a rate of 0.6 firearms homicides for every 100,000 women. That was one-third the rate of North Carolina, which requires a background check of anyone seeking to buy a handgun. Cause and effect Two analysts we contacted urged caution in interpreting a correlation in lower rates of gun violence to private-sale background checks. ""Making causal claims is always riskier,"" Jacquelyn White, a psychology professor at the University of North Carolina Greensboro, said in an email. ""States that require background checks may also be more likely to support other efforts that contribute to the well-being of their residents. Remember, correlation is not causation. There may be other factors, such as a more enlightened commitment to creating healthy and safe communities, that result in an array of programs and policies that reduce domestic violence."" Gary Kleck, a criminology professor at Florida State University, said Everytown’s figure ""takes no other account of any other factors that affect homicides."" ""States do not randomly pass gun laws -- those that pass gun laws are different in many ways from those that do not,"" Kleck, who has studied the impact of background checks on homicide rates, said in an email.  ""For obvious political reasons, it’s easier to enact stricter gun laws in states with fewer gun-owning voters. Thus, states that extended background checks to private gun transfers had lower gun ownership rates even before those laws were passed. Likewise, states with stricter gun laws are more urban, less likely to be Southern or Western (and thus culturally different), more politically liberal etc. You can’t isolate the effect of a gun law without controlling for other violence-related factors."" Our ruling Haas said in states with comprehensive background checks for handguns, ""49 percent fewer women are shot and killed."" She supports that statement by pointing to figures examining a narrower group of female firearms victims -- those killed in domestic violence situations. But figures examining the broader group of victims she cited in her statement -- women in general -- show 38 percent fewer women were shot and killed in the states with private-sale background checks on handgun sales. That’s not quite high as the figure she cited, but it still represents a lower rate of gun homicides of women in states with comprehensive background checks. But experts cautioned against reading too much into that correlation. They noted that there may be other factors beyond background checks that led to that result. We rate her claim Half True.",/factchecks/2015/feb/16/lori-haas/haas-says-fewer-women-killed-guns-states-expanded-/
