tags,sub_header,text_body,sources,quote_href
"['National', 'Health Care', 'Barack Obama']","
Obama has praised single-payer plans in the past
","
At a town hall meeting in Portsmouth, N.H., President Barack Obama was asked about his support of a ""universal"" health coverage and whether his plan would result in the government taking over health care.
 
In his answer, Obama made a point that caught our attention: ""I have not said that I was a single-payer supporter,"" Obama said.
 
That raised some eyebrows here in the PolitiFact newsroom because we recently spent a fair amount of time analyzing Obama's statements on single-payer. Before we delve into that, here's the exchange in Portsmouth:
 
Question: ""Mr. President, you've been quoted over the years — when you were a senator and perhaps even before then — that you were essentially a supporter of a universal plan. I'm beginning to see that you're changing that.  Do you honestly believe that? Because that is my concern.  I'm on Medicare, but I still worry that if we go to a public option, period, that the private companies, the insurance companies, rather than competing — because who can compete with the government; the answer is nobody.  So my question is do you still — as yourself, now — support a universal plan?  Or are you open to the private industry still being maintained?""

 

Obama: ""Well, I think it's an excellent question, so I appreciate the chance to respond.  First of all, I want to make a distinction between a universal plan versus a single-payer plan, because those are two different things. 

 

""A single-payer plan would be a plan like Medicare for all, or the kind of plan that they have in Canada, where basically government is the only person — is the only entity that pays for all health care.  Everybody has a government-paid-for plan, even though in, depending on which country, the doctors are still private or the hospitals might still be private.  In some countries, the doctors work for the government and the hospitals are owned by the government.  But the point is, is that government pays for everything, like Medicare for all.  That is a single-payer plan.
 
""I have not said that I was a single-payer supporter because, frankly, we historically have had a employer-based system in this country with private insurers, and for us to transition to a system like that I believe would be too disruptive.  So what would end up happening would be, a lot of people who currently have employer-based health care would suddenly find themselves dropped, and they would have to go into an entirely new system that had not been fully set up yet.  And I would be concerned about the potential destructiveness of that kind of transition.
 
""All right?  So I'm not promoting a single-payer plan."" (His answer continued at some length as he explained his plan. You can read the full transcript of the town hall

here

.)
 
We see two major points that contradict Obama's statement in different ways.
 
First, at several town halls this year, Obama has been asked by single-payer

supporters

why he doesn't propose a single-payer system. Obama's consistent answer has been that if he were designing a health care system ""from scratch,"" he would go with a single payer system. So that certainly indicates philosophical support for the idea, even if Obama has also consistently concluded that single-payer is not politically feasible.
 
But there's also the matter of a

YouTube video

from June 2003, when Obama was a state senator in Illinois and a longshot candidate for the U.S. Senate. Back then, he plainly indicated he supported a single-payer system.
 
""I happen to be a proponent of a single-payer universal health care program,"" Obama said. ""I see no reason why the United States of America, the wealthiest country in the history of the world, spending 14 percent of its gross national product on health care, cannot provide basic health insurance to everybody. And that's what Jim is talking about when he says everybody in, nobody out. A single-payer health care plan, a universal health care plan. That's what I’d like to see. But as all of you know, we may not get there immediately. Because first we've got to take back the White House, we've got to take back the Senate, and we've got to take back the House.""
 
We previously delved into this video in great — some might say excruciating —  detail, even discovering the identity of ""Jim."" You can read more about the politics of health care in Illinois from that time by reading our complete item, ""

Obama statements on single-payer have changed a bit.

""
 
Suffice to say, Obama's public remarks and statements have moderated since 2003.


In other statements, Obama has spoken favorably of single-payer in concept, but always adding qualifiers.
 
But the 2003 video strikes a very different tone from the remarks above. After weighing all the evidence, we concluded that Obama, as a candidate who was trying to appeal to a liberal electorate, took a strong position on single payer, but then over the years moderated his position to appeal to a broader national audience. We rated him a

Half Flip

on our Flip-O-Meter, a tool we use to gauge when political leaders and others change positions.
 
Getting back to Obama's statement in Portsmouth, he said, ""I have not said that I was a single-payer supporter because, frankly, we historically have had a employer-based system in this country with private insurers, and for us to transition to a system like that I believe would be too disruptive.""
 
But he

has

said in the past he supports a single-payer plan, and the questioner was correct that Obama's thinking has evolved over the years. Obama's answer strikes us as too artful. The 2003 YouTube video shows at one time he supported a single-payer system with little to no reservation. We agree that Obama does not support single payer now, but it's not correct to say that he has never supported it, which is certainly the impression you get from the answer he gave at the town hall. We rate his statement False.
",[<zip object at 0x000001B4EAB2E880>],/factchecks/2009/aug/12/barack-obama/obama-has-praised-single-payer-plans-past/
"['National', 'Health Care', 'Barack Obama']","
Barack Obama promises you can keep your health insurance, but there's no guarantee
","
At a town hall meeting in New Hampshire on Aug. 11, 2009, President Barack Obama repeated a line he's used many times in describing his health care proposal: ""If you like your health care plan, you can keep your health care plan.""
 
On one level, Obama is correct. His plan seeks to build on the system we have now, where most people get health insurance through their employers. The plan also aims to cover the uninsured and reduce costs for everyone. Back during the campaign, we rated a similar statement

True

, based on the fact that his plan does seek to build on the existing system, where about 60 percent of Americans get health insurance through work.
 
Now, close to a year later, we finally have detailed bills to examine. They closely mirror what Obama promised during the campaign.
 
But the plans also introduce new ways of regulating health insurance companies that will surely change the current health care system. That could prompt employers to change their health plans, and we find Obama's statement less clear-cut now than it once seemed.
 
At a news conference on June 23, 2009, Jake Tapper of ABC News asked Obama about the possibility of changes in coverage.
 
Tapper's question centered on the public option on the health care exchange. Before we go any further, we want to explain in the plainest terms possible what the exchange is and what the public option is.
 
The health insurance exchange is a virtual marketplace where individuals and small businesses can go to buy health insurance. Employer-provided insurance offered by large companies, on the other hand, will continue as is, though Democrats have ideas on lowering costs that they hope will end up benefiting these plans, too. (In the interests of brevity, we're not going to go into all the cost-saving aspects here.)
 
The government would regulate the exchange so that insurance companies can't discriminate against people who have pre-existing conditions, or charge wildly different amounts for similar coverage.
 
One of the options on the exchange will be a public option that offers basic coverage. Obama has said the public option will keep private insurers honest by competing with them and not allowing them to charge unfair rates for the basics. Many experts believe that the public option will be the least expensive option on the exchange.
 

Jake Tapper's hypothetical


 
Back to Tapper's question: If the public option is cheapest, Tapper said, ""then lots of employers will want to have their employees covered by that cheaper plan, which will not have to be for-profit, unlike private plans, and may, possibly, benefit from some government subsidies, who knows. And then their employees would be signed up for this public plan, which would violate what you're promising the American people, that they will not have to change health care plans if they like the plan they have.""
 
So Tapper is suggesting that many employers will be allowed onto the exchange and will pick the public option, which would clearly change some people's health plans.
 
Here is the core of Obama's somewhat lengthy answer: ""When I say if you have your plan and you like it, or you have a doctor and you like your doctor, that you don't have to change plans, what I'm saying is the government is not going to make you change plans under health reform. ... Let's say that we take the advice of some folks who are out there and say, 'Oh, this is not the time to do health care. We can't afford it. It's too complicated. Let's take our time,' et cetera. So let's assume that nothing happened. I can guarantee you that there's the possibility for a whole lot of Americans out there that they're not going to end up having the same health care they have. Because what's going to happen is, as costs keep on going up, employers are going to start making decisions: 'We've got to raise premiums on our employees. In some cases, we can't provide health insurance at all.' And so there are going to be a whole set of changes out there. That's exactly why health reform is so important.""
 
So Obama's saying that the government will not force employers to change their health plans. Fair enough. But Tapper's hypothetical isn't wrong either, and we want to explain it in more detail.
 
As we've already noted, the health insurance exchange is where individuals and small businesses go to shop for health insurance. The government intends to regulate it, and the exchange will have a public option that includes basic coverage. But there are many things about the exchange and the public option that have yet to be finalized in Congress. For starters, it's not clear whether the public option will be subsidized by the government or if it will have to finance itself with only patient premiums. (Note that Tapper said it would ""possibly benefit from some government subsidies, who knows."")
 
Obama has said that the public option should be self-sustaining, but this is not settled. In the House, fiscally conservative Democrats known as Blue Dogs won a concession from other Democrats that the public option will have to negotiate payments to doctors. This would tend to put the public option on more equal footing with private health insurance companies.
 
Another implication of Tapper's question is that ""lots"" of employers would be able to have access to the exchange. But we don't know if this is so. Pending legislation in the House says that only individuals and small businesses of fewer than 10 employees would be able to use the exchange during the first year, and only individuals and small businesses with fewer than 20 employees in the second year. In the third year, businesses are allowed in ""based on the number of full-time employees of an employer and such other considerations as the Commissioner deems appropriate."" This sounds like employers will gradually be allowed into the exchange based on size, as well as ""other considerations as the (health exchange) Commissioner deems appropriate."" This obviously gives tremendous leeway to the commissioner, who is presidential appointee in charge of the health exchange. So year three becomes a question mark as to how many businesses will be allowed into the exchange.
 

Questions about the public option


 
Conservative critics of the Democratic plans believe these questions surrounding the public option and the exchange are critical to determining whether people will indeed keep their coverage.
 
""The two most important factors are who is eligible for the public plan, and what are premiums in the public plan, compared with private insurers,"" said Greg D'Angelo, a policy analyst with the conservative Heritage Foundation.
 
The foundation believes that the reform package will encourage employers to change or drop their health insurance and send their employees into the exchange to buy their own insurance.
 
""Any change in policy will change the incentives in the system, and you have to understand what is likely to happen,"" D'Angelo said. ""Employers will change or drop coverage, and individuals will have little to no say in the matter.""
 
If you accept the premise that employers will opt for the least expensive plan available, then millions of people should expect that their employers will change plans under the reform bill, he said.
 
The main response to this objection from supporters of reform is just what Obama said during the press conference: Employers can change health care plans right now, and they often do.
 
Still, the legislative details that have emerged on health care reform indicate that if reform passes, we're headed for some significant changes in how health care operates. Obama certainly intends to leave the current system intact. But at this point, it seems too pat to say, ""If you like your health care plan, you can keep your health care plan."" It seems likely that at least some people will have employers who decide to change plans when different plans become available, most likely any small businesses that currently offer health insurance. They will be allowed into the exchange right away, and it seems likely some might find a better deal there and change plans.
 
Until the legislation gets closer to a final stage, it's difficult to say how many employers will likely opt to change coverage. But clearly some change is coming. It's not realistic for Obama to make blanket statements that ""you"" will be able to ""keep your health care plan."" It seems like rhetoric intended to soothe people that health care reform will not be overly disruptive. But one of the points of reform is to change the way health care works right now. So we rate Obama's statement Half True.
",[<zip object at 0x000001B4EC029380>],/factchecks/2009/aug/11/barack-obama/barack-obama-promises-you-can-keep-your-health-ins/
"['National', 'Health Care', 'Barack Obama']","
Obama is right on federal health care for janitors and senators
","
During a town hall meeting in Portsmouth, N.H., on Aug. 11, 2009, an audience member asked President Barack Obama why members of Congress have a different health care plan than the rest of us.
 
""Why have you not used the bully pulpit to chastise Congress for having two systems of health care, one for all of us and one for them,"" an audience member asked.
 
Obama answered that lawmakers get a good deal on health care, but that ""their deal is no better than the janitor that cleans their offices because they are part of a federal employee plan. It is a huge pool. You've got millions of people who are part of the pool which means they have enormous leverage with the insurance companies. ... That drives down their costs, and they get a better deal.""
 
Republican critics of the president's plan have made an issue of coverage for members of Congress, saying that lawmakers should be forced to take the public option, the most basic government-run plan under Obama's proposal. We found Newt Gingrich was largely

correct

that Democrats have voted against that idea.
 
The administration has studied the federal benefits program, which gets high marks for efficiency, to get ideas for its own health care proposal.
 
Obama's description of the federal plan is accurate. Under the Federal Employees Health Benefits Program, federal employees and elected officials can choose from an array of plans, ranging from very basic options that have high deductibles and only carry catastrophic coverage to more expensive coverage that is more comprehensive. It is the largest employer-sponsored program in the world, covering over 9 million employees, retirees, former employees, family members and former spouses, according to the Office of Personnel Management's Web site.
 
People who opt for the same package will get the same treatment, said Michael Ornstein, a spokesman for the Office of Personnel Management.
 
""The benefits, co-pays and deductibles are no different whether you are a career employee like myself or an elected official,"" he said.
 
For the most part, janitorial staff on Capitol Hill are federal employees, said Eva Malecki, communications officer for the Architect of the Capitol, the office involved in the day-to-day operations of the Capitol complex.
 
""We do have a few contract workers,"" she said. ""But the majority are federal employees and are therefore covered by the federal employee benefits program. The custodial staff has access to the same benefits as members of Congress.""
 
We should note that while janitors and members of Congress can choose from the same menu of plans, members of Congress generally have more money to spend on, well, anything. Many members of Congress are millionaires.
 
But Obama is right that lawmakers and janitors are eligible for the same benefits, deductibles and co-pays. We rate his statement True.
",[<zip object at 0x000001B4ECB86A80>],/factchecks/2009/aug/11/barack-obama/obama-gets-right-federal-health-care-benefits/
"['National', 'Health Care', 'Newt Gingrich']","
Most Democrats are opposed to giving up their health care plans
","
To build opposition to a public health insurance option, Republicans have been challenging Democratic lawmakers and White House officials to enroll in the government-run plan.

 

""If Members of Congress believe so strongly that government-run health care is the best solution for hard working American families, I think it only fitting that Americans see them lead the way,"" said Republican Rep. John Fleming, who is sponsoring a resolution encouraging lawmakers to enroll in the public option, in a statement on his Web site.

 

On the Aug. 9, 2009, episode of

This Week

, Former Speaker Newt Gingrich told host George Stephanopoulos that Democrats are squarely against the idea.

 

""An amendment was offered in every committee to ... have the members of Congress and their staff in any government option as a mandate. And if this is good enough for the American people, it's good enough for the politicians,"" Gingrich said. ""In every committee, the Democrats voted no. Now, why is it they want to insist on a government-run system for ... people other than the Congress, but the Congress and their staff would be exempt?""

 

We wondered whether Gingrich's vote count was correct. To find out, we sifted through all the health care amendments offered in the House and the Senate committees.
 
Currently, members of Congress receive health insurance under the Federal Employees Health Benefit Program, which offers plans that range from basic coverage to plans that pay for special treatments and drugs. The system has earned high markets for efficiency, making it one of the models the White House has studied in coming up with its own ideas for health care reform.
 
It's important to note that under the Democrats' plan, the public option is just one choice that people would have in the health care exchange. The public option would provide basic coverage, but other plans would offer more extensive coverage likely at a higher price. Under the legislation now pending in Congress, no one would be forced to take the public option.
 
An amendment offered during the House Ways and Means Committee July 16 debate of the bill would have changed all that — but just for members of Congress and their staffs. Nevada Republican Dean Heller offered an amendment that would have required them to take the public plan. His amendment was rejected 18-21, with 21 of the 26 Democrats on the committee voting against it.
 
On the same day, members of the Education and Labor Committee adopted a resolution — code for ""nonbinding"" in congressional parlance — by Rep. Joe Wilson of South Carolina that expresses Congress' support that any member voting in favor of the public plan drop his or her federal employee benefits and enroll in the new program. Because the committee approved the resolution by voice vote — meaning members on the panel simply said ""aye"" or ""nay"" to express their support for the bill — it's impossible to tell who voted for or against Wilson's amendment.
 
The Energy and Commerce Committee heard a similar argument from Republican Rep. Roy Blunt of Missouri, who wanted to make the public plan mandatory for the president and the vice president as well as members of Congress. But Blunt's amendment never came to a vote because the Democratic leaders panel ruled it irrelevant to the overall bill.
 
Senators have been working on their own version of the health care bill, legislation that only the Health, Education, Labor and Pensions Committee has debated so far. On July 14, that committee adopted 12-11 a requirement by Republican Tom Coburn of Oklahoma that would require all members of Congress to enroll in the public plan. Nine of the committee's 12 Democrats voted against it.


That brings us back to Gingrich's claim. He's correct that Democrats in the House and Senate have generally voted against proposals to make the public plan mandatory for members of Congress. Even when Coburn's motion narrowly passed, nine of 12 Democrats voted against it. We can't assess the Democrats' positions on the voice vote in the House education committee or the energy and commerce panel where the motion was ruled irrelevant. So we can't be sure that Democrats voted against it in every committee. But based on the counts that are available, Gingrich's underlying point is correct that Democrats have generally opposed it. So we find his claim Mostly True.
",[<zip object at 0x000001B4EBB6F400>],/factchecks/2009/aug/10/newt-gingrich/most-democrats-are-opposed-giving-their-health-car/
