tags,sub_header,text_body,sources,quote_href
"['Crime', 'Texas', 'Rick Perry']","
Gov. Rick Perry says his border security efforts led to 60-percent drop in crime along Texas-Mexico border
","At a time when violence along the U.S.-Mexico border is again in the news, Texas Gov. Rick Perry makes an eye-catching claim on his campaign Web site: ""Governor Perry's border security efforts have led to a 60 percent decrease in border crime."" We had lots of questions about that, so we went looking for answers. In 2005, saying the federal government had not done enough to secure the U.S.-Mexico border, Perry announced he was investing in state border security efforts. His plans included helping local law enforcement agencies hire additional officers, buying the agencies equipment, assigning Texas Department of Public Safety personnel to the border and installing surveillance cameras. According to Perry's office, the governor spent about $30 million from his office's budget on the operations in fiscal years 2006-07. The Legislature allocated $110 million for border efforts in 2008-09 and more than $110 million for 2010-11, for a total of $250 million to date. And what was the impact of the efforts? Perry's campaign pointed us to a report from the Texas Border Security Council, whose members were appointed by Perry. According to a chart in the report, ""serious"" crime in the border counties dropped 65 percent in the two-year period between the third quarter of 2005 — when Texas funding for border operations started — and the third quarter of 2007. We learned that backup for the chart came from the FBI's annual Uniform Crime Reporting program, which tracks the incidences of seven ""index"" crimes: murder, rape, robbery, aggravated assault, burglary, larceny and auto theft. However, the chart (dubbed ""Texas Border Counties Crime Index"") is only that: a jagged line on a page, rising and falling between 2004 and 2007. It doesn't detail specific crime data from border localities, making it impossible to tell exactly where crime dropped, by how much and in which categories.Seeking more detail, we talked to the Texas Department of Public Safety, which reports the state's crime numbers to the FBI. We then learned that the chart was drawn from data that omitted significant facts.The Border Security Council report only counted crimes from unincorporated areas of counties along the border which, it states, accounts for 93 percent of the 1,254 miles of the Texas-Mexico border. By taking that approach, the report excludes all the border region's towns and cities including major population centers such as El Paso, Laredo, Brownsville, McAllen and Harlingen. By our analysis, more than 75 percent of the population in the border counties lived in incorporated areas in 2007, the last year covered in the chart. What's wrong with leaving out the urban areas? More crimes usually occur where more people live. Consider El Paso County. According to DPS data, the sheriff's department there reported 1,350 ""index"" crimes in the county's unincorporated areas in 2005. Adding in offenses reported by the city's police department and other law enforcement agencies in the county causes the ""index"" crimes to total 25,134. Data provided by DPS to support the chart shows that crimes in unincorporated border areas dropped 65 percent between the third quarter of 2005 and the third quarter of 2007. But that only compares two different quarters. When we looked at crime over all three years of data — 2005 through 2007 -- the decline amounted to less than 1 percent. We also considered the data for both urban and rural areas of all the border counties during those years. The total number of ""index"" or serious crimes rose from 103,884 in 2005 to 103,986 in 2007. The ""index"" crime data omits crimes that may occur at higher rates in border regions, including drug offenses and human trafficking. Without those numbers, the border crime story is incomplete. We asked for that data. The DPS says it doesn't collect it but plans to in the future. Separately, the U.S. Border Control offered information on only two enforcement actions that the agency tracks: the number of foreign nationals caught for being in the United States illegally — what it calls ""apprehensions"" — and the amount of drugs seized. Apprehensions in the Border Patrol sectors that include Texas dropped 58 percent from fiscal 2005 through 2009. The amount of drugs seized — measured in pounds of marijuana, heroin, cocaine, methamphetamine and others — more than doubled. Border Patrol spokesman Mark L. Qualia and Tony Payan, an expert on the U.S.-Mexico border and political science professor at the University of Texas-El Paso, agreed that some crimes happen more often in border areas because of the large numbers of people passing through. Qualia cited trespassing and shoplifting as examples of such ""transient"" crimes. Such caveats undermine Perry's claim -- and build a case that border crime is a complicated subject. As for not counting crimes in cities and towns to assess changes in the border region, Payan said: ""This strikes me as sheer manipulation of geographical areas and numbers in order to make the governor look good."" When we asked the governor's office for an explanation of the report's methodology, we were referred to the DPS, whose spokeswoman Tela Mange said: ""We were focusing on the unincorporated areas ... because that is where much of the illegal activity involving human and contraband smuggling occurs."" That may be, though neither the state of Texas nor the Border Patrol gave us data on that activity. Don Reay, executive director of the Texas Border Sheriff's Coalition, said that members of his group still believe that crime has gone down and that Perry deserves credit for improving the situation on the border -- though not all the credit. ""Crime has gone down based on cooperation between counties, between the state and between the federal government,"" Reay said. Since 2006, Washington has spent more than $3.7 billion on border security, although Qualia said he could not say exactly how much of the money went to the southwestern or Texas border. Some of the major initiatives have been to hire more Border Patrol agents and build hundreds of miles of fencing. Payan also said that outside factors could have caused border crime to decline. He cited the war raging between drug cartels in Mexico, which he says has limited the cartels' ability to do business across the Rio Grande. Perry's claims about reducing border crime have come under scrutiny before. In 2006, the El Paso Times investigated his statements touting the impact of Operation Rio Grande, which shifted DPS officers and other state resources to border areas. That October, Perry's office trumpeted in a press release: ""Crime down 60 percent across the border."" The Times questioned the statistic, noting it was based on average crime reductions in ""several"" counties -- not the entire border region -- where the state participated in ""surge"" operations over a four-month period. The operations beefed up federal, state and local law enforcement personnel in selected rural areas; urban areas weren't included in the statistics. That's relatively old news. What about more recently? We checked the latest available UCR crime data in both urban and non-incorporated areas along the Texas border in 2008, as reported by the DPS. Overall, serious crime went up 1.6 percent from 2007. Summing up: Perry's claim that his border security efforts have led to a 60 percent drop in crime doesn't hold water. The calculation he touts doesn't consider crimes committed in cities and towns where most border residents live. It also compared two calendar quarters rather than weighing years' worth of data. Crime may have temporarily subsided in some rural areas of the border region. However, it's not clear how much of any decline can be traced to the state's investment in security. We rate Perry's sweeping statement based on an unreasonable manipulation of crime statistics -- the second instance of his administration touting questionable border crime numbers -- as Pants on Fire.",[<zip object at 0x000002809C2FFCC0>],/factchecks/2010/mar/16/rick-perry/gov-rick-perry-says-his-border-security-efforts-le/
"['Elections', 'Florida Amendments', 'Infrastructure', 'Florida', 'Citizens for Lower Taxes and a Stronger Economy']","
Referendums over growth issues forced city to raise taxes, group claims
","
In its campaign to discredit a ballot initiative giving voters more authority over land use, a statewide political action committee says voters only need to look at tiny St. Pete Beach and its problems since adopting a similar policy.

Amendment 4, which will appear on ballots in November, essentially would give citizens veto power over major development proposals and land use changes. Opponents say a similar citizen initiative on growth and planning in St. Pete Beach has resulted in government run amok.

""The seemingly endless lawsuits (as a result of the changes) decimated the city's legal budget and forced the city to raise the property tax rate. Now this idea threatens every town in Florida,"" a narrator states during a 2 minute, 15 second Web ad produced by a group called Citizens for Lower Taxes and a Stronger Economy. The group is an offshoot of Floridians for Smarter Growth, which is funded by developers, home builders, U.S. Sugar, and other business groups.

We'll begin by noting that there is considerable debate between supporters and opponents of Amendment 4 if St. Pete Beach's experiences are truly analogous to the statewide ballot proposal. We plan to examine the analogy in a future Truth-O-Meter item. But because the advertisement is now on the Web, we'll still examine the individual claims.

For this item, we need to go way back in time, back to the day that developers actually were interested in building condo high rises, back when developers wanted to cram as many units as they could onto a property, back when people actually could flip condos for substantial profits. Yep, way back to 2005.

Back then, St. Pete Beach's five-member City Commission was considering changing the town's road map for growth, the Comprehensive Plan. The commission considered incentives to lure additional hotels that could increase the density of a development and change the allowed uses.

The talk of change didn't sit well with many residents, who formed a group called Citizens for Responsible Growth. They collected enough petitions to get a proposal on the ballot that would require voter approval for height increases and other changes to land use plans.

It got contentious. The city sued to stop the vote, and appeared to have won, but then lost on appeal. A developer also sued saying the petition process was costing him money.

Voters narrowly approved most of the changes to the City Charter in November 2006, making St. Pete Beach the first town in Florida where residents directly controlled development decisions. Voters also elected two members of Citizens for Responsible Growth to the City Commission, giving them a majority.

That prompted a pro-developer group -- Save Our Little Village -- to start its own petition drive to amend the city's comprehensive plan. The city's elected officials -- who had gone from being largely pro-development to anti-development -- tried to stop them.

It got even more contentious. Save Our Little Village sued. The city's attorney resigned under pressure from the commission.

Then, another election, another change of power and eventually, another referendum. This time, the pro-development side won. By December 2009, the city was involved in six different lawsuits prompted by the policy.

Now there's another lawsuit and talk of another petition drive. Whew.

Again, we're not ready to address the question of the similarity between the beach policy and Amendment 4. We're here to examine the policy's impact on the city's tax rate.

And yes, in 2009, the city did increase its tax rate .107 mills (or $0.107 for every $1,000 of taxable value). The tax rate increase raised about $255,000 citywide, according to the city budget.

During the Sept. 21, 2009, meeting where the tax rate increase was approved, there were two main reasons cited:
  

Parent said he was worried that after the city overshot its legal budget in 2008-2009 by about $100,000, that it would do so again.

""Without additional budgeted funds, it could force us to reduce some other things,"" said Parent, who suggested the city's Fourth of July fireworks display could be impacted. But after discussion, and after consultation with City Attorney Michael Davis, commissioners decided to to leave the legal budget the same.

After reviewing the discussion and interviewing Bonfield, we conclude that declining property values appeared to be the most significant factor, although the cost of legal fees was also discussed.

""I guess you could attribute the extra legal fees as a reason why we needed to raise millage,"" Bonfield said. ""But nobody said we need to raise this millage to put it in a fund for legal. I wouldn't say there's a direct correlation.""

In its ad, the group Citizens for Lower Taxes and a Stronger Economy says St. Pete Beach's local version of Amendment 4 resulted in ""seemingly endless lawsuits (that) decimated the city's legal budget and forced the city to raise the property tax rate."" 
Yes, there were lawsuits, but they weren't the only costs mentioned for the city legal department. Yes, the city slightly raised its rate in 2009 -- although the net result still was a decrease on most homeowners because of sharply falling property values.

But the discussion at a town meeting indicates that the decision was motivated by several factors, most notably the decline in property values, as well as legal fees. So we find the claim Half True.",[<zip object at 0x00000280979C6480>],/factchecks/2010/mar/16/citizens-lower-taxes-and-stronger-economy/referendums-over-growth-issues-forced-city-raise-t/
