tags,sub_header,text_body,sources,quote_href
"['Health Care', 'North Carolina', 'D. Cole Phelps']","
Does NC have the 5th highest health insurance premiums?
","Americans spend more on health care than comparable countries, according to a recent analysis. So it’s probably no surprise that the Pew Research Center found health care to be a top concern of voters, or that North Carolina politicians are talking about it ahead of the midterms. This November, Democrats hope to break the Republican supermajority in the state legislature. Among them is D. Cole Phelps, an attorney running for state Senate in northeastern North Carolina’s District 1 against Republican state Rep. Bob Steinburg. On Labor Day, Phelps claimed in a Facebook post that health care premiums in North Carolina are among the most expensive in the country. ""Health care premiums in North Carolina are now among the five highest states in the country — and rural health care is struggling,"" Phelps posted on Sept. 1. ""Our opponent is protecting insurance company profits — not his constituents. As your state senator, I will fight for every person in Senate District One, including people with pre-existing conditions."" Are health insurance premiums in North Carolina higher than those in 45 other states? PolitiFact reached out to Phelps for the source of his information. To support his claim, Phelps cited a recent WalletHub story, ""The Best and Worst States for Healthcare."" WalletHub, which looked at all 50 states and Washington, D.C., ranked North Carolina’s health care system 47th for overall care. The Tar Heel State ranked 45th for average monthly insurance premiums. But there’s a key piece of information that’s buried in the WalletHub story and that Phelps doesn’t mention in his Facebook post: WalletHub only looked at health care plans through the Affordable Care Act, also known as Obamacare. It didn’t take into account premiums for insurance plans acquired through employers. More than 55 percent of Americans have employer-based health insurance plans, according to 2016 estimates by the U.S. Census Bureau. In North Carolina, employer-based plans covered 52 percent of all non-Medicare recipients during 2016, according to an analysis by the Kaiser Family Foundation, a nonprofit health analysis organization. So, with that in mind, we wondered whether North Carolinians are paying some of the highest premiums for health insurance plans across the board. Here’s what we found for both customers in the ACA markets as well as on employer-sponsored plans. True, for ACA premiums When it comes to premiums for people with plans through the Affordable Care Act, Kaiser found that North Carolina had the seventh-highest average benchmark premiums in 2018. In 2017, NC had the second-highest. More than 478,000 people enrolled in such plans in 2018, KFF reports. However, the average benchmark isn’t an accurate reflection of what most customers pay, said Craig Palosky, KFF communications director. Though the benchmark shows the full sticker price, it’s ""not what people who get tax credits would end up paying,"" Palosky said. "" The distinction is important because the vast majority of marketplace customers do get tax credits – 87 percent nationally and 94 percent in North Carolina."" The Centers for Medicare and Medicaid Services, known as CMS, is a part of the U.S. Department of Health and Human Services. David Anderson, a research associate for the Duke University Center for Health Policy, noted that the CMS risk adjustment formula found high average premiums in NC for 2017. At $501 a month, North Carolina in 2017 had the fourth-highest average premium in the individual market, Anderson noted. Erik Wengle, a research analyst for the Urban Institute Health Policy Center, said premiums for North Carolina’s most popular ACA plans are ""frequently"" among the highest in the country. North Carolina’s silver and gold ACA plans were both the fifth-most expensive in the country, he said. ""We’ve found that competition is a large driver associated with lower premiums. NC hasn’t had as robust competition as other states,"" Wengle said. Blue Cross Blue Shield is the only insurer to offer ACA plans in all 100 NC counties, while Cigna offers plans in Wake, Johnston, Orange, Chatham and Nash counties. Another insurer, Centene, is expected to enter the Wake and Durham markets next year. Not true for employer-based insurance While North Carolina’s government-subsidized plans are on the expensive side, PolitiFact couldn’t find any evidence that NC’s non-ACA premiums are among the highest in the country. Kaiser examines employer insurance data from the Medical Expenditure Panel Survey, which collects data from insurance providers and is part of the U.S Agency for Healthcare Research and Quality. KFF statistics from 2016 (the most recent year available) show that the average annual premium for a single employee was $5,717 — one of the lowest averages in the country. Add a ""plus one"" (spouse or child) to the employee’s coverage, and North Carolina still had one of the lowest average premiums in the U.S. Meanwhile, KFF found that premiums for employer-based family plans in NC were middle-of-the-road. Statistics from the 2017 MEPS show that the average employer-plan premium for an employee in North Carolina is slightly below the national average. For those plans, the annual North Carolina average was $6,348 a year while the national average was $6,368. So Phelps’ claim appears to be true for about 520,000 of North Carolinians on an ACA plan, according to CMS. Going by the latest Census estimates, that’s only 5 percent of North Carolina’s population. Our ruling Phelps said health insurance premiums in North Carolina ""are now among the five highest states in the country."" He has a point when it comes to premiums for ACA plans. Those plans, however, only affect a fraction of North Carolina’s population. Millions of North Carolinians have plans on the private market, and data show that private plans in NC aren’t among the most expensive in the country. On balance, we rate Phelps’ claim Mostly False. This story was produced by the North Carolina Fact-Checking Project, a partnership of McClatchy Carolinas, the Duke University Reporters’ Lab and PolitiFact. The NC Local News Lab Fund and the International Center for Journalists provide support for the project, which shares fact-checks with newsrooms statewide.",[<zip object at 0x000002809A4A4640>],/factchecks/2018/oct/02/d-cole-phelps/does-nc-have-5th-highest-health-insurance-premiums/
"['Arizona', 'Immigration', 'Homeland Security', 'Martha McSally']","
In Arizona, McSally falsely claims Sinema backed bill encouraging child trafficking
","The federal government’s separation of children from their parents as they arrived at the southwest border is pivotal in Arizona’s Senate race. Republican U.S. Rep. Martha McSally said in a Sept. 16 Fox News interview that her party was working on a bill to enforce the laws and keep families together. She claimed that her Democratic opponent in the Senate race, U.S. Rep. Kyrsten Sinema, in contrast supported a bill that encouraged child trafficking. ""My opponent and every Democrat got on a bill that essentially says if you cross the border illegally, and you have a kid with you and you commit a crime, another crime within 100 miles of the border, you can’t be arrested,"" McSally said. ""This is essentially encouraging child trafficking and that’s what my opponent supported."" McSally’s campaign told us she’s referring to the Keep Families Together Act, co-sponsored by nearly all Democrats, including Sinema. Did the Sinema-backed bill enable or encourage child trafficking? Not according to several immigration experts and researchers who study human trafficking. They said the bill is about keeping families together and that it includes safeguards against trafficking. U.S. Rep. Jerrold Nadler, D-N.Y., introduced the Keep Families Together Act in June amid calls for President Donald Trump’s administration to end a policy leading to the separation of immigrant families. Nadler’s proposal would prohibit the Department of Homeland Security, Justice Department, and Health and Human Services from removing a child (under 18 years old and without permanent immigration status) from his or her parent or legal guardian, at or near the port of entry, or within 100 miles of the U.S. border. However, the bill lays out several circumstances in which border officials can separate children. A child could be removed if: • the child is a victim of trafficking or is at significant risk of becoming a victim of trafficking; • there is a strong likelihood that the adult is not the parent or legal guardian of the child; and • the child is in danger of abuse or neglect at the hands of the parent or legal guardian, or is a danger to themselves or others. If a child is removed, an independent child welfare expert licensed by the state or county where the separation happened has to authorize it within 48 hours. If not authorized, families are reunited. (Experts said child welfare is regulated by states.) The bill also gives state courts and state or county child welfare agencies their own authority to separate a child from a parent or legal guardian, if it’s in the child’s best interest. McSally said that the proposal prevented the arrest of people who came with children and committed ""another crime within 100 miles of the border."" But the bill doesn’t say that. The bill says asylum seekers may not be prosecuted for immigration law violations until their asylum application is adjudicated. Under current law, asylum seekers must be in the United States to request the protection. They can apply for it even if they entered the country illegally. Nadler’s measure calls for periodic reports on separations. The reports would need to include whether an adult was charged with a crime, the type of crime, whether that charge was prosecuted and the outcome. Sinema’s campaign said the bill would keep families together while removing them from potential trafficking situations. The bill is unlikely to pass so long as Republicans control the U.S. House. The bill diminishes federal enforcement and empowers ""state government determinations that would likely happen well after the point of apprehension and detention on a federal level,"" said Torunn Sinclair, a spokeswoman for McSally’s campaign. Sinclair also argued that the bill incentivizes traffickers to claim children as their own. While it may not be easy to determine in some cases whether an adult is the parent of a child, border officials who come in contact with them are trained to figure that out, said David Kyle, associate professor of sociology at University of California-Davis. The onus remains on parents to prove a relationship, Kyle said. ""No matter how the law is written, law enforcement officials have laws they can invoke if there is a suspicion that the child is not with their legal guardian or parent,"" Kyle said. ""I don't think anything in the bill would undercut those laws and clearly supports exceptions based on those suspicions."" The part of the bill saying an ""independent child welfare expert"" has to authorize separations within 48 hours raises questions regarding the practical implementation of the bill, Kyle said. Still, ""on the face of it, I don't see the bill facilitating child trafficking,"" Kyle said. Dominique Roe-Sepowitz, an associate professor and director of the Office of Sex Trafficking Intervention Research at Arizona State University, also doesn't see the bill as encouraging child trafficking. ""This is much less to do with sexual exploitation and more to do with separating families,"" she said. McSally said Sinema supported a bill that encourages child trafficking. Sinema co-sponsored a bill to limit the separation of immigrant families arriving at U.S. borders. McSally’s team said the bill reduces federal authority and incentivizes traffickers to claim children as their own. However, the bill says a child can be separated if federal immigration officials believe that the child is being trafficked or faces that risk. Separation can also take place if there’s a strong likelihood that a child and adult are not related. Under the bill, a state or county child welfare expert has to authorize a separation within 48 hours. It also gives state courts and agencies their own ability to separate a child from an adult, especially if the child’s safety is at risk. Immigration and human trafficking researchers disagree with McSally’s assessment of the bill. We rate McSally’s statement False.",[<zip object at 0x000002809A381F40>],/factchecks/2018/oct/02/martha-mcsally/did-kyrsten-sinema-support-bill-encouraging-child-/
"['Immigration', 'National', 'Crime', 'Senate Leadership Fund']","
GOP super PAC ad skips over Jacky Rosen's yes vote on criminal immigrant bill
","A Republican super PAC ad faults Democratic Rep. Jacky Rosen for failing to take a tough line on criminals who try to sneak across the border. The $1.3 million ad buy from the Senate Leadership Fund is on the air and on the web statewide in Nevada’s U.S. Senate race. The ad opens with images of MS-13 gang members. The violent criminal organization runs rampant in El Salvador and is a threat in communities across the United States. ""MS-13 violent gang members,"" a narrator says. ""They exploit immigration loopholes and commit vicious crimes in the U.S. Jacky Rosen, she voted against Kate’s Law, which would close immigration loopholes and help stop criminal illegal immigrants from re-entering the U.S."" The words ""Rosen voted against stopping criminals from re-entering the U.S.,"" play across the screen. We gave it a fact-check. Kate’s Law came after 32-year-old Kathryn Steinle died in San Francisco from a shot by a Mexican national with seven felony convictions who had been deported five times. The tragic death in 2015 inflamed the debate over immigration and sanctuary cities. In June 2017, a group of four House members introduced Kate’s Law. The bill imposed stricter penalties on people who had been deported or sent back before and tried to sneak back. Someone with three misdemeanors on their record, or a felony, could face up to 10 years behind bars. Those who had served time in an American jail faced ever increasing penalties, depending on the length of the original sentence. For a two-and-half year sentence, the maximum was 15 years. For a five-year sentence, the maximum was 20 years. And for the worst crimes, such as murder or rape, the maximum went to 25 years. ""It is already a federal crime to enter the United States without the federal government’s permission,"" said César Hernández, associate professor of law at the University of Denver. ""Right now, the maximum prison sentence is 20 years. Kate’s Law would increase that to 25 years, but only for people with prior convictions for a small set of serious crimes."" Kate’s Law passed the House by a 257-167 vote in June 2017 but died in the Senate. Rosen voted against it. Kate’s Law targeted repeat immigration offenders and created ever more stringent penalties based on an offender’s past felony sentences. Under current law, the maximum penalty for any re-entry attempt is two years. Under Kate’s Law, after three attempts, the maximum rose to 10 years. It also expanded the universe of misdemeanors from drug-related under current law, to any misdemeanor, which could include offenses as common as traffic violations. ""It will discourage people from entering the United States illegally, particularly when they have already entered illegally earlier and have been convicted of a crime for doing so,"" said the bill’s main sponsor, Bob Goodlatte, R-Va., in 2017. Although Rosen voted against Kate’s Law, she was one of 11 Democrats who voted for the Criminal Alien Gang Member Removal Act in September 2017. That bill made it easier for federal officials to detain and remove gang members. Under the bill, an official could act if he or she ""knows or has reason to believe that such person is or has been a member of a criminal gang or has participated in criminal gang activities."" The measure provided broad latitude in defining gangs and if officials had any suspicions, the person would be ineligible for asylum, temporary protected status, or special treatment because they are under 18. The bill passed in the House in September 2017, but has yet to win Senate approval. In White House press briefing, U.S. Attorney for Utah John Huber said Kate’s Law would help prosecutors keep gang members off the streets. ""What Kate's Law does is give us one more tool that is fairly easy to use, because we're not reliant upon witnesses who may be intimidated by the gangs or victimized by the gangs,"" Huber said. ""This enables us to, based on a person's status and their criminal record and their deportation record, to simply prosecute them in federal court, obtain a prison sentence, and get them out of here."" But gang expert Robert Bunker at the University of Southern California’s Safe Communities Institute said MS-13 gang members are a special case. Imprisonment is part of initiation. ""Being in prison for a gang member is considered part of ‘making one's bones’ to gain street cred and status within the gang,"" Bunker told us. ""So, unlike cartel members who may be deterred by facing a prison sentence, a gang member — such as an MS-13 one — is not going to be deterred by it. Further, if an MS-13 gang member from Central America was ordered by his clique leader or a higher up shot-caller, to journey to the United States, they would do so. Not following orders would get them severely beaten if not killed outright."" Before Kate’s Law emerged, while deportations in general more or less held steady, people deported because of their criminal history declined. This chart comes from deportation proceedings gathered by Syracuse University’s TRAC project. There are two ways to read the numbers. It’s possible that immigrants with felonies drew less attention over the years (although during most of the period, Washington put more focus on them). But it’s also possible that current law has been effective, without the threat of Kate’s Law. Hernandez at the University of Denver said he’s not seen any study that shows a connection between increased penalties and reduced border crossings. The Senate Leadership Fund said Rosen ""voted against stopping criminals from re-entering the United States,"" citing Kate’s Law. Rosen did vote against Kate’s Law, which increased penalties for those trying to re-enter the country. However, the ad leaves out that Rosen voted in favor of another bill that specifically targeted the sort of gang members presented in the ad. The measure gave federal officers wide latitude in defining gang membership and empowered them to detain and remove any person they had reason to believe was involved with a gang. Rosen’s voting record undercuts the ad’s claim. We rate it Mostly False.",[<zip object at 0x000002809C1C2FC0>],/factchecks/2018/oct/02/senate-leadership-fund/gop-super-pac-ad-skips-over-jacky-rosens-yes-vote-/
"['National', 'Veterans', 'Donald Trump']","
Donald Trump: GOP just passed veteran's Choice after 44-year wait. Actually, it's 4 years old
","President Donald Trump has been barnstorming for Republicans in the midterms. On Oct. 1 he landed in Johnson City, Tenn., to help U.S. Senate candidate Marsha Blackburn, covering familiar ground about the improving economy. He touted securing $716 billion for the military, and he gave Republicans credit for giving veterans a new health care option. ""We just passed Choice,"" Trump said. ""That was 44 years, they’ve been trying to pass Choice. So that if you have to wait for nine days, 30 days, 21 days, months, you don’t do that anymore. If the line is big, and you’re unhappy, you go to a private doctor, they take care of you and we pay the bill."" Trump repeated the point, saying, ""They’ve been trying to pass that one for many, many decades. They couldn’t do it. We got it passed. We’re good at passing things, right?"" Trump is wrong that Choice wasn’t passed until he came into office. Congress passed a new version of a Choice program in June 2018 — but the program itself has been around since 2014. After the scandal of long waits and the efforts of administrators at some facilities to cover that up, Congress and the Obama administration passed the Veterans Access, Choice and Accountability Act of 2014. For veterans who couldn’t be given appointments quickly enough, or who lived more than 40 miles from a Veterans Health Administration hospital, the government would pay for private care. In four years, Washington spent $12 billion on the program. The bill signed by Trump, the VA Mission Act, is a major effort to fold a variety of community care programs at the VA into one integrated whole. That change won’t take place for at least a year. Until then, the law provides $5.2 billion to continue the Choice program in its present form. We reached out to the Trump administration but did not hear back. Trump said that he and his fellow Republican ""passed Choice,"" something that others had been trying to do for 44 years. He described the program as one that allowed veterans to get private care at government expense. The program to do exactly that has been around for four years. And it’s always been referred to as Choice. We rate this claim False.",[<zip object at 0x000002809C13AFC0>],/factchecks/2018/oct/02/donald-trump/donald-trump-gop-finally-passed-veterans-choice-af/
"['Fake news', 'Facebook Fact-checks', 'Bloggers']","
No, a photo does not show Brett Kavanaugh passed out from drinking
","Brett Kavanaugh’s drinking habits were a key theme in the Senate Judiciary Committee hearing. Kavanaugh said he drank beer in high school, but denied ever drinking to the point of blacking out. An image making the rounds on social media tries to disprove that point by showing a drunk Kavanaugh passed out from too much drinking. But the photo does not show Kavanaugh. ""Never been passed/black out drunk, huh.... #kavanaugh,"" the caption on a Facebook image reads. The photo on the left shows a young man holding two beer bottles apparently passed out on a couch, with the year 1982 beneath it. The photo on the right shows Kavanaugh now, with 2018 written below it.  The photo on the left is not actually Kavanaugh in 1982. It is a stock photo from Getty Images, found in their creative images bank. It is captioned ""portrait of a young man asleep on the couch after drinking too much beer."" Getty was only founded in 1995, and there is no indication that the photo was taken prior to that date. A search for photos of Kavanaugh in Getty Images yields no results prior to 1996, when Kavanaugh was an aide to Independent Counsel Kenneth Starr. The photo has appeared in multiple health articles warning of the dangers of binge drinking. We rate this statement Pants on Fire!",[<zip object at 0x0000028097BF4C80>],/factchecks/2018/oct/02/blog-posting/photo-brett-kavanaugh-passed-out-drinking/
