tags,sub_header,text_body,sources,quote_href
"['Rhode Island', 'City Budget', 'City Government', 'Debt', 'Deficit', 'Economy', 'Legal Issues', 'Transparency', 'David Cicilline']","
U. S. Rep. David Cicilline says that when he was mayor of Providence, the city’s internal auditor was not blocked from accessing financial records
"," U.S. Rep. David Cicilline is facing a tough reelection campaign, in part, because by the time he finished his tenure as mayor of Providence, the city was in horrible financial shape and Cicilline, during his 2010 congressional campaign, had characterized the city's fiscal status as ""excellent.""

Making matters worse are allegations that Cicilline tried to hide the problems from Providence's internal auditor.

Not surprisingly, the issue came up Sept. 4 when he debated his opponent in the 1st District Democratic primary, Anthony Gemma, on WPRO radio.

""The fact of the matter is he locked out the city auditor,"" Gemma said of Cicilline. ""So why would you lock out the city auditor, when the auditor needs to file for a Freedom of Information request to get in to do the very job that he was supposed to do, when you're not trying to hide something?""

Cicilline called the allegation ""absolutely false. The auditor was not locked out and so that is absolutely untrue.""

Cicilline's emphatic denial seemed ripe for an audit of its own.

At the center of this dispute is James J. Lombardi III, who served as Providence's internal auditor and, as an employee of the City Council, had a sometimes contentious relationship with the Cicilline administration. He is now the city's treasurer. (The city also has an external audit done every year by an outside company. That report, dated January 2011, confirmed the financial problems.)

In the fall of 2010, when Cicilline was winding down his tenure as mayor and in the middle of a tough race for the U.S. House, Lombardi was complaining that Providence's finances were in trouble and he was having trouble getting access to information.

We found some justification for Gemma's assertion that Lombardi was ""locked out.""

Two Providence Journal stories by two different reporters in March 2011 reported that Lombardi said the administration had canceled his computer access when he began to ask questions about the city's finances, forcing him to seek information by filing formal requests under the Rhode Island Access to Public Records Act.

Lombardi now says that he was never locked out of his computer. His computer access to city financial records was never canceled, he said,  because he never had such access in the first place.

Nor was he ever physically locked out of his office or anywhere else where he tried to get records.

That would mean Cicilline is correct in the strictest sense of the phrase ""locked out.""

But you can still be figuratively locked out if you are denied access to something you're legally entitled to.

Providence's City Charter requires the City Council to appoint an internal auditor who ""shall have access to the books and records of all offices, department and other agencies of the city."" That section of the charter offers no limitation. The auditor reports to the council, not the mayor.

Lombardi, whose complaints about his inability to get information from the mayor's office go back to 2004, told us that in this case the problem wasn't that he was denied the information. The problem was the timeliness of the responses he was getting.

A key issue was whether the city's reserve fund -- sometimes called the rainy-day fund -- was being severely depleted. City records show that on Jan. 11, 2010, Lombardi had requested copies of all authorization forms transferring money in and out of the reserve fund in January 2010, which the Cicilline administration was tapping because of its budget problems.

Three days later, he wrote to the city solicitor's office asking it to assist with the request because, if that request was treated like other requests he had made in the past, ""I will never see it.""

Lombardi said if that couldn't be done, he would request the data under the state open records law, adding that he thought it was ""ridiculous"" that he would have to do such a thing.

He did not get the information until October 2010, according to a report he filed with the City Council. That's nine months.

When we asked the Cicilline campaign about the delay, spokesman Eric Hyers said ""there was absolutely not any plan to delay him, to do anything secretly or to stonewall him.""

Hyers said Lombardi ""had access to whatever he needed. He oftentimes had very unrealistic expectations as to what the turnaround time should be and how soon he should be provided with certain information. At times he assumed that City Hall officials were his own personal staff; they had their own jobs to do.""

Hyers said ""this constant tug of war over what he was entitled to and when he should have it was not unique to 2010. It started several, several years ago.""

We saw two other examples.

In May, according to city records, Lombardi requested a cash flow analysis and was told by the Cicilline administration that (a.) one didn't exist and (b.) the administration was not obligated to generate one just for him under the open records law.

Also in May, he asked Bruce Miller, the city's finance director, for a schedule detailing how the Cicilline administration planned to balance the city's budget. He was told that, until the plan was finalized, he wasn't entitled to see it under the open records law.

Lombardi said he ultimately received the information he wanted in October 2010. That was after the Democratic primary, where Gemma was one of Cicilline’s opponents, and before the general election, where Cicilline ran against Republican John Loughlin.

Loughlin was able to use that information in a Channel 12 debate, during which Cicilline, while touting his accomplishments as mayor, made the now-infamous declaration that Providence was in ""excellent financial condition.""

That record would become seriously tarnished after the election when an independent audit made the full extent of Providence's financial problems painfully clear.

Our ruling

Former Providence Mayor David Cicilline said that the internal auditor for the city ""was not locked out"" of access to the city's finances.

The auditor now says that he was not locked out in the usual sense of the word.

But there's a fine line between being locked out and stonewalled.

Cicilline's spokesman emphatically says that ""neither of those happened.""

But the record shows that Lombardi faced many months of delay in getting information he was entitled to by the City Charter. He was forced to use the state’s open records law to get information and waited months for it.

And key information -- that Cicilline had been tapping the rainy day fund -- wasn’t provided until October 2010, after Cicilline’s primary victory.

Whether it was part of a long-running political wrangle between the mayor and the City Council, which hires the internal auditor, is irrelevant. Open record laws require the release of information regardless of the motives of the person seeking it.

The auditor was not locked out in the strictest sense. But the inability of the internal auditor to get information that might have led to a timely disclosure of the city's serious financial problems had the same effect.

Because the statement contains some element of truth but ignores critical facts that would give a different impression, we rate it Mostly False.

(Get updates from PolitiFact Rhode Island on Twitter: @politifactri. To comment or offer your ruling, visit us on our PolitiFact Rhode Island Facebook page.)",[<zip object at 0x0000028097423140>],/factchecks/2012/sep/07/david-cicilline/u-s-rep-david-cicilline-says-when-he-was-mayor-pro/
"['Rhode Island', 'Taxes', 'Anthony Gemma']","
Providence taxes are among the highest in the country
","In a radio debate last week, Anthony Gemma, who is challenging U.S. Rep. David Cicilline in the 1st Congressional District Democratic primary, continued hacking away at the track record of the former Providence mayor.

Cicilline served two terms as mayor until voters elected him to Congress in 2010. Gemma has repeatedly criticized Cicilline’s erroneous assessment of city finances as ""excellent"" prior to leaving office, and during the debate at WPRO-AM 630 charged that the consequences of Cicilline’s leadership reverberate today.

""The City of Providence is in absolute shambles right now,"" said Gemma. ""The roads are bad. The taxes are amongst the highest tax rate in the entire country.""

While Gemma cited the tax rate -- a figure that can be misleading -- we assumed from the context he was talking about the tax burden -- how much residents and businesses would have to pay.

We asked Gemma’s campaign for his backup. In an e-mail, a Gemma campaign spokesman provided a link to a 2010 report by the nonpartisan Minnesota Taxpayers Association and the Lincoln Institute of Land Policy, a Cambridge, Mass.-based nonprofit think-tank.

Their report compared, among other things, the commercial property tax rate of the largest city in each of the 50 states, as well as the District of Columbia, and the two next largest cities in Illinois and New York. Of the 53 cities, Providence ranked the second highest for commercial property taxes, behind only Detroit.

The spokesman, Alex Morash, also pointed us to one of our own PolitiFact items from this past February when we checked a claim by Governor Chafee that Providence had, indeed, the second highest commercial property tax in the country.

In that item (we ruled it Mostly True), we not only referred to the Minnesota Taxpayers Association study, but also to a report done by the Tax Foundation, a business-backed policy group based in Washington, D.C., that does state-by-state tax comparisons.

They had prepared a draft report  that  compared the tax burdens a hypothetical corporation would face if setting up shop in about 100 U.S. cities. (The study looked at two cities in most states but only one city in small states such as Rhode Island.) In that study Providence would have the third-highest commercial property taxes for a corporate headquarters, behind Des Moines and Columbia, S.C.

But what about residential property taxes? How would Providence rate against other cities?

We e-mailed Richard Morrison, a spokesman for the Tax Foundation, and asked whether he knew of any studies that compared the residential property tax rate of U.S. cities.

The closest the foundation had, said Morrison, was a county comparison, using data from the U.S. Census Bureau’s 2010 American Community Survey. Using that census information and the foundation’s property tax data web tool, Providence County -- of which the city of Providence is the largest  -- had the 98th highest property taxes out of 806 counties ranked by the census bureau.

Over five years, Providence County ranked 122nd out of 2,773 counties.

Still we kept looking for a city by city comparison.

The closest we came was a 2007 analysis by the census bureau’s American Community Survey, which offered a chart comparing the residential property tax rates for the largest city in each state.

At 100-percent valuation, Providence ranked sixth in the nation with a tax rate then of $22.84 per thousand. (It is now $31.89, second only in Rhode Island to Scituate’s $32.73)

Two communities within the top five (Bridgeport, Conn., and Philadelphia) were ranked as having higher property taxes but their rates were set at less than 100 percent valuation, which could have skewed Providence’s ranking.

Our ruling

1st District Democratic congressional candidate Anthony Gemma said during a radio debate last week that Providence’s taxes are ""amongst"" the highest in the country.

The word ""amongst"" by definition implies a generality, and the apparent lack of any specific city by city studies make comparing Providence’s tax rates difficult.

Still, several studies indicate that there is a high tax cost associated with living and doing business in Providence. They all generally support Gemma’s claim but none of them is exactly on point. Therefore because the statement would need ""additional information"" for further verification, we rate it Mostly True

(Get updates from PolitiFact Rhode Island on Twitter: @politifactri. To comment or offer your ruling, visit us on our PolitiFact Rhode Island Facebook page.)",[<zip object at 0x000002809679E440>],/factchecks/2012/sep/07/anthony-gemma/providence-taxes-are-among-highest-country/
"['National', 'Economy', 'Jobs', 'Barack Obama']","
Barack Obama says U.S. has gained a half-million manufacturing jobs
","
During his acceptance speech at the Democratic National Convention in Charlotte, N.C., President Barack Obama touted recent growth in manufacturing jobs.

""After a decade of decline, this country created over half a million manufacturing jobs in the last two and a half years,"" Obama said.

Because of the wording of his claim, we are examining whether the numbers are right, not whether Obama's policies were instrumental. To check the numbers, we turned to data from the Bureau of Labor Statistics, the federal government’s official source for employment numbers. We used seasonally adjusted statistics for manufacturing jobs.

A decade of decline

It’s not news that manufacturing jobs have been in decline in the United States in recent years, though sometimes with ups and downs. Generally, the decline has been due to broad economic shifts both inside and outside the United States, as well as changes in technology. Manufacturing’s share of U.S. employment was 29 percent in 1960, but it fell to just 9 percent by 2011. Even the raw numbers of manufacturing jobs fell over that period -- from 15.7 million to 11.7 million -- despite a large expansion of the overall U.S. workforce.

Between December 1999 and December 2009 -- the decade Obama appears to be referring to -- manufacturing employment fell from 17.3 million to 11.5 million, a decline of just over one-third. So Obama’s correct that manufacturing jobs had experienced ""a decade of decline"" by the time he took office. If you look at the chart (reproduced above) the downward slope is essentially uninterrupted.

Half a million manufacturing jobs created

During the period Obama chose -- from January 2010 to July 2012 -- manufacturing jobs began to rise again, by 532,000. That’s ""over half a million manufacturing jobs,"" as Obama put it.

It’s worth noting that while the reversal has been striking, this rise has still replaced only a fraction of the manufacturing jobs lost during the ""decade of decline."" The manufacturing jobs gained during the turnaround replaced less than 10 percent of the jobs lost during the decade of decline.

Our rating

The rise in manufacturing jobs that Obama is referring to may be modest compared to the prior decade’s decline, but he has described the numbers carefully. We rate his statement True.",[<zip object at 0x00000280973E6F00>],/factchecks/2012/sep/07/barack-obama/barack-obama-says-us-has-gained-half-million-ma/
"['National', 'Bankruptcy', 'Jobs', 'Jennifer Granholm']","
Granholm says Romney's response to auto crisis was 'Let Detroit go bankrupt'
","
Judging by the number of times they have brought it up in Charlotte, N.C., Democrats are ecstatic about the resurgence of the American auto industry. They offer it as slam-dunk proof that government intervention can revive, not stifle, private enterprise.

Jennifer Granholm, former governor of Michigan, took her moment at the podium and got the crowd roaring as she touted President Barack Obama's response to the crisis. ""He organized a rescue! He made the tough calls! And he saved the American auto industry! And you know, you know...Mitt Romney saw the same crisis and you know what he said: 'Let Detroit go bankrupt.' ""

Democrats like that line about Romney so much that, later in the speech, they projected the headline on the gigantic screen behind Granholm.

But here are some facts. Romney wrote an op-ed for the New York Times in November 2008. The headline does say ""Let Detroit go bankrupt,"" but Romney didn’t write that headline and those words don't appear in the text of the article. The line came from a headline writer at the New York Times.

We thought we should look at what Romney actually said and see if it represents the sort of callous tough talk that Granholm suggests.

Auto makers in crisis

When Romney wrote that piece, the Big Three - Ford, General Motors and Chrysler -- had just asked Washington for a bailout. With sales at their lowest levels in decades, credit markets frozen and cash running short, they were after $25 billion in loans. Democrats favored the deal if the government got a stake in the firms and could swap out some of the automaker CEOs. Many Republicans favored bankruptcy.

""I don't believe that the $25 billion they're talking about will make them survive,"" said Sen. Richard Shelby R-Ala. ""It's just postponing the inevitable.""

Generally, Republicans opposed government intervention. They believed the carmakers suffered from fundamental problems that only a bankruptcy could flush clean.

In that context, when people read the op-ed headline, they might have thought Romney meant ""Let Detroit go belly up.""

But that was not his point. Romney offered a more nuanced view of what ought to emerge out of a bankruptcy. It is worth reading what he said:
  
If General Motors, Ford and Chrysler get the bailout that their chief executives asked for yesterday, you can kiss the American automotive industry goodbye. It won’t go overnight, but its demise will be virtually guaranteed. 
Without that bailout, Detroit will need to drastically restructure itself. With it, the automakers will stay the course — the suicidal course of declining market shares, insurmountable labor and retiree burdens, technology atrophy, product inferiority and never-ending job losses. Detroit needs a turnaround, not a check. 
Romney called for a ""managed bankruptcy."" He didn’t define the terms, but he did list some of the desired outcomes. 
• New labor agreements to align pay and benefits to match those of workers at competitors such as BMW, Honda, Nissan and Toyota. Plus, lower retiree benefits. 
• Management as-is must go. New faces should be recruited from unrelated industries. 
• A new direction for the United Auto Workers, profit sharing or stock grants to all employees and a change in Big Three management culture. 
• An end to executive perks such as jets and private dining rooms. 
Romney had other items on his list, including making sure shareholders and lenders took it on the chin. ""They bet on management and they lost,"" he said.

As for the government’s role, he said it should invest in basic research in energy, fuel efficiency and advanced materials that would help carmakers produce better vehicles. At the very end of the op-ed, Romney said, ""the federal government should provide guarantees for post-bankruptcy financing and assure car buyers that their warranties are not at risk.""

In 2012, about four years after that first op-ed, Romney wrote another one. In it, he wrote ""The course I recommended was eventually followed. GM entered managed bankruptcy in June 2009 and exited it a month later in July. The Chrysler timeline was similarly swift.""

Romney went on to fault the administration for unfairly rewarding the unions with billions of dollars. ""Crony capitalism"" he called it.

That criticism aside, Romney is right in that many of the outcomes he listed in 2008 came to pass. The health benefits of retirees were taken completely off the automakers’ books and became the sole responsibility of a trust fund. Labor costs fell dramatically and now are on par with those of Honda, Toyota and other foreign automakers. That trust fund holds a large stake in Chrysler and a much smaller but still significant stake in General Motors. It might not be the form of employee stock ownership Romney had in mind, but it does tie the fate of retired workers to the profits of the company.

What Romney never mentioned in 2008 is what Washington would do to bring about those changes. The outcomes he praises came with a price tag of $23 billion, according to a recent Treasury Department estimate. That’s the gap between the $80 billion the government put into the deal and the $57 billion it expects back.

Romney’s managed bankruptcy would have required massive amounts of private capital, capital that would have been a challenge to raise in the best of times and this took place during a financial meltdown.

Without the infusion of cash from some source, all reports we have read and all observers we have found believe that some liquidation would have followed with much greater disruptions to the entire auto industry and the economy as a whole. However, no one knows for sure what would have been.

Our ruling

Granholm accused Romney of saying ""Let Detroit go bankrupt."" The line, a popular Democratic talking point, suggested that Romney wanted to let the auto companies go out of business.

That was the headline, which he did not write, and he was not suggesting the auto companies should go belly-up. But he did advocate a managed bankruptcy that would produce carmakers with lower labor costs and products that could compete better in the marketplace.

We rate the statement Half True. 
UPDATE: After we published this item, readers alerted us to a CBS TV interview where Romney addressed the ""go bankrupt"" question and he expanded on some of the things he mentioned in the op-ed about the need for a managed bankruptcy.

Romney stood behind the title of his op-ed, ""Let Detroit go bankrupt,"" but said his main point was to oppose government handouts with no strings attached and no demand that the automakers break away from the costs that were dragging them down. Bankruptcy was the way to make the necessary changes and would not be a liquidation.

Romney did use the words about letting Detroit go bankrupt but his meaning was more nuanced and he emphasized that he was not referring to liquidation. Our ruling does not change.",[<zip object at 0x0000028097712740>],/factchecks/2012/sep/07/jennifer-granholm/granholm-says-romneys-response-auto-crisis-was-let/
