tags,sub_header,text_body,quote_href
"['Oregon', 'Jobs', 'Kevin Cameron']","
Oregon House Republicans tout five-year plan for 50,000 jobs
","
Oregon House Republican leader Kevin Cameron came out swinging in January with a jobs plan that his caucus says could create 50,000 jobs over five years. The plan calls for a mix of tax cuts as well as job growth in forestry, farms and food processing. Cameron insists it’s not a partisan plan and has offered to work with House Democrats who share the chamber with Republicans 30-30.

Democrats said no, thank you, so we’re pretty sure the package won’t go anywhere this month. But a reader asked -- and we agree -- that the numbers need vetting. What’s their documentation for the claim that ""the plan could generate more than 50,000 jobs?""

As our sister organization PolitiFact Florida wrote in July 2010, we can’t weigh in on what may or may not happen in the future. But like PolitiFact Florida, we can check whether the House plan, as put together, actually calls for 50,000 jobs over five years. In other words, has a valid third party come by these numbers in some way?

Cameron is wise to use the word ""could."" And to put it into perspective, 50,000 jobs isn’t too big. Portland Mayor Sam Adams said way back when that he would bring 10,000 jobs over five years in the city. Also, Portland metro area employers added 14,200 jobs over the last year, according to December unemployment figures reported by The Oregonian’s Richard Read.

Nick Smith of the House Republicans provided emails and spreadsheets generated by the building’s nonpartisan Legislative Revenue Office, backed up by reports and data from Business Oregon and the state agencies of Employment, Forestry and Agriculture.

There are seven components to the plan:

(1) Water: Use 450,000 acre feet of water from the Columbia River to boost jobs in farm and food processing. The Agriculture Department estimates 72 acre feet of water could equal one direct job. That would yield 6,250 jobs, plus an additional 4,000 indirect jobs based on a multiplier used by Oregon State University.  

(2) Forests: Increase the amount of new growth timber harvested, adding 175 million board feet of timber to the 275 million board feet harvested in 2010. Legislative Revenue Officer Paul Warner checked with Forestry and calculated 7. 3 direct jobs for each million and 4.7 indirect jobs for each million, totaling 1,278 direct jobs and 823 indirect jobs.

(3) Enterprise: Create more enterprise and e-commerce zones, providing incentives to companies that promise to hire people. The Legislative Revenue Office estimates 4,900 direct jobs and 3,200 indirect jobs.

(4) Construction: Create an income tax credit for capital improvements to private homes and businesses. Legislative Revenue estimates the creation of more than 4,000 direct jobs and 2,600 indirect jobs.

(5) Unemployed: Give businesses a tax break to hire people. Legislative Revenue projects more than 600 direct jobs and 400 indirect jobs.

So far, that adds up to a little more than 17,000 direct jobs and roughly 11,000 indirect jobs. (Indirect jobs refers to the assortment of jobs that could be propped up by the direct job, such as at companies that supply material or at bars that serve thirsty new workers.)

The final two proposals rely on a ""general equilibrium analysis,"" and not impact analysis, which is why there’s no breakout between direct and indirect jobs.

(6) Taxes: Double the income in the two lowest tax brackets, and provide a $250 per child tax credit. Combined, this should save a family of four with an adjusted gross income of $35,000 a year, about $927 a year. Legislative Revenue Office estimates more than 18,500 jobs at the end of five years.

(7) Capital gains: Reduce the tax rate to 2.5 percent for two years, and then increase to 5 percent. This is expected to translate into nearly 3,800 jobs in 2016.

Again, PolitiFact Oregon is not in a position to second-guess economic modeling by Legislative Revenue. But we did ask Paul Warner, the top man there, and Chris Allanach to walk us through some of the analyses. At the end, we asked: Is it fair to say this plan could result in 50,000 jobs?

""Overall, I think it’s objective and under certain conditions I think those are reasonable approximations,"" Warner said. But, he also added, who knows what sorts of global and national factors might have an impact on our jobs picture five years from now?

We turned to House Democrats to get their take. Jared Mason-Gere directed us to Steve Robinson, a consultant and former state analyst. Robinson questions the numbers -- as well as the philosophies behind the tax cuts -- and reminds us of jobs lost by the reduction in money to the public sector, such as at the Department of Human Services. (He points us to a report by ECONorthwest that examines the impact of loss of funding on long-term care workers.)

We totally get that economists could measure impact on jobs in different ways. But the only real question we had left for Warner was whether his analyses regarding taxes and capital gains projected net jobs, in other words, accounting for losses as well as gains. He said yes, after a five-year period.

""So when you reach this new equilibrium state, your private sector is bigger and your public sector is smaller,"" Warner said.

We have a ruling to make. We stated upfront that we don’t have the economic credentials to second-guess these numbers, but we’ve largely cleared them of political manipulation. There are caveats galore, but House Republicans have relied on neutral third-parties to come up with job impact analyses.

The only quibble we have is that indirect jobs are not the same as direct jobs estimated, and the statement should have included the distinction. Still, we end up with nearly 40,000 direct jobs estimated. We rate the statement Mostly True.",/factchecks/2012/feb/11/kevin-cameron/oregon-house-republicans-tout-five-year-plan-50000/
"['National', 'Health Care', 'Barack Obama']","
Barack Obama says preventive care 'saves money'
","
It’s been a staple of health care politics for years -- the claim that preventive care saves money. A little money up front, lots of money saved on the back end. Patients living longer and healthier lives. That makes sense, right? 
But while there’s little doubt that preventive care saves lives, the money is a different story. In general, academic studies do not support the idea that paying for preventive care ultimately saves money. 
We first published that conclusion in 2009, when we rated True a claim by New York Times columnist David Brooks that preventive care does not save the government money. When President Barack Obama claimed it did save money in a September 2009 speech to Congress, we rated it False. 
On Feb. 10, 2012, Obama revived this line of argument. His comments came during a media briefing to announce a partial reversal of a policy that would require church-affiliated organizations such as hospitals to provide a package of free preventive coverage, including contraception. Catholic groups criticized the policy -- which was set in motion by Obama’s health care law in 2010 -- on the grounds that it conflicted with churches’ religious beliefs. 
In announcing a partial shift of policy, Obama said, ""As part of the health care reform law that I signed last year, all insurance plans are required to cover preventive care at no cost. That means free check-ups, free mammograms, immunizations and other basic services. We fought for this because it saves lives and it saves money –- for families, for businesses, for government, for everybody. That’s because it’s a lot cheaper to prevent an illness than to treat one."" 
However, as we wrote in 2009, it’s not true that preventive care generally ""saves money."" 
Brooks' critique relied on estimates by the Congressional Budget Office. ""The evidence suggests that for most preventive services, expanded utilization leads to higher, not lower, medical spending overall,"" CBO director Douglas Elmendorf wrote in an Aug. 7, 2009, letter to Rep. Nathan Deal, the top Republican on a congressional subcommittee involved in the debate. 
Elmendorf explained that while the cost of a simple test might be cheap for each individual, the cumulative cost of many tests adds up: 
""But when analyzing the effects of preventive care on total spending for health care, it is important to recognize that doctors do not know beforehand which patients are going to develop costly illnesses. To avert one case of acute illness, it is usually necessary to provide preventive care to many patients, most of whom would not have suffered that illness anyway. ... Preventive care can have the largest benefits relative to costs when it is targeted at people who are most likely to suffer from a particular medical problem; however, such targeting can be difficult because preventive services are generally provided to patients who have the potential to contract a given disease but have not yet shown symptoms of having it."" 
In fact, a government policy to encourage prevention could end up paying for services that people are already receiving, including breast and colon cancer screenings and vaccines, Elmendorf said. 
Other studies backed up the CBO's analysis, including a Feb. 14, 2008, article in the New England Journal of Medicine that was written in response to campaign promises for more preventive care. 
""Sweeping statements about the cost-saving potential of prevention ... are overreaching,"" according to the paper. ""Studies have concluded that preventing illness can in some cases save money but in other cases can add to health care costs."" They write that ""the vast majority"" of preventive health measures that were ""reviewed in the health economics literature do not"" save money. 
""Some preventive measures save money, while others do not, although they may still be worthwhile because they confer substantial health benefits relative to their cost,"" the authors write. ""In contrast, some preventive measures are expensive given the health benefits they confer. In general, whether a particular preventive measure represents good value or poor value depends on factors such as the population targeted, with measures targeting higher-risk populations typically being the most efficient."" 
Meanwhile, a separate study conducted by researchers from the American Diabetes Association, American Heart Association and the American Cancer Society concluded that, while interventions to prevent cardiovascular disease would prevent many strokes and deaths, ""as they are currently delivered, most of the prevention activities will substantially increase costs."" 
To make sure that the data hadn’t changed dramatically since we last looked at this issue, we contacted Peter J. Neumann, director of the Center for the Evaluation of Value and Risk in Health at the Institute for Clinical Research and Health Policy Studies at Tufts Medical Center. He was one of the three co-authors of the New England Journal of Medicine article. 
He said the patterns his group found in 2008 have not shifted dramatically since then. 
""Sometimes preventive measures save money, sometimes not,"" Neumann said. ""The general message is that it depends."" 
Milton C. Weinstein, one of Neumann's co-authors, agreed. ""In general, the comparative effectiveness literature supports the general proposition that preventive care does not save money,"" said Weinstein, a professor of health policy and management at the Harvard School of Public Health. 
Our ruling 
As a general notion, the idea that ""preventive care … saves money, for families, for businesses, for government, for everybody"" is no more true today than it was in 2009. Yes, preventive measures often save lives and keep patients healthier. Certain preventive measures may save money as well. But the findings of CBO and physicians who have studied the medical literature indicate that Obama’s sweeping generalization that preventive services save money is not accurate. We rate the statement False.",/factchecks/2012/feb/10/barack-obama/barack-obama-says-preventive-care-saves-money/
"['Abortion', 'State Budget', 'Texas', 'Rick Perry']","
Rick Perry says he signed legislation leading to closings of 12 abortion clinics
","
At a Personhood USA forum in South Carolina last month, Texas Gov. Rick Perry praised a move by Texas lawmakers to ""de-fund"" Planned Parenthood, which runs family planning and abortion clinics around the country.

According to a Jan. 18, 2012, account by Politico, Perry said: ""I was really proud to be able to sign legislation that we worked with our legislature to defund Planned Parenthood in the state of Texas. There are 12 abortion clinics that aren’t open in the state of Texas today because our members of the Legislature had the courage, the wisdom to do that.""    

Perry’s statement, made the day before he dropped his bid for president, came to our attention from Sarah Wheat, interim co-CEO of the Austin-area Planned Parenthood, who told us via email that none of the clinics Perry referenced provided abortions -- and that 11, not 12, clinics closed.

Wheat told us the Texas clinics to which Perry referred were ""nonprofit health centers … that provided family planning health exams, cancer screenings, treatment for sexually transmitted infections and other basic health care."" Wheat said in another email that the clinics were located in Arlington, Gainesville, Mesquite, Plano, Terrell, Mission, Progreso, Rio Grande City, San Carlos, Alice and Brownsville. She said clinics that provide abortions are ineligible for state funds, while the closed clinics had been receiving state money until September 2011, the beginning of the state’s new fiscal year.

Carrie Williams, a spokeswoman for the Texas Department of State Health Services (DSHS), advised by email that there are now 156 state-supported family planning clinics -- compared to 300 through August 2011. Previously, such clinics served 220,000 women a year, she said, while expectations are that the remaining state-supported clinics will serve about 60,000 women a year through August 2013.

In a telephone interview, Williams confirmed  that abortion clinics do not receive state or federal funding. In an email, she said the clinics that closed had each received state funding in 2011.

Separately, she said that had those clinics provided abortions, they would not have been eligible for state money.

Perry repeated his characterization of the shuttered clinics at a Feb. 6, 2012, Republican Party event north of Austin, according to a KVUE-TV report. ""Since I signed that budget,"" Perry said then, ""there have been about a dozen Planned Parenthood 'abortion clinics' that have shut down in this state. There are lives that have been saved.""

We asked Perry spokesman Josh Havens for backup information on the governor’s claim that legislative action caused abortion-providing clinics to close. Havens  said in a telephone interview that he didn’t know which, if any, of the clinics performed abortions. Regardless, Havens said, he would ""make the argument that a Planned Parenthood clinic is an abortion clinic.""

""Even if the specific clinic was (for) family planning, it’s affiliated with its parent organization, which does do abortions,"" Havens said.

Havens agreed in an email that clinics that provide abortion services are ineligible for state funds.

The Planned Parenthood Federation of America Inc. bills itself as ""the nation's leading sexual and reproductive health care provider and advocate"" and runs its sexual health clinics through local affiliates. About 3 percent of the services Planned Parenthood offers are abortion services, the organization says.

In Texas, 14 Planned Parenthood-affiliated clinics provide abortions, according to information on Planned Parenthood’s website. Wheat said its 51 other clinics in the state focus on preventive services, including the provision of contraception and screenings for cervical and breast cancer. The organization also offers some services for men.  

Nationally and in Texas, whether government funding should pay for abortions has long been debated.

Title X of the Public Health Service Act, enacted in 1970, stipulated that federal family planning funds could not be used for abortions, according to Elizabeth Nash, a specialist in state-level sexual health policy at the pro-abortion rights Guttmacher Institute. In 1976, Congress passed the Hyde amendment, significantly reducing federal funding of abortions by banning Medicaid and other programs from spending federal funds on the procedures except in cases of rape or incest, or when the woman’s life is in danger.

In Texas, various laws have addressed the issue of state funding for abortions since the 1990s. But 2003 was a pivotal year. Before then, ""Planned Parenthood and other providers that pay for abortions with non-tax dollars received state money to provide Pap smears, well-woman exams, counseling and mammograms, mostly for low-income patients,"" according to a May 23, 2003, Austin American-Statesman news article.

In 2003, the newly Republican-majority Texas House and Republican-steered Senate agreed to a budget provision barring federal family planning funds from being distributed to health care facilities that performed abortions.  In subsequent legislative sessions, lawmakers renewed that language in each budget. Sometimes, they advanced into law additional proposals intended to keep public funds from reaching abortion providers and clinics affiliated with the providers.

So, what exactly did the 2011 Legislature do that affected the Planned Parenthood clinics?

To our inquiry, Williams of the DSHS pointed out two actions.

First, Williams said, lawmakers reduced the department’s family planning funding by two-thirds. That is, they appropriated $38 million for family planning services for 2012-13, compared to the $111 million budgeted in 2009-10. Williams said the reduction wiped out funds to some of the Planned Parenthood clinics that ultimately shut down.

Besides the funding cut, Williams said, lawmakers advanced two measures, House Bill 1 and Senate Bill 7, restructuring the way funding is allotted for the DSHS-supported family planning centers in the state.

""It stands to reason that (there are fewer clinics now) because of the budget cuts,"" Williams said. ""The budget for family planning was reduced dramatically, and that’s going to change the financial outlook for clinics. There’s less money available.""

Under the restructuring provision, state family planning aid is awarded first to public entities, like state health clinics, that provide family planning services, and last to clinics--like Planned Parenthood--that don’t provide comprehensive health services.

The budget cuts and establishment of the tiered funding system ""changed the landscape for Planned Parenthood and other providers,"" Williams said.

Wheat said that the cut in family planning aid caused the Planned Parenthood clinics to shut down. ""The number one, primary reason for these closures is there’s one-third of the funds that used to be available,"" she said. ""There’s precious few dollars in the state that are left.""

Some Planned Parenthood clinics, including an East Austin clinic now dependent on donations, had previously relied on the state funding to survive, Wheat said. She speculated that when Perry celebrated the 12 closures, he might have been including the East Austin clinic.

So, legislative moves approved by Perry evidently led to at least 11 Planned Parenthood clinic closings.

Presuming those clinics did not provide abortions, since they were eligible for state money, we asked Wheat whether shuttered clinics could still be reasonably associated with abortion clinics -- and if that, as Perry’s spokesman suggested, makes them about the same as abortion clinics.

Wheat said the family planning clinics and abortion service providers were entirely separate, independent nonprofit organizations, per language inserted into each budget since the 2003 legislative session that requires the separation of such institutions in order for family planning clinics to be eligible for state funds.

""We are all Planned Parenthood health centers, but the services that are provided and how we’re legally operated and governed, those are all completely independent,"" Wheat explained.

She said that while Planned Parenthood family planning and abortion clinics fall under the same umbrella organization, and all have to meet certain requirements--professional standards for personnel, for example--the two kinds of clinics are entirely separate, maintaining different bank accounts, different governing boards and filing separate tax returns.

At Planned Parenthood family planning clinics, Wheat said, counselors inform women facing unintended pregnancy of three options: adoption, abortion or prenatal care. Wheat said that if a woman chooses the abortion option, a counselor talks with her about how to proceed and offers a list of resources including abortion providers. However, Wheat said, the family planning clinics do not transfer any client’s medical records to an abortion clinic or otherwise provide medical referrals. Clinics will, however, transfer official medical records for women who opt for prenatal care, she said.

As we closed out this research, we asked Joe Pojman, executive director of the anti-abortion Texas Alliance for Life, to assess Perry’s statement. Pojman said that as far he knows, no Texas abortion clinics shut down as a result of Texas legislative decisions in 2011. Perry, he speculated, was suggesting that Planned Parenthood’s family planning clinics are closely related to the abortion services affiliated with the overarching Planned Parenthood group.  

Havens responded to a follow-up request for clarification of the governor’s statement in an email: ""The governor meant what he said. Planned Parenthood clinics either perform abortions or refer women to affiliated abortion clinics. Neither the governor nor the Texas Legislature make a distinction between whether the abortion is performed on premises or enabled through an affiliate. When a Planned Parenthood clinic closes, it can no longer perform this function.""

Our ruling

Planned Parenthood clinics shut down due to legislative decisions approved by Perry. 
But Perry's key point -- that the clinics provided abortions -- is unsupported. Abortion providers had been ineligible for state funding for years. This reference to abortion is critical to Perry's claim, which we rate Mostly False.",/factchecks/2012/feb/10/rick-perry/rick-perry-says-he-signed-legislation-leading-clos/
