tags,sub_header,text_body,sources,quote_href
"['Georgia', 'Religion', 'Wilton Gregory']","
Mansion move sparked by church growth?
","Atlanta Archbishop Wilton D. Gregory has promised to find a new place to live since getting an earful from some Catholics -- and unwelcome national attention -- about his new 6,186-square-foot, $2.2 million residence on Habersham Road in Buckhead. In a statement he issued March 31, the archbishop said he had no desire to move to the Tudor-style mansion in the first place. ""However, the Cathedral parish has a problem, albeit a happy one,"" he said. ""The Cathedral of Christ the King is one of our largest, most vibrant and fastest-growing parishes — but it is landlocked."" PolitiFact deemed the archbishop’s statement worthy of a fact check, given all the hoopla. A review of some numbers, as well as some number crunching, should settle the questions: Is it one of the largest of the 99 Catholic churches that are part of the Archdiocese of Atlanta? And is it one of the fastest-growing? We requested membership data for at least five years. But the bulk of what we received was from 2012 and 2013. And looking at that data and limited information that was provided from 1997, the answer to each question is yes. According to the Official Catholic Directory, the Cathedral of Christ the King was the second-largest church in the archdiocese in 1997, based on the number of families, or households. It had 3,505 at the time. Fast-forward to 2013, and the cathedral on Peachtree Road in Buckhead was the archdiocese’s third-largest parish, with 4,842 families. Only St. Michael’s in Gainesville and St. Thomas the Apostle in Smyrna were larger, with 7,054 and 6,844 families, respectively. The cathedral’s congregation grew 9.6 percent between summer 2012 and summer 2013, adding 426 families, according to the archdiocese’s data. By our calculations, that made it the archdiocese’s 15th-fastest-growing of all the churches that year and, among the bigger churches, the second-fastest-growing. St. Joseph’s in Dalton grew the most, 23.2 percent or 509 families, while more than 30 parishes in the archdiocese had virtually no growth or lost families in that same time, the data show. The cathedral was built in French Gothic architectural style and named ""the most beautiful building in Atlanta"" by Architectural Record in 1939, two years after its completion. Some would say it remains a contender today. Members of the parish come from more than 150 ZIP codes in metro Atlanta. Priests at the cathedral presided over more than 1,200 daily Masses, 624 weekend Masses, more than 500 Baptisms, 128 weddings and 49 funerals in 2013. Seven adult choirs and four children’s choirs chimed in at many of these events. The cathedral became part of the recent controversy after Joseph Mitchell, a parishioner at Christ the King and the nephew of ""Gone With the Wind"" author Margaret Mitchell, left $15 million and his home on tony Habersham Road to the archdiocese. Mitchell requested that the archdiocese use the inheritance for ""general religious and charitable purposes."" He also asked that Christ the King get primary consideration. The cathedral was given $7.5 million for its building program and spent $1.9 million of that to buy the archbishop’s longtime residence nearby on West Wesley Road. The goal was to convert the archbishop’s old home into a rectory, or residence, for the cathedral’s six priests. That would allow the rectory that’s on the cathedral’s campus to eventually be replaced with worship and meeting space. (The cathedral is effectively landlocked. It’s surrounded by streets on three sides, and it is restricted from developing on its east side for 20 years. That was part of a deal negotiated with the neighborhood that allowed the church to develop a youth recreation area.) Meanwhile, Mitchell’s home on Habersham Road was torn down. In its place and with part of the proceeds from the sale of the West Wesley residence, the archbishop’s new $2.2 million mansion was built, equipped with two dining rooms, an elevator and a second-floor safe, or panic room. Gregory, long-rumored to be a candidate on the short list to succeed soon-to-be-retiring Chicago Bishop Francis George, moved to the new residence on Habersham in January. He initially defended the move, which critics said went against Pope Francis’ call for modest living. He later apologized. ""I am disappointed that, while my advisers and I were able to justify this project fiscally, logistically and practically, I personally failed to project the cost in terms of my own integrity and pastoral credibility with the people of God of north and central Georgia,"" Gregory wrote. The archbishop promised to sell the house and move elsewhere. We’re told that’s still the plan today. In summary: We decided to fact-check the archbishop’s statement largely on two points: Is the Cathedral of Christ the King one of the archdiocese’s largest churches? And is it one of the diocese’s fastest-growing churches. The data we were provided say yes. But they allowed only a limited comparison, and the information could not be independently verified. We rate the archbishop’s statement Mostly True. Top 10 parishes in 2013 1997 Registration Data 2013 Registration Data % Growth # Growth St. Michael, Gainesville 1,500 7,054 370% 5,554 St. Thomas the Apostle 1,514 6,844 352% 5,330 Cathedral of Christ the King 3,505 4,842 38% 1,337 St. Joseph, Marietta 2,053 4,804 134% 2,751 Our Lady of the Americas Mission of IHM, Data not Recorded 4,665 St. Ann 3,960 4,381 11% 421 Transfiguration 2,700 4,323 60% 1,623 St. Brigid Did not exist 4,056 St. Benedict 2,604 4,004 54% 1,400 St. Thomas Aquinas 2,524 3,930 56% 1,406 Source: Archdiocese of Atlanta Sources:",[<zip object at 0x000002809704B240>],/factchecks/2014/may/02/wilton-gregory/mansion-moved-sparked-church-growth/
"['Government Regulation', 'PunditFact', 'Guns', 'Sarah Palin']","
Sarah Palin: Eric Holder wants gun owners to wear ID bracelets
","""Waterboarding is how we baptize terrorists"" was not the only questionable thing Sarah Palin said during her recent speech to National Rifle Association enthusiasts. In stirring up concerns about gun rights, the former Alaska governor and 2008 vice presidential nominee turned conservative rabble-rouser misrepresented comments from Attorney General Eric Holder about investments in smart-gun technology. ""Every day we are seeing more and more efforts to strip away our Second Amendment rights,"" Palin told the crowd. ""They are trying,"" she said, before leading into her claim about Holder. ""Recently, he reveals this idea to have government have gun owners wear bracelets, special bracelets, that would identify you as a gun owner,"" Palin said. ""Well, hey, Holder, you don't want to go there, buddy."" There is more to the story than Holder wanting gun owners to wear identifying bracelets. Holder’s comments on gun bracelets Holder uttered the words ""guns"" and ""bracelet"" before a House appropriations subcommittee on April 4, 2014, as he testified about his agency’s 2015 budget request. U.S. Rep. Andy Harris, R-Md., asked Holder about requested grants to ""encourage development of innovative gun safety technology."" Holder explained the grant request stems from a White House-driven meeting amid talk of gun regulation reforms. ""We talked about how guns can be made more safe by making them either through fingerprint identification, the gun talks to a bracelet or something that you might wear, how guns can be used only by the person who is lawfully in possession of the weapon. ""It’s those kinds of things that I think we want to try to explore so that we can make sure that people have the ability to enjoy their Second Amendment rights, while at the same time decreasing the misuse of weapons that lead to the kinds of things that we see on a daily basis, you know, where people, kids especially, are struck down by ..."" Harris cut him off, saying ""sure, no one wants that to occur,"" and moved on. Holder’s comment about new gun technology was picked up a few days later in an April 7 Washington Free Beacon story under the headline, ""Holder: We Want to Explore Gun Tracking Bracelets."" From there, it was picked up by Fox News, InfoWars, Townhall.com and the National Rifle Association, among others. In each case, the coverage focused on the idea of ""gun tracking bracelets."" But the technology doesn’t track gun owners, and it doesn’t always require a bracelet. Smart guns and the Department of Justice Holder had smart guns on his mind because of President Barack Obama and reforms he sought after the Sandy Hook Elementary School shootings. Obama directed Holder, via one of 23 executive orders, to release a report on gun safety technology ""and challenge the private sector to develop innovative technologies."" As he mentioned in his testimony, the department’s National Institute of Justice released a report in June 2013 assessing the marketplace, and Holder chaired a meeting with industry leaders and experts at the White House. Smart guns are also called ""owner-authorized guns,"" ""childproof guns"" and ""personalized guns."" Basically, these are firearms made with electronic chips and sensors that can discern an authorized user from an unauthorized user. The gun will fire if it recognizes the owner and won’t if the owner is not recognized. Some high-tech models include a fingerprint reader that works kind of like the one in new iPhones (or James Bond’s personalized gun in Skyfall). Other models include the capability to read a radio signal from a transmitter embedded into a bracelet, ring, watch or pin worn by the gun owner, or even a chip implanted in the hand. ""If that is within a certain programmed distance to the gun, the gun mechanically makes itself operable,"" said Stephen Teret, a smart-gun proponent, professor at Johns Hopkins Bloomberg School of Public Health and director of the Center for Law and the Public’s Health. ""If it’s not within a certain distance, the gun won't work."" So the short signals emitted in smart-gun technology do not function like GPS on mobile phones and other devices. The lack of GPS technology would prevent the government from identifying and tracking gun owners, should the government try, said Mike Bazinet, spokesman for the National Shooting Sports Foundation, a firearm and ammunition trade group. Bazinet noted that doesn't mean the group isn't concerned about that prospect. The technology could require a bracelet. It could also require a watch, a ring, a pin, or even just a fingerprint, experts say. The point is there is no plan to identify gun owners with a ""scarlet letter"" bracelet. Origins and controversies Teret says the earliest smart gun was developed by Smith & Wesson in the 1880s. The manufacturer added a metal lever to the back of its handguns, requiring a person to press the the lever and the trigger at the same time to fire the weapon. A child’s hand would be too small to do that, thus preventing accidental injuries and deaths. Manufacturers started thinking about incorporating electronics into guns in the early 1990s to make them safer. The concept had support from the Bill Clinton administration, lost steam during the George W. Bush years, and then re-emerged after the Newtown, Conn., school shootings under Obama, Teret said. International companies, such as Armatix in Germany and TriggerSmart in Ireland, are ahead of the curve, thanks in part to less political resistance, Teret said. But there is technology emerging in the United States. Utah-based Kodiak Industries is offering the Intelligun, a fingerprint-locking system installed onto a 1911-style, .45 caliber pistol, for $399. This year, a California gun retailer told the Washington Post he planned to sell the Armatix iP1 .22 caliber pistol, an $1,800 product that works with a black stopwatch and PIN code that emits radio signals to the gun when worn by the right user. It was supposed to be the first smart gun sold in the United States, but the owner and Armatix representative received backlash from gun rights activists, and the plans were scrapped. Here’s what the iP1 looks like:  It’s not the development of smart guns that concerns the firearms industry, Bazinet said. It’s government’s embrace of them. A New Jersey law, the only one of its kind, requires after three years from the first smart gun being sold in the United States that all new guns sold in the state be built with this technology. To Bazinet, smart guns won’t be ready for mass use until police forces are using them. His group has warned about defective guns and dead batteries while saying consumers should be able to buy them if they want. Of course, none of this information changes the veracity of Palin’s comments about ID bracelets for gun owners. It just shows how wrong she was. Emails to Palin’s political action committee were not returned. Our ruling According to Palin, Holder recently revealed ""this idea to have government have gun owners wear bracelets, special bracelets, that would identify you as a gun owner."" That’s far from the truth. Holder said he wants the federal government to explore gun safety measures, including smart-gun technology that would prevent weapons from being fired by anyone except their rightful owner. The comment in question came as he explained why his agency is seeking federal money for grants to spur research into safer guns. He listed fingerprint identification and the gun talking ""to a bracelet or something that you might wear"" as tools that could prevent a gun owner’s firearm from being used by someone else. Some smart guns are powered by bracelets with embedded radio signal transmitters, but that’s just one way this could work. The purpose of accessories worn in order to fire a smart gun is not to help the government track owners or identify them (again, Holder is pursuing no such policy). The goal of the emerging technology is to minimize shootings caused by suicides, children or stolen guns. We rate Palin’s claim False.",[<zip object at 0x000002809704B400>],/factchecks/2014/may/01/sarah-palin/sarah-palin-eric-holder-wants-gun-owners-wear-id-b/
"['New Hampshire', 'Health Care', 'Americans for Prosperity']","
AFP says health care premiums up 90 percent in New Hampshire
","A new ad by the free-market group Americans For Prosperity takes a swipe at Sen. Jeanne Shaheen, D-N.H., for her support of President Barack Obama’s health care law. The ad, released in April, proclaims, ""Health care premiums up 90 percent in New Hampshire.""   New Hampshire residents may have heard this claim before. Earlier this month, the New Hampshire GOP said in a press release that ""health care premiums are ‘skyrocketing’ and have increased 90 percent in New Hampshire because of ObamaCare."" The release went on to say that ""ObamaCare is an unmitigated disaster that is raising the cost of health care for the middle class."" Nearly identical claims were tweeted by GOP Chairwoman Jennifer Horn and by former Sen. Scott Brown, who is running against Shaheen. A 90 percent increase seemed like a lot, so we decided to check the numbers. The claim stems from a blog post at Forbes.com, which was based on a study by the investment firm Morgan Stanley. The Morgan Stanley study takes a look at ""individual and small-group rate increases."" Respectively, those categories of health insurance refer to plans purchased by individuals on their own, and by smaller companies. A third category of private insurance -- large-group plans -- were not included in the study, even though those typically represent the most commonly held form of insurance. So, the first thing to note is that while the study only looked at a subset of all health care premiums, the ad’s claim doesn’t make that distinction. Another issue: Individual plans, and to a lesser extent small-group plans, have long been expected to produce larger premium increases than large-group plans. This is because existing individual- and small-group policies were less likely to include all of the requirements enacted under Obama’s law, such as free preventive care. To make up for those shortfalls in benefits, these plans were expected to raise premiums. In fact, while the Morgan Stanley study pegged individual plan increases at 90 percent in New Hampshire, it said that small group plans increased by 15 percent. In other words, the ad cherry-picked the bigger increase statistic and ignored the other. Then there’s the methodology of the study itself. Morgan Stanley surveyed 148 insurance brokers nationally, with only one being from New Hampshire, as reported by Factcheck.org. That’s too small a sample to produce a reliable statistic, experts say. Using just one respondent is like ""calling one person up on the phone and asking their opinion,"" Robert Santos, chief methodologist at the Urban Institute told FactCheck.org. The survey also reported a 100 percent increase in Delaware’s health care premiums, where only one broker was surveyed. In fact, the statistic caught the eye of officials at the New Hampshire Department of Insurance, who asked to see the Morgan Stanley survey. They were told ""it was proprietary and confidential,"" according to department spokeswoman Danielle Barrick. ""We don’t understand how Morgan Stanley is able to generalize what’s going on in the New Hampshire market based on talking to 158 brokers nationally,"" Barrick said. We reached out to Americans for Prosperity New Hampshire, who stood by the claim. ""Forbes has not updated, corrected or retracted its original story,"" AFP-NH state director Greg Moore said. "" Accordingly, one must assume that the news outlet is standing by its work."" Unfortunately, hard data on any premium increases since people were allowed to sign up for the Affordable Care Act does not exist, the insurance department said. However, the Morgan Stanley study, if it were reliable, would suggest premium increases far beyond projections in an earlier study by the state insurance department. That study said the Affordable Care Act would increase premiums on the individual market by about 30 percent. And costs would actually fall, not rise, once federal subsidies are taken into consideration. Income-based subsidies are available to consumers who purchased health care through the marketplace created under the Affordable Care Act. After subsidies, the study projected, individual premiums would decrease by 9 percent. Premiums, however, were projected to go up by a ""significant"" amount for people without subsidies. By the end of February, 22,000 Granite Staters had purchased a plan through the marketplace. The department said that 83 percent of consumers with marketplace plans have been eligible for financial assistance. As for ""small group"" plans, their increases were expected to range between 1 percent and 3 percent. Finally, we asked the Department of Insurance whether they thought it was possible for an individual in New Hampshire to experience a 90 percent rise in their own premiums. Barrick said it’s hard to know for sure, since premiums vary based on age, tobacco use and the number of people covered under a certain policy. The department said it’s possible for a resident -- especially someone older, who smokes and earns too much to get a federal subsidy -- to move from an employer-sponsored policy with a low employee-contribution rate to a policy in the individual market and find themselves ""paying much more."" ""However,"" Barrick added, ""the fact that the person is paying more does not mean premiums went up in the aggregate"" for all New Hampshire residents, as the ad says. Our ruling Americans for Prosperity said that health care premiums are ""up 90 percent in New Hampshire."" The claim cited a Morgan Stanley report that based its New Hampshire numbers on data from just one insurance broker in the state. Experts say that’s far too small a sample to say anything definitive about what’s happening to premiums in the state. It’s possible for some individuals, given the wrong combination of income and health factors, could see premium increases of 90 percent. But that’s a far cry from saying that such increases are typical in the state. This statement is not accurate. We rate it False.",[<zip object at 0x0000028097725B40>],/factchecks/2014/may/01/americans-prosperity/afp-says-health-care-premiums-90-percent-new-hamps/
