tags,sub_header,text_body,sources,quote_href
"['Immigration', 'Crime', 'Texas', 'Ken Paxton']","
Ken Paxton draws on debunked figures, says 'illegals' committed 600,000 crimes in Texas since 2011
","Republican Ken Paxton, the Texas attorney general seeking a second term against Democrat Justin Nelson, invoked previously debunked numbers when he was asked about Democrats seeking to decriminalize border crossings. Paxton, in an Aug. 26, 2018, appearance on ""Fox & Friends,"" called decriminalizing crossings ""a little scary,"" telling the host: ""Obviously, you know we’re a border state. We are struggling with protecting our border, protecting our people. To have a policy like this that takes away criminalizing crossing the border, you’re basically opening up your borders. ""And the reality is we already struggle with this,"" Paxton went on. ""We’ve had over 600,000 crimes committed by illegals since 2011. Over 1,200 homicides. We've had human trafficking. We've had all kinds of drug crimes. And if we make it more lenient, we’re going to get more of it. So, it’s going to cost lives if we go down this path,"" Paxton said. An Aug. 23, 2018, Huffington Post news story quoted Texas’ Democratic gubernatorial nominee, Lupe Valdez, and a Democratic U.S. House nominee, Veronica Escobar of El Paso, speaking favorably about no longer charging border crossers with criminal violations. The story quoted Beto O’Rourke, the Democratic U.S. Senate nominee, specifying that people seeking asylum at the border shouldn’t be charged with criminal violations. We can’t check a prediction about what happens if fewer people crossing the border get charged with crimes. But the big crime counts aired by Paxton reminded us we’ve long found flaws in citations of counts of crimes and homicides attributed to information publicized by the Texas Department of Public Safety, the lead state agency tasked with helping keep watch over the Texas-Mexico border. Let’s plumb our relevant past fact-checks before reviewing the meat of Paxton’s statement. Rick Perry's flammable 2014 claim In July 2014, Gov. Rick Perry warned about the security of the Texas-Mexico border by  declaring that more than 3,000 homicides had been committed by ""illegal aliens"" in six years. Pants on Fire, we ruled, in that Perry had misrepresented figures on a DPS web page that could be read, at worst, to indicate that in their lifetimes, an unspecified subset of 203,685 ""criminal alien defendants"" booked into Texas jails over the nearly six years through June 2014 had been charged with--not convicted of committing--3,070 homicides. We identified other complications that, it turned out, also weakened a pair of subsequent claims we checked that were based on DPS-posted numbers. To begin with, the term ""criminal aliens"" is generally used by law enforcement to identify noncitizens residing in the U.S. who are convicted of a crime--and such individuals include people living here legally or without legal authorization. Also, Michael Walker, an adjunct professor at the John Jay College of Criminal Justice in New  York, said the DPS information didn’t even demonstrate the homicides occurred any time recently or in any particular state. Meantime, Northeastern University criminologist Ramiro Martinez, Jr. built his own analysis of Texas crime numbers and told us that if Perry’s claim held up, it would mean that more than half the state’s homicides in the six years were committed by unauthorized residents--an absurdity. ""It just boggles the imagination that level of ‘aliens’ were involved to that extent over time and nobody noticed,"" Martinez commented. Two 2018 immigrant-crime claims Early this year, we replowed DPS-posted numbers before rating Pants on Fire Lt. Gov. Dan Patrick’s statement that ""566,000 crimes"" had been ""made in Texas by criminal aliens in the last six years."" At the time, the DPS said that more than 638,000 charges and over 286,000 convictions had been accumulated by more than 240,000 ""criminal aliens"" booked into Texas jails in the latest six-plus years--as before, we confirmed, the charges had been amassed through their ""criminal careers."" We’ve posted the charts offered as factual back-up by Perry and Patrick, respectively, here. In March 2018, most recently, we rated False a claim by Sean Hannity of Fox News that  642,000 crimes were committed against Texans by criminal immigrants in a recent seven-year period. We found that Hannity’s claim, triggered by DPS-posted figures, reflected on mostly petty charges leveled through the lifetimes of 245,000 ""criminal aliens"" booked into local Texas jails from June 2011 through February 2018--and 34 percent of them weren’t identified as living in the U.S. without legal authorization at their latest arrest, the DPS said. Generally, nonviolent offenses predominated, accounting for 66 percent of the tallied charges and 55 percent of career convictions. Martinez looked over these DPS-posted numbers, later saying that to his eyes, they reflected what’s known about most domestic crime--a ""sea of minor drug and property crimes."" Paxton points to DPS figures In May 2018, we emailed a DPS spokesman, Tom Vinger, seeking to learn more about data fueling the DPS’s evolving posts about immigrants and crime. Two months later, Vinger responded by pointing out a substantially revised version of the web page. Vinger later told us by email that the revised web page ""only refers to charges and convictions for criminal aliens who were in the country illegally. Past versions,"" Vinger wrote, presented higher counts by showing ""charges and convictions for all criminal aliens – legal and illegal."" Another change: Vinger said the previous web page tallied crimes for each jailed individual’s criminal ""career"" while the new version, he wrote, shows charges and convictions occurring since June 2011. When we requested Paxton’s backup information, a spokeswoman for his state office, Kayleigh Lovvorn, said by email that Paxton’s numbers came from the same DPS web page, ""Texas Criminal Illegal Alien Data."" However, we didn’t spot information on the revised web page supporting Paxton’s reference to ""illegals"" committing over 600,000 crimes and more than 1,200 homicides since 2011. The newly available figures linked far fewer offenses, including homicides, to unauthorized residents. According to U.S. Department of Homeland Security ""status indicators,"" the DPS reported, ""over 261,000 criminal aliens were booked into Texas jails between June 1, 2011, and July 31, 2018, of which over 175,000 were classified as illegal aliens."" In the same period, DPS says, ""these 175,000 illegal aliens were charged with more than 273,000 criminal offenses and  which included arrests for 505 homicide"" charges. All those criminal charges, the DPS says, ""have thus far resulted in over 114,000 convictions including 229 homicide convictions; 12,801 assault convictions; 3,016 burglary convictions; 17,002 drug convictions; 159 kidnapping convictions; 6,820 theft convictions; 10,846 obstructing police convictions; 962 robbery convictions; 1,596 sexual assault convictions; 1,087 sexual offense convictions; and 1,215 weapon convictions."" According to the web page, Homeland Security separately identified another 10,182 ""illegal aliens,"" all imprisoned in Texas, who together had been charged with more than 6,000 criminal offenses included 83 homicide charges. We combined the two sets of counts--a move supporting the conclusion that, per the DPS, more than 185,000 individuals believed to be living in the U.S. without legal permission were jailed in Texas over the seven-plus years who all told accounted for more than 279,000 criminal charges and over 114,000 convictions including 589 homicide charges and 229 homicide convictions--on all fronts, considerably shy of what Paxton said. Cato perspective We also ran Paxton’s statement past Cato Institute analyst Alex Nowrasteh, who authored a February 2018 study of crimes committed by immigrants in Texas. Nowrasteh said by email that in 2016, according to DPS data he said he obtained through a public information request, 16,277 illegal immigrants were convicted of a crime in Texas, accounting for 4 percent of Texas residents convicted of a crime at a time that illegal immigrants accounted for 6 percent of the state’s residents, according to U.S. Census Bureau research. Put another way, Nowrasteh said by email, the ""most crime-prone group in Texas were American natives."" Our ruling Paxton said Texas has ""had over 600,000 crimes committed by illegals since 2011. Over 1,200 homicides."" Both of these numbers--which we’ve twice debunked in detail since 2010--exceed what the state estimates by more than 400 percent. DPS-posted figures lately suggest that since mid-2011, Texas-jailed individuals believed to be living in the U.S. without legal permission account for 229 homicide convictions among more than 114,000 convictions across a range of mostly minor offenses. We rate Paxton's claim Pants on Fire. PANTS ON FIRE – The statement is not accurate and makes a ridiculous claim. Click here for more on the six PolitiFact ratings and how we select facts to check.","[('News story, ""It’s Time To Decriminalize Immigration, Say Top Texas Dems,"" Huffington Post, Aug. 23, 2018', 'https://www.huffingtonpost.com/entry/time-to-decriminalize-immigration-top-texas-democrats_us_5b7c3985e4b0348585fb0db5?ylo'), ('Truth-O-Meter articles, PolitiFact Texas, ""Rick Perry claim about 3,000 homicides by illegal immigrants not supported by state figures,"" July 23, 2014; ""Dan Patrick airs unsupported claim about 566,000 \'crimes made\' by \'criminal aliens\' in recent years,"" Jan. 25, 2018; ""Sean Hannity says 642,000 crimes recently committed against Texans by illegal immigrants,"" March 23, 2018', 'No link'), ('Charts showing career criminal charges and convictions for ""criminal aliens,"" Texas Department of Public Safety, fetched by PolitiFact Texas for fact-checks, July 2014 and January 2018 (PolitiFact Texas compilation posted Sept. 6, 2018)', 'https://www.politifact.com/texas/statements/2014/jul/23/rick-perry/rick-perry-claim-about-3000-homicides-illegal-immi/'), ('Emails, Kayleigh Lovvorn, media relations specialist, Office of Attorney General Ken Paxton, Aug. 27, 2018', 'No link'), ('Emails and phone interview, Alex Nowrasteh, senior immigration policy analyst, Center for Global Liberty and Prosperity, Cato Institute, Sept. 4, 2018', 'https://docs.google.com/document/d/e/2PACX-1vRwu36EXsUQTgtxbEBr-OXWuggesDIxbwMv-YnBYeGjM_mghkZtTSyVWw2FOYDTlEj_Nu6ZxGZQalYj/pub'), ('Email, Tom Vinger, press secretary, Media and Communications Office, Texas Department of Public Safety, Sept. 5, 2018', 'No link')]",/factchecks/2018/sep/07/ken-paxton/ken-paxton-draws-debunked-figures-says-illegals-co/
"['Fires', 'Technology', 'PunditFact', 'Fight for the Future']","
Could net neutrality have shielded California firefighters from throttling?
","The idea that greedy corporations would screw over the average Internet user was perhaps the most vocal concern raised last year when a bundle of Internet protections, known as net neutrality, went on the chopping block. Now, three months after the regulations officially died, proponents are staking out a very different position as they work to resurrect the rules. Net neutrality must be restored, they argue, because its repeal has jeopardized public safety. ""We saw the true danger of the FCC's net neutrality repeal when Verizon was caught throttling California firefighters,"" said digital rights group Fight for the Future. Let’s unpack that statement, starting with the California fire. Golden State firefighters are still working to contain the largest blaze in state history. The Mendocino Complex Fire began burning in Northern California in late July, and so far has torched over 726,000 acres — more than double the size of Los Angeles. Firefighters from around the state have been called to action. Among the out-of-town responders were firefighters from Santa Clara County, located in the center of Silicon Valley, about 160 miles south of the inferno. The Santa Clara County fire department deployed a high-tech truck, known in firefighter jargon as an ""Incident Support Unit,"" to serve as a command-and-control center.  To work effectively, the trucks need a robust Internet signal. Its broadband hookup is used to power software like Google Sheets, which lets firefighters coordinate real-time responses. But in the midst of battling the largest fire in California history, the Santa Clara County truck’s Internet speed suddenly slowed to a crawl. At roughly 1/200 the original speed, firefighters would have been no worse off using a dial-up modem from the 1990s. So what the heck was happening? ""(We) discovered the data connection was being throttled by Verizon,"" Fire Chief Anthony Bowden said in a statement filed as part of an ongoing lawsuit against the FCC. ""These reduced speeds severely interfered with the unit’s ability to function effectively. ""Even small delays in response translate into devastating effects,"" he added, ""including loss of property, and, in some cases, loss of life."" The throttling persisted for some time even after the firefighters complained to Verizon and told the company of their urgent need to have fast Internet restored. Verizon later apologized for the incident. The restrictions were in place because the firefighters had a contract that said excess data usage was subject to significantly slowed-down speeds. But the company said it failed to comply with its own internal policy of taking its foot off the brake during emergencies. ""In supporting first responders in the Mendocino fire, we didn’t live up to our own promise of service and performance excellence when our process failed some first responders on the line, battling a massive California wildfire,"" Verizon said in a statement. ""For that, we are truly sorry."" The public relations fiasco drove Verizon to vow not to throttle west coast firefighters and some other first responders.   But that olive branch had limited reach. For some, the incident was the most clear-cut demonstration of the shortcomings of industry self-policing in the post-net neutrality era. Instead of after-the-fact corporate damage control, they argue, what’s needed is to put the law back on the books. So would Verizon’s conduct have been unlawful and punishable under net neutrality? That’s the main thrust of Fight for the Future’s statement. For the purposes of this fact-check, you need to bear in mind a couple of net neutrality’s key features. (See a more detailed explainer here.) A core idea behind net neutrality is that virtually all content will travel unimpeded around the same speed. ""Usually, when one thinks of a net neutrality violation, one thinks of the violation of the no blocking, no throttling, and no paid prioritization rules,"" said Blair Levin, who served as chief of staff to the FCC chairman from 1993 through 1997. Of those three rules, we’re concerned here with only one: the ban on throttling. That rule generally prohibited Internet service providers, or ISPs, from slowing down customers’ speeds. However, to give ISPs flexibility in designing service plans that would avoid network congestion, the FCC carved out an exception. ISPs could offer plans that would allow willing customers to be throttled if they exceeded their data cap. In a sense, by signing this type of contract, customers waived their right not to be throttled. In addition to the no-throttling rule, you also need to know about net neutrality’s ""general conduct"" rule. That rule stopped companies like Verizon and Comcast from ""unreasonably interfering"" with customers’ Internet access. It also created an avenue for customers file complaints to the FCC, which could trigger an investigation into an ISP’s practices. One way to think about net neutrality with respect to ISPs is that it gave the FCC teeth. Net neutrality’s repeal, in turn, largely defanged it. So would the FCC have taken a bite out of Verizon if the old rules were still in play? The contract between Verizon and the California firefighters allowed throttling for excessive data use. In other words, the firefighters waived their right not to be throttled over their limit. Under the $37.99-per-month plan, the department would get high-speed broadband for the first 25 gigabytes. Data use beyond that was subject to speed reductions. The device installed in the California firefighter’s high-tech truck can use up to 5-10 gigabytes per day. At that rate, the firefighters quickly hit their cap. To some experts, the incident was simply the culmination of a series of mistakes — not a poster child for stronger regulation. ""What really happened wasn’t a net neutrality issue,"" Berin Szoka, a tech lawyer and president of the group TechFreedom, wrote. ""The (fire department) simply chose a data plan for their mobile command and control unit that was manifestly inappropriate for their needs."" What’s clear is that because the firefighters’ service plan permitted the kind of speed restrictions that were allowed under the old rules, Verizon did not directly violate net neutrality’s no-throttling rule. ""The throttling incident, while a real PR disaster for Verizon, has nothing to do with net neutrality,"" said Doug Brake, the director of broadband and spectrum policy at the Information Technology & Innovation Foundation. ""The rules explicitly allowed for data plans that rate-limit or ‘throttle’ a data connection after a certain threshold."" A spokeswoman for the Republican-majority FCC pointed out that the Santa Clara County fire department, which is party to a lawsuit against the FCC to restore net neutrality, does not argue the no-throttling rule was violated here. ""What happened had nothing to do with net neutrality,"" she said. ""Verizon was not discriminating on the basis of content, application, service or device.""  Even the group behind the claim we’re checking, Fight for the Future, conceded the narrow point about the contract falling under the no-throttling exception. Evan Greer, Fight for the Future’s deputy director, told us, ""Verizon's throttling of firefighters was not a direct violation of the ‘no throttling’ rule since it related to a data cap."" But there’s another rule that could have ensnared Verizon: The ""general conduct"" rule. This prohibited companies like Verizon and Comcast from ""unreasonably interfering"" with customers’ Internet access. It also created an avenue for customers to file complaints to the FCC. But the repeal of net neutrality choked off this avenue. ""Under the 2015 rules, the firefighters could have filed a complaint with the FCC on grounds that the throttling was ‘unjust and unreasonable,’ "" said Chip Stewart, a communication technology expert and professor at Texas Christian University. ""After the current FCC repealed those rules, that is no longer an option."" Gigi Sohn, who was a counselor to the FCC chairman while the net neutrality rules were written, said she believes the firefighters ""could have made a persuasive case"" if that option were available today. ""The throttling of the Santa Clara County FPD’s broadband service was a disaster waiting to happen,"" Sohn wrote in an essay for NBC News. ""In the absence of net neutrality rules and without strong FCC oversight, broadband providers like Verizon, Comcast and AT&T are free to run their networks as they please without regard to consumers, competition or public safety."" Harold Feld, the senior vice president at the liberal Public Knowledge, said the key point comes down to whether or not there’s a process for aggrieved consumers to get a fair hearing. ""It’s not just about whether Verizon behaved appropriately or not,"" he told PolitiFact, citing a blog post he wrote. ""It’s about having clear rules and procedures in place so that when an emergency like this happens, people know what to do and can resolve the problem quickly."" Some tech experts say additional oversight is unnecessary because companies are capable of policing themselves. (Verizon has promised to do so with more verve in the future, for instance.) But not all agree. ""The removal of the 'cop on the beat' may have contributed to Verizon acting in ways that even it now admits was dumb,"" Levin said. ""If there is no one watching, people act differently than if they think someone is watching."" Fight for the Future said, ""We saw the true danger of the FCC's net neutrality repeal when Verizon was caught throttling California fire fighters."" Under net neutrality, the firefighters could have filed a complaint against Verizon to the FCC, which at the very least would have launched an investigation, experts said. Repeal of the rules removed that avenue, thereby sidelining the FCC from serving as a ""cop on the beat."" However, the firefighters’ service plan permitted the kind of speed restrictions that were allowed under the old rules. So the company did not violate net neutrality’s no-throttling rule. The claim is partially accurate but leaves out important context. We rate this Half True. ","[('PolitiFact, ""What you need to know about net neutrality,"" Dec. 13, 2017', 'https://www.politifact.com/truth-o-meter/article/2017/dec/13/what-you-need-know-about-net-neutrality/'), ('Gigi Sohn, a fellow at the Georgetown Law Institute for Technology Law & Policy and a former counselor to the FCC chairman, via NBC News, ""Verizon couldn\'t have restricted Santa Clara County\'s internet service during the fires under net neutrality,"" Aug. 24, 2018', 'No link'), ('Berin Szoka, tech lawyer and president of the group TechFreedom, via Medium, ""False Alarm: Verizon’s Fire Department Customer Service Fail Has Nothing to Do with Net Neutrality,"" Aug. 28, 2018', 'https://www.nbcnews.com/think/opinion/verizon-couldn-t-have-restricted-santa-clara-county-s-phone-ncna903531'), ('Harold Feld, senior vice president at the Public Knowledge, via Wetmachine, ""Verizon California Throttling Mistake Shows How Radical Pai’s Repeal Order Really Was,"" Aug. 28, 2018', 'No link'), ('Email interview with Gigi Sohn, a fellow at the Georgetown Law Institute for Technology Law & Policy and a former counselor to the FCC chairman, Aug. 31, 2018', 'https://medium.com/@BerinSzoka/false-alarm-verizons-fire-department-customer-service-fail-has-nothing-to-do-with-net-neutrality-3b9a2d770e5b'), ('Email interview with Ernesto Falcon, legislative counsel at the Electronic Frontier Foundation, Aug. 29-31, 2018', 'No link'), ('Email and phone interviews with Berin Szoka, tech lawyer and president of the group TechFreedom, Aug. 30-31, 2018', 'http://www.wetmachine.com/tales-of-the-sausage-factory/verizon-california-throttling-mistake-shows-how-radical-pais-repeal-order-really-was/'), ('Email interview with Harold Feld, senior vice president at the Public Knowledge, Aug. 31, 2018', 'No link')]",/factchecks/2018/sep/07/fight-future/could-net-neutrality-have-shielded-california-fire/
