tags,sub_header,text_body,quote_href
"['Congress', 'Federal Budget', 'Homeland Security', 'Terrorism', 'Texas', 'Lloyd  Doggett']","
Lloyd Doggett says Homeland Security only federal agency not funded through 2015 fiscal year
","In a commentary, U.S. Rep. Lloyd Doggett of Austin criticized border-security legislation advanced by a fellow U.S. House member at a time that funding for the Department of Homeland Security seems stand-alone shaky. Doggett, a Democrat, said the Border Security Results Act offered by Austin’s Michael McCaul, the Republican chairman of the House Homeland Security Committee, was premised on the unattainable goal of no unauthorized border crossers, making for a border tighter than that of North Korea. Moreover, Doggett wrote in his article posted online Jan. 26, 2015, by the Austin American-Statesman: ""Our border security is being further undermined by Republican limitations on DHS law enforcement funding. This is the only federal department not funded for this entire fiscal year. Uncertain stop-and-start, short-term appropriations weaken the ability to plan at a time of heightened international security concerns."" We think of Uncle Sam as gigantic, sprawling, multi-digited. Is Homeland Security all alone in going unfunded through the fiscal year running through September 2015? Doggett’s factual backup By email, Doggett spokeswoman Leslie Tisdale cited a Dec. 10, 2014, Congressional Quarterly news story referring to 11 spending measures that had made it through Congress with only a ""continuing resolution"" approved to maintain Homeland Security funding for a few months. And on Dec. 16, 2014, she noted, the White House announced President Barack Obama had signed into law the Consolidated and Further Continuing Appropriations Act of 2015, ""which provides fiscal year 2015 full-year appropriations through September 30, 2015, for all agencies except the Department of Homeland Security, for which appropriations are provided instead through February 27, 2015."" Congressional actions Then again, news accounts suggest there’s room for Homeland Security funding to be worked out. In early 2015, the Republican-majority House advanced a measure funding Homeland Security through the fiscal year. A Jan. 9, 2015, press release from the House Appropriations Committee said the fiscal 2015 Homeland Security funding measure, described as the ""last of the 12 annual funding bills to be considered,"" included $39.7 billion in discretionary funding, an increase of $400 million compared with what lawmakers ponied up the previous year. Under the proposal, funding would flow to Customs and Border Protection, Immigration and Customs Enforcement, the Transportation Security Administration, cybersecurity, the Coast Guard, the Secret Service and the Federal Emergency Management Agency, the release said. But the appropriation had a catch. Five days later, the House voted mostly along party lines to tie the funding to reversing Obama’s immigration actions, though news accounts said it was unlikely sufficient senators would agree to the linkage and even if that improbably happened, Obama would veto the measure. ""House approval of the spending bill was just the opening act in a debate expected to stretch into late February, when funding for the Department of Homeland Security is set to expire,"" the Washington Post reported. A Jan. 15, 2015, New York Times news story hinted the issue would be worked out. ""Because Republicans have said that they will use the $40 billion funding bill for the Department of Homeland Security as their vehicle for dismantling"" Obama’s immigration actions, the story said, ""Congress faces another deadline that seems likely to force an accommodation before the department's money is due to run out at the end of February."" ""One disagreement Republicans will have to work out is how far they are willing to go to push legislation that has no chance of becoming law--because it dies either in the Senate or in a presidential veto,"" the Times story said. ""It is clear that some House Republicans want--and expect--the Senate to be as unyielding as they have been, though that is not likely. Asked how far he was willing to go, Rep. Trent Franks of Arizona said, '’All the way to where we fail to override.’"" ""If the feud lingers beyond Feb. 27 with no compromise and Homeland Security funding runs out,"" the Times’ story said, ""millions of federal employees within the department's vast bureaucracy will have to work without pay. Around 85 percent of the department is classified as ‘essential’ and must report to work regardless of whether their agency is effectively shut down. This includes Border Patrol agents and Transportation Security Administration screeners,"" the story said. We asked Homeland Security if more details had been revealed about what happens after Feb. 27 and didn’t draw any. Independent confirmation Separately, a budget expert told us Doggett got it right. By email to our inquiry, Jack Deutsch of the Committee for a Responsible Federal Budget, a nonprofit committed to educating the public about issues with significant fiscal policy impact, said that one of its policy advisers, Ed Lorenzen, noted that at the end of 2014, Congress passed legislation, referred to as the CRomnibus, providing funding for all federal agencies except Homeland Security for all of fiscal 2015 ""but only continuing funding for the Homeland Security appropriations through Feb. 27."" Our ruling Doggett said Homeland Security is ""the only federal department not funded for the entire year"" by Congress. That was so as of when Doggett spoke in January 2015. Congressional Republicans were attempting to tie funding through the fiscal year to a repeal of Obama’s 2014 announcement the administration intended to shield some unauthorized immigrants from deportation. We rate the statement True. TRUE – The statement is accurate and there’s nothing significant missing. Click here for more on the six PolitiFact ratings and how we select facts to check.",/factchecks/2015/feb/18/lloyd-doggett/lloyd-doggett-says-homeland-security-only-us-agenc/
"['Education', 'Florida', 'Florida Badass Teachers Association']","
Teacher group says Florida students take standardized tests up to 45 days a year
","Facing a backlash from teachers and parents over standardized tests, state legislators are discussing whether to pare down the hours students spend on testing. The latest batch of criticism about Florida’s tests coincides with a national discussion about Common Core state standards. One of the potential GOP presidential contenders, former Florida Gov. Jeb Bush, has long defended the need to use tests to make schools accountable -- a position increasingly at odds with other GOP presidential contenders. The Florida Badass Teachers Association, which is part of a national association that formed in recent years in an effort to fight back against testing, raised concerns about the tests as they planned to protest Bush’s Feb. 10 speech in Tallahassee. Thomas James, an association spokesman and Miami-Dade history teacher, leveled many criticisms of Florida schools, including this one in a statement provided to the Miami Herald before Bush’s speech. ""Florida public school students have become little more than ‘test drones’ being bombarded with an array of standardized high stakes tests which eat up as much as 45 school days per year,"" James said. James’ claim about the amount of days eaten up by tests caught our eye because it was more than double the number we heard from state legislative leaders in 2013 -- though Florida has made changes to tests since that time. How many days a year do students actually take standardized tests? Backlash over Florida’s new tests We found no simple answer to that question because it varies widely depending upon students’ grades, courses and district and other factors. Testing of Florida students has always faced some criticism but changes to those tests resulted in a fresh round of backlash within the past year. This year, students will start taking the Florida Standards Assessments aligned to Florida's new education benchmarks, based on the Common Core State Standards. (After the Common Core drew increasingly vocal criticism, the Florida Legislature last year renamed them the Florida Standards with some tweaks.) During his 2014 re-election campaign, Gov. Rick Scott promised to investigate the state testing program and the state expects to have a report ready for the beginning of the legislative session March 3.   James told PolitiFact Florida that he arrived at his claim in part through a bill proposed in February by Senate Education Chairman John Legg, R-Trinity. That bill would require that students spend no more than 5 percent of school hours taking statewide and district-mandated tests. But that adds up to 45 hours -- not days -- of tests. How many hours do students take tests? The Florida Standards Assessments include reading tests in grades 3 through 11, math tests in grades 3 through 8, and science tests in grades 5 and 8. High school students must take six end-of-course exams in subjects including math and history, for example. For example, fourth-graders take 1.5 hours of tests in english language arts, 2.67 hours in writing and 2.67 hours in math. That adds up to just under seven hours of tests. The hours spent on statewide tests grew between the 2013-14 and 2015-16 school year. For example, fourth-graders now spend about one extra hour on such tests while a sixth-grader spends nearly three extra hours on tests. In high school, students take several more hours of tests. For example, a high school student may take 13 hours of statewide tests including language arts, math, biology and history. And then there are the district-wide tests. Some school districts also give their own district-wide exams that are not required by the state, usually to see how students are progressing in any given subject. We interviewed spokespersons in a few school districts to get information about the number of hours their students spend taking standardized tests. Miami-Dade school officials concluded that the maximum example would be for an 11th-grader who takes all required tests and two international baccalaureate (or ""IB"") classes which would add up to about 44 hours. In Pasco County, the typical student on average takes state and districtwide tests for anywhere from three to 26 hours. (This does not include the IB example cited by Miami-Dade.) James told PolitiFact Florida that the Miami-Dade testing calendar shows that testing gears up in March and high schools continue testing nearly through the end of May. But not every student is taking every test throughout that two-month stretch of tests -- and some days they are taking a test for just part of that day. (The Miami Herald wrote in September that only eight out of 180 days on the district’s calendar had no standardized tests, but any individual student would be tested on only a fraction of those days.) Asked about the claim of having testing on as many as 45 days, James said, ""That would be the worst-case scenario."" We should note that even for students who are not taking a test on a particular day or portion of a day, they still could be impacted in some way by the tests. For example, their teachers may be taken out of class to proctor other students taking tests. In May 2014 the Miami Herald reported that some classes at Dr. Michael Krop High School -- James’ school -- were watching movies, such as Frozen, or playing board games during such testing days. But we found no solid evidence to show the extent of students being displaced by other students taking tests. And in any case, this would vary district to district, school to school and grade to grade. How many hours each district spends on testing will become more clear when the Department of Education releases its report during the session. Still, Legg said there isn’t evidence that students are spending 45 days on tests. ""It is very plausible that those students are doing 45 hours,"" Legg said. However, ""I would find it impossible to do 45 complete days."" The Florida Education Association, the union that represents teachers, argues that the number of days devoted to tests is even higher than what James stated and can reach 60 to 80 days. But the FEA counts any day during which a student takes a test for part of the day as a ""testing day,"" and it also includes days when students are in training to use the computers to take the tests. The FEA also points to tests only taken by a fraction of students -- for example, schools whose performance is rated ""D"" or ""F,"" which have to take progress monitoring assessments that higher-rated schools do not. Ruth Haseman Melton, the director of government relations for the Florida School Boards Association, calls James’ statement an oversimplification. An entire day may not be eaten up by tests, but more time is eaten up by tests beyond just the minutes a student takes them. ""It’s not accurate to count the number of days that tests are given, but it’s also not accurate to just count the time it takes to administer the actual test,"" which is what DOE and Senator Legg are suggesting,"" she said. Our ruling Florida students take ""an array of standardized high stakes tests which eat up as much as 45 school days per year,"" said James, a Miami-Dade teacher. Test days do appear to have risen in recent years, and students are not only affected by the tests they take themselves, but also by the impact of other students in their school taking tests. Pinpointing the number of days that students take standardized tests is difficult because it varies widely depending by grade, school, district and other factors. Even so, critics of the amount of testing did not provide hard evidence of any student taken up with testing for 45 total days a year, much less that it is a typical result in Florida. In fact, James’ own district said that the maximum number of hours spent on such tests would equal about 44 hours -- a small fraction of the figure James cited. We rate this claim False.",/factchecks/2015/feb/18/florida-badass-teachers-association/teacher-group-says-florida-students-take-standardi/
"['Environment', 'Agriculture', 'National', 'Animals', 'Food Safety', 'Public Health', 'Peter DeFazio']","
Are GMOs causing monarch butterflies to become extinct?
","Monarch butterflies are an unexpected victim of the widespread adoption of genetically modified crops, Rep. Peter DeFazio, D-Ore., said last week. A genetically modified organism has had its DNA altered in a way that does not occur in nature. One purpose is to increase the plants’ tolerance to pesticides and herbicides. Opponents of GMOs, as they are called, believe they pose health risks, though there’s no generally accepted science that says GMO products are harmful to health. Environmental impacts, however, are the focus of DeFazio’s claim. DeFazio is an advocate for policies that would require food labels to indicate if the product was made with genetically modified crops. In an appearance on MSNBC with celebrity chef Tom Colicchio on Feb. 12, DeFazio said GMO crops are harmful to nature. ""We certainly know there is going to be secondary harm to the environment,"" he said. ""In fact, monarch butterflies are becoming extinct because of this sort of dumping, (the) huge increase in pesticides’ use because of these modified organisms."" We decided to take a closer look at the effect of GMOs on the iconic orange and black butterflies. There’s little doubt that the monarch population is on the decline, but experts say that the adoption of genetically modified crops is not the sole factor. According to the Center for Biological Diversity, the monarch population has dropped 90 percent over the past 20 years. Every winter, monarch butterflies migrate from the Midwestern United States corn-belt region to the Oyamel fir forests in Mexico. This chart from Monarch Watch, a conservation group, shows the steep population change, in terms of the total area occupied by monarchs during their winter stay in Mexico:   The evidence suggests that DeFazio exaggerated when he said monarchs are ""becoming extinct."" The World Wildlife Fund classifies them as ""near threatened,"" which means they are ""likely to become endangered in the near future."" That classification is several steps away from extinct. And conservation experts told us that they are optimistic that the monarch population can be at least partially restored if the right steps are taken. ""Monarchs are not in danger of extinction,"" said Lincoln Brower, a monarch conservation scientist at Sweet Briar College. ""What is endangered is their spectacular migration and overwintering behavior."" Still, even if they are not on the verge of extinction, monarchs are certainly on the decline, at least for now. Why? Several reasons are evident, including deforestation in Mexico, recent weather patterns and reduced availability of milkweed, the butterflies’ main food source. The deforestation stems from illegal logging in Mexico. It has reduced the areas where monarchs can migrate, affecting their lifecycle. However, the Mexican government has largely curtailed the problem in the past five years, Brower said. As far as weather, a serious drought in Texas a couple years ago reduced the amount of flowers along the monarchs’ migration route. This is a problem because, in order to survive the migration, the butterflies need to pick up nectar along the way. And in 2014, an extra-long winter prevented monarchs from migrating successfully back to the United States from Mexico, Brower told the Washington Post. By far the biggest threat, though, is the lowered prevalence of milkweed, due to the increasing use of GMO crops that can withstand a heavy dose of herbicides, Brower said. Milkweed grows in and around crops such as corn and soybeans that are heavily concentrated in the U.S. Midwest. This is the monarch’s spring, summer and fall habitat, and milkweed serves as both the species’ primary food source and where its larvae grow. The problem is that, unlike the GMO crops in close proximity, the milkweed cannot withstand the herbicides. (Milkweed, like other weeds, can stifle crop yield, so farmers don’t like it.) Brower cautioned that there is not yet certain proof that the expansion of GMO crops is causing milkweed declines. But there is an ""extremely tight correlation"" among the increased use of herbicide-tolerant crops, fewer milkweed plants and the declining monarch population, he said. A 2012 study in the journal Insect Conservation and Diversity estimated that between 1990 and 2010, milkweed prevalence declined 58 percent in Midwest agricultural areas. Over the same time frame, the Monarch population declined 81 percent. By 2011, 94 percent of soybean crops were genetically engineered to withstand the widely used herbicide Roundup, and 72 percent of corn crops were herbicide-tolerant. Both genetically modified crops were introduced in the mid 1990s. Additionally, a 2007 congressional ethanol mandate increased the price of corn and soybeans, which encouraged farmers to convert grassland -- where milkweed grows -- into cropland, said Chip Taylor, director of Monarch Watch and a professor of ecology at the University of Kansas. Some argue that conservationists and the media have placed too much blame on GMOs for the loss of monarchs, saying correlation does not necessarily mean causation. Andrew Kniss, a weed expert at the University of Wyoming, wrote in a blog post that the Insect Conservation and Diversity study does not specifically examine if the adoption of GMO crops and herbicides are the reason why milkweed is dying out. There could be another cause, he said. To back up his point, Kniss pointed to a study out of the U.S. Department of Agriculture and Pennsylvania State University that showed only limited effects of herbicide-tolerant plants -- and the use of herbicides -- on native plant diversity outside the border of the agricultural field.   Our ruling DeFazio said that ""monarch butterflies are becoming extinct"" because of increased use of crops genetically modified to withstand pesticides. The evidence of a connection is suggestive but not conclusive. Monarch populations have been declining alongside a shrinkage in its primary food source -- milkweed -- and the increased use of crops genetically modified to withstand pesticides and herbicides. However, causation has not been established yet, and other culprits -- deforestation and unexpected weather events -- are likely to have played a role as well. Moreover, DeFazio exaggerated when he said that the butterfly species is ""becoming extinct."" It faces significant challenges, but monarchs remain several steps away from extinction, and many conservationists think the trend can be mitigated. The statement is partially accurate but leaves out important details, so we rate it Half True.",/factchecks/2015/feb/17/peter-defazio/are-gmos-causing-monarch-butterflies-become-extinc/
