tags,sub_header,text_body,sources,quote_href
"['Georgia', 'Military', 'Steve Phelps']","
NASCAR executive says many fans serve in military
 ","
When the Army dropped its sponsorship of a NASCAR racing team, the good ol’ boy institution responded with wonkish restraint.

A statement from Stewart-Haas Racing said the change was due to the Army’s ""reallocation of its marketing budget."" NASCAR’s statement was written in business speak and
included a statistic:

""NASCAR fans are twice as likely as non fans to serve in the military and 37 percent of active servicemembers and veterans are NASCAR fans,"" NASCAR Chief Marketing Officer Steve Phelps said in a July 10 article in The Hill, which covers Congress.

The National Guard still sponsors a team. This is just the kind of data NASCAR might publicize to coax it to stay.

Is it correct?

The threat of losing the Guard is real. U.S. Rep. Betty McCollum, D-Minn., regularly introduces attempts to stop all military sports sponsorships, not just NASCAR.

This year, she gained the support of Republican U.S. Rep. Jack Kingston of Savannah, a budget hawk. They failed, but with federal budget cuts on the horizon, sponsorships remain at risk.

We reached out to NASCAR, academics, private research companies, McCollum and Kingston.

Kingston’s office did not respond. An official from McCollum’s office criticized Phelps’ claim but gave no specific data.

NASCAR sent us proprietary information from Experian Consumer Research, a private data company. The findings came from a survey of about 25,000 U.S. adults, including nonfans.

Experian found that 18 percent of NASCAR fans serve or have served in the armed forces or reserves, compared with 9 percent of nonfans. In other words, fans were twice as likely to serve or be veterans.

This is close to what Phelps said. He said fans were twice as likely ""to serve"" in the military.

Experian also reported that about 37 percent of current or past military members were fans, just as Phelps said.

There are shortcomings in Experian’s data. The definition of ""fan"" was broad. It includes respondents who said they were ""very,"" ""somewhat"" or ""a little bit"" interested in NASCAR.

Also, the findings are not the result of a peer-reviewed study published in an academic journal -- the gold standard of research. NASCAR paid for the data.

These factors do not discredit the poll, but we’d have more confidence in its findings if other surveys had similar results.    

Confirmation was hard to find.  

""In general, there is a bizarrely scant amount of NASCAR research among sport fandom scholars,"" said John Spinda, an assistant professor at Murray State University in Kentucky. He has published research on NASCAR.

Still, Spinda and others agreed that NASCAR’s military data made sense in light of other research.

""NASCAR fans are more likely to be male and less likely to be college-educated, so it makes sense that fans would be more likely to be involved in the military,"" said Larry DeGaris, director of the Academic Sports Marketing Program at the University of Indianapolis.

DeGaris is also president of the company Sponsorship Research & Strategy, which researches corporate sponsorship. A  2006 poll of more than 1,000 respondents found that 56 percent of those who described themselves as fans were male.

The private firm Scarborough Research asked 200,000 people whether they had ""any interest in NASCAR"" in its survey from August 2010 through September 2011. Fans were 31 percent more likely to be male than U.S. adults in general, and 13 percent were less likely to have graduated from college.

James Dertouzos has studied military sponsorships as senior economist at the nonprofit RAND Corp. He said NASCAR’s audience is also more likely to be blue-collar, middle-class, Southern or Midwestern, and politically conservative

""These are exactly the people who have positive impressions of service in the military,"" Dertouzos said. RAND is an independent research institute with roots in the U.S. military and defense industries.

Data support his statement. Scarborough reported fans were 19 percent more likely to be blue-collar workers.

That company’s 2009 data, posted on NASCAR’s website, also agree with Dertouzos’ assessment that fans are more likely to be Midwestern and Southern, although Sponsorship Research & Strategy found they were more evenly distributed.

DeGaris’ group found fans were more likely to be Republican.  

It’s worth noting that Scarborough found that fans were 18 percent more likely to have ""military specific"" jobs.

This appears to support Phelps’ claim, but researchers surveyed few people in this category. These findings are not as reliable as their other data, a spokeswoman told us.  

Our conclusion:

What little data that exists appears to support Phelps’ points that NASCAR fans are more likely to serve, and that service members and veterans are more likely to be fans.

Phelps appears to give a correct impression, although supporting data are thin. We give him a Mostly True.",[<zip object at 0x00000280972E2840>],/factchecks/2012/aug/17/steve-phelps/nascar-executive-says-many-fans-serve-military/
"['Tennessee', 'Education', 'Arne Duncan']","
Secretary of Education says Tennessee proof education funding is working
","
U.S. Education Secretary Arne Duncan argued in a recent online column that investments in education funding and incentives are starting to pay off.

To make his case, he presented Tennessee’s new teacher evaluation system as Exhibit A.

""After one year, Tennessee’s students made their biggest single-year jump in achievement ever recorded in the state,"" Duncan wrote in The Huffington Post on July 23, 2012.

Duncan was citing a recent Tennessee Department of Education report that examined the first year of implementing the state’s controversial new teacher evaluation system.

""As Tennessee has shown,"" Duncan concluded, ""our children, our teachers and our country will be better off when school leaders and educators finally undertake the challenging task of creating a meaningful and useful system for supporting and evaluating our nation’s teachers.""

In 2011, Tennessee became one of the first states in the country to implement a comprehensive, student outcomes-based teacher evaluation system. The evaluations were part of broader school-reform legislation that passed the General Assembly with bipartisan support in 2010.

The evaluation standards were enacted as part of Tennessee’s application for the $4 billion federal Race to the Top competition, which provides grants to states in recognition of education innovation and reform. Tennessee was one of the first two states to receive grants under the program.

Fifty percent of the new teacher evaluations were required under state law to be based on student achievement data, including student growth on the Tennessee Value-Added Assessment System (TVAAS) or a comparable measure, as well as additional measures of student achievement.

The other 50 percent of the teacher evaluations were to be determined through ""qualitative measures,"" such a teacher observations, personal conferences and a review of prior evaluations and work.

The evaluations were controversial from the beginning, especially with the Tennessee Education Association. Teachers argued the evaluations punished them rather than helping them improve. Some teachers complained they don’t teach subjects covered by the state tests, yet they are nonetheless judged on student test scores in those areas.

We won’t attempt to analyze or fact-check all of the criticisms about the teacher evaluations, although we will note that an education advocacy group tapped by Gov. Bill Haslam to review the system recommended a number of improvements on June 11, 2012.

A month later, the Tennessee Department of Education released its own one-year report on how the implementation has gone. That report also recommended a number of improvements and is the basis for Duncan’s column in The Huffington Post.

For our purposes, we will stick to fact-checking Duncan’s claim that student achievement experienced its largest gains in the year after the evaluations were implemented.

The state Department of Education report gives credence to Duncan’s statement.

""The 2011-12 school year saw tremendous progress for public education in Tennessee, as measured by the most significant outcome – student achievement,"" the report said. ""Test scores improved, in aggregate, at a faster rate than any previously measured year.""

Math and science test scores, in particular, increased significantly, the report noted.

""To put this in perspective,"" the report said, ""55,000 more students are at or above grade level in math than in 2010; 38,000 more students are at or above grade level in science.""

There is a caveat, however. In measuring student achievement, the state Education Department tracked the aggregate gains on statewide testing only as far back as 2007, said Kate Shellnutt, a spokeswoman for the department.

That’s because the state now reports scores for grades 3-8 and high school subjects. Prior to 2007, the state reported scores for grades K-8 and high school. Comparing test scores now to anything prior to 2007 would not have been an apples-to-apples comparison. Also worth noting -- beginning in 2010, the tests for every subject and grade level became much more rigorous.

Regardless, the growth and achievement over the past year ""represents real change in the academic trajectory and potential life options for Tennessee students and can be the very real difference between long-term success and failure,"" the Education Department report said.

The report attributed the strong academic performance to a number of factors, including higher academic standards; an accountability framework that recognizes ambitious but achievable goals; stronger professional development offerings funded in many cases through districts’ Race to the Top plans; and continued state financial investment in K-12 education despite a challenging budget climate.

""We also believe teacher evaluation has played an important role in our student achievement gains as administrators have specifically cited its role in improving instruction,"" the report said.

Our ruling

While the new teacher evaluation system continues to be controversial, the state Department of Education report says it is at least partly responsible for the academic gains Tennessee students have made over the past year. During that period, student test scores approved, in aggregate, at a faster rate than any year since 2007, the most recent year in which comparable data is available.

In his column, Secretary Duncan left out a couple of qualifiers about the student achievement – namely, that the teacher evaluations are partly but not solely responsible for the student improvement, and that comparable data on student achievement is available only back as far as 2007. Still, his larger point – that Tennessee students have made historic academic gains in the past year – is backed up by the state report. Thus, we rate his claim as Mostly True.",[<zip object at 0x0000028096B557C0>],/factchecks/2012/aug/16/arne-duncan/secretary-education-says-tennessee-proof-education/
"['National', 'Federal Budget', 'Health Care', 'Medicare', 'Barack Obama']","
Do Mitt Romney and Paul Ryan want to turn Medicare into a voucher program?
","
In their attacks against Mitt Romney and Paul Ryan, Mitt Romney's running mate, the Obama campaign and Democratic allies have been repeating a familiar word: vouchers.

During a campaign event in Davenport, Iowa, on Aug. 15, 2012, President Barack Obama said, ""I’ve strengthened Medicare. I've made reforms that save millions of seniors with Medicare hundreds of dollars on their prescription drugs. We're closing the doughnut hole. I've proposed reforms that will save Medicare money by getting rid of wasteful spending in the health care system. Reforms that will not touch your Medicare benefits.

""And Gov. Romney and his running mate have a different plan. They want to turn Medicare into a voucher system. That means seniors would no longer have the guarantee of Medicare -- they’d get a voucher to buy private insurance. And if it doesn’t keep up with costs, well, that’s the seniors' problem. It was estimated that Gov. Romney's running mate, his original plan would force seniors to pay an extra $6,400 a year.""

We wondered whether Romney and Ryan really ""want to turn Medicare into a voucher system.""

""Voucher"" is a word Democrats have used over the years to criticize a variety of Republican privatization proposals, such as efforts to help private schools. Republicans don't like the word and try to avoid it. Frank Luntz, a Republican consultant specializing in ""message creation and image management,"" boasts on his website that he ""moved the public debate from ‘school vouchers’ to ‘opportunity scholarships.’""

In the context of Medicare, Republicans prefer to call it ""premium support"" -- the one Ryan himself has used from day one when talking about his own proposals. A Romney-Ryan spokesman told us the campaign considers it a ""premium support"" plan, not a voucher plan.

Both sides are acting in self-interest, said Ben Zimmer, executive producer of the Visual Thesaurus and Vocabulary.com and language columnist for The Boston Globe. ""I can understand Republican willingness to embrace this alternative term, just as I can understand Democratic eagerness to remind voters of the dreaded ‘v-word’ at every turn,"" Zimmer said.

In this item, we will sort through the claims and see whether it’s reasonable for Obama to call the Romney-Ryan plan for Medicare a ""voucher system.""

We'll start with the dictionary. Merriam-Webster defines a voucher as ""a written affidavit or authorization … a form or check indicating a credit against future purchases or expenditures; a coupon issued by government to a parent or guardian to be used to fund a child's education in either a public or private school.""

 Ryan’s plans

The initial Ryan plan that used ""premium supports"" was released in early 2011 and was approved by the GOP-controlled House before dying in the Senate, where Democrats called it radical and argued that it shifted too much of Medicare’s financial burden to beneficiaries.

Under Ryan’s original plan, Medicare would have changed from a program that pays doctors and hospitals fees for particular services to one in which beneficiaries would be paid an amount by the government that they could use toward private insurance premiums. This would have affected people who today are under 55 only. The private plans would comply with standards set by the U.S. Office of Personnel Management, which administers the Federal Employees Health Benefits Program.

Ryan has since offered updated versions of the plan, the first in conjunction with Sen. Ron Wyden, D-Ore., and then as part of his fiscal year 2013 budget proposal.

Ryan’s most recent plan is similar to his original one, with one key difference. The newer version allows beneficiaries under 55 a choice -- they can use their payment to buy private insurance or for a plan that acts like traditional Medicare. The amount a beneficiary receives would be based in part on the second least-expensive plan available on the exchange.

But note that Obama said, ""Gov. Romney and his running mate have a different plan."" Is the most recent Ryan plan also official policy for the Romney campaign?

In an interview with a Green Bay, Wis., television station on Aug. 15, Romney said, ""Paul Ryan and my plan for Medicare, I think, is the same, if not identical -- it's probably close to identical."" Based on this, we’ll evaluate Obama’s claim based on the most recent Ryan plan.

A history of ‘premium support’

When Ryan unveiled his plan, Democrats poked fun at him for avoiding the term ""voucher."" At a hearing on the plan, Rep. Pete Stark, D-Calif., said, ""My Republican colleagues don't like the sound of ‘voucher’ to describe their plan, so they've made up a new term called ‘premium support.’""

Actually, that term has been around since a 1995 paper co-authored by two health policy experts, Henry Aaron, of the Brookings Institution, and Robert Reischauer, a former Congressional Budget Office director who was then at Brookings. ""Premium support"" also was used in a Medicare overhaul proposed by the bipartisan Breaux-Thomas commission in 1999 and in the 2010 Rivlin-Domenici proposal from the Bipartisan Policy Center.

Each of these proposals had somewhat different details, but what they broadly shared is changing Medicare from a program in which the government pays the bills directly to one in which the government gives money to the beneficiary, who spends it on an insurance plan.

In their 1995 paper, Aaron and Reischauer proposed that Medicare ""pay a defined sum toward the purchase of an insurance policy that provided a defined set of services"" -- an approach they billed as a ""middle ground"" between a separate national health care system for the aged and a ""pure voucher system"" within a ""lightly regulated marketplace.""

Aaron -- who no longer supports the idea of premium support, saying the cost-control provisions of President Barack Obama’s health care law serve the purpose he intended -- reiterated in a blog post earlier this year that there are several key differences between a voucher program and premium support.

For a proposal to qualify as premium support, Aaron wrote, it’s crucial to peg the beneficiaries’ payment to the actual rise in health care costs so people don't end up having to pay more because of inflation. Voucher plans that don’t do this ""are virtually guaranteed to become increasingly inadequate,"" he wrote.

So does the Ryan plan meet the definition of premium support? While his original plan was pegged to overall consumer prices, the most recent Ryan plan is pegged to the lower end of health care premiums. That’s closer to the Aaron-Reischauer definition than his first plan was, though the fact that it’s tied to the low end rather than average costs suggests that payment size could still lag typical health care prices.

The notion that there’s a substantive difference between ""premium support"" and ""vouchers"" receives some support from free-market supporters. Michael Tanner, a health care analyst for the libertarian Cato Institute, said that the original Ryan plan, ""leaned more toward a voucher,"" whereas Ryan’s second plan was ""clearly premium support.""

Robert Moffit, a health policy analyst at the conservative Heritage Foundation, agrees with Aaron that there’s a distinction between ""voucher"" and ""premium support,"" though he draws the opposite conclusion, arguing that the Obama campaign’s use of the term ""voucher"" is not justified, since the Ryan plan includes more regulation than for, say, airline vouchers for food and drink.

Looking at linguistics

The differences between vouchers and premium support may matter to health-policy professionals, but not necessarily to a general audience. And while the 1995 Aaron-Reischauer paper may have offered a detailed definition for ""premium support,"" language tends to evolve over nearly two decades.

In recent years, the definitions of ""premium support"" and ""vouchers"" have become almost indistinguishable, with plans such as Breaux-Thomas and Rivlin-Domenici using ""premium support"" to describe policies that weren’t identical to those from the 1995 paper. Reischauer made this argument when he told PolitiFact that he thinks the Obama campaign ""is on firm ground"" using the term ""voucher.""

Even more convincingly, the 1995 paper didn’t say that premium support wasn’t a voucher -- it said that it wasn’t a ""pure"" voucher. This means that ""premium support"" may be seen as just one type of voucher, not the opposite of a voucher.

Aaron told us he agreed with that reasoning. Take away the requirements listed in the 1995 paper, he said, ""and you have a bare-bones voucher."" Adhere to these requirements, he said, ""and you have premium support. That means, I think, that premium support is a type of voucher.""

Our ruling

We agree that in the world of policy wonks, there are distinctions between ""vouchers"" and ""premium support,"" having to do with the type of inflation adjustment used and the degree of marketplace regulation imposed. Compared with his original plan, Ryan’s most recent plan does move closer to fitting the definition of pure premium support. But substantively, it’s still somewhere in between the two approaches.

But the Romney-Ryan approach pretty much matches the dictionary definition of ""a form or check indicating a credit against future purchases or expenditures."" We think that describes the general way Ryan's plan would work. For a political discussion aimed at voters rather than policy wonks, we think Obama’s use of the term ""voucher"" is close enough to earn it a rating of Mostly True.",[<zip object at 0x00000280973A79C0>],/factchecks/2012/aug/16/barack-obama/does-paul-ryan-want-turn-medicare-voucher-program/
