tags,sub_header,text_body,quote_href
"['Public Health', 'State Budget', 'Missouri', 'Chris Koster']","
Gubernatorial candidate Chris Koster right about $50 million on the line with tobacco loophole
","As part of his campaign to become Missouri’s 56th governor, Chris Koster tweeted a statistic about something he has been working to accomplish during his time as attorney general: closing the tobacco loophole. In his tweet, Koster called upon the legislature to #FixTheLoophole, which he says will save Missourians $50 million. The so-called tobacco loophole is money the state hopes to get from five big tobacco companies if it takes a tougher line with smaller ones. We looked into whether $50 million is really on the line. Tobacco background We reached out to the Koster campaign to find out what closing the loophole entailed. We heard back from David Turner, a spokesman for the Missouri Democratic Party. Turner told us that the tobacco loophole arose in 1998 as part of a master settlement agreement between the attorneys general of 46 states, along with Washington, D.C., and five U.S. territories, and the five largest tobacco companies in the U.S. The states had sued the tobacco companies for selling cigarettes which they knew caused cancer, emphysema and other diseases. The attorneys general wanted to recover the cost of caring for those people. The settlement said that in exchange for dropping the lawsuits, the states would receive roughly $10 billion dollars a year, essentially indefinitely. The annual payment to Missouri is about $130 million. As part of the deal, Missouri passed a law that required all nonparticipating tobacco companies to pay into an escrow fund. This was done in part to ensure that small cigarette makers didn’t gain a market advantage because they would be able to sell cigarettes at reduced prices.  But there was a catch. If a state failed to ""diligently enforce"" the requirement that small companies make escrow payments, and the big tobacco companies lost a set amount of market share as a result, that state would lose a portion of its tobacco settlement money. According to a state auditor, that’s exactly what happened. The big tobacco companies lost an 8 percent market share from 1997 to 2003. As a result, the companies sued Missouri and other states for violating the settlement. In 2013, an arbitration panel found that in Missouri, of the 432 million cigarettes sold by nonparticipating manufacturers in 2002, companies made escrow payments on only $102 million. The panel ruled against Missouri and five other states, meaning the Show-Me State had to pay back $70 million from its 2014 payment. In February, Koster negotiated an agreement with the tobacco companies to return $50 million to Missouri — on the condition the state tighten the rules on the smaller cigarette makers. Which brings us to the loophole. Under current Missouri law, the smaller companies can trim the amount they pay into the escrow fund. Missouri is the only state that has yet to take steps to prevent this. The loophole The way escrow payments are calculated, small tobacco companies can get most of the money they pay back if they restrict their sales to only a few states. In order to close the loophole — and return $50 million to Missouri — the legislature would have to pass Senate Bill 1096. The bill would require all nonparticipating manufacturers to either join the master settlement or be subject to modified escrow rules which prevent the companies from gaming the system to keep their escrow money. SB 1096 has supporters on both sides of the aisle, but it is not without its opponents. Small tobacco companies have been fighting different versions of the bill for more than a decade, calling it a tax on their products and a move on the part of big tobacco to earn more market share at their expense. SB 1096 has yet to pass either chamber of the General Assembly, and the consequences are already being felt. Because the bill failed to pass before April 15, Missouri can no longer receive the $50 million for 2016. In order to receive the money in 2017, the bill must be signed by Gov. Jay Nixon by June 3. Taxpayer impact The loophole is the source of Koster’s $50 million figure, but will recouping the loss actually save taxpayers money? It certainly has cost the state. In October, Nixon withheld $46.1 million of the state's budget, relying on the passage of SB 1096 to fill the gap. Turner said that money would have gone to the Mental Health Department and the Department of Social Services, among others. For these programs to be maintained at their initial levels, Turner explained, taxpayers would be forced to cover the money lost in the tobacco arbitration. Gaining the $50 million dollars would allow those programs to remain uncut without costing the taxpayers any additional money. All things being equal, if the bill passes, taxpayers would win no matter what the state does with the money. If it’s spent on services, citizens get the benefit of $50 million worth of services. If the state cuts spending and lowers taxes, they save money when they file their taxes in April. And that’s just in 2017. If the loophole isn’t closed, Missouri could lose additional money in the years to come. The big tobacco companies have begun arbitration concerning Missouri’s diligent enforcement of the escrow laws in 2004. If an arbitration panel were to find against Missouri again, the state could be forced to forfeit more money. If SB 1096 passes, the companies would not seek arbitration for any of the years 2004 to 2014, per Koster’s agreement. Our ruling Koster said that closing the tobacco loophole would save Missouri taxpayers $50 million. The tobacco settlement and the arbitration that followed is complicated, but ultimately, Koster did reach a settlement to return $50 million dollars to Missouri. If the legislature passes SB 1096 by June 3, that money would come to the state in 2017. If it doesn’t, the state could potentially be on the hook for even more. Any money the state received would be dollars that taxpayers would not have to provide. Taxpayers could get $50 million worth of services or $50 million in tax cuts. Either way, they come out ahead. We rate this claim True.",/factchecks/2016/may/06/chris-koster/gubernatorial-candidate-chris-koster-right-about-5/
"['Bankruptcy', 'Debt', 'Federal Budget', 'Financial Regulation', 'Retirement', 'Wisconsin', 'Center for Individual Freedom']","
Is legislation backed by Paul Ryan to help debt-ridden Puerto Rico a 'bailout'?
","Wracked by a decade-long recession, Puerto Rico started borrowing, to cover budget shortfalls. Many Americans obliged, by buying Puerto Rican bonds, which are exempt from federal, state and local taxes in all 50 states. Now Puerto Rico is $72 billion in debt and defaulting on its debt payments. Don’t care much? Congress does. After all, Puerto Rico is a U.S. territory; 3.5 million of the island’s residents are U.S. citizens. And now the word bailout is being thrown around.  Puerto Rico’s debt problems Owes $72 billion -- nearly 100% of its annual economic output Defaulted on most of a $422 million in debt payment in May 2016 Owes a payment of nearly $2 billion due in July 2016 Ryan does back a bill for Puerto Rico that is sponsored by a fellow Wisconsin Republican, U.S. Rep. Sean Duffy. But the bill is not what is commonly understood to be a bailout. That is, unlike American banks and automakers that got bailed out, Puerto Rico would not get any U.S. tax dollars. At the same time, the ad is careful to say the ""bailout"" would hurt ""savers and seniors,"" not taxpayers. And Duffy’s bill, experts tell us, almost certainly would mean lower returns for perhaps hundreds of thousands of Americans who invested in what long had been regarded as safe Puerto Rican bonds. The ad The sponsor of the nationally televised ad is the Center for Individual Freedom, a conservative non-profit based outside of Washington, D.C. that does not disclose its donors. The center says its mission is to ""protect and defend individual freedoms and individual rights guaranteed by the U.S. Constitution."" Here’s a full description of the 30-second, narrated ad, which was unveiled April 13, 2016: Washington is trying to pull a fast one. The Obama administration and leaders in Congress want to bail out Puerto Rico. The words ""Bail out Puerto Rico"" appear on the screen over photos of Democratic House leader Nancy Pelosi, President Barack Obama and Ryan. It's called Super Chapter 9. It grants Puerto Rico unprecedented bankruptcy protections. You pay for it. Pictures of older men and women appear on the screen. Retirement accounts crushed. A bailout on the backs of savers and seniors. Washington politicians try to claim otherwise. The photos of Pelosi, Obama and Ryan reappear. But we know a bad bailout when we see one. Don't be fooled. No Super 9 bailout of Puerto Rico. The Center for Individual Freedom didn’t respond to our call and emails asking for evidence to back its claim. But a news release from the group makes it clear the center is calling Duffy’s bill a bailout. The bill would establish a federal Oversight Board to assist Puerto Rico in managing its public finances. Ultimately, a judge would have the power to reduce the $72 billion in debt, according to the Washington Post. The experts we consulted agreed with Ryan, who has said the bill is not a taxpayer bailout of Puerto Rico, given that it would not commit any U.S. funds to the island. But the experts also agreed with U.S. Rep. John Fleming, R-La., a critic who has said the bill would function like a bailout because Congress would be ""changing the rules"" to benefit Puerto Rico. The rules would change under the bill in that Puerto Rico could restructure its debt, similar to what is done in a so-called Chapter 9 bankruptcy, and pay less to some creditors than the creditors are owed. In terms of the impact on American investors, many bond funds have already sold their Puerto Rican debt, and the debt is now mostly owned by hedge funds, according to the Associated Press. But Oppenheimer Funds and Franklin Templeton still own part of the debts. So, a restructuring almost certainly would mean that Americans who, through brokers or choices they made in their retirement accounts, put some of their savings into Puerto Rican bonds almost certainly will get a lower return on their money, the experts told us. But there is one more consideration, said Simon Johnson, a professor of global economics at the MIT Sloan School of Management: Americans who invested in Puerto Rican bonds thinking they were safe overestimated how safe they are, as the island’s debt crisis shows. With an Oversight Board managing a debt restructuring, savers likely will get a lower return than they expected. But without such a board, creditors would be fighting in court and the returns for individuals investors would likely be lower still. Our rating The Center for Individual Freedom, a Super PAC, says in a TV ad that Ryan backs a proposal that would be a ""bailout"" of Puerto Rico. The ad is misleading in its repeated use of the word bailout, in that legislation supported by Ryan -- unlike past bailout bills -- would not direct any U.S. tax dollars to the debt-ridden island. But the ad was careful to say the ""bailout"" would hurt ""savers and seniors."" And experts told us the bill almost certainly would result in lower returns for Americans who invested money in Puerto Rican bonds. For a statement that is partially accurate but takes things out of context, our rating is Half True.",/factchecks/2016/may/06/center-individual-freedom/legislation-backed-paul-ryan-help-debt-ridden-puer/
"['Economy', 'Jobs', 'California', 'Jerry Brown']","
Jerry Brown’s Half True Claim About California Doubling Florida’s Job Gains
"," Stoking a cross-country feud between the Sunshine and Golden states, Florida Gov. Rick Scott traveled to California for the second time in as many years to urge businesses to move to his state. In his visit this week, Scott said the sun shines more on businesses in Florida, with its lower taxes and less-stringent regulation. The Florida governor also warned California firms of the harm he said would result from the Golden State’s future minimum wage hike to $15 per hour. PolitiFact recently examined a claim by Enterprise Florida, the state’s public-private economic development arm, which said California would lose 700,000 jobs due to the wage hike. The national website rated the misleading claim Mostly False. FROM TWITTER On my way to tell CA businesses why FL has the best business climate. #FLvsCA   California Gov. Jerry Brown, perhaps tired of the job-poaching efforts of governors in Texas and Florida, shot back at Gov. Scott with claims that the Golden State’s job picture is, well, very sunny. ""As one of the millions of tourists flocking to the Golden State this time of year, we’d like to extend a warm welcome to (Florida Gov. Rick Scott). We can understand why he’s coming back -- there’s lots to do and plenty to learn,"" Brown said in a statement on April 26. His office issue a similar press release a few days later. ""In fact, since his last 2,000 mile cross-country jaunt, California has added twice as many jobs as Florida, while paying down debt, building a robust rainy day fund and taking bold action on issues Governor Scott continues to ignore, like climate change and poverty,"" Brown said in the statement. FROM TWITTER .@JerryBrownGov to @FLGovScott: Time to stop the silly political stunts & start doing something about #ClimateChange pic.twitter.com/nuWwhEBu9I   There’s a lot to unpack there. So we focused just on Brown’s statement about California adding twice as many jobs as Florida, and whether there was any context missing. It turns out California’s job picture is not really brighter than Florida’s, at least not during the period Brown described. Our research We looked at data from the U.S. Bureau of Labor Statistics for the two states, from May 2015 to March 2016. Scott’s first visit was in April 2015. Last month’s data was not yet available. During this span, California added 354,100 jobs while Florida added 190,500 jobs. That’s 1.86 times as many jobs as the Sunshine State -- not quite twice as many but pretty close. Brown’s office also pointed to a slightly different time period, January through December 2015, when California added 1.97 times as many jobs as Florida. Of course, California is a much larger state with 39.1 million people -- almost double Florida’s population of 20.3 million. One would expect California to add more jobs than Florida, to keep up with the millions more people who live here. For some context, we checked the states’ job growth rates during this period. Florida had a slightly faster job growth rate at nearly 2.4 percent compared with California’s 2.2 percent. Our ruling Gov. Jerry Brown said California has added twice as many jobs as Florida since that state’s governor visited in April 2015 on a job recruiting tour. Brown's claim is close on the raw numbers. But it leaves out the important context that California is a much larger state that needs to add more jobs to keep its millions more people employed. The federal jobs data show California added 1.86 times as many jobs as Florida during this period, a bit less than twice as many. California often leads the nation in overall job gains due to its sheer size. But the pace of that job growth tells a different story. Florida actually added jobs at a slightly faster rate, nearly 2.4 percent compared with California’s 2.2 percent, during the period in question. That takes a lot of the shine off Brown's statement. We rated his claim Half True. -------- HALF TRUE – The statement is partially accurate but leaves out important details or takes things out of context. Click here for more on the six PolitiFact ratings and how we select facts to check. https://www.sharethefacts.co/share/84a7d7ae-cbfc-488f-a9b1-3f61c0f7069e",/factchecks/2016/may/06/jerry-brown/jerry-browns-mostly-true-claim-about-california-do/
"['Abortion', 'Immigration', 'National', 'Health Care', 'Human Rights', 'Islam', 'Foreign Policy', 'Religion', 'Terrorism', 'Guns', 'Hillary Clinton']","
Hillary Clinton video lists 8 promises of Donald Trump presidency. Did he say that?
","Even before Donald Trump’s Republican rivals bowed out, Democratic presidential candidate Hillary Clinton posted a video warning about a potential Trump presidency. The video opens with a clip of Trump at an event saying, ""Everything I say I’m going to do folks, I do."" It then lists eight steps Trump has said he will take. As the text of each one appears on the screen, audio of Trump plays in the background. We’ll go through in order and assess whether Trump really has made each promise. We asked the Trump campaign if any of these promises were misstated, or if they weren’t actually promises. We did not hear back. ‘Get rid of gun-free zones on schools on his first day’ At a campaign event in Burlington, Vt., on Jan. 7, 2016, Trump said that the number of victims in San Bernardino, Calif., and in Paris would have been much lower if the people in those places had been armed. He lamented the deaths of five soldiers in a shooting rampage in Chattanooga, Tenn. ""I will get rid of gun-free zones on schools, and — you have to — and on military bases,"" Trump said. ""My first day, it gets signed, okay? My first day. There's no more gun-free zones."" The Clinton campaign also cited an interview with Trump on the Outdoor Channel Jan. 21, 2016, in which he said, ""I'm going to get rid of gun-free zones on military bases. I'm also going to do it in schools."" Trump has said little recently about gun-free zones, but the issue resurfaced when a petition emerged that would allow delegates to the Republican National Convention to carry guns. On March 28, 2016, ABC reporter Jonathan Karl asked Trump if he would support that. Trump said he would consider the petition, but the Secret Service ruled out allowing guns at the conventions as a security risk. ‘Defund Planned Parenthood’ Trump’s stance on funding Planned Parenthood has shifted somewhat over time. In August 2015, he told conservative radio host Hugh Hewitt that it would be worth shutting down the government to cut off tax dollars going to Planned Parenthood. But he has also praised the organization for providing regular care to women of limited means. In March, Trump said, ""Millions of women have been helped by Planned Parenthood,"" and then continued ""but we're not going to allow, and we're not going to fund, as long as you have the abortion going on at Planned Parenthood."" Trump’s overarching position on taxpayer funding for Planned Parenthood is that he supports defunding Planned Parenthood so long as the organization continues to perform abortions. ‘Repeal Obamacare’ There doesn’t seem to be any ambiguity on this one. On his campaign website, Trump says ""On day one of the Trump Administration, we will ask Congress to immediately deliver a full repeal of Obamacare."" ‘Build a great great wall’ Trump has made building a wall along the border with Mexico his signature initiative, and he hasn’t wavered. He has said it many times. In the course of interviews with the New York Times published May 4, 2016, he said within his first 100 days the wall would be designed, and there would be bilateral talks with Mexico, presumably on how they would pay for it -- another promise Trump has made. Establish ‘a deportation force’ There is no question that Trump called for teams to remove an estimated 11 million people who are in the country without authorization. The term itself goes back to an interview Trump gave on MSNBC in November 2015 when he said ""You’re going to have a deportation force. And you’re going to do it humanely."" We couldn’t find Trump promoting this again, although in the Feb. 25, 2016, Republican debate, he didn’t back away from the phrase. CNN moderator Wolf Blitzer teed up a question saying, ""Mr. Trump, you've called for a deportation force to remove the 11 million undocumented immigrants from the United States."" Trump prefaced his answer with a cut at his rivals for supporting amnesty and then said, ""We either have a country, or we don't have a country. We have at least 11 million people in this country that came in illegally. They will go out."" Trump has definitely committed to expanding the number of immigration and border control agents and to removing 11 million people. He hasn’t said if he would create a new deportation unit. While he might not be touting the same phrase, the result remains the same. ‘Ban Muslims from entering the country’ Immediately after the shootings by Muslim fundamentalists in San Bernardino in December 2015, the Trump campaign issued a statement saying, ""Donald Trump is calling for a total and complete shutdown of Muslims entering the United States until our country’s representatives can figure out what is going on."" Within a few days, Trump said certain people would be exempted, including American citizens who are Muslim, foreign leaders, and athletes headed to competitions. However, according to the New York Times, within his first 100 days ""the immigration ban on Muslims would be in place."" That puts the ban firmly in the promise zone. ‘Kill the spouses and children of our enemies’ Trump said this during an interview on Fox and Friends, Dec. 2, 2015. ""The other thing with the terrorists is you have to take out their families, when you get these terrorists, you have to take out their families,"" Trump said. In an interview with Fox News’ Bill O’Reilly, Trump seemed to dial down this threat. O’Reilly asked him if he would have killed members of the bin Laden family. Trump said ""I don't want to be so bold. I want to tell you they would suffer."" Trump was pressed on this at the Republican debate in Las Vegas on Dec. 15, 2015. Asked how this policy would set the United States apart from ISIS, Trump said, ""We have to be much tougher."" Trump finished his answer with, ""I would be very, very firm with families. Frankly, that will make people think because they may not care much about their lives, but they do care, believe it or not, about their families’ lives."" While this could be a death threat, it isn’t quite as clear as his original statement. Clearly, he wants to make family members suffer, but he doesn’t say how much. Restore waterboarding and ‘go further’ In the Republican debate right before the New Hampshire primary, Trump said, ""I would bring back waterboarding and I’d bring back a hell of a lot worse than waterboarding."" Trump stood by his waterboarding policy on March 22, 2016, telling CNN’s Wolf Blitzer he would ""go further."" Trump has also said that ""torture works."" The only caveat that Trump offered during his CNN interview is that he would listen to military officials’ advice on the use of interrogation methods. Whether a Trump administration would ever use waterboarding, he has promised to keep it on the table. Our ruling A Clinton campaign video listed eight steps Trump has promised to take as president. Five of those are firmly on the Trump agenda. That includes repealing Obamacare, building a wall along the Mexican border, deporting illegal immigrants, banning Muslims at the border, and restoring waterboarding and other torture techniques. On eliminating gun-free zones on school grounds, he hasn’t repeated it recently, but we saw no evidence he had changed his stance. There might be some debate over his plan to defund Planned Parenthood, because he links that to continued abortions. However, there is no indication that the group plans to stop providing that service, so a President Trump would need to cut funding if he wanted to keep his promise. The one exaggeration in the video is his threat to kill the families of terrorists. Trump seems to have backed off that promise. He has said he would make them suffer, not necessarily kill them. The video might miss a couple of nuances, but it is generally accurate. We rate the collective package Mostly True. https://www.sharethefacts.co/share/a27d6e08-b5ec-40bb-aeb2-e15557be8d62",/factchecks/2016/may/05/hillary-clinton/clinton-video-lists-8-promises-trump-presidency/
