tags,sub_header,text_body,sources,quote_href
"['National', 'Economy', 'Taxes', 'James Lankford']","
Lankford overstates slow growth in past 100 years
","The Republican message on tax reform is that it holds the key to kicking the economy into high gear. Treasury Secretary Steven Mnuchin has talked of steady yearly growth of 3 percent or more each year with passage of the package. Many economists, regardless of their economic leanings, say that prediction is unlikely to play out, but Sen. James Lankford, R-Okla., said it makes sense to him. ""If the economy is stuck in the same track over and over again, somehow, you have got to be able to bump that to get it going,"" Lankford said on CBS News’ Face the Nation on Oct. 22. ""For the last 10 years, our economy has grown at less than 2 percent on average every single year for 10 years. We have not had a decade like that in a century in America."" The government’s Bureau of Economic Analysis tracks economic growth, and that’s where we turned to check Lankford’s statement about America’s lackluster performance compared to the last 100 years. His office told us he was looking at average growth from 2007 to 2016. According to the government statistics, real gross domestic product, or GDP, rose an average of 1.37 percent during that time. The yearly rates ranged from a drop of -2.8 percent at the low point of the Great Recession in 2009 to a high of 2.9 percent in 2015. So yes, the average is less than 2 percent, as he said. Lankford then counted each 10-year period working backward from 2007. His office sent us these numbers, using BEA data: 1967-76 3 1977-86 3.4 1987-96 3 1997-2006 3.3 2007-16 1.4 This raises a couple of questions about his specific words. First, Lankford said growth hadn’t been so low in a century. The bureau’s data only goes back to 1930, which is less than 100 years ago. Lankford would need more than another dozen years of data. His data source can’t prove his point. Second, the exact nature of Lankford’s decades was unique to his claim. Counting backwards by tens from 2016 isn’t necessarily the only way to define a decade. Yes, a decade means 10 years. But often, when talking about history, it means a 10-year period beginning in years that end in zero. The History Channel, for example, has its sections on the 1960s, the 1970s and so on. Based on that understanding, the numbers would tell a different story. In the first decade of this century, 2000 to 2009, the average annual rate of growth was 1.82 percent. That would undercut his argument that growth has not been under 2 percent for each decade going back a century. Then again, looking back at the decades between 1930 and 1999, average annual growth in each period has been over 2 percent. Lankford said that average yearly growth in the past 10 years has been under 2 percent and that ""we have not had a decade like that in a century in America."" Lankford is correct that growth since 2007 has averaged under 2 percent. The data don’t carry his argument over a full century because the government numbers only go back to 1930, not 1917 as would be necessary. He also has cherry-picked his definition of a decade. His numbers are correct by the yardstick he chose, but by another common interpretation of decade, average growth in the first 10 years of this century fell below 2 percent. That runs counter to the heart of his assertion. At the same time, using that definition, it is fair to say that growth since 2000 has been lower than in the decades before that. We rate this claim Half True.",[<zip object at 0x0000028096B2FD40>],/factchecks/2017/oct/31/james-lankford/lankford-overstates-slow-growth-past-100-years/
"['Education', 'Missouri', 'Eric  Greitens']","
Greitens Mostly False about MU having biggest enrollment drop of major universities
","November marks the two-year anniversary of the height of protests that took place on the University of Missouri’s campus. Protests over multiple racial issues culminated with a boycott by football players, a six-day hunger strike and, on Nov. 9, the resignations of the university system president and the MU chancellor. The University of Missouri has since experienced a noticeable dip in enrollment. Gov. Eric Greitens even went as far as to say in a Facebook Live video on Aug. 23, 2017, ""I believe that this is the biggest drop in enrollment of any major university in the country."" Big decline, yes. But is it the worst drop in enrollment in the country? In his video, Greitens goes on to state that freshman enrollment has dipped by 33 percent since protests in 2015 brought national media attention to the SEC school. The governor’s office didn’t respond to our request for clarifications. Because Greitens referred to major universities, we decided to take a look at four-year public universities containing 20,000 or more students. We chose these universities because the Department of Education lists MU in this group. According to the Department of Education data, MU was not the only university to experience a drop in enrollment. Departmental data show that MU's total enrollment declined from 35,424 in 2015 to 33,239 in 2016, or 6.17 percent. That puts the university in fourth place for enrollment decline. The top three: --Florida State University at Jacksonville, which is predominantly a two-year college, came in third with a 7.97 percent decrease in enrollment.
 --The University of Akron main campus fell 8.66 percent.
 --The largest decline was at Miami-Dade College, also predominantly a two-year college, which saw enrollment drop 11.43 percent.
 Greitens spoke before this year’s official enrollment figures were out, but the decline has continued. The Department of Education hasn’t finished gathering numbers for 2017 enrollment. On Sep. 20, MU announced an enrollment of 30,870, according to the MU News Bureau. That’s a drop of 12.9 percent from 2015. Freshmen enrollment is down even more. Since the protests on campus, MU experienced a 36.5 percent drop in freshman enrollment, more than the 33 percent decline Greitens mentions. According to the Department of Education, first-year student numbers for 2016-2017 are still not yet available for all universities, so there is no way to tell if MU experienced the largest drop in freshman enrollment. Greitens said, ""I believe that this is the biggest drop in enrollment of any major university in the country.""   MU has undoubtedly experienced a drop in overall enrollment since protests that took place two years ago. However, MU’s overall enrollment decline did not top other universities like Miami-Dade College or the four-year University of Akron. As far as freshman enrollment, numbers for 2016-17 have not yet been made available, so there is no way to tell if MU experienced the biggest drop in enrollment. The statement contains an element of truth but ignores critical facts that would give a different impression. We rate this claim Mostly False.",[<zip object at 0x000002809757E5C0>],/factchecks/2017/oct/31/eric-greitens/greitens-mostly-false-about-mu-having-biggest-enro/
"['Poverty', 'Wealth', 'Missouri', 'Bernie Sanders']","
Sanders' claim on economic disparity accurate, but with a caveat
","U.S. Sen. Bernie Sanders, I-Vt., spoke Sept. 21 at Westminster College in Fulton, where he laid out his vision for foreign policy. Like many of his other speeches, he touched on economic disparity and said, ""There is no moral or economic justification for the six wealthiest people in the world having as much wealth as the bottom half of the world’s population, 3.7 billion people."" We wanted to know if it is possible that the collective wealth of the six richest people could equal more than that of half the world’s entire population. Sanders’ source is a 2017 Oxfam report that is put together using numbers from Forbes and Credit Suisse’s Global Wealth Databook, according to Joshua Miller-Lewis, Sanders’ press secretary. The Oxfam report states that the eight richest men in the world had as much wealth as 3.6 billion people in the world, or half that population. But since that report, the numbers have changed: The rich have gotten richer while overall global wealth has decreased, according to the underlying data used by Oxfam. Oxfam’s calculations come from wealth estimates by Credit Suisse, a Swiss multinational financial services holding company, said Laura Rusu, policy and campaigns media manager for Oxfam America. Based on the latest data from Credit Suisse, the wealth of the bottom 50 percent of the global population is $409 billion. The six wealthiest people in the world add up to about $416.2 billion, according to Forbes. ""The 1 percent now controls more wealth than the 99 percent of the rest of us combined, and it’s only getting worse,"" said Rusu. The six richest people, according to Forbes billionaire list, are Bill Gates, Warren Buffett, Jeff Bezos, Amancio Ortega, Mark Zuckerberg and Carlos Slim Helú . While Sanders’ claim is accurate, there are some notes of caution. ""I think this statement is correct but it is not very meaningful because the bottom 50 percent has essentially no wealth,"" said economist Emmanuel Saez of the University of California, Berkeley. While many of the economists we spoke to agreed that the statement is technically correct, the issue lies with wealth measures. Most of the wealth of the rich is from fungible private wealth, which is an asset’s interchangeability with assets of the same type. ""It is probably the case that one-half the world’s population has almost no fungible private wealth. So by that measure, Bernie Sanders may be right,"" said Richard Burkhauser, professor emeritus of policy analysis at Cornell University College of Human Ecology. Rusu further explained that the Oxfam reports have seen a drop in private wealth, compared to the world’s collective wealth, but this has to do with an improved data collection method and not necessarily a change in people’s wealth. ""The dramatic drop isn’t due purely to a sharp increase in inequality, but rather the availability of better data,"" Rusu told PolitiFact Missouri. While giving a speech in Fulton, Missouri, Bernie Sanders stated that the six richest people in the world had as much wealth as the bottom half of the world’s 3.7 billion people. According to global wealth disparity research, it is factually accurate to say that six men are, collectively, richer than the bottom 50 percent of the world. However, an expert cautioned about reading too much into this specific statistic because of the way wealth is measured and improvements in data collection. Sanders’ statement is accurate but needs clarification. We rate this claim Mostly True.",[<zip object at 0x00000280966CDC40>],/factchecks/2017/oct/31/bernie-sanders/sanders-token-claim-economic-disparity-accurate-ca/
"['National', 'Elections', 'Crime', 'Donald Trump']","
Trump wrongly says Manafort crimes came years before he joined the campaign
","President Donald Trump reacted via his favorite platform -- Twitter -- to indictments against his former campaign manager Paul Manafort, a business associate of Manafort’s, and a guilty plea from a former campaign policy adviser. ""Sorry, but this is years ago, before Paul Manafort was part of the Trump campaign. But why aren't Crooked Hillary & the Dems the focus,"" Trump tweeted. Sorry, but this is years ago, before Paul Manafort was part of the Trump campaign. But why aren't Crooked Hillary & the Dems the focus????? The Justice Department indicted Manafort on 12 counts, primarily money laundering and false statements, none of which involved his work for Trump. The oldest of the allegations date back to activities that began in 2006, but three occurred in 2016 and 2017. Manafort’s more recent actions undercut Trump’s statement. The White House did not respond to a request for comment. In March 2016, then-candidate Trump tapped Manafort to manage the Republican National Convention. In a press release announcing the hiring, Trump praised Manafort as ""a great asset and an important addition"" in consolidating the support Trump won during the primary season. On May 19, Trump promoted Manafort to campaign chairman and chief strategist. On Aug. 19, as Trump’s poll numbers tumbled, Manafort resigned. His time with the Trump campaign had lasted six months. From 2006 to 2014, according to the indictment, Manafort and his business partner Rick Gates made tens of millions of dollars lobbying on behalf of a pro-Russia political party in Ukraine and the man who led it into power, Ukrainian President Viktor Yanukovych. The work continued briefly after Yanukovych was forced from office. The grand jury indictment alleges that in order to hide the money from the U.S. government, Manafort and Gates ""laundered the money through scores of United States and foreign corporations, partnerships and back accounts."" Manafort used ""his hidden overseas wealth to enjoy a lavish lifestyle in the United States."" He bought ""multi-million dollar properties"" and then ""borrowed millions of dollars in loans using these properties as collateral, thereby obtaining cash in the United States without reporting and paying taxes on the income."" The money-laundering conspiracy is the second count in the indictment. The government documented a large number of transactions between 2008 and 2014. But they continued into March 2016, the very beginning of Manafort’s work with the Trump campaign. In 2012, Manafort used an offshore account to buy a $2.8 million condominium in New York City, which he rented out using, among other services, Airbnb. In late 2015, he applied to get a mortgage on the property. To get a lower interest rate, he and Gates invented documents to say it was a second-home for his daughter and son-in-law. Based on that assurance, in March 2016, government prosecutors said, a bank gave Manafort a $1.185 million loan on the property. Also in early 2016, Manafort misled another bank to secure a loan on a second New York property. In addition, the indictment said for many years Manafort had hidden his control over multiple foreign accounts in places such as Cyprus and the United Kingdom. That deception continued as late as October 2016. There are two other charges that occurred in 2016 and 2017, and both involve making false statements. The government said that in November 2016 and February 2017 Manafort and Gates failed to make a full disclosure of their overseas work under the Foreign Agents Registration Act. They denied that their work for Ukrainian parties included meetings or outreach within the United States. The government also said they tried to bury the paper trail that would reveal their full activities. Manafort's attorney Kevin Downing said in a statement that the Special Counsel was using a ""very novel theory"" of the foreign agents registration law, and that since 1966, the government has won just one conviction for failure to file under it. Trump said the allegations against Manafort involved crimes committed years ago. Most of the counts in the indictment detail Manafort’s money laundering efforts dating back to 2006. But that deception involving foreign bank accounts and misleading lenders, prosecutors said, extended until as late as October 2016. By March of that year, Trump had named Manafort to oversee the Republican National Convention. The charges that Manafort made false statements took place after Manafort stepped down from the Trump campaign, but they did take place within the past year. Trump’s claim puts more of a cushion between him and Manafort than was actually the case. We rate this statement Mostly False.",[<zip object at 0x0000028096E17C00>],/factchecks/2017/oct/30/donald-trump/trump-wrongly-says-manafort-crimes-came-years-he-j/
"['Abortion', 'National', 'Candidate Biography', 'Evan Jenkins']","
Did Patrick Morrisey once support abortion rights?
","In the West Virginia primaries for U.S. Senate, the Republican candidates are lobbing accusations of being insufficiently conservative. West Virginia Attorney General Patrick Morrisey first attacked his opponent, U.S. Rep. Evan Jenkins, R-W.Va., on Twitter for being a political opportunist due to changes in his party affiliation. Morrisey and Jenkins are competing for the GOP nomindation to challenge Sen. Joe Manchin, a Democrat. ""GOP, then Dem for 20 years, then Jenkins becomes a rank political opportunist and joins GOP. Jenkins stands for nothing but himself,"" Morrisey tweeted. Jenkins responded by accusing Morrisey of supporting abortion rights in a 2000 race for U.S. Congress in New Jersey. (Morrisey moved to West Virginia in 2006.) ""Guy who ran for Congress in NJ as pro-choice and just took $100k in pill money,"" Jenkins said. Guy who ran for Congress in NJ as pro-choice and just took $100k in pill money —> https://t.co/AasTJGOkP9 Both candidates have received endorsements from anti-abortion groups in recent years, and Morrisey received the endorsement from West Virginians for Life this year. So is it accurate that Morrisey advocated for abortion rights in a race to represent New Jersey’s 7th District? Not exactly. Morrisey clearly opposes abortion. Jenkins’ claim essentially boils down to Morrisey not having opposed it enough in 2000. When we asked Jenkins’ campaign for evidence, they directed us to the following line in a May 15, 2000, AP story about the GOP primary race between Mike Ferguson and Morrisey: ""Ferguson has the support of state and national anti-abortion organizations and says he would support a constitutional amendment to ban abortion. The other abortion opponent in the field, Morrisey, says he would not support such an amendment,"" the story said. ""While Ferguson and Morrisey are against abortion, and (Tom) Kean favors abortion rights, (Joel) Weingarten says only that lawmakers should respect ‘current constitutional strictures’ by not trying to overturn the 1973 Supreme Court decision, Roe vs. Wade, that legalized abortion,"" the story went on to say. So the same article that Jenkins says shows Morrisey supported abortion rights also referred to him twice as an abortion opponent. The only other evidence the Jenkins campaign provided for his claim was an April 2000 news article in which Morrisey and Weingarten accused Ferguson of conducting a push poll in which Morrisey was portrayed as an abortion rights advocate. ""(Morrisey) also said he is ProLife and not ProChoice on the abortion issue as he said was indicated in the Ferguson campaign poll,"" the story said. The Westfield Leader wrote of Morrisey’s abortion stance two months later: ""The candidate said he is pro-life on the abortion issue, with exceptions for rape, incest, and when the life of the mother is in danger. He opposes partial birth abortion."" Wanda Franz, the president of West Virginians for Life, which endorsed Morrisey for Senate, called Jenkins’ accusation inaccurate. Franz emphasized that Morrisey had been fighting against abortion since the 1990s as a lawyer on Capitol Hill. (Morrisey served as Counsel to the House Commerce Committee under Republican leadership.) ""Both of the pro-life candidates were pro-life, that’s what it said in the article,"" Franz said. ""Simply the difference had to do with the Human Life Amendment as a constitutional effort."" The human life amendment is a pretty broad term encompassing not one but several proposals to amend the Constitution to effectively overturn Roe vs. Wade. Most of the proposed amendments define personhood as starting at fertilization or conception, which poses a problem to some who believe abortion should be permitted in certain cases. ""A Constitutional Human Life Amendment is the only practical action we can take to broadly prohibit abortion and permanently protect unborn human life,"" said Andy Sere, Jenkins’ spokesman. ""If a candidate for Congress says he would not support the only way to do that, then that is a pro-choice position — no matter if that politician would like to be labeled pro-choice or not."" Just to be clear, Morrisey sent a letter to the West Virginia GOP that said he would ""strongly support"" a constitutional amendment in the U.S. Senate to overturn Roe vs. Wade. ""For my entire career, I have been opposed to that horrific decision,"" Morrisey wrote. So what about his stance in 2000? Morrisey’s campaign did not recall the reason for Morrisey’s opposition to a constitutional amendment in 2000. We were unable to gather the specifics of the amendment Morrisey opposed. ""Mike Ferguson was pro-life, no exceptions, and all the articles about Morrisey had some exceptions in the case of rape or incest,"" said Nachama Soloveichik, Morrisey’s spokeswoman. ""It’s possible they were talking about some specific amendment that didn’t have exceptions."" Charles Camosy, author of Beyond the Abortion Wars and theology professor at Fordham University, explained this was a common reason for opposition to the amendment. Larry Arnold, the author of the AP article in question, said Morrisey’s position on the amendment likely came from Morrisey’s campaign website, which the Wayback Machine showed included a link to a position paper on partial birth abortion. (We were unable to track down the paper.) There’s also the chance Morrisey opposed the amendment for other reasons, like believing it was not the most effective way to push the anti-abortion agenda or that it was a decision that should be left to the states. Franz said that either way, opposition to the amendment by itself wouldn’t have meant he supported access to abortion in most cases, as the practicality of a constitutional amendment has long been contested even among people pushing for abortion restrictions. ""We have not thought of the human life amendment as a viable option for decades,"" Franz said. ""We don’t have it on our candidate questionnaires. It isn’t an issue for us anymore because we have other strategies."" The Susan B. Anthony List, a prominent anti-abortion group, is not focused on pushing the amendment, Camosy explained, whereas other groups such as the American Life League and the Human Life Action Center still consider it a long-term goal of the anti-abortion movement. The National Pro-Life Alliance includes the issue on their candidate questionnaire. ""There are various paths to providing legal protection for unborn children,"" said Carol Tobias, a spokeswoman for National Right to Life. ""A constitutional amendment is one. Another would be for the Supreme Court to overturn Roe vs. Wade, followed by action at the state level to enact pro-life measures."" In other words, the importance of the amendment is contested among anti-abortion groups, but Carmosy agreed that equating opposition to an amendment — no matter the reason — to supporting abortion rights was unfair. He proposed the example of the LGBT rights movement in the 1990s. ""Was someone who, back then, was arguing only for civil unions and not a constitutional amendment about marriage not a genuine LGBT ally?"" Camosy said. ""That's ridiculous. It was a difference in political strategy."" Jenkins said Morrisey ""ran for Congress in NJ as pro-choice."" We found no evidence Morrisey supported abortion rights during a New Jersey congressional race in 2000. Morrisey opposed abortion except in cases of rape, incest and when the woman’s life is in danger. The Jenkins campaign cited a 2000 AP story that said Morrisey was opposed to a constitutional amendment to ban abortion, one of the more extreme tactics among those who oppose abortion. However, experts and anti-abortion groups told us that opposition to the amendment would not have made Morrisey an abortion rights advocate. We rate this statement False. Correction: This report initially said that both candidates had received endorsements from an anti-abortion group this year. We have corrected it to note that both candidates have received endorsements in recent years. ",[<zip object at 0x0000028096E33980>],/factchecks/2017/oct/30/evan-jenkins/did-patrick-morrisey-once-support-abortion-rights/
