tags,sub_header,text_body,quote_href
"['City Government', 'Economy', 'Small Business', 'Technology', 'Texas', 'Steve Adler']","
Steve Adler correctly says Austin No. 1 in Texas in startups, venture capital investment, patents
","Austin’s typically soft-spoken mayor recently popped a big-as-Texas boast. ""There’s a reason Austin is number one in Texas in startups and venture capital and patents,"" Steve Adler said. Adler, speaking outside City Hall, went on: ""There’s a reason that tech and transportation companies come to Austin to roll out their new initiatives. And that’s because Austin is where good ideas become real. Claiming that Austin is anti-innovation has no basis in fact."" Hear hear! Still, we wondered about the rankings Adler declared while revealing his plans to vote against a ballot proposition, later rejected by voters, affecting background checks of drivers for ride-hailing services. Startups Adler's office didn't immediately offer his backup. Meantime, our online search for information on startups led us to a June 2015 report from the Kansas City-based Ewing Marion Kauffman Foundation stating that in the ""last year,"" the Austin metropolitan area ranked No. 1 nationally for the area’s pace launching startups, which the foundation defined as ""firms less than one-year old employing at least one person besides the owner."" Asked what ""last year"" means in the report, foundation researcher E.J. Reedy advised by phone the conclusion tied to data from 2012 and 2014. According to the foundation, which says it focuses on improving lives through education and entrepreneurship, the nation’s top 10 metropolitan areas for ""startup activity"" among the 40 most-populous metropolitan areas were: Austin; Miami, Fla.; San Jose, Calif.; Los Angeles; Denver; San Francisco; New York; Houston; San Diego; and San Antonio."" Per Adler’s Texas point, the Austin area had 180.8 startups per 100,000 residents, the foundation says, outpacing the Dallas-Fort Worth-Arlington area (142.5 startups per 100,000 residents), Houston-Sugar Land-Baytown (136.9 startups per 100,000 residents) and the San Antonio-New Braunfels area (111.9 startups per 100,000 residents). By email, foundation spokeswoman Lacey Graverson told us the presented concentrations drew on the U.S. Census Bureau’s Business Dynamics Statistics to tally startups matched with population data from the Bureau of Economic Analysis. Reedy agreed by phone that among the big Texas cities, the Austin area had the greatest concentration of startups. But generally, Reedy indicated, counts of startups can vary, partly because there’s no single accepted definition of startups, which inherently come and go at a rapid pace. The government has official measures, Reedy added, but each one captures an aspect -- for instance new employer businesses or newly self-employed individuals. Also, Reedy said, observers differ over what merits counting. Some stress large firms that employ many, he said, others urge a fix on technology firms and others say that any count should recognize small businesses (including one-person endeavors) that grow by an employee or two a year. A foundation chart presenting Austin’s ""startup density"" since the late 1970s indicates the area has had peppier times--including in 2008 (201.7 startups per 100,000 residents), 2006 (214.9), 1999 (217.9) and, the chart’s high point, 1981 (499.5), which was up a huge measure from 1980 (31.4):              SOURCE: Web page, ""Startup Activity, Austin Area, 2015,"" Ewing Marion Kauffman Foundation, June 4, 2015 (viewed May 5, 2016) Venture capital Next, we turned to exploring Austin’s ranking for venture capital, which describes money invested in a business or project at considerable risk. A January 2016 Austin American-Statesman news story, citing a survey by PricewaterhouseCoopers and the National Venture Capital Association,  said Austin entities in 2015 were ""by far"" the state’s largest recipients of venture capital, with $740 million; Dallas firms placed second, fielding $214.4 million, ahead of Houston outfits, at $160 million. The Austin-connected investments added up to the largest annual dollar figure for Austin since 2001, the newspaper said, when 127 companies received $1.14 billion. By email, mayoral spokesman Jason Stanford pointed out another account of the survey results; a Silicon Hills News story said the 99 Austin deals in 2015, mostly to develop software, were down from 114 in 2014. Also, the story said, Austin’s number one deal for the latest year was Civitas Learning, attracting $60 million in venture capital, followed by Aeglea Biotherapeautics with $44 million, Mirna Therapeutics with $41.8 million and SpareFoot with $30 million, the story said. Nationally in 2015, the Statesman story said, venture capital investments rose to $58.8 billion, up 22 percent from the year before. Silicon Valley, as usual, took in the most money, with the San Jose area receiving $27.3 billion in 1,333 deals, the story said. Patents Stanford said Adler made his claim about Austin leading Texas in patents based on a May 2010 Forbes.com article by Andy Greenberg stating that Austin and neighboring Round Rock had ""produced an impressive average 1.7 patents for every thousand residents over the last 12 months,"" the second-most per-capita of any metro area in the country, he wrote. Greenberg elaborated: ""Austin’s culture of innovation may be boosted by well-known tech credentials like the South by Southwest (SXSW) Web startup and music festival held annually in March, as well as the nearby headquarters of hardware industry giants Dell and Freescale Semiconductor. But they also have two secret weapons in the innovation race: the University of Texas’s Cockrell School of Engineering, and IBM’s Austin research lab. ""IBM produces more patents than any other company in the world, and for the last seven years Austin has produced more of those patents than any other IBM office. In total the lab produced 880 patents in 2009. That’s just 30 less than all of Cisco, and 300 more than Sun Microsystems, Boeing, AT&T or Toyota."" We were unable to confirm or duplicate Greenberg’s Austin conclusion. To get our own sense of how Texas cities stand in patents originated, we reached out to the Dallas-based regional office of the U.S. Patent and Trademark Office. By email, spokesman Ryan Elliott pointed out patent counts posted by the office indicating that in 2012-13 and from 2000 through 2013, the Dallas-Fort Worth-Arlington area generated more patents than the Austin-Round Rock-San Marcos area. However, the regions’ raw counts were close, according to the agency, while the Austin area was responsible for more patents than any other Texas area from 2009, 2010 and 2011 through 2013, by our reckoning. Snapshot: The Austin area was responsible for 12,387 patents from 2009 through 2013, according to the office, with the Dallas area accounting for 11,546 patents -- which we took to mean that the less populous Austin area ran well ahead of the Dallas area in patents per 1,000 residents. Our search for relevant analyses led to a 2013 report by the Brookings Institution finding that from 1980 to 2012, most U.S. patents--63 percent--had been developed by people living in just 20 metro areas home to 34 percent of the U.S. population. ""Reflecting the advantages of large metropolitan economies,"" the report said, ""92 percent of U.S. patents are concentrated in just 100 metro areas, with 59 percent of the population. For patents applied for from 2007 to 2011, the metro areas with the highest number per capita are San Jose; Burlington, VT; Rochester, MN; Corvallis, OR; and Boulder, CO."" The authors wrote: ""From 1980 to 2011, a few large metros notably changed their share of U.S patents. At the top, San Jose moved up from ninth to first, and San Francisco moved from seventh to fourth, moving ahead of Chicago, Philadelphia, Detroit, and Boston. Seattle and San Diego moved up 15 and nine places, respectively, to become seventh and eighth. Meanwhile, Austin and Raleigh moved up 41 and 55 places, respectively, to become 11th and 20th. Cleveland fell 10 slots from 13th to 23rd, while Philadelphia fell from fourth to 13th."" Not only did Austin surge in total patents, it lately achieved a high ranking in per-capita patents. From 2007 through 2011, a chart in the report indicates, the Austin metro area had 1,503 patents per million residents, tops in Texas and placing the area fourth nationally among high-patent areas behind San Jose-Sunnyvale-Santa Clara, California (5,066 patents per million residents); Poughkeepsie-Newburgh-Middletown, New York (1,829); and San Francisco-Oakland-Fremont (1,638). In Texas, the Houston-Sugar Land-Baytown metro area had 379 patents per million residents and the Dallas-Fort Worth-Arlington area had 310 per million, according to Brookings. Next, we heard back from Mark Muro of Brookings who shared a chart that he said was based on a different data source -- global PCT patents, meaning the international patent system rather than the U.S. PTO. By that metric, the chart suggests that from 2008 through 2012, the Houston metropolitan area generated more cutting-edge ""technology"" patents per 1,000 residents (1,598) than the Austin area (1,294). An excerpt:                        SOURCE: Chart ranking 100 U.S. Core Based Statistical Areas in tech patents invented per 1,000 population, 2008-2012 (received by email from Mark Muro, senior fellow and policy director, Metropolitan Policy Program, Brookings, May 5, 2016) Regardless of those results, Muro and a Brookings colleague, Nick Marchio, suggested we hew to the U.S. patent office counts as the best general way of assessing the mayor’s claim. Marchio even volunteered to adjust the patent office’s raw counts for the population of each metropolitan area. Result: In 2013, the latest year of tabulated patents, the Austin area ranked No. 11 nationally with 1.55 patents per 1,000 residents, far outpacing the No. 2 Texas metro, Dallas, at 51st with 0.44 patents per 1,000 residents. Also, from 2009 through 2013, the Austin area ranked 10th nationally with 6.95 patents per 1,000 residents, far ahead of the No. 2 Texas metro, in this case the Houston area, which landed 52nd nationally with 1.81 patents per 1,000 residents. Our ruling Adler said: ""Austin is number one in Texas in startups, venture capital and patents."" Houston has been running ahead in international technology patents, it looks to us, but Austin lately leads the state in overall patents, startups and venture capital. We rate the claim True. TRUE – The statement is accurate and there’s nothing significant missing. Click here for more on the six PolitiFact ratings and how we select facts to check.",/factchecks/2016/may/13/steve-adler/steve-adler-correctly-says-austin-no-1-texas-start/
"['Debt', 'Deficit', 'Wisconsin', 'Sean Duffy']","
Did Sean Duffy flip-flop on what should be done about Puerto Rico's debt crisis?
","House Speaker Paul Ryan is not the only Wisconsin Republican being targeted by The Center for Individual Freedom for supporting a measure aimed at helping Puerto Rico resolve its debt crisis. The center, a conservative non-profit based outside of Washington, D.C. that does not disclose its donors, claimed in a TV ad that Ryan’s support for a measure from U.S. Rep. Sean Duffy, R-Wausau, amounted to backing a ""bailout"" for Puerto Rico. We rated that claim Half True on the Truth-O-Meter. In a separate radio ad, the center argues Duffy flip-flopped on what Congress should do to help resolve Puerto Rico’s debt crisis. We’re going to put that one to our Flip-O-Meter. Our requisite reminder: The Flip-O-Meter simply measures whether a political figure has been consistent, not whether any change makes for good (or bad) politics or policy. So, has Duffy changed his views on how to respond to Puerto Rico’s debt crisis? The ad The one-minute ad, launched April 22, 2016, paints a bleak picture for Puerto Rico -- which is $72 billion in debt and now defaulting on debt payments -- then shifts its attention to a critique of Duffy.    ""In February, Congressman Sean Duffy warned against Super Chapter 9 for Puerto Rico. Duffy said granting Puerto Rico Super Chapter 9 would pave the way for overspending states like California, New York, and Illinois to also declare bankruptcy."" The ad maintains Duffy has ""flip flopped,"" and is now ""leading the fight"" for Super Chapter 9 bankruptcy for Puerto Rico. Unlike the 50 states, Puerto Rico, a U.S. territory,  isn’t covered under Chapter 9 of the U.S. bankruptcy system, which grants various public bodies -- including municipalities and public utilities -- the right to declare bankruptcy. Duffy highlighted that point in a Feb. 17, 2016 keynote speech to the American Action Forum, which is part of the conservative advocacy organization  American Action Network. ""I think bankruptcy should be the priority over a taxpayer bailout,"" Duffy said in the speech. ""I put out a state-based Chapter 9 bankruptcy proposal -- just like you have in Wisconsin, just like you have in Texas -- so municipalities and public corporations in Puerto Rico can file for bankruptcy just like they can in Wisconsin. ""But the general obligation bonds of Puerto Rico proper can’t access bankruptcy."" That is a key point in this discussion. ""Super Chapter 9"" has become a loaded phrase in Washington, but may carry different meanings for different people. For instance, in the radio ad itself, the definition seems to be applied to any measure that allows the territory of Puerto Rico itself to declare bankruptcy -- not just municipalities or smaller government units on the island. Indeed, it goes so far as to declare Duffy’s bill is ""Super Chapter 9."" Duffy, for his part, defined Super Chapter 9 as ""allowing bankruptcy for the general obligation bonds."" He said allowing this in Puerto Rico would amount to a ""tee-up"" for bankruptcy of general obligation bonds in high spending states like Illinois and California. But that provision is not in Duffy’s bill. For the purposes of this item, we can actually set aside the differing definitions, since we are looking at whether Duffy has changed his stance. We will also focus in on the period since February 2016, since that is the benchmark used in the ad. The bill Let’s look at the Puerto Rico Oversight, Management, and Economic Stability Act. This is the measure -- supported by Duffy -- that is in question in the radio ad. The bill, introduced April 12, 2016,  would create an oversight board as an entity within the Puerto Rican government to aid in reforming the territory’s financial crisis. The board could facilitate restructuring of debt with creditors and, as a last resort, seek court supervised restructuring. In our item examining whether the measure amounted to a bailout, we noted the measure would allow Puerto Rico to pay less to some creditors than the creditors are owed.

In terms of the impact on American investors, many bond funds have already sold their Puerto Rican debt, and the debt is now mostly owned by hedge funds, according to the Associated Press. But Oppenheimer Funds and Franklin Templeton still own part of the debts.

So, a restructuring almost certainly would mean that Americans who, through brokers or choices they made in their retirement accounts, put some of their savings into Puerto Rican bonds almost certainly will get a lower return on their money, the experts told us. Thus, the measure has some bankruptcy-like qualities. But that, too, does not change the bottom line when it comes to whether Duffy has been consistent in his stance. His position has been that, just like the 50 states, Puerto Rico itself should not be allowed to declare bankruptcy. Rather, municipalities and governmental units in the territory should be placed on par with those in the 50 states, and they should be allowed to declare bankruptcy. Our rating From the beginning, Duffy warned against allowing Puerto Rico as a territory to declare bankruptcy. Despite the suggestion of the radio ad, the bill he is sponsoring does not allow bankruptcy for general obligation bonds. We rate Duffy’s position on the issue of what to do about Puerto Rico’s debt as No Flip.",/factchecks/2016/may/13/sean-duffy/did-sean-duffy-flip-flop-what-should-be-done-about/
"['Global News Service', 'Financial Regulation', 'Foreign Policy', 'Water', 'Gwen Moore']","
Is an arm of the World Bank tied to 8-fold rise in water rates in Manila?
","If a city can’t provide safe drinking water, should it turn the whole operation over to a private company? No, we’re not talking about Flint, Mich. This concerns the southeast Asian city of Manila, the capital and biggest city in the Philippines. In 1997, officials in the Pacific island nation set up not one but two private companies to deliver water to homes and businesses. One of those companies has been a financial success. So healthy, that the private banking arm of the World Bank, the International Finance Corporation, became a part-owner in 2004 for about $15 million. During a hearing on April 27, 2016, the International Finance Corporation’s role drew criticism from Rep. Gwen Moore, D-Wis. ""In Manila, for example, when the IFC, the development arm, took an equity position in the water company, water rates were raised up to 845 percent,"" Moore said. She was pressing a Treasury Department official on how to make international development banks more accountable. We decided to see whether residents had to pay more than eight times as much for their water once the International Finance Corporation bought a stake in the Manila Water Company. What we found, between 2004, when the IFC bought its share of the company, and 2012, is that rates did climb. But they only rose by about 170 percent, not the 845 percent Moore cited. Moore’s office said she relied on a 2010 resolution from the Philippines House of Representatives. Making apples-to-apples comparisons of rates is challenging. The soundest data we could find was in a 2013 report from local regulators, the Metropolitan Waterworks and Sewerage System. This table shows the average price (in Philippine pesos) of a cubic meter of water at three points, when privatization took place in 1997, when the IFC gained part ownership in 2004 and 2012. 1997 2004 2012 Average rate 
(pesos/cubic meter) 4.02 14 38.12 Change from 1997 (percent) 248% 848% Change from 2004 (percent) 172% PolitiFact analysis of a 
typical bill Typical household bill 
(1997 pesos) 121 295 537   As you’ll see, the increase from 1997 to 2012 was 848 percent, near the increase Moore claimed. The 2010 resolution from the Philippines House of Representatives said that the cost of water rose by 845 percent between 1997 and 2009. The problem, though, is that the IFC did not become a part owner until 2004. The rate increase between that year and 2012 was about 170 percent. There are a few other important dimensions to bring into the picture. A better water service By the mid 1990s, Manila’s public water system was in crisis. About a third of the city’s residents, roughly 3.5 million people, had no running water. Leaks and water theft were literally draining the pipes. Water pressure could drop at any moment, leaving many with a completely unpredictable water supply. Cholera and infection-related diarrhea were on the rise. The Philippine government turned to the World Bank, which brought in the International Finance Corporation to devise a privatization plan. Gregory Pierce, a lecturer at Urban Planning at UCLA, told us privatization ""was a big fad in the early to mid 1990s."" The IFC’s role was advisory, but the framework it crafted produced the circumstances that exist today. Major capital investments, and rising rates to pay for them, were part of the plan. In other words, while Moore linked her comment to the year when the IFC took an equity position, its involvement dates back years earlier to the launch of a privatized water system. The Manila metro area was divided into two zones, and an international consortium, that included the American Bechtel Corporation, was the winning bidder for the eastern section. The company was called Manila Water. Manila Water soon spent over $300 million to install more than 1,200 kilometers of piping. The good news is, by every measure, quality and reliability went up. In 2007, an article in Economics and Management in Developing Countries reported that by 2002, the fraction of people with service had gone from about 60 percent to over 80 percent. Unlike before 1997, the water moving through the pipes met government drinking water standards. Leaks were repaired twice as quickly and while service might drop out, the average went from taps running 17 hours a day before the change to 21 hours a day afterward. As the authors of the journal article put it, ""If one goes by the numbers for water coverage, availability and quality, water privatization in Metro Manila seemed to have worked. However, water rates had risen dramatically during the same period."" Frederick Jones, a spokesman for the International Finance Corporation, said the benefits have been widely shared. ""While tariffs have increased for some residents of Manila, many of the people not previously connected to water services were poor families, who were forced to pay $3 a cubic meter for bottled water on the open market,"" Jones said. ""Today, the average tariff in Manila is $1.30, but this tariff is helping subsidize the poorest families, who now only pay 18 cents per cubic meter."" Two ways to look at price hikes Moore couched her claim in terms of the percentage rise in the cost of water. But Nathaniel Meyer, a senior organizer with the advocacy group Corporate Accountability International, said from a household perspective, what really matters is how much you pay. ""If a family in Manila in 1997 paid 4 pesos for their water and it’s gone up in absolute pesos, that's going to leave them less for food, health care, clothes for the kids and everything else,"" Meyer said. We ran the numbers for a household paying the average rate on 30 cubic meters of water a month. In its publications, Manila Water says 30 cubic meters is the amount used by the typical household. In inflation-corrected pesos, the typical bill went up about 20 percent faster each year after 2004 than before. Our ruling Moore said that when the International Finance Corporation became a part-owner of Manila Water, rates rose 845 percent. The source cited by Moore’s staff undermines that number. The International Finance Corporation bought its stake in 2004. Between 2004 and 2012, rates rose about 170 percent. Moore incorrectly used a figure that would apply to the period from 1997 to 2012. However, the IFC crafted the plan for privatization in the first place. All parties knew that important capital investments would follow, and that rates would go up. It is also true that in terms of the actual size of a family’s water bill, rates rose faster each year after the IFC bought its share than before. Moore wrongly pegged the rate increase to the date of IFC’s equity position, but the development corporation played a key role from the start. We rate this claim Half True. https://www.sharethefacts.co/share/c3d24c04-cbbd-4742-8c79-10b2e96cd9d4",/factchecks/2016/may/12/gwen-moore/arm-world-bank-tied-8-fold-rise-water-rates-manila/
