tags,sub_header,text_body,sources,quote_href
"['Arizona', 'Candidate Biography', 'Corrections and Updates', 'Martha McSally']","
Did Arizona's Kyrsten Sinema protest troops in a pink tutu and denigrated their service?
","Republican U.S. Rep. Martha McSally in a campaign ad paints herself as a stark contrast with Rep. Kyrsten Sinema, her Democratic opponent in the race for Arizona’s open seat in the U.S. Senate. Side-by-side pictures show McSally in military uniform and Sinema in a pink tutu. The ad highlights McSally’s service as a U.S. Air Force fighter pilot and portrays Sinema as unpatriotic and out-of-touch with global threats. McSally’s Aug. 23 campaign ad said: ""Everyone remembers where they were on 9/11. I was deployed to the Middle East. Led airstrikes against the Taliban and was the first woman to fly a fighter jet in combat. I know the price of freedom. ""While we were in harm’s way in uniform, Kyrsten Sinema was protesting us in a pink tutu and denigrating our service. The world is a dangerous place. We need strong leaders who understand the threat and respect our troops. Kyrsten Sinema fails the test."" PolitiFact wondered about McSally’s claim that Sinema protested troops in a pink tutu, ""denigrating our service."" McSally retired from the Air Force in 2010 after 26 years of military service that included six deployments to the Middle East and Afghanistan. Sinema was a law student at the time who participated in a series of vigils and anti-war protests in Arizona. In at least one of those instances, she wore what looks like a pink tutu. The 2003 event coincided with Women’s International Day, included live music and dancing, and other attendees also wore pink outfits. Sinema described the event as ""an expression of creativity and of self.""  Sinema’s pink tutu photo has been used against her in previous races for public office, and it’s a real photo. But we didn’t find evidence that Sinema denigrated the service of military members, as McSally’s ad claimed. Screenshot from McSally for Senate campaign ad. Sinema was a law student at Arizona State University when she was quoted in student newspaper articles as an organizer of protests against the Iraq, which former President George W. Bush ordered March 19, 2003. Six days earlier, an article detailed Sinema’s participation in a Phoenix rally called ""No War! A Celebration of Life and Creativity"" that coincided with International Women's Day. ""Flurries of pink — the color of International Women's Day — highlight the shirts and skirts and socks of demonstrators,"" the article said. The article said Sinema wore ""a neon-pink shirt and something resembling a pink tutu."" Sinema told the newspaper, ""You protest when you feel like you're not being heard. To make yourself heard, you have to do something out of the ordinary. There, inherently, is this expression of creativity that comes with protests, so you can say, 'I am important. I am a human.'"" The articles don’t quote Sinema as saying anything specifically against the troops. Her comments center on Bush’s policy. ""Since Bush has taken office, he has rolled back civil liberties and provoked war against Iraq. We couldn't not protest,"" Sinema said in a September 2002 student newspaper article. The Arizona Republic published a story in February 2002 about silent vigils in Phoenix against war and the abuse of women worldwide. Sinema is quoted as saying that the vigils will continue ""til there's no more war."" The story also quotes an ASU professor as saying that the vigils seek to raise awareness about the victims of war, which included the poor, women and ""yes, soldiers."" The Arizona Republic included the voice an 18-year-old who was planning to enlist in the Marine Corps. ""Everybody has their own opinion,"" Steve Sullivan told the newspaper. ""I'm not offended at all. It's great they come out and protest."" Sinema told the Associated Press for a story on anti-war protesters that a lot of people were worried about the future and felt isolated. ""We just want people who are sad, upset, devastated or confused about the war to have a place to meet and be comforted by other people who feel the same way,"" Sinema said in March 2003. Sinema’s campaign today says she also supported U.S. troops. ""Kyrsten has always supported our service members,"" Helen Hare, a spokeswoman for Sinema’s campaign told PolitiFact. ""Reporting from the time confirms that while she spoke out against the war, she also voiced her respect for those who serve — like the members of her family."" The photo in question is from a 2003 protest, it did not happen on 9/11, contrary to what the ad may imply, her campaign said. Sinema’s campaign also pointed to an Arizona Republic March 2003 article about vigils in opposition to the Iraq war. Sinema told the newspaper that they wanted ""to respect and honor those who would be killed. We want those lives to not be sacrificed."" Sinema’s campaign said that her older brother enlisted in the Marines in 1991 and left active duty in 1999; and her younger brother enlisted in the Navy in 2005 and is still on active duty. Sinema has also voted in favor of bills authorizing funding for the military and pay raises for troops, and co-sponsored bills to help veterans receive benefits, her campaign said. Sinema was first elected to the U.S. House of Representatives in November 2012. As she campaigned for that seat, she told The Hill in a May 2012 article that while her views had evolved, her approach to dealing with global conflicts had not. ""She said she favors aggressive diplomacy, crippling sanctions to combat proliferation, and swift, multilateral intervention as a last resort,"" the Hill reported. The Hill story said that in April 2006, Sinema in an online social justice group wrote: ""I have always and will always continue to oppose war in all its forms."" But in her interview with The Hill, she said: ""You should never take military intervention off the table. When you do so, you give an out to a rogue nation or rogue actors."" For instance, Sinema called for military intervention in places such as Sudan, citing genocide, and wished U.S. troops had intervened earlier in Rwanda and in World War II, The Hill reported. In September 2015, Sinema was among 25 House Democrats who voted against a resolution to approve the Iran nuclear deal. Former President Barack Obama about a month earlier had said that rejection of the deal ""leaves any U.S. administration that is absolutely committed to preventing Iran from getting a nuclear weapon with one option — another war in the Middle East."" Sinema told The Huffington Post after the September vote that it was ""hyperbole"" and ""not necessarily true"" that being against the deal meant choosing war. ""I’m frustrated by these false dichotomies,"" she said.  McSally in a campaign ad said, ""While we were in harm’s way in uniform, Kyrsten Sinema was protesting us in a pink tutu and denigrating our service."" McSally retired from the Air Force in 2010 after 26 years of military service. After 9/11, Sinema led protests against the war in Iraq. At a 2003 rally called ""No War! A Celebration of Life and Creativity,"" Sinema wore a pink tutu. Media reports of the rallies in 2002 and 2003 quote Sinema as opposing the war and the Bush administration’s policy, but we found no evidence of her disparaging troops. McSally’s statement contains an element of truth but ignores critical facts that would give a different impression. We rate it Mostly False.   --- Editor’s note, Sept. 18, 2018: The Senate Leadership Fund and Defend Arizona contacted us after publication to point out that CNN published a story on Sept. 15 saying that a group led by Sinema in the early 2000s distributed anti-war flyers, including one that depicted a soldier as a skeleton. Text in that flyer said, ""You can help us push back U.S. terror in Iraq and the Middle East."" The Senate Leadership Fund said this was evidence showing the accuracy of McSally’s claim. Sinema’s campaign told CNN, however, that Sinema did not approve or design the flyers. The flyers were not used in McSally's ad claiming that Sinema denigrated troops. McSally's campaign did not send PolitiFact the flyers — or any other material — as evidence for the claim. McSally's ad focused on Sinema wearing a tutu. Contemporaneous reporting of the event in which Sinema wore a tutu did not say that Sinema denigrated troops. Given that the flyer is not evidence that Sinema denigrated troops herself, our rating remains the same.","[('Twitter, @MarthaMcSally tweet, Aug. 23, 2018', 'https://twitter.com/MarthaMcSally/status/1032713389640826880'), ('Email interview, Helen Hare, campaign spokeswoman for Kyrsten Sinema, Sept. 5-6, 2018', 'No link'), ('Arizonadailyindependent.com, Rogers Questions Sinema’s Foreign Policy Core, Oct. 7, 2014', 'https://arizonadailyindependent.com/2014/10/07/rogers-hits-sinema-hard-in-first-ad/'), ('The Hill, Candidate’s stance on Afghan, Iraq wars faces scrutiny in Dem primary, May 2, 2012', 'No link'), (""State Press, Crow has eye on war demonstrations, March 26, 2003; Phoenix participates in worldwide anti-war protests, An exhibition of protest, March 13, 2003; Feb. 17, 2003; Bush's Phoenix visit incites protest, Sept. 30, 2002; Bush visit attracts protesters, Sept. 27, 2002"", 'http://thehill.com/blogs/ballot-box/dem-primaries/224919-candidates-stance-on-afghan-iraq-wars-faces-scrutiny-in-dem-primary'), ('New York Times, Bush Declares Start of Iraq War; Missile Said to Be Aimed at Hussein, March 20, 2003', 'No link'), ('George W. Bush White House archives, President Bush Addresses the Nation, Operation Iraqi Freedom, March 19, 2003', 'https://asuwebdevilarchive.jmc.asu.edu/issues/2003/03/26/campusnews/399477'), ('Arizona Republic article, March 17, 2003', 'No link'), (""Nexis.com news searches, articles: Arizona peace groups organize protest plan in advance of war, March 20, 2003; Locals say today's protests reminiscent of Vietnam era, Jan. 19, 2003; 'Women In Black' gather weekly to protest war, abuse, Feb. 9, 2002"", 'https://www.nytimes.com/2003/03/20/international/worldspecial/bush-declares-start-of-iraq-war-missile-said-to.html'), ('The Hill, Candidate’s stance on Afghan, Iraq wars faces scrutiny in Dem primary, May 2, 2012', 'No link'), ('The Huffington Post,\xa0Kyrsten Sinema, Former Anti-War Organizer, Explains Her Vote Against The Iran Deal, Sept. 16, 2015', 'https://georgewbush-whitehouse.archives.gov/news/releases/2003/03/20030319-17.html'), ('Obama White House archives, Remarks by the President on the Iran Nuclear Deal, Aug. 5, 2015', 'No link'), ('PolitiFact,\xa0PolitiFact Sheet: 6 things to know about the Iran nuclear deal, Sept. 8, 2015', 'https://azcentral.newspapers.com/search/#lnd=1&query=%22This+is+to+respect+and+honor+those+who+would+be+killed.+We+want+those+lives+to+not+be+sacrificed.%22'), (""The Hill,\xa0House rejects Obama's Iran deal, Sept. 11, 2015"", 'No link')]",/factchecks/2018/sep/10/martha-mcsally/did-arizonas-kyrsten-sinema-protest-troops-pink-tu/
"['Taxes', 'Illinois', 'Bruce Rauner']","
Rauner falsely claims graduated income taxes always hurt the middle class
","A recurring theme of Republican Gov. Bruce Rauner’s re-election campaign is to paint Democratic challenger J.B. Pritzker as a big taxer. To that end, Rauner has seized on Pritzker’s advocacy for replacing Illinois’ current flat-rate income tax with a graduated system used by most states and the federal government that imposes higher rates on those with higher income. Pritzker, however, has been vague about what sort of rates he would like to set, and that has given Rauner a big opening to try to fill in the blanks. During a recent radio interview with the Bloomington-Normal based WJBC-AM, Rauner claimed Pritzker was being cagey because middle class voters were bound to get hammered by any switch. ""The truth is, every state that has put in a graduated income tax, the middle class always pays more,"" Rauner said, echoing what’s become a frequent talking point. ""That’s what Pritzker doesn’t want known, that’s the truth and we’ve got to get the truth out."" Last fall, we rated Mostly False a claim from Rauner that the graduated system Pritzker supports would necessarily result in a tax hike on Illinois’ middle class. Because Pritzker has so far refused to propose rates, no one can say for sure whether the plan he might ultimately unveil would be worse or better for middle-income taxpayers. But Rauner’s recent claim paints the issue with an even broader brush, flatly declaring it ""the truth"" that all 32 states that tax income at graduated rates penalize the middle class. That’s a tall order, so we decided to see if we could find ""the truth"" about Rauner’s ""truth."" In Illinois, the rich as well as the not-so-rich all pay the same 4.95 percent tax rate on their income. We asked Rauner spokesman Justin Giorgio to explain how middle-class taxpayers are worse off in all states with graduated taxes, and he sent us a list of 26 states in which a single filer making $59,000 would be taxed at a higher rate than the one currently in effect in Illinois. There are glaring problems with that response. Giorgio’s list omits six states with graduated taxes where such a taxpayer would pay less even though Rauner was adamant that his claim applied to all such states. Then there’s the question of that $59,000 benchmark, which is what the U.S. Census pegged as the median household income in the nation for 2016, the latest year for which such data is available. The household number is typically an aggregate of the incomes of two or more wage earners living under the same roof — not individuals. In 2016, the Census measured the median income for the category of people that most closely approximates single filers at slightly more than $35,700. Loading... Setting aside the Rauner camp’s sloppy metrics — not to mention the lack of any consensus definition for the middle class — we looked up the tax impact in each of those 32 graduated tax states when applied to that hypothetical single filer making the national median $35,700. Under that scenario, the number of states that would tax her income at lower rates than in Illinois grows from six to 11. In several of those graduated tax states, the rate advantage over Illinois would be substantial. In North Dakota, for instance, her income would be taxed at just over 1 percent. Comparing tax policies between the states is fraught with complications because no two do it alike. But the Rauner camp doesn’t just compare apples to oranges. More like apples to an entire fruit basket. Rates alone don’t necessarily tell us who pays more. Many graduated tax states do indeed impose rates for most income brackets above Illinois’ single rate. But that doesn’t always mean an individual’s tax burden will be higher there. At a different campaign event on the same day as his radio appearance, Rauner pointed to four graduated tax states with what he described as ""stunningly high"" rates: Minnesota, New Jersey, New York and Connecticut. What he failed to point out, however, is that several of those states also offer a generous menu of exemptions and deductions that significantly mitigate costs for middle- and low-income taxpayers. Individual taxpayers in Connecticut earning over $10,000, for instance, are faced with nominal tax rates higher than Illinois’ flat one. But a single filer in Connecticut also receives a personal exemption worth seven times more than that offered in Illinois. And in New York, rates higher than Illinois’ set in on every dollar earned by an individual above $11,700. But the standard deduction is worth four times the $2,175 personal exemption in Illinois, which does not have a standard deduction. It’s important to note that a multi-rate structure doesn’t necessarily guarantee a state’s income tax will be exceptionally progressive. Missouri, for example, has a ten-tiered rate structure but the highest rate kicks in after just $9,072 in income. That said, Missouri taxpayers also benefit from a standard deduction even more generous than that in New York. And because graduated systems impose tax rates in escalating steps on different portions of income, people in those states aren’t paying top rates on every dollar they earn. In Iowa, for instance, that means taxpayers still get to pay lower rates than they would in Illinois on their first $14,382 of income, regardless of how much they earn beyond that. Graduated rates, by their very nature, are designed so lower-income earners pay less on a greater share of their income. ""It doesn’t take a tax policy analyst to say that you could create an income tax with rates both below and above [4.95 percent] at different levels of income and that the majority of middle-income taxpayers would pay less as a result of that,"" said Richard Auxier, a research associate with the Tax Policy Center, a joint venture of the Urban Institute and Brookings Institution. ""To argue that going to a progressive income tax is bad for low- and middle-income families is kind of missing the point of why you would have a progressive rate structure in the first place,"" he added. Rauner said that in ""every state that has put in a graduated income tax, the middle class always pays more."" But 11 of the 32 states that tax income at graduated rates would tax an individual earning the national median at lower rates than Illinois. In some of those states, the rate would be significantly lower. What’s more, tax rates tell only part of the story. Many states, including some with much higher rates, also offer taxpayers generous exemptions and deductions, significantly reducing their actual tax burden. Rauner’s claim that graduated systems inevitably lead to higher taxes on the middle class is not even close to accurate. We rate it False.","[('""Governor Rauner recounts his record on jobs, budget battles in first term,"" WCIA, Aug. 19, 2018', 'https://www.wcia.com/capitol-connection/watch-governor-rauner-recounts-his-record-on-jobs-budget-battles-in-first-term/1381982140'), ('""Illinois governor’s race: Candidates push ag growth,"" AgriNews Publications, Aug. 31, 2018', 'No link'), ('""Rauner distorts Dems\' message on Illinois income tax,"" PolitiFact Illinois, Dec. 14, 2017', 'http://www.agrinews-pubs.com/news/illinois-governor-s-race-candidates-push-ag-growth/article_0acd36c5-bfcc-54af-85fb-1b4c3dd94e94.html'), ('Report: State Individual Income Tax Rates and Brackets for 2018, Tax Foundation, March 5, 2018', 'No link'), ('Report: Kentucky Passes Tax Package, Tax Foundation, April 16, 2018', 'https://www.politifact.com/illinois/statements/2017/dec/14/bruce-rauner/rauner-distorts-dems-message-illinois-income-tax/'), ('Email interview: Justin Giorgio, Rauner campaign spokesman, Sept. 4, 2018', 'No link'), ('Glossary definitions, U.S. Census, accessed Sept. 6, 2018', 'https://taxfoundation.org/state-individual-income-tax-rates-brackets-2018/'), ('Data: Income and Poverty, U.S. Census, Sept. 2017', 'No link'), ('Phone interview: Richard Auxier, research associate at the Urban-Brookings Tax Policy Center, Sept. 4, 2018', 'https://taxfoundation.org/kentucky-tax-reform-package/'), ('Email interview: Verenda Smith, deputy director of the Federation of Tax Administrators, Sept. 4, 2018', 'No link'), ('Email interview: Ron Alt, research economist with the Federation of Tax Administrators, Sept. 4, 2018', 'https://www.census.gov/glossary/#term_Householdincome')]",/factchecks/2018/sep/09/bruce-rauner/rauner-falsely-claims-graduated-income-taxes-alway/
