tags,sub_header,text_body,quote_href
"['National', 'Federal Budget', 'Jobs', 'Social Security', 'Mike Huckabee']","
Mike Huckabee says Social Security imperiled by dramatic decline in wage-earners
","During the Aug. 6 Republican debate, Mike Huckabee and Chris Christie engaged in one of the calmer exchanges of the evening, discussing how best to reform Social Security and Medicare. Christie laid out his position first: raising the retirement age and cutting benefits for those who maintained a steady stream of high income into their old age. Huckabee countered with his own vision of a ""fair tax"" on consumption, which, he memorably claimed, would apply to everyone, ""including illegals, prostitutes, pimps, drug dealers, all the people that are freeloading off the system now."" As part of his follow-up, Huckabee said, ""One of the reasons that Social Security is in so much trouble is that the only funding stream comes from people who get a wage. The people who get wages is declining dramatically. Most of the income in this country is made by people at the top who get dividends and capital gains."" We decided to check whether the funding stream for Social Security is in danger because the number of people receiving wages is declining dramatically. Sources of funding for Social Security While payroll taxes comprise the bulk of the program’s income -- making up about $750 billion in revenue in 2014 -- Huckabee ignores two other sources of revenue that provided support for Social Security. One is that wealthier beneficiaries pay taxes on their Social Security income. For 2014, the revenue collected this way came out to $29.7 billion. Another method of funding for Social Security comes from interest earnings on investments on the $2.8 trillion worth of reserves in Social Security. This amounted to $98.2 billion in 2014. More significantly, has there been a ""dramatic"" decline in wage-earners? It’s unclear exactly what kind of timeline Huckabee was using when he referred to the ""dramatically declining"" number of people getting wages, and Huckabee’s campaign did not respond to us. But going by the raw numbers, at least, there’s been no decline in the ranks of wage-earners at all. The total civilian labor force has been steadily increasing since 1948, the first year the Bureau of Labor Statistics started counting it, with a brief stagnation at the height of the recent recession. The labor force participation rate — which measures people who are working age and either employed or looking for a job — has fallen since the Great Recession, partly due to economic trends but also due to the aging of the Baby Boom generation. More useful for the purposes of Huckabee’s claim is a look at the total number of people paying into Social Security. In 2013, the number of wage and salary contributors to Social Security (a different category from those who are self-employed, though their earnings are also taxed for Social Security) was virtually the same as in 2007, and one expert predicted that it had probably continued to go up in 2014 and 2015. So the total number of people in the labor force and paying into Social Security is about the same as it was before the recession, not a dramatic decline. However, Jagadeesh Gokhale of Wharton School’s Public Policy Initiative said Huckabee would have been more accurate if he had phrased his claim more carefully. The number of wage-earners is indeed decreasing in relation to the number of Social Security beneficiaries. This is happening due to the increase of Baby Boomer recipients. When a Boomer retires, it’s a double whammy -- the retirement shrinks the number of wage earners while increasing the number of beneficiaries. So Huckabee has reason to be concerned about the number of wage-earners supporting Social Security. It’s just that he didn’t correctly describe the problem. What’s the impact of earnings from capital gains and dividends? Huckabee also suggests another reason why insufficient money is being funneled into Social Security: that the richest people are accumulating a significant portion of their wealth from capital gains and dividends, profits that aren’t taxed for the benefit of Social Security. We wanted to see how well this theory held up. One study that we found on this issue came from the Tax Policy Center, an independent think tank that analyzes tax policy. The center looked at the composition of income reported on tax returns in 2012 and found that the highest-income earners make up a disproportionate share of non-wage earnings, said Roberton Williams, who co-authored the study. The study found that for those with an adjusted gross income above $5 million, capital gains made up nearly half their income, with dividends and interest accounting for another 14 percent. According to a calculation we did with the same data set — 2012 income statistics from the IRS — capital gains and dividends make up an even larger percentage of income for those earning more than $10 million. For those, capital gains, interest and dividends make up 62.7 percent of their adjusted gross income, while salaries and wages only account for 16.1 percent. (Business income and retirement funds round out the rest.) So there’s something to what Huckabee says on this point. But it’s important to keep it in context. There were only about 17,000 Americans making more than $10 million in 2012; combined, their adjusted gross income totaled about $546 billion, or just 6 percent of the country’s total pool of income. You have to adjust the cut-off point all the way down to $100,000 before you can include half of the income in the United States for 2012. Cumulatively, that group earned 56.5 percent of the nation’s income. And the further you extend the pay scale downward, the smaller the role capital gains and dividends play. For those earning $100,000 and up, non-wage income only accounts for 17 percent. Salaries and wages make up 59 percent. It’s also important to remember that wage and salary earnings are only taxed by Social Security up to $118,500. Our ruling Huckabee said that ""one of the reasons that Social Security is in so much trouble is that the only funding stream comes from people who get a wage. The people who get wages is declining dramatically."" Several aspects of this claim are problematic, starting with the inaccuracy that only wages support Social Security. In addition, Baby Boomer retirements are shifting the ratio of recipients to workers in the wrong direction, but it’s not as simple as there being a dramatic decline in the number of people who get their income from wages. In fact, Huckabee overstates the impact of non-wage income on Social Security’s fiscal health; the shift from wage income to non-wage income is happening among the richest Americans, but this group still accounts for a fraction of all income earned in the country. On balance, we rate the claim Mostly False.",/factchecks/2015/aug/12/mike-huckabee/mike-huckabee-says-social-security-imperiled-drama/
"['National', 'Financial Regulation', 'Marco Rubio']","
Marco Rubio slams Dodd-Frank, gets his numbers wrong
","Sen. Marco Rubio, R-Fla., says a law that attempts to stop banks from becoming too big to fail actually ends up making community banks too small to succeed. During the first Republican presidential debate, Rubio called for less regulation, lower taxes, and rolling back the Dodd-Frank Wall Street Reform and Consumer Protection Act, passed in the wake of the financial crisis in 2010. ""We need to repeal Dodd-Frank. It is eviscerating small businesses and small banks,"" he said on Aug. 6, 2015, to applause. ""Over 40 percent of small and mid-size banks that loan money to small businesses have been wiped out since Dodd-Frank has passed."" Rubio’s comment is a new version of an old Republican talking point, so we wanted to take a look. A spokesperson for Rubio referred us to a March 2015 brief by the Federal Reserve Bank of Richmond that noted a 41 percent decline in small banks between 2007 and 2013. But that’s a smaller category -- not small and mid-size, as Rubio said -- and it starts counting before Dodd-Frank became law. If we focus on the time frame he gives, 2010 to now, Rubio’s figure is overstated. Since 2010, the decline in their numbers is less than half of what Rubio said -- estimates range from 12 percent to 16 percent. Still, regulators say that’s not the full picture, and experts contend that a host of factors other than Dodd-Frank are at play. A 30-year trend First, let’s note that Dodd-Frank was billed as a safeguard against another financial crisis -- ""the most far reaching Wall Street reform in history,"" touts the White House -- and its regulations largely target big banks. So how did mom-and-pop bankers get hit in the crossfire?   To understand the shift, we have to look decades before Rubio’s time frame. The number of banks actually began to dwindle in 1980s, as seen in a chart from the Federal Bank of St. Louis:  The heart of the matter is why the numbers are going down. According to a 2012 Federal Deposit Insurance Corp. report, the majority of the loss comes from consolidation, not closures. In other words, banks were not so much collapsing for good as folding into other banks. This was possible thanks to a slew of laws passed in the 1980s and 1990s that chipped away barriers in banking across communities and state borders (the U.S. Government Accountability Office points to, for example, the Riegle-Neal Act of 1994 and the Credit Union Membership Access Act of 1998). So big banks grew bigger, but that doesn’t mean all small banks disappeared. Community banks of different sizes have been subject to different trends.   From 1985 to 2013, the number of the smallest institutions has declined dramatically (85 percent to be exact). But mid-size and large community banks have remained relatively stable since 2010 (and have increased, albeit incrementally, since 1985). Here are two FDIC charts from a 2014 report to that point:  Two-thirds of failed or voluntarily closed community banks are actually acquired by other community banks, according to the FDIC. The result: fewer, but larger community banks. Their goal: to achieve ""economies of scale"" (cost advantages gained when spreading out expenses over more revenue), says the U.S. Government Accountability Office. So community banks have an incentive to grow bigger, because they then get more bang for their buck, explains Joe Rizzi, a banking consultant and American Banker columnist. Dodd-Frank’s impact As for how Dodd-Frank plays into all of this, there’s really no consensus. According to a February 2015 report by the Harvard Kennedy School, ""Dodd-Frank exacerbated the pre-existing trend of banking consolidation by piling up regulatory costs"" on community banks. ""It gets so expensive. The people who can really afford the experts and the simple costs are the larger banks,"" report co-author Marshall Lux told PolitiFact. ""The larger banks are ironically protected from other people entering the market."" Rizzi emphasized that the decline in the number of community banks came well before 2010. He attributes the change, instead, to the 30-year consolidation trend as well as the FDIC changing its policies on new banks in 2009. Moreover, he contends that fewer small community banks isn’t necessarily a bad thing. ""It’s a healthy development. It is better to have fewer sub-scale weak institutions and more stronger banks,"" he said. Lux and his co-author Robert Greene, however, envision a domino’s effect that mostly hits rural and densely populated communities. ""There’s a difference between market-driven consolidation and regulatory-driven consolidation. That leaves gaps. It’s not like a competitor is filling the void,"" Greene said. ""The community banks consolidate into mini-regionals and God knows, you’re then worried about the big banks swallowing those up,"" added Lux. Back to Rubio Despite their disagreement on Dodd-Frank’s culpability, no one backed Rubio’s claim or his call to repeal the law. Lux, whose report was also cited by Rubio’s campaign, told the Washington Post’s Fact Checker that the senator is ""simply wrong."" Rizzi put it more harshly: ""Trying to blame Dodd-Frank for the ‘decline’  -- I call it change -- in number of community banks is fantasy. Trying to maintain the number and size of community banks is nostalgia. George Bailey (It's a Wonderful Life) is dead -- let him rest in peace."" Lux, for his part, advocated for reform rather than a complete overhaul of Dodd-Frank. After all, the law’s primary goal is to tackle ""too big to fail."" Our ruling Rubio said, ""Over 40 percent of small and mid-size banks that loan money to small businesses have been wiped out since Dodd-Frank has passed."" Rubio’s figure is overstated for the time frame he gives. The highest estimate we found shows a 16 percent decline in the past five years -- less than half of what he said. The trend Rubio describes began decades before Dodd-Frank became law in 2010. Even then, experts say a host of factors other than Dodd-Frank are at play.   We rate his claim Mostly False.",/factchecks/2015/aug/12/marco-rubio/marco-rubio-slams-dodd-frank-gets-his-numbers-wron/
"['Education', 'Florida', 'American Bridge 21st Century']","
PAC accuses Rubio of favoring for-profit colleges in education plan
","A liberal political action committee is attacking Sen. Marco Rubio’s proposed overhaul of the nation’s colleges and universities, saying his plan unfairly benefits for-profit schools. After Rubio went on Fox & Friends on Aug. 10, 2015, to lambaste Hillary Clinton’s call to make post-secondary education more affordable, American Bridge 21st Century went after Rubio’s own plan. ""Perhaps in his eagerness to criticize, Marco neglected to mention his long-time advocacy for and support of for-profit colleges,"" the PAC wrote on its website. ""And Marco neglected to mention that his own proposed college affordability overhaul would specifically benefit for-profit colleges — institutions with a reputation for willfully misleading students, targeting veterans, in particular."" Rubio has spent a lot of campaign time talking about getting a proper education, but we haven’t learned many details of his strategy. Will for-profit colleges ""specifically benefit"" from his ideas to make education more affordable? We decided to take a crash course on his plan and find out. Rubio’s plan not specific  Rubio took aim at current education practices in a July 7 speech in Chicago. Among his goals would be to change how schools are accredited, saying the current system favored traditional colleges. ""Our higher education system today is controlled by what amounts to a cartel of existing colleges and universities, which use their power over the accreditation process to block innovative, low-cost competitors from entering the marketplace,"" Rubio said in his speech. ""Within my first 100 days, I will bust this cartel by establishing a new accreditation process that welcomes low-cost, innovative providers."" Accreditation is a system designed to evaluate whether a school or institution meets quality guidelines, and is generally performed by one of several regional boards. These boards are private groups that must be approved by the federal government, and are comprised of members from already qualified schools. It’s important to keep in mind that a school must be accredited in order to qualify for federal financial aid like student loans and Pell grants. Sources told us that makes accreditation very attractive to for-profit schools, which are owned by private companies looking to make money. Experts we interviewed did agree that unless you’re a traditional college, getting accredited can be difficult and lock out schools that could teach skills for less than a degree-granting university. Massive open online courses, boot camps and for-profit colleges often aren’t accredited. It’s not clear what the ""innovative providers"" Rubio mentioned in his speech truly are. Other than broad talking points, Rubio has yet to provide specifics about what he means, and his spokesman did not clarify what schools or programs would benefit from changes in the accreditation process. But that means American Bridge can’t say with certainty, either. ""Admittedly, we are slightly reading between the lines because Rubio did not utter the words ‘for-profit’ and he has yet to release a white-paper on this specific proposal,"" American Bridge spokesman Ben Ray told PolitiFact. But ""code words"" in Rubio’s speech like catering to ""market forces"" and ""competition"" show that he means for-profit colleges, Ray added. Media outlets and critics like American Bridge have pointed out that Rubio has a history of advocating for the privately run schools. American Bridge argues that for-profit schools have a history of overpromising results to recruit students, especially in Florida. In 2014 Rubio defended Corinthian Colleges, a for-profit company that late declared bankruptcy and closed more than 100 campuses after a federal investigation into its lending practices to students. The U.S. Department of Education fined the company $29.7 million for misleading students at Florida locations by lying about job placement rates.    Rubio had asked the agency to continue providing federal aid to Corinthian while the company was being investigated. The company donated more than $27,000 to Rubio over the last five years. Kevin Carey, education policy program director of the New America Foundation public policy institute, agreed that the schools usually have to conform ""to join the club"" and get accredited. But American Bridge is reaching to say Rubio’s plan aims to benefit those private companies when he mentions ""innovative providers."" ""I think it could mean many things, probably including online or technology-enabled education, but not exclusively for-profit colleges,"" Carey said. He noted that Corinthian Colleges already was an accredited institution, so while Rubio may have supported the company, the example doesn’t necessarily apply to a potentially revamped accreditation process the way American Bridge suggests. Our ruling American Bridge 21st Century said Rubio’s ""proposed college affordability overhaul would specifically benefit for-profit colleges."" Rubio has suggested revamping the accreditation process to allow ""innovative providers"" to become accredited. Exactly which schools or programs he means and why they need to be accredited is up for debate, because Rubio hasn’t given any details. That makes it extremely difficult for American Bridge to say the change is specifically to help for-profit colleges, despite Rubio's past affinity for the businesses. Many for-profit schools already are accredited, although experts say others may potentially benefit from Rubio’s plan. Rubio's plan is not specific in benefiting for-profit colleges, so we rate American Bridge’s statement Mostly False.",/factchecks/2015/aug/12/american-bridge-21st-century/pac-accuses-rubio-favoring-profit-colleges-educati/
