tags,sub_header,text_body,sources,quote_href
"['State Budget', 'Illinois', 'Nancy Pelosi']","
Pelosi exaggerates former Republican governor’s role in Illinois’ fiscal distress
","President Donald Trump frequently cites Illinois’ fiscal mismanagement as a reason for potentially withholding federal assistance amid the national crisis caused by the outbreak of COVID-19. In a May 4 interview with CNN, House Speaker Nancy Pelosi shot back with her own assessment of Illinois’ financial straits. ""Look at him saying these states want to be bailed out,"" Pelosi told host Wolf Blitzer. ""The state that he used as an example was Illinois, which got into fiscal problems because of a Republican governor who was governor there until Gov. Pritzker has come to pull it out."" The National Governors Association sent a bipartisan letter to Congress in April that made clear the financial pressure caused by COVID-19 is being felt by states nationwide, not just in blue states as Trump has said. But what about Pelosi’s assessment of how Illinois got itself into a financial bind? Her comment suggests Illinois’ hardships are a matter of recent history, dating back just a few years to the time of Democratic Gov. J.B. Pritzker’s Republican predecessor. State finance experts say that’s misleading. Understanding what Pelosi was referencing requires a brief detour into recent state history. In November 2014, Illinoisans elected Republican Bruce Rauner as governor. Rauner, a private equity investor and political newcomer, reached an impasse with Democrats who control the legislature over how to run the state. This left Illinois without a spending plan for two years. With government spending left operating largely on autopilot, social services suffered, public universities laid off thousands of employees and the state’s pile of unpaid bills tripled, causing credit rating agencies to reduce Illinois’ rating to near-junk status. As the state’s chief executive, Rauner played a starring role in the showdown that caused the budget crisis. But he had plenty of co-stars among the state’s leading Democrats, including longtime House Speaker Michael Madigan, who has exerted influence over every state budget for the past four decades. Democratic leadership also allowed a temporary state income tax increase to expire days before Rauner was sworn into office in 2015, leaving the state with even less cash to make ends meet during the crisis. Rauner had urged the legislature to let it lapse before taking office, and Madigan along with then Senate President John Cullerton obliged despite warnings from then Democratic Gov. Pat Quinn, who lost to Rauner in 2014. Foisting all the blame for the state’s unprecedented budget crisis on Rauner isn’t the only problem with Pelosi’s narrative. That’s because the tale of how Illinois dug itself into a fiscal hole dates back much further than his single term in office. When we raised this with Pelosi’s office, a spokesman responded with an email saying she was ""clearly referencing the fact that Illinois’ situation greatly worsened"" under Rauner — not that he alone was responsible for the state’s fiscal woes. But experts interpreted her statement differently. ""To claim that this is a problem created by Gov. Rauner is clearly misleading,"" said David Merriman, an economist who heads the Fiscal Futures Project at the University of Illinois’ Institute of Government & Public Affairs. ""It's a problem that's developed over decades."" Illinois governors and lawmakers from both parties have long managed to increase government spending without raising the revenue needed to support it. ""For many, many years we’ve provided more goods and services … than our revenues would support,"" said Charles N. Wheeler III, who has studied decades of state budgets as both a journalist and professor at the University of Illinois Springfield. ""It’s always easier for lawmakers to fund programs than it is to raise the revenues to cover it."" Indeed, the alarm bells began sounding long before Rauner took office. A 2011 report from the state comptroller’s office warned of a looming financial crisis created by many years of rampant spending. The report cautioned that the recession at the time had exacerbated the state’s ongoing failures to reduce its debt, build up its emergency reserves, or contribute enough to state employee pension funds. And when it comes to pensions, Illinois’ problems date back even further. In 1917, a report commissioned by the General Assembly was already warning the funds were ""moving toward crisis"" due to inadequate payments from the state. ""We’ve been shortchanging the pensions for more than a hundred years,"" Wheeler said. Pelosi said Illinois ""got into fiscal problems because of a Republican governor who was governor there"" before Pritzker. Illinois’ financial situation did worsen during Rauner's term while the state operated without a spending plan for an unprecedented two years, but he wasn’t solely to blame. What’s more, the state was already teetering on the brink when he took office because of decisions made by leaders from both parties dating back decades. We rate Pelosi’s claim Mostly False. MOSTLY FALSE – The statement contains an element of truth but ignores critical facts that would give a different impression. Click here for more on the six PolitiFact ratings and how we select facts to check.",[<zip object at 0x0000028097423540>],/factchecks/2020/may/08/nancy-pelosi/pelosi-exaggerates-former-republican-governors-rol/
"['Animals', 'Public Health', 'Facebook Fact-checks', 'Coronavirus', 'South West News Service']","
Evidence lacking that cats eaten as COVID-19 cure
","Cats and dogs have long been a controversial part of the cuisine for some in Vietnam. But a new claim circulating online says that people there are eating black cats as a treatment for COVID-19. Tabloid news sites including the Toronto Sun, the New York Post, the U.S. Sun and Vietnam Insider published stories saying black cats are being ""collected, killed and their bodies ground up as a supposed coronavirus treatment."" Each of the stories in some way attributed its information to the South West News Service, which describes itself as a ""UK- and US-based news and media content agency with a proud 40-year history."" These stories and other posts with the same claim were flagged as part of Facebook’s efforts to combat false news and misinformation on its News Feed. (Read more about our partnership with Facebook.) With fewer than 300 reported cases and zero deaths, Vietnam has been highlighted for its response to COVID-19, which included strict quarantining and intensive testing. Much of the country has reopened, with children returning to school May 4. While Vietnam has grappled with real issues related to animal welfare, experts we spoke to say they haven’t found widespread evidence that black cats are being killed and turned into a paste to treat COVID-19. The news service that generated the story said it has removed the article from circulation amid concerns about its credibility. Here’s what we know. On April 17, The Sun, a tabloid in the United Kingdom and Ireland, published a story that reported on an investigation by an animal rights group called Four Paws. According to the story, the group said it examined dining app data and found that dog and cat meat sales were surging through dining app delivery services in Cambodia and Vietnam. The story surmised that ""doctors in the region are encouraging many to eat dog and cat meat, claiming its properties help fight off viruses."" A week later, on April 23 and 24, stories credited to the South West News Service were published elsewhere that had a similar storyline, but took the claim further to suggest black cats are being singled out, turned into paste and consumed as medicine.  Pictures credited to South West News Service accompanied some versions of the online stories. But the captions were vague and the images hard to verify. They included, for example, a photo of a baby drinking from a bottle that appears to contain a black substance. ""This distressing image shows a baby reportedly being fed the black cat concoction,"" the caption said. The stories’ only source appeared to be the head of another charity, No to Dog Meat, based in London. We reached out to that group for evidence. They sent us to their YouTube account which includes four videos uploaded in April and May that claim in captions or titles to show cat mistreatment in Vietnam but which included no verifiable information about exactly where or when they were taken. Asked about the black cat claim, Cat Besch, founder and director of Hanoi-based Vietnam Animal Aid & Rescue, told PolitiFact she has seen ""zero evidence in Vietnam so far that this is true."" Nam Nguyen, an editor in Vietnam with the government-run Vietnam News Agency, told PolitiFact ""the rumor has been around these weeks and originated from one post in Thailand social media, but as far as I know, Vietnamese are not so superstitious like other nations in southeast Asia to practice those ancient rites."" He said the post has been deleted. Phuong Tham, director of Human Society International in Vietnam, told PolitiFact that black cats are being killed there ""by people with lack of knowledge, believing that black cats' bones can treat asthma in children, while others kill them for superstitious beliefs,"" but ""we have seen no evidence that black cats in Vietnam are being killed for COVID-19 treatment."" Tham and Dr. Todd Pollack, Harvard University medical professor and country director in Hanoi of the Partnership for Health Advancement in Vietnam, said it is significant that they had not seen the claim reported by news organizations in Vietnam. VN Express, a newspaper in Vietnam, reported that on May 6, police in Nghe An province seized 630 kilograms of dog, cat carcasses and entrails of other animals from a passenger bus. The driver said the meat was being taken to Hanoi for consumption, according to the report. But the report contains no suggestion the meat was being used for treatment of coronavirus. When we reached out to South West News Service about the source of the information, the agency told PolitiFact that ""shortly after publication, we identified a number of issues with this story and pulled it from our service. We received new information which led us to doubt the widespread nature of the claims the charity had made on this issue."" We rate this claim False.",[<zip object at 0x0000028097AC8640>],/factchecks/2020/may/08/south-west-news-service/Evidence-lacking-that-cats-eaten-as-COVID-19-cure/
"['Facebook Fact-checks', 'Coronavirus', 'Facebook posts']","
Worries for restaurant owners are real, but post saying Georgia Gov. mandated reopening goes too far
","Georgia Gov. Brian Kemp’s decision to reopen many businesses sparked a social media dress-down from a restaurant owner in the Atlanta area. John Gianoulidis, owner of the Kafenio Greek Diner, said Kemp’s order will hurt small businesses. ""Kemp mandates restaurants reopen, whether I reopen dining rooms or not. I file for business interruption insurance, it does not go through since I am ‘allowed’ to operate full capacity,"" he wrote in an April 20 Facebook post that has been reshared thousands of times and drew national media attention. The owner then described a series of problems he faces, including that he still has the pressures to pay rent and unemployment insurance. ""Guys, this is about screwing the working class and small business, not about helping us,"" he wrote. A Facebook post that repeated the restaurant owner’s post without identifying him was flagged as part of Facebook’s efforts to combat false news and misinformation on its News Feed. (Read more about our partnership with Facebook.)  Exactly what happens for any business owner’s unemployment insurance and rent is difficult to fact-check, because those are based on private contractual arrangements. The full impact on restaurants won’t be known for months, if not longer. But we can fact-check if Kemp mandated restaurants to reopen. ""I’ve had people take me to task for the usage of the word mandate,"" Gianoulidis told PolitiFact in an email. Kemp’s order said that restaurants ""are hereby permitted to resume providing dine-in services"" as of April 27. The order includes 39 restrictions, including that restaurant workers must wear face masks, limit the number of patrons, and discontinue salad bars and buffets.  In other words, restaurants are allowed to reopen, as long as they follow the rules, but they are not required to. Restaurants still have a choice.  Still, the hardships faced by restaurant owners like Gianouidis are real. Georgia processed about 1.4 million unemployment claims from March 16 to April 25. Roughly 30% were from the food and hospitality sector, state labor data show. Industry data show that as of May 6 around 31% of restaurants have reopened their dining rooms, said Karen Bremer, CEO of the Georgia Restaurant Association.  Whether it’s feasible for a restaurant to reopen under the 39 conditions depends on the size of the restaurant since seating is limited. The profit margin for a restaurant is between 4 and 6 percent, which means ""if your sales are off by 50%, you are paying to be open to take care of customers and employ people. You are burning cash to do it,"" Bremer said. Restaurants face a series of challenges to reopen. Former restaurant workers collecting unemployment may not want to come back. It’s harder to buy meat amid shortages. It takes time to empty kitchens of expired food.  Following Kemp’s decision, more than 120 Atlanta restaurants announced they would not reopen their dining rooms due to health and safety concerns, though many are offering takeout. Gianoulidis said Kafenio Avondale is open only for takeout/delivery while his College Park location has remained closed.  Gianoulidis told PolitiFact that the cost and hassle of reopening the dining room following all of the protocols ""is not worth the risk or cost."" ""At least 80% of my customers now are not wearing masks and acting like it is all over,"" he told PolitiFact. ""It seems like since people are tired of being careful, most just gave up and are making believe there is nothing wrong."" Gianoulidis said that his claim under business interruption insurance was denied. Multiple lawsuits have been filed by restaurants and other businesses or nonprofits against insurers that say claims for business interruption insurance policies were wrongly denied. The insurance industry argues that policies were not designed to provide coverage against diseases such as COVID-19. ""Pandemics are not generally covered by business interruption,"" said Lauren Anderson, spokeswoman for the National Association of Mutual Insurance Companies. ""Most standard policies list pandemics as an exclusion."" Bremer, with the Georgia Restaurant Association, said that the majority of restaurant owners she has spoken to have had their claims denied for business interruption insurance. She said after previous viruses in past years, more policies added virus exclusions. She has told owners to file claims anyway. But even claims under policies without exclusions for viruses are being denied, said lawyer John Houghtaling. In addition to his Georgia clients, Houghtaling is the lawyer for the Business Interruption Group, which was formed by some of the nation’s top chefs to help businesses that have been denied insurance claims.  The insurance ""industry is taking a completely universal approach regardless of what the policy says,"" he told PolitiFact.  Gianoulidis wrote in a Facebook post that Georgia Gov. Brian Kemp ""mandates restaurants reopen."" Kemp’s order didn’t force restaurants to reopen, but it allowed them to reopen as long as they follow 39 conditions. Many have determined that they will not open their dining rooms, due to health, safety or financial reasons. The challenges and pain faced by restaurant owners is real, but the specific claim about Kemp’s order mandating restaurants to reopen is wrong. We rate this statement False.",[<zip object at 0x0000028097AC8400>],/factchecks/2020/may/08/facebook-posts/worries-restaurant-owners-are-real-post-saying-geo/
"['New York', 'Coronavirus', 'Facebook posts']","
Central Park field hospital treated coronavirus patients, not abused children
","As the early epicenter of the U.S. coronavirus outbreak, New York City scrambled to expand its hospital capacity.  The Navy hospital ship traveled to New York to relieve the pressure on hospitals; the Jacob K. Javits Convention Center was converted into a 4,000-bed medical center; and a field hospital was set up in Central Park. The Central Park tent hospital, operated by Samaritan’s Purse, an evangelical Christian group run by the son of late televangelist Billy Graham, has since become the focus of online conspiracy theories. ""Thousands of babies and children are being brought up out of underground tunnels in New York's Central Park by military personal (sic), during the night and placed in tents brought in by Franklin Graham's Samaritan's Purse,"" one Facebook post says, in all capital letters. The children, it adds, have been captive underground since birth, subjected to torture and ""kept as sex slaves."" There is absolutely no evidence of this. A 68-bed field hospital was set up in Central Park in April to help overwhelmed hospitals treat patients with COVID-19. The hospital was made up of 14 tents used primarily for diagnosis, treatment and storage. When it first began operating, it had 10 ventilators and treated patients from Mount Sinai Health System hospitals in New York’s Queens and Brooklyn boroughs.  Beginning April 1, an organization known as Samaritan’s Purse, working with Mount Sinai, treated nearly 200 coronavirus patients in the Central Park field hospital. The facility operated until May 5, and ""all patients under Samaritan’s Purse care"" have since been discharged, according to its website. Samaritan’s Purse said there is no truth to the claims about abused children being treated there.  ""These are totally false rumors,"" Kaitlyn Lahm, a Samaritan’s Purse spokesperson, said in a statement to PolitiFact.  ""We worked hand-in-hand with Mount Sinai Hospital to bring desperately needed surge capacity,"" she said. ""All patients treated at the Emergency Field Hospital were transferred from Mount Sinai to Samaritan’s Purse."" News outlets including VICE and the Associated Press have investigated the origin of the claims and linked the conspiracies to the group QAnon and its followers.  QAnon ""centers on the baseless belief that (President Donald) Trump is waging a secret campaign against enemies in the ‘deep state’ and a child sex trafficking ring run by satanic pedophiles and cannibals,"" according to AP reports. A post claims, ""Thousands of babies and children are being brought up out of underground tunnels in New York's Central Park by military personal (sic), during the night and placed in tents brought in by Franklin Graham's Samaritan's Purse.""  The Central Park hospital treated coronavirus patients. There is no evidence to support the claim that it housed abused children released from captivity. It appears the claim originated with the QAnon conspiracy group. Samaritan’s Purse said the claims are false. We rate this claim Pants on Fire.",[<zip object at 0x00000280970644C0>],/factchecks/2020/may/08/facebook-posts/central-park-field-hospital-treated-coronavirus-pa/
"['Facebook Fact-checks', 'Coronavirus', 'Viral image']","
There’s no new autopsy report linking Jeffrey Epstein’s death to COVID-19
","Ever since the death of Jeffrey Epstein, the disgraced financier accused of sexual abuse and sex trafficking, people who don’t believe he committed suicide in his jail cell have pushed theories that he was murdered.  A recent Facebook post floated a new cause of death, though.  ""Breaking news,"" it said above a photo of Epstein. ""New autopsy reports suggest Jeffrey Epstein most likely died from COVID-19 complications.""  Some people commenting on the post expressed shock.  ""This can’t be real,"" one commenter wrote. ""They can’t really be tryna say that. Are they really… I mean really?""  After someone else suggested that the coronavirus has been in the United States for longer than has been reported, the commenter said: ""Wow. At least we’re still right! He didn’t kill himself.""  This post was flagged as part of Facebook’s efforts to combat false news and misinformation on its News Feed. (Read more about our partnership with Facebook.)  The official ruling on Epstein’s death has been challenged before. In August 2019, the New York City medical examiner’s office concluded that Epstein hanged himself in his jail cell, the New York Times reported.  In October, a forensic pathologist hired by Epstein’s brother claimed that the evidence suggested Epstein didn’t commit suicide and may have been strangled. The findings were disputed by the city’s chief medical examiner, who stood by her office’s report. On Jan. 5, 2020, ""60 Minutes"" reported on photographs from inside Epstein’s cell that ""possibly raise more questions"" about his death.  But we found nothing credible tying Epstein’s death to the coronavirus.  We rate this Facebook post False.",[<zip object at 0x000002809C3A3FC0>],/factchecks/2020/may/08/viral-image/theres-no-new-autopsy-report-linking-jeffrey-epste/
"['Fake news', 'Facebook Fact-checks', 'Coronavirus', 'Bloggers']","
Mike Pence didn’t pretend to carry empty boxes of PPE. The clip is cut off
","A clip of Vice President Mike Pence helping deliver personal protective equipment to a Virginia nursing home started circulating on social media after late night host Jimmy Kimmel featured it in his show.  A 40-second clip of the ""Jimmy Kimmel Live!"" episode shared on Twitter shows Kimmel mocking Pence, saying he was caught on a hot mic apparently joking about carrying empty boxes. ""Here he is with no mask on, wheeling PPE’s into a health care center and doing his best to lift them. What a hero,"" Kimmel says, ""and since it was going so well, and also because he didn’t realize he had a mic on, Magic Mike decided to keep it going. Listen in closely here."" Kimmel cuts back to Pence. Audio picks up one of the workers telling the vice president that the rest of the boxes in the van are empty. Pence can be heard responding, ""Can I carry the empty ones? Just for the camera?""  The video ends, and Kimmel says, ""Mike Pence pretending to carry empty boxes of PPEs into a hospital is the perfect metaphor for who he is and what he's doing: A big box of nothing delivering another box of nothing."" Mike Pence caught on hot mic delivering empty boxes of PPE for a PR stunt. pic.twitter.com/IduvGhiPwj Before deleting it, the Occupy Democrats group re-shared the clip on Facebook with the headline: ""OMG: Mike Pence caught on hot mix ""delivering"" EMPTY boxes of PPE to hospital... and PRETENDING THEY ARE HEAVY!""  Other websites quickly followed suit. But the video is deceptively edited. The Kimmel clip cuts the video off at a selective point, just before Pence shuts the door to the van. Pence doesn’t touch or pretend to lift any empty boxes. The clip was flagged as part of Facebook’s efforts to combat false news and misinformation on its News Feed. (Read more about our partnership with Facebook.)  The video was taken on May 7, 2020, as Pence helped deliver equipment from the Federal Emergency Management Agency to the Woodbine Rehabilitation & Healthcare Center in Alexandria, Va. We found the full 29-minute video on CSPAN. Pence’s empty boxes quip comes around the 9-minute mark.   After unloading a few boxes, Pence walks back to the van and is told that the rest of the boxes in it are empty. He then asks if he can carry the empty ones for the cameras and smiles after people around him laugh.  One man helping unload the boxes says, ""Absolutely, they’re a lot easier,"" to more laughter before Pence shuts the van doors. Pence’s office did not immediately respond to a request for comment. Jon Thompson, Pence’s campaign communications manager, tweeted that the Kimmel clip is ""garbage"" and said Pence is ""clearly joking about empty boxes & if Kimmel showed the full clip from CSPAN, not the one he selectively edited, you see and hear it."" (Kimmel apologized via Twitter, sort of.) Posts used video from Jimmy Kimmel to claim Pence was caught on a hot mic delivering empty boxes of PPE to a nursing home and pretended they were heavy. That’s not what happened.  This claim is False.",[<zip object at 0x000002809689C0C0>],/factchecks/2020/may/08/blog-posting/mike-pence-didnt-pretend-carry-empty-boxes-ppe-cli/
