tags,sub_header,text_body,quote_href
"['Public Health', 'Facebook Fact-checks', 'Coronavirus', 'Instagram posts']","
No, the British royal family attending a Euro 2020 match doesn’t mean COVID-19 is fake
","The Duke and Duchess of Cambridge, along with their son Prince George, were among thousands of other revelers in Wembley Stadium who cheered on England’s victory over Germany during a Euro 2020 soccer match. It wasn’t long after before misinformation began to spread online about their appearance at the game, claiming it was proof COVID-19 was a hoax. ""This is the simplest way to explain this to the sheep,"" a July 6 Instagram post stated. ""If there were a real deadly pandemic, then two of the heirs to the British (throne) probably wouldn't be allowed to join 50,000 other football fans inside a stadium."" An image of the Cambridges at Wembley Stadium during the June 29 match is included with the text. The Instagram post is not accurate and leaves out several important details as to why and how the Cambridges were able to attend the match. The post was flagged as part of Facebook’s efforts to combat false news and misinformation on its News Feed. Instagram is owned by Facebook. (Read more about our partnership with Facebook.) The United Kingdom is in the midst of a surge of coronavirus infections, driven by the more transmissible delta variant, with one in every 160 people testing positive for the virus as of July 9, according to the BBC.  The infections have primarily been reported among the country's youth who have yet to receive a dose of a COVID-19 vaccine, the BBC reported. More than 128,000 people have died in the United Kingdom because of the virus, and more than 5 million have tested positive since the start of the pandemic. Although the country is experiencing a surge in cases, the British government has been planning to ease restrictions and reopen the country. As part of its reopening plan, the government started the Events Research Programme, which ""aims to examine the risk of transmission of COVID-19 from attendance at events and explore ways to enable people to attend a range of events safely."" The study involves looking at how using a combination of testing and non-pharmaceutical safety measures, like face masks, can be used to lift restrictions. One venue where the study is being conducted is Wembley Stadium.   The stadium required attendees to follow COVID-19 safety measures, according to the Union of European Football Associations. Guests had to wear face masks while entering the stadium and in all indoor areas, only being able to take them off when at their seats. A negative rapid COVID-19 test within 48 hours of a match starting or proof of full vaccination is also required for attendees based in England ages 11 and older. Wembley Stadium is also under strict capacity limits, with the Associated Press reporting 40,000 fans were allowed to attend the June 29 match — short of the 50,000 mentioned in the Instagram post. Both the Duke and Duchess of Cambridge posted on Twitter about getting their first dose of the COVID-19 vaccine in May. Kate has also been in self-isolation since July 2 after coming into contact with someone who tested positive for COVID-19, according to CNN. An Instagram post claims COVID-19 is a hoax and points to the Duke and Duchess of Cambridge attending a Euro 2020 match at Wembley Stadium as evidence, saying if the pandemic was real they wouldn’t have attended the game. The threat of COVID-19 in the U.K. remains very real. The United Kingdom is in the middle of a surge of the virus, with more one out of 160 people testing positive. More than 5 million people have tested positive for COVID-19 throughout the pandemic and more than 128,000 people have died as a result. Wembley Stadium has capacity limits for attending Euro 2020 matches and requires attendees to wear masks when entering the stadium and in any indoor areas outside of their seats. Guests are also required to show proof they’ve been fully vaccinated or have had a negative rapid COVID-19 test 48 hours prior to a match. Both the Duke and Duchess have also received their first doses of the COVID-19 vaccine in May. We rate this claim False.",/factchecks/2021/jul/09/instagram-posts/no-british-royal-family-attending-euro-2020-match-/
"['Sports', 'Facebook Fact-checks', 'Marijuana', 'Viral image']","
No, AOC didn’t tweet this about smoking marijuana and the Olympics
","U.S. Rep. Alexandria Ocasio-Cortez is a frequent target of doctored tweets that use the New York Democrat’s Twitter handle and image and attribute statements to her that she never actually said.  The latest example is a viral screenshot of what looks like a tweet from Ocasio-Cortez that alludes to Sha’Carri Richardson, the American sprinter suspended from the U.S. Olympic team after testing positive for marijuana, and weightlifter Laurel Hubbard, the first openly transgender competitor in the games.  ""So, just to get this straight, if you smoke pot you can be disqualified from the Olympics but if you are a biological man who takes a year of estrogen you can compete against the ladies in weightlifting,"" reads the text of the fake tweet. An Instagram post sharing the image was flagged as part of Facebook’s efforts to combat false news and misinformation on its News Feed. (Read more about our partnership with Facebook.) We searched Ocasio-Cortez’s Twitter accounts @AOC and @RepAOC for the words in the tweet that appeared on Instagram but found no results.  We also didn’t find it in Politwoops, a ProPublica database that includes deleted tweets from the representative.  On July 2, Ocasio-Cortez did tweet about trying to end Richardson’s suspension. But she didn’t tweet the statement that appears in the Instagram post. A spokesperson for Ocasio-Cortez told the Associated Press ""the post is false."" We rate it the same: False.",/factchecks/2021/jul/09/viral-image/no-aoc-didnt-tweet-about-smoking-marijuana-and-oly/
"['Islam', 'Facebook Fact-checks', 'Facebook posts']","
Hoax about mayor refusing pork demands spreads again online
","The mayor of Dorval, a suburb of Montreal in Canada, is getting kudos online for refusing Muslim parents who ""demanded removal of pork in all school canteens in Montreal and its suburbs."" ""Muslims must realize that they must integrate and learn to live in Quebec,"" reads an excerpt of a supposed note from the mayor in a Facebook post. ""They need to change their lifestyle, not Canadians who so generously welcomed them."" The post goes on to claim the mayor said that Muslims who ""don’t feel comfortable in Canada"" can live in one of the ""Muslim countries in the world, most of them poorly populated."" This note has been shared in social media posts and via email since at least January 2015. That year, the city of Dorval denounced it as a hoax.  This post was flagged as part of Facebook’s efforts to combat false news and misinformation on its News Feed. (Read more about our partnership with Facebook.) The mayor in the Facebook post is never named, but in 2015 the city wrote that he ""would like to set the record straight by saying that, on no account, he, nor any of the city’s representatives, have made such comments.""  Still, the falsehoods spread. In 2017, BuzzFeed News reported on ""this hoax about a Canadian mayor’s insulting response to Muslim parents"" that keeps coming back.  Similar fake claims have been shared about other mayors in other countries. In 2020, it was the mayor of a suburb in Perth, Australia, who allegedly refused the demands of Muslim parents to remove pork from school canteens. In 2014, it was the mayor of Ath, Belgium.  But this didn’t happen there, and it didn’t happen in Dorval.  We rate this post False.",/factchecks/2021/jul/09/facebook-posts/hoax-about-mayor-refusing-pork-demands-spreads-aga/
"['Georgia', 'Elections', 'Facebook Fact-checks', 'Just the News']","
No evidence of missing absentee ballots in Georgia’s 2020 election
","A three-week-old article widely shared on social media on July 8 falsely states that an audit of the 2020 presidential election in Georgia found that more than 100 batches of absentee ballots were missing. The article was flagged as part of Facebook’s efforts to combat false news and misinformation on its News Feed. (Read more about our partnership with Facebook.) The article, published by Just the News, referred to the audit in its headline. The subheadline says: ""Records suggest more than 100 batches of absentee ballots in Fulton County could be missing."" Just the News said that it reviewed documents and found that ""more than 100 batches of absentee ballots — each containing approximately 100 or more ballots — were assigned tracking numbers before being sent to one of the five absentee vote-counting machines in Fulton County but are not subsequently recorded in the handwritten logs showing which batches were scanned and counted, raising concerns the ballots may be missing."" It’s speculation lacking evidence. On the day the June 17 article was published, Georgia Public Broadcasting posted an article debunking it. GPB reported:  ""Just the News used selectively edited notes from a state-appointed monitor and a misunderstanding of elections and the risk-limiting audit process to claim that ballots ‘may be missing.’"" There were data entry errors, but no evidence of large batches of missing ballots, GPB reported.  A risk-limiting audit on a sampling of ballots typically is done to confirm that the declared outcome of an election is accurate. But because Joe Biden defeated Donald Trump in Georgia by some 12,000 votes, a full hand-recount was done.  During the risk-limiting audit, ""some counties discovered ballots that were not included in the original tally, but the results of the RLA did not change the results of the election,"" GPB reported.  Fulton County spokesperson Jessica Corbitt-Dominguez told PolitiFact that no absentee ballots from the county are missing. The absentee ballots were reviewed twice and ""all paperwork has been reconciled in coordination with the Secretary of State,"" she said.  The Secretary of State’s monitor notes referenced by Just the News ""are in response to activity in ‘real time’ during the election process. All documentation was filed in compliance with state law and Secretary of State guidelines,"" Corbitt-Dominguez said. The Secretary of State’s office declined to comment.  We rate the post False.",/factchecks/2021/jul/09/just-news/no-evidence-missing-absentee-ballots-georgias-2020/
"['Energy', 'Texas', 'Tucker Carlson']","
Tucker Carlson distorts Texas' smart thermostat energy conservation programs
","Summertime temperatures rose into the high 90s last month across Texas. It wasn’t an unusual heat for Texas in mid-June, but it did trigger the state’s grid operator to issue energy conservation alerts.  The alerts issued by the Electric Reliability Council of Texas asked residents to set their thermostats at 78 degrees in order to help maintain grid reliability. For some Texans, that adjustment was made automatically by their WiFi-enabled thermostats.  Weeks later, Fox News host Tucker Carlson aired a segment on his show focusing on those thermostats.   ""In Texas, the power companies have automatically raised the temperature of people's thermostats in the middle of a heatwave without their permission,"" he said. ""Woo. That's not creepy or anything.""  Carlson was referring to an energy conservation technique called demand response, in which electric utilities or third-party grid monitors will remotely adjust residents’ thermostats to reduce energy demand during periods of tight supply. It’s a practice that has been in Texas, and around the nation, for at least two decades. Initially, older thermostats were remotely controlled using a radio paging technology. Today, companies can tap into smart thermostats — like those manufactured by Google Nest, Ecobee or Honeywell — over the internet.   But are these adjustments being made without people’s permission, as Carlson claims?  There are several electric companies across Texas that offer demand response programs to customers. CPS Energy in San Antonio has had its program in place since 2003, and today the utility issues $85 reimbursements to customers who enroll in its WiFi Thermostat Rewards program.   ""During summer peak energy demand days, we may briefly adjust your thermostat settings by a few degrees,"" the program states. ""We’ll do this only as needed. Peak energy demand days are typically weekdays during the hot summer months. You can opt-out of participating in a peak demand event by manually adjusting your thermostat or through your thermostat’s app.""  Of the San Antonio utility’s 885,000 customers, about 150,000 are enrolled the program. During a period of tight energy supply, the company can adjust 150,000 thermostats to save 128 megawatts of power.  ""That's the size of some smaller power plants,"" said Justin Chamberlain, CPS Energy’s manager of energy efficiency and demand response. ""It can make a big difference on a peak day.""   The utility also does a fair amount of work to spread awareness ahead of when these periods are going to occur. They’ll send notifications to people's phones and thermostats, they’ll publish social media posts and make announcements on local news stations.   Austin Energy’s Power Partner program also offers rebates to customers who enroll under the condition that the utility can raise the temperature of their homes between 2 and 4 degrees for a three hour period during the summer months. Overriding automatic changes only requires a customer to adjust their thermostat back to their desired temperature.   The program has been in place since 2013. Of the utility’s 478,000 residential customers, about 33,000 households have enrolled.   ""Austin Energy does not and cannot remotely control devices that are not enrolled in the program,"" a utility spokesperson said.  But not all local utilities offer such programs. Customers who are hooked up to utilities that don’t can instead turn to programs offered by third-party providers of demand response management systems.   One popular provider is EnergyHub, which offers a program called Smart Savers Texas that customers sign up for through their thermostat manufacturer.   Under this program, customers are entered into a sweepstakes every time they undergo a demand response event for the chance to win $5,000 towards their energy bills. In exchange, customers agree to allow EnergyHub to trigger temperature adjustments (up to 4 degrees) during demand response periods two to 10 times per summer.   ""It's a really important time to have resources like this, because these really unique weather events require that the grid have some resources it can call on at peak in order to reduce demand,"" said Erika Diamond, vice president of customer solutions at EnergyHub.  The program also allows customers to opt-out of any single demand response event or from the program altogether via the thermostat menu or its associated app.  So if these types of programs require customers to opt-into these agreements, what is Carlson basing his claim on that these adjustments are occurring without people’s permission?  Carlson’s segment featured a conversation with Chuck DeVore, vice president of the conservative Texas Public Policy Foundation. In the segment, DeVore criticized these programs for enticing customers with rebates or other incentives.  In an interview, DeVore said that while people are typically granting permission to power companies, they might not be fully aware of what they’re agreeing to.   ""You do have to sign up for it with the providers — you have to give them permission to do it,"" DeVore said. ""It's just that most people in today's day and age don't really spend a lot of time reading the small print."" He pointed to an example out of Galveston, in which a woman who was enrolled in the program was surprised by the automatic thermostat adjustments last month.  ""Not everyone's going to really know what they were signing up for,"" he said.  A spokesperson for Carlson’s show also pointed to a KHOU TV article in which one Houston family ""woke up sweating"" during the mid-June heat. Their thermostat, which was enrolled in EnergyHub’s program, had been unexpectedly kicked up to 78 degrees.   According to KHOU-TV, the thermostat had been installed in the family’s home as part of a new home security package. EnergyHub has partnerships with several home security dealers that include smart thermostats in their installment packages, Diamond said. But it's unclear why this family didn't know their device was enrolled in their program.  All of EnergyHub's customers are enrolled into the program via a sign-up process that is offered on the thermostat's app or the home security app.  ""They are asked, 'Do you want to join? Here are the terms and conditions,'"" Diamond said. ""It lets them know that they are legally signing a document telling them what the offer is, and then they complete that process digitally, and they get an email that says you've applied to this program. And then they get an email letting them know they've either been accepted or rejected."" Carlson said last month that power companies are automatically raising the temperature of people’s thermostats ""without their permission.""  Various demand response programs exist around the state, and thousands of customers have enrolled in them. Although social media posts and local news stations show that some people weren’t fully aware of the terms of the agreement, they had nonetheless granted permission.  We rate this claim False. ",/factchecks/2021/jul/09/tucker-carlson/tucker-carlson-distorts-texas-smart-thermostat-con/
