tags,sub_header,text_body,quote_href
"['Oregon', 'Bruce Hanna']","
Did tied Oregon House consider and approve as many measures as previous Legislatures?
","
The 76th Oregon Legislature adjourned on June 30, 2011, the first legislative session in which the Oregon House had been split 30-30 between Democrats and Republicans. Co-speakers Arnie Roblan, D-Coos Bay, and Bruce Hanna, R-Roseburg, appeared the next morning on Oregon Public Broadcasting’s ""Think Out Loud"" to talk about their accomplishments.

Host Dave Miller asked Hanna to address a concern raised by labor coalition Our Oregon: that the divided House let die a number of Senate approved bills because both committee co-chairs had to agree to move legislation forward.  What, asked Miller, could be done to get more bills, especially noncontroversial bills, to the House floor for an up-or-down vote?

Hanna objected to the claim that the tie in the House meant more bills were blocked. Plenty of measures, he said, left the House never to be taken up by the Senate, controlled 16-14 by Democrats.

But Hanna also said this: ""When you talk about the total number of bills that came through the House, we processed and dealt with and passed as many bills as any Legislature ever has.""

True? Did the 2011 Legislature keep pace with its predecessors?

For this, PolitiFact Oregon turned to Legislative Counsel, the nonpartisan office of lawyers responsible for turning legislators’ ideas into bills that may become law. The office has tracked the number of bills introduced by legislators and enrolled, which means approved by both the Senate and the House, since 1997. Here is the summary: 
  
You can see that the percentage of approved measures dropped this year to 27 percent, from 35 percent in 2009, when Democrats controlled both chambers. In fact, it’s the lowest clearance rate in the last decade, although not entirely out of line. The approval rate was 29 percent in 2005, when Democrats led the Senate and Republicans the House.  

More significantly, the number of bills approved -- 807 -- is the lowest in a decade.

Maybe a lot of the legislation that cleared previously was nonsense. Maybe all 807 bills that passed this session were good and meaty. Still, Hanna is not correct. The House and the Legislature passed fewer bills this session than in previous sessions. There’s no quibbling with those figures.

Angela Wilhelms, Hanna’s chief of staff, said her boss was trying to make the point that ""co-governance did not lead to inaction or gridlock as many predicted it would."" She’s right about that, as she also is correct to say that the Senate and tied House moved fairly heavy-hitting bills on redistricting, education reform, a remake of the Oregon Health Plan and a state budget.

Nevertheless, we have to rule the Republican co-Speaker’s statement as Barely True. There’s an element of truth -- the number of bills isn’t that much different from 2005, and there was hefty legislation on important topics. But he states that the number of bills approved this year was on par with previous Legislatures, and that ""ignores critical facts that would give a different impression.""",/factchecks/2011/jul/20/bruce-hanna/did-tied-oregon-house-consider-and-approve-many-me/
"['Facebook Fact-checks', 'Instagram posts']","
Donald Trump did not congratulate Navy SEALs on Haiti assassination
","Haitian President Jovenel Moïse was assassinated in his home on July 7. While the search for the suspects continues, an Instagram post claimed that former President Donald Trump congratulated the Navy seals for a ""perfect beautiful whack."" An Instagram post from July 7, 2021, included a headline it claimed was from the New York Times that said, ""In a now deleted Telegram post, Former President Donald Trump congratulated the Navy SEALs on a ‘perfect beautiful whack.’"" The post also claimed, ""President Biden fears the assassination spells the end of America’s centuries old policy of allowing the Haitian people to exercise absolute self-determination."" We decided to fact-check this claim. Moïse was killed in his home by multiple gunmen. Moïse’s wife Martine was shot and injured. The gunmen identified themselves as agents from the U.S. Drug Enforcement Administration, or DEA, before entering the property, Haitian ambassador to the U.S. Bocchit Edmond told Reuters. In a July 7 State Department briefing, spokesperson Ned Price condemned the allegations that the assasination was carried out by DEA agents. ""These reports are absolutely false. The United States condemns this heinous act,"" Price said at the briefing. ""These false reports are nothing more than that, just false reports."" Moïse was the source of much controversy in Haiti during his presidency. In recent months, protesters demanded Moïse’s resignation after disputes about when his term was set to expire. Moïse insisted that his term would end on Feb. 7, 2022, because of delays in his swearing in, while opponents pushed for his ousting. Moïse had ruled by decree since 2020 after the country failed to hold parliamentary elections.In February, U.S. Ambassador to the United Nations Jeffrey DeLaurentis emphasized ""the need to bring the current period of rule by decree to a swift conclusion."" International politics notwithstanding, there is no evidence that Trump sent out a Telegram post about the events in Haiti. President Trump has no history of using Telegram to relay messages to the public. We asked his office for a comment but have yet to receive a response. There is concern that the assassination can lead to instability in Haiti, but the headline highlighting Biden’s concern for Haiti’s self-determination was not published by the New York Times. The Instagram post was apparently doctored: When reached for comment, the New York Times said that it did not write or publish either of the headlines in the screenshot.  The suspected gunmen may have identified themselves as agents from the DEA, but there is no evidence that Navy SEALs killed Moïse. A spokesperson from the Navy said, ""Regarding the Navy SEALs, these claims are false. They are wholly fabricated without any basis in fact."" In a statement, President Joe Biden condemned the assassination, and said, ""The United States offers condolences to the people of Haiti, and we stand ready to assist as we continue to work for a safe and secure Haiti."" An Instagram post claimed that former President Trump congratulated Navy SEALs on their ""perfect beautiful whack"" of the Haitian president.  There is no evidence that Trump said any such thing. There’s also no evidence that Navy SEALs had any role in Moïse’s death, and the post making the claim used doctored headlines. We rate this claim False.",/factchecks/2021/jul/09/instagram-posts/navy-seals-did-not-kill-haitian-president-trump-di/
"['Economy', 'Jobs', 'Joe Biden']","
Joe Biden’s boast on early job gains neglects timing, pandemic context
","When the Bureau of Labor Statistics announced that the United States had gained 850,000 jobs in June, President Joe Biden took to a podium in the White House complex to tout the achievement. ""Good morning, everyone — it is a good morning!"" Biden said July 2. ""As we get prepared to celebrate Independence Day, today’s job news brought us something else to celebrate: This morning we learned that, in June, our economy created 850,000 jobs."" Biden went on to say, ""We have now created over 3 million jobs since I took office, more jobs than have ever been created in the first five months of any presidency in modern history, thanks to the incredible work of the entire team."" Presidents’ claims about job creation on their watch can be troublesome. So how did Biden do? Biden was right on the numbers, we found, but he glossed over some important context. The official government data shows that between January 2021, when Biden took office, and June, the number of employed Americans rose from 142.7 million to 145.8 million, or a gain of just over 3 million. In numerical terms, that’s a bigger gain in jobs than for the equivalent period under every post-World War II president who first came to office in an election. (This comparison leaves out Harry Truman, Lyndon Johnson and Gerald Ford, each of whom initially assumed the office without being elected.) The closest competitor to Biden was Jimmy Carter, with a gain of 1.8 million jobs.   Biden’s claim leaves out at least four important bits of context. Raw numbers vs. percentages. By choosing to highlight jobs gained as his metric, Biden has an advantage in a comparison with previous presidents. The U.S. population has grown, and so has the labor force. A fairer metric for comparison is the number of jobs gained divided by the starting level of jobs when the president took office. By this metric, Biden scores well, but he’s not No. 1. That distinction goes to Carter, who oversaw job gains of 2.2%, compared with Biden’s 2.1%.   Comparison to the pre-pandemic level. The U.S. economy is still almost 6.8 million jobs below the pre-pandemic peak — 145.8 million jobs in June 2021, compared with 152.5 million jobs in February 2020.    Put another way, if the gains from June can be replicated each month, it would take until February 2022 for all pre-pandemic jobs to be recovered (setting aside subsequent increases in population).  Given the severity of the pandemic recession, that would be a significant bounceback — but it hasn’t happened yet.  The question of timing. Biden entered office during a recession (and a global pandemic), but while the economy was on the upswing. Most other presidents — aside from Barack Obama, who took office during a spiraling economic downturn — have entered the White House amid a growing economy. But the precise timing of their inauguration can play a big role in how a president’s first few months go, so Biden’s comparison to his predecessors is not really apples-to-apples. Who gets the credit? Experts always caution that a president is not all-powerful in economic matters, since many factors beyond their control, from international oil supplies to changes in technology and demographics, can shape the health of the U.S. economy. That said, experts say that Biden does deserve some credit for the job gains on his watch, given the gains in coronavirus vaccinations and the passage of his $1.9 trillion American Rescue Plan, which provided coronavirus aid and economic relief. The White House did not respond to an inquiry for this article. Biden said, ""We have now created over 3 million jobs since I took office, more jobs than have ever been created in the first five months of any presidency in modern history."" Biden is right on the numbers and on how they compare with his recent predecessors in the Oval Office. However, this talking point glosses over the reality that the U.S. economy remains almost 6.8 million jobs under its pre-pandemic peak. Meanwhile, comparing presidents as Biden did is highly sensitive to the economic conditions around the time of their inauguration; Biden entered office during a deep recession, but he took over on the upswing, a situation that not all presidents have benefited from. We rate the statement Half True.",/factchecks/2021/jul/09/joe-biden/joe-biden-target-early-job-gains-figure-leaves-out/
"['National', 'Crime', 'Republican National Committee']","
GOP tweet misfires in linking crime trends to Democratic policies
","Republicans see a winning issue in linking crime to Democratic policies. When homicides spiked in the second half of 2020, President Donald Trump wielded it as a campaign issue, saying Republicans would restore order to crime-ridden Democratic-led cities. He lost his race, but the GOP attacks continue. In a recent tweet, the Republican National Committee blamed rising crime on Democrats. ""Crime is escalating to a level we haven’t seen in decades as a direct result of Democrats’ defund the police movement and Biden-Harris open-border policies,"" Republicans tweeted June 29. Crime is escalating to a level we haven’t seen in decades as a direct result of Democrats’ defund the police movement and Biden-Harris open-border policies. We asked the RNC for the data behind the claims in the tweet. Their response included nothing on the link to police defunding. On the open border part, they pointed to news coverage about an increase in fentanyl seizures at the border, high-speed chases in South Texas, and FBI director Christopher Wray talking about an epidemic of drug smuggling and other illegal activity at the border.  The RNC tweet is rife with inaccuracies. But its biggest flaw is the unfounded assertion that crime rate trends were a ""direct result"" of Democratic policies. Homicides increased in 2020. It’s possible that the toll could have topped 19,000 last year.  But the RNC tweet is not narrowly about rising homicides. It encompasses several other claims that are flawed: ""Open-border policies"": The articles the RNC cited said nothing linking activity at the border to a spike in the national incidence of murders or other crimes. We found no independent research that argued that point. Criminologist and law professor Paul Cassell at the University of Utah noted that when murders began to increase rapidly in mid-2020, immigration was stable or declining. ""And, obviously, Democrats did not control immigration policy in May 2020,"" Cassell said. ""So any linkage between the 2020 homicide increase and immigration policies seems quite dubious."" Historic highs: The RNC tweet talked about crime reaching levels not seen in decades. Not only do they lack the data to confirm that, but based on the FBI’s latest available data for homicides and other preliminary data, the U.S. is not on pace to reach the heights seen in the mid-1990s.  ""Defund the police"": The RNC tweet suggested that ""defund the police"" is a core Democratic policy. It is not. A handful of Democrats have spoken out for it, but during the 2020 campaign, candidate Joe Biden rejected the movement. And his 2022 budget requested an increase of $304 million for police to build ties within the communities they patrol. Some Democratic-led cities did cut police budgets last year, but not many. Among the 50 largest cities, police spending as a percentage of general expenditures went up an average of 13.7%. At least 24 cities increased police funding for 2021. The RNC tweet speaks of crime broadly, but it’s homicides in particular that have caused alarm since a sharp rise in the summer of 2020. That coincided with the anti-police-violence protests that spread across the country in June following the murder of George Floyd in Minneapolis. The calls to defund the police gained prominence the same month. One problem in talking about crime at this moment is that no one yet has a national picture of crime for 2020, let alone the first half of 2021. The FBI’s annual Uniform Crime Report is the most comprehensive data set, and the FBI hasn’t published the 2020 edition yet.  Other data sets lack the scope of the FBI’s full assessment, but they all point in the same direction: Homicides are up. A preliminary FBI crime report for 154 cities says murders rose 10% in the first quarter of 2021 compared with a year earlier. The Major Cities Chiefs Association found a 29% rise in homicides for 63 cities in the first quarter of 2021. And the latest report from Council on Criminal Justice, an independent source of crime data, looked at 24 cities and found homicides rose by 24% in the first quarter. The topline numbers don’t tell the whole story, however. For example, in the first-quarter FBI release on 154 cities, the increase in homicides was concentrated in 40% of the cities. The remaining 60% saw murders drop or stay the same. As for violent crime generally — including homicide, rape, robbery and aggravated assault — the number remained just about the same across the full group of cities, undercutting the RNC’s broad-brush claim about escalating crime. The Council on Criminal Justice’s data on weekly police reports found that homicide rates generally fell after October 2020 — from a bit over 5 deaths per 100,000 to about 3 per 100,000 by March 2021. That could reflect seasonal changes; homicides tend to fall in the cooler months. But the report’s authors say other unknown factors could be at work. The RNC’s claim that rising crime was a ""direct result"" of Democratic policies lacks evidence, and experts say it ignores some of the major events of 2020 that also likely had an effect on crime. ""The pandemic hit especially hard in exactly those neighborhoods where a lot of violence happens anyway,"" said City University of New York criminologist Candace McCoy. ""Services that connect with teens were shutting down. Families were hit with people getting sick, some of them dying. More young adults were left to themselves."" Criminologist Eileen Ahlin at Penn State-Harrisburg noted that the economic downturn also mattered. ""Unemployment and declining mental health routinely affect crime rates,"" Ahlin said. ""Last year we saw both at play.""  On top of the pandemic and the disruptions it brought, there were the nationwide protests spurred by the death of George Floyd. Cassell at the University of Utah said that played a role, because it made police less likely to engage with people who might commit violence. ""Police pulled back from the kinds of aggressive steps that are often needed to most effectively fight homicides,"" Cassell said. Cassell also said that dealing with marches could have taken police away from other activities. Researchers disagree whether the protests themselves had any effect. Regardless, Cassell called the GOP link between crime and a defund policy ""dubious.""  Even the pandemic and the protests might not fully explain the trend in homicides. As the Council on Criminal Justice report noted, the ""homicide increase actually began in 2019, prior to the pandemic and well before protests against police violence spread across the country."" Looking at the first three months of 2020, murders rose 20% from a year earlier. The pandemic shutdown didn’t take place until mid-March, and the protests didn’t begin until late May. The Republican National Committee tweeted that ""crime is escalating to a level we haven’t seen in decades as a direct result of Democrats’ defund the police movement and Biden-Harris open-border policies."" It’s not true that crime is rising to a level we haven’t seen in decades.  Homicides are up, but there’s no evidence that the trend is tied to a police defunding policy or Democrats’ border policies, let alone that it’s a ""direct result."" Experts say many other factors may have played a role, including racial-justice protests and disruptions caused by the pandemic.  We rate this claim False.",/factchecks/2021/jul/09/republican-national-committee-republican/gop-tweet-misfires-linking-crime-trends-democratic/
"['National', 'Sports', 'Facebook Fact-checks', 'Guns', 'Facebook posts']","
News outlets didn’t ignore a six-time Olympic medalist due to her stance on gun rights
","With the delayed 2020 Tokyo Olympic Games around the corner, an old claim has resurfaced online about Kim Rhode, a six-time Olympic medalist in the sport of shooting. ""First woman to medal in six straight olympics,"" a June 30 Facebook post says. ""Media and sponsors ignore her because she is outspoken pro-2A.""    The claim first started to spread online in 2016, shortly after Rhode won her sixth medal for women’s skeet shooting. It’s just as wrong now as it was then. The post was flagged as part of Facebook’s efforts to combat false news and misinformation on its News Feed. (Read more about our partnership with Facebook.) After her bronze medal win in 2016, Rhode became the first woman and first summer Olympian to medal in six consecutive Olympics. She didn’t qualify for the 2020 games. But it’s inaccurate to say that news organizations ignored Rhode’s success. Stories about the feat were published by multiple news organizations at the time, including CBS Sports, the Daily Mail, The Guardian, NBC, the New York Times, Reuters, SB Nation and USA Today. Outlets have also reported about her accomplishments and support of gun rights. It’s true that, in the past, Rhode hasn’t received sponsorships outside of the firearms industry and a hunters’ conservation group. But that appears to have more to do with shooting’s lack of fanfare compared to other Olympic sports, making it unattractive to big-name sponsors.  Shooters, including Rhode, have also suggested that the rise of gun violence and mass shootings in the U.S. has attached a stigma to the sport, and contributes to its sponsorship problems. ""When you look at the gun debate and the Olympics, there definitely is that stigmatism that’s attached to our sport due to all the negative publicity that guns get,"" Rhode told the Daily Signal in 2016. A Facebook post claims that Rhode was ignored by news organizations and sponsors because she’s an outspoken supporter of the Second Amendment. There is no evidence to support this. Several prominent news outlets have reported about Rhode’s Olympic accomplishments, as well as her support of gun rights. The sport of shooting often receives less big-name sponsors due to its lack of fanfare, and isn’t about Rhode specifically. She and other shooters have also suggested that the sponsorship issues may be due to an aversion to gun sports.  We rate this False.",/factchecks/2021/jul/09/facebook-posts/news-outlets-didnt-ignore-six-time-olympic-medalis/
