tags,sub_header,text_body,quote_href
"['City Government', 'Education', 'Poverty', 'Wisconsin', 'Don Pridemore']","
4 of 5 Milwaukee Public Schools students behind in reading, math, state school superintendent candidate says
","
Tagging himself a common-sense conservative reformer, Wisconsin state Rep. Don Pridemore, R-Erin, aims to unseat first-term state Superintendent of Public Instruction Tony Evers in the April 2013 election.

In announcing his run Dec. 3, 2012, Pridemore criticized school performance, taking particular aim at the district in Wisconsin’s largest city, Milwaukee Public Schools.

The eight-year suburban lawmaker said ""86 percent of MPS students are behind in reading and 80 percent are behind in math.""

Milwaukee Public Schools is a popular target.

But are the vast majority of its students lagging in reading and math?

Pridemore’s evidence

When we asked Pridemore to back up his claim, he cited an Oct. 24, 2012, article in the Milwaukee Journal Sentinel. The article reported on recalculations done by the Department of Public Instruction, the agency Evers heads, on a statewide student tests.

The recalculations were done on 2011 scores for the Wisconsin Knowledge and Concepts Examination, which is given each fall. As the Journal Sentinel explained, DPI raised expectations for performance to match those of a respected national exam.

The recalibration meant that essentially overnight, there was a large increase in the number of students who were rated as non-proficient -- even though their performance on the test didn’t change.

Statewide, under the old standard for scoring the 2011 WKCE tests, 18 percent of students failed to score as proficient or advanced in reading. But the figure rose to 64 percent under the new standard.

In math, the non-proficiency figure rose from 22 percent under the old standard to 52 percent under the new.

Milwaukee Public Schools students fared worse.

Under the old standard, nearly 42 percent of MPS students were scored as not proficient in reading. But under the new standard, the figure climbed to 86 percent.

In math, nearly 41 percent of MPS students were rated as not proficient under the old standard. That rose to just over 80 percent under the new standard.

Milwaukee Public Schools spokesman Tony Tagliavia acknowledged the accuracy of the figures, but pointed out that the percentages of students in Milwaukee voucher, or choice, schools rated as not proficient were even higher in reading (90 percent) and math (88 percent). He said it was important to cite the performance of private schools that get public funding since they are ""pitched as the solution to issues with MPS.""

But we’re not testing a claim about voucher schools -- we’re testing Pridemore’s claim about MPS students’ proficiency in reading and math.

Our rating

Pridemore said that among Milwaukee Public Schools students, ""86 percent are behind in reading and 80 percent are behind in math.""

We would note that the figures are as high as they not because of a change in student performance, but a change in the way the state scores a test.

Nevertheless, Pridemore states the figures accurately and we rate his statement True.",/factchecks/2013/jan/02/don-pridemore/4-5-milwaukee-public-schools-students-behind-readi/
"['Ohio', 'Health Care', 'Medicaid', 'Terry  Russell']","
NAMI Ohio leader Terry Russell says people with mental illnesses die 25 years earlier, on average, than those without
","
One of the questions about the state budget proposal that Gov. John Kasich is expected to announce in February is whether the state will follow through with the Affordable Care Act's expansion of Medicaid coverage.
The federal health care law would expand coverage to people with incomes up to 138 percent of the poverty level -- a provision which was made optional under the U.S. Supreme Court ruling that otherwise upheld the law.

A bipartisan group of 85 health coverage organizations has written to the governor saying anything less than the full 138 percent would cause people to drop or skip coverage, endangering their health.

Terry Russell, executive director of the National Alliance on Mental Illness of Ohio, told Gongwer News Service that mentally ill Ohioans struggle to stay employed, and that local mental health agencies have marginal resources to help.

""The sad statistic that haunts us every day is that individuals with mental illnesses die an average of 25 years earlier than those without a mental illness,"" he said. ""Sixty percent of these premature deaths are the result of preventable and treatable diseases, such as heart disease, diabetes, cancer and infections.""

PolitiFact Ohio checked into his claim about 25 years, and quickly found his statement was right on the money.

A study published in 2006 by the National Association of State Mental Health Program Directors that was the focus of wide attention and concern in the mental health community looked at data from 16 states, including Ohio.

It found that, on average, people with severe mental illness die 25 years earlier than the general population.

The figure for Ohio was actually worse. People with severe mental illness die 32 years earlier.

Calling it ""a serious public health problem for the people served by our state mental health systems,"" the study said about 60 percent of premature deaths are due to conditions such as cardiovascular, pulmonary and infectious diseases.

A number of factors contribute to risk, the study said, including modifiable factors like obesity, poor nutrition and alcohol and tobacco use. People with severe mental illness have poorer access to appropriate health care, and may be additionally vulnerable because of higher rates of homelessness, victimization, unemployment and poverty.

Among its recommendations, the report called for better access to physical health care for people with serious mental illnesses to fight what it called an ""epidemic of premature death and its contributing causes.""

Russell said that people with mental illnesses, on average, die 25 years earlier than those without a mental illness. He accurately cited findings of a major study on the issue. And in Ohio, the average is actually greater than 25 years.

On the Truth-O-Meter, his claim rates True.",/factchecks/2013/jan/02/terry-russell/nami-ohio-leader-terry-russell-says-people-mental-/
"['Georgia', 'Guns', 'Jack Kingston']","
Kingston makes issue of Connecticut's gun control laws
","
Even ardent gun rights supporters are willing to talk gun control in the wake of the deadly shooting at Sandy Hook Elementary in Newtown, Conn.

During a Dec. 18 grilling by MSNBC anchor Thomas Roberts, U.S. Rep. Jack Kingston said gun control should be ""up for discussion"" alongside violent video games and mental health. The Savannah Republican was endorsed by the National Rifle Association in 2012 and received an A+ grade from the group.

Changing gun laws may not be the answer, though.  

""Connecticut has the fifth toughest gun control laws in the country, including an assault weapons ban that bans 35 different weapons,"" Kingston said.

A Kingston spokesman did not reply to our request for more information, so we searched for state-by-state comparisons of gun control laws and reviewed Connecticut’s assault weapons statute.

The term ""assault weapon"" is controversial. Various state laws use the phrase, although the National Rifle Association argues that gun control advocates created it to ""trick the public into believing that ‘assault weapons’ were fully-automatic machine guns used by the military,"" its website says.  

There’s no formal definition for what counts as an assault weapon. Laws describing them vary. In general, the term refers to a semi-automatic firearm that resembles a fully automatic one or those used by militaries.

Connecticut law generally bans the sale, transfer or possession of assault weapons. State statute defines them in two ways:
  

Connecticut’s law lists 37 guns, not 35, so Kingston’s not far from the mark. Technically speaking, the statute is written so that firearms outside the list can be prohibited, but this is a minor problem.

What about Connecticut’s ranking?

The Brady Campaign to Prevent Gun Violence uses a point system to rank states based on whether their statutes met the group’s standards on curbing firearm trafficking; background checks; child safety requirements and other factors.

Connecticut’s laws were ranked the fifth strongest in the nation in 2011, the group’s most recent list. It was bested by California, New Jersey, Massachusetts and New York. Georgia tied for 22nd.

The nutmeg state scored well consistently. We checked the rankings back to 2007 and found it made the top five each time.

Still, Connecticut’s 58 points lagged well behind first place California, which earned 81 points.

The state’s assault weapons ban was one reason why. It earned only three out of a possible 10 points because magazines that carry more than 10 rounds remain legal there. Also, the Brady Campaign prefers a different definition for an assault weapon.  

""While it’s the state with the fifth strongest gun laws, obviously, at 58 points out of 100, there’s a lot more the state can do,"" said Brian Malte, a spokesman for the group.

We found that groups that push for tougher gun laws consistently give Connecticut high marks.

For instance, the San Francisco-based Law Center to Prevent Gun Violence ranked Connecticut fourth in its 2012 report, and fifth in 2010. It assigns points to each state based on 29 aspects of gun law, including the sale and transfer of firearms, owner responsibilities, and rules on their handling in public places.

The center Georgia ranked 24th in 2012.

And Mayors Against Illegal Guns, which boasts membership of more than 700 mayors, including Atlanta’s Kasim Reed, issued a 2010 report that compared states based on whether they enacted 10 key types of gun laws.

Connecticut had put nine of the 10 types in place. Only New York and New Jersey received a 10 out of 10. Georgia had enacted two.

Our conclusion:

Kingston is right on this one. Connecticut consistently ranks high in lists of states with stringent gun laws, and literally ranked fifth in recent rankings by the Brady Campaign and the Law Center to Prevent Gun Violence.

Furthermore, he’s pretty close on the number of assault weapons banned in Connecticut law.

Kingston earns a True.",/factchecks/2013/jan/02/jack-kingston/kingston-makes-issue-connecticuts-gun-control-laws/
"['Education', 'Texas', 'David Dewhurst']","
David Dewhurst says under Texas law, it takes six years to close a failing school
","
A headline-grabbing plan to help students transfer isn’t the only way Lt. Gov. David Dewhurst wants to handle ""unacceptable"" schools in Texas.

""Currently under Texas law, it takes six years to close down a failing school. That’s nuts. I’m going to move for legislation to make it two years,"" Dewhurst told the Dallas regional chamber of commerce Nov. 19, 2012, according to a news story from KERA-TV, Channel 13 in Dallas.

Well, ""nuts"" is an opinion, but ""six years"" is something we can check.

We asked Dewhurst and spokesman Matt Hirsch for details and support for the claim but did not hear back.

Dewhurst repeated his call to ""shorten that time period"" and also made it clear he was referring to academic failure during a Dec. 19, 2012, news conference announcing a proposal to give businesses tax credits for donations to a scholarship fund helping students switch schools.

Texas Education Agency spokeswoman Debbie Ratcliffe told us by email that it takes six years of ""unacceptable"" academic ratings before the Texas schools commissioner is absolutely required to shut down a campus.

But by law, Ratcliffe said, the commissioner can close a school for purely academic reasons after three years. That’s ""two years of academically unacceptable ratings plus one year in which the school fails to successfully implement a reconstitution plan,"" she said.

We reviewed the Texas education code and found that it clearly states that ""after a campus has been identified as unacceptable for two consecutive school years, the commissioner shall order the reconstitution of the campus."" That process, Ratcliffe said, typically includes replacing faculty members.

If the commissioner is not satisfied with the progress under the reconstitution plan, he or she can order ""repurposing"" of the campus, install new management or order it closed. So, the commissioner could close a school after three years.

If the school receives three consecutive ""unacceptables"" after reconstitution, the law says, the commissioner ""shall order"" the campus be repurposed, be put under ""alternative management"" or closed. The only exception is that if it appears the school will improve its rating in the next year, the commissioner can grant another year’s leeway -- bringing the maximum time to six years.

Schools can be -- and have been -- closed more quickly for ""financial, health and safety or other reasons,"" Ratcliffe said. ""Some of those had academic problems; just not five or six years of low ratings.""

Charter schools -- public schools under private management -- can also be shut down more quickly for violating a charter contract, Ratcliffe said, which can involve academics.

Only three public schools have been closed for purely academic reasons since the current accountability system began in 1993, Ratcliffe said. Each of those cases took five to six years.

Johnston High School in the Austin school district and Sam Houston High School in the Houston district were ordered to close in 2008, after five years at ""unacceptable"" for Johnston, according to a June 5, 2008, Austin American-Statesman news story, and six years of ""unacceptable"" ratings at Sam Houston, according to a June 6, 2008, Houston Chronicle news story.

Pearce Middle School, also in the Austin district, was ordered to close in 2009 after five years of ""unacceptable"" ratings, according to a July 9, 2009, Statesman news story.

Agency data Ratcliffe sent us for 2004 through 2011 showed that of the 223 schools ordered to reconstitute, 205 achieved sufficient improvements to get out of the danger zone before an ultimate sanction was triggered. Fourteen schools had posted more than two consecutive ""unacceptable"" years but hadn’t yet reached five.

Ratcliffe said that although a new accountability system is in the works, the six-year requirement won’t change unless the state law governing closure is modified by the Legislature -- for example, if Dewhurst’s two-year suggestion were adopted.

 Our ruling

Dewhurst said it takes six years under Texas law to close a failing school. That’s the maximum, and it’s usually taken nearly that long, but by law a commissioner can order closure after just three years. We rate Dewhurst’s statement as False.",/factchecks/2013/jan/01/david-dewhurst/david-dewhurst-says-under-texas-law-it-takes-six-y/
"['Federal Budget', 'Wisconsin', 'Paul Ryan']","
Anti-poverty spending could give poor $22,000 checks, Rep. Paul Ryan says
","
In a speech shortly after the presidential election, Republican vice-presidential contender Paul Ryan decried what he called the government’s ineffective approach to fighting poverty, saying spending alone isn’t the answer.

""Just last year, total federal and state spending on means-tested programs came to over $1 trillion,"" the Wisconsin congressman and House Budget Committee chairman said Dec. 4, 2012, referring to programs that have eligibility based on income.

""What does that mean in practical terms? For that amount of money, you could give every single poor American a check for $22,000 -- every man, woman and child.""

Really?

Let’s check Ryan’s math.

Ryan’s evidence

To begin with, a little background: 
-- Ryan made his indictment at a time when poverty is at one of its highest rates in decades. In 2011, 46.2 million people, or 15 percent of the U.S. population, lived in poverty. 
-- For 2012, the income levels to be eligible for certain anti-poverty programs was $11,170 for a single person and $23,050 for a family of four. 
-- More than half of Americans -- 51 percent, according to an October 2012 Rasmussen poll -- think the government spends too much fighting poverty. That’s up from 38 percent in an April 2011 Rasmussen survey. 
As for the numbers in Ryan’s speech, it turns out he had used them before -- on the campaign trail less than a month before the election.

Here’s the evidence Ryan spokesman Kevin Seifert provided us to back the two numbers.

How much was spent: Some $1.03 trillion was spent on means-tested programs for the poor in 2011, Republicans on the Senate Budget Committee said in October 2012.

Most of that amount -- $746 billion -- was federal spending, based on a detailed memo by the nonpartisan Congressional Research Service, with the committee itself estimating that states picked up the remainder of the $1 trillion.

But it’s not as though all of that money was being given to people in poverty as cash or food. The largest category was for health care, primarily through Medicaid.

How many in poverty: Ryan cited census data, noting as we did earlier that 46.2 million people lived in poverty in 2011.

From there, Ryan takes the $1.03 trillion and divides it by 46.2 million people living in poverty. The result, he says, is each poor person could have been written a check for $22,000.

The math itself is accurate, and there’s no dispute about the number of people in poverty.

But let’s go to some experts for a closer look.
 
The conservative Heritage Foundation calculates the cost of means-tested federal and state spending on welfare programs in 2011 as $927 billion, with half the amount going to health care.

Michael Tanner, a senior fellow with the libertarian Cato Institute, puts the 2011 anti-poverty spending figure at $952 billion -- although he counted local government spending as well as money spent by the federal and state governments. That amounts to $20,610 for every poor person, Tanner wrote.

So, both groups give support to Ryan’s claim, although their spending figures are somewhat lower than Ryan’s claim of $1 trillion.

The liberal Center for Economic and Policy Research says that even if the $1 trillion is accurate, it is spent on ""a population that is more than twice the size"" of the 46 million people living in poverty. That’s because two of the major programs, Medicaid and the earned income tax credit, have income eligibility limits above the poverty line.

Moreover, some of the $1 trillion, the center said, is paid to school districts and other institutions to help educate the poor -- the poor themselves don’t get the money.

LaDonna Pavetti, a family income support researcher at the liberal Center on Budget and Policy Priorities, said of Ryan’s claim: ""It’s not so much the numbers as what he does with them.""

Noting that the single largest portion of spending cited by Ryan is on health care, Pavetti pointed out that the largest Medicaid expenditures are made on people who live in nursing homes and other institutions -- they, by definition, are not included in the number of people living in poverty.

And the list of programs Ryan includes in his $1 trillion in spending ""is sort of anything and everything that is targeted to low-income people,"" Pavetti said. That includes money that aids schools and low-income communities but do not directly benefit the poor, she said.

Our rating

Ryan said ""over $1 trillion"" was spent on anti-poverty programs in 2011, enough to ""give every single poor American a check for $22,000.""

As a sweeping statement, Ryan’s claim is partially accurate, in that roughly $1 trillion was spent on means-tested programs, and if you divided that by the number of people living in poverty, it would amount to roughly $22,000 per person.

But Ryan mixes apples and oranges, in that the $1 trillion is actually spent on far more people than the 46 million counted as living in poverty. Moreover, much of the money goes to institutions, such as nursing homes and schools, and not directly into the pockets of the poor.

We rate Ryan’s statement Half True.",/factchecks/2012/dec/30/paul-ryan/anti-poverty-spending-could-give-poor-22000-checks/
"['Iran', 'Facebook Fact-checks', 'Facebook posts']","
Old photos of Iran, Israel missile strikes recycled for attack on US bases
","On Facebook, some users shared old photos of Iranian and Israeli missile strikes after the attack on two United States air bases in Iraq. Two of the photos, which a popular Facebook page published Jan. 7, depict several missiles being launched from the foreground of a mountain range. One appears to show an explosion.  ""Approximately half an hour ago Iran attacked US Base in Iraq,"" the page wrote in its caption. The images were flagged as part of Facebook’s efforts to combat false news and misinformation on its News Feed. (Read more about our partnership with Facebook.) They have been shared more than 15,000 times. (Screenshot from Facebook) The photos don’t show the missiles that hit the Al Asad and Erbil bases in Iraq on Jan. 7. Using reverse image searches, we traced the images to three old missile strikes by Iran and Israel. The top photo depicts an Oct. 1, 2018, strike by Iran against the Islamic State in Syria. Its source is the Agence France-Presse (AFP). The photo on the bottom-left of the Facebook post shows a June 18, 2017, attack by Iran also against the Islamic State in Syria. It’s a handout that Iran’s state TV gave the European Pressphoto Agency. The photo on the bottom-right of the Facebook post depicts the impact of a Nov. 15, 2019, Israeli missile strike in the Gaza Strip. Its source is the AFP. Below is footage that Iran has released from its Jan. 7 strike in Iraq. There were no reported casualties. The Facebook posts are inaccurate. We rate them False.",/factchecks/2020/jan/08/facebook-posts/old-photos-iran-israel-missile-strikes-recycled-at/
"['Iran', 'Facebook Fact-checks', '@thesavoyshow']","
Popular Instagram account recycles old Iran missile strike video
","A widely viewed Instagram video claims to show the moment that Iranian missiles were launched against two United States military bases in Iraq. But it doesn’t. The video was posted Jan. 7 by @thesavoyshow, which describes itself as ""Black American News/Satire/Media."" It depicts several clips of what appear to be missiles flying through a night sky. ""#Iran attacks American Troops. According to reports they launched over 60 Rockets,"" the video caption reads. The video was flagged as part of Facebook’s efforts to combat false news and misinformation on its News Feed. (Read more about our partnership with Facebook, which owns Instagram.) It has been viewed more than 128,000 times. (Screenshot from Instagram) Using reverse image searches, we traced the source of the video posted by @thesavoyshow. It doesn’t show Iran’s Jan. 7 strike on military bases in Iraq. The video depicts an Oct. 1, 2018, missile strike by Iran against the Islamic State in Syria. It was originally aired by Iranian news agency Sima News and rebroadcast by several TV networks around the world, including Russia Today and Al Jazeera. Iran attacked the Islamic State in retaliation for a Sept. 22 incursion on a military parade that left 25 people dead. Below is the footage that Iran has released from its Jan. 7 strike, which targeted two airbases in Iraq: Al-Asad and Erbil. There were no reported casualties. @thesavoyshow’s Instagram post is inaccurate. We rate it False.",/factchecks/2020/jan/08/thesavoyshow/popular-instagram-account-recycles-old-iran-missil/
