tags,sub_header,text_body,sources,quote_href
"['Fake news', 'Facebook Fact-checks', 'Facebook posts']","
Facebook post claims CNN uses same girl in photos of separate refugee crises
","We’ve seen many social media posts challenge news organizations’ use of war photos. Recently, the Facebook account Defend the Jewish Nation posted a photo collage captioned, ""When CNN uses the same girl in 3 different Refugee Crisis pictures being saved by 3 different men."" In the pictures, a little girl can be seen wearing the same outfit in the hands of three different men, all of whom appear to be evacuating a scene after a bombing. Did CNN use the girl’s photo three times to pass off as three separate occasions of refugee crises? Could they have, as the post post insinuates, staged the photos using a child actor playing the role of someone who was rescued three times by three different men? The answer to both of these questions: No. Here's how we know. We ran a reverse image search on the collage using the online tool TinEye and found the collage meme spread online as early as December 2016. But we could find no instance where the meme specified what on what three occasions CNN supposedly used the photos to illustrate separate crises. So, we decided to look at each image individually. We discovered that CNN has used two of them in their web content. One image (the one on the left) was included in a CNN web story about a barrel bomb airstrike of a funeral in rebel-controlled eastern Aleppo published on Aug. 27, 2016. It was also used as the cover page for a video of CNN on Sept. 17, 2016, according to a search on Wayback Machine. Another photo (the one in the middle) was first included in a CNN web article in early September 2016 in a text story about the agreement between the United States and Russia for Syrian ceasefire. Under the photo, the caption read, ""A Syrian man carries a wounded child in eastern Aleppo in August."" That caption is accurate. The same photos were used in many other news stories by other news organizations reflecting the same event, including NBC and Foreign Policy, according to our search. A reverse image search shows that the photo on the right-hand side appeared in a news article published on Aug. 28, 2016, on AOL about the same event. Our image search found no evidence that CNN used  the photos on its website in a misleading way as to illustrate any other refugee crisis. We also saw no indication that the photos were used in video on the CNN cable channel. The photo versions used by CNN included watermarks on the right-hand side of the images. They were attributed to Ameer Alhalbi (a pseudonym used by Syrian freelance Mashhadiphotographer Walid Mashhadi) for the international news agency Agence France-Presse and visual media company Getty Images. AFP, the agency that distributed the photo confirmed in a fact-check that the three photos involved in the claim were actually taken on the same day — Aug. 27, 2016, in eastern Aleppo, Syria. The photos show a girl being rescued by Syria Civil Defence volunteers, also known as the White Helmets. AFP’s fact-check also stated that the girl was passed along from one volunteer to another, which is why she is pictured wearing the same clothes with three different people holding her. In the first picture, the girl was carried by a rescue worker in a white helmet together with another boy. In other photos, she was moved farther away from the building. In a Washington Post news story on Aug. 27, 2016, about the funeral bombing, we could see that the child was passed over from the rescue worker in the leftmost photo to the man in the plaid shirt in the rightmost photo. That the three photos capture a sequence of rescue action makes sense. Defend the Jewish Nation shared a viral image that accused CNN of using ""the same girl in 3 different Refugee Crisis pictures being saved by 3 different men."" The accusation is unfounded. CNN did not ""use"" the girl or take part in the creation of the photos, and there’s a lack of evidence to prove that the photos were used to refer incorrectly to three different wars. We rate this claim False.",[<zip object at 0x000001B4ECB3FB00>],/factchecks/2019/mar/01/facebook-posts/facebook-post-claims-cnn-uses-same-girl-photos-sep/
"['Debt', 'Texas', 'Chip Roy']","
In 2019, the United States will rack up about $100 million in debt every hour
","As Democrats on the U.S. House Oversight and Government Reform Committee grilled Michael Cohen, the former personal lawyer of President Donald Trump, many Republicans on the panel described the hearing as a waste of time and suggested government resources could be better spent tackling other issues. Among those members was U.S. Rep. Chip Roy, R-Austin. Roy posed a series of rapid-fire questions to Cohen before offering his perspective on where lawmakers should really focus their attention. ""Real Americans in my district and across the country wanted the president to be president not in any way because he is perfect, but rather because they are sick and tired of this hellhole,"" Roy said at the hearing. ""They supported this president because they are sick and tired of the games we're seeing here today. They are sick and tired of politicians who refuse to secure the border, balance our budget, restore healthcare freedom and then get the hell out of their way so they can lead their life."" ""They are mystified that we amass about $100 million in debt per hour, which means we've blown through 300, 400, 450 million dollars during this charade in amassing debt,"" he said. ""$450 million."" After hearing his remarks, we had to ask: Is it possible to measure how much the national debt grows per hour? How much did debt amass during Wednesday’s hearing? Math behind the claim uses projections, not historical data Roy’s spokesman Robert Donachie said the congressman claimed that ""we amass $100 million in debt per hour"" by using data from a report published by the Congressional Budget Office in January of this year. The Congressional Budget Office, or CBO, is a nonpartisan agency that offers independent federal fiscal projections for budget writers at the Capitol. The report, titled ""The Budget and Economic Outlook: 2019 to 2029,"" states that the projected federal deficit for 2019 is about $900 billion. From there, Donachie said the congressman’s office did the math by dividing $900 billion by 8,760, the number of hours in a year, and found that the deficit would grow by $102,739,726.03 per hour this year. Mark Harkins, a senior fellow at the Government Affairs Institute at Georgetown University, said the math the congressman used is right, but Roy could have used different values other than projections in his calculation. ""How you want to calculate (the value) is part of your game,"" Harkins said. Using projections for the current year, instead of actual figures from the past calendar year, is a fine way to develop an estimate of debt accrued by the hour. But projections are just estimates, meaning things could change based on outside factors like shifts in economic activity, unexpected expenses like from natural disasters or new legislation affecting taxes or expenses. ""The CBO is trying to estimate what tax receipts are going to be in April -- no way,"" Harkins said. ""Good luck with that. They’re educated people and they have a shot, a better shot than most, but it’s still a dartboard."" Harkins said Roy could have come to a more concrete number by using the actual deficit from 2018 to see how much debt amassed per hour last year. That number wouldn’t necessarily tell you about what the rate looks like in 2019, but it’s a more fixed value than the one Roy calculated using the projected deficit. The actual deficit of calendar year 2018 was nearly $873 billion, which means the deficit grew by an average of about $99 million every hour last year. The federal deficit is seasonal Tara Sinclair, an economics professor at George Washington University, said Roy’s claim is right only if he is speaking generally about the average growth per hour and not about  growth at a specific time on a specific day. ""The way I would have revised the quote would have been to say that, ‘the CBO projects that we will amass, on average, $100 million per hour over the next year,’"" she said. ""That’s a perfectly precise and correct quote."" But without that clarifying language, things start to get dicey. ""I would be concerned about the debt-per-hour concept because of seasonality,"" Sinclair said, referencing the idea that the federal deficit is constantly changing, depending on the time of year and whether taxes are due. This means it’s not a great idea to use annual projections of the deficit to try to calculate how much debt was amassed at a specific time on a specific day, because the deficit and its growth rate change at every moment. Instead, Sinclair said looking at the U.S. Treasury Department’s value of the national debt on a specific day will paint a more accurate picture of debt amassed over a certain time period. But these daily values are not published until several days after the fact, making it near impossible to do a real-time estimation. So when Roy said that ""we’ve blown through 300, 400, 450 million dollars"" since the start of Wednesday’s hearing, he’s likely off base. ""That’s almost certainly not correct,"" Sinclair said of his claim. ""But is it a good approximation of about how much it could have been? I’d say it’s a fair illustration of if you took four hours out of 2019 and tried to calculate debt amassed based on CBO projections."" Our rating Roy said Wednesday that, ""we amass about $100 million in debt per hour, which means we’ve blown through 300, 400, 450 million dollars during this charade in amassing debt,"" referencing a house committee hearing featuring testimony from Cohen. While reviewing this claim, we learned that there is no one right way to calculate how much the national debt grows by the hour. There are different ways to show the relationship between the national debt and time, but each calculation is different. Roy’s assessment of debt accrued by the hour is correct if he’s speaking generally about the average growth per hour, but not if he’s trying to literally calculate how much debt was amassed between 10 a.m. EST and 2:25 p.m. EST on Feb. 27 of this year. We rate this claim Mostly True. MOSTLY TRUE – The statement is accurate but needs clarification or additional information.",[<zip object at 0x000001B4ECB28D40>],/factchecks/2019/feb/28/chip-roy/2019-united-states-will-rack-about-100-million-deb/
"['Immigration', 'Crime', 'Public Safety', 'California', 'Kamala Harris']","
Kamala Harris tries to ‘rewrite history’ with False claim on San Francisco ICE policy
","Presidential candidate and U.S. Sen. Kamala Harris, D-Calif., has made protecting undocumented youth a top priority during her time in the Senate. She’s been a vocal supporter, for example, of the Deferred Action for Childhood Arrivals (DACA) program, which gives temporary protections to more than 700,000 young undocumented immigrants, or Dreamers, brought to the country as children. But on the campaign trail in Iowa this past weekend, Harris made some questionable statements about a 2008 San Francisco policy that reported undocumented youth to federal immigration officials upon their arrest by local police. Harris, San Francisco’s District Attorney at the time, supported the policy, which didn’t take into account whether the youth were actually found guilty of a crime. Speaking on an Iowa politics podcast on Sunday, Harris said handing over undocumented youth to U.S. Customs and Immigration Enforcement, or ICE, was ""an unintended consequence"" of the policy. Here’s the exchange: Question: ""Could you kind of give us some insight on how, from that time, when for whatever reason you were supporting this policy that was essentially handing over undocumented people to ICE before they had been convicted to now -- kind of what's changed on that and how you came to those changes?""  Harris’ response: ""That ended up being an unintended consequence of the policy and I did not support that consequence of that policy. And that policy I believe has since changed because it was not the intended purpose of that policy."" We decided to fact-check her claim that turning over undocumented youth to ICE was ""an unintended consequence"" of this strategy.   Background on San Francisco policy  Before 2008, San Francisco’s policy was to not report arrested undocumented youth to ICE at all, as part of its sanctuary city protections. Then Mayor and current California Gov. Gavin Newsom changed that approach in 2008 after a 21-year-old undocumented man was arrested for killing three members of a family in San Francisco. The man had been arrested before, at age 17, and convicted of attempted robbery and assault but was not reported to federal immigration authorities. Former San Francisco County Supervisor David Campos strongly opposed the policy change. Asked about Harris’ statement, he said ""it just doesn’t fly."" ""With all due respect to Sen. Harris, who has been a friend, I don’t understand how she can say that,"" said Campos, who led the board’s effort to reverse the policy, and is now chairperson of the San Francisco Democratic Party. ""Turning over young people and children who were accused of a crime that later turned out they did not commit was not an unintended consequence of what was going on. It was precisely what was going on and what we were trying to avoid,"" Campos said. ""You can’t rewrite history."" The Board of Supervisors voted to overturn Newsom’s policy in October 2009 and overrode his veto the next month, according to a Mercury-News article. But that wasn’t the end of the controversy. Newsom refused to enforce the reversal. ""His administration cited a memo from City Attorney Dennis Herrera, which argued that the supervisors’ reform would be ""likely to result in a federal legal challenge,"" potentially to the sanctuary city law as a whole — although it also noted that ""the law in this area is not well developed,"" the paper reported. Harris expressed the same concerns in a speech at Stanford University in 2009, as cited in a CNN.com article that reviewed Harris’ support for the policy. Harris explained her position this way: ""There was then an initiative that was written by the board of supervisors that was passed and there was opposition to that but it did pass,"" Harris said in the 2009 speech. ""And so we're gonna have to wait to see how the courts interpret what it means. From my perspective, I think that it would be in conflict with federal law, and we have to follow the law. We have to follow that law. You may not agree with it, but you know, that's why we have a process where you can challenge laws. And it is the law."" Newsom’s policy was eventually changed by his successor in the mayor’s office, Ed Lee, who ordered in May 2011 that most juveniles with family ties to the Bay Area not be reported to ICE, the Mercury-News added. It ""was the purpose of this troubling policy""  Angela Chan, a San Francisco immigration attorney who opposed the mayor’s policy, told PolitiFact California this week in an email that referring youth to ICE ""wasn't an unintended consequence, it was the purpose of this troubling policy."" Chan is policy director at Advancing Justice Asian Law Caucus. She represented a family whose 13-year-old son was referred to ICE under Newsom’s strategy. The mayor’s approach ""was a pretty drastic change,"" she told us last year, when we reported on the policy during the gubernatorial campaign. ""Prior to that point, the focus was on rehabilitation and on the appropriate placement of the child and also on reunification with the family."" Last summer, then-Republican gubernatorial candidate John Cox claimed Newsom ""separated families and deported children before he was against it,"" comparing what Newsom did to the the Trump administration’s separation of migrant children from their families at the U.S.-Mexico border. We found Cox was partially correct but that his statement also unfairly conflated Newsom’s policy with Trump’s, despite some stark differences in detail and circumstance. Even so, some undocumented youth were deported due to Newsom’s policy. Chan said ""dozens"" of juveniles between the ages of 12 and 18 were reported to ICE each month, both on felony and misdemeanor charges and ""some kids were actually deported as a result of that policy."" She said her legal efforts blocked the deportation of a 13-year-old she represented who was nearly deported for punching a classmate and stealing 46 cents. Harris didn’t lead the charge on the new strategy, Chan added, but was ""a tacit supporter."" Harris has subsequently said the policy ""could have been applied more fairly."" Asked about the senator’s claim on the podcast, her campaign spokesman issued a written statement: ""As Governor Newsom has said, his initial policy was intended to protect the sanctuary status of San Francisco, which Senator Harris has always supported and defended. In Iowa, Senator Harris was clearly talking about how she believes the policy shouldn’t have been done the way it was done."" We asked Campos and Chan about that response. Campos said the claim that Newsom’s policy was necessary to protect the city’s sanctuary status ""doesn’t pass the straight-face test."" Chan, who listened to the podcast, said San Francisco’s sanctuary status, which is decided by city leaders, was never in jeopardy. ""That makes no sense whatsoever,"" she said of the campaign’s explanation. An in-depth look at Harris’ statement by CNN.com this week also found the senator ""mischaracterized"" the policy, finding multiple inaccuracies. Our rating Sen. Kamala Harris claimed on a recent podcast that turning over arrested undocumented youth to immigration officials was ""an unintended consequence"" of a 2008 San Francisco policy she supported. That, in fact, was the very purpose of the policy. It was specifically designed by then San Francisco Mayor Gavin Newsom to allow local police to report arrested undocumented youth to ICE, according to news reports and those who opposed the policy. Previously, the city did not refer arrested undocumented youth to ICE. Harris also stated she ""did not support that consequence of the policy,"" which is also dubious given past news articles that cite her support for Newsom’s change.   Additionally, Harris said the policy was only changed because of an ""unintended consequence."" That’s also wrong. Newsom resisted changing it, and it was only reformed after a new mayor was elected. On the podcast, Harris said she feels strongly that undocumented residents should be protected by and able to trust local law enforcement ""without having to worry about"" whether they will be deported. That sentiment, however, doesn’t take away from her mischaracterization of the goal and fraught history of the 2008 policy she supported. We rate Harris' claim False. FALSE – The statement is not accurate. Click here for more on the six PolitiFact ratings and how we select facts to check. CORRECTION: An earlier version of this story incorrectly said San Francisco’s policy, before Newsom’s change in 2008, was to refer arrested undocumented youth to ICE only after a criminal conviction. In fact, before the change, the city’s policy was to not refer undocumented youth to ICE at all.",[<zip object at 0x000001B4EAA9DF40>],/factchecks/2019/feb/28/kamala-harris/kamala-harris-tries-rewrite-history-false-claim-sa/
