tags,sub_header,text_body,quote_href
"['Taxes', 'Texas', 'Ted Cruz']","
Ted Cruz says David Dewhurst has a record of promoting a Texas income tax
","
U.S. Senate hopeful Ted Cruz gave reporters a humor-tinged handout about front-running David Dewhurst before the Republican candidates’ Austin debate in January.

The handout listed reasons Dewhurst, the state’s lieutenant governor, might duck the debate -- which Dewhurst did not. On the list: One of Dewhurst’s horses threw a shoe; Dewhurst, who is wealthy, was in Tokyo; his private jet broke down.

We fixed on reason No. 2: ""Come on, would you want to show up and have to defend your record promoting an income tax?""

Texas is one of nine states lacking a state income tax. The last statewide elected official to publicly suggest one, the late Lt. Gov. Bob Bullock, left office in early 1999, nearly eight years after he briefly maintained that a state personal income tax made economic sense. The prospect proved so unpopular, Bullock later ushered in a constitutional amendment requiring voter approval before a personal income tax can become law.

So, we wondered about Cruz’s claim.

At the debate, reporter Brad Watson of Dallas’ WFAA-TV asked Cruz what proof he had of Dewhurst promoting an income tax. Cruz replied that in 2006, Dewhurst told The Associated Press, ""I think I’d rather see a tax that is based on income.""

Also, Cruz said, the Wall Street Journal editorialized in 2005 that Dewhurst was ""pushing what he called a wage tax."" Cruz, quoting the editorial, continued: ""A wage tax is of course a fancy disguise for a personal income tax.""

It’s way-back time.

To assess Cruz’s claim, we looked into the mid-decade efforts by state leaders to overhaul the state’s tax system partly to drive down local school property taxes. Those debates culminated in a 2006 revision of the business franchise tax and other tax changes.

First, let’s plumb the articles offered by Cruz as proof of Dewhurst’s actions.

A March 30, 2006, AP news article, headlined ""Businesses studying proposed tax structure,"" indeed quotes Dewhurst as saying: ""I think I'd rather see a tax that's based on income — you earn money, you pay something, you don't earn money, you don't pay anything.""

We can see why a critic would single out that comment, though the full AP story indicates that Dewhurst was speaking to the particulars of revamping the business franchise tax rather than advancing his desire to create a personal or business income tax.

The story initially points out that lawmakers had previously stumbled over how to restructure the business tax, which most corporations did not owe. ""They worried that proposals would not apply equally to different business structures,"" the article says. ""And business-friendly Republicans have been hesitant to levy a new tax that could be harmful to job creation and economic growth.""

According to the story, the consensus proposed fix -- which was a plan devised by a panel headed by John Sharp, a former Texas state comptroller -- would tax businesses on a percentage of their gross receipts, meaning the money a company brought in before expenses, with each company choosing between deductions for cost of goods sold or employee benefits like salary and health care. The story says sole proprietors and general partnerships would be exempt, along with companies that have annual gross receipts of $300,000 or less.

For more than 80 years, the story says, the state’s main business tax had been based on a company’s net assets, though lawmakers changed it in 1991 to make it more like a corporate income tax. Texas companies subsequently had the choice of paying either 0.25 percent of the value of their net assets or 4.5 percent of their net corporate income, whichever was greater, according to a 2003 report on Texas taxes by the nonpartisan House Research Organization.

In 2006, lawmakers revised the franchise tax along the lines of the Sharp proposal.

The March 2006 AP story, published before lawmakers acted, says two business groups seemed receptive to the proposed overhaul. But it quotes the president of the Texas Auto Dealers Association expressing concern that a gross receipts-based tax would be assessed against businesses even if they had not earned a profit.

Next, the story quotes Dewhurst as saying that the Texas Senate, over which he presides, is sensitive to that concern. It then quotes him saying he’d rather see a tax based on income so if you earn money, you  pay something and if you don’t, you do not.

Dewhurst appears to have reconsidered his comment the next day -- or, perhaps, recognized how it might be taken as a politically risky, Bullock-like call for a state income tax. According to an April 1, 2006, Houston Chronicle news article, Dewhurst ""retreated from his statement a day earlier that he favored basing a business tax on a company's income, rather than its gross receipts."" The story quotes Dewhurst saying: ""I have always opposed a business or personal income tax.""

Cruz told us in a telephone interview that he reads Dewhurst’s initial comment as noted by the AP as indicating he was for a business income tax.

He urged us to put stock as well in the May 10, 2005, Journal editorial, headlined ""Deep in the Heart of Texas,"" which takes Dewhurst to task for state budget and tax proposals then in circulation within the Republican-led Legislature. The editorial states that Texas’ status as a state without an income tax is ""in serious peril,"" continuing: ""Both the state Senate and House have endorsed what Mr. Dewhurst -- whose post of lieutenant governor is nearly as powerful as governor in the state -- is calling a ‘wage tax.’ A wage tax is of course a fancy disguise for a personal income tax, and imposing one is a sure way to put a state on the path to slower growth.""

Cruz told us: ""The wage tax that (Dewhurst) promoted is effectively the same thing as an income tax,"" though Dewhurst, he said, ""wasn’t foolish enough to use the label ‘income tax.’""

The Journal editorial airs concerns about possible tax increases to cover cuts in school property taxes, among them a new wage or payroll tax, which the editorial calls a toll on employers for hiring workers.

Finally, Cruz suggested significance in Dewhurst’s subsequent letter to the Journal regarding the editorial; the response talks up the Senate’s tax plan, but is silent on the Journal’s likening of a wage/payroll tax to a business income tax.

With Cruz’s backup laid out, let’s turn to other signs of an income tax plan being offered or endorsed by Dewhurst in 2005-06.

A Nexis search for such news articles shows the House and Senate each explored numerous tax ideas.

We spotted no stories on Dewhurst or anyone in the Republican leadership promoting a personal or business income tax. But two conservative observers said payroll tax elements of proposed House and Senate franchise tax overhauls amounted to income taxes.

Some nitty gritty: The House in March 2005 approved a revenue package that offered companies a choice of paying the existing franchise tax or a 1.15 percent payroll tax on salaries up to $90,000 a year.

In May 2005, the Senate answered with a plan allowing companies to choose the lower of two taxes, as long as they generate more money than a minimum tax of 0.25 percent of gross receipts. As described in a May 12, 2005, Austin American-Statesman news article, the first option for businesses was to pay 2.5 percent of the sum of their net taxable income plus payroll, though they could deduct from the tax base either half of their payrolls or $30,000 per employee plus the cost of some health benefits. The second option in the Senate plan would have required  companies to pay a 1.75 percent payroll tax, capped at $1,500 per employee.

In an opinion column published in the American-Statesman March 16, 2005, Matthew J. Griffing of the Young Conservatives of Texas said House Speaker Tom Craddick, a Republican, was to blame for the House advancing its payroll tax, which Griffing called a backdoor income tax. ""Of course, the Republican leadership does not have the courage to call this an income tax or assess it directly against the people. Instead, it calls it a ‘payroll tax’ and assesses it against employers rather than employees,"" Griffing wrote.

And a May 21, 2005, AP news article quotes a former U.S. House Majority Leader, Dick Armey of Texas, as saying the payroll elements of the business tax proposals were the same as income taxes.

The AP article, foreshadowing that year’s legislative failure to agree on how to fund cuts in school property taxes, points out that elements of measures approved by the House or Senate ""include some form of a tax on wages."" Critics, including Armey, the story says, ""call the proposals a disguised income tax, which is illegal in Texas."" It quotes Armey urging Gov. Rick Perry to stop the ""wage tax"" in its tracks but quotes Dewhurst as saying the proposed payroll tax was not an income tax.

Was the lieutenant governor right about that?

Close observers of the 2005-06 tax debate told us the payroll tax elements might have been objectionable, but they weren’t generally taken as income tax schemes.

Bill Hammond, president of the Texas Association of Business, said in a telephone interview the taxes would have been paid by employers on top of wages -- instead of being taken out of individual pay checks like an income tax. ""I don’t think anyone in the Capitol thought of that as being an income tax. If they had, it wouldn’t have gotten past the (committee) hearing stage,"" Hammond said.

Laura Hoke, spokeswoman for the National Federation of Independent Business in Texas, said the group opposed the payroll tax proposals as job killers, but did not view them as income tax plans.

Dale Craymer, president of the business-membership Texas Taxpayers and Research Association, and tax analyst Dick Lavine of the liberal-leaning Center for Public Policy Priorities, each said the payroll tax elements were not income taxes.

Lavine, who has helped the center urge lawmakers to establish a state personal income tax since the mid-1990s, said he would not call the payroll tax elements income taxes partly because they failed to tap all forms of income -- such as capital gains.

Broadly, Craymer said, ""there never was an income tax proposal"" from, or supported by, Dewhurst. Lavine agreed.

Finally, we consulted two out-of-state tax experts who each said he wouldn’t characterize payroll taxes, sometimes imposed by individual communities, as income taxes because they’re levied as a percentage of an employer’s payroll rather than being taken out of each employee’s wages.

Seen another way, payroll taxes are not based on a firm’s income, Richard Pomp, a professor at the University of Connecticut School of Law, said in a telephone interview. Instead, Pomp said, they’re tied to the costs of doing business.

After we described the payroll tax approaches considered in Texas, Michael McIntyre, a professor at the Wayne State University School of Law, saw significance in their not being based on all employees' wages, while he said income taxes are typically levied on all workers. ""I’d probably say it’s some other tax,"" McIntyre said.

Our ruling

Contrary to Cruz’s claim, Dewhurst has not promoted a personal or business income tax. It's even a stretch to say he edged in that direction in March 2006 with the comment he quickly forsook. 
All told, the idea that Dewhurst has a record of promoting an income tax is so far from accurate, it’s ridiculous. Pants on Fire!",/factchecks/2012/feb/10/ted-cruz/ted-cruz-says-david-dewhurst-has-record-promoting-/
"['Georgia', 'Economy', 'Jobs', 'Mitt Romney']","
Romney revises claim about the unemployed
","
Super Tuesday is only one month away, which means the GOP presidential hopefuls are descending on Georgia to convince voters they deserve Barack Obama’s job.

And speaking of jobs, they’re hammering Obama on unemployment.

When Republican front-runner Mitt Romney stumped at an Atlanta custom countertop showroom Wednesday afternoon, he said that ""25 or 24 million"" people are ""out of work or stopped looking for work.""

A PolitiFact Georgia team member stood among the crowd of 300, Truth-O-Meter in hand. It lit up and told us that Romney was doing a new take on an old talking point.

Last month, during the Republican presidential debate in Tampa, Romney said that ""we have 25 million Americans out of work"" during the Republican presidential debate. Our colleagues at PolitiFact National ruled his statement Half True.

Does Romney’s revised statement earn him higher marks on the Truth-O-Meter?

First, let’s look at his statement from January.

Officially, there were about 13.1 million unemployed Americans in December 2011, which put the unemployment rate at 8.5 percent. This is according to the Bureau of Labor Statistics, the federal government’s source of employment statistics. Romney’s count was some 12 million higher.

Here’s why:  

When PolitiFact National analyzed Romney’s statement, they pointed out that certain critics have long argued that the BLS definition of unemployment is too limiting. It doesn’t count people who have stopped looking for work or are working part time, even though they’d prefer a full-time job.

To address this concern, BLS offers an alternative measure (known to economists as ""U-6"") that includes these other groups.

By this metric, an additional 2.6 million people in the U.S. were ""marginally attached"" to the labor force in December 2011, meaning they’d be ready to work if a job became available. Another 8.1 million were working part time but would prefer a full-time job.

Together, these three categories added up to 23.8 million people in December 2011, for a total ""U-6"" rate of 15.2 percent -- well above the official unemployment rate. Romney’s data was a little high, but in the ballpark.

Romney earned a Half True. His use of the term ""out of work"" was a stretch when about one-third of the ""25 million Americans out of work"" are actually working part time, PolitiFact National ruled in January.

Now on to Romney’s statement in Atlanta.

Romney described those ""25 or 24 million"" people as being ""out of work"" or having ""stopped looking for work.""

The newest jobs data shows Romney’s calculation for the total number of unemployed, looking for work or are working part time, even though they’d prefer a full-time job, remains more or less accurate.

In January, some 12.8 million people were unemployed and 2.8 million people were marginally attached to the labor force, according to BLS figures. An additional 8.2 million were working part time even though they wanted a full-time position. Once again, that totals 23.8 million.

But Romney’s latest description of these workers was a little off the mark.

The BLS describes ""marginally attached workers"" as people not in the labor force who want to work and are available to do it, and who have looked for a job in the past 12 months, but had not done so in the past four weeks.

These people want work, but have recently given up because they have family obligations, think they can’t get a job, or other reasons.

The BLS calls people who are working part time even though they’d prefer a full-time job as working ""part time for economic reasons."" This is defined as those who worked one to 34 hours a week because they can’t find full-time work or business has slowed down.

The BLS does not ask whether they stopped looking for work.

Of the 24 or 25 million workers mentioned by Romney, only 15.6 million clearly match his description as being ""out of work"" or having ""stopped looking for work.""

The remaining one-third may or may not be angling for more hours or a full-time slot at their current employer. They could have stopped looking for full-time work altogether. We don’t know.

Romney’s statement is partially accurate, but he gets important details wrong. He therefore earns a Half True.",/factchecks/2012/feb/10/mitt-romney/romney-revises-claim-about-unemployed/
"['Candidate Biography', 'Congress', 'Voting Record', 'Florida', 'Alan Grayson']","
Patrick Murphy voted for House Benghazi committee, US Rep. Alan Grayson says
","U.S. Rep. Alan Grayson wants voters to think he’s the only true Democrat in the race for Marco Rubio’s soon-to-be-open Senate seat. After all, he reasoned, his primary opponent helped Republicans create the Benghazi committee. ""Two years ago last Sunday, the Benghazi committee came into being,"" the Orlando businessman and former lawyer said in a fundraising email on May 11, 2016. ""There are only three Democrats in the House today who voted for it. One of them is my primary opponent, Patrick Murphy."" Murphy, a Jupiter Democrat, was a Republican before switching parties two years before being elected to Congress in 2012. His moderate views have been challenged by progressives and especially Grayson, who has endorsed Sen. Bernie Sanders in the presidential race. Could it be true Murphy was among a handful of Democrats who voted to investigate leading Democratic presidential candidate Hillary Clinton? In a word, yes, although Murphy said it was because he wanted to clear Clinton’s name. Back to Benghazi On Sept. 11, 2012, just before President Barack Obama’s re-election, Islamic extremists attacked a U.S. diplomatic mission and a CIA compound in Benghazi, Libya. U.S. Ambassador to Libya Chris Stevens and three other Americans were killed. Various conspiracy theories and cover-ups became partisan talking points as the White House was questioned about al-Qaida involvement and what officials did and did not know about the attack. Then-Secretary of State Clinton and the State Department faced scrutiny that has continued during her presidential campaign. By May 2014, seven congressional probes and a State Department review board had examined the issue. A conservative watchdog group obtained State Department emails about the attack  that had been withheld from one of these House committees, sparking calls for a new investigation. The Republican-led House voted to form the House Select Committee on Benghazi, comprised of seven Republicans and five Democrats, to again question the Obama administration’s handling of the incident. The May 8 vote largely went along party lines, 233 to 186. We say ""largely"" because seven Democrats crossed the aisle and voted to create the committee. Murphy was one of them. (He did not serve on the committee.) Grayson chose his words carefully when he cited ""three Democrats in the House today."" Four of those seven Democrats who voted for the panel are no longer members of Congress. Only Murphy, Minnesota’s Collin Peterson and Arizona’s Kyrsten Sinema are still in office. Murphy released a statement following the vote, saying he hoped Congress would not use the panel to grandstand on the issue. We couldn’t find the press release on Murphy’s House website, but the Tampa Bay Times published the statement in part: ""While the congressman respects the work his colleagues have done already investigating this matter, when it comes to American lives lost overseas in service to our nation, we must make sure that all questions have been answered. He sincerely hopes that this committee is not used as a way to politicize this tragedy and the deaths of four Americans."" This isn’t the first time Grayson has attacked Murphy over the vote. On Oct. 2, 2015, he called the committee ""a partisan clown show"" that had been ""done with Patrick Murphy's permission."" By Oct. 21, Murphy told MSNBC that officials were abusing the process and the panel’s usefulness was over. ""Based on what we’ve heard just in the last several weeks from Leader (Kevin) McCarthy, to the whistleblower to Congressman (Richard) Hanna coming out, admitting pretty clearly that this is a political witch hunt, I think it’s past time that we disband this committee,"" Murphy said. MSNBC’s Chuck Todd asked Murphy if he regretted the vote, but Murphy stayed firm: ""I stand by it, because I think it’s more than proven that there is nothing to hide there."" When we contacted Murphy’s campaign, his spokesman echoed a past statement that ""Republicans turned this tragedy into a political circus"" and reiterated Murphy wanted the committee shut down. There’s little evidence that Clinton or other liberals are holding Murphy’s vote against him. Murphy is favored by Democratic officials in the U.S. Senate race, and Clinton reportedly told donors at a 2015 fundraiser that she is ""so proud of him."" Republicans on the committee have said they expected to release a final report in the summer before the 2016 election. Our ruling Grayson said Murphy is one of ""only three Democrats in the House today who voted"" to create the Benghazi committee. Murphy did vote with six other Democrats to create the committee in May 2014 (four of those seven are no longer in the House). Grayson is trying to paint Murphy as a conservative in liberal’s clothing. Murphy says his vote was to help clear Clinton’s name. That’s a bit of context that Grayson should have included, so we rate his statement Mostly True.",/factchecks/2016/may/16/alan-grayson/patrick-murphy-voted-house-benghazi-committee-gray/
