tags,sub_header,text_body,sources,quote_href
"['New Hampshire', 'Campaign Finance', 'Energy', 'Senate Majority PAC']","
Senate Majority PAC says Scott Brown got $400K in 'big oil' contributions
","The Senate Majority PAC is going all out fighting attacks on Democratic candidates by libertarian businessmen Charles and David Koch. The group’s latest target is former Sen. Scott Brown, R-Mass., who is now trying to unseat Sen. Jeanne Shaheen, D-N.H. ""Scott Brown’s carrying some big oil baggage,"" the narrator says in an April 27 TV ad. ""In Massachusetts, he voted to give oil companies big tax breaks. They make record profits. He collects over $400,000 in campaign contributions."" We already fact-checked Brown’s ""big oil"" votes. Here we’ll take a closer look at the breakdown of contributions to his campaign. The Senate Majority PAC pointed us to OpenSecrets.org, a website run by the independent Center for Responsive Politics that tracks money in politics. The site tracks donations of at least $200 to show how money impacts congressional elections. OpenSecrets logs $455,760 in campaign contributions from oil and gas industry donors for Brown over the course of his career, according to the most recent data available. That’s the 15th most popular area Brown receives donations from. The biggest sectors Brown receives money from are retired individuals, securities and investment, lawyers and law firms, and real estate, each of which account for at least $1 million. OpenSecrets defines oil and gas companies as ""multinational and independent oil and gas producers and refiners, natural gas pipeline companies, gasoline service stations and fuel oil dealers."" That categorization includes what some people would consider ""big oil"": the political action committees and top executives of companies like Exxon and BP. But it also includes smaller, independent companies, and low-level individuals who happen to work for an oil company. In fact, by the center’s definition, global ""big oil"" companies only accounted for $52,550 of the $455,760 total. That’s just 11.5 percent. In addition, the ad makes it sound like the companies themselves are donating. Overall, $168,000 came from PACs -- which pool the money of employees and donate it in the employer’s name -- but the rest comes from individuals associated with oil and gas companies. The reasons for an individual’s donation may have everything or nothing to do with the industry’s policy agenda. Our ruling The Senate Majority PAC ad said that ""Scott Brown’s carrying some big oil baggage"" because he ""collected over $400,000 in campaign contributions."" Independently collected data shows that Brown received at least $455,760 in donations from donors associated with the oil and gas industry. However, the ad’s wording is somewhat misleading, since just 11.5 percent of that total came from PACs and individuals affiliated with the biggest multinational companies -- what viewers would reasonably consider ""big oil."" On balance, we rate this claim Half True.",[<zip object at 0x000002809773FCC0>],/factchecks/2014/may/01/senate-majority-pac/senate-majority-pac-says-scott-brown-got-400k-big-/
"['National', 'Animals', 'History', 'Matt Bevin']","
Were the founding fathers active cockfighters?
","Were the founding fathers cockfighters? It’s not a question we expected to ask this campaign season. But we’re going to ask it because a Kentucky Senate candidate recently claimed that ""many"" of the men who founded our nation also took an interest in the blood sport. Tea party-backed candidate Matt Bevin, who is challenging Senate Minority Leader Mitch McConnell, R-Ky., in a primary, drew criticism earlier this month after speaking at a cockfighters’ rally in Corbin, Ky. Cockfighting is illegal in Kentucky -- as it is in every state, 40 of which make it a felony -- but aficionados want to reverse such laws on a state-by-state basis. Bevin defended his presence at the rally on Louisville radio host Terry Meiners’ show in part by saying many of the founding fathers were participants. ""But it's interesting, when you look at cockfighting and dogfighting as well, this isn't something new, it wasn't invented in Kentucky for example,"" Bevin said. ""I mean, the founding fathers were all -- many of them -- very actively involved in this and always had been."" We’ve checked some claims about historic politicians in the past, so we’ll try again with a look at cockfighting more than two centuries ago. Past claims Bevin’s campaign did not respond to an inquiry for this story, so we don’t know what he’s basing that claim on. However, these claims typically have concerned a handful of prominent founders, notably George Washington, Thomas Jefferson and Benjamin Franklin. Some other sources also mention Abraham Lincoln and Andrew Jackson, but Bevin’s claim specifically mentioned ""founding fathers,"" so we didn't address them.  Our research initially led us to the Humane Society of the United States, which has spearheaded a long fight to make cockfighting illegal and is one of cockfighting’s fiercest critics. In the early 1990s, the society contacted historians and experts about some of the founding fathers to see if there was any truth to the claims. According to the documents the society collected, the founders’ connections to cockfighting seem somewhat tenuous, though we acknowledge some limitations about this type of research -- namely that their surviving personal writings and other documentary evidence is limited. George Washington  There is one reference in George Washington’s diaries that confirms that as a 19-year-old, the nation’s future first president attended a cockfight.  ""A Great Main of (co)cks fought… (be)tween Glouster and york for 5 pistoles each battle and 100 ye odd I left it with Colo. (John) Lewis before it was decided…,"" he wrote, according to information uncovered by the Humane Society. However, it’s unclear how excited the young Washington was, since the entry says he left before the fight ended, said Mary V. Thompson, a research historian at the Fred W. Smith National Library for the Study of George Washington. Another historian -- John P. Riley, formerly of Mount Vernon, Washington’s estate --  told the Humane Society that there is a vague reference to a cockfight elsewhere in Washington’s writings, but that Washington referenced other activities he enjoyed far more than he referenced cockfighting. ""By the numerous references in his diaries and letters to foxhunting, card playing and attending the theater, we know that these were some of Washington’s favorite amusements,"" Riley wrote in 1993. ""The two references to cockfighting in his voluminous writings and the absence of documentation or physical evidence of any cockpit at Mount Vernon leads me to believe that it was not an entertainment in which he participated in any great way."" Thomas Jefferson The evidence on Thomas Jefferson is similar. ""Although it is always much harder to disprove something than to prove it, I am confident that if Jefferson had any interest in cockfighting, I would come across some reference to it in my twenty-five years of working with his documentary archive,"" Lucia C. Stanton, the former director of research at Monticello wrote to the Humane Society in 1993. Stanton told PolitiFact that while it is impossible to tell what activities Jefferson took part in before he started prolifically documenting his life, it would be surprising if he had been actively involved in cockfighting as a young man yet made no mention of these activities in his later writings. Meanwhile, a transcribed memoir from the 1840s of a former slave of Jefferson’s seems to say pretty clearly that Jefferson did not participate in cockfighting. ""Mr. Jefferson never had nothing to do with horse-racing or cock-fighting,"" former slave Isaac Granger Jefferson dictated to Charles Campbell in Memoirs of a Monticello Slave.  In addition, Jefferson did raise fowl at Monticello, but it is a leap to say that he raised birds for sport. Finally, Jefferson helped write a 1799 law that was meant to deter gambling on activities like cockfighting. Adams, Franklin and other founders The evidence about the other founders is no more convincing. John Adams, who would become the new nation’s second president, has only one known reference to cockfighting -- his lament that young men waste time of the activity, said Amanda Mathews, assistant editor of the Adams papers with the Massachusetts Historical Society. ""While they all probably attended one at some point or another, I don’t think any of the Adamses were ‘involved’ in any way,"" Mathews said in an email, referring to John Adams and his second cousin Samuel Adams. As for Franklin, some claims about his fondness for cockfighting involve his proposal to make the national bird a turkey instead of the familiar bald eagle. Some have taken this as a symbol of his association with cockfighting, but this seems too vague to serve as solid evidence. As for other founders, we will note that in October 1774, the Continental Congress, which would become the United States’ first governing body during the Revolutionary War, signed a resolution that, among other things, discouraged cockfighting. Fifty-seven members of the Congress signed the resolution, including such well-known founders like Jefferson, John Jay and Samuel and John Adams. Our ruling Bevin said that ""many"" of the founding fathers were ""very actively involved"" in cockfighting. In looking at the most prominent founders, we found no indications that any of the founders were avid and frequent participants. We rate the claim False.",[<zip object at 0x0000028096F1D140>],/factchecks/2014/may/01/matt-bevin/were-founding-fathers-active-cockfighters/
"['Oregon', 'Taxes', 'Brian Wilson']","
Was Jules Bailey instrumental in creating Oregon's Business Energy Tax Credit program?
","One tool government has for steering policy is making tax credits and other incentives available to private companies. You want new development in a tired part of the city? Limit property taxes for qualified investors. Want to cap the burning of fossil fuels? Offer tax credits for new solar and wind projects. Such tax breaks remain politically contentious, however, with critics questioning the use of tax dollars to benefit for-profit corporations. The claim: In Portland, Brian Wilson faces Jules Bailey, currently a legislator, in the May 20 primary election for the Multnomah County Board of Commissioners seat vacated by Deborah Kafoury, who is running for board chair.   Wilson, in an April 28, 2014, email to supporters, dinged Bailey for his involvement with the controversial Business Energy Tax Credit, a program that drew withering criticism in recent years for its ballooning costs. The email describes Bailey’s supporters as including ""corporate lobbyists and out-of-state special interest groups."" It adds, ""He was instrumental in creating the Business Energy Tax Credit that let companies like Wal-Mart profit by $11 million while costing the Oregon general fund $33 million."" Really? We decided to check. The analysis:    First, we checked the numbers. Those are accurate, as reported in a story by Harry Esteve, a politics reporter for The Oregonian, in 2009. On the central issue -- Bailey’s role -- we contacted Bailey, who sent an email saying Wilson is in error. ""I think he must have me confused with some other legislator,"" Bailey wrote. ""Since the day I was elected, I have spent every term reining in the abuses of the BETC."" He suggested we call several other sources, including the state Legislature’s Revenue Office, to verify his assertion. Chris Allanach, a senior economist in the Revenue Office, said, yes, the BETC program had been clouded with controversy and that Bailey had played a pivotal role -- not in championing the program, as Wilson claimed, but in reining it in. Bailey sponsored a bill in the 2009 legislative session that affixed sunset dates to all of the program’s tax credits, Allanach said. Bailey also carried the bill, which ultimately passed, on the House floor. Then, during the 2011 session, Bailey co-chaired the Joint Committee on Tax Credits, which carried on the work of the earlier bill, Allanach said. One result of that work means the state now can sell only $3 million in renewable-energy tax credits in any two-year period. Before the new limits, upward of $300 million in credits were being sold per two-year budget cycle. Wanting more information on the history of the program, we called the Oregon Department of Energy. Diana Enright, a department spokeswoman, emailed a chronology showing that the 1979 Legislature created the tax credit incentives that later became the Business Energy Tax Credit program. A sizable expansion of the program occurred in 2007, when the BETC increased from 35 percent to 50 percent for renewable energy projects. From checking Bailey’s legislative website, we know he was first elected in 2008. His first session was 2009. That meant he showed up in Salem 30 years after the program was born and two years after the expansion that triggered most of the controversy. Both of those dates contradict Wilson’s claim that Bailey was ""instrumental in creating"" the program. We called Wilson for his reaction. ""Our using the word ‘created’ probably was an inaccurate choice of words,"" he said. ""But he was very much involved with it once he got to the Legislature. He’s been vociferous in his defense of it."" When asked what constituted Bailey’s ""vociferous"" defense of the BETC, Wilson hedged. ""I was really referring to his umbrella statement that he’s spent his time in Salem closing all sorts of corporate loopholes,"" Wilson said. ""It was more about that than the BETC in particular."" In a follow-up call, PolitiFact Oregon told Wilson of Allanach’s view of Bailey’s work. ""That’s better information than we had,"" Wilson said. Various sources that have been helping his campaign, he added, told him that Bailey was ""vulnerable"" on the BETC issue. ""I never want to put out something that isn’t true,"" he said. ""We will definitely make sure that we correct our information."" The ruling: Brian Wilson, in taking on Jules Bailey in the May 20 Democratic primary, claimed Bailey was ""instrumental"" in creating controversial business tax credits. The program was created long before Bailey was elected, and its expansion to include credits for renewable energy projects occurred two years before Bailey was sworn in. A senior state economist who worked extensively on the program characterized Bailey’s work as ""clamping down"" on the amount of breaks given away. Further, a bill Bailey helped sponsor in his first session, along with a committee he co-chaired in 2011, effectively led to the program’s demise. Wilson, when told that a senior legislative economist backed the notion that Bailey worked to rein in the BETC, said he would amend his claim. Even a modicum of research, however, would have turned up evidence that Bailey had nothing to do with creating the program and that he did, in fact, work over several years to limit it. We rate Wilson’s claim Pants on Fire.",[<zip object at 0x0000028096F60A00>],/factchecks/2014/may/01/brian-wilson/was-jules-bailey-instrumental-creating-oregons-bus/
"['Bankruptcy', 'Candidate Biography', 'Texas', 'Dan Patrick']","
Dan Patrick incorrectly says Pants on Fire slapped on entire David Dewhurst ad
","In TV spots and a voter mailer, state Sen. Dan Patrick declares the Texas Truth-O-Meter found his opponent’s latest TV ad, hammering Patrick’s past financial troubles, to be a lie. That’s curious because we haven’t rated a full ad from anyone lately, including the anti-Patrick ad launched in April 2014 by Lt. Gov. David Dewhurst after Patrick led Dewhurst in the March primary for the Republican lieutenant governor nomination; the two face a May 27 runoff. For this fact check, we’re reviewing a statement in a Patrick campaign mailer brought to our attention by a reader as well as Dewhurst campaign spokeswoman Eliza Vielma. The front side of the mailer shows Dewhurst with his hand half-raised, like a stop sign, and these words in red: ""Bankruptcy, unpaid taxes, tax liens, unpaid debts, lawsuits."" The other side shows a frowning Dewhurst with the word ""lie"" stamped on his forehead next to a depiction of the Politifact Truth-O-Meter, its arrow pointed at our most severe rating, Pants on Fire; flames dance around it. ""David Dewhurst’s latest personal attack is a lie,"" the mailer’s text says. ""Desperate and lagging in the polls, David Dewhurst has resorted to outright lies in an attempt to malign his opponent. He has spent over $1 million on airing a TV ad he knows is a lie. PolitiFact Texas gave the (Dewhurst) television ad a ‘Pants-on-Fire’ rating as an outrageous lie,"" the mailer says. This entire statement is attributed to PolitiFact Texas and it’s dated April 17, 2014. Dewhurst’s ad showed a woman sitting in an armchair suggesting Patrick’s personal bankruptcy, which was filed in the 1980s and resolved in 1992, raises doubts about his being able to run the state honestly.  Key elements included a reporter asking Patrick in a debate about his walking away from over $800,000 in debts in the bankruptcy. The ad also referenced a Sept. 19, 2013, news story in the Dallas Morning News stating Patrick had numerous tax liens filed against him. On April 17, we rated as Pants on Fire another claim in Dewhurst’s ad--that Patrick changed his name to hide his debts. Patrick, who grew up as Dan Goeb, had gone by the name Dan Patrick as a broadcaster since the late 1970s but legally changed his name in 2003 in anticipation of running for public office--more than a decade after his personal bankruptcy case ended. Based on that time gap and an absence of other factual back-up, we found Dewhurst’s name-change statement incorrect and ridiculous. Dewhurst’s ad also said Patrick was caught not paying taxes and pocketed employees’ payroll taxes. On April 28, we rated this claim Half True. Government agencies had filed liens against Patrick for unpaid taxes in the 1980s. But we saw no proof Patrick pocketed employees’ payroll taxes. Logan Spence, Patrick’s campaign manager, stood by Patrick saying we found the entire Dewhurt ad a Pants on Fire lie. PolitiFact Texas ""judged one attack as a pants-on-fire lie and the other attack as only half true,"" Spence said by email. ""On the whole, it is completely accurate to say that the ad is a lie because it intentionally distorts the truth."" Our ruling Patrick said ""PolitiFact Texas gave"" the Dewhurst TV ad ""a ‘Pants-on-Fire’ rating as an outrageous lie."" We didn’t rate the overall ad emphasizing Patrick’s past financial difficulties. Rather, we rated one of its claims Pants on Fire and another claim Half True. We rate Patrick’s statement, which overstates our findings, as Half True. HALF TRUE – The statement is partially accurate but leaves out important details or takes things out of context. Click here for more on the six PolitiFact ratings and how we select facts to check.",[<zip object at 0x0000028097D55040>],/factchecks/2014/may/01/dan-patrick/dan-patrick-tv-ad-incorrectly-says-pants-fire-slap/
