tags,sub_header,text_body,sources,quote_href
"['Abortion', 'Criminal Justice', 'Crime', 'Wisconsin', 'Gwen Moore']","
GOP House members tried to redefine rape, Democratic Rep. Gwen Moore says
","U.S. Rep. Gwen Moore of Wisconsin was among women members of the House who made brief speeches Sept. 4, 2012, at the Democratic National Convention. Moore said she is working to end violence against women, then blasted her Republican colleagues, declaring:

""No victim of domestic violence or bullying -- man or woman -- should feel unprotected in America. Yet when Democrats acted to strengthen the Violence Against Women Act, Republicans in the House moved to weaken it. In other legislation, they have even tried to change the definition of rape.""

Let’s hit the pause button.

Did House Republicans try to redefine what constitutes rape and, as the claim suggests, thus affect what would put a perpetrator in prison?

Definition evolves

We'll begin by noting that the definition of rape has not been constant.

The ""legal definition of rape has evolved over centuries, and clearly, we’re not done fighting over it,"" Stanford University historian Estelle Freedman wrote in The Washington Post a couple of weeks before Moore’s speech. She noted that in the 1980s, for example, states began to outlaw marital rape.

In October 2011, PolitiFact National rated as Half True a claim by Vice President Joe Biden that murder and rape in Flint, Mich., increased after the police force in that city was reduced. Our colleagues noted that the FBI’s definition of rape -- ""the carnal knowledge of a female, forcibly and against her will"" -- was particularly limited when compared to the definition of other law enforcement agencies, in that it excluded male victims and other types of sexual assaults.

Three months later, U.S. Attorney General Eric Holder announced the FBI’s Uniform Crime Reporting definition of rape was being revised to be more inclusive and to better reflect state codes.

Noting that the previous definition of rape had been in place since 1927, he said the new definition is: ""The penetration, no matter how slight, of the vagina or anus with any body part or object, or oral penetration by a sex organ of another person, without the consent of the victim.""

Moore’s claim

To back Moore’s claim, Moore spokeswoman Nicole Williams cited two pieces of legislation relating to federal funding for abortions.

So, although Moore’s statement was broad -- House Republicans ""tried to change the definition of rape"" -- what she cites as evidence is much narrower, having to do with how rape is defined when federal money is used to pay for abortions.

1. No Taxpayer Funding for Abortion Act

Williams cited an August 2012 article in Mother Jones, a liberal magazine, on legislation regarding federal funding of abortions in cases of rape. The article said the bill was co-sponsored by U.S. Rep. Paul Ryan of Wisconsin, Republican Mitt Romney’s vice-presidential running mate, and GOP U.S. Rep. Todd Akin of Missouri.

(Akin, a U.S. Senate candidate, was denounced for saying in August 2012 that pregnancies are rare in cases of ""legitimate rape."" He apologized but resisted calls to drop out of the race.)

Ryan and Akin were among the co-sponsors of the legislation, which would have limited federal funding of abortions to victims of ""forcible"" rape and certain other circumstances, PolitiFact New Jersey found in rating a claim by New Jersey Democratic Party chairman John Wisniewski as True.

PolitiFact New Jersey found that the legislation, sponsored by Rep. Chris Smith, R-New Jersey, was first introduced in July 2010. With Democrats controlling the House, the bill didn't move forward.

In January 2011, after Republicans won a majority in the House, Smith reintroduced the legislation. Ryan and Akin -- along with 225 other mostly Republican House members -- again co-sponsored it. The Boston Globe reported that the bill narrowed an exemption to the Hyde Amendment, which allows federal dollars to be used for abortions in cases of rape and incest. Smith’s bill would have limited the incest exemption to minors and covered only victims of ""forcible rape.""

House Republicans never defined what constituted ""forcible rape"" and what did not, the Globe said, but the term ""forcible rape"" ignited an outcry among various critics, who said the phrase would exclude victims rapes involving drugs and victims of statutory rape. Statutory rape occurs when an individual, regardless of age, has consensual sexual relations with an individual not old enough to legally consent.

Smith dropped the forcible rape term from the bill. The revised bill passed the House, but the Democrat-controlled Senate never voted on it.

When Ryan was asked by Fox News in August 2012 about why he sought the forcible rape language, he said the bills were aimed at stopping taxpayer funding of abortion and that ""forcible rape"" was ""stock language"" used in various bills. He said he agreed with it being removed from the legislation he supported, but didn’t elaborate on what he meant by stock language.

Among those coming to Ryan’s defense was The Weekly Standard, a conservative magazine. It noted, as other media have, that the intent of the word forcible was to prevent taxpayer-funding of abortions in the case of statutory rape, such as when a 16-year-old and a 19-year-old have consensual sex.

PolitiFact Texas reached a similar conclusion in September 2012 when it rated as Half True a claim by a pro-Democratic political action committee that Ryan, Akin and Texas House Republicans backed a bill to distinguish between rape and forcible rape. According to the text of the 2010 and 2011 bills and numerous news stories, our colleagues said, ""the main purpose of the legislation was not redefining rape but limiting the use of federal funds to pay for abortion.""

2. Protect Life Act

Moore’s spokeswoman also cited the Protect Life Act, saying it also would have restricted to forcible rape the exceptions for when federal funding can be used for abortions.

The January 2011 bill, which passed the House but didn’t become law, would have amended President Barack Obama’s health care reform law to prevent federal payment to health plans that include abortion coverage, according to PolitiFact National.

Our rating

Moore said House Republicans ""tried to change the definition of rape.""

Her statement contains an element of truth, in that GOP members sought to change when federal money for abortions could be used in cases of rape, by using the term ""forcible rape.""

But the claim ignores critical facts that would give a different impression -- the House Republicans’ effort was not to change the definition of rape, per se, but rather to restrict the use of federal funds in abortions.

We rate Moore’s statement Mostly False.",[<zip object at 0x00000280972DACC0>],/factchecks/2012/sep/06/gwen-moore/gop-house-members-tried-redefine-rape-democratic-r/
"['National', 'Federal Budget', 'Medicare', 'Bill Clinton']","
Clinton says Ryan attacked Obama for Medicare cuts reflected in Ryan's own budget
","
Bill Clinton used his nominating address at the Democratic National Convention to respond to the Republican critiques leveled at President Barack Obama during the GOP’s Tampa convention. But there was one attack in particular, he said, that ""takes some brass.""

""When Congressman (Paul) Ryan looked into that TV camera and attacked President Obama's Medicare savings as, quote, the ‘biggest coldest power play,’ I didn't know whether to laugh or cry,"" Clinton said in his Sept. 5, 2012, speech in Charlotte, N.C. ""Because, that $716 billion is exactly, to the dollar, the same amount of Medicare savings that he had in his own budget.

""You gotta give one thing, it takes some brass to attack a guy for doing what you did.""

Today, Medicare operates as a government-run health insurance plan for Americans over age 65. Ryan, the Republican nominee for vice president, is the head of the House Budget Committee and the architect of a plan to dramatically restructure Medicare. His idea is to eventually move Medicare toward private insurance companies by giving people a set amount to buy their own health insurance plans.

The new system would be for people who are under age 55 now, and it would give them voucher-like credits to buy traditional fee-for-service Medicare or competing private insurance plans. (The credits are sometimes called ""premium support."")

The Republican response to attacks on the Ryan plan has been to attack back, saying President Barack Obama has cut ""$700 billion"" out of Medicare. And the Democratic response to that: Well, Ryan’s plan cuts that amount, too!

For this check, we’re looking at Clinton’s claim that Ryan attacked the president for ""the same amount of Medicare savings that (Ryan) had in his own budget.""

We recently checked a similar claim from Obama campaign spokeswoman Stephanie Cutter that ""Paul Ryan protected those cuts in his budget."" We’re applying what we learned to Clinton’s remark.

$700 billion in Medicare cuts?

There are cuts and then there are CUTS. Neither Obama nor his health care law literally ""cut"" a dollar from the Medicare program’s budget.

Rather, the health care law instituted a number of changes to reduce the growth of Medicare costs. At the time the law was passed, those reductions amounted to $500 billion over the next 10 years. Time’s passage has only boosted that number.

What kind of spending reductions are we talking about? They were mainly aimed at insurance companies and hospitals, not beneficiaries. The law makes significant reductions to Medicare Advantage, a subset of Medicare plans run by private insurers. Medicare Advantage was started under President George W. Bush, and the idea was that competition among the private insurers would reduce costs. But in recent years the plans have actually cost more than traditional Medicare. So the health care law scales back the payments to private insurers.

Hospitals, too, will be paid less if they have too many re-admissions, or if they fail to meet other new benchmarks for patient care.

Still, the overall Medicare budget is projected to go up for the foreseeable future. The health care law tries to limit that growth, making it less than it would have been without the law, but not reducing its overall budget. So claims that Obama would ""cut"" Medicare need more explanation to be fully accurate. In the past, we’ve rated similar statements Half True or Mostly False, depending on the wording and context.

Because Medicare spending gets bigger every year, the cost-saving mechanisms in the health care law also get bigger. Also, it takes a few years for the health care law’s savings mechanisms to kick in. In fact, the effects of time are the main reason the $500 billion number has turned into $700 billion.

The Congressional Budget Office, the nonpartisan agency with expert staff that generates projections about how laws affect the federal budget and economy, determined in 2011 that the federal health care law would reduce Medicare outlays by $507 billion between 2012 and 2021. In a more recent estimate released this year, the CBO looked at the years 2013 to 2022 and determined the health care law affected Medicare outlays by $716 billion.

Does the Ryan budget include the same savings as the health care law?

Now onto our second question: Does Ryan’s budget include those same reductions in Medicare spending? The short answer is yes.

Here’s what Ryan said in an interview with George Stephanopolous of ABC News in June, before his selection as Republican nominee Mitt Romney’s running mate:

Stephanopoulos: ""You know, several independent fact-checkers have taken a look at that claim, the $500 billion in Medicare cuts, and said that it's misleading. And in fact, by that accounting, your budget, your own budget, which Gov. Romney has endorsed, would also have $500 billion in Medicare cuts.""

Ryan: ""Well, our budget keeps that money for Medicare to extend its solvency. What Obamacare does is it takes that money from Medicare to spend on Obamacare. ..."" (Read the full exchange.)

So Ryan confirmed his budget includes the Medicare savings.

The Romney campaign got questions on this point the day after Cutter’s remarks that ""Paul Ryan protected those cuts in his budget,"" and issued a statement saying that Romney intended to fully repeal the federal law, including the savings for Medicare.

""Mitt Romney and Paul Ryan have always been fully committed to repealing Obamacare, ending President Obama’s $716 billion raid on Medicare, and tackling the serious fiscal challenges our country faces,"" said Lanhee Chen, Romney’s policy director, in a statement reported by NBC News. ""A Romney-Ryan administration will restore the funding to Medicare, ensure that no changes are made to the program for those 55 or older, and implement the reforms that they have proposed to strengthen it for future generations.""

Cutter, though, was talking about the Ryan budget, as was Clinton. We should point out that the Ryan budget is a congressional resolution that doesn’t have the force of law. And its plan for Medicare hasn’t been turned into legislation that could be analyzed in detail by the CBO.

Still, Ryan himself said his plan did include the same reductions in future spending that were part of the federal health care law. He explained a few days after Cutter’s remarks that it was only because Obama’s reduction ""was already in the baseline,"" the Wall Street Journal reported. ""We would never have done it in the first place."" The article points out, however, that the budget assumed reversal of other Obama spending decisions.

So it was a choice to leave the reductions in place, likely because both sides agree on one point: Medicare spending is growing too rapidly, and it needs to reined in.

Our ruling

Clinton said that Ryan attacked the president for  ""the same amount of Medicare savings that (Ryan) had in his own budget."" Clinton is correct that the Ryan budget plan included cost savings that were part of the health care law. Just recently, the Romney campaign backed away from that plan, saying Romney’s plan would restore the spending that the health law is set to curtail, such as extra funding for private insurers under the Medicare Advantage plan.

Still, Clinton was right about the Ryan plan. We rate his statement True.",[<zip object at 0x00000280972E33C0>],/factchecks/2012/sep/06/bill-clinton/clinton-says-ryan-attacked-obama-medicare-cuts-ref/
"['Abortion', 'Candidate Biography', 'Taxes', 'Florida', 'Guns', 'George LeMieux']","
Charlie Crist was pro-life, pro-gun and anti-tax, says George LeMieux
","
After former Florida Gov. Charlie Crist endorsed President Barack Obama and secured a speaking spot at the Democratic National Convention, Republicans pulled out the Crist files to highlight how much the Republican-turned-independent Crist had changed in just four years.

George LeMieux, a Republican and a former Crist chief of staff, wrote a biting op-ed about Crist’s former stances.

""He never met a tax increase he liked. ... The Charlie Crist I knew idolized Ronald Reagan and embraced Reagan's view of limited government. He was pro-life, pro-gun and vehemently anti-tax. He believed big government was the enemy of success, and that when government taxed it took ‘your money.’""

In this fact-check we will explore whether Crist was ""pro-life, pro-gun and vehemently anti-tax.""

First, we will note what Crist said of himself in February 2010: ""I am pro-life, I’m pro-gun, I’m pro-family and I’m anti-tax. And I always have been."" He made those claims at a Christian Family Coalition breakfast while running for U.S. Senate as a Republican. He would ditch the GOP label for no-party about two months later as he was struggling in his primary bid against Marco Rubio.

 ""Pro-life""

Crist’s stance on abortion over his political career is too complex to boil down to a sound bite -- even if Crist tried to do that himself at times.

When he was running for the U.S. Senate in 1998, Crist said in a questionnaire for the Tampa Bay Times that he was pro-choice, but not pro-abortion. ""I believe that a woman has the right to choose, but would prefer only after careful consideration and consultation with her family, her physician and her clergy; not her government,"" he said. Crist said in a debate during that campaign that he would not support a constitutional ban on abortion.

In 2006, when he was running for governor, Crist said he was pro-life. But he would not support repealing Roe vs. Wade and opposed a 24-hour waiting period. ""I don't think that politicians ought to put themselves in the place of physicians, and I think it's very important to respect the medical profession,"" said Crist, whose father is a doctor.

In 2010, as a Republican U.S. Senate candidate, Crist said he would ""fight for pro-life legislative efforts.""

But later in 2010, after leaving the Republican Party, Crist vetoed a bill that would have required women seeking abortions to get an ultrasound. He said he found the requirement that women pay for the procedure ""punitive"" and that the measure was ""almost mean spirited.""

 ""Pro-gun""

When Crist was running for U.S. Senate in 2010, we reviewed a claim that he ""never wavered in his support of the Second Amendment, the right to bear arms."" We ruled that claim True and will briefly review what we found for that article.

In one of his first high-profile gun battles, then-state senator Crist blasted Gov. Lawton Chiles' last-minute effort to require criminal background checks and a waiting period for purchases made at gun shows in 1998. The legislation proposal died.

As attorney general, Crist nominated Marion P. Hammer, former president of the National Rifle Association, to the Florida Women's Hall of Fame, and she was inducted in 2004. Hammer is also the longtime president of the state’s NRA affiliate Unified Sportsmen of Florida.

In his 2006 primary against Republican rival Tom Gallagher, Crist ran an ad calling Gallagher ""anti-gun"" and highlighting Crist’s endorsement from the NRA. As governor, Crist signed into law legislation that allowed 500,000 concealed weapons permit-holders to bring their guns to work as long as the weapons remained in their vehicles.

""Anti-tax""

To examine Crist’s actions about taxes, we reviewed multiple reports from Florida TaxWatch and newspaper articles. We also interviewed staff at Florida TaxWatch as well as Amy Baker, the state’s chief economist. Here are some highlights from his tenure as governor:

2007: Crist repeatedly promised Floridians that their taxes would ""drop like a rock."" Crist and the Legislature attempted to deliver that through a question put to voters, Amendment 1, which increased the homestead property tax exemption. Voters approved it in January 2008.

Kurt Wenner, vice president of tax research at Florida TaxWatch, said that taxes didn’t really drop like a rock but ""there was some reduction in them."" But much of that happened due to the decline in property values.

In his first proposed budget in 2007, Crist called for continuing sales tax holidays and reducing the communications services tax.

2008: Crist’s budget proposal suggested dealing with a drop in revenues by using reserves and trust funds. He recommended two more sales tax holidays, one for hurricane
preparedness and one for back-to-school, a savings to taxpayers of $36 million.

2009: Crist’s budget didn’t call for general tax hikes, but he did ultimately support a $1 a pack cigarette tax hike and surcharge on other tobacco products. That tax hike added up to about $1 billion a year, said Dominic Calabro, president of Florida TaxWatch.

Crist also signed a budget that included new fees including a package of increased and new Highway Safety Fees for about $1 billion in recurring dollars.

The Miami Herald quoted Crist as saying: ""The cigarette tax is appropriate and I really view it more as a health issue than I do as a tax issue.''

If Crist had vetoed the cigarette tax, the state would have lost nearly $2 billion in federal Medicaid matching funds.

The Tampa Bay Times wrote that Crist would call taxes the ""T-word"" as if it was an obscenity but would warm up if called a ""user fee.""

2010: TaxWatch wrote that Crist’s budget proposal in January 2010 called for $2.7 billion in increased spending and $100 million in tax cuts by relying on federal money, Seminole gambling Compact and raiding trust funds.

Calabro said that Crist could have done more to reign in spending during his tenure.

But Wenner said that ""generally throughout his career (Crist) was in favor of reducing taxes for the average Floridian.""

Our ruling

LeMieux said that Gov. Charlie Crist ""was pro-life, pro-gun and vehemently anti-tax."" Crist did describe himself in similar language in 2010 while he was still a Republican and running for U.S. Senate. And we agree that he was consistently for gun rights.

His record on abortion was more mixed. At different times, he called himself ""pro-life"" and he called himself ""pro-choice."" And even when he called himself ""pro-life"" in 2006, he said he would not support overturning Roe vs. Wade. In 2010, he earned cheers from abortion rights supporters when he vetoed a bill that would force women who are getting abortions to undergo an ultrasound.

Crist portrayed himself as anti-tax and generally avoided tax increases, although he did support the cigarette tax hike and other increases in fees.

On the whole, we rate this claim Mostly True. 
PolitiFact Florida is partnering with 10 News for the election. See video fact-checks here.",[<zip object at 0x00000280972CF7C0>],/factchecks/2012/sep/06/george-lemieux/charlie-crist-was-pro-life-pro-gun-and-anti-tax-sa/
"['National', 'Economy', 'Jobs', 'Bill Clinton']","
Bill Clinton says 4.5 million jobs have been created under Barack Obama
","
During his speech to the Democratic National Convention in Charlotte, N.C., former President Bill Clinton repeated a talking point often used by Democrats to tout President Barack Obama’s record on job creation.

""In the last 29 months,"" Clinton said, ""our economy has produced about 4.5 million private-sector jobs.""

But Clinton is cherry-picking the numbers to paint Obama’s record in the most favorable light. Other methods show less impressive growth in jobs -- even declines.

First of all, Clinton was using private-sector job figures, not total job figures. Right off the bat, that paints Obama’s numbers favorably, since government jobs have declined during much of Obama’s term. If you count from the start of Obama’s term, private-sector jobs have increased by 332,000, but total jobs have decreased by 316,000 due to losses of government jobs.

Since this time frame includes the start of Obama’s term -- when the economy was in free fall and before Obama’s policies had time to take effect -- we don’t think this is the best way to measure it.

The way Clinton did it is another way to count it. Clinton started counting from the low point of jobs in February 2010. Using this method, private-sector jobs increased by about 4.5 million.

However, starting the count at the low point is a bit of cherry-picking.

If you instead start at the official end of the recession in June 2009, private-sector jobs increased by 3.4 million. That’s well below Clinton’s 4.5 million figure.

We realize that speakers at political conventions are going to put the best gloss on the numbers they have available, so it’s not surprising that Clinton would use the 4.5 million figure. But getting to 4.5 million requires starting the count at the most favorable point possible for Obama.

In addition, as we’ve written previously, presidents are not the only factor in job creation. The national, and world, economies are too big for any one person to control. So crediting Obama’s policies is at best partially correct because there are so many other factors -- such as policies of the Federal Reserve, the willingness of banks to lend money, and global business trends -- that play a role.

Our ruling

While it’s true that by most measures, the number of jobs in the United States has increased on Obama’s watch, Clinton has done some cherry-picking in coming up with the 4.5 million number. But he chose his words carefully in describing the jobs picture. He said, ""In the last 29 months, our economy has produced about 4.5 million private-sector jobs."" On balance, we rate the claim Mostly True.",[<zip object at 0x0000028097C10E80>],/factchecks/2012/sep/06/bill-clinton/bill-clinton-says-45-million-jobs-have-been-create/
