tags,sub_header,text_body,sources,quote_href
"['National', 'LGBTQ', 'Marriage', 'J.D. Hayworth']","
J.D. Hayworth claims Massachusetts ruling opens the door for man-horse marriage
","J.D. Hayworth, the former congressman running against Sen. John McCain in the Arizona Republican primary, was known for making provocative points as a conservative radio talk show host. He's proving every bit as provocative on the campaign trail. In an interview on radio station WORL in Orlando on March 14, 2010, Hayworth was talking about same-sex marriage. He's very much against it. But it was his comments about the prospect of someone walking down the aisle in Massachusetts with a horse that landed Hayworth in the national political news cycle. Let's get the full quote straight from the horse's mouth: ""You see, the Massachusetts Supreme Court, when it started this move toward same-sex marriage, actually defined marriage -- now get this -- it defined marriage as simply, quote, the establishment of intimacy,"" Hayworth said. ""Now how dangerous is that? I mean, I don't mean to be absurd about it, but I guess I can make the point of absurdity with an absurd point -- I guess that would mean if you really had affection for your horse, I guess you could marry your horse. It's just the wrong way to go, and the only way to protect the institution of marriage is with that federal marriage amendment that I support."" Whoa there. Really? Hayworth is talking about a landmark 2003 case in which the Massachusetts Supreme Court ruled, 4-3, that gay couples have the right to marry under the state's Constitution. We took a long look at the 45-page decision in the case, Goodridge vs. the Department of Public Health. Since Hayworth suggested that he was quoting the phrase ""the establishment of intimacy,"" we searched for that first. It's not there. The word ""intimacy"" appears five times in the 45-page decision (actually six times, but one is a duplicate), but never in the context of being the sole definition of marriage. Here they are: * One section talks about how the Supreme Court has affirmed that ""the core concept of common human dignity protected by the Fourteenth Amendment to the United States Constitution precludes government intrusion into the deeply personal realms of consensual adult expressions of intimacy and one's choice of an intimate partner."" * ""Marriage also bestows enormous private and social advantages on those who choose to marry. Civil marriage is at once a deeply personal commitment to another human being and a highly public celebration of the ideals of mutuality, companionship, intimacy, fidelity, and family."" * ""Whether and whom to marry, how to express sexual intimacy, and whether and how to establish a family -- these are among the most basic of every individual's liberty and due process rights."" * ""Our laws of civil marriage do not privilege procreative heterosexual intercourse between married people above every other form of adult intimacy and every other means of creating a family."" * ""Similarly, the Supreme Court has called for increased due process protection when individual privacy and intimacy are threatened by unnecessary government imposition."" We're not sure how Hayworth gets from any of these to the court defining marriage as simply the establishment of intimacy. Chief Justice Margaret H. Marshall of the state's Supreme Judicial Court began the ruling with these words: ""Marriage is a vital social institution. The exclusive commitment of two individuals to each other nurtures love and mutual support; it brings stability to our society. For those who choose to marry, and for their children, marriage provides an abundance of legal, financial, and social benefits. In return it imposes weighty legal, financial, and social obligations. The question before us is whether, consistent with the Massachusetts Constitution, the Commonwealth may deny the protections, benefits, and obligations conferred by civil marriage to two individuals of the same sex who wish to marry. We conclude that it may not. ""We are mindful that our decision marks a change in the history of our marriage law,"" Marshall wrote. ""Many people hold deep-seated religious, moral, and ethical convictions that marriage should be limited to the union of one man and one woman, and that homosexual conduct is immoral. Many hold equally strong religious, moral, and ethical convictions that same-sex couples are entitled to be married, and that homosexual persons should be treated no differently than their heterosexual neighbors. Neither view answers the question before us. Our concern is with the Massachusetts Constitution as a charter of governance for every person properly within its reach."" We italicized ""person"" to make a point. Justice John Greaney, who concurred, wrote in the ruling, ""We construe civil marriage to mean the voluntary union of two persons as spouses, to the exclusion of all others."" Again the word ""persons."" Moreover, Greaney noted that the ruling was strictly about whether people of the same sex could marry and ""it leaves intact the Legislature's broad discretion to regulate marriage."" Take a look at Massachusetts laws regarding who can marry (which includes age and residency requirements and prohibitions on marrying relatives) and you'll see the word ""persons"" over and over. Seems pretty straightforward to us, but we checked with a few legal experts in Massachusetts to get their take. ""The word 'establishment' doesn't occur in the opinion, and the six appearances of the word 'intimacy' aren't free-standing, so that the statement that the SJC 'defined' marriage 'simply' as 'the establishment of intimacy' is false,"" said Mark Tushnet a law professor at Harvard Law School. ""That's not to say that one couldn't extend the underlying principles articulated in Goodridge to other forms of intimacy, including, I suppose, bestiality, but there's nothing in Goodridge itself saying that the principles extend that far. And of course one need not extend the principles if there's some reason not to do so, as there surely would be in the case of bestiality."" Carissa Cunningham, director of public affairs for Gay and Lesbian Advocates and Defenders, which handled the Goodridge case, called Hayworth's comment ""silly."" ""It's so far off base,"" Cunningham said. The ruling, she said, ""didn't change anything there about the marriage law in Massachusetts,"" which very clearly spells out that marriage is only for people. We might have chalked this one up to a one-time misstatement, a bit of hyperbole on the long campaign trail, and simply rated it False. But then Hayworth went on The Rachel Maddow Show on MSNBC on March 15, 2010, and doubled down. Here's how that went: Maddow: ""Where does the establishment of intimacy thing come from? Where in Massachusetts law or in the Supreme Court ruling does it say the establishment of intimacy?"" Maddow said she had spent the afternoon looking for it, but couldn't find it anywhere. Hayworth: ""As we went back and reviewed that document back when the argument was made, the high court in Massachusetts defined marriage in a rather amorphous fashion, simply as quote, the establishment of intimacy. Now I think we all agree there's much more to marriage than that."" Maddow: ""Sir, I'm sorry, it didn't."" Hayworth: ""Okay, you and I have a disagreement."" Maddow then cited several uses of the word ""intimacy"" in the Supreme Court ruling. Maddow: ""The establishment of intimacy as the definition of marriage, it's just not there, let alone the horse thing. What you said about the establishment of intimacy being the definition of marriage in Massachusetts, I don't think it's true, sir."" Hayworth: ""Well, that's fine. You and I can have a disagreement about that."" Maddow: ""Well, it either is true or it isn't, it’s empirical."" Hayworth: ""I appreciate the fact that we have a disagreement on that."" We're with Maddow here. This isn't a matter of legal interpretation. The Massachusetts Supreme Court did not define marriage ""simply as quote, the establishment of intimacy."" And when Hayworth inserts the word ""quote,"" the expectation is that he's directly quoting the phrase ""establishment of intimacy"" from the ruling. He's not. The ruling doesn't contain that phrase. Hayworth prefaced his statement by saying he was making an absurd point. We'll give him that. It's absurd, all right. It's also wrong. We give this one a, quote, Pants on Fire!",[<zip object at 0x0000028097D04340>],/factchecks/2010/mar/18/jd-hayworth/jd-hayworth-claims-massachusetts-ruling-opens-door/
"['Florida', 'Alex Sink']","
Sink claims she refunded $1.2 million from an insurance fraud scam
","CFO Alex Sink, a Democrat running for governor, is appealing to Florida’s elderly by putting the spotlight on a two-year crackdown on an investment scam and refund to a Delray Beach woman. Sink wrote about the episode in a fundraising e-mail to supporters. ""As Florida’s CFO, I shut down [Larry] Krakow's scam and refunded more than $1.2 million to Josephine [Passinissi] and other victims of this con man,'' she said in an e-mail addressed to ""Dear Friend."" It said: ""Please contribute $25, or whatever you can, right now to help me keep fighting for Floridians like Josephine."" Sink’s e-mail contains several claims, but we're focusing on two: Whether the CFO's office shut down the investment ""scam"" and whether it returned $1.2 million to Passinissi and the others.Sink has been claiming credit for the crackdown and using it to promote her Safeguard Our Seniors Task Force since her office put out a release on Sept. 28, 2009, under the headline ""CFO Sink Returns $1.2 Million to Delray Beach Seniors Scammed out of Life Savings.""The Miami Herald wrote a brief item about the episode at the time that called it insurance fraud and likewise characterized it as Sink returning $1.2 million to four Delray Beach seniors ""after they were allegedly misled into buying equity indexed deferred annuities."" It said Larry Yale Krakow, who sold the investment products to them, was suspended from selling insurance and was ordered to pay a $25,000 fine.A deferred annuity is an investment product packaged with an insurance policy, in which an insurance company guarantees an income stream to the investor starting at a specified future date in return for a lump sum or series of payments. But the products are usually considered inappropriate for seniors because they tie up needed income.The Herald noted that annuities scams involving seniors have been a growing problem in Florida. And that the Department of Financial Services launched 267 senior annuity investigations in the fiscal year ending June 30.Kevin Cate, Sink's press secretary at the Florida Department of Financial Services, provided us with links to the Florida statutes that illustrate the CFO's authority on the topic. The law also notes the rights of victims not to be identified. He faxed us the 2008 and 2009 settlement agreements that resolved four citizens' complaints against the Allianz insurance company, which Krakow purportedly represented, brought by the Florida Department of Insurance Division of Legal Services. Each had the seniors' identities redacted, but a summary page showed the range in reimbursements. The smallest was $19,319.27, while the largest was for one investor with nine annuities valued at $932,837.09.His summary page also noted that, with subsequent settlements, the figure was more than $1.5 million, which was slightly higher than Sink had said. Sink’s office handled the case through its Division of Insurance Fraud, which is part of the Department of Financial Services.Reached by telephone, Passinissi confirmed the refund. She said her share of it was $270,000. A former owner of a private employment agency, Passinissi, 74, said she tried to get her money out of the annuity in 2008 by contacting the insurance firm itself -- to no avail. She mentioned her plight to a banker she knew, who sent her to Sink. Passinissi said she called and then wrote Sink directly -- and enclosed documents to illustrate the problem.Passinissi is happy to see Sink take credit.""She wrote to me way, way back and I remember I was very impressed. She said, 'Don’t worry we’ll get to the bottom of it.' After that she sent a person to get a deposition from me, to get the facts,"" Passinissi said.As CFO, Sink oversees the Department of Financial Services, which investigated the complaints and arranged for people such as Passinissi to recoup their money. Sink's claim actually understates the amount that was recouped (she said $1.2 million when it ultimately totaled $1.5 million), but we find she can rightly claim credit for the department's work.So we rate Sink’s claim to be True.",[<zip object at 0x000002809797B540>],/factchecks/2010/mar/18/alex-sink/sink-claims-she-refunded-12-million-insurance-frau/
"['National', 'Health Care', 'Cliff Stearns']","
Stearns says House Democrats trample procedures in health care vote
","Ever heard of ""deem and pass""?It may sound like a football play, but it's actually House Speaker Nancy Pelosi's favored procedural maneuver to pass health care reform in the lower chamber.Such legislative gymnastics have Republicans up in arms, including Florida Rep. Cliff Stearns, who lamented the tactic on the House floor.""There is no precedent for what the Democrats are doing with this deception,"" he said on March 15, 2010. ""We have never written a reconciliation bill to amend a law that does not exist.""Stearns is talking about a series of procedural tools that House and Senate Democrats plan to use to pass their health care overhaul. He and his fellow Republicans say the unprecedented move flouts congressional rules and may even be unconstitutional. We'll leave questions of unconstitutionality to the lawyers. For this fact-check, we're going to look at whether Stearns is correct that there is no precedent for the Democrats' efforts and that Congress has ""never written a reconciliation bill to amend a law that does not exist.""But before we can decide if he's correct, here are some essentials for understanding the arcane world of congressional procedure. Listen up, because you're going to be hearing these terms thrown around a lot as Congress gears up for a showdown on the health care overhaul. Reconciliation: Bills considered under this procedure cannot be filibustered; they only need a simple majority to pass. Reconciliation was created as part of the 1974 Congressional Budget Act in an effort to make it easier to bring revenues and spending in line with caps set by the annual budget resolution. While the founders of the procedure did not envision it as a way to fast-track policy legislation, Congress has nevertheless used it to pass non-budget-related measures, including welfare reform in 1996 and changes to Medicare and Medicaid. ""Deem and Pass:"" This phrase refers to a House tactic that allows it to pass a bill without actually having a roll call vote on the legislation; it is technically known as a ""self-executing rule."" Here's how it works: The House Rules Committee is in charge of writing rules -- a playbook of sorts -- for floor debate. The rule dictates what amendments can be offered to a given bill and how long the bill will be debated, for example. A self-executing rule is essentially a two-for-one special; when the House votes to adopt a self-executing rule, it simultaneously adopts a separate bill or amendment, which is specified in the rule itself. In short, the House ""deems"" another bill to be passed as soon as it adopts the rule. The House and Senate have both passed versions of the health care bill. There are big differences between the two, so typically the two chambers would pick a handful of lawmakers to hash out those discrepancies in something called a conference committee. Then, the House and Senate would vote once again on the final product, called a conference report. But Senate Democrats lost their 60-vote, filibuster-proof majority in January 2010, when Republican Sen. Scott Brown won a special election in Massachusetts. That means Senate Republicans could effectively block a conference report. Complicating the process is the fact that a number of House Democrats don't like the Senate bill. Among other things, they oppose a tax on Cadillac insurance plans and a special Medicare perk for Nebraska.So, where does that leave the Democrats? With one seriously complicated strategy to pass health care reform. Here's how the whole thing could go down: The Rules Committee will cobble together a self-executing rule for the House to consider the package of reconciliation fixes to the Senate bill -- for example, the elimination of special Medicaid subsidies for patients in Nebraska and other states -- but that also includes language that ""deems"" the Senate bill passed once the House adopts the rule. Meanwhile, the Senate parliamentarian has said that the Senate bill must be signed by the president before any of the House changes can be made. So, presumably, President Barack Obama will put his stamp of approval on the bill as soon as the House deems it passed. Then, the Senate will debate the package of reconciliation fixes already passed by the House. The package of fixes will only need a simple majority to pass, but there's still plenty that could derail the package. The tactic serves two purposes: It prevents House Democrats who don't like the Senate bill from ever having to vote on it, and it potentially solves the problem of making changes to the Senate bill without needing 60 votes to pass them. Republicans are calling foul. They say the Democratic strategy is unfair and potentially unconstitutional.""What's really remarkable about this whole business is that not only the American people rejected this plan but Democrats are so desperate to pass it that they're willing to trample on the traditional rules of the House and Senate and even trample on the Constitution of the United States to get it done,"" said Indiana Republican Mike Pence. But is it unprecedented as Stearns claims? In fact, self-executing rules are relatively common in the House. For instance, the chamber employed the procedure on Feb. 3, 2010, to adopt a Senate amendment to a resolution concerning increasing the statutory limit on federal debt. The procedure was used 36 times by the House Republican leadership between 2005 and 2006 and 49 times by the Democratic leadership between 2007 and 2008, according to Brookings Institution congressional scholar Thomas Mann, writing for Politico. Furthermore, the reconciliation process has been used over and over again for policy-related measures. For instance, in 1996 Congress used reconciliation to make big changes to welfare, including separating it from Medicaid. Norm Ornstein, another leading congressional scholar with the conservative American Enterprise Institute, pointed out that the Republicans used a very similar tactic to what the Democrats are now proposing in 2006. At the time, they used a self-executing rule to pass $38.8 billion in budget cuts without having to vote on an immigration measure.So, there's a whole lot of precedent for the individual tactics Democrats are proposing to use, though the specific combination of a self-executing rule and reconciliation is a bit unusual, said Jim Horney, a budget expert at the left-leaning Center for Budget and Policy Priorities. ""There's nothing about [the process] that's dramatically at odds with the way things get done,"" Horney said. ""With almost every bill, you can find some way in which the circumstances are a little different. But to imply that it's somehow a big departure from the way things are done could be wrong.""Donald Wolfensberger served on the House Rules Committee for more than a decade, and was around when reconciliation was first used. He continues to follow Congress closely as director of the Congress Project at the Woodrow Wilson International Center for Scholars, and agrees with Horney and the other congressional experts we spoke with that there's precedent, but not for this specific tack.The 2006 instance mentioned by Ornstein is ""the closest analogy"" to what the Democrats are now proposing. ""It would be pretty similar,"" he said. Wolfensberger also said it's the first time he's seen Congress write a ""a reconciliation bill to amend a law that does not exist,"" as Stearns said. On that point, Stearns is correct, he said; the president will not have signed the Senate bill before the House passes the package of fixes. So, that brings us back to Stearns' original claim. While the combination of a self-executing rule and reconciliation is a relatively novel combination of procedural tools, all the congressional experts we spoke with agreed that there are plenty of similar examples of what the Democrats are proposing to do, nor is the party flouting procedures that are already on the books. As a result, the first part of Stearns's claim is somewhat misleading. However, Stearns is correct that this is the first time Congress has ever written a reconciliation bill to amend a law that does not exist. As a result, we find Stearns' claim to be Half True.",[<zip object at 0x00000280979D5880>],/factchecks/2010/mar/17/cliff-stearns/stearns-says-house-democrats-trample-procedures-he/
