tags,sub_header,text_body,quote_href
"['New Jersey', 'Jobs', 'Chris Christie']","
Chris Christie claims New Jersey has reduced the number of state employees without any layoffs to below the level when Christie Whitman resigned
","
A fresh batch of labor statistics is sending a recycled claim from Gov. Chris Christie to the bottom end of the Truth-O-Meter.

The Republican governor last week repeated a claim about how there are fewer ""state government"" employees now than when former Gov. Christine Todd Whitman resigned in January 2001.

Better yet, the state accomplished that reduction ""without any layoffs,"" Christie said.

""New Jersey today has fewer employees in state government than it had when Christie Whitman left office in January of 2001, and I think that’s good,"" Christie said in a July 9 appearance at the Brookings Institution, a Washington, D.C.-based think tank. ""And we did it without any layoffs. We did it through attrition.""

PolitiFact New Jersey issued a True ruling in December on Christie’s claim about how state government has fewer employees than when Whitman resigned.

But when we looked at recent data from the U.S. Bureau of Labor Statistics, we found that the governor’s statement is no longer accurate. Christie’s claim about there being no layoffs is wrong too, because his representatives previously cited hundreds of layoffs during his tenure.

First, let’s explain what’s changed since our True ruling.

At the time of that ruling, the latest numbers were preliminary estimates for November 2011, showing 137,800 ""state government"" workers. That figure represented 600 fewer employees than the 138,400 state workers in January 2001.

But the November figures have since been revised to show 144,300 workers in that month, exceeding the estimate from January 2001. Every month since November also has shown a greater number of employees than when Whitman resigned.

When Christie repeated the claim last week, the latest figures were preliminary estimates for May 2012, when there were 146,100 state government employees. That represents a 7,700 increase, or nearly 5.6 percent, over Whitman’s final month.

Those statistics are seasonally adjusted and include workers in state departments; the legislative and judicial branches; state colleges and universities; state hospitals and state authorities and commissions, such as NJ Transit.

Brian Murray, a spokesman with the state Department of Labor and Workforce Development, acknowledged how ""the Bureau of Labor Statistics has since revised the data and shifted the estimated count of state employees higher.""

But Murray also pointed to a reduction in employees since the Whitman era in the subcategory of ""other state government,"" which includes the executive, legislative and judicial branches as well as state boards and authorities.

""It could be argued that the Governor has more day-to-day control over the workforces in the items included in ‘other state government’ rather than Educational Services and hospitals,"" Murray said in an e-mail.

However, in both claims, Christie has just referred to ""state government"" in general.

Also, when we referred to that overall category for our first fact-check, a Christie spokesman confirmed that was the source of the governor’s information. So, for this fact-check, we’re focusing on the same category.

It’s worth noting that since Christie took office in January 2010, the number of ""state government"" employees has dropped by 5,600, or nearly 3.7 percent.

But has the Christie administration reduced the state workforce ""without any layoffs""?

That’s not what the governor’s representatives told us in December when we were working on our first fact-check.

Between the start of Christie’s tenure and November 2011, ""743 out of 4,738 full-time positions eliminated were through layoffs,"" the spokesmen said in an e-mail, referring to the executive, legislative and judicial branches.

Those layoffs included 138 positions at the New Jersey Network, the state-owned TV network shut down at the end of June 2011.

Our ruling

At the Brookings Institution, Christie claimed: ""New Jersey today has fewer employees in state government than it had when Christie Whitman left office in January of 2001, and I think that’s good. And we did it without any layoffs. We did it through attrition.""

But the latest labor statistics show there were 7,700 more ""state government"" workers in May than when Whitman resigned. Also, the governor’s representatives have cited hundreds of layoffs during Christie’s tenure.

We rate the statement False. 
To comment on this ruling, go to NJ.com.",/factchecks/2012/jul/16/chris-christie/chris-christie-claims-new-jersey-has-reduced-numbe/
"['Health Care', 'Virginia', 'Eric Cantor']","
Cantor says that under the health care law, the people who like their insurance will lose ""what they have""
","
The day after President Barack Obama’s health care law was upheld by the U.S. Supreme Court, House Majority Leader Eric Cantor, R-7th, was asked if he would concede defeat.

""The president’s team won and you guys lost,"" said Peter King of Bloomberg News in a TV interview with the congressman. ""Why not move on as the president suggests.""

Cantor vowed to continue his effort to repeal the law, complaining that it expands Washington’s control of health care and will be costly to the public. ""Frankly, the people who have health care in this country and like it will not be able to keep what they have,"" Cantor said.

Debate over how health care reform will affect medical insurance is huge in this year’s national elections. PolitiFact recently rated Half True an Obama claim that Americans who already have policies ""will keep"" their insurance."" It rated False a statement by Republican Mitt Romney that up to 20 million covered Americans ""will lose insurance that they like and want to keep.""

Is Cantor right that if you like it your health insurance, you will lose it?  We checked.

We asked Cantor’s office to back up the congressman’s claim. ""It’s a fact that the new insurance regulations in Obamacare will change the type of health insurance plans people currently have,"" spokeswoman Megan Whittemore replied in an email. ""Most employers are expected to modify coverage -- and some may even chose to drop employer-sponsored coverage altogether.""

Whittemore’s comments center on a quirk in the health care act, which in 2014 will require most people to have health insurance or pay a tax penalty.

The nonpartisan Congressional Budget Office estimates that 213 million nonelderly Americans have health insurance this year and 154 million of them -- 72 percent -- are covered through employer policies.

According to Kaiser Family Foundation, the average insurance premium for a single employee last year was $5,429, with the company paying $4,508 and the worker contributing $921. The average cost for a family policy was $15,073, with the company picking up $10,944 and the worker paying $4,129.

The law requires all companies with 50 or more employees to provide health care insurance to workers and families or pay a $2,000 fine per worker tax, not counting the first 30 employees.

As a result, Whittemore said, many companies will find it ""far more economical"" to drop their health insurance plans and pay the penalty tax. Most workers, in such cases, would be left to find coverage on their own through private insurance exchanges that will be set up under the act.

Whittemore pointed us to two studies on the issue.

One is a report entitled ""Broken Promise: Why Obamacare Will Force Americans to Lose the Health Care Coverage They Have and Like."" It was prepared by the majority staff of the House Ways and Means Committee at the request of its chairman, Rep. Dave Camp, R-Mich., a critic of the health care law.

The majority staff sent questionnaires to all Fortune 100 companies. It concluded that the 71 companies that replied could save $28.6 billion in 2014 if they stopped offering health insurance and paid the tax.

Whittemore also said a 2011 study by the Deloitte Center for Health Solutions ""found that up to 65 million people could lose their employer-sponsored health insurance because of Obamacare’s employer mandate requirement.""

Deloitte did find that, in a worse case scenario, 65 million workers could lose their employer-based insurance by the end of the decade because of the health care law. That could happen if more than 25 percent of large corporations with over than 5,000 employees and more than 50 percent of smaller businesses stopped offering insurance.

Keep in mind that 154 million Americans are insured by employers. Under this projection, 42 percent would lose their coverage. While that’s a big percentage, it does not even go half way to proving Cantor’s unbounded claim that, because of the health care act, the people who like their insurance ""won’t be able to keep what they have.""

Deloitte offered eight scenarios that are rosier than the one Cantor’s office cited. If, for example, 5 percent of large corporations 10 percent of smaller businesses cancelled their health coverage, then 7.7 million once-insured workers would need to seek coverage on their own.

And if Congress were to triple the $2,000 tax penalty on companies that don’t offer insurance, employer-based coverage would grow by 2.9 million people by the end of the decade.

Let’s look at a few other studies about the health care law’s impact on employer-provided insurance:

*The CBO estimated between 3 million and 5 million fewer non-elderly Americans will be covered by employers by the end of the decade.

*The Urban Institute projected a decline of about 500,000 people with employer coverage.

*The Lewin Group predicted a decline of 3 million people with work-based coverage.

*The Centers for Medicare and Medicaid Services actuary estimated 1 million fewer people will be covered by employers.

*The Rand Corp. projected about 4 million more people will be insured by employers in 2016.

There’s an important factor to keep in mind with these projections: Not all of the people falling out of employer coverage will be losing policies they like.

The CBO estimates that 3 million people will spurn their employers’ offer of coverage and turn to another source, such as the insurance exchanges created under the health care act. In many cases, they will do so because they consider the employer’s offering to be unaffordable or lacking in features they need.

Vast numbers of workers will see their work-sponsored insurance change for reasons that are not connected to the health care act. It’s common for employers and their insurance companies to unilaterally change their plans.

Mercer, a private consulting firm, found that in each year from 2005 to 2008, roughly a quarter of companies said they made changes to their plans that resulted in employees paying a greater share of the cost. In 2009 and 2010, it rose to one-third.

Our ruling

Cantor said that because of the health care law, ""The people who have health care and like it in this country are not going to be able to keep what they have."" His statement suggests that losing the health insurance you like is guaranteed by the law.

Cantor’s office backs the claim by noting the law makes it cheaper for companies to drop health coverage for their employees and pay a penalty tax. His office cites the bleakest of nine scenarios in Deloitte studies, under which 42 percent of workers would lose their company insurance.

The Cantor camp doesn’t mention that most of the other scenarios estimate a loss under 10 percent. We found five other studies that conclude the law will cause less than a 3 percent net loss of workers with company insurance. That group includes people expected to voluntarily give up their work policies because they prefer private plans that will become available under the health care act.

Even before the coverage mandate has taken effect, the number of companies that switch their plans each year has been substantial. The health care law is expected to increase that rate modestly, not exponentially as Cantor says.

We rate Cantor’s statement Mostly False.",/factchecks/2012/jul/16/eric-cantor/cantor-says-under-health-care-law-people-who-their/
"['Ohio', 'Economy', 'Jobs', 'Bill Johnson']","
Bill Johnson says Ohio leads in job creation and has among the best jobless rates
","
Jobs are a major concern in Ohio's 6th Congressional District, which stretches along the state's southeast border from Youngstown to the southernmost counties in Appalachia. 
That means job creation is again a leading campaign issue in the rematch between Rep. Bill Johnson, the incumbent elected in the Republican sweep of 2010, and Charlie Wilson, the Democrat he unseated.

Johnson raises the issue when he meets with voters, and he mentioned it in June in one of the telephone town halls he uses to keep in touch with his sprawling district.

""I don't know if you realize this or not,"" he told a caller, ""but the state of Ohio has one of the lowest unemployment rates in the nation right now and is leading the pack in terms of job creation.""

PolitiFact Ohio was interested because its positive tone seemed to contrast with a comment the congressman said, days later: ""We have to put America back to work.""

We asked his office for supporting sources. In a written statement, Johnson said, ""Because I talk to so many people in eastern and southeastern Ohio, I know that we need to make much more progress in job creation."" He blamed current economic conditions on what he called ""the job-killing policies"" of the Obama administration.

""I often give dozens of speeches and talks a week, rarely relying on a script,"" he said. ""While my precise wording certainly could have been better, the essence of my point is the same one The Plain Dealer's PolitiFact made just a few months ago.""

He cited PolitiFact Ohio's fact check of April 5, on Gov. John Kasich's statement that Ohio was ""the No. 1 job creator in America in February, and we are now the No. 4 job creator in the last year.""

We rated that statement as True.

But statistics are volatile. Kasich’s statement relied on job figures from several months before Johnson’s claim in his teleconference, so we checked the numbers again to see if it still holds up.

In discussing job creation, Kasich pointed to employment data from the U.S. Bureau of Labor Statistics, and to the news release issued by the BLS when it posted new numbers on March 30.

In February, the BLS said, the nation's largest over-the-month increase in employment and ""largest statistically significant"" job gain occurred in Ohio, which was up 28,300 jobs.

That was then.

In March, Ohio went from first to worst by losing 5,200 jobs, the country’s ""largest over-the-month decrease in employment,"" according to the BLS. Another 2,000 jobs were lost in April.

Figures for May, which the BLS reported 10 days after Johnson spoke, showed that Ohio posted a gain of 19,600 jobs -- an increase second only to California's for the month.

A BLS economist told us that ""lots of things can happen other than the economy"" to affect job losses and gains over short period. They don't consider a one-month change significant, but prefer to look at longer trends -- such as Ohio's ranking 4th in job creation over a year.

We also looked at the state-by-state unemployment figures from BLS to see if Ohio does have ""one of the lowest unemployment rates in the nation.""

The most recent BLS figures, for May, were released on June 15. They put Ohio's unemployment rate at 7.3 percent -- tied for 24th place with Arkansas and Missouri.

The figures for April, which were the latest available when Johnson spoke, had Ohio and Pennsylvania tied for 28th place with unemployment rates of 7.4 percent.

The latest unemployment rate was lowest in North Dakota, at 3 percent, and highest in Nevada, 11.6 percent.

At 24th or 28th, Ohio ranks in the middle, not among the lowest.

Ohio's rate has been on a downward trend and is below the national jobless rate of 8.2 percent. It also is lower than the rates in neighboring Michigan and Indiana, and lower than those of such large industrialized states as New York and Illinois.

What does it add up to?

Johnson conceded that his ""precise wording certainly could have been better,"" and we agree.

His statement contains an element of truth. While Ohio is not ""leading the pack"" in job creation, it does rank among the top dogs in the longer-term measurement that Labor Department economists see as statistically significant.

But the statement ignores some critical facts.

Johnson cited job creation numbers from February, a month in which Ohio was tops in the nation. But monthly stats for March and April, both available at the time of his statement, showed Ohio losing jobs.

And while Ohio’s jobless rate has improved considerably since it rose above 10 percent in 2009 and 2010, it is not one of the lowest unemployment rates in the nation. It now is below the national average. But now and at the time of Johnson’s claim, the state was in the middle of the pack.

On the Truth-O-Meter, Johnson’s claim rates Mostly False.",/factchecks/2012/jul/16/bill-johnson/bill-johnson-says-ohio/
"['Georgia', 'Health Care', 'Medicaid', 'State Budget', 'Brian Robinson']","
Deal spokesman slips up on health care impact to Georgia
","
The recent U.S. Supreme Court ruling on the federal health care law had many Georgians attempting to figure out what it meant for the state.

Brian Robinson, the communications director for Gov. Nathan Deal, a Republican, offered some insight in a front-page article in The Atlanta Journal-Constitution that had a few readers and organizations questioning its accuracy. A couple of them contacted PolitiFact Georgia to get some answers.

State officials have said the law will result in at least 620,000 additional Georgians being eligible for its Medicaid program, which they estimate will cost about $4.5 billion over 10 years. Georgia was one of about two dozen states to join the lawsuit against the health care law that was reviewed by the Supreme Court.

""To pay for the expansion without tax increases would require the state to cut nearly a quarter of its annual budget,"" Robinson said. ""And that’s after we’ve shaved off billions in state spending since the beginning of the Great Recession.""

Cutting a quarter of the state budget? That could be catastrophic.

The Georgia Budget & Policy Institute, which has concluded the health care law will save Georgia money, quickly disputed Robinson’s math in a news release. The institute, which frequently takes moderate to liberal positions on many Georgia fiscal issues, also pressed the state to provide information detailing how it calculated the $4.5 billion estimate on state finances.

""It makes the issue sound bigger than it is,"" Tim Sweeney, the institute’s director of health policy, said of Robinson’s claim in a telephone interview. ""We want to make sure it’s out there that it’s not true.""

The Georgia General Assembly adopted a $19.3 billion budget for the fiscal year that began July 1.

The health care law expands Medicaid eligibility in 2014 to nearly all Americans under 65 with incomes up to 133 percent of the federal poverty level. An additional 5 percent is disregarded when determining income eligibility, which effectively raises the threshold to 138 percent of the federal poverty level. The 2012 federal poverty level for a family of four in Georgia is $23,050. The number of Georgia enrollees is projected to rise from 1.6 million to nearly 2.3 million as a result of the the law.

The law provides that the federal government will pay 100 percent of the costs of covering these individuals through 2016. In the following years, the federal payment level gradually decreases, to a minimum of 90 percent.

The impact on state government in Fiscal Year 2015 is expected to be about $225 million, according to the state Department of Community Health. The annual impact of the health care law on Georgia’s Medicaid program rises by about $100 million a year between fiscal years 2016 and 2022, the state estimates. Georgia’s fiscal year begins July 1 and ends June 30.

As we noted, the state budget is $19.3 billion. If the state had to cut a quarter of its current budget, that figure would be about $4.825 billion.

But the health care law’s impact on Medicaid spending in Georgia is projected to stretch over 10 years, not one year. The Fiscal Year 2014 impact on Medicaid spending is estimated to be about $80 million, which would be about 2 percent of the state budget if the budget remains at its current levels.

Robinson, after an initial refusal to discuss the matter, admitted he erred.

""What I said isn’t accurate,"" he told us. ""I messed up. I was correctly quoted by the reporter.""

Robinson said his underlying point was that the health care law would result in potentially a major financial commitment from the state for Medicaid payments.

""The way I said it made it sound like we’re spending $4.5 billion more per year. That’s not true,"" Robinson wrote us via email. ""I SHOULD have said ‘Over 10 years, the new mandated spending will total a quarter of what the state spends on ALL services in its annual budget.""

Indeed. If he had said the potential impact of the health care law on Medicaid is equivalent to a quarter of the state’s budget, Robinson would have earned a True rating.

But our rating of his actual statement as it appeared in the newspaper: False.",/factchecks/2012/jul/16/brian-robinson/deal-spokesman-slips-health-care-impact-georgia/
