tags,sub_header,text_body,sources,quote_href
"['Housing', 'Taxes', 'Texas', ""Beto O'Rourke""]","
O'Rourke right about property tax going up under Abbott, but governor's role is indirect
","Democratic gubernatorial candidate Beto O'Rourke is blaming Gov. Greg Abbott for high inflation in Texas, taking a page out of the GOP playbook in attacking President Joe Biden. O'Rourke released an Instagram video on April 23 with the caption, ""Greg Abbott is the single greatest driver of inflation in the state of Texas."" TV news clips were stitched together with clips of O'Rourke speaking. In one clip in the montage, O'Rourke says, ""Under Greg Abbott, property taxes have gone up $20 billion."" O'Rourke went on to say, ""When you add this to the other inflation that he's causing ... "" with more clips pointing to electricity bills, traffic backups at the border in April due to additional commercial vehicle inspections Abbott ordered that he said would improve border security, and the rising costs of internet and phone for rural Texans. Overall, O'Rourke is saying Abbott is exacerbating consumer prices in Texas, which were already rising nationwide. We looked at one component of the ad: that jaw-dropping number of a $20 billion increase in property taxes. Is it true? Nationally, inflation hit a 40-year high according to March data from the Bureau of Labor Statistics, prompting criticism of Biden, especially as inflation relates to government spending. O'Rourke's campaign pointed to a Texas Taxpayers and Research Association report titled ""Relief from Rising Values: 2019 Property Tax Reforms Cutting Tax Rates at a Record Pace."" The report looked at the effects of legislation by state Sen. Paul Bettencourt, R-Houston, and state Rep. Dan Huberty, R-Houston, that overhauled the school finance system and local government budgeting practices and tamped down property tax increases for Texans. The association found property taxes are continuing to rise, but at a slower rate. The campaign pointed specifically to a figure in the report depicting Texas local property taxes from 2011 to 2021. Property taxes levied were just over $50 billion in 2015, when Abbott took office, and just over $70 billion in 2021. The difference is about a $20 billion increase. Data on estimated revenue from local property taxes is available on the state comptroller's website. According to the 2018-19 biennial report on property taxes by the comptroller's office, property taxes totaled $52.2 billion in 2015. Comptroller data on school district, city, county and special district property taxes indicate there was an estimated $73 billion in property taxes collected statewide in 2021. That's at least a $20 billion increase and in line with the analysis by the Texas Taxpayers and Research Association. In the six years before Abbott's election, property taxes increased to a lesser extent, but that property tax growth was constrained by the Great Recession. To note, while O'Rourke is appealing to voters who may also be homeowners, both commercial and residential property taxes are included here. Austin Community College economics professor Stuart Greenfield, whose state government career included work with economic models and how Texas distributes money to school districts, said just over half of the 2019 school district taxable value of property was single-family and multifamily homes. The Texas Taxpayers and Research Association is a lobbying organization that primarily spends its money on research. Its policy advocacy has a fiscal conservative bent, the association's President Dale Craymer said, but the organization doesn't advocate for the policies of one party over the other. Craymer said O'Rourke spoke correctly of the group's report based on the data it analyzed from the comptroller's office. The implication of O'Rourke's ad, however, is that Abbott is responsible for rising property taxes. Craymer said the role of state government is indirect at best when it comes to property taxes because rates are set locally and not by the governor or Legislature. ""Basically, the process by which rates are set and adopted is laid out in state law,"" Craymer said. ""The Legislature and the governor obviously are responsible for drafting and putting those laws in effect. But the state really doesn't have a direct say in the amount of property taxes individual jurisdictions raise."" The association's report found taxes would have been somewhat higher without two property tax changes by the Legislature in 2019. One created a process where school district property taxes would decrease over time for senior citizens, whose school district taxes are capped. The second change, Craymer said, increased the school district property tax homestead exemption for homeowners from $25,000 to $40,000, saving homeowners about $180 per year. Also in 2019, the Legislature required cities, counties and most special districts to seek voter approval to set a property tax that raises revenues more than 3.5%. For junior colleges and hospital special districts, the threshold for voter approval is 8%. For school districts, it is 2.5%. State policy also affects property values, and increases in value are tied to increases in taxes. Richard Auxier, senior policy associate at the Tax Policy Center under the Brookings Institute and Urban Institute, said the value of Texas homes is increasing alongside the rest of the country. ""While you can frame that as property taxes went up, you can flip that to home values went up,"" Auxier said. ""It's always going to be a trade-off, because people want the value of their homes to increase, but people don't want their taxes to go up."" Texas Republicans have campaigned on property tax relief, too. Abbott added property tax relief to the Legislature's third special session agenda in 2021 that resulted in a now-approved amendment to the Texas Constitution. Abbott similarly publicized his support for property tax relief as a priority in a May 2 tweet ahead of May 7 elections. Abbott's campaign responded to O'Rourke's ad by saying Abbott reduced property taxes by $18 billion since taking office and O'Rourke increased property taxes as an El Paso City Council member. Texas voters approved Proposition 2, which raises the homestead exemption for school district property taxes from $25,000 to $40,000. They also approved Proposition 1, which corrected a 2019 oversight in tax relief that did not apply to homeowners who are disabled or 65 or older because their school tax burden is capped. O'Rourke said in an April 23 Instagram video on rising inflation in Texas that, ""Under Greg Abbott, property taxes have gone up $20 billion."" Data presented in biennial reports and on the comptroller's website show that estimated revenue collected through property taxes increased by more than $20 billion. O'Rourke's figure was accurate. But property taxes are set locally, not by the state. Although state policies might indirectly affect property taxes, the governor's role in setting property taxes is indirect. We rate this as Mostly True.",[<zip object at 0x0000028097A7D9C0>],/factchecks/2022/may/19/beto-orourke/orourke-right-about-estimated-property-tax-revenue/
"['Agriculture', 'Families', 'Public Health', 'Facebook Fact-checks', 'Facebook posts']","
Medical experts discourage parents substituting goat’s milk for formula
","With the baby formula shortage ongoing, parents are seeking alternatives when they can’t find the products they typically use to feed their children.  Advice abounds online, but it’s not always accurate.  We’ve already debunked claims that people can follow a 1960 recipe for homemade baby formula as a substitute, and that there are loopholes to getting formula from Amazon in Canada or from your state for free.  Some posts are nudging parents to swap their formula for goat’s milk.  ""Don’t know who needs to hear this, but goat milk is better than dead GMO baby formula that causes other health issues,"" one post says.  ""Alternative?"" another said before it was apparently deleted. ""Consider purchasing fresh goat’s milk to bottle feed your baby.""  But medical experts warn against it. This post was flagged as part of Facebook’s efforts to combat false news and misinformation on its News Feed. (Read more about our partnership with Facebook.) Elizabeth Erickson, a pediatrician with Duke Health, told the News & Observer that goat’s milk can lead to vitamin deficiencies, and that parents should avoid any recipes — not just for baby formula — that calls for unpasteurized dairy products, which can cause bacterial infections.  ""There’s a message that ‘we used to do it back in the day,’"" Erickson said, ""but that doesn’t mean it was a safe choice then either."" Intermountain Healthcare, a Utah-based system of dozens of hospitals, discourages giving babies goat’s milk because ""for all its hype, goat’s milk is actually an unsafe choice for infants under 1 year of age."" Goat’s milk is ""extremely high in protein"" compared to human milk or formula, and the body has to make a lot of additional urine to get rid of the extra nutrition, Intermountain Healthcare wrote. It warned this can cause infants to become dehydrated.  The hospital system said there are other risks. Minerals that are excessive in goat’s milk can cause the body to become too acidic, leading to muscle spasms. Meanwhile, goat’s milk also lacks nutrients infants need to create the healthy red blood cells that help stave off fatigue, heart and breathing abnormalities, and more.  Kimberly O’Brien, a professor of human nutrition at Cornell University, said on the school’s website that ""in general, I would not advise replacing formula with goat’s milk or cow’s milk. These are not substitutes for human milk or formula."" Jennifer Nicklas, director of the Louisiana Department of Health, told the Lafayette Daily Advertiser that ""families should not substitute cow’s milk, goat’s milk, or plant-based milk for infant formula."" A 2010 article in the Journal of Pediatrics described giving fresh goat’s milk to infants as a ""dangerous practice"" and cited anecdotal reports of ""severe electrolyte abnormalities"" and ""allergic reactions including life-threatening anaphylactic shock,"" among other problems. We rate this post False.",[<zip object at 0x0000028097A54C80>],/factchecks/2022/may/19/facebook-posts/medical-experts-discourage-parents-substituting-go/
"['Facebook Fact-checks', 'Coronavirus', 'Bloggers']","
No, Democrats aren’t trying to put Americans in quarantine camps
","A May 17 blog post on Alex Jones’ conspiracy-oriented website, Infowars, sounds the alarm on what it describes as planned quarantine camps in the United States.  ""BREAKING,"" the post’s title says. ""Democrats introduce bill to put Americans in quarantine camps.""  But if you read further, it becomes clear that this ""breaking news"" is actually more than two years old, and it mischaracterizes the nature of a bill that was introduced in 2020.  This post was flagged as part of Facebook’s efforts to combat false news and misinformation on its News Feed. (Read more about our partnership with Facebook.) The post cites legislation filed by Rep. Bobby Rush, D-Ill., H.R. 6666, also known as the TRACE Act. That’s short for the COVID-19 Testing, Reaching, And Contacting Everyone Act. The bill was filed on May 1, 2020, and was referred to the House Committee on Energy and Commerce the same day. Democrats, who control the U.S. House, have taken no action on the bill since.  What’s more, the bill doesn’t arrange for Americans to be placed in quarantine camps.  According to a summary of the bill, written by the nonpartisan Congressional Research Service, it authorizes the Centers for Disease Control and Prevention to award grants for testing, contact tracing monitoring and other activities to address COVID-19.  The bill itself mentions quarantine once, saying that the Health and Human Services secretary may award grants ""to eligible entities to conduct diagnostic testing for COVID-19, to trace and monitor contacts of infected individuals, and to support the quarantine of such contacts"" through mobile health units and ""as necessary, testing individuals and providing individuals with services related to testing and quarantine at their residences."" Back in 2020, Rush told Reuters that contact tracing would be voluntary. At the time, there were false claims that the bill allowed strangers to enter someone’s house, test them for COVID-19 and take their family members into quarantine.  ""Contact tracing is not a new idea and is regarded by the CDC as a ‘key strategy for preventing further spread of COVID-19,’"" Rush said in 2020. ""My bill, the COVID-19 TRACE Act, is about appropriately and safely using this time-tested principle to better assist the communities that are the most impacted by the coronavirus — namely the African-American community — through voluntary testing and door-to-door outreach.""  The claim that Democrats recently introduced a bill to put Americans in ""quarantine camps"" is a gross mischaracterization of the 2020 proposal. We rate this post Pants on Fire. ",[<zip object at 0x0000028097670800>],/factchecks/2022/may/18/blog-posting/no-democrats-arent-trying-put-americans-quarantine/
"['Children', 'Families', 'Health Care', 'Military', 'Facebook Fact-checks', 'Facebook posts']","
Fact-checking claim about military families, Tricare and baby formula
","Many U.S. families are scrambling for solutions to the domestic baby formula shortage. For military parents of babies who have metabolic disorders, the U.S. Department of Defense has always provided one — but social media posts are getting the details wrong and falsely leading people to believe that it’s more widely available than it actually is. A May 15 post says that Tricare, the Defense Department's health care program, ""will now pay to have (baby formula) shipped directly to you,"" because of the shortage. It includes steps to follow, including emailing a form to Military Medical Supplies, a private company contracted to provide formula to Tricare. The post was flagged as part of Facebook’s efforts to combat false news and misinformation on its News Feed. (Read more about our partnership with Facebook.) But Tricare does not cover the cost of formula for all infants, only for those with metabolic disorders, it said in a May 17 statement posted on its website. Tricare also said it doesn't directly ship baby formula to beneficiaries. A small number of families — around 200 — are eligible to receive formula paid by Tricare because their infants have dietary needs requiring speciality formulas, including those formulated for feeding tubes, Military.com reported. Participation in the program requires a doctor’s order. The baby formula shortage is linked to COVID-19 related supply chain issues and a product recall that led to a temporary facility shutdown by a major formula manufacturer. About 40% of formulas are out of stock nationwide, The Atlantic reported May 12. A Facebook post claimed, ""Due to the baby formula shortage Tricare will now pay to have it shipped directly to you."" Tricare does not cover the cost of formula for all infants, but it does cover the formula for infants with metabolic disorders. The statement is partially accurate but leaves out important details or takes things out of context. We rate it Half True.

 ",[<zip object at 0x00000280973D3EC0>],/factchecks/2022/may/18/facebook-posts/fact-checking-claim-about-military-families-tricar/
"['Elections', 'Pennsylvania', 'Tweets']","
Mail ballot problem in Pennsylvania county was a printing error, not fraud
","As the results of the Pennsylvania Republican Senate primary remained up in the air a day after the election, critics of voting by mail distorted a problem with mail ballots in Lancaster County. On election night May 17, partially counted returns were too close to determine if Mehmet Oz or Dave McCormick would emerge as the winner. The race may land within the half-percent margin to require a recount.  A problem in Lancaster emerged after 7 a.m. on Election Day when officials opened up mail ballots and found that a significant number printed by the vendor, NPC, would not scan because they had the wrong identification code. The Pennsylvania State Department said about 22,000 ballots were affected; the county will duplicate ballots by hand and scan them over the next few days.  On Twitter, some people suggested that it was a sign of voter fraud or something ""suspicious.""  ""And of course there are mail in ballot discrepancies in Lancaster County, PA,"" tweeted John Cardillo. ""We’re a third world country. Voter fraud is becoming the accepted norm."" Another person tweeted of the Lancaster ballots: ""I see a major opportunity for voter fraud."" But county and commonwealth officials told us there was no evidence of fraud. The day after the election, County Commissioner John Trescot told PolitiFact that there was ""no sign of fraud related to this printing error."" Lancaster County Detective Andrew Morgan, who works for the district attorney, told us that detectives had received no reports of fraud. Lancaster officials said the error occurred after the county had approved the vendor’s test ballots, which had the correct identification code. The vendor, NPC, did not respond to PolitiFact.  Ellen Lyon, a Pennsylvania State Department spokesperson, also said there is no indication the printing error resulted from  fraud or malicious intent.  Human error in elections happens from time to time, said David Becker, founder of the Center for Election Innovation and Research. But it’s worth noting that the problem was discovered as a result of checks and balances built into the system.  ""It appears that every single voter who cast a vote on a ballot with the printing error on it will have their votes counted correctly, thanks to procedures in place,"" Becker said.  Thirty-eight states allow officials to process ballots cast by mail before Election Day, but Pennsylvania isn’t among them. Pennsylvania law says mail ballots can’t be processed until 7 a.m. on Election Day.  So there was no way to spot the problem earlier. Election officials from both parties have urged the Pennsylvania General Assembly to allow for earlier processing of mail ballots.  ""If the legislature had acted, this would have been discovered days if not weeks before, and could have been mitigated more effectively, allowing for rapid delivery of accurate results,"" Becker said. In 2021, lawmakers passed a bill that included earlier processing of mail ballots, but Gov. Tom Wolf, a Democrat, vetoed it, citing other aspects of the bill, including stricter voter ID requirements. Voting by mail surged in Pennsylvania starting in 2020 as a result of Act 77, the 2019 law that established no-excuse mail voting, a provision pushed by Democrats. Republicans got one of their priorities included, too: elimination of straight-ticket voting. Following Joe Biden’s presidential win in Pennsylvania, some Republicans have sought to undo the law, and the matter is in litigation. Former President Donald Trump, on his social media platform, Truth Social, used the Pennsylvania situation as another opportunity to attack voting by mail: ""Our Country should go to paper ballots, with same day voting. Just done in France, zero problems. Get Smart America!!!"" Trump’s repeated statements suggesting widespread fraud have been debunked by fact-checkers, judges and government officials. France completed its presidential election count quickly because that was the only contest on the ballot. Of all the counties in Pennsylvania, Lancaster and one other reported election issues, the State Department said. In Berks County, at least two dozen polling places had long lines as a result of problems with new electronic pollbooks. A court order extended voting in Berks County by one extra hour. The winner of the Senate Republican primary will face Democratic nominee Lt. Gov. John Fetterman. The Senate seat is being vacated by Sen. Patrick Toomey, a Republican. Social media posts extrapolated a problem with mail ballots in Lancaster County as a sign of ""voter fraud."" There is no evidence of fraud. The issue had to do with a vendor that printed the mail ballots using a wrong identification code; the ballots would not scan, so they will need to be copied by hand. County officials dismissed notions of vote tampering or other illegal activity. What happened in Lancaster is a vendor error, and suggestions that it amounts to voter fraud are wrong. We rate this claim False.  RELATED: All of our fact-checks about elections RELATED: Dave McCormick’s Truth-O-Meter RELATED: Mehmet Oz’s Truth-O-Meter RELATED: Why France reports election results faster than the US",[<zip object at 0x0000028097434180>],/factchecks/2022/may/18/tweets/mail-ballot-problem-pennsylvania-county-was-printi/
"['Space', 'Facebook Fact-checks', 'Viral image']","
No, this image of Earth isn’t from an Elon Musk/NASA leak
","An image of what looks like Earth, if it were rolled flat, is being shared on social media with a surprising description.  ""Data leak at Elon Musk AND NASA — this photo and another eleven photos are said to be from one of Elon Musk’s Space-X satellites,"" the post says. ""These photos were not encrypted during transmission. NASA hackers would have intercepted them."" This post was flagged as part of Facebook’s efforts to combat false news and misinformation on its News Feed. (Read more about our partnership with Facebook.) We reached out to both NASA and SpaceX, the rocket company founded by entrepreneur Elon Musk, but didn’t hear back.  However, we found no evidence to support the claim that this image was made public as a result of a leak at the federal agency or Musk’s private company. Previous authenticated leaks, such as video of a SpaceX rocket exploding in 2019 and an email from Musk warning SpaceX faced bankruptcy in 2021, were both well-covered in the media. It follows that news organizations would also cover the alleged leak of this image, but we found no such reports.  The image itself has been online for years, and previously, it wasn’t connected to NASA, SpaceX or Elon Musk. It appeared in this 2018 tweet, this January Quora post, this 2020 blog post claiming the earth is flat, and this undated blog post musing that the earth is neither flat nor a sphere.  This NASA image, created by combining data from two satellites, shows what Earth looks like from space. It is well-established that the Earth is a sphere — more specifically, an irregularly shaped ellipsoid, according to the National Ocean Service — and it does not look like the image in the Facebook post.  We rate this post False.",[<zip object at 0x00000280972288C0>],/factchecks/2022/may/18/viral-image/no-image-earth-isnt-elon-musknasa-leak/
"['Facebook Fact-checks', 'Viral image']","
Fake Twitter account posing as CBS shared false information about Buffalo shooting arrests, victim
","Twitter accounts falsely posing as news organizations sometimes share misinformation during big, developing breaking news stories, such as the recent shooting in Buffalo, New York, that left 10 people dead and others injured.  One such account misleadingly appeared to be a CBS News outlet in New Zealand and tweeted about the supposed arrest of two more suspects in the shooting, as well as another victim. Social media users responded by circulating a screenshot of the posts.   ""#BREAKING,"" read the first tweet, which included four photos. ""Two individuals arrested in connection with the #Buffalo mass shooting: Dimitri Potapoff (top) and Richard McWingo (bottom), were arrested by Buffalo law enforcement on Sunday. They allegedly provided weapons, ammunition, and body armor for the shooter.""  The second tweet said: ""Another victim of the #Buffalo mass shooting has been identified as Bernie Gores, aged 35.""  Facebook posts sharing images of these tweets were flagged as part of Facebook’s efforts to combat false news and misinformation on its News Feed. (Read more about our partnership with Facebook.)",[<zip object at 0x0000028097824380>],/factchecks/2022/may/18/viral-image/fake-twitter-account-posing-cbs-shared-false-infor/
