tags,sub_header,text_body,quote_href
"['Georgia', 'Federal Budget', 'Republican Party of Georgia']","
Obama setting debt record, Georgia GOP says
","
Georgia Republican Party leaders are actively trying to make the case that President Barack Obama is not a good steward of the nation’s checkbook.

One recent post on the party’s website caused our Truth-O-Meter to light up.

""It is clear that America could not afford the first four years of Barack Obama’s presidency, let alone the unimaginable economic nightmare that would surely be his second term,"" the party wrote. ""In fact, at his current rate, President Obama will have added more debt to the United States of America by the end of his first term than each of the previous 43 presidents -- combined!""

The party even has an ""Obama Debt Watch"" digital tote board on its website.

Several Republican leaders have made similar claims, which have been fact-checked by our colleagues at our national PolitiFact office. The rulings have varied because the statements have been slightly different in each case.

Let’s start with the basics concerning this particular claim. There are two ways to measure the national debt: the amount held by the public debt and the gross federal debt. The public debt includes all debt borrowed by the federal government and held by investors through Treasury notes and other securities. The gross federal debt includes public debt plus debt held by the government. The most notable forms of debt held by the government are the trust funds for Social Security and Medicare, money which is owed to beneficiaries in the future.

Georgia GOP spokesman Chris Kelleher said the state party was measuring the federal debt held by the public, starting at the time Obama was sworn in as president on Jan. 20, 2009.

On that January day, the debt held by the public was $6.3 trillion, according to U.S. Treasury Department data. Three years later, the total was nearly $10.5 trillion. In August, after much debate, Congress approved and Obama signed a debt deal that allowed the federal government to raise its debt ceiling by more than $2 trillion but requires a similar amount in budget cuts over the next decade.

The federal government manages its finances on a 12-month fiscal year schedule that begins Oct. 1 and ends Sept. 30. We are currently in fiscal year 2012.

The White House’s Office of Management and Budget estimates that the debt held by the public will be about $12.8 trillion by the end of fiscal year 2013. The Congressional Budget Office has a slightly more conservative estimate of just under $12 trillion.

Using the White House numbers means the debt will have risen by about $6.5 trillion since Obama took office, which is greater than the $6.3 trillion debt estimate when he became commander-in-chief. Using the CBO numbers, the increase since Obama took office will be about $5.7 trillion, which is less than the amount it was on Jan. 20, 2009.

So which 2013 estimate should we use?

We interviewed two experts on such matters. Jason Peuquet, the research director for the  Committee for a Responsible Federal Budget, said he prefers to go with the OMB numbers. Georgia State University professor Katherine Willoughby, an expert in government budgets, said she prefers to use the CBO’s figures. Both, however, disagreed with the Georgia GOP’s process to base its claim. They say it’s more accurate to measure debt as a share of the nation’s gross domestic product.

Peuquet said that statistic is preferable because it is a better historic measure of debt and the economy.

""Dollars today are [worth] a lot less than they were 200 years ago,"" he said. ""So [the Georgia GOP comparison] is not an apples-to-apples comparison.""

In fiscal year 2009, the public debt as a share of the nation’s gross domestic product was about 53 percent, according to OMB and CBO figures. By the end of fiscal year 2013, both organizations estimate it will be 75.1 percent. The difference between those four years is not more than America’s first 43 presidents combined.

PolitiFact Georgia wondered whether it was fair for the party to put this all on Obama when Congress approved the August 2011 debt deal?

""In the American democracy, there are split powers,"" Peuquet said. ""Congress has played a big part in tax cuts and spending increases in the past.""

Said Willoughby: ""My take on this would be that the statement is partially true. Certainly, our debt has soared in light of the Great Recession. To be fair to Obama, though, it would be better to consider debt held by the public as a percent of gross domestic product.""

Willoughby noted that the public debt as a share of the nation’s GDP rose to dangerously similar levels during World War II. It went from 47 percent in 1942 to 106.2 percent by 1945, according to OMB data.

Georgia Republican Party spokesman Chris Kelleher said responsibility for the debt increases solely belong to the president. He said congressional Republicans were forced to go along or face a government shutdown.

""The fact of the matter is that the request for the increase in the debt ceiling -- which directly allowed our government to continue writing bad checks and adding to our public share of the debt -- came directly from President Obama. The blame lies squarely at his feet; for Barack Obama, the buck stops nowhere,"" Kelleher told us via email.

Our conclusion:

There are two factors to consider here. One, has the public debt risen under Obama’s presidency more than all of his predecessors combined? Two, is this all Obama’s fault?

The Georgia GOP’s rationale for its claim is based on using the raw totals reported by the OMB. There are other factors to consider, however, when examining the accuracy of this statement, such as measuring the debt increase by the nation’s gross domestic product. There, the GOP claim is in trouble.

As for whether Obama bears all of the blame here, Congress, which has a Republican-controlled House of Representatives, passed the 2011 debt deal and is partly responsible for the projected increase by fiscal year 2013.

With these caveats, we rate this claim as Half True.",/factchecks/2012/feb/13/GaGOP/obama-setting-debt-record-georgia-gop-says/
"['County Budget', 'State Budget', 'Taxes', 'Wisconsin', 'Rebecca Kleefisch']","
Lt. Gov. Rebecca Kleefisch says Kathleen Falk raised taxes by millions every year as Dane County executive
","
Democrat Kathleen Falk’s bid to knock Gov. Scott Walker out in a likely recall election is subjecting her 14-year tenure as Dane County executive to attacks by Republicans.

Led by Lt. Gov. Rebecca Kleefisch, they are labeling Falk a classic Madison tax-and-spend liberal -- one out of step with the times.

""In a national economic downturn, Wisconsin families cannot afford to have a leader with an addiction to taxing and spending,"" Kleefisch wrote in an opinion piece published by Madison’s Capital Times on Feb. 3, 2012. ""The failed policies Falk has consistently stood for throughout her career are exactly the same policies that led Wisconsin down an irresponsible path to a $3.6 billion budget deficit.""

Kleefisch went on to cite chapter and verse:

""As Dane County executive, Falk raised taxes by millions of dollars every year, most notably in 2010, when she increased taxes by 8 percent, the second highest increase across the entire state of Wisconsin.""

The op-ed piece contrasts these claims with Walker’s state budget, which Kleefisch says was balanced ""without raising taxes on Wisconsin families.""

We’ve labeled inaccurate, multiple times, the GOP claim that Walker didn’t raise taxes. He came close, and he cut taxes more than he raised them in his budget overall, but he reduced tax credits for some lower-income working people, which the nonpartisan Legislative Fiscal Bureau has scored as tax increases.

Asked to back up the claim about Falk, the Walker campaign -- speaking for Kleefisch -- pointed us to property tax figures compiled by Dane County and the Wisconsin Taxpayers Alliance, a nonpartisan research group. 
Falk’s approach as executive from 1997 to 2011 was to limit increases in the property tax levy to inflation with a factor built in for population growth. It was an effort to tie increases to service demand, said Scott McDonell, chairman of the Dane County Board, which largely approved of Falk’s approach. 
Did Falk’s budget raise property taxes by 8 percent in 2010, ""the second highest"" in the state? Yes.

In 2010, Falk busted past her self-imposed levy limit of 1.19 percent for that year. She blamed lagging sales tax and other revenue due to the Great Recession, and said higher property taxes, a 3 percent wage cut negotiated with county unions and efficiency moves would preserve needed services.

""I’ll be the first to say I’m not one bit comfortable with this levy increase, but using the formula would have resulted in painful cuts to public safety and human services that are unacceptable to me,"" Falk said at the time.

The 8 percent hike was second-highest behind Green County.

Did Falk’s budgets raise the levy by ""millions"" every year?

We analyzed the data and found that in Dane County, the property tax levy went up in a range from $2 million to $9 million every year. That’s in the neighborhood of 3 percent to 5 percent increases annually -- with the exception of 2010.

So the ""millions"" every year is accurate, though it’s worth pointing out that Dane County is nearly a half-billion-a-year operation supported by $133 million in tax levy -- so it doesn’t take a big percentage increase to get to ""millions"" of new property taxes in a year.

Falk’s campaign defends her budget record, saying her property tax ""cap"" was landmark. She, like Walker, touts the fact that she balanced budgets, though both were legally bound to do so.

The numbers showed Falk’s self-imposed limits held down property tax increases to the point that only 15 counties had a lower cumulative tax levy increase during that time, we found. Dane County ranked 57th among 72 counties, with 72 being the lowest levy increase.

By comparison, under then-County Executive Walker, Milwaukee County was fifth-lowest (68th ranked) from 2002 to 2011.

So both were in the bottom 20 percent of tax raisers, with Milwaukee County close to the champion of frugality.

Indeed, both counties raised property taxes: Dane’s levy went up $59 million in Falk’s 14 years, while Milwaukee’s rose $51 million over Walker’s nine years.

The difference: While Falk and the board gave themselves a cap on growth, Walker proposed zero tax levy increases each year and vetoed attempts to add to the levy. But the County Board almost always overrode him, complaining his budgets were unrealistic.

To be sure, Walker started each budget with the new, higher base. In effect, he used the new taxes he opposed one year to help his budget for the next year. So if you compare the tax levy he sought in his first budget to that in his last, it is up.

Our conclusion

Kleefisch takes on Falk’s record of consistent property tax levy increases.

While we found Dane County on the low side for tax hikes during Falk’s 14 years, Kleefisch’s main point is that taxes went up every year under Falk, and spiked one year. They did.

We rate her statement True.",/factchecks/2012/feb/12/rebecca-kleefisch/lt-gov-rebecca-kleefisch-says-kathleen-falk-raised/
"['New Jersey', 'Education', 'Sports', 'Chris Christie']","
Chris Christie claims under Greg Schiano, Rutgers football had the best graduation rate in its division
","
Greg Schiano has his detractors in New Jersey, but Gov. Chris Christie isn’t one of them.

The governor defended the football coach, who recently left Rutgers University to become head coach for the Tampa Bay Buccaneers, in a Jan. 31 radio interview. Despite criticism about Schiano’s 11-year tenure with the Scarlet Knights, Christie said the coach transformed the program from a ""laughingstock"" into a fierce competitor -- and in more than just athletics.

""Here's something that people never talk about with coach Schiano: Rutgers had the best graduation rate of any Division I football program in America. Now, when all you see is scandal all over college football, in 11 years you never saw it touch Rutgers. Not once,"" Christie said on New Jersey 101.5’s ""Ask the Governor"" program.  ""And he graduated his kids from college, so those kids if they went on to the NFL like some of the folks who have gone on to the NFL and done really well, great. But the majority of them don't and for the majority who don't, he got them out of Rutgers with a Rutgers degree and I tell you, I bet you the parents of those kids love Greg Schiano because those kids now have a future because they have a college degree from a great university like Rutgers.""

There’s a reason people don’t talk about Rutgers’ football team earning the top graduation rate in its division: it never did.

There are 120 teams playing in the National Collegiate Athletic Association’s Football Bowl Subdivision, formerly known as Division I-A.

Rutgers’ Scarlet Knights play in the division’s Big East Conference with seven other teams. The most recent data available on graduation success rates, which are calculated by the NCAA, ranks Rutgers at the top of its conference, but not the top of its division.

Among Football Bowl Subdivision teams, Notre Dame, Northwestern University, Rice University, Boston College, Duke University and the U.S. Naval Academy had higher graduation success rates than Rutgers.

Rutgers never topped its division in graduation rates under Schiano, but it’s worth noting that in  five years, the team’s NCAA graduation rate climbed from 55 percent to 89 percent.

The governor’s office did not respond to requests for comment, but a spokesman for the Rutgers football program said: ""I would think he was referring to our APR, which he has commented on before.""

The APR, or academic progress rate, is another measure of academic performance based on whether a student-athlete remains academically eligible and remains with the school.

Emily Potter, a NCAA spokeswoman, said in an email that the academic progress rate is ""intended to be predictive of eventual graduation rates. Both should be important measures of academic success, and the higher that one of these measures is, the more likely it is that the other will also be high.""

But, ""having said that, it is true that graduation is not included in the actual measurement of APR.""

Rutgers grabbed the top spot in its division by that measure two years ago. Last year, Rutgers fell to the second spot in the academic progress rate rankings, behind Northwestern University in Illinois.

David Ridpath, an assistant professor of sports administration at Ohio University, said in an email that ""Governor Christie is incorrect, but probably not intentional on his part—still he should be more careful with his absolute statements.""

Our ruling

Christie claimed that ""Rutgers had the best graduation rate of any Division I football program in America.""

The Scarlet Knights ranked at the top of their conference, but not the top of their division for graduation rates in the most recent data. During Schiano’s tenure, the team never had the best graduation rate in the division. By another measure of academic performance, Rutgers football topped its division, but, according to a NCAA spokeswoman, graduation is not included in that calculation.

We rate the statement False.

To comment on this ruling, go to NJ.com.",/factchecks/2012/feb/12/chris-christie/chris-christie-claims-under-coach-greg-schiano-rut/
