tags,sub_header,text_body,quote_href
"['National', 'Health Care', 'New Hampshire 2012', 'Mitt Romney']","
Mitt Romney says federal law requires hospitals to provide free care
","
Responding to a question about health care at a Wolfeboro, N.H., town hall, Republican presidential candidate Mitt Romney defended the health care law he signed in Massachusetts, saying it was partly a response to people who took advantage of a federal law that allows them to get free emergency coverage.

The former governor told the crowd he expanded health coverage in the Bay State in part so citizens could ""take personal responsibility"" for their health care.

""We found that because of federal law, federal law requires that hospitals treat people whether or not they can pay. So someone (who) doesn’t have health insurance -- they can go to the hospital and get free care. And we found a growing number of people were dropping their insurance and going to the hospital if they got real sick.""

Whether hospitals were properly compensated for treating the poor was one of the issues the Massachusetts health care law tried to address. In this case, we wondered if Romney was accurately describing the federal law and whether it truly equates with free care.

His campaign told us he was referring to the Emergency Medical Treatment and Labor Act., which Congress passed in 1986. It says any hospital that receives Medicare dollars (and nearly 90 percent of hospitals in the United States do) must ""provide a medical screening examination"" for an emergency condition ""regardless of an individual's ability to pay.""

The American College of Emergency Physicians defines an emergency as ""a condition manifesting itself by acute symptoms of sufficient severity (including severe pain) such that the absence of immediate medical attention could reasonably be expected to result in placing the individual's health (or the health of an unborn child) in serious jeopardy, serious impairment to bodily functions, or serious dysfunction of bodily organs.""

If the patient’s symptoms qualify as an emergency, the law says ""hospitals are required to provide stabilizing treatment for patients.""

So what does ""stabilizing treatment for patients"" mean in practice?

Matt Fenwick with the American Hospital Association says it means ""your condition has been stabilized. (Medical providers) have done everything they can do to make sure your condition is not getting any worse.""

But there’s no guarantee a hospital will provide some level of treatment, even if a person is really sick, says George Washington University health policy professor Sara Rosenbaum.

""For example, you bring a child who is running a fever and has a sore throat. They say that’s not an emergency. If it turns out the sore throat is very fast-moving strep, which can happen with little children, your child could be dead by night.""

Rosenbaum says whether a patient actually gets treatment can be a matter of lucky timing and whether they show up at the emergency room just as the medical concern has blossomed into a true emergency.

She said that even when a person receives some care, there often is a big gap between stabilizing a patient’s condition and providing them with treatment.

Dr. Arthur Kellermann, a health analyst with  the Rand Corporation, a policy think tank, echoes that sentiment. He says a patient ""will be stabilized and if necessary hospitalized. They are not entitled to primary care, they are not entitled to preventive care, they are not entitled to followup. That is more humane then letting people die in the gutter. But it is a ridiculous way to try to manage a health care system.""

Our ruling

Romney said that federal law ""requires that hospitals treat people whether or not they can pay. So someone doesn’t have health insurance they can go to the hospital and get free care.""

Experts told us that one aspect of Romney's argument has some validity: Many people rely on emergency rooms for care when they have nowhere else to go, which is expensive and a burden on the health care system and the larger society. And hospitals sometimes provide more free care than the law requires.

But Romney is wrongly suggesting more extensive treatment is required by federal law. He implies that hospitals are required to provide more free care than is actually mandated. In fact, the law just requires stabilizing treatment in an emergency. We rate his claim Barely True.",/factchecks/2011/jul/22/mitt-romney/mitt-romney-says-federal-laws-requires-hospitals-p/
"['Georgia', 'Criminal Justice', 'Mike Males']","
Limited studies say teen curfews ineffective
","
In a May 31 news release, just as Atlanta’s teens were embracing the warm glow of summer vacation, city officials announced plans to enforce a long-standing juvenile curfew.

The rationale was safety.

""I want everyone in the City of Atlanta, especially our young people, to enjoy the summer months,"" Mayor Kasim Reed said in the statement. ""At the same time, it is vital that we keep everyone safe.""

But Mike Males, a researcher with the Center on Juvenile and Criminal Justice, said in an Atlanta Journal-Constitution story two weeks later that the mayor’s logic is flawed.

""There’s pretty much no question that [the ordinances] aren’t effective in either reducing crime or preventing harm to young people,"" he said.

That’s a strong position to take against a very popular crime-reduction tactic.

Curfews have been around forever, imposed by moms and mayors alike. In 1884, President Benjamin Harrison called them ""the most important municipal regulation for the protection of children in American homes from the vices of the street.""

Curfews fell out of favor in the mid-20th century and did not regain popularity until the Clinton administration.

By the mid-1990s, the U.S. Conference of Mayors found 70 percent of nearly 350 cities surveyed had some sort of nighttime curfew. The overwhelming majority of cities considered the curfew effective and a good use of police time.

Atlanta’s current curfew has been on the books since 1977, although enforcement has waxed and waned. The curfew says young people 16 and under cannot be on the streets unsupervised past 11 p.m. Sunday through Thursday and after midnight on Fridays and Saturdays. It includes some exceptions for work, school events and emergencies, making it similar to curfews in other cities.

Violation of the curfew nets a warning on the first offense and a $1,000 fine and possible jail time on subsequent violations, but it’s the parent or guardian who gets the punishment.

So we know that curfews are popular, but is Males right when he says they don’t work?

For the answer, we turn to ... Males. It turns out, he is one of the leading researchers in the effectiveness of teen curfews and his work is cited frequently in scholarly papers and the media.

In a widely referenced 1998 paper on the impact of curfews in California, Males and co-author Dan Macallair found curfews ""had no discernible effect on youth crime"" based on a statistical analysis of cities enforcing the laws. In some cases, curfew cities actually saw crime go up compared with cities that did not enforce a curfew, they found.

Males and Macallair said crime statistics in curfew cities ""suggest that solutions are more complex and multifaceted.""

In an interview this week, Males said curfews presuppose that all young people are equally likely to commit a crime. Since they aren’t, curfews become an inefficient tool for combating youth crime, perhaps wasting police resources, he said.

Males’ research is backed up by a popular survey of studies on curfews published in 2003 by criminal justice researcher Kenneth Adams, who also found scant evidence that the laws accomplished what most people believed they did.

""Studies consistently report no change in crime in relation to curfews,"" Adams wrote, although he indicated curfews likely would remain popular.

""The seduction of common-sense reasoning sometimes is too strong to be swayed by scientific evidence,"" he wrote.

While the researchers agree that curfews do not lower juvenile crime, they also admit their conclusions rest on relatively few studies. As a result, Adams allows that curfews ""may encourage parental responsibility,"" and he wrote there is some evidence a short-term curfew focused on certain high-crime areas does reduce crime.

But a more recent stab at measuring the effectiveness of curfews comes from University of California at Berkley economist Patrick Kline.

Using an economic theory called the substitution effect, Kline says there is evidence that curfews curb youth crime.

In consumer economics, the substitution effect holds that higher prices result in lower consumer demand. With curfews, Kline said the criminal penalties for curfew-breakers results in a decline in youth crime of up to 10 percent.

Kline’s paper has been picked up across the country by curfew advocates looking for a champion, but Males said the study has significant shortcomings. For example, Kline does not compare cities that have curfews with similar cities without curfews to see whether crime is declining generally.

In fact, juvenile arrests peaked in the mid-1990s and has been declining nationally ever since, along with arrests for lots of adult crimes. Males said Kline’s assessment does not take those larger shifts into consideration.

Males also said there are some problems with applying a theory governing how milk prices get set with criminal justice.

""The problem with economic substitution theory is that not all juveniles are equally likely to commit crimes,"" he said.

Kline’s paper has gone through several revisions, and according to his website, is awaiting publication in American Law and Economics Review.

So the weight of academic opinion sides with Males’ assessment that curfews do not reduce crime. But Kline’s interpretation suggests the question deserves more research.

Males saves himself with the qualifier ""pretty much,"" but at least some still are asking questions, leaving us with a ruling of Mostly True.",/factchecks/2011/jul/22/mike-males/limited-studies-say-teen-curfews-ineffective/
"['New Jersey', 'Retirement', 'State Budget', 'Dominick Marino']","
Official says New Jersey police, fire pension systems ""far"" from bankruptcy
","
After years of controversy about the state of New Jersey’s pension systems, some good news about the status of their solvency might be welcome.

Dominick Marino, president of the Professional Firefighters Association of New Jersey, believes he has that news for at least one pension fund.

""The firefighter and police officer pension system is not headed for bankruptcy, far from it,"" Marino said in a June 6 column posted on PolitickerNJ.com. ""That’s because New Jersey first responders -- fire fighters and police officers -- have never missed making payments to the retirement system.""

Hardly a day goes by in New Jersey without someone criticizing the supposed failing status of the state’s pension systems, so PolitiFact New Jersey decided to check Marino’s claim. We found its accuracy depends a lot on how bankruptcy is defined.

First, let’s look at how pension systems work for New Jersey police and firefighters.

New Jersey has several pension funds: a joint retirement system for police and firefighters, and one each for state police, teachers and the judiciary.  All other state employees fall under the Public Employees Retirement System.

The state and municipalities are each required to make contributions to the police and firefighter fund, but in recent years municipalities have done a better job of making their contributions. For example, as of June 30, 2010 – the most recent date that the funds were certified by accountants, the police and firefighters pension was at 71 percent funding, or $19.8 billion, said Andrew Pratt, a spokesman for the state’s Treasury Department.

Pensions ideally should be fully funded, which means the pension has 100 percent of its required funds. Roughly, half the fund is financed by employee contributions, which come automatically from payroll deductions and the other half by employers, Pratt said.

As of June 30, 2010, the teachers pension was funded at 63.9 percent or $25.9 billion; the state police pension was 73 percent funded, or $1.7 bllion; and the judiciary pension is at 59.7 percent funded, or $265 million.

Police and firefighters had been paying 8.5 percent of every paycheck toward their pensions, and that climbed to 10 percent effective July 1 with the historic pension reforms signed into law by Gov. Chris Christie.

Next, let’s define what bankruptcy means in terms of pension funding. Bankruptcy is not when a fund reaches zero, Pratt said. It’s when taxpayers can no longer afford to keep the system maintained as designed, because bankruptcy will become inevitable, he said.

For now, Pratt said the police/firefighters fund is 70.8 percent funded. Marino put the figure at 72 percent. The pension is nearly three-fourths funded, but is it enough to escape bankruptcy or to be considered dangerously underfunded?

""In the pension world, that’s a pretty good place to be, 75 to 80 percent is good,"" Marino said.

Pratt agreed – to a point.

""It is more important to say that from the standard of pension funds, 70-percent funded is an inadequate number,"" Pratt told PolitiFact New Jersey. ""The law has determined that 80 percent is the minimum level actuaries would say the fund is solvent. The target is 80 percent with good reason. It is the long-term solvency of a system that is designed to provide benefits to police officers and firefighters not just over the next two or three years, but for the rest of their lives.""

An issues brief released in April 2010, ""The Funding of State and Local Pensions: 2009-2013"" by the Center for State and Local Government Excellence in Washington, DC, looked at the causes and possible solutions to repairing the problems with the nation’s state and local government pensions, and also reviewed 126 government pension funds across the nation -- including New Jersey’s.

The level of New Jersey’s police and fire pension funding dropped from 100.8 percent in 2001 to 70.8 percent in 2009, according to the study.

The U.S. Government Accountability Office also considers 80 percent an important threshold. While it doesn’t recommend 80 percent as a level of funding adequacy, the GAO considers below 80 percent ""potentially worrisome,"" said Barbara Bovbjerg, managing director of Education, Workforce and Income Security Issues for the GAO.

Iris J. Lav, a senior adviser at the left-leaning Center on Budget and Policy Priorities in Washington, DC said public pensions should aim to be 100 percent funded, but noted that ""in a bad economic time, having 80 percent isn’t a crisis.

""It is true that an 80 percent funding threshold is considered adequate for public pensions opposed to private pensions,"" she said. ""Cities, counties and states are ongoing institutions. Businesses can go out of business, and the money on hand that day is supposed to be enough to pay the pensions promised.""

Making changes to deal with lack of contributions and underfunding can improve the situation, according to the findings in the issue brief by the Center for State and Local Government Excellence.

New Jersey’s recent pension reforms are one example of those changes. As part of the state’s new reforms, cost-of-living adjustments have been eliminated until the fund reaches a minimum 80 percent funding level.

Pratt emphasized that New Jersey’s new pension reforms are projected to significantly bring pension funds above the 80 percent funding threshold.

""Without reform, the funds were effectively bankrupt because they didn't contain enough money to pay the future claims of retirees, and without a stock market miracle, they never would have contained enough money to pay future claims,"" Pratt said.

Let’s review.

The president of the New Jersey Professional Firefighters Association says the joint police and firefighters retirement fund is far from bankruptcy and in better shape than other funds. While the funding level of that pension is higher than others in the state, several experts state that public pensions funded below a threshold of 80 percent -- the case for the police and firefighters fund, as well as other New Jersey pensions -- could be cause for concern. Bankruptcy might not be on the immediate horizon for the police and firefighters pension fund, but it’s not an impossibility, either. We rate Marino’s claim Half True. 
To comment on this ruling, go to NJ.com.",/factchecks/2011/jul/22/dominick-marino/official-says-new-jersey-police-fire-pension-syste/
"['Elections', 'Redistricting', 'Florida', 'Debbie Wasserman Schultz']","
Latest in West-Wasserman Schultz feud: She says he lives in her district
","
Most of the she-said, he-said, back-and-forth between South Florida Reps. Debbie Wasserman Schultz and Allen West has been good for political theater but bad for fact-checkers.

If you missed it, Wasserman Schultz -- a Democrat -- criticized West -- a Republican -- this week over his support for a plan to sharply reduce federal spending and require a balanced budget amendment to the Constitution. In a speech Tuesday on the floor of the U.S. House, Wasserman Schultz said the West-backed GOP plan would raise costs for Medicare beneficiaries, and that it was ""unbelievable"" for West to support it because he represents so many South Florida seniors.

West responded via e-mail. ""Look Debbie ... you want a personal fight, I am happy to oblige. You are the most vile, unprofessional, and despicable member of the U.S. House of Representatives. If you have something to say to me, stop being a coward and say it to my face, otherwise, shut the heck up.""

See? Not a lot to check in either statement.

But as the debate ballooned into cable news drama Wednesday and Thursday, Wasserman Schultz provided an interview -- and a sound bite -- to CNN's Wolf Blitzer that had us scratching our heads. 
Wasserman Schultz said she is West's elected representative to the House.

""He's a constituent of mine, and so I was dutifully doing my job and representing my constituents and taking to task someone who I think is really taking the wrong position when it comes to the people we represent in South Florida who badly need that safety net and make sure that we're not going to dramatically increase their costs, which that cut, cap and balance plan does,"" she said.

Blitzer stopped for a moment. ""So you're saying he lives in your district, he doesn't live in his own district?""

""Yes,"" Wasserman Schultz continued, ""Congressman West is a constituent of the 20th Congressional District, but represents the 22nd.""

To win a seat on the city council, you have to live in that city when you take office. To win a seat in the state House, or the state Senate, you also have to live in the district you represent. The obvious question is why would it work differently for Congress?

The U.S. Constitution, that's why. The requirements for U.S. House members are spelled out in Article I, Section 2: ""No Person shall be a Representative who shall not have attained to the Age of twenty five Years, and been seven Years a Citizen of the United States, and who shall not, when elected, be an Inhabitant of that State in which he shall be chosen.""

We're not sure why the framers loved all the negatives, but in other words: U.S. House members need only live in the state they represent to be eligible for their seat.

""Remember back in 1789, things weren't like they are today,"" said lawyer Mark Herron, an elections expert based in Tallahassee. ""A state was a state. It was just a reflection of the times, and they tried to keep it as simple as possible.""

In fact, the Roanoke Times recently identified a handful of House members who lived outside their districts, including Utah Republican Jason Chaffetz, California Democrat John Garamendi and Georgia Democrat David Scott.

And West does, too, it turns out.

West moved to Florida with his wife, Angela, and two daughters in 2004 after retiring from the Army. The former colonel lives in a four-bedroom, two-bathroom $200,000 home in the city of Plantation, Broward County property records show.

His zip code, when punched into the U.S. House of Representatives website, and his address, when entered into the St. Petersburg Times' MyLawmaker database, both show his home falling in Florida's 20th Congressional District, represented by Wasserman Schultz.

West has owned up to this before. Amid questions over residency requirements for several South Florida lawmakers in 2008, West correctly cited federal law to the Palm Beach Post and explained, ""I'm a distance runner, and I even do my 5 to 10 miles mostly in District 22.

""The U.S. Constitution says only that a person must live in the state in which he is running for Congress,"" said West, then a challenger to former Rep. Ron Klein. ""But I'm not trying to hide where I live. Yes, I live just outside the district. Part of Plantation is in District 22 and the other part in District 20. The dividing line is University Drive and I live about a mile from there.""

""They redistrict every 10 years anyway and what are you supposed to do, move all the time?"" West said.

We won't answer that. But on the matter at hand, Wasserman Schultz is correct that she can count West as a constituent. And it's okay, according to the U.S. Constitution. We rate this claim True.",/factchecks/2011/jul/21/debbie-wasserman-schultz/latest-west-wasserman-schultz-feud-she-says-he-liv/
