tags,sub_header,text_body,quote_href
"['National', 'Health Care', 'Bernie Sanders']","
Bernie Sanders repeats flawed claim about U.S. health care spending compared to other countries
","Democratic presidential candidate Bernie Sanders is on a campaign for ""Medicare for all"" — or at least something like it. Sanders, an independent senator from Vermont who identifies as a socialist, told NBC’s Meet the Press moderator Chuck Todd to look at how much the country spends compared to the rest of the world as a reason for a single-payer system. ""We spend almost twice as much per capita on health care as do the people of any other country,"" Sanders said. It’s a striking claim, and one we heard from Sanders six years ago. We rated the claim False then, and it's still wrong now. We looked at data from the Organization for Economic Cooperation and Development (OECD), widely cited by experts as an authoritative source for this information. In 2007, the United States led the world in health care spending at $7,167 per capita, according to the OECD. Norway and Switzerland followed at $4,579 and $4,568, respectively. The United States maintained its spending lead in the years that followed. But Sanders puts the difference too strongly when he says U.S. spending is ""almost twice"" per capita of ""any other country."" According to the OECD’s most recent data, U.S. spending grew to $8,713 per capita in 2013. Switzerland and Norway came in second and third at $6,325 and $5,862 per capita, respectively. (The organization’s incomplete 2014 data set, which does not include the United States, shows no country spending over $6,500 per capita.) Had Sanders fine-tuned his talking point by claiming that the United States spends twice as much per capita as the average developed country, his statement would been accurate. Average per capita spending is less than $3,500 across the 32 countries listed in the OECD database. That’s 40 percent of what the United States spends per person. A spokesman for Sanders could not be reached for comment. Our ruling Sanders said that ""we spend almost twice as much per capita on health care as do the people of any other country."" The United States spends more on health care per capita than other countries, but not always twice as much. Sanders’ comment suggests the United States outpaces all other countries more than it actually does. European countries with extensive social service networks aren’t so far behind the United States.  We rate his statement False.",/factchecks/2015/aug/16/bernie-sanders/bernie-sanders-repeats-flawed-claim-about-us-healt/
"['National', 'Education', 'State Budget', 'Hillary Clinton']","
Hillary Clinton tweets that Florida got an F for college affordability under Jeb Bush
","Democratic presidential candidate Hillary Clinton and Republican presidential candidate Jeb Bush (or at least their staffs) engaged in a snarky Twitter exchange shortly after Clinton gave a speech about college affordability. In the exchange, on Aug. 10, 2015, Clinton and Bush cheekily traded barbs about education policy. The original tweet, from Clinton’s camp, was straightforward, saying, ""Cost won't be a barrier to an education. Debt won't hold you back. Read Hillary's plan: http://hrc.io/college."" The Bush camp replied by tweaking the original visuals and saying, ""100%: The increase in student debt under this Democratic White House."" Then the Clinton camp shot back by ""scribbling over"" Bush’s graphic with the following claim: ""F: The grade given to Florida for college affordability under Jeb Bush's leadership."" It cited the the Center for Public Policy and Higher Education. So did Florida received an F for college affordability when Bush was governor from 1999 to 2007? There is some evidence to back this up, but Clinton's jab leaves out important context on the cost of Florida higher education during the Bush years. (We separately checked Bush’s claim about the increase in debt.) The claim comes from the Center for Public Policy and Higher Education, which shut its doors in 2010. The independent group, funded by philanthropies such as Pew Charitable Trusts and the Ford Foundation, graded states every two years on a variety of metrics for higher education. One was ""affordability."" In looking at this subject, the group sought to answer this question: ""How difficult is it to pay for college in each state when family income, the cost of attending college, and student financial assistance are taken into account?"" To do this, researchers considered such criteria as tuition for community colleges and public and private four-year colleges and universities; the degree of state investments in need-based financial aid; and the extent of student debt. For the year cited in Clinton’s tweet -- 2006 -- Florida did receive an F for affordability. And it wasn’t the only time: In 2004, the study also gave Florida an F. But Florida was hardly alone in flunking the affordability test. In 2006, the year the Clinton camp selected for the tweet, every state but seven received an F, and those ""lucky"" seven states didn’t do much better: Five ended up with a D while two got a C. The missing context from the tweet, then, is that Florida was not uniquely bad -- not by a longshot. Our own previous fact-checking concluded that while tuition went up under Bush, it did so at a rate slower than the national average. We found that Bush signed budgets in which the Legislature increased tuition substantially, but we also found that in-state, undergraduate tuition in Florida was still modest compared to to other states when Bush left office. Bush’s team cited several policies he helped institute on education: He put in place a First Generation Matching Grant for Floridians who are the first in their families to attend college; gave the Florida Student Assistance Grant Program a record 21.9 percent increase in 2006; and expanded the lottery-funded Bright Futures Medallion Scholarship program to cover 100 percent of community-college tuition fees. Still, the reports cannot be discounted entirely. Troy Miller, associate director for research and policy for the student advocacy group the Florida College Access Network, said the reports were important because they looked at whether state’s residents could typically afford the price tag of college in their state. ""The way the authors evaluate affordability is valid, even if their grading scale is arbitrary,"" such as the fact that most states received an F, Miller said. Miller added that Florida may have suffered in the ratings because of the Bright Futures program, which was a merit-based program, not one that was need-based. The report points out ""that Florida awards little state aid on the basis of need relative to other states,"" he said. Our ruling Clinton said that under Jeb Bush, Florida got an F for college affordability. The report on which her campaign is basing the claim confirms that in 2006 Florida received an F in this category. Still, it’s worth noting that 43 of the 50 states scored an F in 2006, meaning that Florida’s grade wasn’t uniquely bad. And while tuition did increase on Bush’s watch, the rate of increase was smaller than the national average. The statement is partially accurate but leaves out important details, so we rate it Half True.",/factchecks/2015/aug/14/hillary-clinton/hillary-clinton-tweets-florida-got-f-college-affor/
"['National', 'Debt', 'Education', 'Jeb Bush']","
Jeb Bush: Student loan debt has doubled under Obama
","In a Twitter back-and-forth with Hillary Clinton’s 2016 campaign, former Florida Gov. Jeb Bush said Democrats don’t have a great track record for keeping student loan debt in check in recent years. On Aug. 10, as part of promoting her college affordability plan, Clinton tweeted a graphic that said ""$1.2 trillion, the amount 40 million Americans owe in student debt,"" accompanied by the text, ""Cost won't be a barrier to an education. Debt won't hold you back."" Bush, running for the Republican nomination, responded with his own similar graphic that said, ""100 percent, the increase in student debt under this Democratic White House. Hillary Clinton: mortgaging the future of college grads for four more years."" Has the student debt really doubled in the past seven years, and is it fair to tie it to Barack Obama’s presidency? (We also fact-checked Clinton’s response -- a third graphic that said Florida received an ""F"" in college affordability under Bush. See that article here.) The numbers, for the most part check out. But experts told us that rising student loan debt is a trend that started long before the Obama administration. ""The long term trend of colleges becoming unaffordable goes back to the mid-1980s -- when private colleges started jacking up the prices,"" said Stephen Burd, a senior policy analyst at the New America Foundation and an expert in higher education policy. ""In more recent years, it's been the publics that have seen bigger percentage increases in tuition."" Total student loan debt has increased about 86 percent since Obama took office -- a bit under the 100 percent increase Bush cited -- according to figures from the Federal Reserve. At the end of 2008, right before Obama was inaugurated, the total student loan debt was $640 billion. By March 2015, student loan debt was $1.19 trillion. This graph from the National Center for Education Statistics shows the total student loan debt from 2003 through 2012, adjusted for inflation:    Experts told us that total student debt increases when tuition increases and when more students enroll, and the 2008 recession caused both of these things to happen -- so the recent increase is more a function of the economic downturn, rather than having a Democrat in the White House. The economic downturn pushed states to cut higher education funding, so schools upped tuition to cover costs, said Donald Heller, dean of the College of Education at Michigan State University. Since 1980, private college tuition has increased about 200 percent, according to College Board data compiled by Heller. Public school tuition, on the other hand, has increased about 300 percent, with by far the biggest jump happening since 2008. As opposed to Obama, ""some critics say governors and state legislators are to blame since they didn't protect higher education funding -- and colleges, since they haven't controlled costs,"" said Joni Finney, director of the Institute for Research on Higher Education at the University of Pennsylvania. Even with the increased tuition, more people enrolled in college, as people tend to do when employment prospects appear to dry up, Heller said. Additionally, the recession left households with fewer of their own resources to fund higher education, so they had to take out more loans. There haven’t been any big policy changes so far in the Obama administration that would have affected student loan debt significantly, either positively or negatively, said Beth Akers, a Brookings Institution fellow and an expert on the economics of higher education. ""It is far reaching to suggest that the president has had a significant impact on student borrowing during his administration,"" Akers said. The White House pointed out that the Obama administration has taken other measures to improve college affordability, such as expanding federal scholarships and implementing programs to help borrowers pay back student loans. Akers added that more collective debt is not necessarily a bad thing because higher education generally produces large and positive returns for its graduates. More collective debt means that more people are pursuing higher education -- particularly those from lower income brackets, who need loans the most. Our ruling Bush said there has been a 100 percent ""increase in student debt under this Democratic White House."" There has been a substantial increase in student loan debt over the course of Obama’s presidency -- but it’s an increase of about 86 percent, not 100 percent. Experts also told us that student loan debt was growing before Obama took office, too, and much of the increase that happened under his watch was a result of the recession and other factors out of the White House’s control. We rate Bush’s claim Half True.",/factchecks/2015/aug/14/jeb-bush/jeb-bush-student-loan-debt-has-doubled-under-obama/
"['Disability', 'Pensions', 'Retirement', 'States', 'Wisconsin', 'Scott Walker']","
Wisconsin is only state with a fully funded pension system, Scott Walker says
","Scott Walker fired off 13 tweets on July 26, 2015 that cite accomplishments and highpoints during his time as Wisconsin's governor. This was one of them: ""Overall bonding in latest WI state budget is at 20 year low. State pension system is only one fully funded in the country."" We decided to check the second part of the statement to see if anything has changed since we first rated it True in 2013. The fully-funded pension system is also a prominent talking point for Walker in his quest for the Republican presidential nomination. Where pension benefits come from The Wisconsin Retirement System provides retirement, disability and death benefits not only to all state employees, but to nearly all local government employees in Wisconsin. With some $85 billion in what are known as actuarial assets, it covers more than 256,000 active public employees, including teachers and municipal employees, plus 154,000 retirees and others who are no longer active employees. The funds come from three sources: employer contributions, employee contributions and investment earnings. The employer-employee split was changed dramatically by Act 10, Walker's 2011 collective bargaining reform law. Before Act 10, the state, as well as the local governments participating in the state retirement system, had agreed to make almost of the contributions that employees were required to make toward their pensions. In other words, often as a result of union bargaining, the employers were making the employer contributions to the pension fund and nearly all of the employee contributions, as well. In 2010, for example, state and local government employers made 99 percent of the employer-employee contributions to the system. As of 2013, the latest figures available, employers paid 57 percent and employees 43 percent. So, just how healthy is the pension fund, and how does it compare? How close to fully funded? The state's most recent actuarial evaluation showed that as of the end of 2013, the retirement system was in balance. That is, the expected total retirement benefit obligations equalled the assets ultimately expected to be available to the system. More specifically, the Gabriel Roeder Smith & Co. firm said the pension fund was 99.96 percent funded. It’s worth noting the actuarial reports have shown the retirement system funding at 99 percent or greater not only during Walker's tenure, but dating back to 2003. Wisconsin's pension system has long been viewed as a national model. When we rated Walker's 2013 claim that Wisconsin’s pension fund was the only fully funded one in the country, we relied primarily on a report from the non-partisan Pew Charitable Trusts. It was since updated, with the most recent version published in July 2015. That report shows that in 2013, South Dakota's pension system had joined Wisconsin as being fully funded. Pew actually ranked South Dakota first and Wisconsin second, even though both were 99.9 percent funded. The national average was 72 percent. Illinois was lowest, at 39 percent. Another report -- which included some actual as well as estimated data for 2014 -- also listed South Dakota and Wisconsin as the only fully funded pension systems. That report, from the Center for Retirement Research at Boston College, estimated that Wisconsin had an asset-to-liability ratio of 104 percent for 2014, up from 99.9 percent in each of the three previous years. Actual data for South Dakota, meanwhile, showed that state's pension system was funded at 100 percent in both 2013 and 2014. (The report also examined local pension plans. The City of Milwaukee's was estimated at 100.8 percent funded in 2014.) Keith Brainard, research director for the National Association of State Retirement Administrators, told us Wisconsin and South Dakota are well funded because their investments have performed well and their retirement benefits ""have remained fairly reasonable."" In addition, in Wisconsin’s case, retirement benefits go down when investments don’t perform up to par, he said. Our rating Walker says Wisconsin's ""pension system is only one fully funded in the country."" That was the case among state pension plans in 2012, but newer reports show slightly different results. According to Pew Charitable Trusts, both South Dakota and Wisconsin were fully funded in 2013; and according to Boston College, both were fully funded in 2013 and 2014. We rate Walker’s statement Mostly True.",/factchecks/2015/aug/14/scott-walker/wisconsin-only-state-fully-funded-pension-system-s/
"['Abortion', 'States', 'Florida', 'Marco Rubio']","
Marco Rubio says a minor can get an abortion -- but not a tattoo -- without parental consent
","Teenagers getting inked is apparently subject to greater parental say than getting an abortion, according to U.S. Sen. Marco Rubio. In an Aug. 4 interview with Southern Baptist Convention President Russell Moore, Rubio joined other Republicans in criticizing Planned Parenthood amid the release of videos by an anti-abortion group that accuse the group of harvesting fetal tissue for profit. A day earlier, Florida’s Republican senator had been among those who voted to defund Planned Parenthood, a measure that failed to get the required 60 votes to advance. In his interview, Rubio raised concerns about nationwide access to abortions for minors: ""The idea that a minor can go get a tattoo,"" he said, before quickly correcting himself to say ""cannot get a tattoo without parental consent -- but can get an abortion without parental consent -- is just mind-shattering for the vast majority of Americans. ... People who believe that a young child, a minor, should be able to get an abortion easier than a tattoo -- they are the extremists."" We decided to check whether minors need their parents’ permission to get a tattoo, but don’t need permission to get an abortion. Parental consent laws First, the laws about parental consent for abortion and tattoos vary from state to state, so it’s not possible to make a blanket statement as Rubio did and apply it to the whole country. According to data through March 2015 compiled by the National Conference of State Legislatures, at least 45 states have laws prohibiting minors from getting tattoos, with the majority of those states allowing it if there’s parental consent. For example, Florida law requires written, notarized consent of a minor's parent or legal guardian in order to tattoo a minor. Now let’s look at whether minors need their parents’ permission to obtain an abortion. There are two different categories of parental involvement: one is consent, which means a parent has to sign off on the abortion, while the other one is simply notification which can mean the parent receives a letter or a phone call about the abortion. According to Guttmacher Institute, a group that tracks abortion policy and statistics, a majority of states require consent and/or notification. In 38 states, minors either have to get consent and/or notify their parents, while in 12 states they don’t need either. We asked Alex Conant, a spokesman for Rubio, which states require parental consent for a tattoo but not for an abortion. Using information from Planned Parenthood about abortion laws and the National Conference of State Legislatures about tattoo laws, Conant pointed to seven states:   State Abortion law for minors Tattoo law for minors California No parental involvement required It is a misdemeanor to tattoo anyone under age 18. Connecticut No parental involvement required Requires permission of parent or guardian. Hawaii No parental involvement required Requires written consent of parent or guardian Maine No parental involvement required It is illegal to tattoo anyone under age 18. Montana No parental involvement required Requires explicit in-person consent of the child's parent or guardian. New York No parental involvement required It is unlawful to tattoo the body of a child less than 18 years old. Vermont No parental involvement required Requires written consent of his or her parent or guardian. Sources: Planned Parenthood and the National Conference of State Legislatures Conant included two states that flat-out ban tattoos for minors: California and Maine. So that leaves five states that require parental consent for tattoos but have no parental involvement required for abortions. However, Rubio used the more narrow term of ""parental consent"" in his interview -- not ""parental involvement"" or ""notification."" There are some states that require only parental notification for abortion but do require consent for tattoos -- for example Florida. So that means that a Florida teenager doesn’t need her parents’ permission to get an abortion -- but does for a tattoo. State Abortion law Tattoo law Colorado Parental notification only Requires express consent from the minor's parent or guardian. Delaware Parental notification only Requires prior written consent of the adult parent or legal guardian. Florida Parental notification only Requires written, notarized consent of a minor's parent or legal guardian in order to tattoo a minor. Minnesota Parental notification only Requires written parental consent. South Dakota Parental notification only Requires signed consent form from the minor's parents West Virginia Parental notification only Requires prior written consent from a parent or guardian Source: Guttmacher Institute and National Conference of State Legislatures So in all, Rubio has a point for about 11 states. Complicating matters is that there is a way to avoid parental involvement. Since the U.S. Supreme Court has ruled that states may not give parents an absolute veto over whether their daughters have an abortion, 37 states that require parental involvement include a ""judicial bypass"" procedure. This allows a minor to receive court approval for an abortion without her parents’ knowledge or consent. Use of judicial bypass could increase the number of states where Rubio’s scenario would be valid. A spokeswoman for Americans United for Life, told PolitiFact that ""even in states with the most stringent parental consent requirements, a minor who can demonstrate (with the assistance of free counsel) to a court that she is either mature enough to make an abortion decision, or that obtaining parental consent is not in her best interest, can bypass the parental consent requirement.""   However, it’s worth noting that, despite the existence of judicial bypass, a majority of pregnant minors who seek abortion report that their parents are aware that they are doing so, according to a literature review by Guttmacher in 2009. Helena Silverstein, a government and law professor at Lafayette College who wrote a book in 2007: ""Girls on the Stand: How Courts Fail Pregnant Minors,"" suggested that rather than compare parental consent for tattoos to abortion, it is more useful to compare other minors’ consent law as they relate to sexual and reproductive health. All states allow minors to consent to get treatment for sexually transmitted infections while 32 states allow minors to consent to prenatal care without their parents’ permission. J. Shoshanna Ehrlich, an expert on reproductive rights at the University of Massachusetts, was also skeptical of Rubio’s comparison. While it ""must suck to be 16 and wait until you are 18 to get a tattoo, you can postpone the decision,"" unlike abortion, she said. Our ruling Rubio said ""a minor cannot get a tattoo without parental consent but can get an abortion without parental consent."" Rubio has a good argument for about 11 states, but that’s a minority. More commonly, parents by law need to be at least notified -- and in many cases give their consent -- for a minor to have an abortion. There is a significant exception, however: 37 states allow a minor to go through a judge without notifying parents. As for tattoos, most states either ban them for minors or require parental consent. We rate this claim Half True.",/factchecks/2015/aug/13/marco-rubio/marco-rubio-says-minor-can-get-abortion-not-tattoo/
