tags,sub_header,text_body,sources,quote_href
"['Economy', 'Jobs', 'New York', 'Robin Schimminger']","
Explaining the confusion over the Start-Up NY Report
","Assemblyman Robin Schimminger, D-Kenmore, said state officials reported an incorrect number of jobs created by companies participating in Start-Up NY, one of the state’s economic development programs. A report released in July says the program created 408 jobs in its first two years, 2014 and 2015. Schimminger, who chairs the Assembly’s Economic Development Committee, said at a hearing earlier this month that Empire State Development Corp. inflated its claim of 319 jobs in 2015 by as many as 80 positions. The report puzzled Schimminger and other lawmakers because it showed more net new jobs for the companies than the number of jobs the companies said they created. ""I could not figure out how that could be, until I came to the conclusion that very possibly the companies were reporting a two-year amount, the 2014 and 2015 net new jobs created and including them in their submission to the agency,"" Schimminger said at the hearing. ""The agency then simply took that number, tallied it and reached what should be the correct tally number to include in the report. However, they were the wrong numbers from the companies. So I would submit this is not the difference of a dozen or so, this is a significant number of overcounts in the compilation that I’ve looked at."" Howard Zemsky, head of the Empire State Development Corp., defended Start-Up NY before the Assembly panel. ""I don’t acknowledge that there are any inaccurate numbers,"" Zemsky replied. Who’s right? We took a closer look. Did the Start-Up NY report inflate job claims by double counting many of the jobs? What’s a net new job? Start-Up NY offers businesses tax relief for 10 years when they locate or expand on or near a participating college campus. The state must publish an annual report on the program’s progress. This year’s report was tucked inside an omnibus report of other state incentive programs called the Business Incentives Report. The section on Start-Up NY takes less than three pages. Last year’s report was a 14-page document. This year’s report offers little guidance on how to interpret the information in the report other than a few footnotes and a set of unidentified appendices. Understanding the report requires knowing the state’s definition of a ‘net new job.’ It’s not just any job created during the year. It must be a job that did not exist before the company joined the program. It has to be full time. It has to be filled for more than six months. Empire State Development counted 319 net new jobs in the report. A separate part of the report shows jobs created at any point during the calendar year. No six-month requirement applies to this count. That means any job filled in the second half of 2015 was counted in this number - but not included in the net new job count because it did not reach the six month mark by the end of the year. By that way of counting, the state reported 332 jobs created in 2015. Counting the jobs So the 319 net new jobs in the report are jobs filled at any point during the 2014 calendar year or in the first half of 2015. The 332 jobs created are new, full-time positions companies reported creating during the entire 2015 calendar year. We reached out to Liazon Corp., which expanded in Buffalo under Start-Up NY. Liazon confirmed this is its explanation for why it reported more net new jobs than jobs created in 2015. Our ruling Schimminger said at an economic development hearing in Albany that Empire State Development reported ""wrong numbers from the companies"" in Start-Up NY. So the report included ""a significant number of overcounts in the compilation,"" he said. Empire State Development did not provide guidance on how to read the report, so anyone not privy to state definitions of certain terms may have come to the same conclusion as the assembly member. Schimminger, of course, is not just anyone. Schimminger served as chairman of the Assembly's small business committee from 1985 until 1997, when he was named chairman of the Assembly Standing Committee on Economic Development, Job Creation, Commerce and Industry. A closer look at the law explains how the numbers are reported. We rate Schimminger’s claim as False. https://www.sharethefacts.co/share/10730ecb-e329-40ec-8370-9bb70ece7310",[<zip object at 0x00000280979F13C0>],/factchecks/2016/aug/26/robin-schimminger/explaining-startup-ny-report/
"['Energy', 'Gas Prices', 'Transportation', 'Taxes', 'Wisconsin', 'Paul Ryan']","
How much would Barack Obama $10-per-barrel tax on oil raise gas prices? 24 cents, Paul Ryan says
","In an Aug. 11, 2016 tweet that was augmented with a bit of animation (a counter with rolling numbers), House Speaker Paul Ryan declared: ""President Obama’s proposed oil tax would cost consumers 24 cents a gallon."" That’s a flat declaration of a specific figure. Let’s see if it’s on the money. Ryan’s evidence To back Ryan’s statement, his office cited a February 2016 article from MarketWatch.com, which reported on Obama’s proposal for a $10  tax on each barrel of oil to pay for ""clean"" transportation projects such as expanding mass transit. The article said the tax would be paid by oil companies and gradually phased in over five years. To be clear, the article said the proposal ""isn’t expected to go far."" And in a news release Ryan issued the same day as his tweet, he said the tax is ""dead on arrival in Congress."" The MarketWatch article quoted Patrick DeHaan, senior petroleum analyst at GasBuddy.com, as saying: ""This proposal would trickle down and be a $10 per barrel tax on motorists -- or 20 to 25 cents per gallon on refined fuels. To me it’s clear: this is not something oil companies are going to absorb."" So, 24 cents is in the range of the analyst’s estimate. But it’s only one analyst; and his estimate is based on how he thinks oil companies would respond to a $10-per-barrel tax. What the oil companies would do isn’t quite as certain as what Ryan claimed. A trade group that should know, the American Petroleum Institute, warned the tax would ""harm consumers."" But it hedged a bit in saying the tax ""could"" raise the cost of gasoline by 25 cents a gallon. Economist Nicolas Loris estimated the cost slightly lower, at 22 cents, the Huffington Post said 22 to 24 cents, and the Washington Post said 24 cents. Politico and Forbes said about 25 cents. One note: The federal government currently imposes a tax of 18.4 cents per gallon of gasoline. But that’s a direct tax on gas, not on the oil companies. Our rating Ryan said: ""President Obama’s proposed oil tax would cost consumers 24 cents a gallon."" Estimates are in the 24 cents range for the $10-per-barrel tax that Obama proposed on oil companies. But it’s not a sure thing, if the tax became law, that all of the tax would be passed onto consumers. We rate the statement Mostly True.",[<zip object at 0x0000028097BDB680>],/factchecks/2016/aug/26/paul-ryan/how-much-would-barack-obama-10-barrel-tax-oil-rais/
"['Education', 'Public Health', 'Taxes', 'California', 'No on 56 campaign']","
Big Tobacco blowing smoke in claim about California's Prop 56
"," Opponents of Proposition 56, California’s proposed $2 per pack cigarette tax hike, are flooding radio airwaves with attacks on the measure. The initiative is one of many on the state’s November ballot. The No on 56 campaign is funded by tobacco companies Phillip Morris and R.J. Reynolds. Its campaign says online and in radio ads that the measure ""cheats schools out of at least $600 million a year."" The industry attacks are not surprising. And they’ll likely continue as opponents of the measure have raised more than $35 million, while supporters have collected about $17 million. We wondered whether there’s any truth to the claim that Prop 56 ‘cheats’ schools out of all that money. Our research Nearly three decades ago, voters in California approved Proposition 98 requiring a minimum level of funding for public education. It requires the state to dedicate roughly 40 percent of new General Fund revenues to K-12 schools and community colleges. Prop 56 would generate up to $1.4 billion in tax revenue its first year. But instead of sending that revenue to the General Fund, Prop 56 would place it in a special fund to help pay for Medi-Cal, which provides health coverage for millions of low-income Californians. We asked the No on 56 campaign for evidence that the tobacco tax measure ‘cheats’ schools. A spokeswoman pointed to language in the measure that exempts Prop 56 from the school funding guarantee. The campaign said this exemption is proof that the measure undermines the funding guarantee and ‘cheats’ schools. But the experts we spoke with say there’s nothing new about this proposal. Past tobacco taxes, in 1988 and 1998, also established special funds rather than sending money to the General Fund. One of the experts said the opponents’ claim is misleading. ""When I think of this claim that the schools are going to be cheated -- particularly that word ‘cheated’ out of this money -- that suggests something that’s wrong or illegal. And this is not the case,"" said Steve Boilard, executive director of Sacramento State University’s Center for California Studies. ""There’s plenty of examples where new revenue is raised that is not subject to the Prop 98 funding guarantee."" Boilard pointed to Proposition 63, a tax on wealthy Californians that funds mental health services.  Curran Kelleher / Flickr Others reject claim State Superintendent of Public Instruction Tom Torlakson rejected the claim that the new tax measure ‘cheats’ schools. In a recent letter circulated by the Yes on 56 campaign, he wrote: ""Make no mistake, Proposition 56 will not divert a dime away from schools. Rather, it will raise revenues for school based tobacco prevention and intervention programs."" A report by the Legislative Analyst’s Office estimates Prop 56 will add $20 million for those school based programs. The Sacramento Bee’s fact-checking team, PoliGRAPH, recently examined the same claim about Prop 56 ‘cheating’ schools. It found that it ""isn’t fair to say the measure 'cheats' schools out of $600 million a year. Nothing in the measure reduces school funding. If the measure passes, the budget for schools does not decrease."" Our ruling The No on 56 campaign is running ads that say the proposed tobacco tax ""cheats schools out of at least $600 million a year."" The measure includes an exemption from the state’s school funding guarantee. A portion of its revenues, estimated at up to $1.4 billion, could otherwise have been directed toward school funding. But past tobacco taxes and a tax to fund mental health services have also legally avoided this guarantee. Those had exemptions allowing their revenues to fund health services. This doesn't mean, however, that money will be taken from schools or community colleges under Prop 56. The measure, in fact, sends about $20 million to schools for tobacco prevention programs. The claim that Prop 56 ""cheats"" schools goes too far. It might have been accurate to say the measure exempts most all revenue from going to schools. But the term chosen by No on 56 is misleading. We rate the claim Mostly False. MOSTLY FALSE – The statement contains some element of truth but ignores critical facts that would give a different impression. Click here for more on the six PolitiFact ratings and how we select facts to check. https://www.sharethefacts.co/share/aabdc989-5155-4716-837a-cae1783eac21",[<zip object at 0x0000028096EDB740>],/factchecks/2016/aug/26/no-56-campaign/big-tobacco-misleads-mostly-false-claim-prop-56-ch/
"['Jobs', 'Taxes', 'Wisconsin', 'Russ  Feingold']","
Feingold: Johnson voted five times for tax breaks that help ship Wisconsin jobs overseas
","In the race for the U.S. Senate, a new TV ad from challenger Russ Feingold claims that U.S. Sen. Ron Johnson, the Republican incumbent, ""voted five times for tax breaks that help companies ship Wisconsin jobs overseas."" When it comes to attacks on Republican officeholders, this claim is not new. In 2014, PolitiFact National wrote: ""Democrats and their advocates have washed, rinsed and are now repeating one of their favorite talking points from 2012: that ‘(Insert Republican Here) supports tax breaks for corporations that ship jobs overseas.’ "" The piece called the description ""so simplistic as to be misleading,"" adding there is no specific tax break for sending jobs to other countries. OK, 2012 … 2014 … 2016 … we’re sensing a trend here. Let’s take a look at how Feingold’s claim fares on the Truth-O-Meter. Bring Jobs Home Act The Feingold campaign cited five votes by Johnson, two of which were on what was termed the Bring Jobs Home Act, which would have given companies credit for bringing jobs to the United States and denied existing deductions associated with moving a business outside the country. Those two votes were specifically addressed in a 2014 factcheck involving a claim against U.S. Sen. Mitch McConnell, R-Kentucky. The claim in the 2014 piece was that McConnell voted ""three times for corporate tax breaks that send Kentucky jobs overseas."" Feingold’s campaign emphasized that the claim in their ad was that Johnson voted five times for tax breaks that help companies ship jobs overseas, not that corporate tax breaks by themselves are responsible for sending jobs outside the U.S. ""Like that PolitiFact notes, McConnell voted against denying deductions for costs associated with outsourcing,"" Feingold spokesman Michael Tyler said in an email to PolitiFact. ""That helps a company attempting to ship its jobs elsewhere."" But the earlier item noted: ""The tax breaks that the law would have stopped are actually standard business expense deductions. Companies can write off many business-related expenses as tax-deductible -- including relocation. But this isn’t a special provision just for businesses that move outside of the United States. A business would get the same deductions for money spent moving from New York to California."" Tax experts said there is very little money associated with these standard deductions and ""getting rid of deductions for business expenses associated with outsourcing would not be nearly enough to affect a company’s decision to engage in foreign activity."" The legislation was proposed in 2012 and 2014 and Johnson voted ""no"" on procedural measures in each case, functionally voting to block the legislation from moving forward. The measures failed on procedural votes. The legislation itself was ""almost entirely symbolic,"" PolitiFact reported. Three votes on budget amendments Now let’s turn to the other three votes, taken in March 2015 and cited by the Feingold campaign, this time on amendments to Congress’ concurrent budget resolution for fiscal year 2016. Two were proposed by Democrats and a third was proposed by Vermont Sen. Bernie Sanders, an Independent who ran as a Democrat in the 2016 presidential race. The amendments were opposed by Republicans, with the two Independents voting with the Democrats. -- Amendment 817 statement of purpose: ""To establish a deficit-neutral reserve fund to provide tax benefits to patriot employers that invest in American jobs and provide fair pay and benefits to workers and to eliminate tax benefits for corporations that ship jobs overseas."" -- Amendment 523 statement of purpose: ""To prevent United States companies from getting tax benefits for moving jobs overseas, to end offshore tax loopholes including inversions, and to provide incentives for United States companies to relocate overseas jobs to the United States."" -- Amendment 323 statement of purpose: ""To create millions of middle class jobs by investing in our nation's infrastructure paid for by raising revenue through closing loopholes in the corporate and international tax system."" USA TODAY reported that amendment 323 targets ""tax loopholes"" that ""let corporations and wealthy Americans shift jobs and profits overseas."" But experts we spoke with said these votes had no practical effect. Congress’ concurrent budget resolution does not have the force of law and it would not be the place to change the tax code, said Steve Ellis, vice president of Taxpayers for Common Sense. ""To me those are just sort of messaging -- they were all very much of a partisan vote,"" Ellis said. He added: ""You can argue, well, he voted against whatever the message that the member, the Senator, was trying to get across, but I wouldn't necessarily say that was voting for tax breaks that help companies ship Wisconsin jobs overseas because if he had voted for it, it wouldn’t have had any effect and voting against it didn’t have any effect."" In addition, he said, tax reform would have to originate in the House, and it would be dealt with by the Senate Committee on Finance and the House Committee on Ways and Means -- not on the floor of the Senate in a budget resolution. In an email, Johnson’s campaign said the senator’s position is that ""we should scrap the tax code, rather than favor any single deduction."" Our rating Feingold’s campaign ad said Johnson ""voted five times for tax breaks that help companies ship Wisconsin jobs overseas."" By voting against the Bring Jobs Home Act, Feingold is correct that Johnson voted against denying deductions associated with moving a business out of the country. But, as the 2014 PolitiFact notes, the law was mostly symbolic and these aren’t deductions specifically for moving jobs elsewhere, which is how the statement could easily be interpreted. The amendments to the budget resolution on which he voted had no practical effect, experts told us. We rate this claim False.",[<zip object at 0x00000280973A1C00>],/factchecks/2016/aug/26/russ-feingold/feingold-johnson-voted-five-times-tax-breaks-help-/
"['Education', 'Illinois', 'Rahm Emanuel']","
Emanuel scores well on CPS test
","In June, Illinois Gov. Bruce Rauner called some Chicago Public Schools ""crumbling prisons,"" and then five-year-old emails from when he was in private business revealed he’d also called principals ""managerially incompetent"" and half its teachers ""virtually illiterate."" Chicago Mayor Rahm Emanuel could not let the moment pass, even as he said he was accepting Rauner’s apology for the remarks. At a press event after Rauner’s email comments were released, Emanuel used the opportunity to boast about CPS students’ achievements. ""Well, let me tell you what the [Chicago Public Schools] ‘crumbling prisons’ with wardens as principals and guards as teachers have done. They lead the country in high school graduation of an urban school system…They now match the United States of America in kids graduating high school going on to a four-year college...That same prison with that same warden and that same security guard is also producing eighth-grade leaders in the country in math gains, fourth-grade leaders in reading gains."" That’s a lot to study, so we decided to do our homework. Testing the claims Lauren Huffman, a spokeswoman for the mayor’s office, noted Emanuel often repeats those claims, citing statistics from the National Assessment of Educational Progress. The NAEP calls itself the largest, continuing organization that tests students in a variety of subjects. It is under the umbrella of the National Center for Education Statistics run by the federal education department. We were able to verify the mayor’s claims about eighth-grade math and fourth-grade reading by examining ""The Nation’s Report Card"" for 2016 and the Trial Urban District Assessment published by the NAEP, and by interviewing Grady Wilburn, a statistician with the National Center for Education Statistics. Wilburn said Chicago’s fourth-grade reading score had improved 15 points since 2003, the second-highest improvement behind Washington, D.C., which improved 26 points. Since 2013, Chicago improved 7 percentage points and tied for first place with Washington, Cleveland and Boston.      While the chart shows numerically that D.C. is higher, it does not account for statistical significance. Wilburn said when districts are tested for statistical significance, Washington, Cleveland and Chicago are not different from each other. Significance testing considers sampling error associated with only assessing a portion of students, not all of them. In eighth-grade reading, Wilburn said scores show Emanuel’s statement to be accurate. Since 2003, he said, eighth-grade CPS math scores have improved 20 percentage points. They are statistically tied for highest gains since 2003. They’re tied with Atlanta, Boston and Los Angeles. If you look just at 2013-15, Chicago’s scores went up 6 percentage points, and that is the biggest gain. Of the 21 urban districts monitored, CPS students were the only ones to improve in eighth-grade math from 2013 to 2015.   Passing or surpassing? Emanuel made two other claims about Chicago Public School students. One of the claims was that they now match the nation in kids graduating high school and going on to a four-year college. The Chicago Consortium on School Research at the University of Chicago published a new study in June that examined high school graduation, college enrollment and bachelor’s degree attainment rates. Chicago Public Schools’ ""four-year college enrollment rate for 2014 is 42 percent, two percentage points lower than the national rate, and half of CPS graduates who enroll in four-year colleges will graduate in six years,"" a summary of the report says. Two percentage points lower than the nation in college enrollment would indicate Emanuel’s statement is slightly off, but it is clear CPS graduation rates, college enrollment and degree attainment have been rising significantly. In 2006, the graduation and college enrollment rate was eight percent. In nine years, by 2015, that rate had doubled to 16 percent. Emanuel’s other claim, that CPS leads the nation among urban districts for high school graduation, was more difficult to verify. The National Center for Education Statistics put the adjusted cohort graduation rate at 82 percent for 2013-14. Jenny Nagaoka, deputy director of the University of Chicago Consortium on School Research and an author of the study of CPS college attainment, said the CPS rate for the same year is 74 percent, but she cautioned the two institutions might rely on districts that calculate rates differently. Unlike reading and math scores, there doesn’t appear to be a comparison of urban district graduation rates. In 2012, she said CPS was ""probably in the middle of the pack"" nationally. ""On the basis of this, I can’t conclusively say this is a true or false statement,"" she said. ""CPS is certainly higher than Baltimore. We may be higher than New York. CPS is certainly higher than many. Chicago has made great gains. We’ve really closed the gap compared to the national rate and that’s important."" Chicago’s improvement in graduation rate comes at a time when, nationally the rate also has been climbing. ""It is a big accomplishment to improve the gap when the national rate also is improving,"" Nagaoka said. Our ruling Emanuel’s boasts about reading and math scores compared to other urban districts were accurate. His statement about going on to four-year college was a bit off, but probably not statistically significant. We could not find data to conclusively verify that CPS leads urban districts nationwide in its graduation rate, but it has made dramatic improvement. A similar study from the consortium concludes, ""While changes in student demographics account for some of the increase in graduation rates, improvements in student performance in high school — compared to similar students who started high school in the past — accounts for most of the change; students are passing more classes and earning more credits in ninth grade. Not only are more students graduating, but they are leaving high school with higher achievement than graduates in prior years. We rate this claim Mostly True.",[<zip object at 0x000002809C4F54C0>],/factchecks/2016/aug/25/rahm-emanuel/emanuel-scores-well-cps-test/
