tags,sub_header,text_body,quote_href
"['Candidate Biography', 'Health Care', 'Government Regulation', 'Public Health', 'Wisconsin', 'Tommy Thompson']","
GOP Wisconsin Senate candidate Tommy Thompson says he never backed individual mandate
","
Among conservatives, a hated provision of federal health care reform is the ""individual mandate,"" which requires Americans (with some exceptions) to buy health insurance.

That sentiment has left Republican Tommy Thompson in a difficult spot as he vies with three opponents in the August 2012 primary for U.S. Senate.

The former governor and U.S. health and human services secretary has made statements for and against the health care reform legislation that eventually became law. That led us to rate Half True a claim by the national Club for Growth, a conservative group, that Thompson supported ""Obamacare.""

On June 13, 2012, two weeks before the U.S. Supreme Court declared most of the reform law constitutional, Thompson issued two Internet statements about the individual mandate.  

In one message from a Twitter account for his campaign, Thompson said he ""didn’t support the individual mandate.""

And in the other tweet, directed at Democratic Senatorial Campaign Committee spokesman Matt Canter, he went further, stating:

""Can’t back down from something (i.e. the individual mandate) that you never supported, Canter.""

Taken together, Thompson is claiming he ""never supported"" the individual mandate.
Never is pretty absolute, so let’s check the record.

Opponents’ evidence

Arguing that Thompson did support the mandate, Canter cited a video clip released by the Washington, D.C.-based Club for Growth the day before the Supreme Court ruling.

(While the national Club for Growth has repeatedly attacked Thompson, and is supporting Republican Mark Neumann in the Senate race, the Wisconsin chapter has not.)

In the clip, Thompson speaks at a national health care reform forum at American University in Washington, D.C. At the April 2006 event, held more than two years before Obama’s election, Thompson refers to reform in Massachusetts, saying:

""You’ve also got to consider strongly -- and I happen to support that, what Massachusetts did -- and that is requiring health insurance, the coverage of health insurance. This is a little bit opposed to what Republicans really think or propose. But the truth of the matter is, just like automobile insurance, you’ve got to have coverage. And if you’re going to be able to cover the uninsured, you’re going to have to have some degree of a mandate to cover the uninsured.""

Both Canter and Club for Growth also cited video of a University of Texas speech in February 2007 in which Thompson says:

""I, for one, believe the mandate for health insurance is all right. We mandate insurance for automobiles. You know you can’t drive in Texas without automobile insurance. You can’t drive in any state without automobile insurance. It’s a mandate, but it’s certainly something that we should discuss in this country, and I think that’s positive.""

So, Thompson said he supported Massachusetts’ health insurance requirement and said such a mandate is ""all right,"" although both statements were made before Obama’s reform efforts were launched.

Thompson’s evidence

To defend Thompson’s claim, his campaign spokesman, Brian Nemoir, said Thompson ""is the only candidate who has testified before Congress against the mandates."" He cited a portion of Thompson’s May 2008 testimony to the Senate Finance Committee:

""I am not convinced that the individual mandate is the correct approach,"" Thompson said, according to a transcript. ""We have seen in Massachusetts that the individual mandate approach is not effective at covering the most vulnerable part of the population, that part of the population which needs coverage the most.""

So, after the generally supportive statements in 2006 and 2007, Thompson in 2008, shortly before Obama’s election, indicated he did not support an individual mandate.

Nemoir also cited an August 2011 report by the University of Pennsylvania-based FactCheck.org, which concluded that Club for Growth had falsely attacked Thompson as a ""champion of Obamacare,"" and he provided statements saying Thompson opposes what eventually became law.

But Thompson’s past or current positions on the overall reform are not at issue here.

In our item about Club for Growth’s claim about Thompson, Thompson’s campaign noted that Thompson at a July 2008 forum on a ""universal mandate"" for health insurance said: ""I don’t want a mandate."" But moments later Thompson said: ""I’m not opposed to it, I just don’t think it’s the most practical way.""

Our rating

Thompson said he ""never supported"" an individual mandate.

But while he is now an opponent of the health care reform law and its mandate requiring most Americans to buy health insurance, Thompson said in 2006 he supported a mandate and in 2007 said a mandate is ""all right.""

We rate Thompson’s statement False.",/factchecks/2012/jul/15/tommy-thompson/gop-wisconsin-senate-candidate-thompson-says-he-ne/
"['New Jersey', 'Economy', 'Jobs', 'Taxes', 'Joseph Kyrillos']","
Joe Kyrillos claims the United States is not producing jobs
","
Joe Kyrillos rejects the term ""Bush tax cuts.""

Rather, the Republican U.S. Senate hopeful casts the looming expiration of lower federal tax rates -- enacted under former President George W. Bush -- as tax increases the country can’t afford. That’s his argument considering the jobs market, which Kyrillos erroneously claimed in a recent interview is not growing.

""If we don’t take action there will be tax increases and I guess we would call them [President Barack] Obama tax increases or [U.S. Sen.] Bob Menendez tax increases,"" Kyrillos, a state senator who is challenging Menendez this November, said in a July 11 interview on WNYC’s The Brian Lehrer Show. ""Here's the thing: our economy is not performing. We are not producing jobs. We created 80,000 jobs last month. We don't talk about the jobs that we lost. The net of it all is that we lost jobs. And so listen, raising taxes now in these times is not going to help with job creation.""

Actually, the nation is adding jobs and has been for more than 20 months. So what is Kyrillos -- who has been traversing New Jersey on a ""statewide jobs tour"" -- talking about?

""Our country has 4.894 million fewer jobs than we did at the start of the recession. That is the net job loss the Senator was referring to,"" Chapin Fay, Kyrillos’ campaign manager, said in a written statement.

Federal labor statistics confirm the country shed nearly 4.9 million jobs since December 2007, the official start of the recession, according to the National Bureau of Economic Research.

But since June 2009 -- the official end of the recession -- the nation added nearly 2.6 million jobs.

So to support his claim that the ""net of it all is that we lost jobs,"" Kyrillos includes all of the job losses incurred during the recession.

Fay said the point Kyrillos was ""making is that we still have lost a lot of jobs since the recession and are not replenishing them fast enough. That is the context of his sentence and that is factually correct.""

But Kyrillos didn’t make any reference to that time frame in the interview, as he explained why the economy can’t now afford a tax increase.

And the fact is the trend has reversed since the end of the recession.

Though it may not be the growth Kyrillos or the rest of the country would like, the nation added 80,000 jobs in June, according to preliminary estimates.

Fay said in his statement that ""the 12.7 million Americans currently unemployed are certainly not reassured by the measly 80,000 jobs netted last month.""

But there still has been job growth.

The nation has added more jobs than it lost every month since October 2010. In the private-sector, job growth has been sustained even longer, with gains every month since March 2010.

Year over year, the country added more than 1.7 million jobs overall from June 2011 to June 2012. Over the same time frame, more than 1.9 million private-sector jobs were added.

Our ruling

Kyrillos said ""we are not producing jobs. We created 80,000 jobs last month. We don't talk about the jobs that we lost. The net of it all is that we lost jobs.""

The country is producing jobs. To suggest otherwise is wrong.

Kyrillos’ campaign manager said the Republican candidate was referring to total job losses dating back to December 2007, the start of the recession, when he said ""the net of it all is that we lost jobs.""

But Kyrillos doesn’t make that distinction during the interview.

The nation has sustained monthly job growth since October 2010. And year over year, more than 1.7 million jobs were added.

We rate this claim False.

To comment on this story, go to NJ.com.",/factchecks/2012/jul/15/joseph-kyrillos/joe-kyrillos-claims-united-states-not-producing-jo/
"['Rhode Island', 'Health Care', 'Housing', 'Income', 'Taxes', 'Vincent ""Buddy"" Cianci']","
Talk show host Buddy Cianci says Obama's health care plan dictates a 3.8 percent tax on home sales
","
It's the bogus claim that refuses to die.

Initially, the idea that President Obama's health-care law requires everyone who sells his or her home to pay a 3.8-percent sales tax was the stuff of unsigned chain e-mails.

On Wednesday, it was embraced by former Providence mayor and current talk show host Vincent ""Buddy"" Cianci.

Cianci was grilling Democratic congressional candidate Anthony Gemma about the health-care law; Gemma was barely able to get a word in edgewise. But it was Cianci’s questioning that caught our attention.

Cianci: ""Are you in favor of the part of Obamacare that says when you sell your house now you have to pay a 3.8-percent tax? When you sell the house. Are you for that?""

Gemma: ""No.""

Cianci: ""Well then, what are you supporting the Obama health-care plan for? Because that's what it calls for.""

Gemma: ""At the end of the day, at the end of the day . . .""

Cianci (interrupting): ""So if you sell your house, you've got to pay 3.8 percent. And you're for that? You're for that? I just want you to go on record. You're for paying the 3.8 percent when you sell the house? I just want to put you on tape. So you're for that? So the next time I ask you, you change your mind, that you can't say . . .""

Gemma (interrupting): ""I'm not for new taxes. I'm not for new taxes. I'm for appropriate . . . ""

Cianci (interrupting):  ""Well no. Are you for that? One question. Don't argue with me. I'm trying to get you some publicity. I want the people to know how you stand. Are you for the 3.8-percent tax on the house that a person sells when Obama's health plan goes in? Are you in favor of that? Are you in favor of that?""

Gemma: ""I am, I am for it, for it . . .""

Cianci (interrupting): ""Yes or no. Are you for it or against it?""

Gemma: ""I am for it -- the affordable . . . .""

Cianci (interrupting): ""Ok, thanks. I have to go to a break. He's for the tax.""

That's four times Cianci makes reference to a 3.8-percent tax if you sell your house. We e-mailed Cianci to see if he had any new information about the tax. We didn't hear back from him.

PolitiFact and other fact-checking organizations have looked at this issue before. (We last published an item on this in February.) They've all come to the same conclusion.

The health-care plan does include new taxes. One of them is a 3.8-percent tax on home sales by the wealthy and won’t affect the vast majority of sellers or buyers.

Here's why.

The tax does not apply to individuals with an adjusted gross income of under $200,000 in the year the sale takes place. Nor does it apply to couples with an AGI below $250,000. The amount a person (or a couple) makes on the sale is not included in the income calculation.

That rule alone eliminates the tax on more than 97 percent of tax returns.

Even if the seller exceeds the income limit, the tax only applies to the profit from the home sale, not the sales price itself. That's why it's not a sales tax, as it's sometimes characterized.

Finally, the first $250,000 in profit is excluded from the new tax. For couples, the first $500,000 in profit is excluded.

To put that in perspective, the National Association of Realtors reported in June that the typical home was selling for $182,600 in May 2012. That's sale price, not profit.

So if a couple bought a $100,000 home years ago and they sell it in 2013 for tens of millions of dollars, the new tax will cost them nothing if their combined adjusted gross income is under a quarter of a million dollars.

And if their annual income is in the tens of millions of dollars but their profit on the sale is a half million dollars or less, they will also escape the tax.

Cianci repeatedly made it sound as though every seller would have to pay the tax.

The new tax does not replace the long-standing capital gains tax on money made from the sale of property. That is still in effect.

Our ruling

We gave this claim a Pants on Fire when it was a chain e-mail making the rounds earlier this year. It got a Pants on Fire when it first surfaced, in 2010. It has been debunked by other fact-checking organizations as well.

Yet Cianci repeated this wild misrepresentation of one aspect of the new health-care law no fewer than four times in 45 seconds.

Perhaps he and Gemma, a successful businessman, make enough money to qualify for the tax if they sold their homes at a hefty profit. But for the vast majority of Rhode Islanders, suggesting that this tax applies to them is nonsense.

There may be no stains on Cianci's jacket, but there's a blaze in his britches.

We rate his claim Pants on Fire!

(Get updates from PolitiFactRI on Twitter. To comment or offer your ruling, visit us on our PolitiFact Rhode Island Facebook page.)",/factchecks/2012/jul/15/vincent-buddy-cianci/talk-show-host-buddy-cianci-says-obamas-health-car/
"['New Hampshire', 'Jobs', 'Ovide Lamontagne']","
Granite State has lost jobs during the recession like the rest of the U.S., just not that many
","
In his quest for a new job in the corner office, Republican gubernatorial candidate Ovide Lamontagne is trying to keep a close eye on New Hampshire’s employment picture.

""There are 60,000 fewer jobs today in this state than we had in 2008,"" Lamontagne, a Manchester Republican and veteran attorney, told audience members during a July 12 debate at Franklin Pierce University in Rindge, N.H.

""It’s going to take us until 2014, at this current rate, to re-employ who we had before,"" he said.

Looking at the statement, we’ll leave the 2014 projection alone. As for the 60,000 jobs lost, that sounds like a job for PolitiFact. Because of his wording, we are strictly going to examine whether the number is accurate without assessing whether state officials deserve blame or credit.

To start, we reached out to the Lamontagne campaign, which directed us to the New Hampshire Center for Public Policy Studies, a non-partisan research group that released a report earlier this spring looking at the Granite State economy.

The study, titled ""Skills and People Matching: Where are the Jobs?"" reports that New Hampshire is ""missing"" about 60,000 jobs. That means the current number of jobs in the state -- 626,500, according to New Hampshire employment figures -- is about 60,000 less than the jobs the state would have hosted if the recession had never settled in, according to Dennis Delay, an economist with the public policy center who presented the report earlier this month.

By the time the recession hit, New Hampshire had seen five consecutive years of job growth, rising from 614,900 in May 2003 to a high of 659,000 in May 2008, according to state employment figures. And, if not for the recession, the state would likely have continued to see job growth over the years to follow, reaching nearly 690,000 by now, Delay said.

""All other things being equal, the economy could have gone on creating jobs,"" he said. ""We had had a 10-year expansion prior to that point.""

But, then the recession intervened.

Starting in spring 2008, several months after the official start of the recession, New Hampshire began to shed jobs, falling from 651,000 in May of that year to 626,500 in May 2012, the most recent figures available.

Those numbers show a difference of 24,500 between May 2008 and May 2012 -- less than half of the 60,000 Lamontagne claimed.

To take it a step further, the highest job total in 2008 came in February of that year with 651,600 jobs, according to the state count. That difference is 25,100 -- still less than half of Lamontagne’s figure.

Those numbers, released by the New Hampshire Employment Security office, reflect the total number of full- and part-time jobs in the state, including those held by part-time workers and out-of-state residents, according to Annette Nielsen, an economist with the employment security office’s Economic and Labor Market Information Bureau.

The recent numbers, seasonally adjusted, are based entirely on surveys of employers, while the older figures have been cross-checked with data collected from tax returns, Nielsen said.

Neither tally includes self-employed jobs which do not contribute unemployment taxes. The employment office does not track those figures, but they shouldn’t weigh heavily on the total jobs numbers, Nielsen said.

""These numbers aren’t complete, but (the 60,000) number seems a little high to me,"" Nielsen said. ""We were closer to 30,000, and we’ve added some since then. ... That’s still a huge drop for New Hampshire.""


Our ruling:

To Lamontagne’s point, New Hampshire, like the rest of the country, has lost many jobs since the recession started. But the candidate got his numbers wrong. The report he cites compares the current jobs count to the number the state could have reached if the recession had never hit, which isn’t the same thing. Lamontagne’s number of 60,000 jobs lost was twice as high as the actual number of jobs lost. We rate Lamontagne’s claim Half True.",/factchecks/2012/jul/13/ovide-lamontagne/granite-state-has-lost-jobs-during-recession-rest-/
"['New Hampshire', 'Economy', 'Charles Bass']","
Is it getting more difficult to start a business in the U.S. and is it Obama's fault?
","
Veteran congressman Rep. Charles Bass, R-NH, labeled 2012 as ""gut-check time"" in America when he filed to run for another two-year congressional term last month.

After signing his papers at the New Hampshire Secretary of State’s Office on June 11, Bass stumped on national jobs and economic issues.

His call for a gut check spurred a PolitiFact New Hampshire fact check.

""The economy is going nowhere,"" Bass said, touting jobless rates and unemployment statistics, median income levels and the national debt.

""America used to be the third-easiest country to get established in a business,"" Bass went on. ""It’s now number 17, and I could go on.""

Ranking a country on the ""ease"" of establishing a business seemed curious, so we contacted his ""Victory Committee"" to find out which sources Bass used to support his claim.

Victory Committee spokesman Scott Tranchemontagne pointed us to Doing Business reports from 2006 and 2012, which are conducted by the World Bank and International Finance Corporation, specifically the ""Starting a Business"" category listings produced with each.

And, they owned up for an error.

Bass, ""incorrectly stated that we are ranked 17th and instead it should have been 13th"" for 2012, Tranchemontagne wrote, though Bass did get the 2006 ranking right. ""While the congressman inadvertently stated the wrong number, it is clear that 13th is an entirely unacceptable ranking - and indicates that our economy has been going in the wrong direction.""

The 2012 study considers a number of factors when weighing the ease of starting a business, including regulations on ""starting a business, dealing with construction permits, getting electricity, registering property, getting credit, protecting investors, paying taxes, trading across borders, enforcing contracts, resolving insolvency (formerly closing a business) and employing workers.""

Bass was clear about who he thinks is to blame.

""Congressman Bass has clearly indicated that he believes that the administration's economic plan is not working and it is time to try something else,"" Tranchemontagne wrote.

But is ""the administration"" really to blame for the country’s drop on the global ""starting a business"" list?

It is not accurate to compare rankings across several years, according to Nadine Ghannam, head of communications for The World Bank & International Finance Corporation’s Global Indicators and Analysis Department.

""Doing Business only publishes rankings for the current year, and the year immediately preceding the publication,"" Ghannam said. ""Rankings are relative and only represent an economy's position vis-a-vis the rest of the economies sampled.  An economy's ranking may drop even if the situation did not get worse, simply by the fact that other countries have improved.""

Essentially, a ranking is only accurate at the time of publication and does not account for data changes that have occurred, Ghannam said, such as countries being added over the years, methodology changes, and minor corrections that were made to the data.

What’s more, by examining the data sources, or the indicators and sub-indicators, Ghannam said, one will find that the ""Starting a Business"" process in the U.S. has not actually changed over the years, except for some fees that have increased ""non-significantly.""

Ghannam used the 2004 report to show that it took six procedures, six days, and a cost of about 0.7 percent of gross national income (GNI) per capita to start a business in the U.S. In 2012, the report shows it still takes six procedures and six days to start a business, with the cost slightly increased to 1.4 percent GNI.

""It is important to note that this indicator records the procedures, time, cost and paid-in minimum capital requirement to start a domestic LLC in New York City,"" Ghannam added, ""and therefore all of the costs associated with the increase are a result of fees charged in the State of New York, and not linked to any federal fees.""

Our ruling:

Bass said America took a 14-spot hit from 2006 to 2012 in its ease-of-starting-a-business rank when compared with other countries--and blamed it on the administration.

He was four off from the actual Doing Business ranking for the United States--it was ranked 13 in 2012, not 17-- and took credit for his error. And if he had been comparing apples to apples, that might have been a reasonable conclusion.
But it turns out, he was off on the logic.

The team behind the report says Doing Business rankings should be examined independently of each other. Countries go up or down on the Starting a Business leaderboard if other countries’ have improved, if data has changed, if other countries are added to the list, and other factors--not necessarily because the United States’ own situation has gotten worse. And the process to start a business in the U.S. has hardly changed at all.

For getting the ranking wrong and misinterpreting the data, we give Bass a Mostly False.",/factchecks/2012/jul/13/charles-bass/it-getting-more-difficult-start-business-us-and-it/
