tags,sub_header,text_body,quote_href
"['Elections', 'Donald Trump']","
Video shared by Trump omits full context of Biden’s comments
","President Donald Trump shared a deceptively edited video that made it appear former Vice President Joe Biden supported Trump’s re-election. For the first time, Twitter applied its new policy and labeled the video as ""manipulated media,"" though it could still be viewed on Twitter without the warning label. On March 7, Dan Scavino, an assistant to Trump and the White House’s director of social media, tweeted a 13-second video of Biden speaking at a campaign event in Missouri: ""Sleepy Joe in St. Louis, Missouri today: ‘We can only re-elect @realDonaldTrump.’"" Sleepy Joe💤in St. Louis, Missouri today:“We can only re-elect @realDonaldTrump.”#KAG2020LandslideVictory🇺🇸 pic.twitter.com/FT4q2MWfcD The video tweet was viewed more than 6 million times and drew retweets from Trump. ""I agree with Joe!"" tweeted Trump. He also retweeted the video clip posted by conservative activist Charlie Kirk and a later tweet by Scavino.   I agree with Joe! https://t.co/h84mD7jVPW By cutting what Biden said before and after this clip, the video distorts the meaning of what Biden said. We contacted the White House and did not get a response. Scavino tweeted March 9 that ""the video was NOT manipulated.""  Biden was speaking in Kansas City (not St. Louis, as Scavino said) on March 7 when he made the speech in question.  Biden clearly stumbled over his words as he spoke during part of the speech. But it’s clear that he wasn’t calling for Trump to get re-elected. (Start at the 13:20 mark for a full minute listen.) Biden’s point was to call on Democrats to unite as a party and avoid attacks on each other to aim to defeat Trump.  ""If you want a nominee who will beat Donald Trump, keep the House of Representatives and elect the Senate, help me out. If you want a nominee who is a Democrat, a lifelong Democrat, a proud Democrat, an Obama-Biden Democrat, join us. If you want a nominee who will bring this   party together, who will run a progressive, positive campaign and turn this primary from a campaign that’s about negative attacks into one about what we are for, because we cannot get re-elect, we cannot win this re-election. Excuse me. We can only re-elect Donald Trump if in fact we get engaged in this circular firing squad here. It's got to be a positive campaign. So join us. Folks, we are building a coalition…"" Speaking in St. Louis earlier in the day, Biden made the same point without stumbling over his words: ""If you want a nominee who will bring the party together, who will run a positive, progressive vision for the future — not turn this primary into a campaign of negative attacks because that will only re-elect Donald Trump if we go that route."" Twitter added the label of ""manipulated media"" to the Scavino tweet on March 8 under a new policy. The policy applies to synthetic and manipulated media including videos, audio and images. The ""manipulated media"" warning beneath the tweet was not showing up in tweet detail, but it is visible in the timeline. Twitter said it was working on a fix.
   On Facebook, Scavino’s video was labeled ""partly false"" after it was reviewed by fact-checkers. PolitiFact is also part of the fact-checking partnership with Facebook. ""Fact-checkers rated this video as partly false, so we are reducing its distribution and showing warning labels with more context for people who see it, try to share it, or already have,"" Facebook said in a statement. ""As we announced last year, the same applies if a politician shares the video, if it was otherwise fact-checked when shared by others on Facebook.""  A White House video showed 13 seconds of Biden speaking at a campaign event when he said ""we can only re-elect Donald Trump."" Biden did make that statement as he stumbled over his words. But the video snippet omitted what Biden said immediately before and after, which removes his meaning. Biden’s overall point was to call for Democratic Party unity and to run a positive campaign, rather than intra-party attacks. The video stripped that out. The video employs deceptive editing via omission. We rate it Mostly False.",/factchecks/2020/mar/09/donald-trump/video-shared-trump-omits-full-context-bidens-comme/
"['Elections', 'Texas', 'Hillary Clinton']","
What caused voting delays in Texas on Super Tuesday?
","Hours after Super Tuesday polls closed in Texas at 7 p.m., voters across the state were still standing in lines to cast their ballots. In one North Texas county, Democratic primary voters reported long lines while Republican voters cast ballots with ease. In Austin, people reported lengthy waits throughout the day and some were still waiting to vote at 10:15 p.m. At Texas Southern University in Houston, the last Democratic voter cast his ballot at 1 a.m. Wednesday. In an appearance on NBC’s ""The Tonight Show"" Wednesday, Hillary Clinton remarked on the long lines in Texas. ""It is so wrong what is being done to try and purge people from voting lists, not let them register or, as we saw in places yesterday, particularly in Texas: The Republican side gets 25 machines, the Democratic side gets five machines,"" Clinton said. ""People were literally standing in line for seven hours. I want to applaud everybody that stood in a line yesterday, because they were doing the right thing for our country. Clinton is right that some voters in Texas stood in line for hours to vote on Tuesday, but is she right about the cause? Were more machines allocated to Republican primary voters than to Democrats in Texas? Clinton’s team did not return a request for comment. Differences by county In Texas, elections are conducted at the local level and procedures differ in each of the state’s 254 counties. For example, in Travis, Harris and Tarrant counties, voters can go to any polling place within the county to vote in the primary and general elections. In other counties, voters are restricted to polling places within the precincts where they live. During primary elections, both political parties work with election officials to agree on how the elections are run — including selecting the number of polling places and how voting machines are allocated. In Travis County, which also saw long lines, Democrats and Republicans can vote using the same machines at any polling place during the primary.  Some polling places in the county saw staffing disruptions early in the day that caused delays, as eleven people responsible for opening different polling locations did not show up for work over fears of catching the coronavirus. In Harris County, an equal number of voting machines for each party was placed at every polling place. Michael Winn, Harris County’s elections supervisor, told the Austin American-Statesman that this created longer lines for Democratic voters since the Democratic ballot drew more interest than the Republican one, and the county has more Democratic voters. Winn said people in Harris County voted in the Democratic primary at a 2-to-1 ratio compared with Republicans — but two-thirds of voting centers were located in Republican commissioner districts. Local party officials expressed trepidation at Harris County’s plan to divide voting machines equally in emails obtained by the Houston Chronicle. In one Feb. 18 message to county staff, Donna Stanart, the primary election director for the Republican Party wrote: ""A 50/50 split will be a problem at the polls that are going to be heavier for Democrats or heavier for Republicans."" Harris County Clerk Diane Trautman said in a statement that officials initially believed they were being ""fair and equitable by allocating equal amounts of equipment to each party."" In Tarrant County, election officials warned of long lines on Super Tuesday after local party officials agreed to have a set number of voting machines for each party, based on a review of past voter turnout data. The plan called for 1,015 Democratic machines and 1,767 Republican machines across the county’s 192 polling sites, according to the Fort Worth Star-Telegram. State lawmakers plan to hold a hearing to investigate the excessive wait times voters experienced and other issues reported by news outlets on Super Tuesday. In a letter to the Texas secretary of state and a handful of local election administrators urging action on improving voting infrastructure in the state, Mimi Marziani, president of the nonprofit Texas Civil Rights Project, outlined the different issues voters experienced on Super Tuesday. ""From the time polls opened to when they closed, voters faced a series of obstacles: polling sites that opened hours late or not at all; broken voting machines and ballot-printers; crashed election websites; too many untrained poll workers; and voters’ names missing from the registration rolls,"" she wrote. ""Then, especially later in the day, many voters in our major cities faced absurdly long wait times due to an inadequate number of polling locations, a lack of operational machines per location, and the failure to properly staff each location. As chronicled by numerous press reports, wait times lasted as long as seven hours at points, particularly in communities of color and on college campuses."" Our Ruling Clinton said that voters in Texas had to wait in long lines because ""the Republican side gets 25 machines, the Democratic side gets five machines."" Clinton is right that people in Texas waited for hours to vote, but she’s off on the polling machine disparity. In the county that experienced the longest lines on Super Tuesday, a main problem was the opposite of what Clinton described: a local decision to provide an equal number of machines for Republicans and Democrats at each voting location. We rate this claim Mostly False.",/factchecks/2020/mar/09/hillary-clinton/clinton-oversimplifies-cause-voting-delays-texas/
"['Guns', 'Joe Biden']","
Did Bernie Sanders vote against the Brady Bill five times?
","Former Vice President Joe Biden went after his presidential campaign rival, Sen. Bernie Sanders, I-Vt., over gun policy during an interview with NBC’s Savannah Guthrie. Sanders ""voted against the Brady Bill five times for background checks on people,"" Biden said in the March 5 interview. The Brady Bill line was also an attack that Sanders’ 2016 presidential rival, Hillary Clinton, used, and Biden, like Clinton before him, is correct about the number of times Sanders voted against the landmark gun law, which among other things would have tightened background check requirements. However, Biden’s assertion glosses over the fact that Sanders now supports tighter background checks. RELATED: Bernie Sanders’ complicated record on guns Before it became law in 1993, the Brady bill underwent many transformations. Sanders, then Vermont’s sole representative in the U.S. House of Representatives, voted against the bill in its entirety five times: 1. In May 1991, Sanders voted against a version that mandated a seven-day waiting period. The bill passed in the House.   2. The Senate then voted to decrease the waiting period to five days, and the bill returned to the House. In November 1991, Sanders voted against that version. Although it passed in the House, the Senate didn’t muster enough votes for the new version. 3. After some back and forth, a bill resurfaced that reinstated the five-day waiting period. In November 1993, Sanders voted against that version twice in the same day.  4. Sanders voted against an amendment that would have ended state waiting periods, and for an amendment giving those denied a gun the right to know why. 5. The final compromise version of the Brady bill —  an interim five-day waiting period while installing an instant background check system — was passed and signed into law on Nov. 30, 1993. Sanders voted against it. The Sanders campaign told PolitiFact in 2015 that Sanders voted against the bill because he believed a national waiting period was a federal overreach and because he was answering to his constituents. Sanders’ early votes against the Brady Bill reflected his constituents’ views on guns in the rural state of Vermont. Sanders has also voted to allow firearms on Amtrak trains and in National Parks. ""He wasn't opposed to states having (waiting periods) if they wanted to. The Republicans wanted to repeal waiting periods in states that had them, and Bernie voted that down,"" Sanders aide Jeff Weaver told us at the time. ""He said he would be against waiting periods, and he kept his word to the people of Vermont."" In recent years, Sanders has moved closer to an anti-gun position that is more in line with the norms within the Democratic Party. Sanders has voted in favor of banning assault weapons, closing the gun show loophole, regulating high capacity magazines, and expanding background checks, spokesman Michael Briggs told PolitiFact in 2015. And over the past 15 years, he has received mixed marks from the National Rifle Association, ranging from a C-minus to F. His most recent pro-gun vote came in 2009. Early in the 2016 campaign, Sanders sounded something of a middle-ground message, such as telling CNN’s Jake Tapper in July 2015 that ""we need a sensible debate about gun control which overcomes the cultural divide that exists in this country, and I think I can play an important role in this."" But later in the 2016 campaign, after primary rivals had hit him on his past votes, Sanders sharpened his anti-gun rhetoric and said he would repeal the law he previously voted for that blocks lawsuits against gunmakers. In his current presidential campaign, Sanders has made clear his support for tighter gun restrictions. On the issues page of his campaign website, Sanders promises to expand background checks, ban the sale and distribution of assault weapons, and prohibit high-capacity ammunition magazines, among other policies. Biden said Sanders ""voted against the Brady Bill five times for background checks on people."" Sanders did vote against the Brady bill, including a shifting mix of background check provisions, five times. The most recent of those votes took place 26 years ago. In his 2020 campaign, Sanders is fully supportive of expanded background checks and other gun control policies supported by a wide range of Democratic politicians. We rate the statement Mostly True.",/factchecks/2020/mar/09/joe-biden/did-bernie-sanders-vote-against-brady-bill-five-ti/
"['Immigration', 'Illinois', 'Rush Darwish']","
Challenger’s account of Lipinski’s immigration record falls short
","Critics of U.S. Rep. Dan Lipinski, one of the last conservative Democrats in the House, often argue he is out of step with what they view as his constituents' more progressive values. The eight-term congressman’s record on hot-button issues including health care, abortion and immigration has become a central focus in the March 17 primary challenge for the 3rd District seat he now holds. One attack on Lipinski’s immigration record caught our attention because it suggests the congressman is aligned with some of Republican President Donald Trump’s most controversial policies. A graphic tweeted by challenger Rush Darwish, who runs a multimedia production company in Chicago, said Lipinski ""voted against the DREAM Act, supports separating families and banning Muslims."" The 3rd District is the state’s most Arab American district, according to experts. And Darwish, who is Palestinian American, has said Lipinski has ignored the interests of immigrant communities there. Lipinski’s 2010 vote against legislation that would have protected ""Dreamers"" — the nickname for immigrants brought to the country illegally as children — from deportation, has been widely reported. But we didn’t know what Darwish was referencing when he claimed Lipinski backed ""separating families and banning Muslims."" So we decided to find out. There’s a lot to unpack in Darwish’s claim, so we’ll start with its clearest contention. First introduced in 2001, the DREAM Act not only would have prevented the deportation of Dreamers, but also would have provided a path to citizenship. In 2010, Lipinski was one of 38 Democrats to vote against the bill, which passed the House but died in the Senate. Since then, however, Lipinski has taken steps to protect the beneficiaries of a similar program instituted by former President Barack Obama and has more recently backed new legislation that resembles the bill he voted against. Obama’s Deferred Action for Childhood Arrivals program, or DACA, offered Dreamers temporary protection from deportation but did not include a path to citizenship. In 2017, Trump moved to end DACA. His administration is still required to process renewal applications for immigrants who have been granted DACA and want to renew that protection, but the government is not allowing new applicants to apply. Lipinski signed on to a letter that year requesting Trump continue DACA and told the Sun-Times he would support legislation to protect the program. And in 2019, he co-sponsored and helped pass a House bill to protect DACA recipients. The legislation, which is unlikely to secure Senate approval, would provide a path to citizenship for Dreamers and other immigrants with temporary legal status. In April 2018, Trump’s Justice Department introduced a ""zero tolerance"" policy that called for prosecuting all adults referred by immigration authorities for violating immigration laws. As a consequence of that policy, children were separated from their parents as they arrived at the border. Lipinski criticized those separations at the time and signed on to several letters questioning the government’s actions. Last year, he also co-sponsored legislation aimed at limiting family separations near the border. But a Darwish spokesperson told us his candidate’s tweet wasn’t talking about those separations. ""We are referring to Congressman Lipinski's vote against the DREAM Act,"" spokesperson Andrew Patinkin wrote in an email. ""Lipinski effectively voted in favor of the separation of families because when undocumented people are brought to the United States as children and are not provided a path to legal residency, they may very well be deported."" Even by that logic, Lipinski clearly reversed course on providing legal residency to Dreamers. Shortly after taking office, Trump signed an executive order temporarily suspending immigration from seven Muslim-majority nations and the U.S. refugee program. Lipinski decried the president’s order in a press release at the time, calling it ""ill conceived and harmful to innocent individuals."" Instead of pointing to evidence Lipinski supports Trump’s travel ban, a version of which was upheld by the Supreme Court in 2018, Darwish’s spokesman cited the congressman’s absence from the list of cosponsors for a bill that would limit the president’s authority to restrict residents of other countries from entering the United States. When we asked Lipinski’s campaign if he planned to support the bill, spokesperson Sally Daly told us he intends to vote for it. Daly also said he became a co-sponsor ""this week,"" but did not provide a specific date. The list now shows he was added on March 5, the same day we spoke with her. Darwish’s tweet claims Lipinski ""voted against the DREAM Act, supports separating families and banning Muslims."" Lipinski did vote against the DREAM Act in 2010. But he now supports legislation to provide similar protections to immigrants brought to the country illegally as children. He has been a longtime critic of a Trump policy that resulted in children being separated from their families along the border and of the president’s travel ban affecting people from Muslim-majority nations. Darwish’s claim contains some truth in citing Lipinski’s vote against the DREAM Act, but it gives a misleading impression overall of the congressman’s current stance on key immigration issues. We rate his claim Mostly False. MOSTLY FALSE – The statement contains an element of truth but ignores critical facts that would give a different impression. Click here for more on the six PolitiFact ratings and how we select facts to check.",/factchecks/2020/mar/08/rush-darwish/challengers-account-lipinskis-immigration-record-f/
