tags,sub_header,text_body,sources,quote_href
"['History', 'Florida', 'Charlie Crist']","
Charlie Crist says Jeb Bush said Ronald Reagan ""would have been too moderate, too reasonable for today's GOP”
","In his speech to the Democratic National Convention, Republican-turned-independent Charlie Crist said he didn’t leave the GOP, the GOP left him.

He then evoked two Republican icons to drive home his point.

""Half a century ago, Ronald Reagan, the man whose optimism was inspiring to me to enter politics, he famously said at one time that he did not leave the Democratic Party; but the party left him,"" Crist said. ""Listen, I can relate. I didn't leave the Republican Party; it left me. Then again, my friend Jeb Bush recently noted Reagan himself would have been too moderate, too reasonable for today's GOP.""

Did Crist characterize Bush’s comments accurately?

Bush made his comments on June 11, 2012, to national reporters and editors at a roundtable discussion hosted by Bloomberg View in Manhattan.

Bush had already earned a reputation for being a respected member of the GOP who was willing to stray from the party line on immigration and raise taxes to reduce the deficit.

At the breakfast, he called the current political environment ""disturbing"" and unsuitable for compromise thanks to both parties. He talked about the governing styles of his father, George H.W. Bush, and Reagan.

According to the Bloomberg report, he said, ""They got a lot of things done with bipartisan support, but right now it’s just difficult to imagine.

""Context changes; history changes. Ronald Reagan would have, based on his record of finding accommodation, finding some degree of common ground, similar to my dad, they would have a hard time if you define the Republican Party -- and I don’t -- as having an orthodoxy that doesn’t allow for disagreement,"" he said. ""We’re in a political system in general that is in a very different place right now.""

The quote was picked up by many news outlets and shorthanded much the same way Crist did in his speech at the DNC.

BuzzFeed: Jeb Bush: No Place For Father, Reagan In Today's GOP

Rachel Maddow’s blog: Jeb Bush: Reagan would have struggled with today's GOP

Bush was displeased with the tone of the coverage. He took to his Twitter account the next day and punched out the following four tweets in effort to clarify his remarks:

Am reminded today why I rarely read headlines. #ContextIsImportant

The point I was making yesterday is this: The political system today is hyperpartisan. Both sides are at fault.

My dad & Reagan sacrificed political points for good public policy.

Past 4 years, Democrats have held leadership roles w/opportunities to reach across political aisle. For sake of politics, they haven't.

Then Bush gave an email interview to the Associated Press, stressing that he meant both parties are overly partisan.

Crist’s speech misinterpreted -- as many news organizations did -- what Bush meant, said Jaryn Emhof, a Bush spokeswoman. She held up the AP’s next-day story as an example of ""one of the few who got it right.""

Our ruling

We think it’s clear Bush said the partisan divide would make it difficult for Reagan to govern the way he did (i.e., Republicans might have been mad at him for working with Democrats, and Democrats might be unwilling to work with him because he’s a Republican.) What’s murky is whether Bush said -- or suggested -- Reagan would be ""too moderate"" and ""too reasonable for today's GOP.""

We do know that Bush has since distanced himself from the suggestion that Reagan could not survive in today’s Republican Party.

In this case, we think it’s fair to dock Crist points for cherry-picking one interpretation of Bush’s statement and for failing to factor in Bush’s subsequent remarks. On balance, we rate this statement Half True. PolitiFact Florida is partnering with 10 News for the election. See video fact-checks here.",[<zip object at 0x000002809710F400>],/factchecks/2012/sep/07/charlie-crist/crist-jeb-bush-ronald-reagan-moderate-gop/
"['National', 'Health Care', 'History', 'Medicaid', 'Medicare', 'James Clyburn']","
James Clyburn says Republicans sat on sidelines for passage of Social Security, Medicare, Medicaid
","
During his speech at the Democratic National Convention in Charlotte, N.C., James Clyburn -- a South Carolinian who is the third-highest-ranking Democrat in the House -- offered an extended metaphor about how Democrats have protected Americans over the years.

""When too many of our senior citizens who were living their golden years in the darkness of economic security, Democratic President Franklin Roosevelt and a Democratic congress created Social Security, lighting a candle, while the Republicans cursed the darkness,"" Clyburn said.

""When too many of our elderly found their lives darkened by unaffordable and inaccessible health care, Lyndon Johnson and a Democratic Congress lit the candles of Medicare and Medicaid, while Republicans stood on the sidelines and cursed the darkness,"" he added.

Clyburn used some strong metaphors in that passage, but his point was clear -- that Republicans were not involved when Social Security, Medicare and Medicaid were passed.

We have looked at similar claims in the past, which we’ll recap here.

In 1935, President Franklin D. Roosevelt’s Social Security Act, was controversial for a number of reasons, including its perceived effects on the labor market and whether its benefits favored working white men. But some opponents, including some Republicans, spoke out forcefully against it.

As Nicholas Kristof of the New York Times recalled in a 2009 column, Daniel Reed, a Republican House member from New York, predicted that Americans would feel ""the lash of the dictator."" Sen. Daniel Hastings, a Delaware Republican, declared that the proposal would ""end the progress of a great country."" And John Taber, a GOP House member representative from New York, said, ""Never in the history of the world has any measure been brought here so insidiously designed as to prevent business recovery, to enslave workers.""

Nevertheless, on Aug. 8, 1935, the conference report — the final version of the bill that melds together changes made in the House and in the Senate — passed in the House, 372-33, with 81 Republicans voting in favor compared to just 15 against. The next day, the bill was passed in the Senate, 77-6, with 16 Republicans supporting the legislation and only 5 voting against it. So Social Security did pass with Republican support.

Decades later, the idea of federally sponsored health care was unpopular in certain segments of the Republican Party. In 1961, Ronald Reagan, the future president, released an LP with a speech in which he demonized ""socialized medicine,"" citing proposals that sound a lot like the one passed four years later.

""Write those letters now; call your friends and then tell them to write them,"" Reagan said. ""If you don't, this program, I promise you, will pass just as surely as the sun will come up tomorrow, and behind it will come other federal programs that will invade every area of freedom as we have known it in this country. ... And if you don't do this and if I don't do it, one of these days we are going to spend our sunset years telling our children and our children's children, what it once was like in America when men were free.""

Other high-profile Republicans who opposed Medicare and Medicaid included Arizona Sen. Barry Goldwater, the party's 1964 presidential nominee.

And by 1965, as the bill that Johnson would eventually sign worked its way through the House, Republican support was scant. No Republicans voted for the bill until it reached the floor. It passed the Ways and Means Committee by a party-line vote of 17-8. And all four Republicans on the House Rules Committee — the panel that sets the boundaries of debate on all bills that come to the House floor — voted against the bill.

However, as time went on, Republican support grew. As the bill worked its way through the Senate, Republican support was somewhat stronger. In the final Finance Committee vote, the measure passed 12-5, with four of the committee's eight Republicans supporting it.

And when the House adopted a conference report, on July 27, 1965, it passed it by a 307-116 margin. That included 70 Republican ""yes"" votes, against 68 ""no"" votes.

Then, on July 28, 1965, the Senate adopted the bill by a vote of 70-24, with 13 Republicans in favor and 17 against. President Johnson signed it two days later.

So in the House, a slight majority of the Republican caucus voted for the bill, and in the Senate, a significant minority voted in favor. In neither case did Republicans as a whole ""stand on the sidelines.""

""The political parties were very different in 1965 than they are today,"" said Donald Ritchie, the historian of the U.S. Senate. ""Both had strong conservative and liberal wings, so most votes were bipartisan because the conservatives in the two parties voted against the liberals in each party. You had Republicans like Jacob Javits (N.Y.) who were more liberal than most Democrats, and Democrats like James Eastland (Miss.) who were more conservative than most Republicans. So there were Republicans who supported Medicare and Democrats who opposed it.""

Our ruling

Although some of the biggest and most vocal opponents of the bills were Republicans, it’s wrong to say that ""Republicans stood on the sidelines"" when the bills were being considered. On the final vote on Social Security, Republicans overwhelmingly supported the bill. On Medicare and Medicaid, a majority of Republicans voted for the bill in the House, as did a significant minority in the Senate. We rate Clyburn’s claim False.",[<zip object at 0x0000028096656380>],/factchecks/2012/sep/07/james-clyburn/james-clyburn-says-republicans-sat-sidelines-passa/
"['National', 'Welfare', 'Rahm Emanuel']","
Rahm Emanuel says Romney asked for welfare work waiver in Massachusetts
","Chicago Mayor Rahm Emanuel, President Barack Obama’s former chief of staff, jumped into the fray over welfare work requirements during an appearance Sunday on Meet the Press.

Emanuel also served as a senior adviser to President Bill Clinton during welfare reform in 1996. The reform law transformed welfare from an indefinite entitlement to temporary assistance that required people to eventually join the workforce. That’s what the changes Obama announced this summer are also aimed at, Emanuel said, by giving states flexibility in how they move welfare recipients into employment.

The work rule reforms, Emanuel said, ""have one goal: work. Fifty different creative ways to achieve it. Gov. Romney asked for, actually, a waiver. But you had to make sure your plan for Massachusetts, which is different than Mississippi or Alabama's or California's, achieves the goal of work. And it was every governor, regardless of party, who wanted to be creative in their own way to achieve this single goal. And that is exactly how it's supposed to work,"" Emanuel said in the Sept. 2, 2012, appearance.

Emanuel’s statement is somewhat garbled by the mixing the past (Romney’s one term as governor as Massachusetts) with the present (the changes announced by Obama this summer). But a fuller transcript of Emanuel’s comments make it fairly clear that he is accusing Romney of being hypocritical -- namely, of attacking Obama for changes to the welfare law that Romney himself once advocated.

But Emanuel’s statement went one step further -- saying Romney specifically asked for a waiver like ones Obama proposed.

Is that true?

First, some background
   
Welfare erupted as an issue in the presidential campaign in August, when the Romney campaign released an ad accusing Obama of gutting the work requirement in welfare reform.  

""Under Obama’s plan, you wouldn’t have to work and wouldn’t have to train for a job. They just send you your welfare check,"" the Romney ad said.

We looked into the claim and rated it Pants On Fire. The changes Obama sought don’t eliminate the work requirement but instead give states the ability to test different programs for helping residents move toward work. (They first have to have approval of their programs from the U.S. Department of Health and Human Services.) A July memo from HHS specified several times that any states seeking waivers must show that employment will grow under their pilot programs.

Romney’s letter
   
We did not hear back from Emanuel or the Democratic National Committee about this claim. But we suspect it’s related to a 2005 letter that Romney and 28 other Republican governors signed in support of legislation to extend the welfare reform law.
   
The governors wrote that an extension was needed so they could effectively implement welfare block grants in their states, and they emphasized the positive aspects of a bill being considered in the Senate known as the PRIDE Act. Those included a stable funding stream, support for abstinence education, child care and, mostly notably ""increased waiver authority.""
   
""The Senate bill provides states with the flexibility to manage their (grant) programs effectively and serve low-income populations. Increased waiver authority, allowable work activities, availability of partial work credit and the ability to coordinate state programs are all important aspects of moving recipients from welfare to work,"" the letter states.
   
That sounds a lot like what the Obama administration has outlined in its memo about state waivers. But it’s not exactly a request for a waiver in Massachusetts.

What about Massachusetts?

We delved back into news coverage from 2005 and 2006 to look for any mention of Romney requesting a waiver for his state. We found he was doing something nearly opposite of that.

In 1995, the year before federal welfare reform passed, the Massachusetts Legislature enacted state reform. When federal reform passed the next year, Massachusetts received a waiver exempting it from federal welfare rules. (Keep in mind, Romney was not governor at this time.)

Here’s the Boston Globe’s report on it from the time: ""Like the federal law, the Bay State's law includes time limits and work requirements: Recipients who are not exempt are limited to 24 months of assistance in any five-year period and must work between 20 hours and 30 hours a week, depending on the age of their youngest child. With its waiver, Massachusetts continues to receive federal money, which it supplements with state tax dollars.""

In general, the federal rules were tougher than Massachusetts’, so the state was having to ratchet up its requirements in order to get in compliance.

In late 2004, a state advisory panel came up with a set of recommendations. Romney, by then in his second year as governor, offered his own outline -- and what he proposed exceeded the panel’s ideas and the federal law’s requirements.

He sought to roughly double the number of Massachusetts welfare recipients who have to work, ""eliminating exemptions for pregnant women in the third trimester, mothers with children between 1 and 2 years old, and about 5,600 people who are considered disabled under state standards but not under federal ones. His plan also would impose work requirements on recipients caring for a disabled relative and teenagers in school,"" a story in the Globe said.

Ultimately, the state Legislature took no final action to overhaul welfare. The fact remains, however, that Romney not only didn’t seek a waiver from HHS, he pushed for tougher work demands in his state.

Our ruling

Emanuel said on Meet the Press that Romney sought a state waiver for meeting federal welfare work requirements.

As governor of Massachusetts, Romney signed onto a letter supporting a bill to extend the federal welfare reform law. That letter urged greater state flexibility and increased waiver authority, which adds grist to the charge Romney is being hypocritical in attacking Obama now for gutting work requirements. It also indicates he supported the principle allowing states some waiver authority.

But Emanuel’s words were ""Romney asked for, actually, a waiver,"" and that is not true. Emanuel stretched the meaning of the 2005 letter signed by Romney and other governors, fabricating a waiver request that never existed.

The claim omits critical facts and creates an inaccurate impression. We rate it Mostly False.",[<zip object at 0x0000028097ABB140>],/factchecks/2012/sep/06/rahm-emanuel/rahm-emanuel-says-romney-asked-welfare-work-waiver/
"['National', 'Economy', 'Jobs', 'Ted Strickland']","
Strickland credits auto rescue for Ohio manufacturing gains
","
With jobs at the center of the presidential race, Democrats tout the revival of the American auto industry as a prime success story of the Obama administration. Former Democratic Ohio governor, Ted Strickland, made that connection when he appeared on Meet the Press last month.  

Strickland said unemployment in Ohio was below the national average and his state had ""created 45,000 new manufacturing jobs since 2010. And that's due in large part to the fact that the auto rescue has helped Ohio.""

We have examined the resurgence of the Ohio auto industry before. Republican Gov. John Kasich downplayed its impact on the state’s overall economy. We rated that Mostly True. Strickland is giving the auto bailout particular credit for growth in the manufacturing sector and that specific connection is one that we look into now.

According to the Bureau of Labor Statistics, Strickland has it right for the number of manufacturing jobs in Ohio. They went up by about 47,000 between the start of 2010 and the middle of 2012.

Where he gets into trouble is proving that a large part of the job growth is due to the automotive sector. Jobs in building cars and making the parts that go into cars did go up, but only by a bit over 5,000, or 12 percent of the total increase. That’s not a small fraction, but it doesn’t seem to qualify as a ""large part.""

We contacted Strickland’s colleagues at the Ohio Democratic Party for supporting details and they did not provide any.

However, the direct job figures don’t tell the whole story. The supply chain that feeds into a finished car is long and complicated. The BLS tracks the car parts industry, but it doesn’t track the other manufacturing jobs that supply auto parts makers. An analysis by the Center for Automotive Research, an independent group that gets some support from the auto industry, found that the number of jobs in metals, plastics and rubber that are tied to auto parts makers is about half again larger than the number of jobs in the auto parts sector itself.

It is very difficult to know how this ripple effect plays out in Ohio itself. 
""The problem is we have these artificial boundaries called state borders,"" said Kim Hill, associate research director at the Center. ""An assembly plant in Michigan can produce jobs at a Mom and Pop tool and die maker in Ohio and vice versa."" Hill says often, the small firms themselves aren't aware of the connection. 
James Rubenstein, a professor at Miami University, has drilled into the complex connections among manufacturers in the car business.

""A very high percentage of steel produced in Ohio goes to the auto industry,"" Rubenstein said. And he added, the pattern would carry through for all primary metals, machine shops and other fabricators.

The larger the fraction of steel, for example, that went to cars, the larger the number of jobs attributable to the industry. Some of those downstream companies could be selling to car makers and car part suppliers in other states. The revival of the car industry was not limited to Ohio. It also took hold in places such as Michigan, Indiana, and Pennsylvania. Increased activity there could produce jobs in Ohio.

As a final complication, Strickland tied the auto industry to manufacturing in general. At some level, when people have jobs, they buy some big ticket items such as washing machines and refrigerators. Those purchases also would generate manufacturing jobs.

The problem is, we could find no clear tally of all of these possible effects.

Based on the numbers we can find for manufacturing jobs that feed into the supply chain of auto parts, we might take the figure from the Center for Automotive Research and say that  those jobs might account for another 4,000 manufacturing workers in Ohio due to the auto industry.

If one counted all of those jobs, that would still translate into only about 20 percent of the manufacturing jobs added in the state.

Our Ruling

Strickland said that Ohio ""created 45,000 new manufacturing jobs since 2010. And that's due in large part to the fact that the auto rescue has helped Ohio.""

Strickland is right on the big number. Giving major credit to the auto industry is a harder case to make. Based on the information gathered by the BLS, the automobile sector accounted for just one-eighth of the new manufacturing jobs. There are good reasons to believe that the impact of the auto industry, both within and outside of Ohio, generated a larger impact on manufacturing jobs, but it is difficult to quantify.

We rate the statement Half True.",[<zip object at 0x000002809783D700>],/factchecks/2012/sep/06/ted-strickland/strickland-credits-auto-rescue-ohio-manufacturing-/
"['National', 'Jobs', 'Bob King']","
UAW president Bob King says auto industry has gained 250,000 jobs since mid-2009
","
One of the big themes of the Democratic National Convention in Charlotte, N.C., has been a celebration of what President Barack Obama did to help the automobile industry when it was teetering on the edge of financial collapse in early 2009.

Bob King -- president of the International Union, United Automobile, Aerospace and Agricultural Implement Workers of America, better known as the UAW -- emphasized that point in his speech to the convention on Sept. 5, 2012.

""President Obama took action, putting together a rescue team, demanding real change and real sacrifice from everyone involved — from management, from labor, from suppliers, from debt-holders, from dealers, from everybody involved,"" King said. ""It was not universally popular, but it was absolutely right. President Obama's strong leadership saved a million jobs. Since June 2009, this industry has added a quarter of a million jobs, and the auto industry is thriving again. These are good, middle-class jobs in glass, in plastics and steel—jobs making things for an economy built to last.""

With Detroit’s comeback such a big topic at the convention, we thought it was worth checking to see if that was accurate.

We turned to data from the Bureau of Labor Statistics, the federal government’s official source of employment data.

There are two categories relevant to this analysis. One is ""motor vehicles and parts manufacturing."" Since June 2009, seasonally adjusted employment in this sector has increased by 165,100 jobs.

The second category is ""motor vehicle and parts dealers."" Over the same period, employment in that sector increased by 84,500.

Add these two figures together and you get 249,600 jobs -- almost exactly a quarter million.

With statements such as these, PolitiFact considers not just whether the statement is statistically accurate, but also whether the politician or party in question deserves the credit or blame attributed to it.

In this case, determining Obama’s precise role in aiding the auto industry is more a matter of opinion than fact, but experts have told us for other articles that Obama’s leadership was crucial, along with help from some Republicans. So we think it’s reasonable to credit Obama’s ""strong leadership"" with a role in producing these numbers.

Our ruling

The data will change once new jobs figures are released on Sept. 7, 2012. But at the time King made the statement, his data was correct. We rate his statement True.",[<zip object at 0x000002809748CC40>],/factchecks/2012/sep/06/bob-king/uaw-president-bob-king-says-auto-industry-has-gain/
