tags,sub_header,text_body,sources,quote_href
"['National', 'Health Care', 'Pundits', 'David Brooks']","
Brooks claims that preventive care will cost the government
","The logic behind preventive care seems simple enough: stopping illnesses before they happen will mean fewer pricey procedures at the hospital and lower health care costs for all.
 
Not so, says columnist David Brooks, who was interviewed on the Aug. 14, 2009, edition of the  NewsHour with Jim Lehrer  .
 
He said President Barack Obama claims that ""preventive care saves money,"" but the reality is ""that's not true. ... If you're testing people, say, for an illness, you have to give 100 people a test to get five people — to find five people. Now, preventive care is good for health. Everyone agrees on that. But if you look at the CBO studies and the other research, it doesn't save you money. We should do it. But because you have to test so many people to get the few you're really going to prevent serious illness from, you're really not adding up to a lot of cost saving.""
 
Brooks was talking about a core principle of Obama's health care overhaul: That many costly procedures and treatments can be prevented by catching disease earlier or preventing it all together. Operating under that logic, the House health care bill expands access to procedures such as hypertension screening and vaccines. 
 
House Speaker Nancy Pelosi and House Democratic Leader Steny Hoyer sang the praises of preventive care in an Aug. 10  USA Today  op-ed. ""Reform will also mean higher-quality care by promoting preventive care so health problems can be addressed before they become crises,"" they wrote. ""This, too, will save money. We'll be a much healthier country if all patients can receive regular checkups and tests, such as mammograms and diabetes exams, without paying a dime out-of-pocket.""
 
Brooks's critique relied on new numbers from the Congressional Budget Office that indicate that preventive care isn't as cost-effective as Pelosi and Hoyer claim.
 
""The evidence suggests that for most preventive services, expanded utilization leads to higher, not lower, medical spending overall,"" CBO director Douglas Elmendorf wrote in an Aug. 7 letter to Rep. Nathan Deal, the top Republican on a congressional subcommittee involved in the debate. 
 
Elmendorf explained that, while the cost of a simple test might be cheap for each individual, the cumulative cost of many tests could be quite expensive:
 
""But when analyzing the effects of preventive care on total spending for health care, it is important to recognize that doctors do not know beforehand which patients are going to develop costly illnesses. To avert one case of acute illness, it is usually necessary to provide preventive care to many patients, most of whom would not have suffered that illness anyway. ... Preventive care can have the largest benefits relative to costs when it is targeted at people who are most likely to suffer from a particular medical problem; however, such targeting can be difficult because preventive services are generally provided to patients who have the potential to contract a given disease but have not yet shown symptoms of having it.""
 
In fact, a new government policy to encourage prevention could end up paying for services that people are already receiving, including breast and colon cancer screenings and vaccines, Elmendorf went on.

The CBO did not put a price tag on the costs or savings associated with preventive care measures in the House bills because budgeting rules prevent them from doing so. But a few other studies back up the CBO's analysis, including a Feb. 14, 2008, article in the  New England Journal of Medicine  that was written in response to campaign promises for more preventive care.

""Sweeping statements about the cost-saving potential of prevention ... are overreaching,"" according to the paper. ""Studies have concluded that preventing illness can in some cases save money but in other cases can add to health care costs.""

And a study conducted by researchers from the American Diabetes Association, American Heart Association and the American Cancer Society concluded that, while interventions to prevent cardiovascular disease would prevent many strokes and deaths, ""as they are currently delivered, most of the prevention activities will substantially increase costs.""

So, the consensus is that, while preventive care will almost certainly save lives, it's a stretch to say that it will save government spending on health care. As a result, we give Brooks a True.",[<zip object at 0x000001B4EC9C0A80>],/factchecks/2009/aug/17/david-brooks/brooks-claims-preventive-care-will-cost-government/
"['National', 'Health Care', 'U.S. Chamber of Commerce']","
U.S. Chamber of Commerce Ad says health reform plan would mean big tax increases
","
The Campaign for Responsible Health Reform, sponsored by the U.S. Chamber of Commerce, released a 30-second TV commercial that warns the health plans kicking around in Congress will translate to ""big tax increases.""
 
With the visual of a red balloon expanding until it pops, the announcer says: ""Washington's latest health reform idea: a trillion-dollar health plan, and a government-run public option, with big tax increases, even on health benefits. And the federal deficit? The nonpartisan Congressional Budget Office says the deficit will grow $239 billion. Inflated taxes. Swelling deficits. And expanded government control over your health. Tell Congress, 'Let's slow down and reform health care the right way.'""
 
There's no denying the health care plans being considered in Congress would be expensive. In order to meet the plan's goal of reducing the number of uninsured, the government would be providing more in health care subsidies. That costs money. According to the nonpartisan Congressional Budget Office, the plan would cost in the neighborhood of $1 trillion over 10 years.
 
But would it mean ""big tax increases, even on health benefits?""
 
The answer: It depends. There is not a single health care plan, there are several versions kicking around various committees in the House and Senate. And they have different approaches on how the plan would be paid for.
 
Most of the discussion has focused on the the House plans because there is not a detailed Senate version yet. In the House plan, the tax increases are targeted at the wealthy. So if you make $1 million a year, yes, the plan would mean a big tax increase.
 
We can be even more precise. The House versions of the bill would help pay for the health plan with a surtax on high earners that would break down as follows: for couples making between $350,000 and $500,000 (or $280,000 to $400,000 for individuals), a new 1 percent tax; between $500,000 and $1 million ($400,000 to $800,000 for individuals), 1.5 percent; and over $1 million (or over $800,000 for individuals), 5.4 percent. In other words, a family making $1 million would have to pay $9,000.
 
Small businesses filing as individuals would face the same levies at those income levels.
 
In all, that is estimated to bring in about $540 billion over 10 years.
 
""That hits the very top earners,"" said Bob Williams of the nonpartisan Tax Policy Center. ""But that proposal would not affect many people.""
 
In fact, he said, less than 2 percent of the population fall into those income categories.
 
But according to the Chamber, the high earners aren't the only ones who will see tax increases.
 
In the House versions of the health plan, there's a tax penalty — anywhere from 2 percent to 8 percent on payroll taxes — for large companies that do not provide government-approved health care plans. There's also a tax penalty on uninsured people who refuse to buy insurance (that's the incentive to get everyone on some health plan).
 
As for the Chamber of Commerce claim that the plans would even include taxes on health benefits, you need to go to the Senate side for that discussion. Although there's nothing currently in writing in a bill, the Senate Finance Committee is mulling a tax on so-called ""Cadillac"" or ""gold-plated"" health plans, plans that cost well above average. Essentially it would tax any amount paid for insurance plans over a certain threshold — perhaps $8,000 for an individual, or $21,000 for a family, said James Galfand, senior manager of health policy for the U.S. Chamber of Commerce. While it would not directly tax employees' health benefits, he said, it would amount to the same thing, as those costs would be passed on by the insurance company or employer.
 
We think the Chamber of Commerce ad is a bit premature in warning that the health plan would include taxes on health benefits. It might, but so far, that's not in any published version of the bill, and the House specifically did not include it in its plan.
 
The Chamber of Commerce ad does raise some legitimate concerns about how the health care plan would be paid for. But we think it's slightly misleading to say it would lead to ""big tax increases."" That's true for some high earners. But it's not true for the vast majority of people who do not make that level of income. Uninsured people who decline to purchase insurance will see a tax hit, but that's also expected to be a small minority.
 
Things may change as these bills seek to solve the question of paying for the plan, but as the plans are now, some people would see a big tax increase, but most would not. That leaves us at a Half True.
",[<zip object at 0x000001B4EBCE2BC0>],/factchecks/2009/aug/14/us-chamber-commerce/us-chamber-commerce-ad-says-health-reform-plan-wou/
"['National', 'Health Care', 'David Axelrod']","
Reform plan caps out-of-pocket expenses
","
The White House is fighting chain e-mails with chain e-mails. 


After spending days responding to inaccurate e-mails about the health care reform plan, the White House responded with its own e-mail from David Axelrod, senior adviser to President Barack Obama. The subject line was ""Something worth forwarding.""
 
Axelrod began his e-mail with a list of ways that reform provides ""security and stability to those with or without coverage.""
 
One of his claims is that refom ""ends exorbitant out-of-pocket expenses, deductibles or co-pays: Insurance companies will have to abide by yearly caps on how much they can charge for out-of-pocket expenses.""
 
We recognize that ""exorbitant"" is subjective, but we thought it would be helpful to research whether Axelrod is right that the plan limits charges that a typical person or family would find excessive.
 
The main health care reform bill in Congress does set annual limits on out-of-pocket expenses. That means there's a cap on what people would have to pay in a year for medical costs. And insurance companies won't be allowed to require patients to pay for preventive treatments such as check-ups.
 
In the House legislation, outlined in section 122, the annual cap on out-of-pocket expenses is $5,000 for an individual and $10,000 for a family. Those numbers are indexed for inflation.
 
The policy would be phased in. Employer-provided policies would have a grace period of five years, as outlined in section 102, before they are required to comply with the caps. If you get a new individual policy through the health care exchange, it would have to comply right away.
 
We asked Sara Collins of the Commonwealth Fund about the caps. The Commonwealth Fund is a nonpartisan private foundation that advocates for a better health care system. She said the caps are a good form of consumer protection.
 
Axelrod is correct that the main health care reform bill requires insurance companies to ""abide by yearly caps on how much they can charge for out-of-pocket expenses."" But ending ""exorbitant"" out-of-pocket expenses, deductibles or co-pays? 'Exorbitant' may be in the eye of the beholder. For a family, $10,000 in the course of a year can be a serious financial hit. (The median income for a family of four is $67,000.) Still, the new limits are better than nothing, and health care advocates praise them as an important safeguard for consumers. So we rate Axelrod's statement Mostly True.
",[<zip object at 0x000001B4EBAA4240>],/factchecks/2009/aug/14/david-axelrod/reform-plan-caps-out-pocket-expenses/
"['National', 'Health Care', 'Veterans', 'David Axelrod']","
Axelrod gets it right on vet benefits
","
The White House is fighting chain e-mails with chain e-mails. 


After spending days responding to inaccurate e-mails about the health care reform plan, the White House responded with its own e-mail from David Axelrod, senior adviser to President Barack Obama. The subject line was ""Something worth forwarding.""
 
""This is probably one of the longest e-mails I’ve ever sent, but it could be the most important,"" Axelrod wrote. ""Across the country we are seeing vigorous debate about health insurance reform. Unfortunately, some of the old tactics we know so well are back — even the viral e-mails that fly unchecked and under the radar, spreading all sorts of lies and distortions.”


One such distortion, Axelrod said, is the suggestion that veterans' access to health care will be blocked by the bill. ""It’s a myth that health insurance reform will affect veterans' access to the care they get now,"" Axelrod wrote. ""To the contrary, the president's budget significantly expands coverage under the VA, extending care to 500,000 more veterans who were previously excluded. The VA health care system will continue to be available for all eligible veterans.""


The White House has also

posted a video

about the issue on its Web site.


The rumor may have started when a coalition of six veterans groups wrote a letter on July 30, 2009, to House Speaker Nancy Pelosi expressing concern that the bill might penalize vets who get health coverage through the VA but don't have private health insurance.


The House version of the bill mandates coverage by requiring individuals to have a health insurance plan or pay a penalty based on their income. And businesses would have to contribute 65 percent of workers' family insurance premiums or pay an 8 percent penalty.


""We wanted to make sure that, if someone is enrolled with the [U.S. Department of Veterans Affairs], they didn't fall into this category"" of having to pay a fine because they didn't have private coverage, said David Autry, a spokesman for the Disabled American Veterans.


""Businesses might have been less willing to hire vets who may be enrolled in the VA health care plan,"" said Tom Zampieri, director of government relations for the Blinded Veterans Association.

 

Those concerns have since been addressed through a series of amendments to the House bill, according to Zampieri and Autry.


Nothing in the House bill would affect veterans' current coverage, they both said. Vets will continue to get those services from the VA.


""What the White House is saying is true,"" said Bernard Edelman, deputy director for policy and government affairs for the Vietnam Veterans of America.


Edelman said that another part of the White House claim – that “the president's budget significantly expands coverage under the VA, extending care to 500,000 more veterans who were previously excluded” – also adds up. Obama’s first budget plan opened the VA’s doors to about that many vets previously excluded from care.


So, by all accounts, the administration is correct that health care reform will not keep veterans from getting the care they currently receive. So for this one, Axelrod earns a True.
",[<zip object at 0x000001B4EBA0A6C0>],/factchecks/2009/aug/14/david-axelrod/axelrod-gets-it-right-vet-benefits/
"['National', 'Health Care', 'Medicare', 'Barack Obama']","
Obama claims Medicare benefits will not be cut under the health care bill
","
""I just want to assure [you] we're not talking about cutting Medicare benefits.""

Those were President Barack Obama's words to a town hall audience in Portsmouth, N.H; they were meant to ease fears that health care reform will slash Medicare benefits and deprive seniors of the treatments and procedures they need.

A ""myth that we've been hearing about is this notion that somehow we're going to be cutting your Medicare benefits,"" Obama said on Aug. 11, 2009. ""We are not. AARP would not be endorsing a bill if it was undermining Medicare, okay? So I just want seniors to be clear about this, because if you look at the polling, it turns out seniors are the ones who are most worried about health care reform. And that's understandable, because they use a lot of care, they've got Medicare, and it's already hard for a lot of people even on Medicare because of the supplements and all the other costs out of pocket that they're still paying.""

""So I just want to assure we're not talking about cutting Medicare benefits,"" Obama said.

Listening to Obama, you'd think that Medicare will remain intact. Yet, others claim Medicare spending will be trimmed quite a bit. AARP  has said  about $231.4 billion could come out of Medicare's budget, while the 60Plus Association, a group that opposes the bill,  says  cuts could top out at $500 billion.

Confused?
 
We were, too.

There are three versions of health care reform floating around the House, and each dedicates hundreds of pages to Medicare. For this Truth-O-Meter item, we're going to be focusing on the biggest changes to the program. (So far, the Senate Finance Committee, which holds the purse strings to all things health care, hasn't put any ideas on paper.)
 
Before delving into the bill and Obama's claim, a little Medicare 101: 
There are two basic ways most people get Medicare coverage. They enroll in traditional Medicare and a prescription drug plan through the government and maybe buy a supplemental policy to cover most out-of-pocket costs. Or they enroll in Medicare Advantage programs (they include drug plan), which are run by private insurers. They typically have more generous benefits such as dental and vision coverage. Some plans even pay the patient’s monthly Medicare premium, which can amount to about $100. 
We found some disagreement about whether Obama is correct that Medicare benefits would not be cut.

The House bill will not cut any benefits, said Tricia Neuman, vice president and director of the Medicare Policy Project at the Kaiser Family Foundation.
 
""What it will do is cut growth in Medicare spending,"" Neuman said.  
Indeed, some of the biggest savings in the bill — about $196 billion — would come from a permanent reduction in the annual payment adjustments for some Medicare services, including inpatient hospital services and ambulatory care, according to the Congressional Budget Office. That doesn't mean health care providers will stop being paid for taking care of the elderly; rather, they won't see pay increases in the future. 
Obama also wants to save money on the Medicare Advantage program, which covers about one-fifth of all Medicare patients.
 
""We do think that systems like Medicare are very inefficient right now, but it has nothing to do at the moment with issues of benefits,"" Obama said in his speech in New Hampshire. ""The inefficiencies all come from things like paying $177 billion to insurance companies in subsidies for something called Medicare Advantage that is not competitively bid, so insurance companies basically get a $177 billion of taxpayer money to provide services that Medicare already provides. And it's no better — it doesn't result in better health care for seniors. It is a giveaway of $177 billion.""

Indeed, a June 2009 MedPAC analysis said that the Advantage plan costs taxpayers on average of 14 percent more than the traditional Medicare plan.

The House bills propose to change the benchmarks that set the payments, making them equal to what the government pays for traditional Medicare services. According to the Congressional Budget Office, those changes would translate to a savings of $156 billion over 10 years.
 
We asked experts from both sides of the debate whether all these changes constituted a cut, and most had the same answer: yes and no.
 
On one hand, they might not be considered cuts because nowhere in the bill are benefits actually eliminated, they said. And other parts of the bill expand coverage for seniors and ultimately make some components of Medicare less expensive for patients. For instance, the bill would require the pharmaceutical industry to help pay for prescription drugs. That savings will ultimately help the government cover more drug benefits for more patients.
 
But experts told us the cuts in the Advantage program could lead to some changes. The basic benefits that mirror regular Medicare will stay the same, but the extra benefits that people receive under Advantage could be changed.

""The core benefits of Medicare won't change,"" said Marc Steinberg, deputy director of health policy for Families USA, an advocate for health care consumers. ""Most [Medicare Advantage] plans are solid and resemble traditional Medicare."" However, some insurance plans have entered the program ""to make a quick buck. They may have to reconsider their budget, which could mean some patients will see changes in the services provided above and beyond traditional Medicare.""
 
Stuart Guterman, assistant vice president for the Commonwealth Fund’s program on payment system reform, had a similar view.
 
""People enrolled in (Medicare Advantage) get services that people in traditional care do not get under Medicare,"" he said. ""Insurance companies can afford to cover these services because taxpayer money is subsidizing them. Plans will most likely not offer those extra services, but in no case will [patients] get less Medicare benefits than people in the rest of the program.""
 
Another example involving regular Medicare coverage: The House bill proposes a $20 billion cut in hospital readmission subsidies. This has to do with patients who re-enter the hospital to be retreated or have procedures fixed. Gail Wilensky, who ran the Medicare program under President George H.W. Bush in the early 1990s, said this is just one example of how cuts to Medicare payments could ultimately trickle down to patients.
 
""Most of the ways to get money with any certainty is to have it happen quickly, which you do by either raising taxes or whacking prices,"" said Wilensky, now an economist and senior fellow with Project Hope, a health care advocacy group. ""In this case they're whacking prices. ... Are these patients in jeopardy? You can't guarantee they're not.""
 
That leaves us with Obama's claim that, under the health care reform proposal, Medicare benefits will not be cut. He's right that the bill does not directly trim Medicare benefits; instead, the government is proposing ways to slow or eliminate some Medicare spending to beef up other aspects of the plan. But experts told us it's conceivable or even likely that those financial changes could lead to reduced benefits, particularly for people in the Advantage program. From that perspective, it's a stretch for Obama say that Medicare patients won't see changes in their plans as a result. We give Obama a Half True.",[<zip object at 0x000001B4ECB3F200>],/factchecks/2009/aug/14/barack-obama/obama-claims-medicare-benefits-will-not-be-cut-und/
