tags,sub_header,text_body,quote_href
"['Georgia', 'Sports', 'Nathan Deal']","
Deal makes premature claim on Falcons stadium bid
","
The public may be wary, but key elected officials are warming up to the idea of helping the Atlanta Falcons build a new stadium for the low, low price of $1 billion.

Taxpayers would help finance a projected $300 million to construct the retractable-roof colossus, but boosters say the burden is smaller than it seems.  A cautious Gov. Nathan Deal recently told WSB-TV reporter Lori Geary that the plan could make fiscal sense.

""I think that, overall, if we get a new facility that’s upgraded and meets the current demands and needs of the future, then being ‘on the hook,’ so to speak, for less than a third – that is repaid from money that comes from outsiders – I think that’s probably a pretty good deal,"" the governor said.

There’s got to be a catch, right?

A stadium can cost more than the price of on-site construction.  Off-site roads, bridges and other infrastructure may need upgrades to accommodate crowds.  

Looks like it’s time for the Truth-O-Meter.

If the Falcons get their wish, the 20-year-old Georgia Dome would be razed in favor of a facility with luxury suites and other features that could boost the team’s bottom line.  

Skeptical taxpayers stand in their way. The public fully financed the Dome. But in the decades since, voters have soured on helping sports teams build new arenas.

Under the current proposal, they would pitch in big time.

The facility would be owned by the Georgia World Congress Center Authority, which owns the Dome, the Georgia World Congress Center and Centennial Olympic Park.  Each year, a portion of the  budgets for the Dome and World Congress Center come from a cut of an 8 percent tax on hotel and motel rooms within Atlanta’s city limits and unincorporated Fulton County.

The GWCCA would help the Falcons pay for stadium construction with a bond backed by revenue it expects this tax to make over the next 30 years.  The projected amount: about $300 million.  

We emailed Deal spokesman Brian Robinson for more information. He said the governor was speaking about the burden the stadium would put on state funds, and Deal overstated the cost.

""In reality, it would come at no cost to STATE taxpayers,"" Robinson responded.  

We think viewers may have gotten the impression that Deal  was talking about the total burden to taxpayers. The financing the governor mentioned in the interview would be backed by the local hotel/motel tax, not state funds.

We’ll take both interpretations into account.

This brings us to the first part of our fact check. Are taxpayers ""on the hook ... for less than a third"" of the stadium’s cost?  

This appears to be a matter of arithmetic. The $300 million contribution from local motel/hotel taxes is  less than one-third of the projected $1 billion construction cost.  

If this were the only pot of public funds going to the stadium, then this portion of Deal’s claim would be correct.  But there’s more to the story.

In a ""term sheet"" approved in December that outlines the deal, both parties agreed that the GWCCA would buy land for the facility.

Deal earmarked $15 million from the state budget in 2012 to buy land that could be used for the complex. Land acquisition costs could rise depending on which site planners select.

In addition, roads and other infrastructure near the stadium may need hundreds of millions of dollars in upgrades. Atlanta Mayor Kasim Reed said in September that these improvements could push the stadium’s total cost to $1.2 billion. This could push the cost to the public upward of $500 million.

The Falcons expect to seek government help.  The term sheet says that the GWCCA will cooperate with them ""in pursuing other possible governmental funding sources with respect to such offsite infrastructure as may be required.""

Reed floated the possibility of using an additional $53 million in city economic development dollars.

WXIA-TV recently reported that the stadium could receive millions of dollars in tax breaks from the state through an economic development program for projects of ""regional significance.""

And furthermore, state money that the Georgia Department of Transportation gives local governments for road maintenance could be available, state DOT spokeswoman Jill Goldberg said.  The project may be eligible for federal funds, too.

Goldberg stressed, though, that no plans have been made, and the project may need no state money.

Robinson told PolitiFact Georgia that he did not ""foresee"" state DOT money being used, but there are no set plans.

""There’s too many unknowns at this juncture,"" Robinson said in an email. ""There’s no deal at this time.""

Let’s move on to the second part of Deal’s claim. Will the public’s share of the cost really be paid for by ""outsiders""?

Not entirely. As we mentioned earlier, the GWCCA would use state funds to buy the site, and state, local and federal funds could be used for infrastructure.

But the majority of the projected $300 million in hotel/motel taxes for stadium construction would be paid by outsiders.

Some 86 percent of those who stay in hotels in unincorporated Fulton and the city of Atlanta are from out of state, Atlanta Convention and Visitors Bureau spokeswoman Lauren Jarrell said.

Our ruling:

Regardless of how you interpret Deal’s claim, it fell short.

Yes, a large portion of the public’s contribution would come from local hotel/motel taxes, and these are overwhelmingly paid by ""outsiders.""

But the state will buy land for the stadium, could chip in to help with hundreds of millions in infrastructure costs, and could provide substantial tax breaks.

The total share for taxpayers could  easily exceed $300 million.

Deal’s claim is premature. And it leaves out important details.

The governor gets a Half True.",/factchecks/2013/jan/04/nathan-deal/deal-makes-premature-claim-falcons-stadium-bid/
"['Government Regulation', 'Texas', 'Guns', 'Louie Gohmert']","
Louie Gohmert says George Washington said a free people should be armed to guard against government tyranny
","
Why should ordinary Americans be able to buy semi-automatic weapons designed for the military or law enforcement?

That was ""Fox News Sunday"" host Chris Wallace’s question to U.S. Rep. Louie Gohmert, a Texas Republican, on his Dec. 16, 2012, show, two days after the Newtown, Conn., elementary school massacre.

Gohmert answered in part, ""For the reason George Washington said a free people should be an armed people. It ensures against the tyranny of the government.""

We contacted spokeswomen for Gohmert, seeking details on the Washington quotation, but didn’t hear back.

But a Web search led us to a similar statement that Washington made in the first State of the Union address, Jan. 8, 1790: ""A free people ought not only to be armed, but disciplined.""

Experts told us, though, that Washington was calling for a trained militia to defend the new nation, not anticipating a citizens’ stand against their own government’s tyranny.

The statement comes near the beginning of Washington’s speech:
  
Among the interesting objects, which will engage your attention, that of providing for the common defence will merit particular regard. To be prepared for War is one of the most effectual means of preserving peace. 
A free people ought not only to be armed but disciplined; to which end a uniform and well digested plan is requisite. And their safety and interest require, that they should promote such manufactories, as tend to render them independent on others for essential, particularly for military supplies. 
The proper establishment of the Troops, which may be deemed indispensable, will be entitled to mature deliberation. 

Ron Chernow, whose ""Washington: A Life"" won the 2011 Pulitzer Prize for biography, helped us translate that into 21st-century-ese.

""In this passage, Washington is talking about national defense policy, not individuals arming themselves, and the need for national self-sufficiency in creating military supplies,"" Chernow told us by email.

John Woolley, co-creator of the American Presidency Project at the University of California-Santa Barbara (where we first saw the speech), also said Washington was speaking about external threats and ""not being dependent on imported weapons.""

""He said that as a practical matter, the young and vulnerable USA needed to be prepared to mount an effective defense against other"" nations, Woolley told us by email. The Senate and House both issued formal responses, Woolley said, and ""there is no hint in either of these that the members of Congress thought there was something in that speech about gun rights.""

Washington’s address goes on to say that peaceful measures having failed in regards to ""certain tribes of hostile Indians"" on the southern and western frontiers, ""we ought to be prepared to afford protection to those parts of the Union.""

The ""common defence,"" being prepared for war and having the ability to protect against hostile tribes all refer to outside threats.

Edward Lengel, editor in chief of the Papers of George Washington project at the University of Virginia, told us by email, ""Washington never said, to my knowledge, anything about arms providing a safeguard against any so-called ‘tyranny’ of government.’ ""

In reading the ""armed, but disciplined"" quotation, Lengel said, ""emphasis should be on the word ‘disciplined,’ by which Washington was taking a backhanded swipe at the militia, which he considered undisciplined and next to useless in combat. Washington was all for an ordered, professional standing army under the command of a strong central government.""

But an army was expensive, as Washington wrote in a May 2, 1783, memo to a congressional committee that asked for his advice on how to organize the military in peacetime.

""We are too poor to maintain a standing Army adequate to our defence,"" he said, and suggested a small regular army supplemented by a well-organized militia -- a part-time force of volunteers, called up in emergencies. The Militia Acts of 1792 tracked with the memo’s description, calling for white men 18 to 45 years old to be enrolled in a militia. A cost-cutting provision required them to provide their own arms and ammunition.

So there’s evidence that post-Revolutionary lawmakers expected citizens to own firearms. And, Woolley said, some leaders then undoubtedly ""endorsed views like those Mr. Gohmert expresses -- perhaps more precisely, in order to stay free, the people should have the right to be armed.""

Washington, though, does not appear to have been among them.

Lengel said, ""The idea of resistance to tyranny being dependent on a nation of gun-wielding individuals acting at their own behest or even on local initiative would have been anathema to Washington.

""Indeed, during the (Revolutionary) war he very frequently lamented the crimes carried out by armed civilians or undisciplined militia against their unarmed neighbors. The solution to these crimes, as he understood it, was to increase the power of the government and the army to prevent and punish them -- not to put more guns in the hands of civilians.""

Mary Thompson, research historian at Washington’s Virginia home, Mount Vernon, told us via email, ""Washington’s actual quote is in regard to the people serving in the militia as an arm of the government,"" rather than as an armed resistance to government.

In fact, she said, Washington called up militias to put down just such a rebellion a few years later.

During the Whiskey Rebellion in 1794, she said, ""citizens of Western Pennsylvania rose up to fight a new tax on the whiskey they produced."" Washington was ""concerned that success by the rebels would lead to a diminishment of the central/federal government,"" and directed state militias to counter the insurrection -- ""citizen-soldiers,"" she said, ""acting on behalf of the government against their fellow citizens.""

Our ruling

Gohmert’s rendering, ""George Washington said a free people should be an armed people,"" seemingly tracks Washington’s words to the nation: ""A free people ought not only to be armed, but disciplined.""

Contrary to Gohmert’s characterization, though, Washington was not speaking about citizens arming themselves in case of government tyranny. Quite the opposite: The president and former general was calling for disciplined troops to fight on behalf of the government.

Gohmert’s statement is False.",/factchecks/2013/jan/03/louie-gohmert/louie-gohmert-says-george-washington-said-free-peo/
"['New Jersey', 'Natural Disasters ', 'Weather', 'Robert Menendez']","
U.S. Sen. Menendez says $60 billion was approved 10 days after Katrina, but Sandy aid still pending
","Two months after Hurricane Sandy devastated parts of the Garden State, New Jersey officials and residents are still waiting for Congress to sign off on roughly $60 billion in emergency relief aid.

But after Hurricane Katrina pummeled New Orleans in August 2005, it only took 10 days for a similar level of federal aid to be approved for that disaster, according to U.S. Sen. Robert Menendez.

Raising his voice, the New Jersey Democrat offered that comparison during a Dec. 27 speech on the Senate floor in regard to a $60.4 billion aid package for Sandy victims. The Senate approved the package Dec. 28, but the House has delayed action on the funding.

""I want my colleagues to remember that 10 days after Hurricane Katrina, this chamber passed two separate bills amounting to $60 billion,"" Menendez said. ""It has been nearly two months since we had Superstorm Sandy and nothing has passed.""

Menendez is right.

In the 10 days after Hurricane Katrina made landfall in Louisiana, the Republican-controlled Congress approved two bills providing $62.3 billion in emergency funding, and President George W. Bush immediately signed them into law.

In this fact-check, we’re not comparing the levels of damage caused by Katrina and Sandy. Our focus is on the timing of emergency appropriations approved by Congress.

Here’s how the timing breaks down:

Katrina made landfall Aug. 29, 2005, near Buras, La., and continued north toward New Orleans, leaving about 80 percent of the city flooded, according to a report from the National Hurricane Center.

On Sept. 2, 2005, Congress passed a bill to provide $10.5 billion in emergency funding for disaster relief related to Hurricane Katrina. Then, on Sept. 8, 2005, Congress passed another bill for an additional $51.8 billion in emergency appropriations.

So, 10 days after Katrina reached New Orleans, Congress had approved $62.3 billion in emergency funding.

Now, let’s talk about federal aid for victims of Hurricane Sandy.

Sandy made landfall near Atlantic City on Oct. 29, ultimately damaging more than 70,000 homes and businesses in New Jersey alone, The Star-Ledger has reported. Parts of New York and Connecticut suffered extensive damage as well.

On Dec. 7, President Obama requested $60.4 billion in emergency appropriations to assist the states affected by Sandy. In a 62-32 vote on Dec. 28, the Democrat-controlled Senate approved that amount.

But around the same time when the GOP-led House passed legislation dealing with the so-called ""fiscal cliff,"" Speaker John Boehner canceled a vote on the disaster relief Tuesday night.

Boehner is expected to schedule a vote tomorrow on $9 billion for the National Flood Insurance Program and another vote on Jan. 15 for the remaining $51 billion in the aid package.

Our ruling

In a Dec. 27 speech on the Senate floor, Menendez said that ""10 days after Hurricane Katrina, this chamber passed two separate bills amounting to $60 billion. It has been nearly two months since we had Superstorm Sandy, and nothing has passed.""

The senator’s claim is on the mark. Within 10 days after Hurricane Katrina made landfall in Louisiana in August 2005, Congress approved two separate bills providing a total of $62.3 billion in disaster relief funding.

The Senate on Dec. 28 approved a $60.4 billion aid package for Hurricane Sandy, but the House has delayed action on the emergency funding.

We rate the statement True. To comment on this ruling, go to NJ.com.",/factchecks/2013/jan/03/robert-menendez/hurricane-sandy-aid-still-pending-us-sen-robert-me/
"['Ohio', 'Deficit', 'Federal Budget', 'Taxes', 'John Boehner']","
John Boehner says half the wealthiest Americans are small business owners
","
As President Barack Obama and House Speaker John Boehner dickered over how to avoid the so-called fiscal cliff, the issue of who might pay more in taxes was a persistent stumbling block.

The White House said there could be no deficit deal unless Republicans agree to raise tax rates on the wealthiest households and proposed increasing rates on incomes greater than $250,000 a year for married couples ($200,000 for individuals).

Republicans wanted to focus the talks on spending and entitlements.

Ultimately a deal brokered by Vice President Joe Biden and Senate Minority Leader Mitch McConnell, a Kentucky Republican, was approved. It allowed rates to rise on incomes above $450,000 for married couples.

But during the negotiating, Boehner balked at increasing the maximum 35 percent tax rate on high-income taxpayers at all because of the effects for small business.

""The problem with raising tax rates on the wealthiest Americans is that more than half of them are small business owners,"" Boehner said in a news conference. ""Raising tax rates will slow down our ability to create the jobs that everyone says they want.""

PolitiFact has examined a similar claim Boehner made about small business owners before, and rated it False. FactCheck.org also has looked at the issue, calling it ""an incorrect talking point"" and a ""bogus claim."" But we wondered about current figures behind the claim, and several readers asked about its accuracy.

We asked Boehner's office how he backed up the statement. His staff said the tax increases would hit half of all small business income, and they pointed us to a January 2012 report from the President’s Council on Jobs and Competitiveness.

The council's report states: ""About half of business income now accrues to pass-through entities such as S corporations and partnerships; although the income of such pass-through entities is subject to tax at the individual level, it is excluded from the corporate tax.""

In other words, Boehner's staff said, many small businesses file their taxes as individuals, not corporations, and 53 percent of all business income is taxed through the individual code.

Boehner's staff also cited a report by the nonpartisan Joint Committee on Taxation in Congress which said the tax hikes would affect roughly 940,000 small business owners. It, too, found that 53 percent of business income would be reported on tax returns in the top brackets on which Obama would raise taxes.

That does show that some small business owners would see taxes go up. But it falls short of supporting Boehner's statement.

While the JCT report found that 53 percent of business income would be reported in the top two tax brackets, that is not at all the same as saying that half of the earners are being taxed at that rate.

In fact, the JCT estimated that just 3.5 percent of taxpayers with business income in 2013 would fall in the tax brackets that would rise under Obama's proposal.

And the JCT said its figures ""do not imply that all of the income is from entities that might be considered 'small.' For example, in 2005, 12,862 S corporations and 6,658 partnerships had receipts of more than $50 million.""

S corporations and partnerships are ""pass-through"" businesses in which profits pass from the business to individual shareholders for tax purposes. They include sole proprietorships and such partnerships as big law firms and financial funds. Goldman Sachs was classified as a partnership before it went public in 1999.

So what is a small business?

The Office of Tax Analysis at the U.S. Treasury Department issued a study in 2011 that recognized the need for a clear definition. The authors acknowledge that defining a small business is a matter of setting some subjective parameters.

The ones they set include a limit of $10 million in income or deductions to be counted as ""small,"" and a minimum labor deduction of $10,000 to distinguish businesses that don’t have any employees.

Other tests they applied excluded businesses on the very low end of the scale, such as those with $4,600 or less net annual income. They defined an ""owner"" as someone who gets at least one-fourth of income from a small business.

Not surprisingly, by narrowing the definition, far fewer tax filers qualified as small businesses.
The analysis found that: 
Boehner's statement was: ""The problem with raising tax rates on the wealthiest Americans is that more than half of them are small business owners.""

That is wrong on two points -- the ""half"" and the ""small business owners.""

Of the business income reported on tax returns, half of it would have been taxed at the top two rates, the Joint Committee on Taxation found. But that doesn’t mean half of the earners are paying those rates.

And it’s incorrect to call small business owners and millionaires who would see a tax increase one and the same. For top earners who report business income, it is often just a fraction of their total income. They are not the folks operating small manufacturing plants or neighborhood pizza parlors. In fact, only 0.5 percent of small businesses make that kind of money.

More often, small businesses are small in every sense -- most have incomes of less than $50,000 and almost all have profits of less than $1 million -- and they wouldn’t be affected by the millionaires tax.

Boehner’s statement is not accurate. On the Truth-O-Meter, his claim rates False.",/factchecks/2013/jan/03/john-boehner/john-boehner-says-half-wealthiest-americans-are-sm/
"['National', 'Corporations', 'Federal Budget', 'Financial Regulation', 'American International Group']","
AIG says it has repaid the government, plus profit
","New Year’s Day football watchers got a heavy dose of rah, rah from AIG, the big insurance company that was bailed out by federal taxpayers.

An ad called ""Thank You, America"" featured scenes from Hurricane Sandy, tornado-ravaged Joplin, Mo., and the World Trade Center — disasters the company insured — with the message: We paid you back.

AIG has repaid ""everything, plus a profit of more than $22 billion,"" an employee in the ad says.

Text on the screen soon flashes: ""$205 billion, paid to America from AIG.""

You’ll see the ad over the next two weeks as you watch sports, news and the Golden Globes. We thought you might wonder: Is that true? Did the company pay back its loans plus a profit?

Final stock sale

Back in 2008, AIG was in deep trouble. AIG Financial Products had invested heavily in complicated financial instruments called credit default swaps. As financial journalist Michael Lewis put it in his book The Big Short, AIG became, essentially, the world’s biggest owner of subprime mortgage bonds.

When those bonds turned out to be dangerously hollow, the financial world unraveled. Bear Stearns failed, Fannie Mae and Freddie Mac collapsed and Lehman Bros. went bankrupt. After markets reacted badly to the Lehman bankruptcy, the Federal Reserve and Treasury Department decided to rescue AIG.

Offering $182 billion to stabilize the company, the federal government became its largest stockholder. Two years ago, the Treasury held 92 percent of AIG’s common stock — more than a billion and a half shares.

The company made significant changes, including slashing bad investments made by AIG Financial Products, the division that oversaw the controversial credit default swaps.

The federal government gradually sold its stake. Last month, the Treasury sold the last shares for an overall ""positive return"" of $22.7 billion. Andrew Ross Sorkin, a New York Times columnist and author of Too Big to Fail, called AIG the ""turnaround of the year.""

Still, the New York Times editorial board and critics of the bailout point out that amount doesn’t take into account tax breaks the company got as part of the deal. Former members of an oversight panel said in March that a special tax exemption offered by the Treasury in 2008 amounted to a ""stealth bailout.""

It allowed AIG to count net operating losses against future tax bills, which ""some estimate has contributed to $17.7 billion in profits for the company,"" according to the group of former oversight panelists, including chair Elizabeth Warren, now a Democratic senator from Massachusetts.

So, have the government’s loans been repaid, with a ""positive return"" of $22 billion for taxpayers? Yes. Was the entire U.S. bailout of AIG, including special tax provisions, that profitable? No.

Our ruling

AIG says it honored its commitment to repay the government, plus a profit of more than $22 billion.

It's true that the government has recouped the $182 billion it loaned AIG, plus $22.7 billion. Still, critics have a point that a special tax provision granted to aid the struggling company substantially offsets that ""profit."" We rate the company’s claim Mostly True.",/factchecks/2013/jan/02/american-international-group/aig-says-it-has-repaid-government-plus-profit/
