tags,sub_header,text_body,quote_href
"['Michigan', 'Tweets']","
List does not show over 14,000 dead people cast ballots in Michigan’s Wayne County
","A viral tweet claims that thousands of dead Wayne County voters cast ballots in this election. ""Here is a list of 14+ thousand dead people who voted in Wayne County (Detroit),"" the tweet says, linking to a list that provides the first and last names of just over 14,500 individuals and their birth year. This tweet marks the latest in a long line of false claims that individuals fraudulently cast mail-in ballots on behalf of dead voters. All of the voters listed are over the age of 100, but they’re not all Wayne County residents, and at least several of the voters named on the list are not marked in the state’s voter information center as ever having received or cast an absentee ballot. And at least one woman listed seems to still be alive. According to the state’s voter information center, one voter, Imo Oliver of Ypsilanti, included on the list of allegedly dead voters cast an absentee ballot this year. The state’s voter information center shows that Oliver received her absentee ballot Sept. 24, and it was returned to the clerk’s office Oct. 2. PolitiFact Michigan used public records to identify the Ypsilanti voter, and spoke to a woman who identified herself as Imo Oliver. She was an elderly woman who said she suffered from memory loss, but she said her son assisted her to vote in this election. Some may be dead, but there’s no evidence that the state counted any ballots cast by deceased voters. Others may be old, but there’s no law establishing an age limit on voting. Michigan is a member of the Electronic Registration Information Center, a multi-state partnership that offers access to federal databases and technology to ensure the integrity of voter files. The system relies on Social Security Administration death records to flag deceased voters. The state also checks to ensure that ballots cast by people who are deceased are not counted. In the August primary, the state successfully identified ballots cast by 846 people who had passed away between casting their ballot and the election.  ""Ballots of voters who have died are rejected in Michigan, even if the voter cast an absentee ballot and then died before Election Day,"" the Secretary of State’s Office noted on its fact-check page. Sometimes clerical errors occur when recording ballots received by voters with similar names. The Secretary of State’s fact-check notes, ""On rare occasions, a ballot received for a living voter may be recorded in a way that makes it appear as if the voter is dead."" One viral example from this week concerned a son and his late father, who shared the same name and home address. A screenshot from the voter information center showed the elder Bradley as having cast a mail ballot in the 2020 election, even though he died in 1984. PolitiFact investigated and learned this was a mistake, not voter fraud. The city clerk’s office initially recorded the younger ballot as belonging to the deceased father, a consultant for the Detroit Department of Elections told PolitiFact.  The New York Times reported that ""internet sleuths have widely disseminated what they said was evidence that showed Democrats were trying to steal the election. In virtually every case so far, mainstream journalists have found the claims to be false or the product of typical errors in the election process."" Despite widespread claims that dead voters cast ballots in Detroit, Michigan, Virginia, Nevada and Wisconsin, none stack up. This one doesn’t either. A tweet claims that this election, over 14,000 dead people in Wayne County voted. There is no evidence to support this claim. While the list contains the names of over 14,000 individuals, they are not all Wayne County residents. Several of the individuals did not receive or cast an absentee ballot. At least one woman listed seems to still be alive. There is no evidence that Michigan clerks counted ballots fraudulently cast on behalf of dead people. We rate it False. Reporting contributed by Ashley Nerbovig ",/factchecks/2020/nov/07/tweets/list-does-not-show-over-14000-dead-people-cast-bal/
"['Nevada', 'Elections', 'Nevada Republican Party']","
Fact-checking Republican claim of illegal votes in Nevada
","President Donald Trump’s campaign and Republicans in Nevada are questioning the integrity of the 2020 election, claiming that there ""appear"" to be thousands of people who voted illegally. ""Our lawyers just sent a criminal referral to (U.S. Attorney General Bill) Barr regarding at least 3,062 instances of voter fraud,"" the Nevada Republican Party tweeted Nov. 5. ""We expect that number to grow substantially. Thousands of individuals have been identified who appear to have violated the law by casting ballots after they moved from NV."" ""In Nevada, there appear to be thousands of individuals who improperly cast mail ballots,"" Matt Morgan, general counsel for Trump’s reelection campaign, similarly said in a statement Nov. 6. PolitiFact reached out to Trump’s campaign, a law office representing the campaign, and to the Nevada Republican Party seeking information. We did not hear back. At this point, the claims are unproven. A lawsuit filed Nov. 5 against Nevada’s secretary of state and the Clark County registrar of voters alleges that ""irregularities have plagued the election in Clark County."" Clark County is Nevada’s most populous county, is home to Las Vegas and has the state’s highest number of registered Democrats. The lawsuit claims that there were ""over 3,000 instances of ineligible individuals casting ballots,"" and that ballots were cast on behalf of deceased voters. It does not include evidence to back those claims. The lawsuit, which challenges the county’s use of a machine as a step in signature verification, was filed on behalf of a Nevada resident, candidate committees for two Republicans running for Congress, and another person identified as a credentialed member of the media. ""We are not aware of any improper ballots that are being processed,"" Clark County Registrar of Voters Joe Gloria said during a press conference Nov. 5. Lawyers for Trump’s campaign sent a letter to Clark County’s counsel, saying, ""We have confirmed that thousands of votes have been cast improperly. Indeed, we have initially identified 3,062 voters who moved from Nevada before the election but still cast ballots in this election."" The lawyers said they cross-referenced the list of general election voters with publicly available change of address records. The attorneys sent a similar letter to Barr, the U.S. attorney general. However, a mismatch in those records doesn’t necessarily mean that a vote was cast illegally. The ACLU of Nevada said that an American who moved within 30 days before an election has a right to vote in a presidential race in their new state of residence, or may cast a ballot in their previous state of residence, in-person or via absentee ballot. A spokesperson for Nevada Secretary of State Barbara K. Cegavske, a Republican, told PolitiFact that the ACLU statement is accurate and also applies to Nevada. Trump’s lawyers produced a list of voters who allegedly voted improperly. But Jon Ralston, editor of The Nevada Independent, a nonprofit news organization, noted in a Nov. 6 tweet that the list includes Nevadans in the military who voted absentee. ""Many on list sent to the DOJ have these postal codes: AE, AA and AP: Armed Forces Europe, Armed Forces Americas and Armed Forces Pacific,"" Ralston said. The list does not include voters’ names, but does show other identifying information. It includes the city, state, and zip code where one voter moved from, and the city, state, and zip code where the voter moved. For instance, the first page of the list says that ""vote cast record 28"" moved from Las Vegas, Nev., and lists as the new city ""FPO"" and as the new state ""AE."" The Defense Department says that ""FPO"" stands for Fleet Post Office, and is associated with Navy installations and ships. The U.S. Postal Service says that ""AE"" should be used as the ""state"" abbreviation for Armed Forces in Europe. Nevadans who go to college out-of-state and other people who leave the state temporarily can also get a ballot at a new address. So the list produced by Trump’s lawyers on its own does not prove whether the identified people cast a vote illegally. Nevada Republicans said they found ""at least 3,062 instances of voter fraud. ... Thousands of individuals have been identified who appear to have violated the law by casting ballots after they moved from NV."" The GOP lawyers issued a list that they say shows more than 3,000 people who were no longer living in Clark County by the time they cast their ballots. The list alone does not prove a violation of the law. People who move within 30 days before an election can cast a vote in their new state, or in their prior state of residence, in-person or via absentee ballot. A Nevadan who goes to another state for college can also request a ballot. The list from Trump’s lawyers also included addresses for Americans serving overseas in the military. The burden of proof is on the speaker making the claim. The information released so far by Trump’s team does not confirm their claim. We rate the claim False. RELATED: Donald Trump’s Pants on Fire claim about illegal votes This fact check is available at IFCN’s 2020 US Elections #Chatbot on WhatsApp. Click here, for more.",/factchecks/2020/nov/06/nevada-republican-party/fact-checking-republican-claim-illegal-votes-nevad/
"['Elections', 'Texas', 'Pennsylvania', 'Ted Cruz']","
Ted Cruz falsely claims Philadelphia is counting votes in ‘shroud of darkness’
","Sen. Ted Cruz amplified President Donald Trump’s baseless and conspiratorial claims of a stolen election, falsely claiming that Philadelphia officials have been kicking out Republican election observers and counting legally cast ballots ""in a shroud of darkness."" ""I am angry, and I think the American people are angry,"" Cruz said in a Nov. 5 interview with Fox News host Sean Hannity. ""Because, by throwing the observers out, by clouding the vote counting in a shroud of darkness, they are setting the stage to potentially steal an election.""  There is no evidence at this point that any significant number of illegal votes have been cast, and neither Trump nor Cruz have provided any proof of wrongdoing.  The Texas senator’s claim about votes being counted ""in a shroud of darkness"" is also wrong. Observers from both political parties have had access to the process in Philadelphia and in Pennsylvania more broadly. Philadelphia’s counting setup also includes a livestream. Hours before Cruz appeared on Fox News, Pennsylvania Secretary of State Kathy Boockvar told CNN’s Jake Tapper there was ""absolutely"" nothing happening in the dark. ""In Pennsylvania, every candidate and every political party is allowed to have an authorized representative in the room observing the process,"" Boockvar said, adding that the livestream in Philadelphia is available worldwide. ""It’s very transparent."" Hours after Cruz’s comments, Philadelphia City Commissioner Al Schmidt, a Republican, also appeared on CNN. ""Observers from the Democratic Party and Republican Party, from the Biden campaign and the Trump campaign, have been in our counting area observing, right up against where the process is taking place, from the very beginning,"" he told CNN’s Don Lemon. A Cruz spokesperson said Republican observers have been ""denied meaningful access to the ballot processing and counting process in Philadelphia,"" citing a recent judge’s order allowing observers from both parties to watch the process from within six feet. Observers had previously been kept farther away due to concerns about the coronavirus.  Election workers scan in ballots at the Pennsylvania Convention Center on Nov. 3, 2020, in Philadelphia. (AP) The city has appealed the judge’s order, saying they have provided access that is in step with the law and accounts for the pandemic. But it has complied in the meantime. Cruz has argued on Twitter that the previous distance was too far.  He wrote that observers were so far away that they ""had to use binoculars"" — something the Philadelphia Inquirer photographed one election observer doing on Nov. 3. But Cruz’s claim that Philadelphia is cloaking the process in secrecy is far from accurate.  ""At all times, the city commissioners, who are a bipartisan organization, have followed the law,"" said Kevin Feeley, a spokesperson for the city commissioners. City solicitor Marcel Pratt told the Philadelphia Inquirer that a location has been set up so observers ""can easily view the room without impeding the operation,"" and the city wrote in its court appeal that representatives from both parties could ""see the entire set up"" in detail. The same day Cruz spoke to Hannity, a Trump campaign lawyer told a federal judge in court that the campaign had several representatives in the room, according to news reports.  In an effort to halt the vote count, the Trump campaign cited testimony from one observer who said he could not tell whether there were any errant markings on ballot secrecy envelopes. But a judge denied the bid and suggested an agreement be reached for the number of observers. Pennsylvania commonwealth law allows election observers. Feeley noted that Act 77, the law that established mail-in voting and allows observers to be present when mail ballots are opened and recorded, was passed by a Republican legislature. ""Any laws around poll watchers apply equally to both major parties and any third parties,"" said Suzanne Almeida, interim executive director of Common Cause Pennsylvania. ""I have seen no evidence that one party’s poll watchers have been treated any differently than the other."" The city’s livestream, which has been running since Election Day, also provides viewing access to the general public. Wired reported that watching the livestream closely ""reveals almost every step of how a ballot becomes a vote.""  Cruz’s office did not respond by deadline to a question asking for examples of Republican observers being kicked out of the convention center. In another Nov. 5 tweet, Cruz shared a video of a man accusing Philadelphia officials of preventing him from observing. But Buzzfeed News reported that the man was not wrongfully prevented as Democrats were ""defying the law,"" as Cruz claimed. He was removed for breaking the rules against filming. ""Security there asked him to stop, and he refused,"" Feeley said. Feeley said he has been present for the ballot counting each day since the election, and that he knows of no other observer who was told to leave. ""I’m staring at them now,"" Feeley said. ""Claims regarding election observers being wrongly removed from the convention center are demonstrably untrue,"" added Jane Roh, a spokesperson for the Philadelphia district attorney. In an isolated mixup, one poll watcher was denied on Election Day from watching the voting process — not the ballot-counting process — but Feeley told PolitiFact at the time that the person was allowed in at another polling site and had been denied by mistake. Cruz said Philadelphia is ""clouding the vote counting in a shroud of darkness."" That’s not the case. A judge ruled to let election observers watch the count from closer up, but representatives from both parties have been allowed to observe the process all along. The counting is also being streamed live online. We rate Cruz’s statement False. This fact check is available at IFCN’s 2020 US Elections #Chatbot on WhatsApp. Click here, for more.",/factchecks/2020/nov/06/ted-cruz/ted-cruz-falsely-claims-philadelphia-counting-vote/
"['Elections', 'Facebook Fact-checks', 'Instagram posts']","
No, a porn site logo didn’t appear on CNN broadcast
","Levity feels in short supply this week, so if you chuckled seeing a logo of a porn website flash onto the screen during a CNN broadcast, we’re sorry to tell you that it was doctored.  A clip spreading on social media shows CNN anchors Wolf Blitzer and John King standing in front of a screen showing some results from the presidential election when King appears to swipe away the logo for Pornhub. This post was flagged as part of Facebook’s efforts to combat false news and misinformation on its News Feed. (Read more about our partnership with Facebook.)  King does swipe away a graphic in the original video — it’s unclear what it is — but it doesn’t have the Pornhub logo on it, or anything else that’s NSFW.  A Twitter asked King if the doctored clip was real, and King confirmed it’s ""not.""  ""Some clown taking time away from lying about something else apparently because they don’t like math,"" he said.  Piers Morgan was among the people fooled by the fake video, however.  ""OMG,"" he tweeted, with two emojis of monkeys covering their eyes.  He tweeted a correction later.  ""Apparently this is a fake,"" he said. ""Still bloody funny though.""  We rate this clip False. This fact check is available at IFCN’s 2020 US Elections #Chatbot on WhatsApp. Click here, for more.",/factchecks/2020/nov/06/instagram-posts/no-porn-site-logo-didnt-appear-cnn-broadcast/
"['National', 'Elections', 'Donald Trump']","
Donald Trump’s Pants on Fire claim about illegal votes
","As vote counting continued, President Donald Trump offered a fresh round of falsehoods and wrongly suggested illegal votes are swinging the election toward Joe Biden.  ""If you count the legal votes, I easily win. If you count the illegal votes, they can try to steal the election from us,"" Trump said Nov. 5. We asked Trump spokespersons which votes he considered ""illegal"" and did not hear back. However, the rest of Trump’s remarks show that he questioned the timing of mail ballot arrivals and the counting in certain battleground states.  As Trump continues to perpetuate a myth about widespread voter fraud, he hasn’t proved that illegal votes influenced the election.  ""So far we have seen no credible evidence of illegal votes in any state that could potentially tip the results of the election to Trump,"" UC Irvine law professor Rick Hasen said Nov. 6. ""Assuming Biden wins Pennsylvania, I see no path for Trump to litigate his way to victory based upon unsubstantiated claims of fraud.""  The idea that Democrats would orchestrate a nationwide felonious scheme to count illegal votes would require voters and election workers in various counties (Democrats and Republicans) to coordinate and take actions that risk prison time. And it defies logic that such a scheme would take place that would aim to keep Trump out of the White House but have Republicans win seats in the House and potentially retain control of the Senate. Republicans govern some of the states Trump has challenged vote counting. Nevada has a Republican secretary of state. Georgia has a Republican secretary of state and governor. Arizona has a Republican governor. The regular counting of legal ballots continued at the time of Trump’s remarks in a handful of battleground states. Trump has targeted ""late"" ballots, but that’s inaccurate. State laws specify when mail ballots must be postmarked or arrive in order to be counted, and the grace period (if there is one) varies by state. States also vary in their policies on how early election officials can start processing mail ballots.  Election officials have been following the processes in their state laws to verify and tabulate ballots. They have been rejecting ballots that violated state laws, such as omitting the signature on the envelope or sending it in past the state’s deadline, and only counting ballots that are legal, said David Becker, executive director of the Center for Election Innovation & Research. Many states give voters time to correct signature issues. There are policies, too, across many states allowing political parties or others to deploy observers to watch the ballot verification and counting. Who can observe and what they can watch (and especially in the pandemic, how many can be in the room) can vary by state, but the underlying principle is transparency. Steven Huefner, an election law expert at Ohio State University, said questionable ballots are set aside and not counted as they await an official review. ""Might an election official make a mistake and count a ballot that should not have been counted? Sure. Is there any evidence that has happened this election? Not that I have seen,"" Huefner said. Trump and his allies have filed lawsuits in an effort to challenge vote counting and other procedures in states with close races. Judges have thrown out lawsuits filed by the Trump campaign in Michigan and Georgia. In Pennsylvania, a federal judge denied a request to halt ballot counting in Philadelphia. Pennsylvania Republicans filed an emergency U.S. Supreme Court request related to the arrival of mail ballots.  Litigation remains pending targeting Clark County in Nevada, the most populous county in the state with the highest number of Democrats and home to Las Vegas.  The lawsuit alleged that in Clark County there were ""over 3,000 instances of ineligible individuals casting ballots. Ballots have even been cast on behalf of deceased voters."" The Nevada Republican Party sent information to the U.S. Department of Justice that alleged that 3,062 voters were no longer living in Nevada when they cast their ballots. The lawsuit also challenges the county’s use of a machine as a step in signature verification. Whether any of those 3,000 or so voters were indeed ineligible to cast a vote remains to be seen. However there are circumstances under which a person who has moved can still cast a Nevada ballot, including if they left the state temporarily, are in the military or are students. Regardless, 3,000 votes (and assuming all such votes went to Biden) would not make up the difference for Trump as of Friday afternoon, when Biden led in Nevada by about 20,000 votes. Clark County Registrar Joe Gloria, who administers the election, said Nov. 5, ""We are not aware of any improper ballots that are being processed."" Nevada expanded voting by mail due to the pandemic, which Gloria said resulted in a slower process to complete the count. But he explained that election officials are taking the steps required to verify ballots. Ben Hovland, chairman of the bipartisan U.S. Election Assistance Commission, told PolitiFact that there was no evidence of illegal votes being counted to steal the election. Trump has made claims of widespread voter fraud repeatedly, including in 2016 when he said millions of illegal votes cost him the popular vote, a claim we rated Pants on Fire. ""Time and time again when rubber hits the road there is no evidence, no evidence in academic after academic study, in court case after court case — there was whole presidential commission election integrity to track down widespread voter fraud — none of those cases found widespread voter fraud,"" Hovland said. It’s possible when all the vote counting is finished that election officials will find some cases of fraudulent votes cast, but there is no evidence of widespread fraud.  ""The reality is voter fraud in this country is limited,"" Hovland said. ""It is isolated cases, usually small races where a few votes make a difference."" RELATED: Fact-checking Trump’s election fraud falsehoods in White House remarks Trump said, ""If you count the legal votes, I easily win. If you count the illegal votes, they can try to steal the election from us."" At the time of Trump’s comments the process of counting legal ballots continued in a handful of states with close races. Election experts say that local election officials are proceeding by following their state laws to count and verify ballots. There is no evidence that proper counting of legal votes automatically means Trump wins. And there is no evidence of widespread counting of illegal votes or any scheme by Democrats to steal the election. We rate this statement Pants on Fire!  ",/factchecks/2020/nov/06/donald-trump/donald-trumps-pants-fire-claim-about-illegal-votes/
