tags,sub_header,text_body,sources,quote_href
"['Facebook Fact-checks', 'Coronavirus', 'Facebook posts']","
No, there is no evidence that spending time around vaccinated people causes death or disease
","As COVID-19 vaccine distribution continues, so does the spread of online misinformation about purportedly serious side effects — not just for the people who are vaccinated, but also for the people who come near them.  ""The Unvaccinated Beware, COVID-19 mRNA Shots Cause Death and Disease Through GMO Shedding,"" reads the title of a nearly 15-minute video posted on Facebook.  The video is a screen recording of someone navigating between several articles while providing a voiceover. The video’s narrator reads through several anecdotal accounts of women experiencing out-of-the-ordinary menstrual cycles and pregnancy complications — including one death — after being around people who were vaccinated.  ""There have been some fatalities from contact with the vaccinated,"" the narrator says. ""This does not mean hugging or kissing, necessarily. It means being in the same room, in the same elevator. It’s a dangerous time."" These health problems and deaths were attributed to ""shedding of the mRNA,"" according to the video narrator. The post was flagged as part of Facebook’s efforts to combat false news and misinformation on its News Feed. (Read more about our partnership with Facebook.) This is not true. Being close to someone who has been vaccinated against COVID-19 cannot impact those who are unvaccinated. There is no evidence that anyone has died because they were near someone who was vaccinated.  Other fact-checking organizations have also debunked the claims in the video. And PolitiFact has debunked similar claims before. Recently, PolitiFact checked a claim about the vaccines affecting the fertility and menstrual cycles of unvaccinated individuals who were near vaccinated people and rated it False. Experts say that there are no parts of the vaccines that can be passed on to unvaccinated people. Dr. Kelly Moore, deputy director of the Immunization Action Coalition, said it is not possible that those who have received the COVID-19 vaccines are ""shedding"" materials that could cause unvaccinated individuals to experience side effects such as disease or death. Dr. Jen Gunter, an OB-GYN who writes a New York Times column, wrote in a blog post: ""An mRNA vaccine simply cannot affect other people. We don’t shed mRNA or spike proteins."" Similarly, experts at the Centers for Disease Control and Prevention told Reuters: ""There is no way for a COVID-19 vaccinated person to ‘shed vaccine.’"" Andrew Pollard, a professor of pediatric infection and immunity at the University of Oxford and a member of the Oxford Vaccine Group, told Full Fact that he couldn’t think of ""any biologically plausible mechanism for shedding"" any elements of the Pfizer-BioNTech Moderna vaccines after they’ve been administered. In addition, there is no evidence the COVID-19 vaccines have been linked to infertility or to pregnancy complications.  Those who are pregnant, trying to conceive or would like to get pregnant someday can get vaccinated against COVID-19, according to the CDC.  A Facebook video claims that people who aren’t vaccinated against COVID-19 should ""beware"" because being around people who have received the mRNA COVID-19 vaccines could cause ""death and disease."" There is no evidence anyone has died after being close to someone who received an mRNA COVID-19 vaccine. Experts say there is no way for people to shed mRNA or spike proteins after they’ve been vaccinated. The mRNA COVID-19 vaccines cannot affect people who are not vaccinated.  We rate this claim False.",[<zip object at 0x0000028097336DC0>],/factchecks/2021/apr/30/facebook-posts/no-there-no-evidence-spending-time-around-vaccinat/
"['Public Health', 'Facebook Fact-checks', 'Coronavirus', 'Instagram posts']","
Claim about COVID-19 vaccines misinterprets the meaning of herd immunity
","Throughout the COVID-19 pandemic, the term ""herd immunity"" has been tossed around as a future benchmark of progress in the fight against the virus. For over a year, health officials and news organizations have analyzed what herd immunity means for COVID-19, and whether and when the United States might achieve it. But we recently came across a post on Instagram that makes a series of problematic claims about the effectiveness of vaccines and the concept of herd immunity. Notably, it asserts that the benchmark revolves only around vaccines and can’t realistically be achieved because, ""100 percent of the population would have to be vaccinated for that to work."" The post was flagged as part of Facebook’s efforts to combat false news and misinformation on its News Feed. (Read more about our partnership with Facebook.)  This post is dubious for a couple of reasons. First, herd immunity does not depend on 100% of the U.S. population getting vaccinated. Everyone is encouraged to get the shot, because the more who do, the more likely it is that herd immunity can be achieved without putting too many more lives at risk. Second, herd immunity doesn’t mean that no one gets the disease. It means that if enough people get the vaccine or have some natural immunity from a previous infection, the virus’ spread can be contained.  The post bases its claim on the premise that ""today we take ‘herd immunity’ to mean that no one gets the disease if we all vaccinate."" That’s not the prevailing definition of herd immunity. Herd immunity occurs when enough people are immune — either through vaccination or previous infection — to make its spread from person to person unlikely. That’s because an infected person is less likely to encounter a non-immune person to pass it on to, breaking that link in the chain of transmission.  When that happens on a large enough scale, the spread of the disease remains under control, though it’s not necessarily eradicated. ""Herd immunity is not ‘everybody is vaccinated therefore the disease goes away,’"" said Dr. Sarah Fortune, chair of the Immunology and Infectious Diseases Department at the Harvard T.H. Chan School of Public Health. ""Herd immunity is, in fact, that enough people are vaccinated that the transmission chains are disrupted and people who are vaccinated, or not, are less likely to be exposed."" For COVID-19, scientists have tossed around different estimates of how much of the population needs to be immune, either naturally or by vaccine, in order for herd immunity to work well. The mathematical model for SARS-CoV-2 — which is derived based on how contagious the virus is and how the population behaves — puts it around 70 to 85 people out of every 100.  Even the most highly contagious viruses in the world don’t require 100% protection in a population to get them under control.   Take measles, for example. It’s considered the most contagious airborne virus that scientists are aware of, and medical experts say about 95% of the population needs to have protection for its circulation to remain low.  ""Before the vaccine was available for measles, 90% of people got measles by the time they were 15,"" Fortune said, adding: ""Measles isn’t gone, but the fact that a child now isn’t expected to be regularly exposed to it shows that herd immunity works."" In arguing that herd immunity can’t be achieved with vaccines, the Instagram post points out that vaccines don’t guarantee immunity. But the new COVID-19 vaccines’ high efficacy numbers undercut this point.  Clinical trials and follow-on studies show that the vast majority of people who get the COVID-19 vaccines are protected. ""The only people we found that don't produce an antibody response have highly dysfunctional immune systems,"" said Dr. Stanley Perlman, a professor of microbiology and immunology at the University of Iowa A study by the Centers for Disease Control and Prevention found that the vaccines produced by Moderna and Pfizer-BioNTech appeared to be 90% effective in preventing COVID-19 infection in a real-world setting (outside of clinical trials). And all three vaccines approved for emergency use in the U.S. have been proven to be highly effective at protecting against serious COVID-19 disease and death among those who do get infected. An Instagram post claims that vaccine herd immunity doesn’t exist because 100% of the population would need to get vaccinated for that to be achieved.  The post misinterprets the meaning of herd immunity.  Herd immunity occurs when enough people are immune — either through vaccination or previous infection — to make its spread from person to person unlikely. It doesn’t mean completely eradicating the disease through vaccination, and it does not require 100% of the population to be vaccinated. We rate this False. ",[<zip object at 0x00000280972DD580>],/factchecks/2021/apr/30/instagram-posts/claim-about-covid-19-vaccines-misinterprets-meanin/
"['National', 'Congress', 'Criminal Justice', 'Race and Ethnicity', 'Tim Scott']","
Bipartisan police reform has been a struggle in the Senate. Here’s the story
","Sen. Tim Scott, R-S.C., who has called on lawmakers to work together to achieve common ground, said that he proposed a police reform proposal last year, but Democrats thwarted his efforts. ""In 2015, after the shooting of Walter Scott, I wrote a bill to fund body cameras. Last year, after the deaths of Breonna Taylor and George Floyd, I built an even bigger police reform proposal,"" Scott said. ""But my Democratic colleagues blocked it. I extended an olive branch. I offered them amendments. But Democrats used the filibuster to block the debate from even happening."" Scott said negotiations with Democrats continue on police reform. ""My friends across the aisle all seem to want the issue more than they wanted a solution,"" Scott said. ""But I’m still working. I’m hopeful that this will be different.""  Scott made the comments during his GOP response to President Joe Biden’s address to a joint session of Congress.  Scott did propose a police reform bill in June 2020, but Democrats, who preferred their own version, blocked it. Each side accused the other of failing to negotiate in good faith, and neither party got its measure passed into law. Following the death of George Floyd on May 25, 2020, Senate Republicans and House Democrats wrote separate proposals for police reform.  Scott, the lone Black Republican in the Senate, was tasked with coming up with a police reform plan that would be acceptable to Republicans. Scott unveiled the Justice Act on June 17 and drew dozens of GOP cosponsors. ""I’ve been waiting for this for a long time. I’m sad that it takes another death to get here,"" Scott told NBC’s ""Today."" House Democrats unveiled the George Floyd Justice in Policing Act on June 8 and drew widespread support among their party. Scott’s Senate bill and the House Democrats’ bill had some similarities, such as making lynching a federal hate crime, increased data collection and funding for body cameras. Scott’s bill called for incentives, grants and study, while the Democrats’ version had more mandates. The proposals also had other key differences: Qualified immunity: Democrats sought to limit qualified immunity to make it easier for victims to sue police officers, while Scott’s bill didn’t change the practice. Chokeholds: Both aimed to curtail the use of chokeholds, but Scott’s bill had a more narrow definition of chokeholds than the Democrats’ bill. Both cut off funding to agencies as an incentive to create chokehold policies. No-knock warrants: The Democrats’ bill banned the use of federal no-knock warrants in drug cases and prohibited state and local agencies from receiving funds if they didn’t have a law prohibiting no-knock warrants in drug cases. Scott’s bill called for police agencies to report their use of no-knock warrants to the attorney general. Military equipment: The Democrats’ bill banned the transfer of surplus military weapons to police departments such as firearms, bayonets and grenades. The Senate version did not have that provision. President Donald Trump threatened to veto the Democrats’ bill if it reached his desk. Civil rights groups like the NAACP Legal Defense and Educational Fund objected to Scott's bill and said it lacked a ""strong accountability framework for police officers."" The group said it steered more funding to police agencies rather than reimagining public safety and routing money to social services. The ACLU opposed Scott’s bill and said it failed to address systemic issues such as militarization of police departments and qualified immunity. The ACLU did not endorse or oppose the House Democrats’ police reform bill and called on lawmakers to go further on several provisions. Sen. Dick Durbin, D-Ill., called for creating a bipartisan group to reach a deal, but Republicans sought a vote. Scott’s bill needed 60 votes to move forward, but it fell short on June 24, when Senate Democrats blocked the bill on a 55-45 vote. Two Democrats, Doug Jones of Alabama and Joe Manchin of West Virginia, along with independent Angus King of Maine, joined Republicans in voting to move the bill forward. King said the GOP proposal didn’t go far enough to address racial injustice, but ""my concern was that voting against it will end the discussion of this subject in the Senate for the foreseeable future."" Democrats dismissed the GOP bill as a ""political game"" that didn’t address the concerns of equal justice for Black Americans. ""And we're not going to play that game. And we're not going to be played,"" then-Sen. Kamala Harris, D-Calif., told reporters. After the bill died, Scott said in a floor speech that he was open to multiple Democrats’ amendments on the bill, such as collecting data on all uses of force and the definition of chokeholds. ""We offered them opportunities, at least 20 I offered, to change it,"" Scott said. ""Their answer to me? You can't offer 20 amendments. I said why not? Because Mitch McConnell won't give 20 amendments. I spoke to Mitch McConnell. He said you can have 20 amendments. I told them that."" Steven S. Smith, a political scientist at Washington University in St. Louis, said the Democrats’ vote was an example of minority obstruction.  The context is that the House had crafted their own version that they preferred.  ""Democrats wanted a sign that Republicans would move in their direction on the issue and found the Scott measure to be an inadequate alternative,"" Smith said. ""Both sides could have gone public with half-way measures. Neither side did so."" The Democrats’ legislation passed the House June 25, a day after Scott’s Senate version hit a wall. But the House version didn’t reach a vote in the Senate. Democrats reintroduced the legislation this year, and it passed the House in March but has yet to reach a vote in the Senate. Minneapolis police officer Derek Chauvin’s recent conviction for manslaughter and murder led to renewed calls by politicians to pass police reform. Scott has been trying to negotiate a compromise. The day after Scott’s speech, he was scheduled to meet with a bipartisan group of lawmakers to continue negotiations on the bill. Advocates for Floyd and others who died at the hands of police officers also met with lawmakers from both parties. One key sticking point for Republicans has been Democrats’ efforts to limit qualified immunity as a defense in civil lawsuits against police officers. Scott has called on making it easier for victims to sue police departments rather than individual officers.  In 2020, Scott said Democrats’ efforts on qualified immunity was a ""poison pill."" ""When you make it all about the individual officer, you run good cops out, you make it far more difficult to get anything accomplished, but if the actual conversation is around restitution and recourse, you can change the behavior of all officers, not simply one,"" he told Vox in July 2020. Scott says Democrats blocked his efforts at police reform. Scott proposed a bill in June 2020, but Democrats blocked it from moving forward. Scott omits the reason that Senate Democrats blocked the measure: They preferred the House version of a police reform bill Democrats put forward the same month.  While both parties faced pressure to adopt police reform, partisan bickering and maneuvers led to nothing passing, and efforts stalled weeks later. Bipartisan negotiations are now underway, but it remains to be seen whether they will reach a compromise.  We rate this statement Mostly True. RELATED: Fact-checking Sen. Tim Scott's GOP response to President Joe Biden",[<zip object at 0x00000280973A0A40>],/factchecks/2021/apr/30/tim-scott/sen-tim-scott-says-democrats-blocked-his-police-re/
"['Corporations', 'State Budget', 'Wisconsin', 'Tony Evers']","
Gov. Tony Evers doesn’t tell whole story with claim that new Foxconn deal saves taxpayers $2.77B
","Gov. Tony Evers has wasted no time touting Wisconsin’s new deal with Foxconn. The Democratic governor negotiated a new deal with the technology giant that would create 1,454 jobs and invest $672 million by 2026. In return, the company will receive a maximum of $80 million in tax subsidies — up to $37 million of which could be paid over the next two years.  The plan dramatically scales back promises of 13,000 jobs and $10 billion in investment negotiated under former Republican Gov. Scott Walker that would have cost the state nearly $3 billion. But the company’s proposed LCD manufacturing facility in Mount Pleasant never came to fruition, and the company now seems to be shifting its focus to create a wider range of products on that campus.  Evers contends the new agreement is a better outcome for Wisconsin.  ""We fixed that agreement and found a better deal with Foxconn that will save Wisconsin taxpayers $2.77 billion while still bringing good, family-supporting jobs to Wisconsin,"" he tweeted on April 21, 2021. We’re going to focus on that number. Does the new Foxconn deal save taxpayers $2.77 billion? When asked for evidence to support the governor’s claim, Evers spokeswoman Britt Cudaback pointed to the difference in tax credits between the new agreement and what Walker negotiated.  The original plan would have provided Foxconn up to $2.85 billion in tax credits compared to $80 million under the new contract. The new deal includes $60.3 million in job and capital investment credits, plus another $19.7 million in performance credits if Foxconn meets and maintains job projections. If you subtract $80 million from $2.85 billion, you get the $2.77 billion Evers cited.  That means when the governor is talking about savings, he’s really referring to how much the state will spend on subsidies.  But how does that fit into the larger picture of taxpayer dollars? It’s first worth noting that Wisconsin has not yet given Foxconn any money.  The Wisconsin Economic Development Corp. decided last year not to award tax credits to the company for work done in 2019 after determining it didn’t hire enough people. State officials expected the company to fall short for several more years and therefore didn’t plan to issue any subsidies during that time. Still, the state had to budget assuming Foxconn would meet its goals and be eligible for the money. For example, Cudaback said the 2019-21 state budget included roughly $211 million in case the company reached its job targets in the 2021 fiscal year.  ""That’s more than $200M that couldn’t be spent on other priorities like schools, healthcare, broadband so Wisconsinites lost out on having that money invested in those areas because it had to be budgeted for Foxconn even if they did not ultimately qualify to receive those credits,"" she said. It’s part of the process for the 2021-23 budget, too. In an April 23, 2021 letter to chairmen of the Joint Finance Committee, Administration Secretary Joel Brennan asked that the spending plan reflect $37.4 million for Foxconn from 2021-23, based on the new deal. Now, back to Evers’ original claim.  It’s clear that Foxconn affected the state’s bottom line because officials had to set aside money for tax credits should the company meet its end of the agreement. But as Cudaback noted, that money theoretically could have been spent on something else if it wasn’t already earmarked — meaning it still could’ve hit taxpayers’ pocketbooks.  The same is true for future savings, though none of that has been budgeted beyond the two-year spending plan in front of the Legislature. ""Because of the renegotiated contract, the $2.77 billion saved — or, on average, nearly $200 million per biennium — can be allocated for other purposes in the state budget rather than being earmarked for a potential Foxconn payoff,"" Cudaback said. Evers’ claim also doesn’t reflect the possibility that Wisconsin may never have paid a dime in subsidies under the previous deal, based on the slow progress and shrinking Foxconn plans. So, in that respect, can one really save money that may never have been spent? That’s part of the issue when Evers and others make such claims about tax incentives. On the other side, if the original deal had been fulfilled — and Foxconn met all of the investment and job goals — the state would have paid more. And if a fully-realized massive LCD facility was the result, the state would have also seen a much bigger boon in jobs and economic development in return for those incentives.  In a tweet, Evers said the new Foxconn deal ""will save Wisconsin taxpayers $2.77 billion."" The agreement does involve $2.77 billion less in state tax credits, which means taxpayers are on the hook for significantly less money. It’s important to note that the state had not paid subsidies to the company under the previous deal and wasn’t on track to do so for several years, so it’s possible much — or even all — of that never would have been paid.  That said, the new contract also frees up funds that officials could funnel elsewhere. There’s no telling how this will affect future budgets, but if the state does choose to reallocate that money and spend it elsewhere, taxpayers won’t enjoy the savings Evers boasted about.  Our definition for Half True is a statement that’s partially accurate but leaves out important details or takes things out of context.  That fits here.",[<zip object at 0x0000028097477080>],/factchecks/2021/apr/30/tony-evers/gov-tony-evers-doesnt-tell-whole-story-claim-new-f/
