tags,sub_header,text_body,sources,quote_href
"['Elections', 'Florida', 'Alex Sink']","
Alex Sink says Pinellas County voted for her to be CFO, governor
","Democrat Alex Sink’s bid for the late C.W. Bill Young’s vacant U.S. House seat hasn’t exactly been helped by the fact that she isn’t a Pinellas native, though she did rent a condo and move there while launching her campaign. Republicans have harped on this point for months, calling Sink a ""carpetbagger."" They ask how could she well represent an area she didn’t grow up in. So it was no surprise that Sink addressed this concern at Monday night’s debate at St. Petersburg College. ""One of the things that sets me apart is that I’ve actually been elected by the people of Pinellas County,"" she said, responding to a moderator’s question about how she differs from Jolly and Libertarian Lucas Overby, both of whom have never ran for elected office before. ""They elected me as their chief financial officer and I served them and their interests. And they actually elected me as governor four years ago."" PolitiFact Florida revisited 2006 and 2010 election results to see if Sink was right that a majority of Pinellas County voters supported her. Sink won her bid for chief financial officer in 2006, beating out Republican Tom Lee with 55.5 percent of the vote in Pinellas and 53.5 percent statewide. That’s different than what happened in 2010, when Sink lost a tight gubernatorial race to Republican Rick Scott. She netted 47.7 percent of the statewide vote, shy of Scott’s 48.9 percent. In Pinellas, though, the story was different. There, Sink came out on top, and by a bigger margin, with 50.7 percent to Scott’s 45 percent. We chose to focus on Pinellas County percentages because that’s what Sink referred to in her claim. But for the March 11 special election, not all Pinellas voters are eligible to weigh in. Florida’s 13th congressional district spans from Fort de Soto Park up to Dunedin, but excludes parts of downtown and southern St. Petersburg. Our ruling Sink claimed that Pinellas County voters supported her in both her 2006 run for chief financial officer and her 2010 bid for governor. On both counts, the election results support her point. We rated her claim True.","[('Florida Department of State Division of Elections, chief financial officer official results, Nov. 7, 2006', 'http://doe.dos.state.fl.us/elections/resultsarchive/DetailRpt.Asp?ELECTIONDATE=11/7/2006&RACE=CFO&PARTY=&DIST=&GRP=&DATAMODE='), ('Florida Department of State Division of Elections, governor official results, Nov. 2, 2010', 'No link'), ('Phone interview with David Bergstein, Democratic Congressional Campaign Committee spokesman, Feb. 4, 2014', 'http://doe.dos.state.fl.us/elections/resultsarchive/DetailRpt.Asp?ELECTIONDATE=11/2/2010&RACE=GOV&PARTY=&DIST=&GRP=&DATAMODE='), ('Tampa Bay Times, ""GOP takes aim at Alex Sink while waiting on Rick Baker,"" Oct. 30, 2013', 'No link')]",/factchecks/2014/feb/05/alex-sink/alex-sink-says-pinellas-county-voted-her-be-cfo-go/
"['National', 'Health Care', 'John Boehner']","
John Boehner says Obamacare is “expected to destroy 2.3 million jobs”
","Ever since President Barack Obama shepherded the Affordable Care Act to enactment, critics have called the health care law a job killer. Now, many of the critics are saying that a new report by the nonpartisan Congressional Budget Office proves their point. The CBO estimated that by 2017, there would be the equivalent of about 2 million fewer workers than there would be in the absence of the law. CBO said that number would grow to about 2.5 million by 2024. Shortly after the report was released on Feb. 4, 2014, House Speaker John Boehner, R-Ohio, joined many Republicans and conservatives in highlighting this finding via social media. Boehner tweeted, ""Pres. Obama’s #hcr law expected to destroy 2.3 million jobs http://on.wsj.com/1kM33oN  via @WSJ."" (Wonk alert: #hcr is shorthand for ""health care reform.) In short order, Democrats and liberal commentators took issue with such characterizations, saying Obama’s critics were misreading the report. A full-fledged war of facts and spin ensued. We have addressed previous CBO projections of this sort and found reasons to be skeptical of interpretations like Boehner’s. The key problem here is that claims by Boehner -- and other critics -- overlook the difference between workers and jobs, and Boehner was misleading when he used the word ""destroyed."" He made it sound as if jobs are going away because businesses don’t create them or because they eliminate existing jobs. The CBO report, though, was referring to workers who decide on their own to leave the workforce. The CBO figured that, when presented with new options for purchasing health insurance outside their job, millions of people would decide they don’t need to work as much. ""Workers who now have access to less expensive health insurance through Medicaid or with refundable federal tax credits that help them pay for premiums will not want to work such long hours after the ACA becomes fully implemented,"" said Gary Burtless, an economist at the Brookings Institution. The CBO estimated that Obamacare would ""reduce the total number of hours worked, on net, by about 1.5 percent to 2.0 percent during the period from 2017 to 2024, almost entirely because workers will choose to supply less labor — given the new taxes and other incentives they will face and the financial benefits some will receive."" This would equal a ""decline in the number of full-time-equivalent workers of about 2.0 million in 2017, rising to about 2.5 million in 2024,"" the report continued. These changes, CBO said, would not result in ""an increase in unemployment (that is, more workers seeking but not finding jobs) or underemployment (such as part-time workers who would prefer to work more hours per week)."" To be clear, the report predicts that total employment will still rise. It just won’t rise as much as it would if the ACA did not exist. Another key point: The CBO did not specify how many of the 2 million figure would include full-time positions, as compared to cases of an employee keeping their job but working fewer hours, or keeping one job while quitting a separate, part-time job. In some ways, a drop in the number of people who feel the need to work actually could be a boon to the unemployed. As we’ve noted, there are about three job seekers for every job vacancy in today’s economy -- a high ratio by historical standards. Some of these people could pick up the slack once vacancies open up -- and they should be able to, since CBO said it didn’t expect a major change in companies’ demand for workers. In essence, you’d be trading workers unhappy to be working for those who are desperate to be working. ""Unemployed workers who really need to find jobs to support their families, rather than to obtain health coverage, will find it easier to get jobs,"" Burtless said. ""After all, they will not face as much competition from the workers who were mainly remaining in the labor force to get a job with health coverage."" We see a few problems with Boehner’s phrasing  -- that the law is ""expected to destroy 2.3 million jobs."" (We have no quarrel with the 2.3 million figure; it’s the mid-point between 2.0 million and 2.5 million.) The first problem is the word ""destroy."" It’s inaccurate because it suggests that CBO says employers will be making 2.3 million layoffs. That's not correct -- the reduction will come primarily from voluntary choices by workers, not by by employers, the CBO said. The second problem is the word ""jobs."" Using that word glosses over the fact that CBO didn’t cite a number of jobs that will be reduced; it referred to full-time-equivalents of jobs. That may sound like a technical distinction, but it’s important. These job equivalents will be made of a lot of bits and pieces of hours per week that people will choose to drop. Many of these people might be working two or three jobs, in excess of 40 hours a week, and will choose to cut back to a more reasonable one or two jobs. All this said, it’s also worth pointing out a few less positive conclusions of the CBO report. As more people choose to work less, the labor force participation rate should decline, putting a larger burden for supporting the social safety net on those who remain working. Any change in labor force participation comes on top of an already major shift toward retirement driven by the aging of the baby boom. Also, some commentators have expressed concern about having people work less because taxpayer-subsidized insurance is available. Ultimately, it boils down to a tradeoff, said Tara Sinclair, a George Washington University economist. ""Admittedly there are some touchy issues with the government potentially paying or subsidizing the health care costs for people who could work but choose not to,"" Sinclair said. ""But overall I think separating health care from employment, at least making it like any other service where employment may provide the money to pay for it but where we work doesn't determine our choices, is a good thing."" Sinclair said Boehner has a reasonable point in terms of the larger economic impact of these changes, but adds that he’s largely wrong in how he framed the labor-market question. ""In a macroeconomic sense, this still means fewer people working, even if that is their choice,"" she said. On the other hand, she added, ""it also probably means relatively higher wages and better bargaining power for those who are looking for a job. This is very different than the short-run effects of employers cutting positions, where we would see unemployment rates go up, less bargaining power for workers, and potentially relatively lower wages. So, the description of the source of the cut -- whether it’s from supply or demand -- does matter, but not for the count of ‘jobs.’ "" When we checked with Boehner’s office, spokesman Brendan Buck reiterated that the CBO report shows that ""there will be that many fewer people working – that many fewer people in jobs. Whether a result of a change in supply or demand for labor, that’s still bad for the economy. If there’s an error, it’s for tweeting in English instead of ‘economist.’"" Our ruling In his tweet, Boehner said that Obama’s health care law is ""expected to destroy 2.3 million jobs."" Boehner’s use of the word ""destroy"" mischaracterizes what is going on, since the reduction will come from voluntary actions by workers, rather than layoffs by employers. The law would not push up unemployment. In fact, some people at the low end of the wage ladder would find it easier to find work as a result of the predicted shifts in the workforce. In addition, it’s misleading to refer to 2.3 million ""jobs,"" since CBO combined all incremental losses of hours worked into full-time-job equivalents. Under this scenario, we would expect many more than 2.3 million people to be affected, but many of them would cut their hours a few at a time, rather than quitting their jobs entirely. It can be easy to miss the distinction between jobs and workers -- and the CBO report is not all rosy for the nation’s economic future. But Boehner’s statement remains flawed. We rate the claim Mostly False.","[('John Boehner, tweet, Feb. 4, 2014', 'https://twitter.com/johnboehner/status/430803187948204032'), ('Congressional Budget Office, The budget and economic outlook: 2014 to 2024, Feb. 4, 2014', 'No link'), ('Washington Post, No, the CBO did not say Obamacare will kill 2 million jobs, Feb. 4, 2014', 'https://www.politifact.com/truth-o-meter/documents/obamcare-cbo-budget-economic-outlook-february-2014/'), (""Forbes, White House: It's A Good Thing That Obamacare Will Drive 2.5 Million Americans Out Of The Workforce, Feb. 5, 2014"", 'No link'), ('Washington Post, Yes, Obamacare will probably downsize the workforce. Economists explain why, Feb. 5, 2014', 'https://www.washingtonpost.com/blogs/fact-checker/wp/2014/02/04/no-cbo-did-not-say-obamacare-will-kill-2-million-jobs/'), ('Wall Street Journal, ""Health Law To Cut Into Labor Force,"" Feb. 5, 2014', 'No link'), ('Dave Weigel, ""Who Blew the CBO \'2 Million Jobs\' Story?"" (in Slate.com), Feb. 5, 2014', 'https://www.forbes.com/sites/theapothecary/2014/02/05/white-house-its-a-good-thing-that-obamacare-will-drive-2-5-million-americans-out-of-the-workforce/'), ('PolitiFact, Michele Bachmann says Obamacare will kill 800,000 jobs, June 14, 2011', 'No link'), ('PolitiFact, ""There are 3 unemployed people for every job opening, Obama adviser says"" Jan. 7, 2014', 'https://www.washingtonpost.com/blogs/wonkblog/wp/2014/02/05/yes-obamacare-will-probably-downsize-the-workforce-economists-explain-why/'), ('Email interview with Gary Burtless, economist at the Brookings Institution, Feb. 4, 2014', 'No link'), ('Email interview with Jeffrey Clemens, economist at University of California-San Diego, Feb. 4, 2014', 'https://online.wsj.com/news/articles/SB10001424052702304626804579362691500388668?mg=reno64-wsj&url=http://online.wsj.com/article/SB10001424052702304626804579362691500388668.html'), ('Email interview with Alan Auerbach, economist at University of California-Berkeley, Feb. 4, 2014', 'No link'), ('Email interview with Tara Sinclair, economist at George Washington University, Feb. 5, 2014', 'http://www.slate.com/blogs/weigel/2014/02/05/who_blew_the_cbo_2_million_jobs_story.html')]",/factchecks/2014/feb/05/john-boehner/john-boehner-says-obamacare-expected-destroy-23-mi/
"['Economy', 'Health Care', 'Jobs', 'PunditFact', 'Gretchen Carlson']","
Carlson: CBO says Obamacare will cut full-time jobs by 2.3 million
","Ever since the Affordable Care Act passed, Republicans and conservative talk show hosts labeled it as a job killer and in their view, the latest economic report proves their point. The Congressional Budget Office, the nonpartisan number crunchers for Congress, estimated that 10 years from now, there would be about 2.5 million fewer workers than there otherwise would be. How was that conveyed by the pundits? ""The CBO now says the president's health care law will cut the number of full-time jobs in the United States by 2.3 million by 2021,"" said Gretchen Carlson of Fox News. In the interview that followed, interrupted by a live briefing on the report from the White House, Carlson noted that much of the change stems from people deciding not to work. Carlson then went onto interview U.S. Rep. Jason Chaffetz, R-Utah, where they discussed workers who have a difficult time finding full-time work. But Carlson’s statement is missing an important distinction that the CBO report makes between workers and jobs. (And it’s a mistake we’ve spotted before.) Carlson makes it sound as if jobs are going away because businesses don’t create them or they eliminate existing jobs. The CBO report, though, was referring to workers who decide on their own to leave the workforce. Here are the key quotes from the report: ""CBO’s projections of hours worked represent a decline in the number of full-time-equivalent workers of about 2.0 million in 2017, rising to about 2.5 million in 2024."" ""The estimated reduction stems almost entirely from a net decline in the amount of labor that workers choose to supply, rather than from a net drop in businesses’ demand for labor."" The government analysts basically figured that millions of people will decide they don’t need to work as much because the law makes health insurance more affordable. ""It will not represent an increase in either the unemployment rate or the number of unemployed workers,"" said Gary Burtless, an economist at the Brookings Institution, a Washington-based academic research center. ""Workers who now have access to less expensive health insurance through Medicaid or with refundable federal tax credits that help them pay for premiums will not want to work such long hours after the ACA becomes fully implemented."" For economist Jeffrey Clemens at the University of California - San Diego, this result is no surprise. The law gives most of its assistance to people making less money. ""Subsidizing insurance for low-income households, and providing Medicaid to the poor, involves reducing the returns to work. As earned income rises, the benefits phase out,"" Clemens said. The CBO report tracks with that, noting that the voluntary decisions to leave the workforce would be concentrated among lower-paid jobs. Another key point: The CBO did not specify how many of the 2 million figure would include actual full-time positions, as compared to cases of an employee keeping a job but working fewer hours, keeping one job but quitting a separate, part-time job, or leaving the workforce. And to be clear, the report predicts that total employment will rise. It just won’t rise as much as it would if the health care law did not exist. A drop in the number of people who feel they need to work actually could even be a boon to those who remain in the labor force, especially with relatively high unemployment. ""Unemployed workers who really need to find jobs to support their families, rather than to obtain health coverage, will find it easier to get jobs,"" said Burtless. ""After all, they will not face as much competition from the workers who were mainly remaining in the labor force to get a job with health coverage."" Still, the CBO expects the current unemployment rate to remain elevated; it won’t drop below 6 percent until 2017. This is not to say there are no downsides woven into the CBO projections. The labor force participation rate is expected to decline, putting a larger burden on those who remain working. ""Bigger implicit and explicit tax distortions are reducing productive economic activity,"" said Alan Auerbach, an economist at the University of California - Berkeley. As the economy returns to full employment, Burtless expects that there would be a shortage of low-wage workers. ""The remaining taxpayers will have to pay slightly higher taxes to finance public health insurance subsidies than they would otherwise have to pay if the work hours of low-wage workers remained unchanged,"" Burtless said. Ultimately, it boils down to a tradeoff, said Tara Sinclair, a George Washington University economist. ""Admittedly there are some touchy issues with the government potentially paying or subsidizing the health care costs for people who could work but choose not to,"" Sinclair said. ""But overall I think separating health care from employment, at least making it like any other service where employment may provide the money to pay for it but where we work doesn't determine our choices, is a good thing."" Our ruling Carlson said that the CBO predicts that Obamacare will cut the number of full-time jobs by 2.3 million. The word ""cut"" sends the message that jobs are being taken away, but that's not the case. On top of that, the statement confuses the number of jobs with the number of workers, and more specifically, the number of hours worked. The CBO said the health care law will give more people an incentive to reduce their hours; some will limit their hours and some will stop working altogether by their own choice. The law would not push up unemployment. It can be easy to miss the distinction between jobs and workers, but the statement remains flawed. We rate the claim Mostly False.","[('Fox News, The Real Story, Feb. 4, 2014', 'http://www.foxnews.com/on-air/the-real-story-with-gretchen-carlson/index.html#/v/3152206222001'), ('Congressional Budget Office, The budget and economic outlook: 2014 to 2024, Feb. 4, 2014', 'No link'), ('Washington Post, No, the CBO did not say Obamacare will kill 2 million jobs, Feb. 4, 2014', 'https://www.politifact.com/truth-o-meter/documents/obamcare-cbo-budget-economic-outlook-february-2014/'), ('PolitiFact, Michele Bachmann says Obamacare will kill 800,000 jobs, June 14, 2011', 'No link'), (""Forbes, White House: It's A Good Thing That Obamacare Will Drive 2.5 Million Americans Out Of The Workforce, Feb. 5, 2014"", 'https://www.washingtonpost.com/blogs/fact-checker/wp/2014/02/04/no-cbo-did-not-say-obamacare-will-kill-2-million-jobs/'), ('Washington Post, Yes, Obamacare will probably downsize the workforce. Economists explain why, Feb. 5, 2014', 'No link'), ('Email interview, Gary Burtless, economist, Brookings Institution, Feb. 4, 2014', 'https://www.politifact.com/truth-o-meter/statements/2011/jun/14/michele-bachmann/michele-bachmann-says-obamacare-will-kill-800000-j/'), ('Email interview, Jeffrey Clemens, economist, University of California - San Diego, Feb. 4, 2014', 'No link'), ('Email interview, Alan Auerbach, economist, University of California - Berkeley, Feb. 4, 2014', 'https://www.forbes.com/sites/theapothecary/2014/02/05/white-house-its-a-good-thing-that-obamacare-will-drive-2-5-million-americans-out-of-the-workforce/'), ('Email interview, Tara Sinclair, economist, George Washington University, Feb. 5, 2014', 'No link'), ('\xa0', 'https://www.washingtonpost.com/blogs/wonkblog/wp/2014/02/05/yes-obamacare-will-probably-downsize-the-workforce-economists-explain-why/')]",/factchecks/2014/feb/05/gretchen-carlson/carlson-cbo-says-obamcare-will-cut-full-time-jobs-/
