tags,sub_header,text_body,sources,quote_href
"['National', 'Candidate Biography', 'Donald Trump']","
Donald Trump: Clinton's celebrity backers 'aren't very hot anymore'
","Donald Trump mocked the size of Hillary Clinton’s crowds and the depth of her support at a packed rally in Tampa. Then he turned on Clinton’s celebrity supporters. ""The only people enthusiastic about her campaign are Hollywood celebrities, in many cases celebrities that aren’t very hot anymore,"" he said. We were interested in his line that Clinton’s celebrity backers are ""in many cases celebrities that aren’t very hot anymore."" Believe it or not, there actually is data that addresses this question. Ever the dutiful fact-checkers, we dug in. (For the record, the Trump campaign did not respond to our requests for evidence, and though the Clinton campaign did respond, it did not address our particular question.) Clinton celebs still sizzling Clinton has received endorsements from at least 900 celebrities. With that volume, some ""aren’t very hot anymore"" (consider Laguna Beach’s Lo Bosworth and MC Hammer). But Hollywood royalty is largely on Clinton’s side. Trump specified ""Hollywood celebrities,"" so we won’t count Clinton supporters like radio host Howard Stern or President Barack Obama. And because Trump focused on ""enthusiastic"" supporters, we’ll also limit our investigation to Hollywood celebrities who have campaigned or raised money for Clinton. With those parameters, we identified about 100 hardcore Tinseltown Clinton fans. The roster includes singers Beyoncé, Justin Timberlake, Lady Gaga, Alicia Keys, Katy Perry and Demi Lovato (the last three of whom performed at the Democratic National Convention); and Oscar winners Meryl Streep, Matt Damon, Ben Affleck and Leonardo DiCaprio, plus George Clooney (who once defended a fundraiser he held for Clinton with this Half True claim) and Bradley Cooper (whose appearance at the DNC upset some American Sniper fans). Other celebrity supporters include Kanye West and wife Kim Kardashian (who got her selfie with Clinton in 2015), Heidi Klum, Magic Johnson and Elton John (who headlined a New York City concert for the Hillary Victory Fund and isn’t too keen on Tiny Dancer being played at Trump rallies). And as we said, you can actually gauge how hot these celebrities are.     We consulted E-Poll Market Research, which collects data on almost 9,000 celebrities and measures whether people know and like them. The marketing firm had an E-Score for all but one person on the list (Orange is the New Black’s Dascha Polanco). Altogether, the 100 most enthusiastic Clinton celebrities averaged an E-Score of 86 out of 100. Two-thirds of the list scored above 90, with seven netting a perfect 100. (Because E-Score reflects both awareness and likeability, Kanye West scored a low 15 due to low appeal.) Katy Perry, a Clinton donor and campaign trail performer, tops Forbes’ list of celebrities with the most Twitter followers (92.1 million). A dozen other Clinton supporters also are on the list. Forbes also counts Perry and six other Clinton backers among the highest-paid celebrities of 2016. Ten Clinton celebs made it onto Vulture’s Most Valuable Movie Stars of 2015. And finally, half of People’s Top 25 Celebrity Hot List, as of Aug. 25, 2016, is backing Clinton. For a more qualitative take on Trump’s claim, we turned to Hollywood blogger Perez Hilton. ""He’s dead wrong!"" Hilton told PolitiFact. ""Katy Perry is one of the biggest and highest-earning pop stars on the planet. Justin Timberlake just hosted a fundraiser for (Clinton). Meryl Streep and Barbra Streisand are legends. Trump himself is the one with D- and Z-list celeb support!"" (Full disclosure: Hilton supports Clinton and has been photographed wearing a Hillary Clinton onesie.) Not many of the 100 total celebrity Trump endorsers have also appeared with him on the campaign trail (notable exceptions include former Indiana University basketball coach Bob Knight and several NASCAR drivers). Just one, Beth Chapman of A&E’s Dog the Bounty Hunter, gave to his campaign, according to our search. E-Poll Market Research did not have an E-Score on file for 13 of about 60 of Trump’s most prominent defenders. Randy Parker, a spokesman for the company, told us the Republican nominee’s list includes ""some more obscure folk."" ""The fact that so many of (Trump’s) people aren’t even in our database shows that his people are really the ones who are not hot,"" Parker said. The Trump celebrities with E-Scores averaged a 64, with Walker, Texas Ranger star Chuck Norris leading the pack with a score of 99. Other high-scoring Trump celebrities include actors Lou Ferrigno (97), Randy Quaid (96), and Paul Sorvino (94). Of the Republican National Convention speakers, Scott Baio of Happy Days clocked a 91, while Duck Dynasty star Willie Robertson scored a 78 and soap star and underwear model Antonio Sabato Jr. came in at 71. No enthusiastic Trump Hollywood celebrity appeared on the lists from People, Forbes or Vulture, though Trump supporter Caitlyn Jenner was named Just Jared’s Most Popular celebrity of 2015. Our ruling Trump said the Hollywood celebrities endorsing Hillary Clinton are ""in many cases celebrities that aren’t very hot anymore."" Trump has a point that out of hundreds of celebrities endorsing Clinton, some have faded. But the data doesn’t lie. Many prolific Clinton-backing stars remain popular according to several metrics: social media influence, earning potential, and popularity on celebrity news blogs and websites. Supporters like Katy Perry, Justin Timberlake, Meryl Streep and George Clooney are arguably the most visible and enthusiastic. Trump’s statement contains some element of truth but ignores critical facts that would give a different impression. We rate it Mostly False. https://www.sharethefacts.co/share/57cb5021-de28-46f5-840e-64751fb508fe",[<zip object at 0x0000028096E5B600>],/factchecks/2016/aug/25/donald-trump/donald-trump-clintons-celebrity-backers-arent-very/
"['Facebook Fact-checks', 'Facebook posts']","
No, John Velazquez didn’t call Joe Biden a horse’s ass
","On May 1, Hall of Fame jockey John Velazquez rode a dark bay colt named Medina Spirit to victory in the Kentucky Derby, the first of three Triple Crown races.  The following day, a statement attributed to Velazquez started to spread widely on social media.  ""BREAKING NEWS,"" one post said. ""Derby winner Medina Spirit’s jockey John Velazquez turned down a White House invite today saying ‘if I wanted to see a horse’s ass I would of came in second.’"" Some people commenting on the post applauded Velazquez for the comment, while another took issue with the jockey insulting President Joe Biden.  But the quote is fake, and this post was flagged as part of Facebook’s efforts to combat false news and misinformation on its News Feed. (Read more about our partnership with Facebook.) We reached out to Ron Anderson, an agent who represents Velazquez. He told us that Velazquez hasn’t been invited to the White House and didn’t make the statement that’s being attributed to him on social media. ""He wouldn’t say something like that in a million zillion years,"" Anderson said.  Searching online, we didn’t find any evidence to the contrary.  We rate this post Pants on Fire!",[<zip object at 0x000002809710C100>],/factchecks/2021/may/03/facebook-posts/no-john-velazquez-didnt-call-joe-biden-horses-ass/
"['China', 'Debates', 'Elections', 'California', 'Facebook posts']","
No, Kamala Harris Did Not Tell Joe Biden He’d Do ‘Whatever’ China Wants
","An image making rounds on Facebook, Twitter and other social media platforms claims Vice President Kamala Harris said during a 2019 Democratic debate that President Joe Biden would do ""whatever"" the Chinese government wants because they gave his son ""over a billion dollars.""  The image featured cropped and merged photos of Harris, who was a senator from California at the time, and Biden at the June 27, 2019, Democratic debate, which was held in Miami, Florida, and sponsored by NBC, MSNBC and Telemundo.  The way the images are cropped and combined depicts Harris and Biden standing face-to-face, by deleting U.S. Sen. Bernie Sanders, an Independent from Vermont, who was standing at his lectern between Biden and Harris at the debate.  Text above the photos reads, ""Anyone remember Kamala telling Joe during the debate: ‘You will do whatever the Chinese tell you! They gave your son over a billion dollars.’"" There’s just one problem with the quote: According to transcripts of the Democratic debates, Harris never said it. We decided to look at the false claim and where it came from. Facebook flagged this image as part of its efforts to combat false news and misinformation on its News Feed. (Read more about PolitiFact California’s partnership with Facebook.) One Facebook user’s post featuring the image had been shared more than 400 times as of April 30. Another was shared 183,000 times. The image racked up more than 3.3 million views within 24 hours. The claim and the transcripts The image’s claim references allegations that swirled around Biden and his son, Hunter Biden, in the time leading up to the 2020 election. Hunter Biden had an investment deal that involved the Bank of China while his father was serving as vice president, which former President Donald Trump and other Republicans touted as an example of improper ethics and corruption. Trump repeatedly stated that the business deal made the Bidens more than $1 billion. The business deal remains murky because of minimal disclosure requirements for international investments, and nobody has been able to independently verify how much Hunter Biden made off the deal.  In a previous fact check, PolitiFact found no evidence that either Joe Biden or Hunter Biden broke any laws, although experts in political ethics said the deal was unwise and put Joe Biden in an awkward position. Additionally, experts noted that relatives of high-ranking American public officials of both parties have routinely been courted by Chinese businesses. During the first five Democratic debates, Harris never discussed any of the controversy surrounding the Bidens. Harris suspended her presidential campaign on Dec. 3, 2019, so she was not present for the six remaining Democratic debates. Her only significant comment on China came during the Sept. 12, 2019, debate in Houston, Texas, when she was asked how her trade policy would differ from former President Barack Obama by moderator George Stephanopoulos of ABC. ""It's a complicated relationship,"" Harris said. ""We have to hold China accountable. They steal our products, including our intellectual property. They dump substandard products into our economy. They need to be held accountable."" She added that the United States should also seek to partner with China ""on climate and the crisis that presents"" and ""on the issue of North Korea."" Harris did occasionally spar with Biden on stage, most notably in the first Democratic debate on June 27, 2019, when she said she ""wanted to speak on the issue of race"" and criticized Biden for his ""hurtful"" comments surrounding prominent segregationists and his opposition to busing. When Brown v. Board of Education was decided in the U.S. Supreme Court, the Berkeley Unified School District in Berkeley, California, implemented a busing program to integrate schools. Harris was part of the cohort that began kindergarten in the district during the second year of the program. Harris drew praise for her ""breakout"" moment on stage during the debate, but her comments to Biden were entirely based around race and the history of segregation, not China or Hunter Biden. We could find no evidence that Harris made any such statements elsewhere on the campaign trail. Her office declined to comment on the claim. Additionally, no other candidate made similar statements attacking Biden over allegations surrounding his son and China during any of the Democratic debates. Former President Donald Trump did attack Biden over China during two presidential debates. Our research A search of the false quote turns up results dating back to January 2021. The earliest evidence of the quote on Facebook was posted on Jan. 24 and appears to have come from a page run by a group called Activated Patriots. The group protects ""freedom, God and guns"" and is based in Wisconsin, according to their website.  The Activated Patriots post included the false quote, but in the post’s text, rather than in an image. It also included additional statements mischaracterizing several of Harris’s comments during the Democratic debates and on the campaign trail during and after her presidential bid. On April 29, the post was deleted from the Activated Patriots page. It had been shared more than 450 times. The false quote appears to have originated on Twitter on Jan. 23, less than 24 hours before the Activated Patriots post on Facebook, when @BlessUSA2024 tweeted it out.  The pro-Trump account was created in September 2019 and has more than 26,000 followers as of April 30. It has previously shared misinformation related to QAnon, a baseless conspiracy theory that claims there is a deep state run by political elites, business leaders and celebrities that engages in pedophilia and works against former President Donald Trump and his allies.  The tweet had received 700 likes as of April 30 and was retweeted more than 600 times. PolitiFact reached out to Activated Patriots and the @BlessUSA2024 account for comment, but received no response. Our ruling Social media posts claimed that Vice President Kamala Harris told President Joe Biden during the Democratic debates, ""You will do whatever the Chinese tell you! They gave your son over a billion dollars."" Transcripts of the debates show that this is wholly incorrect.  Harris never made such a statement and rarely touched on China during the debates. When she did, she did not reference the murky allegations surrounding Biden’s son and his business dealings with Chinese companies. Harris made no such statements elsewhere on the campaign trail and none of Biden’s other competitors made similar comments.  Furthermore, the quote has not been substantiated by any reputable news organization and appears to have originated on social media from pro-Trump accounts. Therefore, we rate this claim Pants on Fire. PANTS ON FIRE – The statement is not accurate and makes a ridiculous claim.",[<zip object at 0x000002809710C480>],/factchecks/2021/apr/30/facebook-posts/no-kamala-harris-did-not-tell-joe-biden-hed-do-wha/
"['Federal Budget', 'Infrastructure', 'Transportation', 'Iowa', 'Randy Feenstra']","
Congressman, carrying GOP complaint, leaves a lot out of infrastructure definition
","Rep. Randy Feenstra, R-Iowa, was among several members of Congress to respond to President Biden’s first address to Congress the night of Wednesday, April 28. We’ve seen the claim before, as it is a major talking point from Republicans concerned about the price tag on Biden’s proposed $6 trillion stimulus combination of  The American Jobs Plan, American Rescue Plan, and American Families Plan. Sen. Tim Scott, R-South Carolina, made the claim in the Wednesday night GOP rebuttal to Biden’s speech, although Scott also said, ""Republicans support everything you think of when you think of ‘infrastructure’ Roads, bridges, ports, airports, waterways, high-speed broadband — we’re all in.""  PolitiFact reported previously that elements of infrastructure Scott listed would take up about 26% of Biden’s proposed spending in the proposed American Jobs Plan. Some lawmakers, such as Rep. Liz Cheney, R-Wyo., said only 6% of the jobs plan was for infrastructure of any type, which we rated Pants on Fire.  Citing the Committee for a Responsible Federal Budget, we’ve pointed out that transportation upgrades to rail, air and water travel, for example, would get $207 billion. Protecting land and water resources and upgrading drinking water supplies would get $161 billion, while power infrastructure and high-speed internet would get $100 billion apiece. Roads, bridges and highways would get $115 billion, for a grand total of $683 billion for infrastructure projects, based on what the Committee for a Responsible Budget estimates will be a $2.65 trillion cost if the plan gains congressional approval. That’s different from other reported figures or the plan and what Feenstra tweeted. At this point, the actual cost would not be determined until the legislation is negotiated, debated and adopted. Feenstra notes three Biden stimulus plans in his tweet and ties them to his complaint about infrastructure’s share. But, while the $1.8 trillion American Rescue Plan’s stated purpose is to ""change the course of the pandemic and deliver immediate and direct relief to families and workers impacted by the COVID-19 crisis through no fault of their own,"" the program’s fact sheet says.  But, that law, passed in March, includes $10 billion for local improvements to infrastructure to go along with direct payments to individuals, increased child tax credits, funds to local governments for COVID-19 vaccinations, support for small businesses, employed retention and paid leave credits and homeowner assistance. The proposed American Families Plan does not have an infrastructure component. It would authorize spending for universal pre-school, direct payments and tax breaks for families with children or in low-income brackets, summer and school meal programs for low-income families, free community college and selected studies in college for up to four years. It also calls for increasing the income tax rate for those making more than $400,000 in a year.  We asked Feenstra’s Washington, D.C., office in emails about the infrastructure spending beyond roads and bridges and also called his office but did not receive a response to the questions. Feenstra, as well as Scott and other Republicans for that matter, are correct about the share of the American Jobs Plan spending on just roads and bridges in Biden’s plans. But, focusing only on those two items paints a skewed picture of how much money from the president’s plan is tabbed for infrastructure as key Republican leaders define it. Feenstra didn’t give a full picture in his tweet. We rate the claim to be Half True.",[<zip object at 0x00000280972EC100>],/factchecks/2021/apr/30/randy-feenstra/congressman-carrying-gop-complaint-leaves-lot-out-/
"['China', 'Debates', 'Facebook Fact-checks', 'Facebook posts']","
No, Kamala Harris didn’t attack Joe Biden on China during a primary debate
","More than a year before Joe Biden selected Kamala Harris to be his running mate, the future president and vice president sparred on the debate stage in Miami. In a tense exchange, Harris attacked Biden over his record on busing to desegregate schools in the 1970s. ""There was a little girl in California who was part of the second class to integrate her public schools, and she was bused to school every day,"" she said. ""And that little girl was me."" Now, months into Biden’s term as president with Harris by his side, social media users have recast the exchange as a confrontation over Biden’s relationship with China. ""Anyone remember Kamala telling Joe during the debate: ‘You will do whatever the Chinese tell you! They gave your son over a billion dollars,’"" says an April 24 Facebook post. The post shows images of both Harris and Biden from the June 27, 2019, primary debate in Miami. The post was flagged as part of Facebook’s efforts to combat false news and misinformation on its News Feed. (Read more about our partnership with Facebook.)   A screenshot of an April 24 Facebook post falsely claiming Kamala Harris attacked Joe Biden on China during a debate. The image in the Facebook post shows the moment during the Miami debate when Harris went after Biden for his position on busing. But Harris never challenged him about China or said what the post alleges — not during the Miami debate or any other debate, the transcripts show. Harris called off her campaign for president on Dec. 3, 2019. Before that, she participated in five Democratic primary debates, including the first in Miami. But transcripts of each debate from the Washington Post do not show Harris attacking Biden about China. Harris did mention China during a September debate in Houston, but the comment did not pertain to Biden or Biden’s son, Hunter Biden. ""It's a complicated relationship,"" Harris said. ""We have to hold China accountable. They steal our products, including our intellectual property. They dump substandard products into our economy. They need to be held accountable. We also need to partner with China on climate and the crisis that presents. We need to partner with China on the issue of North Korea."" Fact-checkers at Snopes, the Associated Press, Lead Stories and USA Today also found no evidence that Harris attacked Biden as the Facebook post claimed. Hunter Biden became a target of attacks from former President Donald Trump and his allies as Trump and Biden squared off on the campaign trail. Trump’s efforts to pressure Ukraine to announce investigations into the Bidens led to the first of his two impeachments. In December, Hunter Biden confirmed his finances were the subject of a Justice Department probe. He has been involved in business dealings involving Chinese companies. But claims alleging wrongdoing by the elder Biden have generally remained unsubstantiated. A Facebook post said, ""Anyone Remember Kamala telling Joe during the Debate: ‘You will do whatever the Chinese tell you! They gave your son over a billion dollars.’"" Harris never said that during the Miami primary debate highlighted by the Facebook post, or in any of the other four primary debates she participated in, transcripts show. We rate this Facebook post Pants on Fire! RELATED: Harris did not call Biden a racist during her busing attack",[<zip object at 0x0000028097338F80>],/factchecks/2021/apr/30/facebook-posts/no-kamala-harris-didnt-attack-joe-biden-china-duri/
