tags,sub_header,text_body,sources,quote_href
"['National', 'Federal Budget', 'Health Care', 'Medicare', 'Retirement', 'Stephanie Cutter']","
Ryan's plan includes $700 billion in Medicare ""cuts,"" says Stephanie Cutter
","
Mitt Romney’s pick of U.S. Rep. Paul Ryan as his running mate has rekindled a heated debate over Medicare.

Ryan, R-Wis., is the head of the Budget Committee in the U.S. House of Representatives and the architect of a plan to dramatically restructure Medicare.

Today, Medicare operates as a government-run health insurance plan for Americans over age 65.

Ryan’s idea is to eventually move Medicare toward private insurance companies by giving people a set amount to buy their own health insurance plans. The new system would be for people who are under age 55 now, and it would give them voucher-like credits to buy traditional fee-for-service Medicare or competing private insurance plans. (The credits are sometimes called ""premium support."")

Though House Republicans voted overwhelmingly for Ryan’s plan, polling shows public opinion is mixed, with older voters the most wary of the plan.

The Republican response to attacks on the Ryan plan has been to attack back, saying President Barack Obama has cut ""$700 billion"" out of Medicare. And the Democratic response to that: Well, Paul Ryan cuts that amount, too!

For this check, we’re looking specifically at what Obama campaign spokeswoman Stephanie Cutter said on Face the Nation when debating Romney spokesman Eric Fehrnstrom.

""You know, I heard Mitt Romney deride the $700 billion cuts in Medicare that the president achieved through health care reform,"" Cutter said. ""You know what those cuts are? It’s taking subsidies away from insurance companies, taking rebates away from prescription drug company. Is that what Mitt Romney wants to protect? And interestingly enough Paul Ryan protected those cuts in his budget."" 
It’s a lot to digest if you’re not already a Medicare policy wonk, so let us sort it out for you. For now, we are going to put aside the question of whether it is accurate to call them ""cuts"" -- a claim we're checking in another item -- and focus on the question of whether Cutter is correct that Ryan relies on those same reductions in his budget.

$700 billion in Medicare cuts?

Because we’re wonks ourselves at PolitiFact, our ears pricked up at the claim in recent days that Obama cut $700 billion out of Medicare. Just a few weeks ago, the oft-cited number was $500 billion. How did he manage to cut another $200 billion when no one was looking?

Well, there are cuts and then there are CUTS. Neither Obama nor his health care law literally ""cut"" a dollar from the Medicare program’s budget.

Rather, the health care law instituted a number of changes to reduce the growth of Medicare costs. At the time the law was passed, those reductions amounted to $500 billion over the next 10 years.

What kind of spending reductions are we talking about? They were mainly aimed at insurance companies and hospitals, not beneficiaries. The law makes significant reductions to Medicare Advantage, a subset of Medicare plans run by private insurers. Medicare Advantage was started under President George W. Bush, and the idea was that competition among the private insurers would reduce costs. But in recent years the plans have actually cost more than traditional Medicare. So the health care law scales back the payments to private insurers.

Hospitals, too, will be paid less if they have too many re-admissions, or if they fail to meet other new benchmarks for patient care.

Still, the overall Medicare budget is projected to go up for the foreseeable future. The health care law tries to limit that growth, making it less than it would have been without the law, but not reducing its overall budget. So claims that Obama would ""cut"" Medicare need more explanation to be fully accurate. In the past, we’ve rated similar statements Half True or Mostly False, depending on the wording and context.

Because Medicare spending gets bigger every year, the cost-saving mechanisms in the health care law also get bigger. Also, it takes a few years for the health care law’s savings mechanisms to kick in. In fact, the effects of time are the main reason the $500 billion number has turned into $700 billion.

The CBO determined in 2011 that the federal health care law would reduce Medicare outlays by $507 billion between 2012 and 2021. In a more recent estimate released this year, the CBO looked at the years 2013 to 2022 and determined the health care law affected Medicare outlays by $716 billion.

So it’s timing that’s making the ""cuts"" bigger, not changes to Medicare.

 Does the Ryan budget ‘protect those cuts’?

Now onto our second question: Does Ryan’s budget keep the reductions in Medicare spending? The short answer is yes.

Here’s what Ryan said in an interview with George Stephanopolous of ABC News in June, before his selection as Romney’s running mate:

Stephanopoulos: ""You know, several independent fact-checkers have taken a look at that claim, the $500 billion in Medicare cuts, and said that it's misleading. And in fact, by that accounting, your budget, your own budget, which Gov. Romney has endorsed, would also have $500 billion in Medicare cuts.

Ryan: ""Well, our budget keeps that money for Medicare to extend its solvency. What Obamacare does is it takes that money from Medicare to spend on Obamacare. ..."" (Read the full exchange.)

So Ryan has confirmed his budget includes the Medicare savings.

The Romney campaign got questions on this point the day after Cutter’s remarks, and issued a statement saying that Romney intended to fully repeal the federal law, including the savings for Medicare.

""Mitt Romney and Paul Ryan have always been fully committed to repealing Obamacare, ending President Obama’s $716 billion raid on Medicare, and tackling the serious fiscal challenges our country faces,"" said Lanhee Chen, Romney’s policy director, in a statement reported by NBC News. ""A Romney-Ryan administration will restore the funding to Medicare, ensure that no changes are made to the program for those 55 or older, and implement the reforms that they have proposed to strengthen it for future generations.""

Cutter, though, was talking about the Ryan budget. We should point out that the Ryan budget is a congressional resolution that doesn’t have the force of law. And its plan for Medicare hasn’t been turned into legislation that could be analyzed in detail by the Congressional Budget Office.

Still, Ryan himself said his plan did include the reductions in future spending that were part of the federal health care law.

That’s because both sides agree on one point: Medicare spending is growing too rapidly, and it needs to reined in.

Our ruling

Cutter said that Romney attacked Obama for cutting $700 billion out of Medicare, but ""Paul Ryan protected those cuts in his budget."" Again, with this item we are not addressing whether they are cuts, but simply whether she is correctly characterizing Ryan's plan. 
Cutter is correct that the Ryan budget plan included cost savings that were part of the future health care law. Just recently, the Romney campaign backed away from that play, saying Romney’s plan would restore the spending that the health law is set to curtail, such as extra funding for private insurers under the Medicare Advantage plan.

Still, Cutter was right about the Ryan plan. We rate her statement True.",[<zip object at 0x0000028097BB9D00>],/factchecks/2012/aug/15/stephanie-cutter/ryans-plan-includes-700-billion-medicare-cuts-says/
"['New Jersey', 'Elections', 'States', 'Chris Christie']","
Chris Christie says Mitt Romney isn’t counting on New Jersey to win presidency
","Mitt Romney can rely on the vote of at least one New Jerseyan in November: Gov. Chris Christie.

But even Christie, a top Romney surrogate tapped to deliver the keynote address on Aug. 28 at the Republican National Convention, admits the rest of the state isn’t likely to swing in favor of the presumptive Republican presidential nominee.

""I don't think Mitt Romney's counting our electoral votes in his column. I believe the overwhelming likelihood is that President [Barack] Obama will win New Jersey. I think all the polls indicate that,"" Christie said during an Aug. 7 press conference

""A Republican hasn't won [an election] for a presidency in New Jersey since 1988. And so it's a been a long haul. Could it happen? Sure, it could happen. But I think if Mitt Romney wins New Jersey he's probably going to win in 45 other states,"" Christie said.

PolitiFact New Jersey can’t check Christie’s electoral prediction, but we can test his claim about the state’s past votes on the Truth-O-Meter. Was 1988 the last time New Jersey went red in a presidential election?

It’s true: a majority of voters in the Garden State cast votes in 1988 for the then-GOP presidential candidate George H. W. Bush.

That wasn’t an aberration at the time. Republican nominees had won New Jersey in every presidential election since 1968.  

Bush took New Jersey in 1988 with more than 56 percent of the vote, defeating Democratic rival Michael Dukakis to secure a spot in the White House.

But four years later, New Jersey voters decided against sending Bush back to Washington for a second term.

Bill Clinton edged out Bush in New Jersey in 1992, grabbing nearly 43 percent of the state’s vote. Bush lost the state with more than 40 percent of the vote.

Since then New Jersey has voted for the Democratic presidential candidate in every election cycle.  

Here’s a breakdown of New Jersey’s presidential voting history:
    Our ruling

Christie said ""a Republican hasn't won [an election] for a presidency in New Jersey since 1988.""

When Bush took on Dukakis in 1988, a majority of New Jersey voters cast a ballot for the Republican candidate, helping send Bush to the White House.

But four years later, the tide turned in New Jersey and the state has voted Democratic in every presidential election since.

We rate this claim True. To comment on this ruling, go to NJ.com. https://www.sharethefacts.co/share/cc018ecd-6033-4be2-8a2c-fff8a1cb58ce",[<zip object at 0x0000028096F22580>],/factchecks/2012/aug/15/chris-christie/chris-christie-says-mitt-romney-isnt-counting-new-/
"['Rhode Island', 'Federal Budget', 'Health Care', 'Medicare', 'Social Security', 'David Cicilline']","
U.S. Rep. David Cicilline says Republican Brendan Doherty wants to raise Social Security eligibility age without regard for workers in physically demanding jobs
","
First-term Democratic Congressman David Cicilline has been circulating a campaign flier attacking Republican Brendan Doherty over the issue of Social Security reform.

The two-column flier draws a contrast between the candidates over one of the most pressing issues facing Washington: how to keep the Social Security trust fund from running dry in the next 20 years.

In one column, there is this statement: ""David will continue to fight against any efforts to privatize Social Security or reduce benefits."" The opposing column states: ""Doherty wants to raise the eligibility age for Social Security benefits for anyone born after 1960, with no regard for the challenges it would cause for people working in physically demanding occupations.""

Doherty, the former head of the Rhode Island State Police, has said that raising the retirement age of Americans born around 1960 is worth considering. It’s the second part of that sentence that caught PolitiFact’s attention: ""with no regard for the challenges it would cause for people working in physically demanding occupations."" Had Doherty said that?

The flier states as its source an appearance Doherty made on  ""Newsmakers"" on Channel 12 (WPRI) -- though it cites the broadcast date inaccurately. (It says ""3/10/2010."" The show actually aired March 11, 2012.)  

Raising the eligibility age of Social Security recipients -- it’s now 67 for those born in 1960 or later  -- has been talked about since at least 2010 when a bipartisan budget commission appointed by President Obama considered it.

Mr. Obama created the National Commission on Fiscal Responsibility and Reform to propose ways to balance the federal budget by 2015. It became known as the Simpson-Bowles commission after its two co-chairmen: former Republican Sen. Alan Simpson, of Wyoming, and Democrat Erskine Bowles, former White House chief of staff under President Bill Clinton.

As part of its suggestion to raise the eligibility age, the Simpson-Bowles report specifically calls for a hardship exemption for people who work physically demanding jobs, such as fishermen or construction workers. Their strenuous professions would probably force them to retire by 62, the report says, and they would need retirement income when they do.

During the ""Newsmakers"" interview, Doherty is asked a general question about what kinds of changes might people expect in Social Security coverage 10 years from now.

Doherty uses the opportunity to first reiterate that he would protect the benefits of seniors and those about to enter the system but  ""down the road we need to look at Social Security .... I  believe there are some good talking points in Simpson-Bowles.""

Doherty is never asked any specific questions about how he feels about hardship exemptions nor does he bring up the issue, a point Ted Nesi, one of the show’s co-hosts, made last week in a blog post.

When we asked Cicilline’s campaign for any other evidence of Doherty’s position, campaign manager Eric Hyers said Doherty’s lack of specific mention of the hardship exemptions shows he doesn’t support them and has ""no regard for the challenges"" of those who work in physically demanding jobs.

The flier ""is 100 percent accurate,"" Hyers contends.

""He has talked many, many times about raising the age of Social Security,"" said Hyers. ""Never once has he talked about these exemptions. ... If this was a serious concern of his it would have come up.""

Besides, Hyers said, the flier doesn’t actually say Doherty ""opposes an exemption. It only says he has not made a point to speak about it.""

(In fact, the flier says Doherty wants to raise the eligibility raise ""with no regard"" for physically challenging jobs.)

We asked the Doherty camp whether their candidate had ever in the past specifically mentioned whether he supported the hardship exemption. Just one reference would undeniably show that the Cicilline campaign was wrong.

Doherty campaign manager Robert Coupe said he didn’t think so because Doherty always talks about Social Security ""in terms of the Simpson-Bowles proposal and this [the hardship exemptions] is part of it.

""Just because you don’t specifically say something doesn’t mean you can say they have no regard for it. That’s like asking us to disprove a negative.""

Our ruling

A David Cicilline campaign flier says Brendan Doherty wants to raise the eligibility age for Social Security benefits for anyone born after 1960 ""with no regard for the challenges it would cause for people working in physically demanding occupations.""

But the Cicilline campaign provided no evidence that Doherty ever espoused that position.

Attacking someone for what he hasn’t specifically said -- that he supports the exemption -- defies logic, particularly since Doherty says he does support the Simpson-Bowles proposal, which would include the hardship exemptions if the eligibility age is raised.

We rate the statement False.

(Get updates from PolitiFact Rhode Island on Twitter: @politifactri. To comment or offer your ruling, visit us on our PolitiFact Rhode Island Facebook page.)
 ",[<zip object at 0x000002809782E0C0>],/factchecks/2012/aug/15/david-cicilline/says-brendan-doherty-wants-raise-social-security-e/
"['Florida', 'Guns', 'Rick Scott']","
Florida is No. 1 in concealed permits, Rick Scott says
","
After yucking it up on a Gulf of Mexico fishing trip, Govs. Rick Perry and Rick Scott sat for a wide-ranging interview with Fox News Channel’s Your World with Neil Cavuto.

In the interview (transcript here), the governors talked about why Scott and not Perry was selected to speak at the Republican National Convention in Tampa, as well as Mitt Romney’s decision to select U.S. Rep. Paul Ryan, R-Wis., as his running mate. They also were asked to comment about a recent shooting near Texas A&M University.

Both Perry and Scott cautioned about using the shooting as evidence that people’s gun rights should be restricted.

Scott then stated an amazing statistic about guns, if true.

""I mean, I think we have more concealed weapons permits than any other state because Floridians care about their right to bear arms.""

Florida is the fourth-most populous state in the country, so it’s no surprise it would be high on a concealed permit list. But is it No. 1 ahead of Perry’s Texas, which has 6 million more residents, and California, which is nearly double the size?

Turns out, yes. Scott is correct.

The U.S. Government Accountability Office, the investigative arm of Congress, recently studied the number of active concealed weapons permits by state. Their report, available here, is dated July 2012 and includes concealed weapons permit data as of Dec. 31, 2011, in most cases.

The top 10 of valid permits by state breaks down like this:

1. Florida -- 887,000;
2. Pennsylvania -- 786,000;
3. Georgia -- 600,000;
4. Texas -- 519,000;
5. Indiana -- 406,000;
6. Washington -- 351,000;
7. Utah -- 347,000;
8. Tennessee -- 341,000;
9. Michigan -- 296,000;
10. Virginia -- 279,000.

There’s two caveats to this list. First, several states, including Florida, allow out-of-state residents to acquire concealed weapons permits. So people living outside of Florida may have a Florida permit. Records don’t distinguish by location.

Second, it’s worth noting that many states have reciprocity agreements regarding concealed weapons permits, meaning that a Texas license is valid in Florida and vice versa.

We don’t think either is enough to question the validity of Scott’s remark, however.

Three large states are missing from the Top 10 list. Illinois does not issue concealed weapons permits. California and New York are considered a ""may issue"" states, which gives those states much more discretion over who gets a permit. That in turn makes it harder to get one.

As a result, California has just 35,000 active permits, representing .1 percent of the adult active population, according to the analysis. Florida, a ""shall issue"" state, had a concealed weapons permit rate of 6.2 percent of its active adult population. Georgia ranks first at 11 percent.

Our ruling

Scott said Florida has ""more concealed weapons permits than any other state."" A recent U.S. Government Accountability Office study backs Scott up. The state has about 887,000 valid concealed weapons permits, nearly 100,000 more than the next closest state, Pennsylvania.

We rate this statement True. 
(Correction: Our concluding graphs originally gave Georgia the No. 2 ranking and ignored Pennsylvania, which is rightly No. 2.)",[<zip object at 0x00000280973A4280>],/factchecks/2012/aug/14/rick-scott/florida-no-1-concealed-permits-rick-scott-says/
"['National', 'Energy', 'Barack Obama']","
 Obama says Romney would end wind power tax credits
","
President Barack Obama raised concerns about the future of wind power at a campaign event in Colorado, a state that has done well with wind energy. Over 6 percent of its power comes from wind and a Danish turbine maker recently built a manufacturing plant there.

But the industry is fragile and Obama played to that when he said, ""At a moment when homegrown energy is creating new jobs in states like Colorado and Iowa, my opponent wants to end tax credits for wind producers.""

Obama was referring to Renewable Energy Production Tax Credits. The president says Mitt Romney wants to get rid of them -- and the Romney campaign agrees.

A Romney spokesman, Ryan Williams, says when the tax credits expire at the end of this year, Romney has no plans to renew them.

""Wind energy will thrive wherever it is economically competitive,"" Williams said.

It's worth noting that Romney's position on the tax breaks for wind energy is a major issue within the wind power industry.

These tax credits have been part of American energy policy since 1992. For every kilowatt hour of power from wind, the government gives the producer a tax credit worth 2.2 cents. If the average price of electricity is around 8.5 cents, as it was in Colorado in 2010, then the tax break can make wind power more competitive.

The tax credit has come and gone over the years. Investment analyst, Aris Karcanias, managing consultant at Navigant BTM, says as the tax credit goes, so goes the wind industry.

""The Production Tax Credit remains the largest driver of industry growth in the United States,"" Karcanias said. ""And uncertainty over its renewal has historically been accompanied by repeated ‘boom and bust’ cycles of growth.""

The past few years have been one of the ""boom""  times. The National Renewable Energy Laboratory estimates that wind projects created at least 52,000 jobs between 2009 and 2011. The Congressional Research Service reports that the country will add a record 10 to 12 gigawatts of capacity by the end of 2012. 
After the policy runs out, new construction is expected to plummet. But the congressional analysts don’t say that extending it would necessarily lead to an upswing. They say that competition from cheap natural gas and a limited rise in the demand for power will tend to put a damper on the industry regardless of federal tax policy.

Our Ruling

Barack Obama said Mitt Romney plans to put an end to tax credits that benefit the wind power industry. Romney agrees.

We rate the statement True.",[<zip object at 0x0000028096784C00>],/factchecks/2012/aug/14/barack-obama/obama-says-romney-would-end-wind-power-tax-credits/
