tags,sub_header,text_body,quote_href
"['Federal Budget', 'Social Security', 'Florida', 'Marco Rubio']","
Marco Rubio tweets that GOP didn't support Social Security changes
","
The fiscal cliff negotiations are now over, but while they were happening, there were lots of accusations and finger-pointing.

President Barack Obama and Senate Republicans finally struck a deal early in the morning on New Year’s Day to avoid going over the fiscal cliff, with senators voting 89-8 in favor. But a much-talked about Florida senator with presidential aspirations voted no: Marco Rubio.

Amid home stretch negotiations, Rubio took to the online messaging service Twitter to tell people what was happening. On the afternoon of Sunday, Dec. 30, he tweeted: ""Report that #GOP insisting on changes to Social Security as part of #fiscalcliff false. BTW those changes are supported by @barackobama.""

The next day, liberal columnist Paul Krugman said Rubio lied about the negotiations, and that ""numerous reports tell us that McConnell did in fact make precisely that demand,"" referring to the Senate Republican Leader Mitch McConnell of Kentucky.

Krugman concluded that Rubio’s words revealed that a ""grand bargain"" between the two parties just won’t work: ""You can’t make big deals with a totally untrustworthy negotiating partner,"" he said.

We decided to sort out the controversy by investigating Rubio’s claim that the GOP did not insist on changes to Social Security as part of the fiscal cliff, and whether Obama actually supported those changes.

Chained CPI

The final days of fiscal cliff negotiations hit a roadblock amid a controversy about something called ""chained CPI,"" which would reduce future spending on Social Security for seniors.

Most years, seniors get cost-of-living adjustments that slightly increase their monthly Social Security payments. If chained CPI were adopted, the increases would be smaller.

What is chained CPI? The CPI stands for ""consumer price index,"" and it would be a new method for calculating cost-of-living increases for Social Security. Chained CPI accounts for how people change their behavior when costs go up: So if the price of pasta goes up, you might buy cheaper rice instead.

Supporters of chained CPI say it’s a way to reduce Social Security spending without making major changes to the program. Opponents say it’s essentially a reduction in Social Security payments that hits many seniors who are barely getting by.

Although painful for politicians clamoring for the senior vote, switching to chained CPI has drawn support from many economists and experts. The National Commission on Fiscal Responsibility and Reform included the idea in its recommendations. The conservative Heritage Foundation has endorsed chained CPI and the Center on Budget and Policy Priorities, a liberal think tank, has shown support for it under certain conditions, if it includes a modest benefit increase. 
Obama’s view on chained CPI

Switching to chained CPI isn’t a new concept. The Washington Post reported that Obama ""tentatively embraced"" chained CPI during 2011 negotiations with House Republicans on the debt ceiling.

But many Democrats -- including Sen. Majority Leader Harry Reid of Nevada, and the AARP pushed back. When Obama released his deficit-reduction plan in September 2011 a year before he would face voters, it did not include the change.

But post-election, as Obama wanted to avoid going over the fiscal cliff, he again seemed open to switching inflation measures. In mid-December, Obama reportedly agreed to chained CPI, angering some in his own party.

Obama spoke about his chained CPI proposal on Meet the Press on Dec. 30, noting that it was not popular with Democrats or the AARP: ""But in pursuit of strengthening Social Security for the long-term I'm willing to make those decisions. What I'm not willing to do is to have the entire burden of deficit reduction rest on the shoulders of seniors, making students pay higher student loan rates, ruining our capacity to invest in things like basic research that help our economy grow. Those are the things that I'm not willing to do....""

So Obama supported chained CPI as a concession he was willing to make in order to get Republicans to make concessions on things Obama wanted. (We contacted the White House for additional comment on this point and did not get a response.)

So was chained CPI part of negotiations?

During the final weekend of backroom negotiations on the fiscal cliff, multiple news reports said that Senate Republican Leader Mitch McConnell included the chained CPI in an offer. The Los Angeles Times wrote that McConnell included it in his proposal on the evening of Saturday, Dec. 29 -- and it appeared to unravel within 24 hours.

The reports we read -- in both liberal and conservative media -- said Democrats were bashing the proposal, while some said Republicans were ""insisting"" or ""demanding"" that chained CPI be included.

At some point Sunday afternoon, though, Republicans dropped their demands for the Social Security change.

The timing of those news reports were around the same time as Rubio’s afternoon tweet. Republicans appeared to be in damage-control mode about the suggestion that they would be reducing grannies’ Social Security checks in favor of lower taxes for the wealthy.

A reporter asked Sen. John McCain why McConnell made the proposal if Republicans were against it. McCain, R-Ariz., responded bluntly: ""Damned if I know.""

McCain said changes to Social Security would be a political loser for Republicans since the deal at hand was mostly about taxes.

""It’s a very bad, losing proposition,"" McCain said. ""What (Democrats) are saying now is, ‘Republicans want to preserve tax breaks for rich people and give up seniors’ Social Security.’ That’s the argument they’re using. Now whether it’s valid or not, it’s a winning argument. It should be off the table. And I think most Republicans believe it should be off the table.""

Rubio’s explanation

Multiple news reports said that McConnell proposed chained CPI but that Republicans revolted and immediately squashed the idea. So why did Rubio tweet that ""Report that #GOP insisting on changes to Social Security as part of #fiscalcliff false""?

Rubio spokesman Alex Conant told PolitiFact in an email: ""Marco’s tweet is 100% true. It was something that Republican leaders had sought, but never insisted on, and it was obviously not part of the final agreement (which Marco voted against because it failed to grow the economy or address spending). I’m honestly surprised that something so obviously true would warrant a fact-check from you guys.""

Our ruling

On Dec. 30, two days before Rubio voted against the fiscal cliff package, he tweeted: ""Report that #GOP insisting on changes to Social Security as part of #fiscalcliff false. BTW those changes are supported by @barackobama.""

Actually, Republicans had asked for the changes earlier in the negotiations, but dropped the demand later when they decided it was a political loser. Rubio’s tweet did not make it clear that GOP leadership did pursue the Social Security change, at least for a time.

Rubio also stated ""BTW those changes are supported by @barackobama."" Obama has shown a willingness to use chained CPI as one ingredient in deficit reduction, though he acknowledges that it isn’t popular with seniors or his own party. Obama has also said it was a concession he was willing to offer as part of a deal where both sides would compromise to reduce the deficit.

We rate Rubio’s claim Half True.",/factchecks/2013/jan/04/marco-rubio/marco-rubio-tweets-social-security-changes-gop/
"['Health Care', 'Medicaid', 'Public Health', 'Texas', 'Lois Kolkhorst']","
Committee chief says Texas government spent more through Medicaid on orthodontia than other states combined
","
A legislator featured at a breakfast during the September 2012 Texas Tribune Festival brought up orthodontia—I know, right?—and made a Texas-sized claim.

Rep. Lois Kolkhorst, R-Brenham, who chairs the House Committee on Public Health, said: ""It’s unacceptable that the state of Texas spent more than all 49"" other ""states combined, according to many, many reports and even our own data."" The claim was heard and relayed to us by University of Texas journalism student Cody Permenter.

Texas, No. 1 in recent Heisman Trophy winners, winter warm spells—and orthodontia?

By email, Kolkhorst’s chief of staff, Chris Steinbach, said Kolkhorst drew on groundbreaking news reports by WFAA-TV, Channel 8 in Dallas, about Medicaid spending on orthodontia, as well as a congressional report published in April 2012.

Since May 2011, the station has presented numerous reports exploring expenditures on what appear to have been many medically unneeded orthodontic procedures provided to children enrolled in Medicaid, the joint federal-state health program.

In the initial May 13, 2011, broadcast, reporter Byron Harris said such expenditures are supposed to be authorized only when a child’s teeth are so crooked they could handicap the child. But, he said, required authorizations submitted by Texas practitioners had been rejected by a state contractor only when paperwork was flawed.

""Under Medicaid, Texas spends far more on braces than any state in the country, more than the next 10 states combined,"" Harris reported. The segment showed Stephanie Goodman, spokeswoman for the Texas Health and Human Services Commission, saying: ""For whatever reason, it’s an area where we’ve had more trouble than other parts of Medicaid.""

Spending was described more dramatically in subsequent WFAA-TV reports, though wordings varied. For instance, a station anchor introduced a June 19, 2011, report by saying Texas ""spent $184 million last year on free braces for kids covered by Medicaid. That’s more than the rest of the country combined."" In an Aug. 18, 2011, report, Harris said  the same Texas spending was ""as much as the rest of the nation combined,"" a characterization repeated in a segment that aired a week later in which he said the state ""now spends as much on braces for poor kids as the other 49 states combined.""

We wondered how the station researched spending in Texas and other states.

By phone, Harris said that he and a producer contacted the states that, with Texas, comprise the nation’s 10 most populous: California, New York, Florida, Illinois, Pennsylvania, Ohio, Michigan, Georgia and North Carolina. Harris said letters sent to officials in each state inquired into how much the state had spent in 2010 on orthodontic procedures the station had zeroed in on in Texas.

""Nobody had ever asked for this before,"" Harris said.

Resulting totals, according to a spreadsheet Harris forwarded to us, ranged from zero in Michigan to $1 million for Ohio and up to $19.4 million for California and $20 million for North Carolina. And the nine-state total, $126.7 million, ran well short of the $184 million spent in Texas.

Harris said the station did not research spending in the 40 other states, which would have drained too much time. Instead, he said, ""we just guessed"" at how much the other states spent. He also agreed that such spending in the other 40 states could push the total for all other states over the Texas total. ""It could go either way,"" he said.

Harris later called us back, saying: ""You can shoot our methodology"" per the spending in the 40 other states, though it’s also worth noting that the state of Texas did not make its own comparison. ""The proof is available,"" Harris said. Texas officials ""chose not to go for it.""

The congressional report cited by Steinbach, issued April 25, 2012, by the Republican majority staff of the House Committee on Oversight and Government Reform, says that ""between 2008 and 2010, Texas’ Medicaid program spent more on orthodontics, particularly braces, than all 49 remaining states combined.""

But that comparison, also quoted in an Aug. 19, 2012, Wall Street Journal news article noted by Kolkhorst, does not appear to have been independently researched. A footnote in the committee staff report credits a Dec. 27, 2011, special report by WFAA, whose online summary of the report says: ""Texas paid more for Medicaid-funded dental orthodontics than the other 49 states combined.""

The congressional report also quotes the then-Texas Medicaid director, Billy Millwee, as saying that because the state was focused on increasing the participation of dentists in Medicaid in accordance with a broad plan resulting from a lawsuit, the state had not noticed the stunning increase in spending on orthodontic services.

In August 2011, the Texas Health and Human Services Commission announced that it was tightening its oversight of requests to pay for orthodontics through Medicaid.

By phone, spokeswoman Goodman told us it’s not known whether Texas spent the same or more on orthodontics than what was spent in other states combined nor was it necessarily the agency's mission to prove or disprove that. She said by email that when state researchers asked the federal Centers for Medicare and Medicaid Services about a Texas-to-other-states comparison, they were told it would be difficult to compare states because of the different ways state Medicaid programs address orthodontic services. At the federal agency, spokesman Alper Ozinal told us state-specific figures for 2010 Medicaid spending on orthodontic procedures were not yet compiled.

Goodman told us: ""No doubt, there have been problems with orthodontic services and we paid for claims that didn’t meet the criteria for medical necessity,"" but significantly, she said by email, the state also ensured that more needy children received basic dental services. She sent a chart showing that Medicaid spending on orthodontic procedures escalated more than 200 percent from nearly $73 million in 2006 to $249 million five years later. Medicaid expenditures on other dental procedures in Texas increased at a faster clip--300 percent, from nearly $297 million to nearly $1.2 billion, according to the chart.

Goodman noted, too, that in March 2012, the state shifted from a fee-for-service approach to Medicaid-funded dental services to a managed-care approach, a move that put the financial risk of providing services on contractors rather than the state.

According to an Oct. 15, 2012, commission presentation, ""there has been a significant decrease in the number of orthodontic prior authorization requests and approvals"" since implementation of the managed-care method. Also, the presentation says, the commission’s inspector general had identified more than 50 probable ""over-utilizers"" of orthodontic services and identified $229 million in potential overpayments with 26 orthodontic providers placed on payment hold based on credible fraud allegations.

Kolkhorst said her reference at the Tribune event to ""our own data"" reflected efforts by House aides to check spending in some other states. She emailed us what she described as her handwritten notes suggesting that 14 other states, combined, spent nearly $150 million on such procedures, about $35 million less than Texas alone. The notes show totals for the nine states separately checked by WFAA plus Arkansas, Colorado, Wyoming and Alabama and Hawaii, both shown as spending nothing on the procedures.

""Without us actually calling all 50 states and adding it all up, which we could do, I am very confident ... that Texas spent in the ballpark of the 49 other states,"" Kolkhorst said. ""It could be within $1 million or $10 million—the point being"" that what Texas spent by itself was ""incredible.""

Kolkhorst said that if WFAA had said Texas solely outspent the other most-populous states, combined, she would have said that and shouldn’t be penalized for echoing what she believed to be accurate reportage. Otherwise, she said, ""it is now our job to research whatever the media puts out.""

Our ruling

Kolkhorst said that according to ""many reports"" and ""our own data,"" Texas outspent all other states combined on Medicaid-funded orthodontia. 
Texas experienced a toothsome spending spike; WFAA's reporting demonstrates the state spent more on orthodontic procedures funded by Medicaid in 2010 than the other most-populous states, combined. But relevant research has been limited to the spending in Texas and nine to 14 other states. Lacking complete backup information, this claim rates as Half True.",/factchecks/2013/jan/04/lois-kolkhorst/committee-chief-says-texas-government-spent-more-t/
"['Ohio', 'Federal Budget', 'Health Care', 'Medicaid', 'Medicare', 'Marcia Fudge']","
Marcia Fudge claims the fiscal cliff deal included cuts in payments for illness that disproportionately impact minorities
","
If you read about the fiscal-cliff deal Congress made on New Year’s Day, one fact above others stood out. Through compromises -- more unsavory or unprincipled to some than to others --  America’s economy did not topple over.

Neither side got everything it wanted, noted U.S. Rep. Marcia Fudge, a Warrensville Heights Democrat who voted for the deal. One compromise in particular still leaves Fudge uneasy: the funding measures used to keep Medicare from cutting its pay to physicians by 26.5 percent. To avert the physician pay cuts, Congress diverted money from several other medical programs, Fudge said in a Jan. 1 news release.

This took care of the so-called Medicare doc fix -- but it also happened to take money
from programs that pay for ""treating illnesses disproportionately impacting minorities, including end stage renal disease and diabetes,"" Fudge said. She said this must be addressed in the new session of Congress.

Did Congress really get the money to keep paying doctors for treating seniors (via Medicare,) by cutting what it pays hospitals and others for treating diabetes and other diseases? PolitiFact Ohio took a look.
 
It turns out that Fudge, who chairs the Congressional Black Caucus, was correct on the funding. Whether this will harm patients is a matter of debate. Government accountants have wanted some of these changes for some time. Hospitals say the bean counters miss the big picture -- the real cost of treating patients -- by focusing too narrowly on line items.

To understand this, let’s start with a quick explanation of the doc fix. It is a remnant of laws, the most recent in 1997, designed to hold down federal spending by linking the nation’s rate of economic growth to government payments for providers in Medicare, the 1965 program that brought federal health insurance to retirees.

The problem is, medical costs often rise much faster than the overall economy (measured  by the gross domestic product). In recent, low-inflation years, the formula linking the two would automatically require payment cuts to doctors. Some doctors who serve seniors say they might get paid so little that they would stop accepting new patients or quit practicing. So  Congress halts these reductions every year, though it keeps the law.

This year’s cut would have been particularly deep because of the cumulative build-up of past deferrals. But as we said, Congress found a fix. It required coming up with about $30 billion to pay.

Where did the money come from?

According to the Kaiser Health News blog, Congress decided to cut the amount that Medicare pays to hospitals for inpatient or overnight care by reducing annual base payment  increases. This would save $10.5 billion over 10 years, the Kaiser news service said.

Congress found another $4.2 billion by reducing what are known as ‘disproportionate share"" payments made by Medicaid, the government’s program for low-income Americans, to hospitals that treat an unusually high share of the poor.

And it got $4.9 billion by changing the way it bundles payments for treating end-stage renal disease starting in 2014

There are other changes, including a requirement that companies start competing with bids to sell diabetes test supplies, ending what government auditors say are over-payments. But you get the idea. These and other cuts are detailed in reports by the medical trade press, including The Medicare NewsGroup and Becker’s Hospital Review.

If this sounds like Congress took from Peter to pay Paul, the president and CEO of the Federation of American Hospitals, Chip Kahn, might agree. He put it that way to Kaiser Health News: ""It is not in the best interest of patients or those who care for them to rob hospital Peter to pay for fiscal cliff Paul.""

The American Medical Association also expressed its concerns.

Outrageous? Consider the rationale: Congressional watchdogs maintain these programs were overpaid or abused in the past, and could function in the future with less money.

According to several studies and audits by the Government Accountability Office, an investigative agency that reports to Congress, hospitals were overpaid while Medicare transitioned toward paying them a bundled sum for treatment based on a patient’s disease or diagnosis. The old system paid for individual services, treatments and tests, some of them poorly coordinated and duplicative. Overpayments occurred during the transition that started in 2008.

Additionally, some ambulance services were overpaid for emergency transport of diabetes patients who did not need emergency or ambulance services, according to examinations by the inspector general for the Department of Health and Human Services. By cutting such payments by 10 percent, starting next October, Congress freed up additional money for the doc fix.

And the Centers for Medicare and Medicaid Services paid for more dialysis-related drugs -- as much as $880 million in 2011 -- than patients with kidney failure actually used, according to a December, 2012, GAO report. This was due to a bundled-payment calculation that did not account for a significant drop in the usage of certain drugs -- 23 percent lower in 2011 than in 2007, the GAO found.

The GAO specifically recommended that Congress tweak the law so CMS had clear authority to alter its dialysis payment calculations. Congress did so as part of the fiscal cliff and doc fix deal.

But the medical industry is unhappy about this and the other cuts. It says that the GAO failed to factor in costs for which it is never reimbursed.

""Making cuts of the magnitude GAO is recommending would impose great financial strain"" on smaller dialysis organizations ""and could lead to fewer choices and access to care problems for patients,"" Katrina Russell, president of the National Renal Administrators Association, told American Medical News in December.

Fudge, too, does not like this change. Her district not only includes every major hospital system in Cuyahoga County, as her communications director, Belinda Prinz, told us, but also has a significant black population. African-Americans have a disproportionately high incidence of diabetes and are 1.8 times more likely to have diabetes than non-Hispanic whites, according to the American Diabetes Association.

One in four African-American women over age 55 has diabetes, Prinz said in an email, citing this and other American Diabetes Association figures. Complications can cause blindness, kidney disease, heart attacks and strokes, and amputations sometimes result -- with African-Americans 2.7 times as likely to have lower-limb amputations, the association says.

So where does that leave us with Fudge’s claim?

Fudge did not specifically say minorities will be harmed by the spending cuts. Her statement was factually accurate. But she suggested that harm will result, saying that cuts will be made to programs that treat diseases disproportionately affecting minorities, including end stage renal disease and diabetes.""

The impact is unsettled for now. The GAO and inspector general have called out some of these programs for waste or unnecessary spending. Yet Fudge is in good company -- namely, the American medical community, although like any constituency, it too has its interests to protect.

Because her claim requires this additional information to fully understand, we rate it Mostly True.",/factchecks/2013/jan/04/marcia-fudge/marcia-fudge-claims-fiscal-cliff-deal-included-cut/
