tags,sub_header,text_body,quote_href
"['Rhode Island', 'Guns', ""Michael O'Neill""]","
How many lives would be saved by a gun-free zone?
","A bill that would stop the state’s more than 3,000 concealed-carry permit holders from bringing their weapons into Rhode Island schools quickly became the center of attention at an April 26 Senate Judiciary Committee hearing. Sponsored by Sen. Harold Metts, D-Providence, Senate Bill 2761 would make schools ""gun free zones,"" meaning that only ""peace officers"" — defined in state law as people who are sanctioned by the school and have extensive firearms training — could carry weapons in school zones. This roiled Second Amendment enthusiasts who argued against the bill, saying it would put kids at higher risk for acts of terrorism. Legal gun owners, or ""good guys,"" can help disarm a potential attacker if they are on school grounds before police arrive, Michael O’Neill, a pro-bono lobbyist for the Rhode Island 2nd Amendment Coalition said at the hearing. Sen. Frank Lombardi, D-Cranston, and Sen. Stephen Archambault, D-Smithfield, both agreed with O’Neill on that point. ""If we're going to issue law-abiding concealed-carry permits to people,"" Archambault said, ""... I'd rather know there's a chance someone can put down a lunatic.""   O’Neill added: ""There’s no data that says a gun-free zone has saved lives."" We reached out to O’Neill, and his colleague Frank Saccoccio, also of the Rhode Island 2nd Amendment Coalition, to clarify. We briefly spoke with both men. Saccoccio said he’d send us information via email Tuesday night. By Friday, he hadn’t sent us an email, and he hasn’t returned subsequent emails and phone calls. On the other side of the argument, support for the bill comes from school committees across the state, Attorney General Peter Kilmartin, the Rhode Island Association of School Principals and the Rhode Island Federal of Teachers and Health Professionals, among others. Is it possible that it's not backed up by data? Is there no data?  O’Neill’s statement is tough to refute because it’s so broad, said Linda Finn, a spokeswoman for the Rhode Island Coalition Against Gun Violence. There may not be data that gun-free zones have ""saved lives."" It’s hard to disprove a claim like that. Further, the federal Centers for Disease Control and Prevention — the leading national public health institute — has not extensively researched firearms since 1996, when the National Rifle Association accused the agency of promoting gun control. After the 2012 mass shooting at Sandy Hook Elementary in Newtown, Connecticut, President Obama signed an executive order reversing the research ban. But nearly four years later, Congress still hasn’t approved the funding. There is, though, ""plenty of data that shows that when guns are present, it increases the likelihood of an injury or death,"" Finn told us. Like when Michelle Ferguson-Montgomery, a sixth-grade teacher and a concealed-carry permit holder in Utah, shot herself in the leg in the school bathroom in September 2014. Or when an Idaho State University professor literally shot himself in the foot with his concealed gun on campus. Then there’s a psychological phenomenon called the ""weapons effect."" Numerous peer-reviewed studies, including one dating back to 1967, show the presence of a weapon, or just a photo of one, leads to aggressive behavior in humans. This is especially true when stress levels are high -- say, in an active school shooter situation.   The study ""Does the Gun Pull the Trigger?"" published in ""Psychological Science"" in 1996 showed that ""simply identifying weapons increases the accessibility of aggressive thoughts."" This theory played out for a Barrington sixth grader, according to testimony by his father, Willis Peter Bilderback. Bilderback testified that his son became ""very afraid"" after his teacher told him he had a firearm in his desk. The boy was so shaken that he switched out of the class and had repeated nightmares of ""his teacher attempting to track him down with a gun and kill him,"" according to Bilderback’s testimony. ""The fact that my son believed his teacher had a gun in the classroom turned a nationally recognized blue-ribbon Middle School into a house of horrors for him,"" Bilderback wrote. But do ‘good guys"" help? There is anecdotal evidence to back up O’Neill and Archambault’s idea — some of which is outlined in this  Washington Post blog from October 2015. In Chicago in April 2015, an Uber driver with a concealed-carry permit ""shot and wounded a gunman who opened fire on a crowd of people,"" according to a Chicago Tribune report. A similar incident played out in a Philadelphia barber shop. And an FBI ""Study of Active Shooter Incidents in the United States Between 2000 and 2013"" showed that out of the 160 incidents studied, in 21 cases  unarmed citizens ""made the selfless and deeply personal choice"" to confront the shooter, and ended the threat. There were seven times that an armed, off-duty police officer, citizen or security guard used a weapon to end the threat. Our ruling: O’Neill says ""there’s no data that says a gun-free zone has saved lives."" He is correct. There is no definitive data to say that a gun-free zone has saved lives. In part, that’s because the CDC has been blocked from studying anything related to firearms for the last 20 years. And also because ""saved lives"" are hard to quantify. However, there are many anecdotes, scholarly articles and federal studies with data showing that just the presence of guns can cause anxiety and increase aggressive behavior. Plus, there are the teachers who accidentally shot themselves on school grounds. And yes, there are the cases in which the ""good guys"" prevail. We rate O’Neill’s claim: Mostly True https://www.sharethefacts.co/share/97a87447-7f5a-4775-979a-98b85f616e16",/factchecks/2016/may/08/michael-oneill/how-many-lives-would-be-saved-gun-free-zone/
"['Transportation', 'Texas', 'Sylvester Turner']","
Sylvester Turner overstates number of solo drivers
","When Houston Mayor Sylvester Turner announced Carrin Patman as the new chairwoman of the Metropolitan Transportation Authority of Harris County board, he emphasized the vital role Patman would play in reducing Houstonians’ dependence on cars. ""We have been focusing so much, especially the Texas Department of Transportation, on that 97 percent of people in single-occupancy vehicles,"" he said. Since Turner became mayor in January 2016, he’s emphasized public transit and other ways of fighting congestion in contrast to building more highways, a traditional focus of TxDOT. Turner, introducing Patman, brought up TxDOT’s focus on single-occupancy vehicles because he disagrees with the strategy of building roads to ease traffic congestion. We wanted to check his facts. Are 97 percent of people in single-occupancy vehicles? Origin of the 97 percent statistic The 97 percent statistic wasn’t limited to the March 4, 2016, event at City Hall. In fact, it’s been a regular part of Turner’s stump speeches of late, according to Houston Chronicle transportation reporter Dug Begley.  He also mentioned the number at an announcement for other Metro appointments March 18, 2016, and at the Texas Active Transportation and Trails Conference in Houston on March 9, 2016, Begley said. We called the mayor’s staff to see where the 97 percent figure came from. His press team referred us to the city’s Planning and Development Department, which they said wrote Turner’s  March 4 speech. By phone, Suzy Hartgrove, the planning department’s public affairs manager, told us the statistic referred to drivers in all of Texas -- not just Houston -- and that it had come from TxDOT Commissioner Bruce Bugg of San Antonio. Hartgrove said Bugg brought up the statistic at a January 25, 2016, meeting in to discuss traffic congestion in the Houston region. By email, Hartgrove forwarded Bugg’s slide show from a Jan. 28, 2016, presentation to Houston TranStar, the body that coordinates city and state agencies to respond to Houston-area traffic incidents. A slide in the presentation says that Austin, Dallas, Fort Worth, Houston and San Antonio were ""home to 97 of the top 100 most congested roadway segments in Texas in 2015."" In the email Hartgrove forwarded to us, planning department staff discussed how Bugg’s 97-of-100 point may have been misinterpreted in its drafting of Turner’s remarks. We turned to TxDOT; Austin-based spokeswoman Veronica Beyer responded by email, saying that Bugg ""never used the words ‘single-occupancy vehicle.’"" On the other hand, Beyer said, Bugg has offered a few similar statistics, including that ""97 percent of Texans who choose to travel do so by car, truck or van."" What that statistic means  When Turner first started bringing up this statistic in January, the Houston Chronicle took a close look at his facts. In Jan. 28, 2016, remarks before the Texas Transportation Commission, Turner said that ""TxDOT has noted that 97 percent of Texans currently drive a single-occupancy vehicle for their daily trips."" That comment differs slightly from his statement at hand -- it refers to daily trips, not 97 percent of all people. Begley’s analysis of that number in an annotated transcript of the speech helps with the number we’re looking at, too: ""This number is commonly used in various ways but is misapplied most of the time,"" the Chronicle said. ""In a 2006 study by Texas A&M University, it was stated 95.4 percent of workers over age 16 use a car, van or truck to get to work. However the number included carpoolers and only covered trips to [and] from work, as opposed to all driving. According to the Census Bureau, 79.9 percent of commuters drive alone to work in the state. Around 11 percent share a ride to work. About 4 percent work at home and 1.6 percent statewide use public transit."" The upshot: ""Solo drivers dominate any breakdown of how Texans travel, but it is not as high as many people claim,"" the story said. Beyer, from TxDOT, also offered some backup that points to these numbers from the Chronicle as the most reliable. She sent us a chart from the U.S. Department of Commerce indicating that in 2013, 96.1 percent of Texans who commuted to work chose a car, truck or van. Notably, that figure folded in carpools so it wasn’t referring solely to single-occupancy vehicles. How many people are in single-occupancy vehicles?  Absent other data, then, we suspect it’s not quite 97 percent of people driving single-occupancy vehicles. So, how many are driving solo? It’s hard to say exactly. We have the numbers on commuters from the Census Bureau: 79.9 percent of Texas workers in 2013 drove alone to work. For all driving, however, it’s tougher to pinpoint how many people driving solo. We reached out to the Texas Transportation Institute at Texas A&M University, which connected us with Phil Lasley, a researcher there. Lasley told us by phone that it is difficult to get numbers related to all trips. Surveys that measure that data are rarely done, he said. Lasley was looking at the Census data that says 79.9 percent of people drive alone to work. Lasley, asked if that number would be higher or lower if it took into account all driving, said he thought it would be higher. ""People who carpool are generally going to work. People wouldn’t jump in a carpool to go to the dry cleaners or pick up kids from school,"" he said. During the school day especially, when many people are on the road getting errands done, drivers tend to be by themselves, he said. Lasley also pointed out that trips to and from work -- which is the data the 79.9 percent refers to, and the closest survey result we found to generally gauge single-occupancy drivers -- only made up 16 percent of all trips in Texas from April 2008 to April 2009, according to the 2009 National Household Travel Survey, the most recent (the 2016 survey is underway). Most driving was for social and recreational trips, errands and shopping before commuting. The average vehicle in that time frame, driving for all purposes, had 1.67 people in it, according to the National Household Travel Survey. Our ruling  Houston Mayor Sylvester Turner, decrying traditional emphases on road building to ease traffic congestion, said 97 percent of people drive single-occupancy vehicles. This figure looks like it was based on a misread of another official’s declarations. And while we found little data about how many of us always drive solo, Census research suggests that about 80 percent of commuters drive alone, but commuting accounts for less than 20 percent of total driving, according to the latest survey we could find. It is 100 percent time to park this stat; we rate his claim False. FALSE – The statement is not accurate. Click here for more on the six PolitiFact ratings and how we select facts to check. https://www.sharethefacts.co/share/de2b979b-980b-4bba-bfa4-22db6680f96d",/factchecks/2016/may/06/sylvester-turner/sylvester-turner-overstates-number-solo-drivers/
"['Elections', 'Wisconsin', 'Paul Ryan']","
Vexed by Donald Trump, has Paul Ryan changed his position on backing GOP presidential nominee?
","On May 3, 2016, Donald Trump earned the title of presumptive Republican presidential nominee by winning decisively in Indiana’s GOP primary election. Ted Cruz, who is second in delegates behind Trump, dropped out of the race the same night. And John Kasich, the final remaining contender, ended his campaign the next day. But less than 48 hours after Hoosiers gave Trump his climactic victory (for which he gives ex-basketball coach Bobby Knight big credit), House Speaker Paul Ryan made huge headlines by saying he is not ready to support Trump for president. Previously, the Wisconsin Republican has said he will support the GOP nominee. So, has Ryan -- the chairman of the convention and the highest-ranking member of his party to explicitly withhold his support from Trump -- flip-flopped? Let’s pivot to our Flip-O-Meter, which determines whether a politician has changed position on an issue. Past statements Here are some of the statements Ryan has made in recent weeks: Jan. 13, 2016: Today Show host Matt Lauer asked, referring to Trump: ""If he becomes the nominee of the party, will you support him? Ryan replied: ""Yes, I will. I'll support whoever our nominee is."" March 1, 2016: At his weekly news conference with reporters, Ryan criticized Trump for equivocating about receiving support from white supremacists, but said: ""I plan to support the nominee. I think I’ve said enough this morning about what’s happening right now. My plan is to support the nominee."" March 15, 2016: Asked at a news conference at the Republican National Committee's headquarters whether whether he would support the eventual nominee, whoever it may be, Ryan said he would, adding: ""My position hasn’t changed on that.""   Post-presumptive statements Compare those to what Ryan said to CNN host Jake Tapper on May 5, 2016: Tapper: So, Mr. Speaker, you have said throughout this process that you will support the Republican presidential nominee. Now you have a presumptive nominee, Donald Trump. Will you support him? Ryan: Well, to be perfectly candid with you, Jake, I’m just not ready to do that at this point. I’m not there right now. And I hope to, though, and I want to. But I think what is required is that we unify the party. And I think the bulk of the burden on unifying the party will have to come from our presumptive nominee. Moments later, there was a follow-up question. Tapper: So you’re saying you can’t support or endorse him right now? Ryan: Yes, I am basically saying that ….But at this point, I think that he needs do more to unify this party to bring all wings of the Republican Party together ... Pretty clearly a partial change in position. Ryan invited Trump to meet Tuesday, May 10, with Republican House leaders, and Republican National Committee Chairman Reince Priebus is expected to meet that day with Ryan and Trump, according to a statement from Ryan’s office. Our rating Ryan has said repeatedly he would support for president whomever wins the Republican nomination. He said so even when asked specifically about Trump being the nominee. But in his first comments after Trump became the presumptive nominee, Ryan wavered. He did not say he would not support Trump. But he stated he is not ready to support him at this time. It’s worth noting that the party won’t officially have a nominee until its convention in Cleveland in July 2016, although no one but Trump is in a position to claim the nomination. But for pledging to support the GOP nominee and now withholding that support, at least for the time being, we give Ryan a Half Flip.",/factchecks/2016/may/06/paul-ryan/vexed-donald-trump-has-paul-ryan-changed-his-posit/
"['Immigration', 'Labor', 'Florida', 'Ted Cruz']","
Donald Trump attacked for bringing in hundreds of foreign workers on H-2B visas at Mar-A-Lago
","Donald Trump has promised to be the ""greatest jobs president that God ever created."" But he’s also been attacked for his record of hiring foreign workers. A Ted Cruz ad that aired in Indiana attacked Trump’s use of temporary foreign visas known as the H-2B program: ""Trump still brings in hundreds of foreign workers to replace Americans,"" stated the narrator. Cruz dropped out of the presidential race May 3 after losing Indiana, but we suspect Democrats will be happy to launch this same attack line at Trump in the months to come. So we decided to look into it. The bottom line: Trump did try to hire hundreds of foreign workers at his Mar-A-Lago resort in Palm Beach, although it’s unclear just how many actually took jobs. The workers also weren’t necessarily replacing Americans, but filled temporary jobs locals allegedly couldn’t do or didn’t want. Mar-A-Lago foreign workers Trump’s Mar-A-Lago Club in Palm Beach County is an oceanfront eating club designed for the 1 percenters. The club’s website describes itself as offering ""an incomparable, royal lifestyle"" in a historic 126-room mansion. It offers a beach and pool, a spa and fine dining for those who can afford the $100,000 initiation fee. The club’s director of human resources referred us to the campaign for this fact-check, and a campaign spokeswoman did not respond. The charge that Trump hires foreign workers revolves around the club seeking H-2B visas for low-skilled workers such as cooks, wait staff and housekeepers. H-2B visas are legal — Congress has set the cap at 66,000 per year — and its agricultural counterpart is the H-2A visa. Nationwide for both programs, the vast majority of the workers are young Mexican men, although news reports say Trump sought workers from Europe. Employers argue they need these temporary workers to fill jobs Americans don’t want, while critics say the workers can be exploited. Since the visas are tied to a particular job, the foreigners can’t simply jump ship for a better paying job at another resort, and unlike Americans, they may be reluctant to raise any complaints with their employers. Since 2010, nearly 300 U.S. residents applied or were referred for jobs at Mar-A-Lago, but only 17 were hired, the New York Times reported. Meanwhile, Mar-A-Lago sought more than 500 visas for foreign workers. (The visas were also sought at some of his other properties.) We don’t know how many people actually used the visas and became employees. A spokesman for the State Department said that information is kept confidential. To obtain the visas, businesses must prove they tried but couldn’t fill positions with Americans or legal residents. According to the Florida Department of Economic Opportunity, the resort posted jobs through CareerSource Florida, the local workforce development boards throughout the state. A U.S. Labor Department spokesman told PolitiFact Florida that 93 people applied for 250 seasonal job openings. Four were hired, while 79 didn’t answer interview requests or turned down jobs (10 applications were classified with unknown status). Documents the resort later filed with the Labor Department showed that many of the American applicants weren’t hired because they didn’t meet requirements. Some applicants didn’t want to work split shifts, or didn’t have enough experience. Many wanted full-time jobs instead of part time, or didn’t respond when the resort contacted them. One applicant said they only were applying as a prerequisite to continue getting unemployment. After that process, the Labor Department certified 685 H-2B visas for the Mar-A-Lago Club between 2008 and 2015. News reports suggested Mar-A-Lago did the bare minimum to meet legal requirements to try to recruit U.S. workers. For example, CNN wrote that job openings were placed in a local newspaper with small circulation for just two days rather than a larger newspaper. Nationally, while employers claim there are labor shortages in lower- and semi-skilled occupations, ""there is no credible evidence that such labor shortages exist,"" wrote Daniel Costa, an immigration expert at the left-leaning Economic Policy Institute, in a paper in January. The New York Times asked Trump why he hired so many foreign workers when Americans applied for the same positions. ""The only reason they wouldn’t get a callback is that they weren’t qualified, for some reason,"" Trump replied. ""There are very few qualified people during the high season in the area."" But some experts question Trump’s assessment that it’s hard to find local help. In 2015, CareerSource assisted in placing nearly 1,800 candidates in hospitality jobs in Palm Beach County. But Mar-A-Lago didn’t show much interest in using the free service. Tom Veenstra, senior director of support services at CareerSource in Palm Beach County, told PolitiFact Florida that the first time his office received a request for helping finding workers was September 2015. (That was shortly after one of the first news reports, by Reuters, about Trump’s foreign hiring practice.) Since that time, Mar-A-Lago used the office to hire just one person, a banquet server. ""We called the HR director after the hire, and she said they were pleased with the hire and the candidates we sent them,"" Veenstra said. ""There has been nothing else since then."" There are plenty of local applicants, said Greg Schell, an attorney in Palm Beach County who represents foreign workers. ""The local job fairs for hotels and other hospitality jobs are overwhelmed with applicants,"" he said. Our ruling A Cruz ad says that Donald Trump ""brings in hundreds of foreign workers to replace Americans."" Federal labor records show Trump sought visas for hundreds of foreign workers to fill temporary positions at his Mar-A-Lago Club in recent years. Hundreds of U.S. applicants either applied or were referred for the jobs, but only a handful were hired. There is some debate about whether those applicants were qualified or not. Cruz makes it sound like foreign workers took jobs from Americans already in positions, but that’s not the case. It’s an ongoing debate whether there were qualified Americans who would have been willing to work the seasonal, part-time service jobs for which the club was hiring. The statement is partially accurate but leaves out important details. We rate it Half True.",/factchecks/2016/may/06/ted-cruz/donald-trump-attacked-bringing-hundreds-foreign-wo/
