tags,sub_header,text_body,quote_href
"['National', 'Housing', 'New Hampshire 2012', 'Newt Gingrich']","
Newt Gingrich says Dodd-Frank law requires 20 percent down payments
","
With the 2012 election in their sights, Republican candidates spend most of their time trying to prove that President Barack Obama and the Democrats will make the economy worse.  

Presidential hopeful Newt Gingrich recently used this tactic in discussing housing and the new law to regulate the financial industry known as the Dodd-Frank Act. In a June 13, 2011, appearance in Concord, N.H., Gingrich said that Dodd-Frank ""establishes a mandatory 20 percent down payment to buy a house. So at a time when housing prices have dropped worse than the Great Depression, we’re now going to have a law that guarantees there’s no housing market for a generation?"" Gingrich said this was just one of many reasons to scrap Dodd-Frank entirely.

Not too long ago, a 10 percent down payment was generally the industry standard.  So we thought it would be important to know if Dodd-Frank in fact ""establishes a mandatory 20 percent down payment.""  

Some quick background on the Dodd-Frank Act., which is named after Sen. Christopher Dodd, a Democrat from Connecticut who retired last year, and Rep. Barney Frank, a Democrat from Massachusetts. It changes many of the rules the financial sector must live by, from credit cards to derivatives trading. One of its targets is a practice that lies at the heart of the sub-prime mortgage disaster.  

When a bank gives someone a loan to buy a house, it almost never holds the loan. Instead, it bundles it with other mortgages and sells it to another financial institution or group of investors.  Before the meltdown, banks could sell the entire mortgage. If the loan went bad, the new owner of the mortgage was on the hook.

Selling the loan allowed banks to make bad loans and not suffer the consequences. Dodd-Frank tries to put an end to that by saying that banks, and other kinds of lenders, must hold on to at least 5 percent of the value of the mortgage so they are ""keeping some skin in the game.""

But the new law gave regulators the option to cut lenders some slack so they could sell 100 percent of certain mortgages if they were less risky.  That provision is the source of Gingrich’s statement about a mandatory 20 percent down payment. But we find he is not characterizing the law accurately.  

We went to the law (page 519 is where you’ll find the topic addressed) and found nothing about a requirement for a 20 percent down payment.

Asked to back up the claim, the Gingrich campaign cited this item in the Housing Wire, a news service for the mortgage market.  The June 22 article describes a bipartisan furor over a proposed rule from housing and finance agencies to implement Dodd-Frank.  The regulators did say the safest loans were those where the borrower put down 20 percent, and they proposed waiving the 5 percent requirement only for such highly rated mortgages.

But that was just a proposal -- and an unpopular one. Groups from the Mortgage Bankers Association to the National Association of Colored People to the Independent Community Bankers of America registered strong objections. The president of the National Association of Realtors, Ron Phipps, said ""as written, the proposed rule violates congressional intent, makes homeownership more expensive for millions of responsible consumers and jeopardizes the fragile housing recovery.""

Lawmakers also weighed in against the proposal, with 44 senators and 282 House members of both parties signing letters opposing it. The authors of the law said the proposal was not consistent with their intent for the legislation.  

An expert on the real estate industry told us Gingrich was wrong.

""It's totally incorrect to say that Dodd-Frank came up with the 20 percent down payment standard,"" said Ken Harney, a real estate columnist with the Washington Post Writers Group. ""It just could not be further from the truth.  So whoever says that is just misinformed.""

Harney notes that after the firestorm of protest, regulators extended the comment period for rule making.  Harney’s assessment?  This is ""a proposal that I think has no chance of becoming reality.""

Two final points.  By June 22, Gingrich himself had backed off, acknowledging that the 20 percent rule was just a proposal.  And even the proposed rule would not make a large down payment mandatory.   
Our ruling:

Gingrich is not correct that the law mandates a 20 percent down payment. There is no such requirement. The only element of the law that even comes close to that is a provision that requires banks to hold on to 5 percent of the value of their mortgages so they will retain a stake in mortgages. There's also been a proposal by regulators to waive that requirement for highly rated mortgages, which would include those with a 20 percent down payment.  But that proposal has stalled and that's a long way from what Gingrich said, that 20 percent down payments are required.

We rate Gingrich's statement False.",/factchecks/2011/jul/21/newt-gingrich/newt-gingrich-says-dodd-frank-law-requires-20-perc/
"['Retirement', 'State Budget', 'Virginia', 'Bob McDonnell']","
Gov. McDonnell says Virginia state employees ""pay nothing"" toward their pensions
","
Gov. Bob McDonnell recently proclaimed Virginia’s retirement system needs change.

""We’re one of only four states in the country that the state employees pay nothing (toward their pension),"" McDonnell said in a July 13 interview with CNBC’s Squawk Box. ""We pay the employee and employer share.""

So state employees don’t contribute a dime to their own retirement?

A couple of our readers who saw the TV interview told us McDonnell’s is wrong. So we decided to look into the governor’s statement. 
The CNBC interview began with McDonnell -- widely mentioned as vice-presidential prospect for next year's Republication national ticket -- accepting praise for Virginia's sound financial condition. When asked about the state's pension, McDonnell acknowledged it has $18 billion in unfunded liabilities and blamed part of the problem on the General Assembly's reluctance to ask state employees to kick in money. 
Jeff Caldwell, a spokesman for the governor, said McDonnell’s claim was based on an October 14, 2008, report from the Joint Legislative Audit and Review Commission that said Virginia was among five states that did not require its employees to make pension contributions.

Caldwell said the other four were Tennessee, Florida, Utah and Missouri. But he said Virginia is now one of four states without employee contributions because Missouri, as of January 1, 2011, began requiring new hires to contribute 4 percent to their plans.

There are major  problems with the governor’s claim, however.

State employees hired before July 1, 2010, recently began contributing 5 percent of their salary to their pension plans under a change that went into effect June 25, 2011 -- 18 days before McDonnell’s interview on CNBC. The new policy is contained in a well-publicized budget provision approved by the General Assembly earlier this year that gave state employees a 5 percent raise and simultaneously required them to contribute 5 percent of their salary to their pensions.

The governor was hardly a stranger to this development. He urged legislators to require state employees to pay into the pension fund during his State of the Commonwealth Address on Jan. 12. McDonnell signed a budget containing such a provision -- although more lenient than what he wanted -- on May 2.

The change reversed a deal made in 1983 when Virginia agreed to pay for its employees’ pension contributions instead of giving them a raise that year.

This year’s pension contribution deal only affected longer-serving workers. Newer workers, hired on or after July 1, 2010, had already been required to contribute 5 percent toward their pensions from the day they began work. That provision is part of a bill McDonnell signed on April 13, 2010.

McDonnell made his statement on CNBC four days after the pay period ended in which longer-serving state workers made their first contributions to pensions. New state employees had contributed for as long as a year, depending on their start dates.

Caldwell said Virginia is still paying the pension contribution for longer-serving workers, because the state gave employees the 5 percent raise in return for a 5 percent pension contribution.

""There was a requirement to pay in, but then the state paid employees to offset that,"" he said.

Caldwell offered no explanation how the governor’s statement could be true in light of the fact that newer employees have been paying into the system for as long as a year.

Those newer employees are not eligible for the 5 percent pay hike provided to longer-serving workers, according to the Virginia Department of Human Resource Management’s website. The  newer employees received no salary boost to offset their pension contribution.

About 6,000 new state employees have been hired and started paying into their pensions during the past year, said Jeanne Chenault, a spokeswoman for the Virginia Retirement System. Another 84,000 veteran workers were affected by the 5 percent raise/pension contribution.

Ron Jordan, executive director of the Virginia Government Employees Association, said even with the raise, a burden for paying pension contributions has been placed on the backs of veteran workers. Next time there’s a raise, workers will pay the 5 percent contribution on a higher salary, Jordan said, meaning they will ultimately pay more towards their pension than what’s covered by the 5 percent raise given to them this year.

Jordan also took issue with the contention that veteran state workers’ immediate loss from the pension contribution was entirely covered by the 5 percent raise. He pointed to a document on the Department of Human Resource Management website saying some employees could see a drop in their take home pay after the pension contribution and raise go into effect.

Let’s review.

McDonnell, in a CNBC interview, said state workers pay nothing toward their pension and that Virginia makes the contribution for them. That was the case for several decades, but it is no longer true.

For more than a year, new state employees -- those hired on or after July 1, 2010 -- have been required to make pension contributions from the day they reported to work. About 6,000 new state workers now fall under the legislation.

Longer-serving bureaucrats also are being required to ante up. McDonnell’s interview on CNBC came 18 days after after well-publicized provisions went into effect requiring longer-serving state employees to contribute 5 percent of their pay to Virginia’s pension.

The governor’s spokesman correctly points out that longer-serving employees were given a 5 percent raise to offset their pension contribution. Nonetheless, veteran state employees are now chipping in for their pensions and any future raises they receive will also increase their payments into the retirement fund.

The governor, in his interview, said Virginia is one of four states that foot the entire bill for pension contributions. But McDonnell removed a fifth state that had been on the list -- Missouri -- because at the start of this year, Missouri began requiring new hires to pay in.

So Virginia shouldn’t be on that list either. McDonnell’s claim goes beyond inaccurate and enters the realm of the absurd. We rate his statement Pants on Fire.",/factchecks/2011/jul/21/bob-mcdonnell/gov-mcdonnell-says-virginia-state-employees-pay-no/
"['New Jersey', 'Deficit', 'Federal Budget', 'Richard Codey']","
New Jersey Sen. Richard Codey claims “every president has raised the debt ceiling” during Fox News interview
","
As President Barack Obama and Congressional Republicans wrestle over raising the nation’s debt ceiling, New Jersey Sen. Richard Codey (D-Essex) added his voice to the debate during a recent panel discussion on Fox News’ Hannity.

Sitting between a conservative writer and a former Miss America, Codey joined the ""The Great American Panel"" on July 13 and soon found himself sparring with host Sean Hannity. Hannity began the conversation by criticizing President Barack Obama for using ""seniors as a pawn in this...political chess game of his.""

But Codey, a former governor, told Hannity that Obama isn’t the first president to increase the federal debt limit.

""But Sean, every president has raised the debt ceiling,"" Codey said. ""George Bush did it seven times.""

PolitiFact New Jersey took a look at the nation’s history of borrowing money and discovered that Codey was mostly right. Since an overall limit on most federal debt was first set up in 1939, the debt ceiling went up during every presidency with the sole exception of former President Harry S. Truman’s.

Codey acknowledged the minor oversight in a phone interview and said his overall message was to show that previous presidents have contributed to the debt ceiling increases.

Now, let’s take a look at how we reached the current federal debt limit of nearly $14.3 trillion.

A statutory limit on federal borrowing was first established with the Second Liberty Bond Act of 1917, which helped finance the nation’s entry into World War I, according to the Congressional Research Service. That act allowed separate limits for different forms of debt.

In 1939, Congress eliminated those separate limits and set up the first aggregate limit covering nearly all public debt. During the presidency of Franklin D. Roosevelt, the debt ceiling was raised annually between 1941 and 1945 to pay for the costs associated with World War II. The limit was increased to $65 billion in 1941.

Soon after the debt limit was increased to $300 billion in April 1945, Truman became president. The debt ceiling was reduced to $275 billion in June 1946, and the Korean War was primarily financed by higher taxes, not increased debt.

The debt ceiling would not increase until 1954, when Dwight D. Eisenhower was president.

""It just went down and stayed down,"" said Bill Galston, a senior fellow in governance studies at the centrist-to-liberal Brookings Institution, referring to Truman’s presidency.

But from Eisenhower to former President George W. Bush, the debt ceiling was raised during every presidency for a total of 68 times*, according to data from the White House’s Office of Management and Budget. Obama has raised the debt limit three times.

Here’s a breakdown of debt ceiling increases before Obama by presidency:

￭ Dwight D. Eisenhower (R): 4
￭ John F. Kennedy (D): 5
￭ Lyndon B. Johnson (D): 7
￭ Richard M. Nixon (R): 7
￭ Gerald R. Ford (R): 6
￭ Jimmy Carter (D): 6
￭ Ronald Reagan (R): 17
￭ George H. W. Bush (R): 5
￭ Bill Clinton (D): 4
￭ George W. Bush (R): 7

When Eisenhower left office, the debt limit was $293 billion. After Bush left office -- following seven increases to the debt ceiling, as Codey had said -- the limit was about $11.3 trillion. Barring significant changes to federal regulations, the amount of debt is projected to rise in the coming decade, according to the Congressional Research Service.

""Unless federal policies change, Congress would repeatedly face demands to raise the debt limit to accommodate the growing federal debt in order to provide the government with the means to meet its financial obligations,"" according to a July 1 report from the Congressional Research Service.

Asked why the debt limit has continued to increase over the past several decades, D. Andrew Austin, one of the authors of that report, said in an email: ""Over time (the) federal government has spent more than it received in revenues. Unlike (the European Union’s) Stability and Growth Pact, the debt limit is a fixed number, rather than a restriction tied to the size of the national economy.""

Back to Codey’s statement:

The former governor said during a panel discussion that ""every president has raised the debt ceiling."" Federal records show that since the overall limit was set up in 1939, Truman is the only president who didn’t have an increase in the debt ceiling on his watch.

We rate Codey’s statement Mostly True. 
To comment on this ruling, go to NJ.com. 
*Editor's Note: The total of 68 times failed to include all cases where the debt limit was temporarily increased or the expiration dates for temporary increases were extended. Factoring in those other instances, the debt ceiling was increased 86 times between the presidencies of Eisenhower and George W. Bush. Here is the revised breakdown: Eisenhower, 7; Kennedy, 8; Johnson, 8; Nixon, 9; Ford, 7; Carter, 9; Reagan, 18; George H.W. Bush, 9;  Clinton, 4; and George W. Bush, 7.",/factchecks/2011/jul/21/richard-codey/new-jersey-sen-richard-codey-claims-every-presiden/
"['Rhode Island', 'Economy', 'Federal Budget', 'Stimulus', 'Ocean State Policy Research Institute']","
Watchdog group critical of stimulus spending publishes a report listing purported projects in Rhode Island
","When the Ocean State Policy Research Institute (OSPRI) published The 2011 Rhode Island Piglet Book last month -- ostensibly a report on government spending in our state -- we jumped at the opportunity to examine one of the ""300 pork projects, bungled boondoggles, bad ideas and examples of abuse of power"" the group targeted.

We found that the authors erred in saying that the state prisons used $250,000 in federal stimulus funds to convert from analog to digital TV. In fact, no stimulus money was used, so we ruled the claim False.

That first look got us wondering about the 50 other projects that the Piglet Book highlighted as having benefited from the American Recovery and Reinvestment Act of 2009, more commonly known as the stimulus program. Did they actually get funded?

What we found raises serious questions about the quality of the Research Institute’s research.

For example, the report indicates the state spent $20 million from the stimulus program on ""renovations for legislative office space"" at 2 Capitol Hill, the building across Smith Street from the State House.

But when we contacted Larry Berman, spokesman for the House of Representatives, he said, ""The General Assembly has not done any improvements to any lawmaker offices."" And Laurie Petrone, who oversees stimulus spending for state agencies as the director of  the state Office of Economic Recovery and Reinvestment, said no stimulus money was used to improve the building.

What about another project with a hefty price tag -- $30 million to ""install modern cyberinfrastructure"" at Brown University?

The university did not receive that grant, said Mark Nickel, director of news and communications at Brown.

How about the Town of Smithfield? Did it receive ""an overpriced overhaul courtesy of the American taxpayer... $4,565,000 in stimulus funds to revamp and add on to the hockey and ice skating facility?""

Randy Rossi, Smithfield’s finance director, did undertake some improvements at the hockey rink. But Rossi, who was aware of the Piglet Book claim, said the town received no stimulus funds for the work.

In fact, we found that many of the stimulus projects OSPRI lambasted were never funded:

* $700,000 to plant 1,600 trees in Providence? ""The city did not receive any stimulus funds,"" said spokesman David Ortiz.

* $640,000 for new facilities at Goddard State Park, Colt State Park and the George Washington Management Area? ""Didn’t get funded,"" said Petrone.

* $300,000 for parking lot improvements on Capitol Hill?  ""No ARRA funds for that,"" Petrone said.

* $3 million for improvements at Charlestown’s Cross Mills Village, $50,000 to take aerial photographs of the town and $45,000 to repair a sheep barn at the town’s South Farm Preserve?  ""We haven’t received any money at all,"" said Town Treasurer Patricia Anderson. For the work that the town did undertake (the photography, for example, was never done),  ""we used our own money.""

The problem, as we first found in our report on digital TV at the prisons, is that OSPRI relied on documents listing requests for stimulus money, not approvals. One document that OSPRI shared with us when we questioned the prison TV project was clearly titled in red type: ""submitted requests under review.""

Petrone said the state compiled stimulus requests even before federal agencies wrote guidelines for the  program.

""We published every project that anyone had suggested for stimulus money. It was like the wish list,"" she said.

Some wishes came true.

Among the projects the Piglet Book listed under ""stimulus shenanigans"" were two at the University of Rhode Island. Spokesman David Lavallee directed us to documents confirming that the National Science Foundation gave $446,247 to URI for a six-week cruise to study the marine environment in the Arctic Ocean and $42,994 for an archaeological expedition to Iceland to excavate textile remains and study the role of women in early Norse culture.

We won’t get into whether either was worthwhile. Our mission is to examine the accuracy of the Piglet Book’s stimulus claims, not to judge whether the money was well spent.

A project at Rhode Island College also received SOME stimulus funding, but far less than the Piglet Book claimed.

Under a section titled ""frittering funds for fun,"" the OSPRI report said RIC received $12 million to renovate its recreation center. But spokeswoman Jane Fusco said that only $1 million came from the stimulus program, part of a $9.9-million grant to RIC to be used exclusively for fire-safety upgrades.

We checked on 20 of the 50 projects listed in the report. In most cases, we tried to contact purported recipients, but we also visited recovery.org -- since renamed recovery.gov -- a federal repository of stimulus information and projects.

Of the 20,  we could verify only five that received stimulus money as described in the Piglet Book -- the two at URI and three highway projects overseen by the state Department of Transportation. The DOT jobs totaled $11 million and involved replacing some signs along the state’s major highways.

Of the remaining 15 we checked, 13 of the purported recipients said they received no stimulus money whatsoever.

That leaves two others. We already noted that RIC received a fraction of what OSPRI reported. In addition, Roger Williams University said it didn’t get the $8.2 million that OSPRI claimed it was awarded to expand its shellfish research center. The project cost about half that and was largely funded through other sources, said director Timothy Scott. A small amount of stimulus funds may have been used, but it’s possible none were, he said.

The final tally: the Piglet Book was wrong on 15 of the 20 projects we checked.

When we told OSPRI what we found, the organization acknowledged its error, but downplayed it.

""The primary purpose of our Piglet report is to highlight the culture of out-of-control government spending that inevitably leads to waste, special-interest peddling and cronyism . . . ,"" it said in a statement.

""While OSPRI recognizes that our report inadvertently did not properly distinguish between requested federal stimulus projects and completed projects, it does not lessen concern about the tax-and-spend mindset that encourages or would even consider some of these unconscionable requests . . . ""OSPRI plans to submit an official record request to some of the entities in question and will publish an updated listing of the status of these projects on our website once the information has been gathered.""

In applying the Truth-O-Meter, we took into consideration that OSPRI said it made a mistake.

But that’s not going to save their bacon here. OSPRI is clearly on a mission to ridicule government spending. You can’t miss the recurring inflammatory language in the report anymore than the message conveyed by its cover -- a cartoon of a large pig playing a violin and wearing a coat that says ""R.I. Gov’t"" as a background map of the state goes up in flames.

OSPRI wants its 37-page report, with 411 footnotes, to be taken seriously. Yet the section that we examined, stimulus funding -- a controversial program whose merits should be debated based on facts -- is egregiously flawed.

The group says it wants to highlight ""out of control government spending,"" but most of the stimulus spending it cites never happened.

Because OSPRI got so much so wrong, we’re thrusting a spit through the Piglet Book’s stimulus section and roasting it. This little piggy is going ""Wee! Wee! Wee!"" all the way to a Pants on Fire!

(Get updates from PolitiFactRI on Twitter. To comment or offer your ruling, visit us on our PolitiFact Rhode Island Facebook page.) (Update: This item was revised on May 8, 2014, to reflect the change in the name of the website for information about stimulus money and projects. The new URL is recovery.gov.)",/factchecks/2011/jul/21/ocean-state-policy-research-institute/watchdog-group-critical-stimulus-spending-publishe/
